104.,2013-10-26 19:23:16,123.81,96%,"Your face has fallen sad now, for you know the time is nigh....",Win (1 of 4)
103.,2013-10-26 19:22:40,111.42,93%,"Races are not won in the first corner; however, they are oft...",No win (2 of 4)
102.,2013-10-26 19:20:06,113.27,96%,Images of broken light which dance before me like a million ...,No win (2 of 5)
101.,2013-10-26 19:19:33,115.80,92%,"There are perhaps twenty regular posters on the forum, and s...",No win (2 of 3)
100.,2013-10-26 19:18:33,109.11,96%,"Whether you're a student, secretary, office administrator, m...",Win (1 of 2)
99.,2013-10-26 19:17:31,137.06,100%,"They say that right after God created man, he took a rib fro...",Win (1 of 5)
98.,2013-10-26 19:16:57,106.18,91%,Although the United Nations does not have the power to enfor...,Win (1 of 4)
97.,2013-10-26 19:16:13,111.82,98%,"But suddenly, I viddied that thinking was for the gloopy one...",Win (1 of 4)
96.,2013-10-26 19:15:28,116.56,99%,His soul swooned slowly as he heard the snow falling faintly...,Win (1 of 5)
95.,2013-10-26 19:15:02,103.42,93%,I sincerely believe that if women study male lessons on conc...,No win (2 of 2)
94.,2013-10-26 19:14:14,115.32,95%,"The creation ends in South Georgia, at the very edge of the ...",No win (2 of 3)
93.,2013-10-26 19:13:20,100.90,92%,She's got eyes of the bluest skies as if they thought of rai...,No win (3 of 3)
92.,2013-10-26 19:12:41,92.82,93%,"It was an effect of light: quick sunlight dappling, yellow l...",Win (1 of 2)
91.,2013-10-26 19:11:45,103.17,97%,"When we pulled out into the winter night and the real snow, ...",No win (2 of 3)
90.,2013-10-26 19:10:37,92.44,87%,If I'm curt with you it's because time is a factor. I think ...,No win (3 of 5)
89.,2013-10-26 19:09:54,99.11,95%,"An essential characteristic of the superhero mythology is, t...",Win (1 of 3)
88.,2013-10-26 19:08:51,126.99,97%,"Thirdly, however, these wars could now be waged with the new...",Win (1 of 2)
87.,2013-10-26 19:08:07,88.36,92%,"Disillusion is the greatest gift I can give you. But, becaus...",No win (3 of 3)
86.,2013-10-26 19:07:05,101.80,95%,"Run to the bedroom, in the suitcase on the left, you'll find...",Win (1 of 2)
85.,2013-10-26 19:06:00,85.88,91%,"It turned out that the sweet-talking, tattoo-sporting pikey ...",No win (2 of 5)
84.,2013-10-26 19:05:05,90.10,94%,"In the English language, swearing is essential to effective ...",No win (2 of 3)
83.,2013-10-26 19:04:24,102.86,88%,Don't make assumptions - find the courage to ask questions a...,No win (2 of 3)
82.,2013-10-26 18:42:59,108.16,98%,The recipe for turning fruit into wine goes something like t...,Win (1 of 2)
81.,2013-10-26 18:41:48,113.84,94%,"Thirdly, however, these wars could now be waged with the new...",Win (1 of 4)
80.,2013-10-26 18:40:55,100.41,96%,"Trudging slowly over wet sand, back to the bench where your ...",No win (4 of 4)
79.,2013-10-26 18:40:25,103.77,95%,"The world of typing has changed. In the 1970s, every busines...",Win (1 of 3)
78.,2013-10-26 18:39:33,117.69,99%,I don't believe in painted roses or bleeding hearts while bu...,Win (1 of 5)
77.,2013-10-26 18:38:55,122.35,98%,Once you get into the processed foods you have to be a fairl...,Win (1 of 5)
76.,2013-10-26 18:38:07,107.03,95%,"Hello, hello, hello, is there anybody in there? Just nod if ...",Win (1 of 3)
75.,2013-10-26 18:37:16,123.14,100%,All the blue light reflections that color my mind when I sle...,Win (1 of 4)
74.,2013-10-26 18:36:30,121.19,98%,"No matter how bad things are, you can always make things wor...",No win (2 of 3)
73.,2013-10-26 18:35:56,107.71,99%,Supermarket aisles are the perfect place to practice your gl...,No win (1 of 1)
72.,2013-10-26 18:35:03,85.62,93%,"So, I'm tending bar there at Ecklund & Swedlin's last Tu...",Win (1 of 4)
71.,2013-10-26 18:34:01,119.95,99%,I've been looking so long at these pictures of you that I al...,Win (1 of 5)
70.,2013-10-26 18:33:31,103.91,92%,"A computer needs a manager to administer its operations, jus...",No win (3 of 4)
69.,2013-10-26 18:32:53,94.49,94%,My entire life had been on a predictable trajectory dominate...,No win (2 of 3)
68.,2013-10-26 18:32:03,93.91,92%,"However, let us leave aside the philosophical, social, and e...",Win (1 of 2)
67.,2013-10-26 18:30:56,116.71,98%,"There are perhaps twenty regular posters on the forum, and s...",No win (2 of 3)
66.,2013-10-26 18:29:10,114.70,99%,"Whether you're a student, secretary, office administrator, m...",Win (1 of 3)
65.,2013-10-26 18:28:11,114.70,98%,At the time when Britain faced a plunge into chaos and darkn...,Win (1 of 3)
64.,2013-10-26 18:27:14,124.95,97%,"You have a class of young strong men and women, and they wan...",Win (1 of 3)
63.,2013-10-26 18:26:38,129.06,100%,Your inner child will be happy to know that when it comes to...,Win (1 of 4)
62.,2013-10-26 18:25:54,110.19,97%,"In general, many of these targets are easier marks if you ar...",Win (1 of 5)
61.,2013-10-26 18:24:29,100.83,99%,So I'm two inches away from her. Her luscious lips part. Jus...,No win (2 of 4)
60.,2013-10-26 18:23:54,112.76,95%,Come sail your ships around me and burn your bridges down. W...,Win (1 of 3)
59.,2013-10-26 18:23:01,100.09,96%,Do I really look like a guy with a plan? You know what I am?...,No win (2 of 5)
58.,2013-10-26 18:22:02,109.60,98%,Corn is what feeds the steer that becomes the steak. Corn fe...,No win (2 of 4)
57.,2013-10-26 18:19:59,104.33,94%,The truth of the matter is that there are a lot of available...,No win (3 of 5)
56.,2013-10-26 18:19:12,100.37,98%,Glancing through the 1977 Atlanta Yellow Pages reveals a cit...,Win (1 of 2)
55.,2013-10-26 18:16:52,100.07,92%,Once you get into the processed foods you have to be a fairl...,Win (1 of 3)
54.,2013-10-26 18:16:00,129.78,97%,"One day you're in a funk about things, telling a friend that...",No win (2 of 5)
53.,2013-10-26 18:15:16,102.74,89%,The odds are that you will generally meet the worst of them....,No win (3 of 3)
52.,2013-10-26 18:11:38,87.51,96%,"As the netted bag says, this potato was grown in Idaho, that...",Win (1 of 5)
51.,2013-10-26 17:57:40,141.03,100%,"The terminator wouldn't stop, it would never leave him. It w...",Win (1 of 5)
50.,2013-10-26 17:56:51,95.30,95%,Lucid but wholly false recollections can easily be induced b...,No win (3 of 5)
49.,2013-10-26 17:56:07,116.06,99%,In order to become an elf I filled out ten pages' worth of f...,No win (3 of 3)
48.,2013-10-26 17:55:21,113.29,94%,You have to wonder: how do the machines know what Tasty Whea...,Win (1 of 5)
47.,2013-10-26 17:53:51,96.47,96%,I had a friend who was a heavy drinker. If somebody asked hi...,No win (2 of 4)
46.,2013-10-26 17:53:09,100.62,95%,"I'd been walking for hours and, as usual, I'd lost track of ...",No win (4 of 5)
45.,2013-10-26 17:52:09,112.73,94%,The invention of the wheel represented a major turning point...,Win (1 of 4)
44.,2013-10-26 17:51:17,97.13,91%,I suddenly had the impression that I had been left all alone...,No win (2 of 4)
43.,2013-10-26 17:50:28,126.54,99%,"They say that right after God created man, he took a rib fro...",Win (1 of 2)
42.,2013-10-26 17:49:42,137.32,100%,Good games offer players a set of challenging problems and t...,Win (1 of 5)
41.,2013-10-26 17:48:53,114.03,98%,"The term ""barbarian"" was created by the Greeks; it was origi...",Win (1 of 2)
40.,2013-10-26 17:47:48,104.58,99%,"Air-conditioned, odorless, illuminated by buzzing fluorescen...",Win (1 of 3)
39.,2013-10-26 17:47:11,94.27,92%,"She was a genius of sadness, immersing herself in it, separa...",No win (2 of 3)
38.,2013-10-26 17:46:08,105.81,95%,"No man is an island, entire of itself; every man is a piece ...",Win (1 of 5)
37.,2013-10-26 17:44:35,115.93,98%,"He's got a two day head start on you, which is more than he ...",Win (1 of 4)
36.,2013-10-26 17:43:49,103.77,93%,From compositional considerations the tomato layer would be ...,Win (1 of 2)
35.,2013-10-26 17:43:10,101.83,94%,"This was the most delicious meal he'd had in recent years, a...",Win (1 of 4)
34.,2013-10-26 17:42:07,86.07,93%,"Wilkinson County was a recipient of one of the new ""separate...",No win (3 of 3)
33.,2013-10-26 17:41:12,108.52,96%,You have to wonder: how do the machines know what Tasty Whea...,Win (1 of 4)
32.,2013-10-26 17:40:13,102.14,95%,"The time I waited seemed endless, and I felt doubts and fear...",No win (2 of 3)
31.,2013-10-26 17:39:37,94.64,92%,"There was me, that is Alex, and my three droogs, that is Pet...",No win (4 of 4)
30.,2013-10-26 17:38:59,109.25,96%,The invention of the wheel represented a major turning point...,Win (1 of 3)
29.,2013-10-26 17:38:15,107.51,96%,"My name is Turkish. Funny name for an Englishman, I know. My...",No win (2 of 5)
28.,2013-10-26 17:37:23,95.99,90%,The unknown future rolls toward us. I face it for the first ...,No win (4 of 5)
27.,2013-10-26 17:36:50,103.22,97%,"Keying text quickly is important, but it is more important t...",No win (2 of 5)
26.,2013-10-26 17:35:09,106.26,92%,Too often writers believe that they can emphasize words by p...,No win (3 of 5)
25.,2013-10-26 17:32:31,105.10,94%,Most popular song lyrics have two sections - a verse and a b...,Win (1 of 4)
24.,2013-10-26 16:45:25,113.76,97%,We go waiting for the stars to come showering down. From Mos...,Win (1 of 4)
23.,2013-10-26 16:44:33,91.21,93%,"Today, computers have taken this ancient art out of the craf...",Win (1 of 2)
22.,2013-10-26 16:43:30,92.98,94%,"My darling, you have to be standing up in order to be able t...",No win (2 of 4)
21.,2013-10-26 16:42:45,103.71,98%,"An essential characteristic of the superhero mythology is, t...",No win (2 of 3)
20.,2013-10-26 16:40:57,124.66,97%,I never said I would stay to the end - I knew I would leave ...,No win (3 of 4)
19.,2013-10-26 16:39:40,108.10,95%,"Races are not won in the first corner; however, they are oft...",Win (1 of 4)
18.,2013-10-26 16:38:46,95.23,94%,It takes more than a calorie of fossil fuel energy to produc...,No win (2 of 4)
17.,2013-10-26 16:37:38,107.79,98%,"It's a sunny, woodsy day in Lumberton, so get those chainsaw...",Win (1 of 3)
16.,2013-10-26 16:36:55,112.98,97%,"Life is not suffering; it's just that you will suffer it, ra...",Win (1 of 5)
15.,2013-10-26 16:36:20,103.46,96%,"Hi, and welcome to the future. San Dimas, California, 2688. ...",Win (1 of 3)
14.,2013-10-26 16:34:14,102.51,93%,Do you know what they call a Quarter-pounder with cheese in ...,No win (2 of 3)
13.,2013-10-26 16:33:41,96.69,94%,I have quit three jobs and been fired from all the rest. Get...,Win (1 of 3)
12.,2013-10-26 16:32:29,108.25,95%,"The goal of the true seeker is to become a sage, or superior...",No win (2 of 3)
11.,2013-10-26 16:31:28,118.75,95%,The place to improve the world is first in one's own heart a...,No win (3 of 5)
10.,2013-10-26 16:30:32,104.83,97%,"Trudging slowly over wet sand, back to the bench where your ...",No win (2 of 4)
9.,2013-10-26 16:29:51,106.47,96%,Even the best-designed chair won't make up for bad posture. ...,Win (1 of 5)
8.,2013-10-26 16:29:01,94.42,92%,Paper as we know it today was invented in China in around 10...,No win (1 of 1)
7.,2013-10-26 16:27:54,105.02,91%,"If you don't get what you want, you suffer; if you get what ...",No win (2 of 3)
6.,2013-10-26 16:26:49,109.85,94%,"The world of typing has changed. In the 1970s, every busines...",Win (1 of 2)
5.,2013-10-26 16:25:25,119.37,99%,I don't believe in painted roses or bleeding hearts while bu...,No win (2 of 4)
4.,2013-10-26 16:24:26,102.79,96%,"In May 1980, Fidel Castro opened the harbor at Mariel, Cuba ...",No win (1 of 1)
3.,2013-10-26 16:22:29,106.71,97%,At first they had tried to keep the finding quiet. After all...,Win (1 of 2)
2.,2013-10-26 16:21:16,97.18,93%,"In the late 1960s, a growing number of people became concern...",Win (1 of 2)
1.,2013-10-26 16:19:54,94.29,93%,Some have a positive vocation for breaking open safes: from ...,Win (1 of 2)
