329.,2013-10-30 12:01:41,117.62,93%,"Every craft and every investigation, and likewise every acti...",No win (2 of 3)
328.,2013-10-30 11:59:32,120.25,96%,I think you're gonna find - when all this stuff is over and ...,Win (1 of 3)
327.,2013-10-30 11:57:43,120.96,99%,"They had been given a sign - a powerful, lucid sign - that u...",No win (2 of 3)
326.,2013-10-30 11:56:37,117.13,96%,The theory of music emphasizes the elements from which music...,Win (1 of 3)
325.,2013-10-30 11:54:33,131.17,99%,Music finds a comfortable parallel with that of human langua...,Win (1 of 3)
324.,2013-10-30 11:52:37,121.17,100%,"I've heard there was a secret chord that David played, and i...",Win (1 of 3)
323.,2013-10-30 11:51:33,114.20,96%,"To evaluate an option from the other side's point of view, c...",Win (1 of 2)
322.,2013-10-30 11:50:46,127.21,98%,"After removal from the oven, the pizza is sliced and plated ...",No win (2 of 3)
321.,2013-10-30 11:49:54,115.51,94%,"I had a job, I had a girl. I had something going, mister, in...",Win (1 of 3)
320.,2013-10-30 11:49:00,123.40,98%,Danger is a topic you're often asked about as a sprinter. Th...,No win (3 of 3)
319.,2013-10-30 11:47:52,133.73,99%,"The world of typing has changed. In the 1970s, every busines...",Win (1 of 3)
318.,2013-10-30 11:45:38,116.77,95%,"Burning my bridges and smashing my mirrors, turning to see i...",Win (1 of 5)
317.,2013-10-30 11:44:09,113.25,98%,Who is Keyser Soze? He is supposed to be Turkish. Some say h...,No win (2 of 2)
316.,2013-10-30 11:43:08,128.55,98%,"Don't practice too much at first, or you're likely to develo...",Win (1 of 3)
315.,2013-10-30 11:41:35,124.51,97%,There is something about yourself that you don't know. Somet...,No win (2 of 4)
314.,2013-10-30 11:40:48,109.79,96%,I sincerely believe that if women study male lessons on conc...,No win (2 of 5)
313.,2013-10-30 11:40:01,132.28,96%,"Ticking away the moments that make up a dull day, you fritte...",No win (2 of 5)
312.,2013-10-30 11:39:28,123.17,97%,"You have a class of young strong men and women, and they wan...",Win (1 of 5)
311.,2013-10-30 11:38:51,123.78,96%,"If we all go for the blonde and block each other, not a sing...",No win (2 of 4)
310.,2013-10-30 11:38:09,120.17,98%,"He's got a two day head start on you, which is more than he ...",Win (1 of 3)
309.,2013-10-30 11:36:25,130.66,98%,I sincerely believe that if women study male lessons on conc...,Win (1 of 4)
308.,2013-10-30 11:35:43,128.61,100%,Do you know what they call a Quarter-pounder with cheese in ...,Win (1 of 2)
307.,2013-10-30 11:35:14,106.15,93%,Mac knew the score even if Aunt Ella didn't. Shot through th...,Win (1 of 4)
306.,2013-10-30 11:34:24,131.36,97%,"We turn away to face the cold, enduring chill, as the day be...",Win (1 of 3)
305.,2013-10-30 11:33:45,126.23,98%,"That fear had been inside him for many years, it had lived w...",Win (1 of 3)
304.,2013-10-30 11:32:58,140.36,100%,A glooming peace this morning with it brings. The sun for so...,Win (1 of 3)
303.,2013-10-30 11:31:18,118.93,98%,"The Orient was almost a European invention, and had been sin...",Win (1 of 4)
302.,2013-10-30 11:30:47,115.53,98%,Who has a safety deposit box full of money and six passports...,Win (1 of 5)
301.,2013-10-30 11:30:16,113.56,97%,Aztec rule was based upon a system of tribute and fear over ...,Win (1 of 3)
300.,2013-10-30 11:29:22,108.13,96%,Three changes occur while the stacked disk structure equilib...,Win (1 of 3)
299.,2013-10-30 11:28:18,124.28,97%,"I rejected those answers; instead, I chose something differe...",No win (2 of 2)
298.,2013-10-30 11:27:31,103.90,96%,Many wines have more than 14 percent alcohol because the win...,Win (1 of 5)
297.,2013-10-30 11:26:35,126.57,95%,She's got eyes of the bluest skies as if they thought of rai...,Win (1 of 3)
296.,2013-10-30 11:25:13,104.43,95%,"Excellent. He's enterprising, aggressive, outgoing, young, b...",Win (1 of 2)
295.,2013-10-30 11:12:30,99.68,94%,Glancing through the 1977 Atlanta Yellow Pages reveals a cit...,Win (1 of 2)
294.,2013-10-30 11:11:47,116.28,99%,"Well, it just so happens, this hacienda comes with its very ...",Win (1 of 5)
293.,2013-10-30 11:11:12,116.17,99%,"It turned out that the sweet-talking, tattoo-sporting pikey ...",Win (1 of 2)
292.,2013-10-30 11:07:22,124.44,96%,"A zealot might be, for instance, an individual with a person...",Win (1 of 3)
291.,2013-10-30 11:06:29,126.68,99%,It was hard to toss things I had once thought were valuable ...,Win (1 of 3)
290.,2013-10-30 11:05:35,132.63,100%,Don't make assumptions - find the courage to ask questions a...,Win (1 of 2)
289.,2013-10-30 11:04:58,122.42,98%,Having endured the racial turmoil of the Civil Rights Moveme...,Win (1 of 4)
288.,2013-10-30 11:03:06,111.51,91%,"Thirdly, however, these wars could now be waged with the new...",No win (2 of 3)
287.,2013-10-30 11:00:39,132.21,98%,I remember when we used to sit in the government yard in Tre...,Win (1 of 2)
286.,2013-10-30 10:59:55,127.18,99%,Some have a positive vocation for breaking open safes: from ...,Win (1 of 3)
285.,2013-10-30 10:59:12,120.04,95%,"To evaluate an option from the other side's point of view, c...",No win (2 of 3)
284.,2013-10-30 10:58:28,123.99,97%,Step out the front door like a ghost into the fog where no o...,Win (1 of 4)
283.,2013-10-30 10:57:45,115.65,90%,"One day you're in a funk about things, telling a friend that...",No win (2 of 4)
282.,2013-10-30 10:56:56,110.78,98%,"There was me, that is Alex, and my three droogs, that is Pet...",Win (1 of 3)
281.,2013-10-30 10:55:09,112.44,94%,Is it sweeter to exist only in the mind or to exist both in ...,Win (1 of 4)
280.,2013-10-29 23:15:16,121.55,99%,"It was a marvelous night, the sort of night one only experie...",Win (1 of 4)
279.,2013-10-29 23:12:42,132.04,99%,Step out the front door like a ghost into the fog where no o...,Win (1 of 4)
278.,2013-10-29 23:11:36,123.09,99%,Don't take anything personally - nothing others do is becaus...,Win (1 of 3)
277.,2013-10-29 23:10:56,122.65,98%,Imagine for a moment if we once again knew these few unremar...,Win (1 of 2)
276.,2013-10-29 22:22:50,130.74,100%,"I don't want tickets, I need you to find me a painting, a cl...",No win (3 of 5)
275.,2013-10-29 22:22:14,114.69,94%,The problem we now face is that this thin layer of atmospher...,Win (1 of 4)
274.,2013-10-29 22:20:58,113.09,94%,"And you know it's time to go, through the sleet and driving ...",No win (2 of 2)
273.,2013-10-29 22:19:36,119.57,95%,"Hi, and welcome to the future. San Dimas, California, 2688. ...",No win (2 of 4)
272.,2013-10-29 22:18:23,115.37,99%,"Ergonomics is a term that combines the Greek word ergon, mea...",Win (1 of 4)
271.,2013-10-29 22:17:03,111.59,94%,Typing competitions provided another test of the Qwerty keyb...,Win (1 of 3)
270.,2013-10-29 22:16:18,111.30,94%,Quality humor doesn't just deliver one gag and then tax the ...,No win (2 of 4)
269.,2013-10-29 17:58:03,117.61,99%,"If I leave here tomorrow, would you still remember me? For I...",Win (1 of 5)
268.,2013-10-29 17:49:08,116.07,98%,I've been thinking lots about my life and how quick I'd wash...,No win (3 of 4)
267.,2013-10-29 17:48:32,126.98,99%,I remember when we used to sit in the government yard in Tre...,Win (1 of 5)
266.,2013-10-29 17:46:36,127.04,100%,It's the possibility of having a dream come true that makes ...,No win (2 of 2)
265.,2013-10-29 17:45:59,121.28,96%,Always do your best - your best is going to change from mome...,No win (2 of 5)
264.,2013-10-29 17:44:45,132.50,99%,"When you are typing on a typewriter, your input appears dire...",Win (1 of 3)
263.,2013-10-29 17:43:40,131.42,98%,Your inner child will be happy to know that when it comes to...,No win (2 of 5)
262.,2013-10-29 17:43:02,131.58,99%,"The problem is, Willie, is that Charles and yourself are not...",No win (2 of 5)
261.,2013-10-29 17:40:46,140.35,97%,"This planet has, or rather had, a problem, which was this: m...",Win (1 of 4)
260.,2013-10-29 17:40:02,108.29,96%,"I know a bloke who knows a bloke who knows a bloke. Now, I k...",No win (2 of 4)
259.,2013-10-29 17:37:45,139.78,96%,"One day you're in a funk about things, telling a friend that...",No win (2 of 4)
258.,2013-10-29 17:36:27,124.73,98%,Don't make assumptions - find the courage to ask questions a...,No win (4 of 4)
257.,2013-10-29 17:35:23,126.75,98%,"I had a dream. There was our world, and the world was dark b...",No win (3 of 4)
256.,2013-10-29 16:27:19,125.72,99%,"That fear had been inside him for many years, it had lived w...",Win (1 of 4)
255.,2013-10-29 15:12:22,123.21,98%,"I'm so glad you came, I'm so glad you remembered, to see how...",Win (1 of 5)
254.,2013-10-29 14:59:41,119.99,96%,"Never give up, no matter how far behind you are, no matter h...",Win (1 of 2)
253.,2013-10-29 14:56:47,118.78,95%,Remembering you running soft through the night. You were big...,Win (1 of 5)
252.,2013-10-29 14:54:33,123.47,96%,The odds are that you will generally meet the worst of them....,No win (2 of 5)
251.,2013-10-29 14:53:54,110.81,97%,"We turn away to face the cold, enduring chill, as the day be...",Win (1 of 4)
250.,2013-10-29 14:52:32,131.08,100%,"Warmer water increases the moisture content of storms, and w...",Win (1 of 2)
249.,2013-10-29 14:50:36,114.40,89%,The most precious treasures we have in life are the images w...,Win (1 of 5)
248.,2013-10-29 14:48:03,135.97,100%,Sometimes you concentrate more on racing the cars around you...,Win (1 of 3)
247.,2013-10-29 11:05:10,141.89,100%,Although his voice was also broken by uncertainty and his ha...,Win (1 of 5)
246.,2013-10-29 11:04:43,107.03,91%,The time has come for man to set himself a goal. The time ha...,No win (2 of 3)
245.,2013-10-29 11:03:38,114.51,93%,"They say that right after God created man, he took a rib fro...",Win (1 of 2)
244.,2013-10-28 21:15:05,107.93,96%,And I will strike down upon thee with great vengeance and fu...,No win (2 of 4)
243.,2013-10-28 20:54:51,116.59,95%,What should have been swift revenge turned into an all out w...,Win (1 of 3)
242.,2013-10-28 18:31:47,128.36,100%,Music finds a comfortable parallel with that of human langua...,No win (2 of 3)
241.,2013-10-28 18:29:36,115.48,96%,I thought climbing the Devil's Thumb would fix all that was ...,No win (2 of 4)
240.,2013-10-28 18:23:01,116.01,95%,"This was the most delicious meal he'd had in recent years, a...",Win (1 of 3)
239.,2013-10-28 18:21:43,111.38,97%,"The problem is, Willie, is that Charles and yourself are not...",No win (2 of 4)
238.,2013-10-28 18:21:18,113.88,93%,"Warmer water increases the moisture content of storms, and w...",Win (1 of 2)
237.,2013-10-28 18:18:18,126.37,98%,I think you're gonna find - when all this stuff is over and ...,Win (1 of 5)
236.,2013-10-28 12:07:09,112.16,93%,"Never give up, no matter how far behind you are, no matter h...",Win (1 of 3)
235.,2013-10-28 12:06:09,117.88,93%,"You have a class of young strong men and women, and they wan...",Win (1 of 3)
234.,2013-10-28 12:05:29,125.14,99%,Everything we hold dear likewise resolves into its original ...,Win (1 of 4)
233.,2013-10-28 12:03:53,137.49,100%,"When I really worry about something, I don't just fool aroun...",Win (1 of 5)
232.,2013-10-28 12:02:29,111.95,98%,The only preventive thing I do is wash clothes after buying ...,Win (1 of 5)
231.,2013-10-28 12:01:32,112.55,97%,The truth of the matter is that there are a lot of available...,Win (1 of 4)
230.,2013-10-28 11:59:01,90.92,93%,"Under the headline ""Wonderful Typing,"" the New York Times re...",Win (1 of 3)
229.,2013-10-28 09:51:23,123.88,98%,But the two men were not lonely at all. At home they were co...,No win (2 of 3)
228.,2013-10-28 00:09:45,114.42,96%,The theory of music emphasizes the elements from which music...,No win (2 of 2)
227.,2013-10-28 00:08:48,140.09,100%,Stab a sorry heart with your favorite finger. Paint the whol...,Win (1 of 4)
226.,2013-10-28 00:08:01,119.99,95%,"Contrary to the feminist cant, there are many things we can ...",No win (2 of 4)
225.,2013-10-28 00:07:13,112.08,93%,Focus your attention on the Now and tell me what problem you...,No win (2 of 2)
224.,2013-10-28 00:06:32,107.52,94%,Do you know what they call a Quarter-pounder with cheese in ...,Win (1 of 3)
223.,2013-10-28 00:04:12,119.38,96%,"To evaluate an option from the other side's point of view, c...",No win (2 of 2)
222.,2013-10-28 00:03:32,120.32,96%,I'd just like to point out that you were given every opportu...,Win (1 of 2)
221.,2013-10-28 00:02:06,120.03,98%,"Everyone said I was daft to build a castle on a swamp, but I...",Win (1 of 3)
220.,2013-10-28 00:01:11,109.57,96%,All the blue light reflections that color my mind when I sle...,No win (1 of 1)
219.,2013-10-28 00:00:29,116.60,93%,You have to wonder: how do the machines know what Tasty Whea...,Win (1 of 3)
218.,2013-10-27 23:59:32,105.86,95%,The wine list looks so imposing that you finally give up lab...,Win (1 of 2)
217.,2013-10-27 23:55:50,120.58,94%,Be impeccable with your word - speak with integrity. Say onl...,Win (1 of 5)
216.,2013-10-27 23:55:20,105.83,96%,But speculations on the structure of the universe also move ...,Win (1 of 2)
215.,2013-10-27 23:54:33,103.61,91%,"And you know it's time to go, through the sleet and driving ...",No win (2 of 4)
214.,2013-10-27 23:52:55,111.24,97%,"People get ready, there's a train coming. You don't need no ...",Win (1 of 3)
213.,2013-10-27 23:51:09,111.66,88%,"For centuries, the battle of morality was fought between tho...",No win (2 of 3)
212.,2013-10-27 23:50:30,116.57,93%,"Ever since I was a child, folks have thought they had me peg...",Win (1 of 2)
211.,2013-10-27 23:50:03,122.07,98%,Supermarket aisles are the perfect place to practice your gl...,No win (2 of 2)
210.,2013-10-27 23:48:35,121.20,95%,Humans need to practice what they are learning a good deal b...,Win (1 of 3)
209.,2013-10-27 23:47:55,108.01,96%,"Finally, gentlemen, there are people with an hereditary anim...",Win (1 of 3)
208.,2013-10-27 23:46:50,94.99,90%,"It turned out that the sweet-talking, tattoo-sporting pikey ...",No win (2 of 4)
207.,2013-10-27 23:45:59,111.11,96%,Instead of hiring workers during the peak hog kill in the wi...,Win (1 of 3)
206.,2013-10-27 23:45:08,108.20,95%,What? A swallow carrying a coconut? It's not a question of w...,Win (1 of 2)
205.,2013-10-27 23:44:21,124.36,99%,"The boy has not a real choice, has he? Self-interest, the fe...",Win (1 of 2)
204.,2013-10-27 23:43:41,109.65,99%,"O clear intelligence, force beyond all measure! Gentlemen, I...",No win (2 of 4)
203.,2013-10-27 23:43:11,114.70,96%,How many roads must a man walk down before you call him a ma...,No win (3 of 3)
202.,2013-10-27 23:41:28,128.39,97%,The ultimate way to compose is to be able to keyboard as fas...,No win (2 of 3)
201.,2013-10-27 23:39:05,112.64,97%,"A zealot might be, for instance, an individual with a person...",Win (1 of 5)
200.,2013-10-27 18:50:33,124.68,99%,"Comfortable, Mullet? It seems sadly ironic that it's that ti...",Win (1 of 4)
199.,2013-10-27 18:50:03,98.63,93%,"And though my journeys did take me to a great many states, a...",Win (1 of 3)
198.,2013-10-27 18:49:13,108.24,96%,"Finally, gentlemen, there are people with an hereditary anim...",Win (1 of 4)
197.,2013-10-27 18:47:56,107.17,95%,Is it sweeter to exist only in the mind or to exist both in ...,No win (3 of 5)
196.,2013-10-27 18:47:13,116.38,98%,But if in efficient causes it is possible to go on to infini...,Win (1 of 2)
195.,2013-10-27 18:46:27,110.22,98%,"Whether you're a student, secretary, office administrator, m...",Win (1 of 4)
194.,2013-10-27 18:45:48,109.60,95%,One thing I've learned in the last seven years: in every gam...,Win (1 of 5)
193.,2013-10-27 18:45:12,109.83,98%,"That's Tommy. He tells people he was named after a gun, but ...",No win (3 of 4)
192.,2013-10-27 18:44:43,117.80,98%,Jay made up for the lack of glamour in his assignment by hav...,Win (1 of 5)
191.,2013-10-27 18:43:16,115.03,93%,Imagine for a moment if we once again knew these few unremar...,Win (1 of 3)
190.,2013-10-27 18:42:14,98.66,91%,He canceled all his commitments and pulled together the most...,Win (1 of 3)
189.,2013-10-27 18:41:21,112.86,93%,"That fear had been inside him for many years, it had lived w...",Win (1 of 4)
188.,2013-10-27 18:40:28,112.62,95%,I never said I would stay to the end - I knew I would leave ...,No win (3 of 5)
187.,2013-10-27 18:39:40,113.97,96%,"When we pulled out into the winter night and the real snow, ...",Win (1 of 5)
186.,2013-10-27 18:38:34,116.17,99%,"I was shaking like a leaf, so without thinking I lit up a ci...",Win (1 of 2)
185.,2013-10-27 18:37:41,109.28,93%,I sincerely believe that if women study male lessons on conc...,No win (2 of 2)
184.,2013-10-27 18:36:55,114.67,93%,I'm telling it like it is. Get used to it or put this book d...,Win (1 of 4)
183.,2013-10-27 18:36:00,100.32,95%,"It's a blue savanna song: somewhere cross the desert, someti...",Win (1 of 4)
182.,2013-10-27 18:35:26,101.93,96%,"Imagine considering ""if"" as a two-finger movement instead of...",Win (1 of 4)
181.,2013-10-27 18:34:32,115.98,93%,"Ticking away the moments that make up a dull day, you fritte...",No win (2 of 4)
180.,2013-10-27 18:33:30,99.10,94%,"You needn't take it any further, sir. You've proved to me th...",Win (1 of 4)
179.,2013-10-27 18:32:46,106.36,97%,"Whenever you watch the mind, you withdraw consciousness from...",Win (1 of 3)
178.,2013-10-27 18:31:45,135.32,99%,"Your face has fallen sad now, for you know the time is nigh....",Win (1 of 2)
177.,2013-10-27 18:29:24,119.32,96%,I sincerely believe that if women study male lessons on conc...,Win (1 of 2)
176.,2013-10-27 18:28:41,94.44,93%,Music finds a comfortable parallel with that of human langua...,No win (2 of 2)
175.,2013-10-27 18:28:04,103.41,90%,"I can feel the heat closing in, feel them out there making t...",Win (1 of 4)
174.,2013-10-27 18:27:18,102.94,93%,"The melted mozzarella layer, which we shall designate MML, i...",Win (1 of 3)
173.,2013-10-27 18:26:41,116.37,95%,It was one of those days when it's a minute away from snowin...,Win (1 of 3)
172.,2013-10-27 18:24:42,114.26,92%,For it is not enough to have a good mind; the main thing is ...,No win (2 of 3)
171.,2013-10-27 18:23:49,119.76,90%,"She's got a smile that, it seems to me, reminds me of childh...",No win (2 of 5)
170.,2013-10-27 18:23:05,127.64,97%,I'm telling it like it is. Get used to it or put this book d...,Win (1 of 4)
169.,2013-10-27 18:22:16,133.89,98%,A glooming peace this morning with it brings. The sun for so...,Win (1 of 2)
168.,2013-10-27 18:21:37,102.78,89%,Paper as we know it today was invented in China in around 10...,No win (2 of 2)
167.,2013-10-27 18:20:47,105.34,90%,"The creation ends in South Georgia, at the very edge of the ...",Win (1 of 5)
166.,2013-10-27 18:19:47,100.98,95%,"The day dawned bleak and chill, a moving wall of gray light ...",No win (3 of 4)
165.,2013-10-27 18:18:49,105.00,88%,"That's Tommy. He tells people he was named after a gun, but ...",No win (3 of 3)
164.,2013-10-27 18:18:22,110.97,95%,I am learning about twenty new Italian words a day. Where am...,No win (3 of 4)
163.,2013-10-27 18:17:45,112.64,94%,Corn is what feeds the steer that becomes the steak. Corn fe...,Win (1 of 3)
162.,2013-10-27 18:16:33,138.21,100%,"I'm so glad you came, I'm so glad you remembered, to see how...",Win (1 of 3)
161.,2013-10-27 18:15:55,101.66,95%,Danger is a topic you're often asked about as a sprinter. Th...,No win (3 of 4)
160.,2013-10-27 18:14:45,97.97,90%,What should have been swift revenge turned into an all out w...,Win (1 of 2)
159.,2013-10-27 18:13:38,128.55,100%,"The less you do with the controls, the less chance of error....",No win (2 of 4)
158.,2013-10-27 18:05:50,107.88,92%,"This planet has, or rather had, a problem, which was this: m...",Win (1 of 2)
157.,2013-10-27 18:04:53,100.62,91%,"Hello, hello, hello, is there anybody in there? Just nod if ...",No win (3 of 3)
156.,2013-10-27 18:03:52,126.22,100%,Music finds a comfortable parallel with that of human langua...,Win (1 of 2)
155.,2013-10-27 18:03:21,97.08,96%,I still see things that are not here. I just choose not to a...,No win (2 of 4)
154.,2013-10-27 18:02:46,107.79,94%,"Common knowledge has bicyclists always riding into the wind,...",Win (1 of 2)
153.,2013-10-27 17:55:35,128.60,97%,The alternative to binge travel - the mini retirement - enta...,Win (1 of 3)
152.,2013-10-27 17:53:52,113.03,98%,"The melted mozzarella layer, which we shall designate MML, i...",Win (1 of 2)
151.,2013-10-27 17:53:14,114.48,94%,"You found paradise in America. You had a good trade, made a ...",Win (1 of 3)
150.,2013-10-27 17:52:24,106.30,98%,"Ergonomics is a term that combines the Greek word ergon, mea...",Win (1 of 3)
149.,2013-10-27 17:51:52,112.79,95%,If there is one thing the history of evolution has taught us...,Win (1 of 5)
148.,2013-10-27 17:51:20,102.78,90%,"The goal of the true seeker is to become a sage, or superior...",Win (1 of 4)
147.,2013-10-27 17:50:28,110.50,95%,We began to recognize in them a strange obsession. After all...,No win (2 of 5)
146.,2013-10-27 17:49:40,111.31,95%,If there is one thing the history of evolution has taught us...,No win (2 of 5)
145.,2013-10-27 17:49:07,111.52,90%,"If you are given too many choices, if you are forced to cons...",No win (2 of 3)
144.,2013-10-27 17:47:35,90.19,85%,"Kid, I've flown from one side of this galaxy to the other, a...",No win (2 of 2)
143.,2013-10-27 17:46:42,117.70,94%,"I had a dream. There was our world, and the world was dark b...",Win (1 of 3)
142.,2013-10-27 17:45:46,131.74,100%,"Kid, I've flown from one side of this galaxy to the other, a...",Win (1 of 5)
141.,2013-10-27 17:45:06,110.40,89%,"Contrary to the feminist cant, there are many things we can ...",Win (1 of 3)
140.,2013-10-27 17:44:28,117.70,98%,"Good games stay within, but at the outer edge, of the player...",Win (1 of 5)
139.,2013-10-27 17:43:55,109.71,94%,Stab a sorry heart with your favorite finger. Paint the whol...,Win (1 of 2)
138.,2013-10-27 17:43:11,104.58,97%,Space is big. Really big. You just won't believe how vastly ...,No win (2 of 2)
137.,2013-10-27 17:42:11,98.06,93%,"Imagine this: Here we are, a plane full of grown human being...",Win (1 of 5)
136.,2013-10-27 17:40:30,129.62,99%,"Life is not suffering; it's just that you will suffer it, ra...",Win (1 of 3)
135.,2013-10-27 17:39:59,93.71,96%,"But suddenly, I viddied that thinking was for the gloopy one...",No win (3 of 3)
134.,2013-10-27 17:39:12,100.63,91%,"Thirdly, however, these wars could now be waged with the new...",Win (1 of 4)
133.,2013-10-27 17:38:22,118.25,95%,Sometimes you concentrate more on racing the cars around you...,Win (1 of 4)
132.,2013-10-27 17:37:23,111.84,90%,"Your face has fallen sad now, for you know the time is nigh....",Win (1 of 5)
131.,2013-10-27 17:36:41,125.96,100%,All the blue light reflections that color my mind when I sle...,Win (1 of 4)
130.,2013-10-27 17:35:50,96.84,85%,"What good's a reward if you ain't around to use it? Besides,...",No win (2 of 4)
129.,2013-10-27 17:35:17,118.92,98%,"A zealot might be, for instance, an individual with a person...",Win (1 of 2)
128.,2013-10-27 17:34:22,127.11,99%,Always do your best - your best is going to change from mome...,Win (1 of 2)
127.,2013-10-26 19:45:43,106.94,93%,"Warmer water increases the moisture content of storms, and w...",Win (1 of 3)
126.,2013-10-26 19:44:54,94.69,97%,The recipe for turning fruit into wine goes something like t...,Win (1 of 5)
125.,2013-10-26 19:43:47,104.30,94%,We often believe the more we practice a skill or technique -...,Win (1 of 3)
124.,2013-10-26 19:42:37,116.38,98%,All that year the animals worked like slaves. But they were ...,Win (1 of 2)
123.,2013-10-26 19:41:46,87.39,94%,"Wilkinson County was a recipient of one of the new ""separate...",No win (2 of 4)
122.,2013-10-26 19:40:56,110.21,96%,"They say that right after God created man, he took a rib fro...",Win (1 of 4)
121.,2013-10-26 19:40:22,115.21,97%,"Many people limit themselves to leading boring, dull lives b...",Win (1 of 2)
120.,2013-10-26 19:39:28,98.25,96%,"When I was a kid, you never saw radicchio in the produce sec...",Win (1 of 2)
119.,2013-10-26 19:38:30,107.24,94%,Let me tell you why you're here. You're here because you kno...,No win (2 of 2)
118.,2013-10-26 19:37:34,106.03,93%,Being able to quit things that don't work is integral to bei...,No win (2 of 2)
117.,2013-10-26 19:36:46,131.20,99%,There's a piece of Maria in every song that I sing. And the ...,Win (1 of 3)
116.,2013-10-26 19:36:09,116.67,98%,"The Earth is a world, the world is a ball, a ball in a game ...",Win (1 of 3)
115.,2013-10-26 19:34:54,97.93,90%,"When she returns to the forum page, her post is there. It is...",No win (4 of 4)
114.,2013-10-26 19:34:09,102.62,89%,For it is not enough to have a good mind; the main thing is ...,No win (3 of 3)
113.,2013-10-26 19:33:21,103.56,93%,The great edifice of variety and choice that is an American ...,Win (1 of 2)
112.,2013-10-26 19:32:36,115.81,92%,Good games offer players a set of challenging problems and t...,No win (2 of 3)
111.,2013-10-26 19:30:00,123.57,93%,Come sail your ships around me and burn your bridges down. W...,Win (1 of 4)
110.,2013-10-26 19:28:59,112.28,94%,I'd just like to point out that you were given every opportu...,Win (1 of 3)
109.,2013-10-26 19:27:28,117.69,97%,Since every piece of matter in the Universe is in some way a...,No win (2 of 4)
108.,2013-10-26 19:26:41,114.53,95%,"As if that blind rage had washed me clean, rid me of hope; f...",Win (1 of 2)
107.,2013-10-26 19:25:47,124.63,98%,"When you are typing on a typewriter, your input appears dire...",Win (1 of 3)
106.,2013-10-26 19:25:15,106.46,91%,It was hard to toss things I had once thought were valuable ...,No win (2 of 3)
105.,2013-10-26 19:24:16,108.00,98%,"Common knowledge has bicyclists always riding into the wind,...",Win (1 of 4)
