555.,2013-11-06 18:26:54,130.85,98%,Let me tell you why you're here. You're here because you kno...,No win (2 of 3)
554.,2013-11-06 18:26:09,116.23,94%,But the two men were not lonely at all. At home they were co...,No win (3 of 4)
553.,2013-11-06 18:23:54,122.58,98%,"Because they're at the bottom of the scale, nerds are a safe...",Win (1 of 3)
552.,2013-11-06 18:21:11,118.35,99%,Involuntarily I glanced seaward - and distinguished nothing ...,Win (1 of 4)
551.,2013-11-06 17:52:30,127.21,93%,I've been looking so long at these pictures of you that I al...,Win (1 of 2)
550.,2013-11-06 17:51:57,144.00,100%,"For centuries, the battle of morality was fought between tho...",Win (1 of 3)
549.,2013-11-06 17:51:08,116.19,96%,"They say that right after God created man, he took a rib fro...",No win (2 of 3)
548.,2013-11-06 17:50:32,133.73,98%,I said that I would see you because I had heard that you wer...,Win (1 of 2)
547.,2013-11-06 17:49:45,122.35,98%,Commas and periods always go inside quotation marks. Colons ...,Win (1 of 4)
546.,2013-11-06 17:49:02,123.78,99%,"It may seem quite novelistic to you, and I am willing to agr...",Win (1 of 3)
545.,2013-11-06 17:46:35,137.84,98%,One thing I've learned in the last seven years: in every gam...,Win (1 of 4)
544.,2013-11-06 17:45:54,130.36,100%,I had the impression of being abandoned by everyone when the...,Win (1 of 5)
543.,2013-11-06 17:44:02,124.23,95%,Come sail your ships around me and burn your bridges down. W...,Win (1 of 3)
542.,2013-11-06 17:36:12,134.53,100%,Who has a safety deposit box full of money and six passports...,Win (1 of 2)
541.,2013-11-06 17:34:24,112.19,92%,"Keying text quickly is important, but it is more important t...",Win (1 of 2)
540.,2013-11-06 17:32:33,126.36,97%,I think you're gonna find - when all this stuff is over and ...,Win (1 of 5)
539.,2013-11-06 17:31:56,126.76,96%,It was hard to toss things I had once thought were valuable ...,Win (1 of 3)
538.,2013-11-06 17:27:10,120.64,99%,"I had a job, I had a girl. I had something going, mister, in...",Win (1 of 5)
537.,2013-11-06 17:22:49,134.11,99%,Humans need to practice what they are learning a good deal b...,No win (2 of 5)
536.,2013-11-06 17:18:00,115.89,92%,Remember that humor is written backwards. That means you fir...,No win (2 of 5)
535.,2013-11-06 17:15:28,122.56,95%,"Well, it just so happens, this hacienda comes with its very ...",Win (1 of 2)
534.,2013-11-06 17:12:48,135.77,100%,Being able to quit things that don't work is integral to bei...,No win (2 of 4)
533.,2013-11-06 17:11:13,125.17,97%,The beginner writes just twenty pieces. The professional wri...,No win (2 of 3)
532.,2013-11-06 13:35:11,120.92,97%,We often believe the more we practice a skill or technique -...,No win (1 of 1)
531.,2013-11-06 13:33:35,120.09,98%,Instead of hiring workers during the peak hog kill in the wi...,Win (1 of 2)
530.,2013-11-06 13:32:11,120.83,98%,The truth of the matter is that there are a lot of available...,Win (1 of 2)
529.,2013-11-06 13:30:57,119.57,96%,"They knew they were privileged to have these choices, but th...",Win (1 of 3)
528.,2013-11-06 13:27:08,120.00,95%,"If we all go for the blonde and block each other, not a sing...",Win (1 of 3)
527.,2013-11-06 13:26:09,125.08,99%,"We turn away to face the cold, enduring chill, as the day be...",Win (1 of 3)
526.,2013-11-06 13:24:52,143.23,100%,"The Earth is a world, the world is a ball, a ball in a game ...",Win (1 of 2)
525.,2013-11-06 13:22:31,123.27,96%,"Hello, hello, hello, is there anybody in there? Just nod if ...",No win (2 of 3)
524.,2013-11-06 12:57:25,132.71,100%,One thing I've learned in the last seven years: in every gam...,Win (1 of 5)
523.,2013-11-06 12:56:54,117.27,96%,"When she returns to the forum page, her post is there. It is...",Win (1 of 4)
522.,2013-11-06 12:54:29,126.40,98%,"A long time ago, I was in Burma, my friends and I were worki...",No win (1 of 1)
521.,2013-11-06 12:50:55,129.57,95%,Let me tell you why you're here. You're here because you kno...,Win (1 of 3)
520.,2013-11-06 12:48:44,140.47,97%,The place to improve the world is first in one's own heart a...,No win (2 of 3)
519.,2013-11-06 12:47:42,123.18,95%,"There is no physical separation after the slicing, so that e...",No win (1 of 1)
518.,2013-11-06 12:46:27,113.08,96%,"But older than me now, more constant, more real, and the fur...",No win (4 of 5)
517.,2013-11-06 12:44:35,127.48,97%,Since every piece of matter in the Universe is in some way a...,No win (1 of 1)
516.,2013-11-06 12:39:23,125.48,100%,"The time I waited seemed endless, and I felt doubts and fear...",No win (2 of 3)
515.,2013-11-06 12:34:22,127.31,98%,The truth of the matter is that there are a lot of available...,Win (1 of 2)
514.,2013-11-06 12:32:09,133.96,97%,The odds are that you will generally meet the worst of them....,No win (2 of 2)
513.,2013-11-06 12:30:53,136.95,98%,I've been looking so long at these pictures of you that I al...,Win (1 of 3)
512.,2013-11-05 20:09:56,136.01,98%,"I had a dream. There was our world, and the world was dark b...",No win (2 of 2)
511.,2013-11-05 20:08:19,126.21,99%,Ideology: the process of making ideas. The work was generall...,No win (3 of 3)
510.,2013-11-05 20:03:49,127.83,100%,"That fear had been inside him for many years, it had lived w...",No win (3 of 4)
509.,2013-11-05 20:01:42,119.42,96%,"But older than me now, more constant, more real, and the fur...",No win (3 of 5)
508.,2013-11-05 20:00:29,131.19,99%,"Whether you're a student, secretary, office administrator, m...",Win (1 of 4)
507.,2013-11-05 19:59:52,117.67,95%,One essential rule: make sure the joke is the last possible ...,No win (3 of 5)
506.,2013-11-05 19:57:19,128.24,97%,The only message I got was from the company that holds my st...,No win (2 of 2)
505.,2013-11-05 19:56:19,152.74,100%,The beginner writes just twenty pieces. The professional wri...,Win (1 of 2)
504.,2013-11-05 19:55:47,125.55,97%,"Trudging slowly over wet sand, back to the bench where your ...",Win (1 of 3)
503.,2013-11-05 19:55:01,125.75,96%,In order to become an elf I filled out ten pages' worth of f...,No win (3 of 3)
502.,2013-11-05 19:54:26,119.63,97%,But the two men were not lonely at all. At home they were co...,No win (3 of 3)
501.,2013-11-05 19:52:51,126.54,96%,"When I was your age, television was called books. And this i...",Win (1 of 3)
500.,2013-11-04 12:49:57,131.84,97%,Sometimes you concentrate more on racing the cars around you...,No win (2 of 5)
499.,2013-11-04 12:47:35,145.31,100%,There are very few things I wish I could change about those ...,Win (1 of 3)
498.,2013-11-04 12:43:51,121.38,94%,There are very few things I wish I could change about those ...,No win (3 of 3)
497.,2013-11-04 11:58:50,115.75,97%,"My darling, you have to be standing up in order to be able t...",Win (1 of 4)
496.,2013-11-04 11:56:02,118.07,100%,"Excellent. He's enterprising, aggressive, outgoing, young, b...",Win (1 of 4)
495.,2013-11-04 11:53:28,112.82,95%,"Let me get this straight. You think that your client, one of...",Win (1 of 3)
494.,2013-11-04 11:51:31,124.83,95%,I never said I would stay to the end - I knew I would leave ...,Win (1 of 5)
493.,2013-11-04 11:50:01,131.33,96%,"There is no physical separation after the slicing, so that e...",No win (2 of 3)
492.,2013-11-04 11:49:11,114.85,98%,"But suddenly, I viddied that thinking was for the gloopy one...",Win (1 of 3)
491.,2013-11-04 11:48:34,122.52,99%,"That fear had been inside him for many years, it had lived w...",Win (1 of 4)
490.,2013-11-04 11:45:23,122.33,98%,"I can feel the heat closing in, feel them out there making t...",Win (1 of 4)
489.,2013-11-04 11:44:49,127.93,100%,A few light taps upon the pane made him turn to the window. ...,Win (1 of 3)
488.,2013-11-04 11:44:04,122.46,98%,"Imagine considering ""if"" as a two-finger movement instead of...",Win (1 of 4)
487.,2013-11-04 11:43:23,113.27,95%,Supermarket aisles are the perfect place to practice your gl...,Win (1 of 5)
486.,2013-11-04 11:42:30,114.19,94%,It was one of those days when it's a minute away from snowin...,Win (1 of 3)
485.,2013-11-04 11:40:30,124.89,99%,A few light taps upon the pane made him turn to the window. ...,Win (1 of 4)
484.,2013-11-04 11:39:11,124.92,99%,The pickpockets' profession demands extraordinary nimbleness...,Win (1 of 5)
483.,2013-11-04 11:38:01,126.78,96%,I don't believe in painted roses or bleeding hearts while bu...,Win (1 of 2)
482.,2013-11-04 11:31:55,129.97,96%,There is something about yourself that you don't know. Somet...,Win (1 of 4)
481.,2013-11-04 11:31:07,115.65,95%,Few smart kids can spare the attention that popularity requi...,Win (1 of 3)
480.,2013-11-04 11:30:17,117.02,95%,Sometimes you concentrate more on racing the cars around you...,No win (2 of 4)
479.,2013-11-03 16:32:40,112.86,96%,"There was me, that is Alex, and my three droogs, that is Pet...",Win (1 of 2)
478.,2013-11-03 16:30:45,132.07,99%,"As if that blind rage had washed me clean, rid me of hope; f...",Win (1 of 3)
477.,2013-11-03 16:27:41,133.34,97%,Let's face it: there are tons of things in your home and lif...,Win (1 of 2)
476.,2013-11-03 16:26:58,115.87,93%,"There is no pain, you are receding. A distant ship smoke on ...",Win (1 of 2)
475.,2013-11-03 16:26:05,129.85,99%,A glooming peace this morning with it brings. The sun for so...,Win (1 of 2)
474.,2013-11-03 16:25:25,135.97,99%,Rhymes trap you into saying things you don't want to say. A ...,Win (1 of 2)
473.,2013-11-03 16:22:18,121.53,97%,"Whenever you watch the mind, you withdraw consciousness from...",Win (1 of 4)
472.,2013-11-03 16:21:35,113.29,99%,And then he calls me a jerk and says the last guy who though...,Win (1 of 3)
471.,2013-11-03 16:20:46,118.59,98%,A giant inverted steel pyramid is perfectly balanced on its ...,Win (1 of 3)
470.,2013-11-03 16:19:00,133.76,98%,I think you're gonna find - when all this stuff is over and ...,Win (1 of 3)
469.,2013-11-03 16:18:21,149.69,100%,"One day you're in a funk about things, telling a friend that...",Win (1 of 3)
468.,2013-11-03 16:16:50,105.43,95%,"Yes, the newspapers were right: snow was general all over Ir...",No win (2 of 3)
467.,2013-11-03 16:15:01,136.88,100%,"A little boy went out to play. When he opened his door, he s...",Win (1 of 4)
466.,2013-11-03 16:13:41,119.83,96%,It doesn't mean much to be able to filter out most present-d...,No win (3 of 3)
465.,2013-11-03 16:12:27,153.27,100%,Remember that humor is written backwards. That means you fir...,No win (2 of 3)
464.,2013-11-03 16:12:01,122.38,96%,I don't know why he saved my life. Maybe in those last momen...,Win (1 of 3)
463.,2013-11-03 16:09:23,128.15,96%,"Keying text quickly is important, but it is more important t...",Win (1 of 4)
462.,2013-11-03 16:06:23,137.02,97%,"Look and think as far ahead as possible. Often, a driver's n...",Win (1 of 4)
461.,2013-11-03 16:05:43,108.84,96%,We've arranged a global civilization in which most crucial e...,No win (2 of 3)
460.,2013-11-03 16:04:52,127.78,97%,Humans need to practice what they are learning a good deal b...,Win (1 of 3)
459.,2013-11-03 16:02:16,131.41,100%,Humans need to practice what they are learning a good deal b...,Win (1 of 3)
458.,2013-11-03 16:00:38,111.64,97%,"You ask Raymond what he does for a living and he says, ""I br...",No win (4 of 5)
457.,2013-11-02 17:51:01,145.14,100%,To an outsider's ear it sounds absurdly wild and ridiculous ...,Win (1 of 3)
456.,2013-11-02 17:50:33,108.96,97%,Three changes occur while the stacked disk structure equilib...,Win (1 of 5)
455.,2013-11-02 17:47:54,113.25,97%,"The sooner your kids appreciate the value of work, the more ...",Win (1 of 5)
454.,2013-11-02 17:47:16,107.42,94%,"It was a marvelous night, the sort of night one only experie...",No win (3 of 4)
453.,2013-11-02 17:46:39,111.25,98%,And then he calls me a jerk and says the last guy who though...,No win (3 of 5)
452.,2013-11-02 17:45:55,112.90,95%,Chance and chance alone has a message for us. Everything tha...,Win (1 of 2)
451.,2013-11-02 17:41:28,128.43,98%,"It is a period of civil war. Rebel spaceships, striking from...",Win (1 of 3)
450.,2013-11-02 17:38:33,116.06,98%,"When we pulled out into the winter night and the real snow, ...",Win (1 of 3)
449.,2013-11-02 17:37:37,123.43,99%,Some have a positive vocation for breaking open safes: from ...,Win (1 of 4)
448.,2013-11-02 17:36:51,136.57,100%,"Look and think as far ahead as possible. Often, a driver's n...",Win (1 of 4)
447.,2013-11-02 17:35:24,107.04,98%,"Under the headline ""Wonderful Typing,"" the New York Times re...",Win (1 of 4)
446.,2013-11-02 17:34:39,117.39,95%,And I will strike down upon thee with great vengeance and fu...,Win (1 of 3)
445.,2013-11-02 17:32:39,120.34,100%,"Pulp: 1. A soft, moist, shapeless mass or matter. 2. A magaz...",Win (1 of 2)
444.,2013-11-02 17:31:56,130.45,99%,"When I really worry about something, I don't just fool aroun...",Win (1 of 3)
443.,2013-11-02 17:28:46,104.69,94%,"Trudging slowly over wet sand, back to the bench where your ...",No win (3 of 3)
442.,2013-11-02 17:28:19,112.62,96%,The theory of music emphasizes the elements from which music...,No win (2 of 3)
441.,2013-11-02 17:23:29,107.03,97%,In 1873 the Sholes & Glidden Type Writer became the firs...,Win (1 of 3)
440.,2013-11-02 17:22:31,130.23,98%,To an outsider's ear it sounds absurdly wild and ridiculous ...,Win (1 of 3)
439.,2013-11-02 17:21:45,113.50,98%,"Two households, both alike in dignity (in fair Verona, where...",No win (3 of 4)
438.,2013-11-02 17:20:53,128.36,99%,Let's face it: there are tons of things in your home and lif...,No win (4 of 4)
437.,2013-11-02 17:18:51,121.72,98%,Stab a sorry heart with your favorite finger. Paint the whol...,No win (2 of 4)
436.,2013-11-02 17:17:11,131.16,98%,From compositional considerations the tomato layer would be ...,Win (1 of 3)
435.,2013-11-02 17:15:55,127.38,94%,"If you want to drive a race car well, whether to win an Indy...",Win (1 of 5)
434.,2013-11-02 17:14:56,124.03,99%,"In the English language, swearing is essential to effective ...",Win (1 of 3)
433.,2013-11-02 17:14:23,111.97,98%,A few light taps upon the pane made him turn to the window. ...,No win (2 of 4)
432.,2013-11-02 17:05:45,135.10,100%,Your faith was strong but you needed proof. You saw her bath...,Win (1 of 3)
431.,2013-11-02 17:05:09,130.83,100%,"I don't believe in an interventionist God, but I know, darli...",Win (1 of 2)
430.,2013-11-02 17:04:18,136.03,96%,"You have a class of young strong men and women, and they wan...",No win (2 of 2)
429.,2013-11-02 17:02:58,134.77,99%,Being able to quit things that don't work is integral to bei...,No win (2 of 2)
428.,2013-11-02 16:59:23,126.37,97%,Images of broken light which dance before me like a million ...,No win (3 of 3)
427.,2013-11-02 16:58:50,133.61,98%,"The world of typing has changed. In the 1970s, every busines...",Win (1 of 4)
426.,2013-11-02 16:56:34,116.93,96%,"And I said, I don't care if they lay me off either, because ...",Win (1 of 3)
425.,2013-11-02 16:55:32,135.12,99%,"To evaluate an option from the other side's point of view, c...",Win (1 of 3)
424.,2013-11-02 16:54:53,122.52,98%,"O clear intelligence, force beyond all measure! Gentlemen, I...",Win (1 of 3)
423.,2013-11-02 16:54:21,137.22,100%,"Ticking away the moments that make up a dull day, you fritte...",Win (1 of 2)
422.,2013-11-02 16:53:47,129.69,97%,"If we all go for the blonde and block each other, not a sing...",Win (1 of 3)
421.,2013-11-02 16:53:05,129.08,98%,The alternative to binge travel - the mini retirement - enta...,Win (1 of 2)
420.,2013-11-02 16:47:08,117.10,99%,"You just couldn't let me go, could you? This is what happens...",No win (2 of 4)
419.,2013-11-02 16:46:25,127.70,98%,"There is no physical separation after the slicing, so that e...",Win (1 of 3)
418.,2013-11-02 16:43:46,111.87,97%,The problem we now face is that this thin layer of atmospher...,Win (1 of 3)
417.,2013-11-02 16:42:57,119.88,98%,"With no map to navigate one's life, some of us have stood st...",Win (1 of 2)
416.,2013-11-02 16:42:07,113.22,97%,I know that you weren't bored that day because there was a l...,No win (2 of 3)
415.,2013-11-02 16:40:00,116.23,97%,The unknown future rolls toward us. I face it for the first ...,Win (1 of 3)
414.,2013-11-02 16:39:28,110.40,96%,"A long time ago, I was in Burma, my friends and I were worki...",No win (2 of 3)
413.,2013-11-02 16:37:12,128.23,98%,"Ticking away the moments that make up a dull day, you fritte...",Win (1 of 3)
412.,2013-11-02 16:36:02,115.96,99%,"Excellent. He's enterprising, aggressive, outgoing, young, b...",Win (1 of 3)
411.,2013-11-02 16:34:42,127.02,99%,There is something about yourself that you don't know. Somet...,Win (1 of 3)
410.,2013-11-02 16:30:59,112.06,94%,"Ergonomics is a term that combines the Greek word ergon, mea...",No win (2 of 2)
409.,2013-11-02 16:29:43,141.46,100%,She's got eyes of the bluest skies as if they thought of rai...,Win (1 of 4)
408.,2013-11-02 16:29:11,120.34,97%,"King, eh? Very nice. And how'd you get that, eh? By exploiti...",Win (1 of 3)
407.,2013-11-02 16:28:37,120.83,95%,Let's face it: there are tons of things in your home and lif...,No win (2 of 5)
406.,2013-11-02 16:27:54,121.48,98%,Danger is a topic you're often asked about as a sprinter. Th...,Win (1 of 5)
405.,2013-11-02 16:27:00,120.79,98%,Focus your attention on the Now and tell me what problem you...,Win (1 of 4)
404.,2013-11-02 16:26:27,113.34,97%,"Yet one fine day, in a fit of euphoria, after he had picked ...",No win (2 of 5)
403.,2013-11-02 16:25:40,126.50,99%,"I went to the woods because I wished to live deliberately, t...",Win (1 of 5)
402.,2013-11-02 16:25:06,134.24,99%,Focus your attention on the Now and tell me what problem you...,Win (1 of 4)
401.,2013-11-02 16:24:27,119.78,96%,Chance and chance alone has a message for us. Everything tha...,Win (1 of 5)
400.,2013-11-02 16:21:34,116.60,97%,Don't take anything personally - nothing others do is becaus...,Win (1 of 5)
399.,2013-10-31 16:27:26,113.09,96%,The great edifice of variety and choice that is an American ...,Win (1 of 3)
398.,2013-10-31 16:25:37,136.03,100%,"Your face has fallen sad now, for you know the time is nigh....",Win (1 of 3)
397.,2013-10-31 16:24:27,118.38,98%,"There are men who possess a peculiarly strong visual memory,...",Win (1 of 4)
396.,2013-10-31 16:04:21,122.08,95%,Remembering you running soft through the night. You were big...,Win (1 of 3)
395.,2013-10-31 16:02:36,131.36,95%,Don't take anything personally - nothing others do is becaus...,Win (1 of 3)
394.,2013-10-31 15:44:13,135.80,97%,"That's Tommy. He tells people he was named after a gun, but ...",Win (1 of 2)
393.,2013-10-31 15:43:32,146.86,100%,To an outsider's ear it sounds absurdly wild and ridiculous ...,Win (1 of 5)
392.,2013-10-31 15:42:55,123.54,98%,"My name is Turkish. Funny name for an Englishman, I know. My...",Win (1 of 3)
391.,2013-10-31 15:42:07,120.27,97%,Jay made up for the lack of glamour in his assignment by hav...,Win (1 of 2)
390.,2013-10-31 15:40:42,122.46,98%,Is it sweeter to exist only in the mind or to exist both in ...,Win (1 of 4)
389.,2013-10-31 15:40:02,117.58,100%,Who has a safety deposit box full of money and six passports...,No win (2 of 2)
388.,2013-10-31 15:38:55,130.26,98%,"If you want to drive a race car well, whether to win an Indy...",Win (1 of 3)
387.,2013-10-31 15:37:51,118.79,98%,"To evaluate an option from the other side's point of view, c...",Win (1 of 4)
386.,2013-10-31 15:37:17,123.77,97%,"The only people for me are the mad ones, the ones who are ma...",Win (1 of 3)
385.,2013-10-31 15:35:48,122.60,96%,Always do your best - your best is going to change from mome...,Win (1 of 4)
384.,2013-10-31 13:01:36,114.33,94%,"Kid, I've flown from one side of this galaxy to the other, a...",No win (2 of 3)
383.,2013-10-31 12:59:14,129.08,98%,"The world of typing has changed. In the 1970s, every busines...",Win (1 of 3)
382.,2013-10-31 12:58:19,127.49,96%,"If you want to drive a race car well, whether to win an Indy...",Win (1 of 3)
381.,2013-10-31 12:57:27,132.15,99%,One thing I've learned in the last seven years: in every gam...,No win (2 of 4)
380.,2013-10-31 12:52:37,133.33,97%,The ultimate way to compose is to be able to keyboard as fas...,Win (1 of 4)
379.,2013-10-31 12:46:03,117.79,91%,"There are perhaps twenty regular posters on the forum, and s...",Win (1 of 3)
378.,2013-10-31 12:45:15,125.98,98%,Even the best-designed chair won't make up for bad posture. ...,Win (1 of 3)
377.,2013-10-31 12:43:56,125.66,97%,"My name is Turkish. Funny name for an Englishman, I know. My...",Win (1 of 3)
376.,2013-10-31 12:42:59,123.54,92%,The place to improve the world is first in one's own heart a...,No win (2 of 2)
375.,2013-10-31 12:42:16,133.30,99%,Is it really necessary to send that email? The more emails y...,No win (1 of 1)
374.,2013-10-31 12:41:30,138.07,100%,Humans need to practice what they are learning a good deal b...,Win (1 of 4)
373.,2013-10-31 12:40:56,114.79,95%,The problem we now face is that this thin layer of atmospher...,No win (3 of 3)
372.,2013-10-31 12:39:50,125.56,99%,"Whether they use the title or not, many lyrics have evocativ...",No win (2 of 3)
371.,2013-10-31 12:36:32,121.52,97%,I don't know why he saved my life. Maybe in those last momen...,Win (1 of 3)
370.,2013-10-31 12:34:19,133.54,98%,"The terminator wouldn't stop, it would never leave him. It w...",Win (1 of 4)
369.,2013-10-31 12:32:48,121.84,96%,I can already hear your tune calling me across the room. Whe...,Win (1 of 5)
368.,2013-10-31 12:31:02,118.17,98%,Is it sweeter to exist only in the mind or to exist both in ...,Win (1 of 3)
367.,2013-10-31 12:30:16,126.09,99%,With the coming of Dean Moriarty began the part of my life y...,No win (1 of 1)
366.,2013-10-30 18:50:38,119.38,99%,"Comfortable, Mullet? It seems sadly ironic that it's that ti...",Win (1 of 2)
365.,2013-10-30 18:49:44,92.57,88%,"She was a genius of sadness, immersing herself in it, separa...",No win (2 of 2)
364.,2013-10-30 18:48:43,131.77,99%,"I've heard there was a secret chord that David played, and i...",No win (2 of 3)
363.,2013-10-30 17:47:27,119.45,98%,"My name is Turkish. Funny name for an Englishman, I know. My...",No win (3 of 5)
362.,2013-10-30 17:46:55,118.44,96%,"Hey Mr. Tambourine Man, play a song for me, I'm not sleepy a...",Win (1 of 2)
361.,2013-10-30 17:46:17,133.68,96%,"Look and think as far ahead as possible. Often, a driver's n...",Win (1 of 3)
360.,2013-10-30 17:45:26,117.05,98%,We've arranged a global civilization in which most crucial e...,Win (1 of 4)
359.,2013-10-30 17:44:53,117.43,99%,"The time I waited seemed endless, and I felt doubts and fear...",Win (1 of 2)
358.,2013-10-30 17:44:18,130.14,98%,The example of painting can teach us not only how to manage ...,Win (1 of 4)
357.,2013-10-30 17:43:20,105.89,93%,"Throughout my academic career, I'd given some pretty good ta...",No win (3 of 5)
356.,2013-10-30 17:42:42,128.97,97%,"Keying text quickly is important, but it is more important t...",Win (1 of 4)
355.,2013-10-30 17:42:02,138.07,98%,She's got eyes of the bluest skies as if they thought of rai...,No win (3 of 5)
354.,2013-10-30 17:41:27,129.58,94%,"Many people limit themselves to leading boring, dull lives b...",No win (2 of 4)
353.,2013-10-30 17:40:46,134.84,95%,Remember that humor is written backwards. That means you fir...,Win (1 of 3)
352.,2013-10-30 17:40:09,139.26,98%,"In the casino, the cardinal rule is to keep them playing and...",No win (2 of 2)
351.,2013-10-30 17:39:36,115.79,95%,"I don't want tickets, I need you to find me a painting, a cl...",No win (2 of 4)
350.,2013-10-30 17:38:53,109.22,96%,"She was a genius of sadness, immersing herself in it, separa...",Win (1 of 4)
349.,2013-10-30 17:37:59,128.69,98%,"No matter how bad things are, you can always make things wor...",No win (2 of 3)
348.,2013-10-30 17:36:20,124.08,95%,San Francisco in the middle sixties was a very special time ...,No win (2 of 5)
347.,2013-10-30 17:35:35,119.09,99%,Aztec rule was based upon a system of tribute and fear over ...,Win (1 of 2)
346.,2013-10-30 17:16:50,115.40,94%,Everything we hold dear likewise resolves into its original ...,Win (1 of 3)
345.,2013-10-30 17:15:06,142.14,100%,"When you are typing on a typewriter, your input appears dire...",Win (1 of 5)
344.,2013-10-30 17:14:35,122.39,97%,And I don't believe in the existence of angels but looking a...,Win (1 of 5)
343.,2013-10-30 17:13:11,116.69,94%,Typing competitions provided another test of the Qwerty keyb...,No win (2 of 4)
342.,2013-10-30 17:12:23,110.22,94%,Images of broken light which dance before me like a million ...,Win (1 of 5)
341.,2013-10-30 17:08:32,117.11,93%,"Thirdly, however, these wars could now be waged with the new...",Win (1 of 3)
340.,2013-10-30 17:07:48,148.46,97%,Remember that humor is written backwards. That means you fir...,Win (1 of 2)
339.,2013-10-30 15:30:52,125.20,99%,"I was shaking like a leaf, so without thinking I lit up a ci...",No win (2 of 3)
338.,2013-10-30 15:30:02,124.76,95%,"Every craft and every investigation, and likewise every acti...",No win (3 of 3)
337.,2013-10-30 15:28:59,139.38,100%,"A little boy went out to play. When he opened his door, he s...",No win (2 of 2)
336.,2013-10-30 14:58:52,126.09,98%,You've got a way to keep me on your side. You give me cause ...,Win (1 of 5)
335.,2013-10-30 14:58:26,129.14,97%,"As if that blind rage had washed me clean, rid me of hope; f...",Win (1 of 5)
334.,2013-10-30 14:57:40,134.79,98%,Let's face it: there are tons of things in your home and lif...,Win (1 of 4)
333.,2013-10-30 14:57:03,127.71,99%,Stab a sorry heart with your favorite finger. Paint the whol...,Win (1 of 3)
332.,2013-10-30 14:55:09,125.08,99%,Is it sweeter to exist only in the mind or to exist both in ...,Win (1 of 5)
331.,2013-10-30 14:53:46,132.81,98%,Don't take anything personally - nothing others do is becaus...,Win (1 of 3)
330.,2013-10-30 12:03:39,135.54,100%,"Keying text quickly is important, but it is more important t...",Win (1 of 3)
