228.,2016-08-26 01:19:20,80.98,89%,"Do you smell that? Napalm, son. Nothing else in the world sm...",No win (4 of 5)
227.,2016-08-26 01:17:26,85.53,91%,Convection also plays a minor role because of the relative t...,No win (3 of 5)
226.,2016-08-26 01:16:16,78.30,91%,"As the netted bag says, this potato was grown in Idaho, that...",No win (4 of 5)
225.,2016-08-26 01:15:18,86.53,94%,Indonesia is a nation of islands - more than seventeen thous...,No win (3 of 4)
224.,2016-08-26 01:14:11,89.30,91%,"When she returns to the forum page, her post is there. It is...",No win (3 of 5)
223.,2016-08-26 01:11:43,98.79,94%,Step out the front door like a ghost into the fog where no o...,No win (2 of 3)
222.,2016-08-26 01:07:14,88.27,92%,Data is by definition easy to copy. And the Internet makes c...,Win (1 of 3)
221.,2016-08-26 01:03:49,77.29,89%,"This was the most delicious meal he'd had in recent years, a...",Win (1 of 5)
220.,2016-08-24 14:37:52,91.06,93%,"The sooner your kids appreciate the value of work, the more ...",Win (1 of 2)
219.,2016-08-13 03:31:23,91.43,92%,"There are perhaps twenty regular posters on the forum, and s...",Win (1 of 3)
218.,2016-08-13 03:10:55,82.21,95%,Many rivers to cross but I can't seem to find my way over. W...,Win (1 of 2)
217.,2016-08-13 03:08:55,94.21,94%,Yet the web of thought has no such creases and is more like ...,Win (1 of 2)
216.,2016-08-13 03:06:52,69.21,87%,"It's a blue savanna song: somewhere cross the desert, someti...",Win (1 of 2)
215.,2016-08-13 03:04:16,99.11,97%,We have a criminal jury system which is superior to any in t...,Win (1 of 2)
214.,2016-08-13 03:03:06,100.70,96%,The most precious treasures we have in life are the images w...,Win (1 of 2)
213.,2016-08-08 05:50:08,79.19,88%,The child is brought up in a culture where he or she simply ...,No win (2 of 2)
212.,2016-08-08 05:48:43,91.01,94%,"Ever since I was a child, folks have thought they had me peg...",Win (1 of 2)
211.,2016-08-08 05:47:56,90.02,90%,A freedom fighter learns the hard way that it is the oppress...,No win (2 of 2)
210.,2016-08-08 05:46:51,78.06,91%,"""This man right here,"" McGuinness said, pointing at Kenna, ""...",Win (1 of 2)
209.,2016-08-02 00:41:27,88.87,92%,I am learning about twenty new Italian words a day. Where am...,No win (4 of 4)
208.,2016-08-02 00:40:41,85.04,89%,From compositional considerations the tomato layer would be ...,No win (2 of 4)
207.,2016-08-02 00:39:55,86.22,91%,I can teach you how to bewitch the mind and ensnare the sens...,No win (2 of 5)
206.,2016-08-02 00:39:07,88.90,87%,Be impeccable with your word - speak with integrity. Say onl...,No win (2 of 5)
205.,2016-08-01 13:52:47,69.31,88%,"The problem is, Willie, is that Charles and yourself are not...",No win (4 of 4)
204.,2016-08-01 13:52:13,88.88,93%,I'll tell you a secret. Something they don't teach you in yo...,Win (1 of 5)
203.,2016-07-30 18:19:15,97.34,93%,We all know people who are very bright but who do not always...,No win (2 of 4)
202.,2016-07-30 18:17:03,98.95,93%,"If you really want to hear about it, the first thing you'll ...",Win (1 of 4)
201.,2016-07-30 18:14:14,92.45,92%,"I'm so glad you came, I'm so glad you remembered, to see how...",Win (1 of 3)
200.,2016-07-30 18:11:41,86.78,93%,"It turned out that the sweet-talking, tattoo-sporting pikey ...",Win (1 of 5)
199.,2016-07-30 18:10:00,85.42,88%,"The less you do with the controls, the less chance of error....",No win (4 of 5)
198.,2016-07-30 18:09:11,106.29,96%,A freedom fighter learns the hard way that it is the oppress...,No win (2 of 5)
197.,2016-07-30 18:08:23,95.34,91%,"In the moment when I truly understand my enemy, understand h...",Win (1 of 5)
196.,2016-07-30 18:07:27,102.62,95%,"And in the world a heart of darkness, a firezone, where poet...",Win (1 of 4)
195.,2016-07-30 18:06:38,89.64,90%,And that's what this whole thing is about. Calling home. Ins...,No win (2 of 4)
194.,2016-07-30 18:03:33,95.20,90%,There is a theory which states that if anybody ever discover...,No win (2 of 4)
193.,2016-07-30 18:02:39,94.46,95%,"Get it straight buster - I'm not here to say please, I'm her...",No win (2 of 5)
192.,2016-07-30 18:01:10,88.89,93%,"In general, many of these targets are easier marks if you ar...",No win (2 of 4)
191.,2016-07-30 18:00:09,73.98,84%,"My name is Turkish. Funny name for an Englishman, I know. My...",No win (3 of 3)
190.,2016-07-30 17:55:37,88.17,90%,Space is big. Really big. You just won't believe how vastly ...,No win (2 of 4)
189.,2016-07-30 17:54:16,87.82,92%,"As customers of all races, nationalities, and cultures visit...",No win (3 of 5)
188.,2016-07-30 17:53:16,109.89,97%,"And you know it's time to go, through the sleet and driving ...",Win (1 of 2)
187.,2016-07-30 13:57:51,90.43,94%,"But suddenly, I viddied that thinking was for the gloopy one...",No win (2 of 3)
186.,2016-07-30 13:53:51,79.88,88%,"I did my best, it wasn't much. I couldn't feel, so I tried t...",No win (3 of 5)
185.,2016-07-30 13:53:04,85.90,89%,"Combat for a naval aviator is fought in short, violent burst...",No win (4 of 5)
184.,2016-07-30 13:52:11,94.56,93%,"Look and think as far ahead as possible. Often, a driver's n...",Win (1 of 4)
183.,2016-07-30 13:48:15,77.67,85%,The number one challenge I've seen with myself and with othe...,No win (3 of 3)
182.,2016-07-30 13:45:28,94.76,91%,"But no matter how effective the lesson was, I never really u...",No win (2 of 2)
181.,2016-07-30 13:42:41,88.19,88%,Every time I think of you I feel shot right through with a b...,Win (1 of 3)
180.,2016-07-30 13:41:41,85.32,89%,We all know people who are very bright but who do not always...,Win (1 of 3)
179.,2016-07-30 13:40:33,99.24,92%,"I'm so glad you came, I'm so glad you remembered, the walkin...",No win (2 of 5)
178.,2016-07-30 13:39:48,92.72,92%,Is it sweeter to exist only in the mind or to exist both in ...,Win (1 of 5)
177.,2016-07-13 02:42:30,73.80,90%,"Yeah, you just take Soupy-Sales to prom 'cause I can think o...",Win (1 of 2)
176.,2016-06-04 01:02:04,88.31,89%,"All life's battles teach us something, even those we lose. W...",Win (1 of 2)
175.,2016-06-04 01:00:18,82.95,88%,"Has it been five years? Six? It seems like a lifetime, the k...",Win (1 of 2)
174.,2016-05-27 23:13:45,72.95,89%,Always do your best - your best is going to change from mome...,No win (2 of 3)
173.,2016-05-27 23:12:14,87.59,92%,All that year the animals worked like slaves. But they were ...,No win (2 of 4)
172.,2016-05-27 23:10:41,96.98,96%,"That fear had been inside him for many years, it had lived w...",Win (1 of 4)
171.,2016-05-27 23:09:14,87.78,92%,"I had a job, I had a girl. I had something going, mister, in...",No win (3 of 4)
170.,2016-05-27 23:07:55,87.92,90%,The alternative to binge travel - the mini retirement - enta...,No win (2 of 3)
169.,2016-05-27 23:06:25,68.04,87%,We're no strangers to love. You know the rules and so do I. ...,No win (3 of 4)
168.,2016-05-27 23:04:57,75.20,95%,San Francisco in the middle sixties was a very special time ...,No win (3 of 3)
167.,2016-05-27 23:03:43,75.39,90%,"Kid, I've flown from one side of this galaxy to the other, a...",No win (2 of 3)
166.,2016-05-27 23:02:01,64.33,83%,The theory of music emphasizes the elements from which music...,No win (3 of 3)
165.,2016-05-27 23:00:26,81.42,90%,I thought climbing the Devil's Thumb would fix all that was ...,No win (2 of 2)
164.,2016-05-22 23:29:10,56.43,91%,"Anyway, like I was saying, shrimp is the fruit of the sea. Y...",Win (1 of 2)
163.,2016-05-12 00:46:11,90.75,94%,Music finds a comfortable parallel with that of human langua...,No win (2 of 3)
162.,2016-05-12 00:45:38,100.89,95%,"Never give up, no matter how far behind you are, no matter h...",No win (2 of 4)
161.,2016-05-12 00:44:35,91.75,94%,"Whether you're a student, secretary, office administrator, m...",No win (2 of 4)
160.,2016-05-12 00:43:31,86.07,92%,The feeling of having no power over people and events is gen...,No win (3 of 5)
159.,2016-05-12 00:42:16,82.84,89%,Any finite number divided by infinity is as near to nothing ...,No win (4 of 4)
158.,2016-05-12 00:41:15,83.70,88%,You've got a way to keep me on your side. You give me cause ...,Win (1 of 5)
157.,2016-05-12 00:40:36,91.78,93%,"Ever since I was a child, folks have thought they had me peg...",No win (3 of 5)
156.,2016-05-12 00:40:09,92.56,92%,Popularity is only partially about individual attractiveness...,No win (2 of 4)
155.,2016-05-12 00:39:21,84.92,85%,There's a piece of Maria in every song that I sing. And the ...,No win (4 of 5)
154.,2016-05-12 00:38:29,88.16,89%,"And I said, I don't care if they lay me off either, because ...",Win (1 of 5)
153.,2016-05-12 00:36:40,103.44,97%,I can already hear your tune calling me across the room. Whe...,No win (2 of 5)
152.,2016-05-08 18:51:06,94.87,96%,"So don't be afraid; your heart is in me, and it's racing so ...",Win (1 of 5)
151.,2016-05-08 18:50:35,76.21,89%,"Gentlemen: You have undertaken to cheat me. I won't sue you,...",No win (4 of 5)
150.,2016-05-08 18:50:10,86.92,92%,Punishment and negative reinforcement are opposites. Punishm...,Win (1 of 5)
149.,2016-05-08 18:49:14,89.49,94%,"The problem is, Willie, is that Charles and yourself are not...",No win (2 of 3)
148.,2016-05-08 18:48:48,86.54,92%,The treatment of atoms with more than one electron requires ...,No win (2 of 5)
147.,2016-05-08 18:47:40,85.93,90%,To an outsider's ear it sounds absurdly wild and ridiculous ...,Win (1 of 4)
146.,2016-05-08 18:45:22,80.36,86%,One thing I've learned in the last seven years: in every gam...,No win (3 of 5)
145.,2016-05-08 18:44:42,90.43,92%,"My friend, I shall be pedagogic, and say you ought to start ...",No win (2 of 2)
144.,2016-05-08 18:43:55,77.00,87%,Once you get into the processed foods you have to be a fairl...,No win (2 of 3)
143.,2016-05-08 18:42:58,80.91,92%,"Ergonomics is a term that combines the Greek word ergon, mea...",No win (2 of 4)
142.,2016-05-08 18:42:13,86.87,89%,Writing is hard work. A clear sentence is no accident. Very ...,No win (3 of 4)
141.,2016-05-08 18:41:22,91.09,88%,"I had a dream. There was our world, and the world was dark b...",No win (2 of 4)
140.,2016-05-08 18:40:23,92.20,90%,"Right, I am going to tell you how this works. You're going i...",No win (2 of 3)
139.,2016-05-08 18:39:09,76.32,88%,Lucid but wholly false recollections can easily be induced b...,No win (2 of 5)
138.,2016-05-08 18:38:19,98.32,96%,"He's got a two day head start on you, which is more than he ...",Win (1 of 4)
137.,2016-05-08 18:37:34,88.42,95%,"It is a period of civil war. Rebel spaceships, striking from...",No win (2 of 3)
136.,2016-05-08 18:36:40,101.81,98%,"The time I waited seemed endless, and I felt doubts and fear...",Win (1 of 5)
135.,2016-05-07 23:10:59,91.86,92%,"Well, the way they make shows is, they make one show. That s...",No win (3 of 3)
134.,2016-05-07 23:09:09,91.01,92%,With the coming of Dean Moriarty began the part of my life y...,Win (1 of 2)
133.,2016-05-07 23:07:22,94.76,95%,"Every craft and every investigation, and likewise every acti...",No win (3 of 5)
132.,2016-05-07 23:05:27,89.73,93%,Come sail your ships around me and burn your bridges down. W...,Win (1 of 2)
131.,2016-05-07 23:04:24,84.98,94%,I'll tell you a secret. Something they don't teach you in yo...,No win (3 of 3)
130.,2016-05-07 23:01:37,88.94,92%,"There is no pain, you are receding. A distant ship smoke on ...",No win (3 of 4)
129.,2016-05-07 23:00:36,88.33,93%,"All at sea again, and now my hurricanes, have brought down t...",Win (1 of 2)
128.,2016-05-07 22:57:24,86.66,88%,"If we all go for the blonde and block each other, not a sing...",No win (2 of 3)
127.,2016-05-07 22:56:18,85.10,95%,What should have been swift revenge turned into an all out w...,No win (4 of 5)
126.,2016-05-07 22:55:21,98.77,96%,"So don't be afraid; your heart is in me, and it's racing so ...",No win (2 of 3)
125.,2016-05-07 22:53:03,98.84,92%,Now I want you to think and stop being a smart aleck. A man'...,Win (1 of 3)
124.,2016-05-07 22:50:23,86.24,89%,There's a piece of Maria in every song that I sing. And the ...,No win (3 of 3)
123.,2016-05-07 22:49:34,82.67,88%,"Now that I know that I'm breaking to pieces, I'll pull out m...",No win (2 of 2)
122.,2016-05-07 22:48:26,82.57,93%,"The result has been the emergence of what some call the ""win...",No win (3 of 4)
121.,2016-05-07 22:46:12,101.02,95%,"Ticking away the moments that make up a dull day, you fritte...",Win (1 of 5)
120.,2016-05-07 22:45:05,91.08,95%,I can teach you how to bewitch the mind and ensnare the sens...,Win (1 of 3)
119.,2016-05-07 22:44:19,74.21,89%,It is by will alone I set my mind in motion. It is by the ju...,Win (1 of 2)
118.,2016-05-04 03:37:45,91.86,93%,We're no strangers to love. You know the rules and so do I. ...,Win (1 of 5)
117.,2016-05-04 03:37:13,86.23,90%,Paranoia is a survival trait when you run in my circles. It ...,No win (5 of 5)
116.,2016-05-04 03:36:24,88.77,91%,I suddenly had the impression that I had been left all alone...,No win (4 of 4)
115.,2016-05-04 03:35:33,95.71,95%,Now I want you to think and stop being a smart aleck. A man'...,No win (2 of 5)
114.,2016-05-04 03:34:46,88.94,89%,Typing competitions provided another test of the Qwerty keyb...,Win (1 of 3)
113.,2016-05-04 03:33:38,78.78,90%,"Radiation could be precisely determined, in principle, if we...",No win (2 of 4)
112.,2016-05-04 03:32:25,77.41,90%,"She was a genius of sadness, immersing herself in it, separa...",No win (2 of 4)
111.,2016-05-04 03:31:07,88.99,92%,Do not go gentle into that good night. Old age should burn a...,No win (2 of 4)
110.,2016-05-04 03:29:35,64.88,82%,"When I was a kid, you never saw radicchio in the produce sec...",No win (3 of 4)
109.,2016-05-03 02:27:15,86.62,90%,Imagine for a moment if we once again knew these few unremar...,Win (1 of 5)
108.,2016-05-03 02:24:30,79.83,88%,Do not go gentle into that good night. Old age should burn a...,Win (1 of 4)
107.,2016-05-03 02:22:48,79.19,91%,Few smart kids can spare the attention that popularity requi...,Win (1 of 5)
106.,2016-05-03 02:21:29,88.82,95%,I don't know why he saved my life. Maybe in those last momen...,No win (2 of 5)
105.,2016-05-03 02:20:36,83.08,91%,And then he calls me a jerk and says the last guy who though...,No win (2 of 5)
104.,2016-05-03 02:19:44,78.25,91%,"What about Tony? You know, Bullet Tooth Tony. He'll find you...",No win (2 of 5)
103.,2016-05-03 02:18:58,94.55,92%,Humans need to practice what they are learning a good deal b...,Win (1 of 5)
102.,2016-05-03 02:18:10,88.83,94%,"Good games stay within, but at the outer edge, of the player...",No win (3 of 5)
101.,2016-05-03 02:17:27,77.50,90%,The treatment of atoms with more than one electron requires ...,No win (4 of 4)
100.,2016-05-03 02:16:09,90.63,91%,Imagine for a moment if we once again knew these few unremar...,Win (1 of 5)
99.,2016-05-03 02:14:58,82.17,88%,"When the light of life has gone, no change for the meter. Th...",No win (2 of 5)
98.,2016-04-17 02:20:13,89.66,95%,"When we conceive of the sweetest being ever, we are conceivi...",Win (1 of 2)
97.,2016-04-17 02:19:23,73.28,96%,"Now, you want it, Nick, you buy it. - What else do I get wit...",Win (1 of 4)
96.,2016-04-17 02:18:23,71.45,91%,There was a stage and a PA up in western Massachusetts and t...,No win (2 of 5)
95.,2016-04-17 02:15:53,74.75,93%,"An essential characteristic of the superhero mythology is, t...",Win (1 of 2)
94.,2016-04-17 02:14:32,88.93,96%,Any finite number divided by infinity is as near to nothing ...,No win (2 of 4)
93.,2016-04-17 02:13:32,78.29,93%,"Good evening, London. Allow me first to apologize for this i...",No win (2 of 5)
92.,2016-04-17 02:12:10,90.46,97%,Gardeners know how to grow top-notch crops. They determine w...,No win (2 of 5)
91.,2016-04-17 02:11:18,63.56,87%,The inner surface of the cell wall touches the cytoplasmic m...,No win (3 of 5)
90.,2016-03-27 14:05:07,75.13,86%,It was hard to toss things I had once thought were valuable ...,Win (1 of 5)
89.,2016-03-27 14:03:10,77.33,94%,"The term ""barbarian"" was created by the Greeks; it was origi...",Win (1 of 3)
88.,2016-03-27 14:01:57,90.37,96%,Once you get into the processed foods you have to be a fairl...,No win (3 of 5)
87.,2016-03-27 14:01:06,69.67,89%,"Around midafternoon, the snow thinned into sleet, and some u...",No win (2 of 4)
86.,2016-03-27 14:00:10,65.33,88%,We might begin by asking why the pregnant man image has been...,Win (1 of 4)
85.,2016-03-27 13:58:45,75.14,88%,"The less you do with the controls, the less chance of error....",No win (4 of 5)
84.,2016-03-27 13:56:02,77.84,89%,We live in a charmed world. If we have money we can buy lite...,No win (2 of 4)
83.,2016-03-27 13:54:48,85.45,88%,"But it is important to know this, to know your roots. To kno...",Win (1 of 5)
82.,2016-03-27 13:54:00,71.11,89%,"As the netted bag says, this potato was grown in Idaho, that...",No win (4 of 4)
81.,2016-03-27 13:52:39,82.89,91%,"Contrary to the feminist cant, there are many things we can ...",No win (2 of 5)
80.,2016-03-27 13:51:53,73.93,87%,"The less you do with the controls, the less chance of error....",No win (3 of 5)
79.,2016-03-27 13:45:36,89.66,88%,As much money and life as you could want! The two things mos...,No win (3 of 4)
78.,2016-03-27 13:45:02,70.05,84%,"He's got a two day head start on you, which is more than he ...",No win (4 of 5)
77.,2016-03-27 13:43:27,91.19,95%,"My darling, you have to be standing up in order to be able t...",Win (1 of 4)
76.,2016-03-27 13:42:31,89.05,96%,It is by will alone I set my mind in motion. It is by the ju...,Win (1 of 4)
75.,2016-03-27 13:41:54,93.71,97%,"It's a blue savanna song: somewhere cross the desert, someti...",Win (1 of 3)
74.,2016-03-27 13:41:19,77.37,91%,"Do you smell that? Napalm, son. Nothing else in the world sm...",No win (2 of 2)
73.,2016-03-27 13:40:29,69.84,87%,"Now you might ask yourself, if by yourself you mean me, ""Ste...",No win (1 of 1)
72.,2016-03-27 13:39:14,71.34,85%,Since every piece of matter in the Universe is in some way a...,Win (1 of 5)
71.,2016-03-27 13:38:10,68.69,83%,"Living men are bound by time... Thus, their lives have an ur...",No win (4 of 5)
70.,2016-03-27 13:36:48,81.28,90%,"O clear intelligence, force beyond all measure! Gentlemen, I...",No win (4 of 4)
69.,2016-03-27 13:36:02,103.04,95%,All time is all time. It does not change. It does not lend i...,Win (1 of 5)
68.,2016-03-27 01:59:23,91.98,97%,All time is all time. It does not change. It does not lend i...,Win (1 of 2)
67.,2016-03-27 01:58:41,73.39,86%,Since the 1980s virtually all the sodas and most of the frui...,No win (3 of 3)
66.,2016-03-27 01:57:18,85.56,93%,"Whether you're a student, secretary, office administrator, m...",Win (1 of 3)
65.,2016-03-17 12:42:46,72.05,85%,"And, anyway, it's not about making money, it's about taking ...",No win (2 of 5)
64.,2016-03-17 12:39:55,71.05,85%,"A robot may not injure a human being, or, through inaction, ...",No win (4 of 5)
63.,2016-03-17 12:38:43,91.09,94%,Paranoia is a survival trait when you run in my circles. It ...,Win (1 of 5)
62.,2016-03-17 12:37:51,73.05,88%,The quick brown fox jumps over the lazy dog.,Win (1 of 3)
61.,2016-03-17 12:37:14,77.15,89%,"A long time ago, I was in Burma, my friends and I were worki...",Win (1 of 5)
60.,2016-02-25 21:55:23,70.62,88%,A chorus is the high-point of a lyric's energy as well as th...,No win (2 of 2)
59.,2016-02-25 21:53:21,73.68,84%,"Tim and the Princess lounge in the castle garden, laughing t...",No win (2 of 2)
58.,2016-02-25 21:50:43,49.03,86%,Chance and chance alone has a message for us. Everything tha...,No win (2 of 2)
57.,2016-02-25 21:45:44,76.56,94%,"Now you might ask yourself, if by yourself you mean me, ""Ste...",Win (1 of 2)
56.,2016-02-25 21:43:22,79.50,90%,"Burning my bridges and smashing my mirrors, turning to see i...",Win (1 of 2)
55.,2016-02-25 21:41:38,86.19,94%,God help the man who ever really loves you. You'd break his ...,Win (1 of 2)
54.,2016-02-16 00:09:23,64.16,85%,Convection also plays a minor role because of the relative t...,No win (4 of 4)
53.,2016-02-16 00:08:18,78.14,87%,Focus your attention on the Now and tell me what problem you...,No win (4 of 4)
52.,2016-02-16 00:07:24,69.17,84%,Come sail your ships around me and burn your bridges down. W...,No win (4 of 5)
51.,2016-02-16 00:06:09,63.59,80%,Your faith was strong but you needed proof. You saw her bath...,No win (5 of 5)
50.,2016-02-13 15:16:13,86.73,90%,Remembering you standing quiet in the rain as I ran to your ...,Win (1 of 3)
49.,2016-02-13 15:15:13,59.65,83%,I was having this awful nightmare that I was 32. And then I ...,Win (1 of 3)
48.,2016-02-13 15:13:39,75.42,87%,"But, pray how could that which I spoke so many years ago, an...",Win (1 of 3)
47.,2016-02-13 15:11:46,68.45,87%,Everything we hold dear likewise resolves into its original ...,Win (1 of 3)
46.,2016-02-13 15:09:43,70.92,90%,I've seen things you people wouldn't believe. Attack ships o...,Win (1 of 4)
45.,2016-02-13 15:08:12,99.18,95%,How do I live without the ones I love? Time still turns the ...,Win (1 of 4)
44.,2016-02-13 15:06:40,70.81,83%,We were playing checkers. I used to kid her once in a while ...,Win (1 of 3)
43.,2016-02-13 15:04:36,71.60,87%,A problem in communication is that people don't smile enough...,Win (1 of 3)
42.,2016-02-13 15:02:09,93.68,94%,There is a theory which states that if anybody ever discover...,Win (1 of 3)
41.,2016-02-08 00:38:24,62.72,88%,"It turned out that the sweet-talking, tattoo-sporting pikey ...",No win (2 of 5)
40.,2016-02-08 00:37:21,73.64,88%,"When she returns to the forum page, her post is there. It is...",Win (1 of 5)
39.,2016-02-08 00:36:21,77.53,91%,"That day, for no particular reason, I decided to go for a li...",No win (2 of 5)
38.,2016-02-08 00:35:18,67.88,88%,"I was stealing saltshakers again. Ten, sometimes twelve a ni...",No win (2 of 4)
37.,2016-02-08 00:33:56,63.64,88%,Who has a safety deposit box full of money and six passports...,Win (1 of 5)
36.,2016-02-08 00:32:50,77.62,93%,"No matter how bad things are, you can always make things wor...",Win (1 of 5)
35.,2016-02-08 00:32:00,69.96,87%,"I'm so glad you came, I'm so glad you remembered, the walkin...",No win (3 of 5)
34.,2016-02-08 00:31:10,78.86,88%,The odds are that you will generally meet the worst of them....,No win (2 of 5)
33.,2016-02-08 00:18:08,77.55,89%,"I had a dream. There was our world, and the world was dark b...",No win (3 of 5)
32.,2016-02-08 00:16:59,61.07,87%,In 1873 the Sholes & Glidden Type Writer became the firs...,No win (3 of 4)
31.,2016-02-08 00:15:26,72.46,92%,"To some, the rules of etiquette may seem outdated, stuffy an...",Win (1 of 4)
30.,2016-02-08 00:14:22,68.06,89%,Don't make assumptions - find the courage to ask questions a...,No win (4 of 4)
29.,2016-02-08 00:13:21,61.57,86%,"Padre, these are subtleties! We are not concerned with motiv...",No win (2 of 3)
28.,2016-02-08 00:11:30,73.83,92%,I'm telling it like it is. Get used to it or put this book d...,No win (3 of 4)
27.,2016-02-08 00:10:17,68.61,85%,Come sail your ships around me and burn your bridges down. W...,No win (4 of 5)
26.,2016-02-08 00:05:31,69.99,92%,Many wines have more than 14 percent alcohol because the win...,No win (4 of 4)
25.,2016-02-08 00:03:46,64.39,85%,"No man is an island, entire of itself; every man is a piece ...",No win (4 of 5)
24.,2016-02-07 23:59:28,75.40,91%,I don't believe in painted roses or bleeding hearts while bu...,No win (3 of 4)
23.,2016-02-07 23:58:45,75.73,93%,Who has a safety deposit box full of money and six passports...,No win (2 of 4)
22.,2016-02-07 23:56:11,71.86,93%,Mac knew the score even if Aunt Ella didn't. Shot through th...,No win (2 of 4)
21.,2016-02-07 23:53:22,74.31,91%,As much money and life as you could want! The two things mos...,No win (4 of 5)
20.,2016-02-07 23:50:33,74.63,92%,Sometimes you concentrate more on racing the cars around you...,No win (4 of 5)
19.,2016-02-07 23:49:20,73.57,91%,"Every craft and every investigation, and likewise every acti...",No win (3 of 3)
18.,2016-02-07 23:47:56,77.29,94%,"Look, you should admit to yourself that Microsoft will miss ...",No win (2 of 5)
17.,2016-02-07 23:47:09,54.60,84%,"They had been given a sign - a powerful, lucid sign - that u...",No win (3 of 3)
16.,2016-02-07 23:45:29,76.24,90%,A freedom fighter learns the hard way that it is the oppress...,No win (2 of 5)
15.,2016-02-07 23:44:37,60.59,86%,"A zealot might be, for instance, an individual with a person...",No win (2 of 4)
14.,2016-02-07 23:43:20,74.32,91%,And when he rode past I seen he was carryin' fire in a horn ...,No win (2 of 2)
13.,2016-02-07 23:41:59,78.06,92%,"Look and think as far ahead as possible. Often, a driver's n...",No win (4 of 4)
12.,2016-02-07 23:39:57,71.81,88%,Space is big. Really big. You just won't believe how vastly ...,Win (1 of 4)
11.,2016-02-06 15:27:08,76.31,90%,We don't need no education. We don't need no thought control...,No win (4 of 5)
10.,2016-02-06 15:24:03,78.37,88%,Being able to quit things that don't work is integral to bei...,Win (1 of 3)
9.,2016-02-06 15:22:48,69.55,85%,"Every craft and every investigation, and likewise every acti...",No win (3 of 4)
8.,2016-02-06 15:21:10,60.08,86%,"Air-conditioned, odorless, illuminated by buzzing fluorescen...",No win (3 of 4)
7.,2016-02-06 15:19:28,72.77,90%,"My name is Turkish. Funny name for an Englishman, I know. My...",No win (2 of 5)
6.,2016-02-06 15:18:04,66.83,87%,"Don't practice too much at first, or you're likely to develo...",No win (4 of 5)
5.,2016-02-06 15:16:35,75.21,87%,"A sensitive and honest-minded man, if he's concerned about e...",No win (4 of 5)
4.,2016-02-06 15:15:08,73.87,90%,Had dreams. Two of 'em. Both had my father. It's peculiar. I...,Win (1 of 5)
3.,2016-02-06 15:13:19,72.07,85%,"And you know it's time to go, through the sleet and driving ...",No win (4 of 5)
2.,2016-02-06 15:12:15,70.22,83%,"Ticking away the moments that make up a dull day, you fritte...",No win (4 of 5)
