454.,2017-02-03 01:39:07,92.97,95%,What you gonna do with your man there? You're always gonna h...,No win (2 of 5)
453.,2017-02-03 01:36:04,97.20,93%,Yet the web of thought has no such creases and is more like ...,No win (2 of 5)
452.,2017-02-03 01:35:13,98.06,95%,"Hello, babies. Welcome to Earth. It's hot in the summer and ...",Win (1 of 3)
451.,2017-02-01 18:40:41,98.81,91%,I think if your clients want to sit on my shoulders and call...,No win (2 of 5)
450.,2017-02-01 18:39:31,102.20,93%,I wish that strife would vanish away from among gods and mor...,No win (2 of 5)
449.,2017-02-01 18:38:47,98.67,93%,"The fact that we live at the bottom of a deep gravity well, ...",Win (1 of 4)
448.,2017-02-01 18:36:39,83.71,87%,Now I want you to think and stop being a smart aleck. A man'...,No win (5 of 5)
447.,2017-02-01 18:35:44,93.61,91%,Convection also plays a minor role because of the relative t...,No win (2 of 5)
446.,2017-02-01 18:33:32,113.02,96%,We passionately long that there may be another life in which...,No win (2 of 3)
445.,2017-01-29 23:39:58,96.08,92%,It is by will alone I set my mind in motion. It is by the ju...,No win (2 of 2)
444.,2017-01-29 23:38:30,102.91,94%,"Precious are the dead that lie there, every stone over them ...",No win (2 of 3)
443.,2017-01-29 23:37:30,94.60,94%,A fellow will remember a lot of things you wouldn't think he...,Win (1 of 3)
442.,2017-01-29 23:34:34,104.71,95%,"I never wanted to become someone like him. So secure, conten...",No win (2 of 4)
441.,2017-01-29 23:32:52,98.91,91%,The place to improve the world is first in one's own heart a...,Win (1 of 3)
440.,2017-01-29 23:31:42,98.92,95%,Isn't everybody tired of the fighting? Isn't everybody tired...,Win (1 of 4)
439.,2017-01-29 23:10:56,100.21,93%,There was a time not that long ago when many drivers thought...,No win (2 of 4)
438.,2017-01-29 23:09:32,94.65,92%,It is no worse because I write of it. It would be no better ...,No win (2 of 4)
437.,2017-01-22 20:14:12,87.66,84%,"When we pulled out into the winter night and the real snow, ...",No win (4 of 4)
436.,2017-01-22 20:12:57,108.70,93%,Data is by definition easy to copy. And the Internet makes c...,No win (2 of 5)
435.,2017-01-19 23:41:21,98.52,92%,I am learning about twenty new Italian words a day. Where am...,No win (2 of 5)
434.,2017-01-19 23:40:35,84.52,90%,These contests provided ample opportunity to demonstrate the...,No win (2 of 5)
433.,2017-01-19 23:38:42,104.38,93%,Now I want you to think and stop being a smart aleck. A man'...,Win (1 of 4)
432.,2017-01-19 23:37:01,102.77,94%,"When you have children, you always have family. They will al...",No win (2 of 5)
431.,2017-01-19 23:35:36,84.90,87%,"Look, you should admit to yourself that Microsoft will miss ...",Win (1 of 5)
430.,2017-01-19 23:34:42,101.02,92%,"Let me tell you what's gonna happen, Officer Grimly. I'm goi...",Win (1 of 4)
429.,2017-01-19 23:33:51,89.18,89%,"I've seen it watching me, that misty thing without a face. I...",No win (2 of 5)
428.,2017-01-19 23:33:10,98.68,91%,This business is filled to the brim with unrealistic people ...,Win (1 of 3)
427.,2017-01-19 23:30:55,88.28,83%,I only lose my fear when I run. I won't lose a tear when I r...,No win (2 of 5)
426.,2017-01-19 23:30:11,102.38,93%,You know how far I'm prepared to go. I will be a boat and ro...,No win (2 of 5)
425.,2017-01-19 23:29:00,93.24,91%,"Brother, I'm not depressed and haven't lost spirit. Life eve...",Win (1 of 3)
424.,2017-01-19 23:27:04,84.97,92%,"And I am whatever you say I am. If I wasn't, then why would ...",No win (1 of 1)
423.,2017-01-19 23:26:02,99.38,93%,The man who pulls the lever that breaks your neck will be a ...,No win (2 of 4)
422.,2017-01-19 23:24:50,92.02,85%,Writing is hard work. A clear sentence is no accident. Very ...,No win (4 of 5)
421.,2017-01-19 23:23:29,102.06,93%,"Imagine a vast sheet of paper on which straight Lines, Trian...",No win (4 of 5)
420.,2017-01-19 23:15:19,90.09,86%,Caddy got the box and set it on the floor and opened it. It ...,Win (1 of 5)
419.,2017-01-19 23:13:26,89.33,90%,On other wavelengths there would probably be a lot still to ...,Win (1 of 5)
418.,2017-01-19 23:07:08,88.62,91%,"If you're ever feeling bored and aimless in a shopping mall,...",Win (1 of 2)
417.,2017-01-19 23:05:19,101.99,95%,For this is what it means to be a king: to be first in every...,No win (2 of 4)
416.,2017-01-19 23:04:36,107.59,97%,"That fear had been inside him for many years, it had lived w...",No win (2 of 4)
415.,2017-01-19 23:03:43,103.35,94%,"Above all, don't lie to yourself. The man who lies to himsel...",No win (2 of 5)
414.,2017-01-19 23:02:57,99.94,94%,"If I had been downright honest with myself, I would have see...",Win (1 of 5)
413.,2017-01-19 23:01:35,93.83,89%,There was a stage and a PA up in western Massachusetts and t...,No win (2 of 4)
412.,2017-01-19 23:00:39,106.93,95%,As much money and life as you could want! The two things mos...,No win (2 of 5)
411.,2017-01-19 23:00:07,100.23,94%,"I like them, I like them! I liked them first! Before I even ...",No win (3 of 4)
410.,2017-01-19 22:59:33,125.12,96%,I don't want to live someone else's idea of how to live. Don...,No win (2 of 4)
409.,2017-01-18 19:45:27,84.50,88%,You have lost your reason and taken the wrong path. You have...,No win (3 of 5)
408.,2017-01-18 19:40:31,93.79,90%,You have to wonder: how do the machines know what Tasty Whea...,No win (3 of 5)
407.,2017-01-18 19:38:33,101.26,92%,"We are going to die, and that makes us the lucky ones. Most ...",No win (3 of 5)
406.,2017-01-18 18:43:06,81.23,86%,"Now you might ask yourself, if by yourself you mean me, ""Ste...",Win (1 of 2)
405.,2017-01-18 18:42:06,92.21,93%,You gotta relax and stay calm in there. The cage is your hom...,No win (1 of 1)
404.,2017-01-18 18:38:58,96.28,92%,Alchemy: the science of understanding the structure of matte...,No win (2 of 5)
403.,2017-01-18 18:37:28,88.79,86%,"Did it matter then, she asked herself, walking towards bond ...",No win (3 of 5)
402.,2017-01-18 18:36:41,108.07,93%,Sometimes we get sad about things and we don't like to tell ...,Win (1 of 5)
401.,2017-01-18 18:36:02,85.74,87%,I've always wondered about this coat business. When I'm in a...,No win (2 of 5)
400.,2017-01-16 19:13:57,96.62,94%,"Perhaps I will die too, she told herself, and the thought di...",No win (4 of 5)
399.,2017-01-16 19:12:43,90.63,94%,Droll thing life is - that mysterious arrangement of mercile...,No win (3 of 5)
398.,2017-01-16 19:12:00,79.45,85%,Any finite number divided by infinity is as near to nothing ...,No win (4 of 4)
397.,2017-01-16 19:10:56,94.83,89%,Let me tell you why you're here. You're here because you kno...,No win (3 of 4)
396.,2017-01-16 19:09:57,96.68,89%,"Take care where you're going, doing all the things you do. E...",No win (2 of 5)
395.,2017-01-16 19:09:04,84.32,88%,The alternative to binge travel - the mini retirement - enta...,No win (3 of 4)
394.,2017-01-16 19:07:43,101.26,94%,"Right, I am going to tell you how this works. You're going i...",Win (1 of 5)
393.,2017-01-16 19:06:32,101.55,94%,"Vanity and pride are different things, though the words are ...",Win (1 of 4)
392.,2017-01-16 19:05:54,96.90,87%,We were the people who were not in the papers. We lived in t...,No win (3 of 5)
391.,2017-01-16 19:05:26,94.71,88%,I'm the most terrific liar you ever saw in your life. It's a...,Win (1 of 4)
390.,2017-01-16 19:04:53,98.41,93%,I know that you weren't bored that day because there was a l...,Win (1 of 4)
389.,2017-01-16 19:03:40,100.60,87%,The ultimate way to compose is to be able to keyboard as fas...,No win (2 of 3)
388.,2017-01-16 02:47:07,85.70,91%,The number of servings per day that is right for you depends...,No win (2 of 4)
387.,2017-01-16 02:46:02,106.56,98%,You've got a way to keep me on your side. You give me cause ...,Win (1 of 3)
386.,2017-01-16 02:43:53,88.61,92%,"A book, to me, is almost sacrosanct: such an individual and ...",No win (3 of 5)
385.,2017-01-16 02:42:49,94.42,94%,You have to wonder: how do the machines know what Tasty Whea...,Win (1 of 2)
384.,2017-01-16 02:40:37,96.59,93%,As much money and life as you could want! The two things mos...,No win (4 of 5)
383.,2017-01-13 00:04:40,96.93,94%,It is no worse because I write of it. It would be no better ...,No win (3 of 4)
382.,2017-01-13 00:02:26,105.59,92%,There is a theory which states that if anybody ever discover...,No win (3 of 4)
381.,2017-01-13 00:01:43,109.63,94%,Let me tell you why you're here. You're here because you kno...,No win (2 of 4)
380.,2017-01-12 23:57:50,95.19,96%,I have my books and my poetry to protect me; I am shielded i...,Win (1 of 4)
379.,2017-01-12 23:57:08,104.22,95%,"Out of my thoughts! You are part of my existence, part of my...",Win (1 of 2)
378.,2017-01-12 23:54:46,110.07,97%,And I don't believe in the existence of angels but looking a...,No win (2 of 5)
377.,2017-01-12 23:53:54,96.77,94%,"High on a stag the Goddess held her seat, and there were lit...",Win (1 of 5)
376.,2017-01-12 01:08:30,83.56,91%,Me? Not at all. Remember: I'll do the talking. You sit there...,No win (3 of 4)
375.,2017-01-12 01:07:42,101.32,96%,"Intrigued by that enigma, he dug so deeply into her sentimen...",Win (1 of 5)
374.,2017-01-12 01:07:03,93.55,93%,"This made me reflect, how vain an attempt it is for a man to...",No win (2 of 4)
373.,2017-01-12 01:03:05,93.20,92%,It is part of the human nature always to judge others very s...,Win (1 of 5)
372.,2017-01-12 01:02:27,96.24,95%,I'll be the number two guy here in about six weeks. How? Nam...,Win (1 of 2)
371.,2017-01-12 00:59:56,94.22,94%,"Everyone laughed and looked around, surprised to discover th...",Win (1 of 5)
370.,2016-12-14 18:59:15,85.01,88%,"Today, you people are no longer maggots. Today, you are Mari...",Win (1 of 2)
369.,2016-12-14 18:57:28,91.97,88%,Don't bother trying to explain your emotions. Live everythin...,Win (1 of 2)
368.,2016-12-14 18:55:54,107.70,94%,Writing is hard work. A clear sentence is no accident. Very ...,Win (1 of 2)
367.,2016-12-14 18:52:37,89.16,91%,Data is by definition easy to copy. And the Internet makes c...,Win (1 of 2)
366.,2016-12-14 18:49:51,93.63,91%,"When he utilizes combined energy, his fighting men become as...",Win (1 of 3)
365.,2016-12-14 18:48:26,25.79,88%,It is one thing to write as poet and another to write as a h...,No win (2 of 2)
364.,2016-12-14 14:51:35,84.43,91%,"I was shaking like a leaf, so without thinking I lit up a ci...",No win (3 of 4)
363.,2016-12-14 14:50:32,91.70,89%,Images of broken light which dance before me like a million ...,No win (4 of 5)
362.,2016-12-14 14:49:53,73.04,81%,"Hope you're feeling better now, hope you got my letter, how ...",No win (2 of 4)
361.,2016-12-14 14:48:52,83.30,87%,The man who pulls the lever that breaks your neck will be a ...,No win (4 of 5)
360.,2016-12-14 14:47:54,79.49,90%,"When things are going well with sales, profits, shareholder ...",No win (3 of 3)
359.,2016-12-14 14:47:08,86.03,92%,Since the 1980s virtually all the sodas and most of the frui...,No win (2 of 4)
358.,2016-12-09 00:55:18,99.96,94%,The most precious treasures we have in life are the images w...,Win (1 of 4)
357.,2016-12-09 00:54:31,82.90,87%,Achieving top performance in a programming contest or any ot...,No win (2 of 4)
356.,2016-12-09 00:50:08,85.02,89%,"Heaven knows we need never be ashamed of our tears, for they...",No win (2 of 5)
355.,2016-12-09 00:48:18,94.17,90%,As a manager you will also be able to control gravity. Sir I...,No win (2 of 5)
354.,2016-12-09 00:46:23,87.76,90%,I remember that I'm invisible and walk softly so as to not a...,No win (2 of 5)
353.,2016-12-09 00:40:07,82.64,88%,"I am always saying ""Glad to've met you"" to somebody I'm not ...",No win (2 of 2)
352.,2016-12-09 00:39:25,98.84,91%,"The less you do with the controls, the less chance of error....",No win (3 of 4)
351.,2016-12-09 00:38:38,98.17,94%,"The time I waited seemed endless, and I felt doubts and fear...",No win (2 of 5)
350.,2016-12-09 00:34:02,89.37,88%,Is it sweeter to exist only in the mind or to exist both in ...,No win (4 of 5)
349.,2016-12-09 00:29:06,83.86,92%,"By that point, entire sectors of my cerebral cortex seemed t...",No win (4 of 5)
348.,2016-12-09 00:28:14,107.80,95%,"I also thought about my wife, the most important person in m...",No win (2 of 4)
347.,2016-12-09 00:26:59,85.44,92%,It is always painful to part from people whom one has known ...,No win (3 of 4)
346.,2016-12-09 00:25:23,84.24,88%,Is this the real life? Is this just fantasy? Caught in a lan...,No win (3 of 5)
345.,2016-12-09 00:23:59,95.37,92%,It's the possibility of having a dream come true that makes ...,Win (1 of 3)
344.,2016-12-09 00:23:13,104.57,95%,I'll tell you a secret. Something they don't teach you in yo...,Win (1 of 4)
343.,2016-12-09 00:22:27,94.34,92%,There are two places on Earth that serve as canaries in the ...,No win (2 of 4)
342.,2016-12-09 00:19:29,97.48,91%,"All life's battles teach us something, even those we lose. W...",No win (2 of 5)
341.,2016-12-09 00:18:41,90.80,92%,I know that you weren't bored that day because there was a l...,Win (1 of 5)
340.,2016-12-07 21:54:50,91.14,90%,"Some pilots like the excitement of our missions, knowing tha...",No win (2 of 3)
339.,2016-12-07 21:52:43,122.32,98%,There is a theory which states that if anybody ever discover...,Win (1 of 3)
338.,2016-12-07 21:51:17,73.21,82%,"Radiation could be precisely determined, in principle, if we...",No win (2 of 3)
337.,2016-12-07 21:49:47,84.37,84%,"I had a job, I had a girl. I had something going, mister, in...",No win (2 of 2)
336.,2016-12-07 21:48:33,94.02,96%,"V: I can assure you, I mean you no harm. Evey: Who are you? ...",Win (1 of 2)
335.,2016-12-07 21:47:22,80.86,86%,I walked into the store. After the buzzing and booming of th...,Win (1 of 2)
334.,2016-12-07 21:46:06,77.30,81%,"I took her hand in mine, and we went out of the ruined place...",No win (2 of 2)
333.,2016-12-07 21:44:47,113.01,97%,You've got a way to keep me on your side. You give me cause ...,Win (1 of 2)
332.,2016-12-03 00:04:29,92.89,90%,"But the queen - too long she has suffered the pain of love, ...",Win (1 of 2)
331.,2016-12-03 00:03:14,90.63,92%,"One respondent said ""For women - a lot of games are crap - t...",Win (1 of 2)
330.,2016-12-03 00:01:59,107.71,92%,"If you don't get what you want, you suffer; if you get what ...",Win (1 of 2)
329.,2016-11-27 20:55:07,80.42,90%,The Swarms have crushed the meager human resistance and laid...,Win (1 of 2)
328.,2016-11-24 20:54:32,103.05,96%,"There is no physical separation after the slicing, so that e...",Win (1 of 2)
327.,2016-11-24 20:53:25,105.85,95%,We all know people who are very bright but who do not always...,Win (1 of 2)
326.,2016-11-24 20:52:24,90.69,89%,The pathology of setting a deadline to the earliest articula...,Win (1 of 2)
325.,2016-11-24 20:50:49,85.39,89%,"But pure, unadulterated feelings are dangerous in their own ...",Win (1 of 2)
324.,2016-11-24 20:48:37,76.51,88%,"The less you do with the controls, the less chance of error....",No win (2 of 2)
323.,2016-11-24 20:46:47,87.62,88%,"All at sea again, and now my hurricanes, have brought down t...",Win (1 of 2)
322.,2016-11-23 19:52:47,114.29,96%,"So, I guess we are who we are for a lot of reasons. And mayb...",Win (1 of 2)
321.,2016-11-23 19:50:14,92.76,90%,"Well, you've cracked the sky, scrapers fill the air, but wil...",Win (1 of 2)
320.,2016-11-23 19:49:06,92.22,91%,"You there, my friend. Come, let me hold you. Now, with a sig...",Win (1 of 2)
319.,2016-11-23 19:47:35,82.44,87%,"Mostly, I could tell, I made him feel uncomfortable. He didn...",Win (1 of 2)
318.,2016-11-23 19:46:05,91.39,93%,"They had been given a sign - a powerful, lucid sign - that u...",Win (1 of 2)
317.,2016-11-23 19:44:23,104.88,96%,The problem we now face is that this thin layer of atmospher...,Win (1 of 2)
316.,2016-11-23 19:42:59,79.32,86%,"Every life is in many days, day after day. We walk through o...",Win (1 of 2)
315.,2016-11-23 19:41:52,103.91,96%,The basis of the Aztecs' success in creating a great state a...,Win (1 of 2)
314.,2016-11-23 19:40:17,90.65,91%,"As customers of all races, nationalities, and cultures visit...",Win (1 of 2)
313.,2016-11-23 19:38:55,80.16,84%,"HAL, you have an enormous responsibility on this mission, in...",Win (1 of 2)
312.,2016-11-13 03:17:41,99.71,94%,There are but two types of men who desire war: those who hav...,Win (1 of 3)
311.,2016-11-13 03:04:51,89.02,92%,"There was me, that is Alex, and my three droogs, that is Pet...",Win (1 of 2)
310.,2016-11-09 19:06:40,83.29,89%,"At 211 degrees, water is hot. At 212 degrees, it boils. And ...",Win (1 of 2)
309.,2016-11-09 19:05:50,90.94,90%,Because some roads you shouldn't go down. Because maps used ...,No win (4 of 5)
308.,2016-11-09 19:05:14,94.28,91%,"That's Tommy. He tells people he was named after a gun, but ...",No win (3 of 4)
307.,2016-11-09 19:04:53,81.41,87%,"When I really worry about something, I don't just fool aroun...",No win (3 of 4)
306.,2016-11-09 19:04:15,73.55,82%,"I don't believe in an interventionist God, but I know, darli...",No win (5 of 5)
305.,2016-11-09 19:01:45,104.60,97%,I think if your clients want to sit on my shoulders and call...,Win (1 of 4)
304.,2016-10-21 00:15:09,94.54,94%,You've got a way to keep me on your side. You give me cause ...,No win (1 of 1)
303.,2016-10-21 00:14:34,88.40,90%,And then I hear the best thing to do is feed 'em to pigs. Yo...,No win (2 of 3)
302.,2016-10-21 00:12:43,82.33,89%,The development of a living body of literature became indica...,No win (2 of 4)
301.,2016-10-21 00:11:38,89.48,91%,"And, anyway, it's not about making money, it's about taking ...",No win (2 of 5)
300.,2016-10-21 00:10:00,85.26,90%,The men in the room suddenly realized that they didn't want ...,No win (4 of 5)
299.,2016-10-21 00:09:12,95.84,92%,There is a theory which states that if anybody ever discover...,Win (1 of 5)
298.,2016-10-21 00:07:41,96.07,92%,"When you are typing on a typewriter, your input appears dire...",No win (2 of 5)
297.,2016-10-21 00:05:46,103.29,94%,"All life's battles teach us something, even those we lose. W...",No win (2 of 5)
296.,2016-10-21 00:04:10,90.49,89%,"Many people limit themselves to leading boring, dull lives b...",No win (2 of 5)
295.,2016-10-21 00:03:15,88.90,90%,"The time I waited seemed endless, and I felt doubts and fear...",No win (3 of 5)
294.,2016-10-21 00:02:39,92.77,94%,"One respondent said ""For women - a lot of games are crap - t...",Win (1 of 3)
293.,2016-10-21 00:01:59,99.11,93%,"In the ninja world, those who break the rules are scum, that...",Win (1 of 5)
292.,2016-10-21 00:01:29,99.45,95%,I will need my spectacles and a clear head. Today I broke my...,Win (1 of 3)
291.,2016-10-19 23:40:20,73.50,88%,"Prior to the 1970's, because the United States had long been...",Win (1 of 2)
290.,2016-10-19 23:38:43,79.90,88%,"In general, many of these targets are easier marks if you ar...",No win (2 of 2)
289.,2016-10-19 23:37:06,81.85,88%,"We are being watched. The government has a secret system, a ...",Win (1 of 2)
288.,2016-10-19 23:35:37,89.03,90%,"The brain can be a tool. It can recall phone numbers, solve ...",No win (2 of 2)
287.,2016-10-13 15:58:14,88.75,89%,The ultimate way to compose is to be able to keyboard as fas...,No win (3 of 4)
286.,2016-10-13 15:54:36,88.40,88%,"As happens sometimes, a moment settled and hovered and remai...",No win (2 of 2)
285.,2016-10-13 15:53:12,88.43,90%,Wrongfully imprisoned action heroes rarely have the time to ...,No win (3 of 5)
284.,2016-10-13 15:50:06,94.53,91%,"The only people for me are the mad ones, the ones who are ma...",No win (3 of 5)
283.,2016-10-13 15:48:09,100.42,93%,Remember before when I was talking about smelly garbage stan...,No win (2 of 5)
282.,2016-09-26 02:30:48,80.31,88%,"Imagine considering ""if"" as a two-finger movement instead of...",No win (3 of 3)
281.,2016-09-16 00:55:50,92.91,94%,Antoon used to import paint cans. That's simply too expensiv...,No win (2 of 4)
280.,2016-09-16 00:55:00,88.87,90%,"That day, for no particular reason, I decided to go for a li...",Win (1 of 4)
279.,2016-09-08 22:10:23,94.20,93%,Don't make assumptions - find the courage to ask questions a...,No win (2 of 5)
278.,2016-09-08 22:09:29,96.66,89%,Let me tell you why you're here. You're here because you kno...,No win (4 of 5)
277.,2016-09-08 22:08:19,90.44,91%,Corn is what feeds the steer that becomes the steak. Corn fe...,Win (1 of 4)
276.,2016-09-08 22:06:48,90.31,89%,"I had a job, I had a girl. I had something going, mister, in...",Win (1 of 5)
275.,2016-09-08 22:05:51,91.51,89%,I said that I would see you because I had heard that you wer...,No win (2 of 5)
274.,2016-09-08 22:04:28,95.66,91%,Imagine for a moment if we once again knew these few unremar...,No win (3 of 5)
273.,2016-08-30 21:38:22,102.90,97%,"Let me put it this way, Mr. Amor. The 9000 series is the mos...",No win (2 of 4)
272.,2016-08-30 21:36:55,90.21,93%,"""This man right here,"" McGuinness said, pointing at Kenna, ""...",No win (2 of 3)
271.,2016-08-29 22:03:39,92.00,90%,"It was a marvelous night, the sort of night one only experie...",No win (3 of 3)
270.,2016-08-29 22:02:54,86.47,90%,The problem we now face is that this thin layer of atmospher...,Win (1 of 5)
269.,2016-08-29 22:01:27,101.68,96%,"In the casino, the cardinal rule is to keep them playing and...",Win (1 of 5)
268.,2016-08-29 22:00:44,91.79,90%,Come sail your ships around me and burn your bridges down. W...,No win (5 of 5)
267.,2016-08-29 21:59:18,96.68,92%,But if in efficient causes it is possible to go on to infini...,Win (1 of 4)
266.,2016-08-29 21:40:57,84.70,89%,"If I leave here tomorrow, would you still remember me? For I...",Win (1 of 5)
265.,2016-08-29 21:40:02,81.42,86%,This business is filled to the brim with unrealistic people ...,No win (4 of 4)
264.,2016-08-29 21:38:50,81.79,90%,Parisian French is different from Provincial French and Germ...,No win (2 of 2)
263.,2016-08-29 21:38:04,94.95,93%,"All life's battles teach us something, even those we lose. W...",No win (2 of 4)
262.,2016-08-29 21:37:07,90.20,86%,"Ticking away the moments that make up a dull day, you fritte...",No win (4 of 5)
261.,2016-08-29 21:36:22,110.06,97%,Writing is hard work. A clear sentence is no accident. Very ...,Win (1 of 5)
260.,2016-08-29 21:35:42,80.65,87%,"Yeah, you just take Soupy-Sales to prom 'cause I can think o...",No win (2 of 4)
259.,2016-08-29 21:34:42,96.72,94%,"My name is Turkish. Funny name for an Englishman, I know. My...",Win (1 of 5)
258.,2016-08-29 21:33:48,101.47,93%,Good games offer players a set of challenging problems and t...,No win (2 of 5)
257.,2016-08-29 21:33:16,91.11,88%,"My mom, especially, challenged us on everything. She'd use w...",No win (2 of 5)
256.,2016-08-29 19:25:31,89.75,90%,"Take care where you're going, doing all the things you do. E...",Win (1 of 5)
255.,2016-08-26 01:49:28,72.67,82%,"I was hugely impressed. Kirk, I mean Shatner, was the ultima...",No win (2 of 2)
254.,2016-08-26 01:48:36,78.29,91%,"They had been given a sign - a powerful, lucid sign - that u...",No win (3 of 5)
253.,2016-08-26 01:47:22,80.16,87%,"My friend, I shall be pedagogic, and say you ought to start ...",No win (4 of 5)
252.,2016-08-26 01:46:17,76.78,85%,A glooming peace this morning with it brings. The sun for so...,No win (2 of 3)
251.,2016-08-26 01:43:56,70.34,82%,"Trudging slowly over wet sand, back to the bench where your ...",No win (4 of 4)
250.,2016-08-26 01:43:12,77.02,86%,I've been thinking lots about my life and how quick I'd wash...,Win (1 of 5)
249.,2016-08-26 01:42:23,69.05,91%,"An essential characteristic of the superhero mythology is, t...",No win (2 of 3)
248.,2016-08-26 01:39:39,91.27,86%,Remember that humor is written backwards. That means you fir...,Win (1 of 4)
247.,2016-08-26 01:39:11,89.28,94%,"The brain can be a tool. It can recall phone numbers, solve ...",Win (1 of 5)
246.,2016-08-26 01:38:04,89.95,91%,Sometimes you concentrate more on racing the cars around you...,No win (2 of 3)
245.,2016-08-26 01:37:02,83.91,87%,"Let's sort the buyers from the spiers, the needy from the gr...",No win (2 of 3)
244.,2016-08-26 01:36:14,78.30,87%,"You think cooking is a cute job, huh? Like mommy in the kitc...",No win (3 of 5)
243.,2016-08-26 01:35:07,86.20,91%,The odds are that you will generally meet the worst of them....,No win (3 of 5)
242.,2016-08-26 01:34:22,66.59,82%,These contests provided ample opportunity to demonstrate the...,No win (3 of 5)
241.,2016-08-26 01:33:00,74.74,90%,"In the English language, swearing is essential to effective ...",No win (4 of 5)
240.,2016-08-26 01:32:16,87.41,90%,And I will strike down upon thee with great vengeance and fu...,No win (2 of 4)
239.,2016-08-26 01:30:56,80.93,89%,"Often, we assume that a familiar situation will be but a rep...",No win (2 of 4)
238.,2016-08-26 01:30:12,78.13,85%,And I don't believe in the existence of angels but looking a...,No win (4 of 5)
237.,2016-08-26 01:29:11,103.89,97%,"No matter how bad things are, you can always make things wor...",Win (1 of 5)
236.,2016-08-26 01:28:36,82.69,89%,I am fundamentally an optimist. Whether that comes from natu...,No win (3 of 5)
235.,2016-08-26 01:27:32,81.40,91%,"Listen up, maggots. You are not special. You are not a beaut...",Win (1 of 5)
234.,2016-08-26 01:26:57,78.58,88%,We don't need no education. We don't need no thought control...,No win (4 of 5)
233.,2016-08-26 01:26:06,72.69,84%,"Hello, babies. Welcome to Earth. It's hot in the summer and ...",No win (5 of 5)
232.,2016-08-26 01:25:27,91.78,94%,At first they had tried to keep the finding quiet. After all...,No win (2 of 5)
231.,2016-08-26 01:24:24,97.65,93%,There comes a point when you just love someone. Not because ...,No win (3 of 3)
230.,2016-08-26 01:23:21,80.69,87%,Music finds a comfortable parallel with that of human langua...,Win (1 of 5)
229.,2016-08-26 01:20:31,84.71,92%,Is this the real life? Is this just fantasy? Caught in a lan...,No win (3 of 5)
