904.,2018-03-11 18:19:33,108.09,97%,They burned the flag and they demonstrated against us; it's ...,No win (2 of 4)
903.,2018-03-11 18:17:57,115.50,98%,Sometimes you concentrate more on racing the cars around you...,No win (2 of 3)
902.,2018-03-11 18:17:09,99.25,96%,"Salvation must grow out of understanding, total understandin...",No win (2 of 3)
901.,2018-02-27 03:26:05,124.91,100%,"I've seen it watching me, that misty thing without a face. I...",Win (1 of 5)
900.,2018-02-26 15:31:38,97.53,96%,"The last thing he said to me, ""Doc,"" he said, ""some time whe...",No win (2 of 4)
899.,2018-02-26 15:30:37,94.81,95%,Just sleep together in the most innocent sense of the phrase...,No win (3 of 5)
898.,2018-02-26 15:29:40,104.49,97%,"I just finished this fascinating book. By the year 2030, the...",No win (2 of 5)
897.,2018-02-26 15:28:57,94.67,96%,"How I love to watch the morn, with golden sun that shines. U...",No win (2 of 5)
896.,2018-02-26 15:28:05,115.05,97%,You forget everything. The hours slip by. You travel in your...,Win (1 of 5)
895.,2018-02-26 15:25:48,108.73,97%,It was one of those March days when the sun shines hot and t...,No win (3 of 5)
894.,2018-02-26 15:25:20,107.98,97%,"My name is Turkish. Funny name for an Englishman, I know. My...",No win (3 of 5)
893.,2018-02-26 15:24:48,101.07,97%,Late in the afternoon of a day in the early part of last Dec...,No win (4 of 5)
892.,2018-02-26 15:23:30,108.94,96%,In the middle of our life journey I found myself in a dark w...,No win (2 of 5)
891.,2018-02-26 15:22:48,99.46,96%,Did those words sound ominous to anyone else? Jonah looked a...,Win (1 of 4)
890.,2018-02-26 15:22:16,109.90,97%,I don't know what the world may need but a V-8 engine's a go...,No win (2 of 3)
889.,2018-02-26 15:21:40,102.11,98%,"""Pearl Harbor"" is a two-hour movie squeezed into three hours...",Win (1 of 5)
888.,2018-02-26 15:20:36,104.79,98%,There's a simplicity to war: Attacking is the only secret. D...,No win (4 of 4)
887.,2018-02-26 15:20:04,104.45,97%,"This tree is our symbol. Our affirmation of life, and everyo...",No win (3 of 5)
886.,2018-02-26 15:19:30,106.23,96%,Let's hold it down. The only engine we got with enough power...,No win (3 of 5)
885.,2018-02-26 15:17:47,105.56,96%,"We deal in illusions, man! None of it is true! But you peopl...",Win (1 of 4)
884.,2018-02-26 15:16:38,108.95,96%,No I'm not. I'm not the best version of me. I love being The...,Win (1 of 3)
883.,2018-02-26 15:16:03,99.15,96%,"Whenever I despair, I remember that the way of truth and lov...",Win (1 of 5)
882.,2018-02-26 15:15:26,100.15,96%,Finish each day and be done with it. You have done what you ...,Win (1 of 5)
881.,2018-02-26 15:14:05,98.10,96%,"You've beaten my giant, which means you're exceptionally str...",No win (2 of 3)
880.,2018-02-26 15:12:56,103.47,97%,Corn is what feeds the steer that becomes the steak. Corn fe...,No win (3 of 5)
879.,2018-02-26 15:10:59,96.13,95%,As the United States assumed greater status as a power in wo...,No win (3 of 5)
878.,2018-02-25 14:27:29,83.69,95%,"Beneath the commonwealth, there is a cancer known as the ins...",No win (2 of 4)
877.,2018-02-25 14:26:33,94.57,96%,"Very well - I'll bide my time. And as for you, my fine lady,...",Win (1 of 3)
876.,2018-02-25 14:25:13,124.85,97%,"People won't be people when you hear this sound, that's been...",Win (1 of 5)
875.,2018-02-25 14:23:58,96.01,96%,Most Americans do not own passports. They're not a naturally...,Win (1 of 4)
874.,2018-02-25 14:22:55,92.57,98%,"As to your dead guy, occupational hazard. Drug dealer gettin...",No win (2 of 5)
873.,2018-02-25 14:18:59,110.89,97%,Unknown (#3641013),Win (1 of 2)
872.,2018-02-25 14:11:29,115.79,97%,"Adios rock band that we loved the most, this is a toast to w...",Win (1 of 5)
871.,2018-02-25 14:10:50,119.61,99%,"Salvation must grow out of understanding, total understandin...",Win (1 of 4)
870.,2018-02-25 14:07:28,91.42,93%,"Surprisingly, the Triforce created this world to fulfill Gan...",No win (3 of 5)
869.,2018-02-25 14:00:47,116.18,98%,Finding a way into a criminal organization is about observin...,Win (1 of 5)
868.,2018-02-25 13:58:20,86.35,96%,This hole was caused by some kind of explosive. Pretty power...,No win (3 of 3)
867.,2018-02-25 13:57:37,104.11,97%,"A little bit of Monica in my life, a little bit of Erica by ...",No win (2 of 5)
866.,2018-02-25 13:56:48,109.03,97%,"Even if there is only one possible unified theory, it is jus...",No win (2 of 3)
865.,2018-02-25 13:54:43,119.75,98%,"I guess this is just another lost cause, Mr. Paine. All you ...",No win (2 of 3)
864.,2018-02-25 13:53:52,117.98,99%,"I'll make him an offer he can't refuse. You see, Johnny, we ...",No win (2 of 5)
863.,2018-02-25 13:51:27,111.31,97%,"I'm so in love with you. And I hope you know, darling, your ...",No win (2 of 4)
862.,2018-02-25 13:50:54,112.26,98%,Resistance is the measurement of the ability of electrons to...,No win (2 of 5)
861.,2018-02-25 13:49:54,112.82,97%,What's in your eyes 'cause they talk to me. They know how to...,No win (2 of 5)
860.,2018-02-25 13:48:00,110.85,98%,"Beta flecks, another type of imperfection, are small regions...",Win (1 of 4)
859.,2018-02-24 23:03:41,120.51,99%,Give me a lifetime of promises and a world of dreams. Speak ...,Win (1 of 5)
858.,2018-02-24 23:00:26,106.07,97%,"You know, at one time I used to break into pet shops to libe...",Win (1 of 4)
857.,2018-02-24 22:58:30,92.57,94%,"The world is indeed full of peril, and in it there are many ...",No win (5 of 5)
856.,2018-02-21 16:45:40,93.01,96%,"""Exactly,"" said Dumbledore, beaming once more. ""Which makes ...",Win (1 of 2)
855.,2018-02-21 16:41:37,107.12,98%,"Hi, and welcome to the future. San Dimas, California, 2688. ...",Win (1 of 2)
854.,2018-02-21 16:37:39,100.26,97%,"Kryten: Sir, I just can't eat any more raw coffee. Lister: [...",Win (1 of 4)
853.,2018-02-21 16:36:28,114.27,99%,The basis of the Aztecs' success in creating a great state a...,Win (1 of 5)
852.,2018-02-21 16:35:41,111.25,97%,Tables. Tables are made so a person can sit down and do some...,Win (1 of 3)
851.,2018-02-21 16:32:17,119.77,98%,And then he calls me a jerk and says the last guy who though...,Win (1 of 5)
850.,2018-02-21 16:31:38,112.66,97%,"Purity in body and heart may please some - as for me, I make...",Win (1 of 4)
849.,2018-02-21 16:30:10,123.84,100%,"On recovering my senses, I hastened to quit a place where I ...",Win (1 of 5)
848.,2018-02-21 16:29:34,106.66,97%,"A zealot might be, for instance, an individual with a person...",Win (1 of 3)
847.,2018-02-21 16:26:22,121.63,98%,"Well, you see, that's another reason I can't help you catch ...",Win (1 of 3)
846.,2018-02-21 16:25:20,109.29,98%,I was having this awful nightmare that I was 32. And then I ...,Win (1 of 5)
845.,2018-02-21 16:24:50,104.44,97%,"This is a little ridiculous. Okay, so he kills a deer, he ta...",Win (1 of 4)
844.,2018-02-21 16:24:08,110.66,97%,The pig-run kept close to the jumble of rocks that lay down ...,No win (2 of 5)
843.,2018-02-21 16:22:45,118.07,97%,"The rest of my attention is back at the offices of Facebook,...",No win (2 of 5)
842.,2018-02-21 16:21:26,116.82,98%,"Like most North Americans of his generation, Hal tends to kn...",No win (2 of 4)
841.,2018-02-21 16:20:42,109.88,97%,It's really hard to do nothing totally. Even just sitting he...,Win (1 of 5)
840.,2018-02-21 16:19:44,125.77,99%,The only thing that burns in hell is the part of you that wo...,Win (1 of 5)
839.,2018-02-20 12:49:59,107.04,97%,Your bill is ready. You take it over there and you introduce...,Win (1 of 4)
838.,2018-02-16 22:54:19,99.67,96%,We sat and drank with the sun on our shoulders and felt like...,No win (3 of 5)
837.,2018-02-16 22:52:37,107.01,96%,I love bagels even though they are one of mankind's most dan...,No win (3 of 5)
836.,2018-02-16 22:51:55,103.03,96%,Well I watch you tangle every weekend. It might start differ...,No win (3 of 5)
835.,2018-02-16 22:50:10,103.39,97%,To my babies: stay strong. Daddy will be home soon. And to t...,No win (2 of 5)
834.,2018-02-16 22:49:26,104.16,96%,"She can lead you to love, she can take you or leave you, she...",No win (3 of 5)
833.,2018-02-16 22:48:47,123.37,98%,"One man, one family driven from the land; this rusty car cre...",No win (2 of 2)
832.,2018-02-16 22:47:10,116.63,98%,"Last thing I remember, I was running for the door, I had to ...",Win (1 of 4)
831.,2018-02-16 22:46:10,127.62,99%,There are many things that I would like to say to you but I ...,No win (2 of 5)
830.,2018-02-16 22:45:55,104.24,97%,Because you taught yourself how to run your little fingers o...,No win (2 of 4)
829.,2018-02-16 19:44:08,99.29,97%,"You know, Einstein was not only brilliant, he had a great se...",No win (2 of 5)
828.,2018-02-16 19:40:37,89.97,96%,"Vincent, Mr. Joe Zasa now owns what used to be the Corleone ...",Win (1 of 4)
827.,2018-02-16 19:34:12,107.48,96%,"In short, our gentleman became so caught up in reading that ...",Win (1 of 4)
826.,2018-02-16 19:33:17,100.94,96%,A good plan today is better than a perfect plan tomorrow.,Win (1 of 5)
825.,2018-02-16 19:06:04,96.50,97%,"The rooster stared back at me, his power and confidence almo...",No win (2 of 5)
824.,2018-02-16 19:04:12,116.32,99%,"According to all known laws of aviation, there is no way tha...",Win (1 of 5)
823.,2018-02-16 19:03:34,102.90,98%,You say: I am not free. But I have raised and lowered my arm...,Win (1 of 5)
822.,2018-02-16 19:03:02,102.65,97%,Yes. Everyone at Harvard's inventing something. Harvard unde...,Win (1 of 4)
821.,2018-02-16 19:02:25,97.97,96%,I want to defeat the me that's dragging this failure around....,Win (1 of 2)
820.,2018-02-16 19:01:50,97.60,97%,"Well, technology is a glittering lure. But there is a rare o...",Win (1 of 4)
819.,2018-02-16 18:55:49,114.91,98%,Many introverted hackers who are next to inarticulate in per...,Win (1 of 4)
818.,2018-02-16 18:55:05,104.90,97%,"One mile to the west, Emerson Cod was also not thrilled. Dur...",No win (2 of 4)
817.,2018-02-16 18:54:30,96.35,96%,Do you know I've been sitting here thinking to myself: that ...,Win (1 of 4)
816.,2018-02-16 18:08:01,117.47,97%,"I was once like you are now, and I know that it's not easy t...",No win (2 of 5)
815.,2018-02-16 18:07:16,104.04,96%,"Living men are bound by time... Thus, their lives have an ur...",No win (2 of 4)
814.,2018-02-08 16:55:44,109.42,97%,"I used to think she was quite intelligent, in my stupidity. ...",No win (3 of 4)
813.,2018-02-08 16:55:03,88.63,95%,No one could figure out how I coaxed such hearty flavor out ...,No win (3 of 4)
812.,2018-02-08 16:52:12,105.18,97%,"I feel the Aryan in my blood, it's scarier than a blood. Bee...",No win (3 of 5)
811.,2018-02-08 16:51:27,110.95,97%,You can tell me that your dog ran away then tell me that it ...,No win (2 of 4)
810.,2018-02-08 16:50:22,114.84,98%,You don't think I'd sacrifice this one? Let me explain somet...,Win (1 of 4)
809.,2018-02-08 16:49:33,90.74,95%,I must not fear. Fear is the mind killer. Fear is the little...,No win (2 of 3)
808.,2018-02-08 16:48:42,108.56,97%,"Good games stay within, but at the outer edge, of the player...",No win (2 of 5)
807.,2018-02-04 18:53:45,116.55,97%,I want to play a game. Let's play hide and seek. Those were ...,Win (1 of 3)
806.,2018-02-04 18:51:09,109.90,98%,"I search the faces of the gods... for ways to please you, to...",No win (3 of 5)
805.,2018-02-04 18:50:21,103.72,97%,"Whether you're a student, secretary, office administrator, m...",Win (1 of 5)
804.,2018-02-04 18:49:03,107.29,98%,Today I don't feel like doing anything. I just wanna lay in ...,Win (1 of 3)
803.,2018-02-04 18:48:36,104.21,97%,Is that what your little note says? It must be hard living y...,No win (3 of 5)
802.,2018-02-04 18:42:55,111.26,98%,A really efficient totalitarian state would be one in which ...,No win (3 of 4)
801.,2018-02-04 18:40:51,117.62,96%,"Look, there's only one thing worse than being a loser. It's ...",Win (1 of 5)
800.,2018-02-04 18:33:48,105.94,96%,"I am invisible, understand, simply because people refuse to ...",No win (3 of 5)
799.,2018-02-04 18:32:55,93.52,96%,"Two households, both alike in dignity (in fair Verona, where...",No win (4 of 5)
798.,2018-02-04 18:31:47,115.93,96%,Let me tell you why you're here. You're here because you kno...,Win (1 of 2)
797.,2018-02-04 18:30:54,115.05,97%,I don't want you to think of this as just a film - some proc...,Win (1 of 5)
796.,2018-02-04 18:29:58,109.96,96%,I have been told of a certain sea snake which has a very unu...,No win (2 of 4)
795.,2018-01-30 21:30:31,141.83,99%,We look not at the things which are what you would call seen...,Win (1 of 5)
794.,2018-01-30 21:29:57,103.55,98%,"She was probably my age, maybe a couple of inches taller, an...",Win (1 of 5)
793.,2018-01-30 21:27:12,108.55,97%,We sit silently and watch the world around us. This has take...,Win (1 of 3)
792.,2018-01-30 21:26:13,101.46,96%,So can we be friends sweetly before the mystery ends? I love...,Win (1 of 5)
791.,2018-01-30 21:25:37,115.53,97%,"I only see my goals, I don't believe in failure 'cause I kno...",No win (2 of 5)
790.,2018-01-30 21:24:20,106.16,98%,It is tragic and sad and chaotic and lovely. All life is the...,Win (1 of 5)
789.,2018-01-30 21:23:42,104.81,97%,"I'll have two number 9s, a number 9 large, a number 6 with e...",Win (1 of 5)
788.,2018-01-30 21:23:01,105.65,95%,"When you're dead, they really fix you up. I hope to hell whe...",No win (2 of 5)
787.,2018-01-30 21:22:09,108.49,98%,"Ever since the dawn of civilization, people have not been co...",No win (2 of 5)
786.,2018-01-30 21:17:45,121.66,98%,"So much of this story is about human will, about what we can...",No win (2 of 4)
785.,2018-01-30 21:16:42,103.14,95%,I have no idea to this day what those two Italian ladies wer...,No win (4 of 5)
784.,2018-01-28 20:55:44,102.92,98%,"I'll have two number 9s, a number 9 large, a number 6 with e...",No win (1 of 1)
783.,2018-01-17 23:52:51,101.08,97%,"I'm so in love with you. And I hope you know, darling, your ...",Win (1 of 4)
782.,2018-01-17 23:51:07,96.17,96%,"She was a genius of sadness, immersing herself in it, separa...",Win (1 of 4)
781.,2018-01-16 02:46:44,93.17,95%,"You know, certain words and phrases just keep drifting throu...",No win (2 of 2)
780.,2018-01-16 02:45:53,117.55,98%,"Yes, there were times, I'm sure you knew, when I bit off mor...",Win (1 of 3)
779.,2018-01-16 02:40:13,91.78,95%,"Summer's going fast, nights growing colder. Children growing...",No win (2 of 4)
778.,2018-01-16 00:04:15,106.43,98%,"Raised the ol' girl from a cub, I did. ... 'Course we had to...",No win (3 of 5)
777.,2018-01-16 00:02:32,96.52,97%,"Why would a Wookiee, an 8-foot-tall Wookiee, want to live on...",Win (1 of 4)
776.,2018-01-16 00:00:43,108.84,96%,"For me, Halloween is the best holiday in the world. It even ...",No win (3 of 3)
775.,2018-01-15 15:55:33,103.45,98%,The Sky People have sent us a message that they can take wha...,Win (1 of 4)
774.,2018-01-15 15:54:48,108.97,96%,"Anything high-tech, you can break into. With a radio, you ca...",No win (2 of 4)
773.,2018-01-15 15:53:54,99.72,96%,"Intrigued by that enigma, he dug so deeply into her sentimen...",No win (2 of 5)
772.,2018-01-15 15:53:16,108.71,98%,In any new job there's always friction with your coworkers. ...,Win (1 of 4)
771.,2018-01-15 15:52:34,111.01,97%,You think the dead we loved ever truly leave us? You think t...,Win (1 of 5)
770.,2018-01-15 15:49:56,116.05,98%,Groups of illegal miners smuggle themselves down in freight ...,Win (1 of 5)
769.,2018-01-15 15:48:56,104.35,97%,"A long time ago, I can still remember how that music used to...",No win (2 of 5)
768.,2018-01-08 00:36:48,102.93,97%,"Never forget what you are, for surely the world will not. Ma...",No win (4 of 4)
767.,2018-01-01 21:39:26,89.63,95%,Lucid but wholly false recollections can easily be induced b...,Win (1 of 4)
766.,2018-01-01 21:38:29,101.39,96%,"When you type faster than usual, it forces you to start look...",No win (2 of 5)
765.,2018-01-01 21:34:59,96.70,96%,"Come on, all the long distance lines are down? What about th...",Win (1 of 3)
764.,2018-01-01 00:40:14,87.48,97%,Welcome to Havana. Smoking Cubanos with Castro in cabanas. V...,Win (1 of 4)
763.,2018-01-01 00:26:39,107.42,98%,"At that time, I often thought that if I had had to live in t...",No win (2 of 5)
762.,2018-01-01 00:25:13,106.65,97%,"According to all known laws of aviation, there is no way tha...",No win (2 of 5)
761.,2018-01-01 00:20:28,103.45,97%,"I cast my vote, perchance, as I think right; but I am not vi...",Win (1 of 5)
760.,2018-01-01 00:17:25,101.10,97%,"The sea was angry that day, my friends - like an old man try...",Win (1 of 2)
759.,2018-01-01 00:15:46,109.31,98%,"Every morning when he'd come to pick you up, I would look fo...",No win (3 of 4)
758.,2018-01-01 00:13:51,99.46,96%,"Let folly be our cloak, a veil before the eyes of the Enemy!...",No win (1 of 1)
757.,2018-01-01 00:12:38,95.55,99%,"Oh, supercalifragilisticexpialidocious! Even though the soun...",Win (1 of 4)
756.,2018-01-01 00:11:56,101.55,97%,"Raised the ol' girl from a cub, I did. ... 'Course we had to...",No win (2 of 4)
755.,2018-01-01 00:11:13,116.18,98%,"It's been a hard day's night, and I'd been working like a do...",Win (1 of 3)
754.,2018-01-01 00:08:18,104.84,96%,You know what I'd like to be? A cartoon of some kind. You kn...,No win (2 of 4)
753.,2018-01-01 00:07:36,105.89,96%,You can tell me that your dog ran away then tell me that it ...,Win (1 of 5)
752.,2018-01-01 00:06:16,105.97,97%,I don't know who you are. I don't know what you want. If you...,No win (2 of 4)
751.,2018-01-01 00:05:12,97.29,95%,Vigorous writing is concise. A sentence should contain no un...,No win (3 of 4)
750.,2018-01-01 00:01:22,102.51,97%,"Why so much grief for me? No man will hurl me down to Death,...",No win (3 of 3)
749.,2018-01-01 00:00:09,117.46,99%,"Look and think as far ahead as possible. Often, a driver's n...",No win (2 of 4)
748.,2017-12-31 23:59:28,113.50,98%,You've undoubtedly noticed how some authors go to so much tr...,Win (1 of 3)
747.,2017-12-31 23:57:40,102.72,98%,"You see, I feel sorrier for you than I do for him. Because y...",Win (1 of 3)
746.,2017-12-31 23:53:28,110.16,97%,It was hard to toss things I had once thought were valuable ...,Win (1 of 2)
745.,2017-12-31 23:52:10,117.75,99%,"Oh, it doesn't matter what they say in the papers 'cause it'...",No win (3 of 5)
744.,2017-12-31 23:51:38,102.71,97%,"I see trees of green, red roses too, I see them bloom for me...",No win (2 of 3)
743.,2017-12-31 23:50:40,112.44,97%,"So much of this story is about human will, about what we can...",No win (2 of 5)
742.,2017-12-31 23:50:01,117.13,98%,"I would rather not have upset him, but I couldn't see any re...",No win (2 of 3)
741.,2017-12-31 23:49:13,105.81,98%,For it is not enough to have a good mind; the main thing is ...,Win (1 of 3)
740.,2017-12-31 19:53:25,116.91,97%,"Look at the stars. Same stars as last week, last year, when ...",Win (1 of 5)
739.,2017-12-31 18:22:36,97.66,96%,"The amusing thing about this, it's all a big mistake. That p...",Win (1 of 4)
738.,2017-12-31 18:21:12,93.18,96%,I don't know what the world may need but a V-8 engine's a go...,No win (1 of 1)
737.,2017-12-31 18:18:13,103.61,97%,I'm the most terrific liar you ever saw in your life. It's a...,No win (4 of 4)
736.,2017-12-31 18:15:31,102.33,97%,"Unjust laws exist: shall we be content to obey them, or shal...",No win (2 of 4)
735.,2017-12-31 18:14:17,99.22,96%,"And the great owners, who must lose their land in an upheava...",Win (1 of 5)
734.,2017-12-31 18:13:22,95.92,96%,"Well, I'm no poet, but I can't be fooled. The lies don't cou...",No win (3 of 5)
733.,2017-12-31 18:06:47,84.31,95%,"I'm a Barbie girl, in a Barbie world. Life in plastic, it's ...",No win (2 of 4)
732.,2017-12-31 18:06:11,112.88,98%,I hate all the rules and organization and teams and ranks in...,Win (1 of 3)
731.,2017-12-31 18:05:24,125.09,97%,So you run and you run to catch up with the sun but it's sin...,No win (2 of 5)
730.,2017-12-31 18:04:53,111.25,98%,"The first time I made coffee for just myself, I made too muc...",No win (2 of 4)
729.,2017-12-31 18:04:16,111.60,98%,We look not at the things which are what you would call seen...,No win (3 of 3)
728.,2017-12-31 18:03:41,108.89,98%,"On recovering my senses, I hastened to quit a place where I ...",Win (1 of 3)
727.,2017-12-31 18:03:02,107.15,97%,Why does man create? Is it man's purpose on earth to express...,Win (1 of 3)
726.,2017-12-31 17:59:49,106.22,98%,"Vanity and pride are different things, though the words are ...",No win (2 of 4)
725.,2017-12-31 17:59:10,116.50,99%,"Scratch the surface of any champion in any individual sport,...",Win (1 of 5)
724.,2017-12-31 03:28:15,99.23,98%,"And it's whispered that soon, if we all call the tune, then ...",No win (2 of 5)
723.,2017-12-27 17:24:31,89.71,95%,"All Ninja are men of peace, and must always remain so or los...",No win (2 of 5)
722.,2017-12-27 17:22:23,84.56,96%,Let me bring you up to speed. My name is Wayne Campbell. I l...,Win (1 of 4)
721.,2017-12-26 15:41:03,106.21,97%,"When the light of life has gone, no change for the meter. Th...",No win (2 of 5)
720.,2017-12-26 15:40:20,104.39,95%,"What you need to learn, children, is the difference between ...",No win (2 of 3)
719.,2017-12-26 15:39:49,104.85,98%,The titanium business was in a state of flux during the 1990...,Win (1 of 4)
718.,2017-12-26 15:38:53,109.58,96%,The light and the dark the big and the small. Just keep in m...,No win (2 of 5)
717.,2017-12-26 15:35:26,103.27,96%,"I guess this is just another lost cause, Mr. Paine. All you ...",No win (4 of 5)
716.,2017-12-26 15:34:41,100.86,97%,"If you imagine an orange, there may occur in your cortex a s...",No win (2 of 4)
715.,2017-12-26 15:33:35,106.16,96%,Legend has it this bridge was constructed by a young man and...,Win (1 of 4)
714.,2017-12-26 15:32:33,113.40,98%,"To protect you both from the Emperor, you were hidden from y...",Win (1 of 2)
713.,2017-12-26 15:31:09,111.42,99%,You no good little slimebag! I'm going to make you the secon...,No win (2 of 4)
712.,2017-12-26 15:30:09,113.99,97%,Teachers never die. They live in your memory forever. They w...,No win (2 of 4)
711.,2017-12-26 05:45:10,96.01,96%,"Above all, don't lie to yourself. The man who lies to himsel...",No win (4 of 4)
710.,2017-12-26 05:44:28,93.34,96%,I see a line of cars and they're all painted black with flow...,No win (4 of 5)
709.,2017-12-26 05:43:48,92.24,96%,"Today, almost everyone is an obsessive, well-informed aficio...",Win (1 of 2)
708.,2017-12-26 05:41:59,106.23,98%,For this is what it means to be a king: to be first in every...,No win (2 of 5)
707.,2017-12-26 05:40:02,92.34,96%,There's a feeling I get when I look to the west and my spiri...,No win (2 of 3)
706.,2017-12-26 05:23:43,94.65,95%,"Why, if I had a brain I could... I could wile away the hours...",No win (3 of 3)
705.,2017-12-26 00:08:58,110.03,98%,My visitors are often surprised when they see the TV Mack pu...,Win (1 of 2)
704.,2017-12-26 00:06:35,113.71,98%,The man who pulls the lever that breaks your neck will be a ...,Win (1 of 2)
703.,2017-12-26 00:05:47,100.81,96%,Our evaluations of reflection and transmission at material i...,No win (3 of 4)
702.,2017-12-26 00:04:47,86.69,96%,"Once you fall, Septimus repeated to himself, human nature is...",Win (1 of 5)
701.,2017-12-26 00:03:40,111.37,98%,"We climbed, he first and I behind, until through a small rou...",No win (3 of 5)
700.,2017-12-26 00:02:37,115.92,98%,"Well, it just so happens, this hacienda comes with its very ...",No win (2 of 3)
699.,2017-12-26 00:02:02,104.32,97%,There will come a time when all of us are dead. All of us. T...,No win (3 of 3)
698.,2017-12-25 23:59:23,110.97,96%,"When the light of life has gone, no change for the meter. Th...",Win (1 of 5)
697.,2017-12-25 23:58:37,131.61,99%,"You don't get to choose if you get hurt in this world, but y...",No win (3 of 5)
696.,2017-12-25 23:58:18,94.10,96%,Sorrow is a lonely feeling. Unsettled is a painful place. I'...,No win (3 of 4)
695.,2017-12-25 23:56:51,119.45,98%,"Still, we will let all this be a thing of the past, though i...",No win (2 of 5)
694.,2017-12-25 23:43:24,94.55,96%,"My apologies. I have a nephew named Anfernee, and I know how...",No win (3 of 4)
693.,2017-12-25 23:42:45,105.65,98%,All beauty comes from beautiful blood and a beautiful brain....,No win (2 of 5)
692.,2017-12-25 23:41:58,104.96,96%,All that year the animals worked like slaves. But they were ...,Win (1 of 3)
691.,2017-12-25 23:40:25,95.43,97%,You shake my nerves and you rattle my brain; too much love d...,No win (4 of 5)
690.,2017-12-25 23:39:40,126.60,99%,"A computer needs a manager to administer its operations, jus...",No win (2 of 5)
689.,2017-12-25 23:36:23,100.40,97%,Everyone always wants new things. Everybody likes new invent...,No win (3 of 5)
688.,2017-12-25 23:35:42,94.07,96%,I'm shakin' the dust of this crummy little town off my feet ...,No win (3 of 4)
687.,2017-12-25 23:33:54,95.54,97%,"Borders matter. Borders regulate the flow of people, the mov...",No win (2 of 3)
686.,2017-12-25 22:41:03,101.00,96%,Once upon a time there lived a magnificent race of animals t...,Win (1 of 4)
685.,2017-12-25 22:39:54,108.82,98%,"I must've forgot, you can't trust me. I'm open a moment and ...",No win (2 of 3)
684.,2017-12-25 22:39:02,104.98,96%,What good are prayers and shrines to a person mad with love?...,No win (3 of 3)
683.,2017-12-25 22:38:27,95.11,97%,"Mario! I hate to bother you while you're resting, but I want...",No win (2 of 5)
682.,2017-12-25 22:35:25,115.32,97%,"I'll tell you a riddle. You're waiting for a train, a train ...",Win (1 of 4)
681.,2017-12-25 22:34:45,99.46,98%,He also swore himself by a binding oath that whatever wife h...,No win (2 of 5)
680.,2017-12-25 22:34:12,101.68,97%,Droll thing life is - that mysterious arrangement of mercile...,Win (1 of 5)
