127.,2018-03-16 08:29:48,73.42,97%,Remember before when I was talking about smelly garbage stan...,No win (4 of 5)
126.,2018-03-16 08:28:25,96.58,98%,I have been told of a certain sea snake which has a very unu...,Win (1 of 5)
125.,2018-03-16 08:27:38,87.29,97%,I feel his presence. But he can also feel mine. He's come fo...,Win (1 of 5)
124.,2018-03-16 08:26:55,95.96,99%,"Well, a scavenger hunt is exactly like a treasure hunt, exce...",Win (1 of 5)
123.,2015-10-30 13:43:18,64.01,84%,I was long into my second decade of living single before I c...,No win (4 of 5)
122.,2015-10-30 13:42:30,77.58,92%,"Because most of the 150,000 tons of gold ever mined is still...",No win (3 of 4)
121.,2015-10-30 13:41:34,70.80,92%,"Whether you're a student, secretary, office administrator, m...",Win (1 of 5)
120.,2015-10-30 13:40:11,70.13,91%,"Today, you people are no longer maggots. Today, you are Mari...",No win (4 of 5)
119.,2015-10-30 13:39:03,70.39,88%,Don't make assumptions - find the courage to ask questions a...,No win (4 of 4)
118.,2015-10-30 13:38:06,77.54,88%,We all know people who are very bright but who do not always...,No win (3 of 5)
117.,2015-10-30 13:37:15,76.08,94%,"There was me, that is Alex, and my three droogs, that is Pet...",No win (2 of 5)
116.,2015-10-30 13:36:31,82.01,93%,"They say that right after God created man, he took a rib fro...",No win (3 of 5)
115.,2015-10-30 13:35:49,75.36,91%,Typing competitions provided another test of the Qwerty keyb...,Win (1 of 4)
114.,2015-10-30 13:34:35,74.36,91%,I know that you weren't bored that day because there was a l...,No win (3 of 5)
113.,2015-10-30 13:33:35,79.21,91%,"They say that right after God created man, he took a rib fro...",No win (5 of 5)
112.,2015-10-30 13:32:50,62.12,84%,Being able to quit things that don't work is integral to bei...,No win (4 of 5)
111.,2015-10-30 13:31:49,81.42,93%,"I'll miss the sea, but a person needs new experiences. They ...",Win (1 of 4)
110.,2015-10-30 13:31:03,71.49,88%,"He said that if culture is a house, then language was the ke...",No win (4 of 5)
109.,2015-10-30 13:30:18,82.59,95%,Everything we hold dear likewise resolves into its original ...,Win (1 of 5)
108.,2015-10-30 13:29:12,64.95,81%,We all know people who are very bright but who do not always...,No win (4 of 5)
107.,2015-10-30 13:28:19,78.54,91%,I thought climbing the Devil's Thumb would fix all that was ...,No win (3 of 5)
106.,2015-10-30 13:27:32,77.91,91%,"The goal of the true seeker is to become a sage, or superior...",No win (3 of 5)
105.,2015-10-30 13:26:18,89.41,97%,We've arranged a global civilization in which most crucial e...,Win (1 of 5)
104.,2015-10-30 13:25:35,83.04,94%,"And I said, I don't care if they lay me off either, because ...",No win (2 of 5)
103.,2015-10-30 13:24:23,76.35,90%,"If you want to drive a race car well, whether to win an Indy...",Win (1 of 4)
102.,2015-10-30 13:23:09,86.99,92%,"Life is not suffering; it's just that you will suffer it, ra...",Win (1 of 5)
101.,2015-10-30 13:22:33,91.07,97%,Quality humor doesn't just deliver one gag and then tax the ...,No win (2 of 5)
100.,2015-10-30 13:21:43,69.98,88%,"Yes, the newspapers were right: snow was general all over Ir...",No win (2 of 5)
99.,2015-10-27 15:39:53,101.98,99%,You have two choices: you can keep running and hiding and bl...,Win (1 of 3)
98.,2015-10-20 10:30:31,79.06,94%,"Trudging slowly over wet sand, back to the bench where your ...",No win (4 of 4)
97.,2015-10-20 10:29:46,73.89,88%,Convection also plays a minor role because of the relative t...,No win (2 of 4)
96.,2015-10-20 10:27:44,81.18,94%,When we got to the Mint I parked on the street in front of t...,Win (1 of 4)
95.,2015-10-20 10:27:12,90.90,98%,"They say, ""Find a purpose in your life and live it."" But, so...",Win (1 of 4)
94.,2015-10-19 15:05:05,84.13,95%,"Whether they use the title or not, many lyrics have evocativ...",No win (2 of 5)
93.,2015-10-19 15:04:20,65.01,92%,"Under the headline ""Wonderful Typing,"" the New York Times re...",Win (1 of 2)
92.,2015-10-19 15:02:52,96.04,95%,"In fact, the mere act of opening the box will determine the ...",Win (1 of 3)
91.,2015-10-19 15:01:54,73.21,89%,Don't make assumptions - find the courage to ask questions a...,No win (3 of 4)
90.,2015-10-19 10:27:37,75.23,94%,When beetles fight these battles in a bottle with their padd...,Win (1 of 3)
89.,2015-10-13 14:29:36,74.82,94%,"At 211 degrees, water is hot. At 212 degrees, it boils. And ...",Win (1 of 3)
88.,2015-10-13 14:28:55,82.38,93%,"He started running, up and up, until he hurled himself into ...",No win (2 of 5)
87.,2015-10-13 14:27:49,69.41,90%,The basic concept is simple: a satellite in geosynchronous o...,No win (5 of 5)
86.,2015-10-13 14:26:41,83.39,92%,"In fact, the mere act of opening the box will determine the ...",No win (3 of 3)
85.,2015-10-13 14:25:57,81.88,89%,She's got eyes of the bluest skies as if they thought of rai...,No win (3 of 4)
84.,2015-10-13 14:25:04,81.62,94%,"A lot of people, especially this one psychoanalyst guy they ...",No win (3 of 4)
83.,2015-10-13 14:23:45,99.99,96%,"The Earth is a world, the world is a ball, a ball in a game ...",Win (1 of 5)
82.,2015-10-13 14:22:22,71.10,93%,We may climb into the thin and cold realm of pure geometry a...,No win (2 of 5)
81.,2015-10-12 14:29:40,73.66,91%,"Finally, there are those languages, such as Turkish, Finnish...",No win (2 of 4)
80.,2015-10-12 14:28:25,64.98,87%,"They had been given a sign - a powerful, lucid sign - that u...",No win (2 of 3)
79.,2015-10-12 14:26:58,84.27,93%,Chance and chance alone has a message for us. Everything tha...,No win (3 of 4)
78.,2015-10-12 14:26:00,84.19,94%,We live in an age when people do more writing than they have...,No win (2 of 5)
77.,2015-10-12 14:25:05,87.11,93%,"My mom, especially, challenged us on everything. She'd use w...",No win (2 of 5)
76.,2015-10-12 14:23:52,66.42,87%,"Let me get this straight. You think that your client, one of...",No win (4 of 5)
75.,2015-10-12 13:15:50,76.53,90%,From compositional considerations the tomato layer would be ...,No win (3 of 4)
74.,2015-10-12 13:14:58,76.62,92%,So my heart goes out to them. Figuratively. I would never ac...,Win (1 of 4)
73.,2015-10-12 13:13:48,89.84,96%,It is possible that I already had some presentiment of my fu...,No win (2 of 4)
72.,2015-10-12 09:14:45,66.33,90%,"You ask Raymond what he does for a living and he says, ""I br...",No win (2 of 3)
71.,2015-10-09 14:38:15,95.11,95%,"I hope that whoever you are, you escape this place. I hope t...",No win (3 of 5)
70.,2015-10-09 14:37:21,87.33,93%,"They knew they were privileged to have these choices, but th...",No win (2 of 5)
69.,2015-10-09 14:36:11,95.03,96%,So it's all come back round to breaking apart again. Breakin...,Win (1 of 5)
68.,2015-10-09 14:35:14,81.09,93%,"To some, the rules of etiquette may seem outdated, stuffy an...",No win (2 of 5)
67.,2015-10-09 14:34:12,79.34,92%,Don't bother trying to explain your emotions. Live everythin...,No win (2 of 4)
66.,2015-06-05 21:02:36,76.00,91%,"Now you might ask yourself, if by yourself you mean me, ""Ste...",No win (2 of 3)
65.,2015-06-05 21:01:00,82.17,94%,"You think cooking is a cute job, huh? Like mommy in the kitc...",No win (4 of 5)
64.,2015-06-05 20:59:03,87.64,95%,Unlike the other four senses located in the logical regions ...,No win (2 of 4)
63.,2015-06-04 19:54:15,65.93,87%,"Imagine considering ""if"" as a two-finger movement instead of...",No win (2 of 2)
62.,2015-06-04 19:52:59,90.18,94%,"I had a job, I had a girl. I had something going, mister, in...",Win (1 of 4)
61.,2015-06-04 19:51:47,75.50,88%,One essential rule: make sure the joke is the last possible ...,No win (3 of 4)
60.,2015-06-04 19:50:53,84.42,93%,You have two choices: you can keep running and hiding and bl...,No win (3 of 3)
59.,2015-06-04 19:50:13,89.95,96%,Facts can be thought of as objective or subjective. Things a...,No win (2 of 3)
58.,2015-06-04 19:47:38,74.97,91%,"My name is Turkish. Funny name for an Englishman, I know. My...",Win (1 of 4)
57.,2015-06-04 19:46:09,81.69,96%,And I don't believe in the existence of angels but looking a...,Win (1 of 3)
56.,2015-06-04 19:45:05,76.00,90%,"When we conceive of the sweetest being ever, we are conceivi...",Win (1 of 5)
55.,2015-06-04 19:44:12,79.96,91%,We live in an age when people do more writing than they have...,No win (2 of 4)
54.,2015-06-04 19:43:14,74.55,90%,I don't know who you are. I don't know what you want. If you...,No win (3 of 4)
53.,2015-06-04 19:41:46,63.71,90%,So my heart goes out to them. Figuratively. I would never ac...,No win (4 of 5)
52.,2015-06-04 19:40:36,84.22,90%,The major difference between a thing that might go wrong and...,No win (3 of 4)
51.,2015-06-04 19:39:49,84.02,90%,There's a piece of Maria in every song that I sing. And the ...,Win (1 of 4)
50.,2015-06-04 19:38:55,78.39,93%,"I can feel the heat closing in, feel them out there making t...",No win (3 of 5)
49.,2015-06-04 19:37:56,69.95,89%,"The world of typing has changed. In the 1970s, every busines...",No win (4 of 4)
48.,2015-06-04 19:36:51,87.17,92%,"Ticking away the moments that make up a dull day, you fritte...",No win (4 of 4)
47.,2015-06-04 19:35:15,71.71,92%,Commas and periods always go inside quotation marks. Colons ...,No win (3 of 4)
46.,2015-06-04 19:34:10,74.58,91%,"The boy has not a real choice, has he? Self-interest, the fe...",No win (2 of 4)
45.,2015-06-04 19:22:28,87.33,96%,"I had a job, I had a girl. I had something going, mister, in...",No win (2 of 5)
44.,2015-06-04 19:21:27,70.17,89%,"I don't want tickets, I need you to find me a painting, a cl...",No win (3 of 4)
43.,2015-06-04 19:20:27,85.90,95%,Commas and periods always go inside quotation marks. Colons ...,No win (2 of 4)
42.,2015-02-13 22:41:21,67.46,93%,The Inca believed that if one did not give thanks and obedie...,No win (2 of 3)
41.,2015-02-13 22:39:48,73.57,92%,And I will strike down upon thee with great vengeance and fu...,Win (1 of 3)
40.,2014-05-13 08:27:23,87.20,94%,"The Earth is a world, the world is a ball, a ball in a game ...",Win (1 of 3)
39.,2014-05-13 08:26:43,80.13,93%,"If I leave here tomorrow, would you still remember me? For I...",Win (1 of 4)
38.,2014-05-13 08:25:48,71.05,90%,Paper as we know it today was invented in China in around 10...,No win (4 of 4)
37.,2014-05-05 15:16:52,84.99,91%,"One day you're in a funk about things, telling a friend that...",No win (4 of 5)
36.,2014-05-05 15:15:02,65.20,88%,It is by will alone I set my mind in motion. It is by the ju...,No win (3 of 5)
35.,2014-05-05 15:13:47,75.79,94%,Most popular song lyrics have two sections - a verse and a b...,No win (2 of 5)
34.,2014-05-05 15:12:42,79.63,95%,Sholes consulted with an educator who helped him analyze the...,No win (2 of 5)
33.,2014-01-24 19:20:27,71.18,91%,"When we pulled out into the winter night and the real snow, ...",Win (1 of 3)
32.,2014-01-24 19:09:45,75.97,92%,"A long time ago, I was in Burma, my friends and I were worki...",No win (3 of 5)
31.,2014-01-24 19:08:15,75.34,93%,"The less you do with the controls, the less chance of error....",No win (2 of 3)
30.,2014-01-24 19:07:19,65.67,89%,Paper as we know it today was invented in China in around 10...,No win (4 of 5)
29.,2014-01-24 19:05:58,71.70,89%,"If you don't get what you want, you suffer; if you get what ...",No win (3 of 5)
28.,2014-01-24 19:04:41,80.27,96%,We all know people who are very bright but who do not always...,No win (2 of 5)
27.,2014-01-24 18:55:43,82.14,93%,There's a piece of Maria in every song that I sing. And the ...,No win (2 of 4)
26.,2014-01-24 08:25:39,69.84,90%,It takes more than a calorie of fossil fuel energy to produc...,Win (1 of 2)
25.,2014-01-24 00:22:25,64.28,89%,"To evaluate an option from the other side's point of view, c...",No win (4 of 4)
24.,2014-01-24 00:21:24,75.51,93%,And then he calls me a jerk and says the last guy who though...,No win (2 of 2)
23.,2014-01-24 00:20:32,89.42,96%,Now I want you to think and stop being a smart aleck. A man'...,Win (1 of 4)
22.,2014-01-24 00:19:28,71.31,90%,"The creation ends in South Georgia, at the very edge of the ...",No win (2 of 3)
21.,2014-01-24 00:17:56,69.71,92%,"Get it straight buster - I'm not here to say please, I'm her...",Win (1 of 4)
20.,2014-01-24 00:16:58,75.38,89%,One essential rule: make sure the joke is the last possible ...,No win (2 of 4)
19.,2014-01-24 00:16:01,63.32,92%,"Imagine this: Here we are, a plane full of grown human being...",No win (2 of 2)
18.,2014-01-24 00:14:27,68.46,90%,"Whenever you watch the mind, you withdraw consciousness from...",No win (2 of 3)
17.,2014-01-24 00:12:58,89.91,93%,"Your face has fallen sad now, for you know the time is nigh....",No win (3 of 5)
16.,2014-01-24 00:08:46,77.98,90%,San Francisco in the middle sixties was a very special time ...,No win (3 of 5)
15.,2014-01-23 23:59:53,60.67,90%,Groups of illegal miners smuggle themselves down in freight ...,No win (2 of 5)
14.,2014-01-23 23:58:34,74.34,91%,It's the possibility of having a dream come true that makes ...,No win (3 of 5)
13.,2014-01-23 23:55:51,61.49,88%,"""This man right here,"" McGuinness said, pointing at Kenna, ""...",Win (1 of 3)
12.,2014-01-23 23:47:20,78.50,93%,"You ask Raymond what he does for a living and he says, ""I br...",No win (2 of 5)
11.,2014-01-23 23:43:15,70.09,92%,Yet the web of thought has no such creases and is more like ...,No win (2 of 3)
10.,2014-01-23 23:38:52,70.73,92%,Language is one of the keys to being human. It allows us to ...,No win (2 of 5)
9.,2014-01-23 23:34:53,85.68,94%,"Ticking away the moments that make up a dull day, you fritte...",No win (2 of 5)
8.,2014-01-23 23:33:18,62.38,89%,"No man is an island, entire of itself; every man is a piece ...",No win (2 of 4)
7.,2014-01-23 23:31:17,88.09,99%,"Keying text quickly is important, but it is more important t...",Win (1 of 5)
6.,2014-01-23 23:30:00,79.50,93%,"Races are not won in the first corner; however, they are oft...",No win (2 of 5)
5.,2014-01-23 23:28:52,62.25,86%,One thing I've learned in the last seven years: in every gam...,No win (4 of 5)
4.,2014-01-23 23:27:26,81.63,94%,The ultimate way to compose is to be able to keyboard as fas...,Win (1 of 5)
3.,2014-01-23 23:25:56,72.37,91%,"We turn away to face the cold, enduring chill, as the day be...",No win (2 of 2)
2.,2014-01-23 23:23:58,67.32,86%,"Because they're at the bottom of the scale, nerds are a safe...",No win (2 of 2)
1.,2014-01-23 23:22:29,68.18,92%,"Two years ago this property cost one million pounds. Today, ...",No win (2 of 2)
