440.,2018-03-19 05:24:18,87.66,97%,"We deal in illusions, man! None of it is true! But you peopl...",Win (1 of 3)
439.,2018-03-19 05:22:19,84.54,98%,Give me a lifetime of promises and a world of dreams. Speak ...,Win (1 of 2)
438.,2018-03-17 09:17:30,86.54,97%,There's a sign on the wall but she wants to be sure cause yo...,No win (2 of 4)
437.,2018-03-17 09:16:54,95.29,99%,Covert intelligence involves a lot of waiting around. Any me...,Win (1 of 4)
436.,2018-03-17 09:15:32,93.62,98%,I'm not blind! I know exactly who he is. He is selfish and l...,No win (4 of 4)
435.,2018-03-17 09:14:18,89.56,98%,"When a man's an empty kettle, he should be on his mettle, an...",No win (2 of 5)
434.,2018-03-17 09:13:42,79.04,96%,Certainly the determining acts of her life were not ideally ...,No win (2 of 4)
433.,2018-03-17 09:12:43,83.06,97%,"Lush green hills and plains, forests that are filled with ra...",No win (2 of 4)
432.,2018-03-17 09:11:23,77.39,98%,We all carry around so much pain in our hearts. Love and pai...,No win (3 of 5)
431.,2018-03-17 09:10:33,69.35,95%,"Say my name, say my name. If no one is around you, say, ""Bab...",No win (3 of 5)
430.,2018-03-17 09:09:46,87.74,98%,"All right, if this guy just took advantage of a natural acci...",No win (3 of 4)
429.,2018-03-17 09:09:07,82.88,96%,"But suddenly, I viddied that thinking was for the gloopy one...",Win (1 of 5)
428.,2018-03-17 09:08:19,94.53,99%,"Some people thought we were at war with the Germans -

 inco...",Win (1 of 5)
427.,2018-02-17 14:13:15,81.20,98%,"Oh, no, sir. I'm sorry, sir. I could never answer to a whist...",No win (3 of 5)
426.,2018-02-17 14:12:31,95.44,97%,I see a line of cars and they're all painted black with flow...,No win (2 of 4)
425.,2018-02-17 14:11:58,91.10,98%,We all know that something is eternal. And it ain't houses a...,No win (2 of 3)
424.,2018-02-17 14:10:51,70.15,97%,Attention! All rise! This meeting of G.R.O.S.S. is now calle...,Win (1 of 5)
423.,2018-02-17 14:09:07,78.80,97%,And that's what this whole thing is about. Calling home. Ins...,No win (4 of 5)
422.,2018-02-17 14:08:01,98.82,98%,I don't like work - no man does - but I like what is in the ...,Win (1 of 4)
421.,2018-02-17 14:01:32,82.57,98%,"Photo shoot fresh, looking like wealth. I'm 'bout to call th...",Win (1 of 5)
420.,2018-02-17 13:51:13,109.32,99%,"The bizarre thing is, is that I did it for my old man... I t...",No win (2 of 3)
419.,2018-02-17 13:50:03,69.10,97%,Scientists hypothesize that Austronesians from the Philippin...,No win (2 of 3)
418.,2018-02-17 13:48:57,80.57,96%,"Samatha is a state in which the mind is brought to rest, foc...",No win (3 of 4)
417.,2018-01-25 14:17:04,86.15,99%,"The old sea captain, not surprisingly, was an excellent witn...",No win (2 of 5)
416.,2018-01-08 12:51:40,76.94,97%,I still see things that are not here. I just choose not to a...,No win (3 of 4)
415.,2018-01-08 12:50:51,76.64,97%,"And so, having defeated the nefarious Psy-crow, our hero, Ea...",No win (3 of 4)
414.,2018-01-08 12:49:23,85.07,96%,My life's work is teaching. And I believed that if you boys ...,No win (4 of 5)
413.,2018-01-08 12:48:06,54.13,97%,"Lesser than Macbeth, and greater. Not so happy, yet much hap...",No win (4 of 4)
412.,2018-01-08 12:45:58,87.34,97%,This little droid. I think he's searching for his former mas...,Win (1 of 5)
411.,2018-01-08 12:45:16,100.82,99%,Each day means a new twenty-four hours. Each day means every...,No win (2 of 3)
410.,2018-01-08 12:44:49,79.19,96%,"The following year, I left home to live in the school dormit...",No win (3 of 4)
409.,2018-01-08 12:43:59,94.31,99%,How often do you think about why your friends came into your...,No win (2 of 2)
408.,2018-01-08 12:42:56,82.01,96%,I've taken my bows and my curtain calls. You brought me fame...,No win (5 of 5)
407.,2018-01-08 12:42:08,101.06,98%,"Patience, he thought. So much of this was patience - waiting...",Win (1 of 5)
406.,2018-01-08 12:41:32,75.13,97%,Mitochondria and chloroplasts display similarities with bact...,No win (2 of 5)
405.,2017-12-01 15:26:54,82.23,97%,A really efficient totalitarian state would be one in which ...,No win (3 of 5)
404.,2017-12-01 15:26:06,88.02,97%,For the first time in a long time I thought about Maman. I f...,No win (5 of 5)
403.,2017-12-01 15:24:54,90.63,99%,He's not afraid of losing. He's afraid of losing your love. ...,Win (1 of 5)
402.,2017-12-01 15:24:17,81.80,97%,Daddy's flown across the ocean. Leaving just a memory. A sna...,Win (1 of 5)
401.,2017-10-12 08:46:14,75.72,96%,"Then you compared a woman's love to Hell, to barren land whe...",No win (3 of 4)
400.,2017-09-16 06:07:59,100.37,97%,As much money and life as you could want! The two things mos...,Win (1 of 4)
399.,2017-09-16 06:07:19,82.40,96%,"Ladies and gentlemen, this is a flying saucer. It's made of ...",No win (3 of 5)
398.,2017-09-16 06:06:00,79.21,96%,What's Joey Zasa got to do with this? Joey Zasa's a pazzo. J...,No win (2 of 3)
397.,2017-09-16 06:05:03,84.11,97%,That sometimes human beings have to just sit in one place an...,No win (2 of 5)
396.,2017-09-16 06:03:57,90.02,97%,"Mature affection, homage, devotion, does not easily express ...",No win (3 of 4)
395.,2017-09-16 05:58:26,113.23,99%,Nothing in life is easy. But that's no reason to give up. Yo...,Win (1 of 5)
394.,2017-08-29 11:39:27,89.33,98%,We have a straight shot into the fusion reactor. We need a c...,Win (1 of 4)
393.,2017-08-29 11:38:04,75.42,97%,I finally figured it out. It's like when they realized it wa...,No win (2 of 3)
392.,2017-08-29 11:36:29,84.89,97%,According to the data in their networks the ring has some ki...,Win (1 of 5)
391.,2017-08-29 11:35:46,78.46,97%,The matter between the stars is collectively termed the inte...,No win (2 of 4)
390.,2017-08-29 11:34:40,74.34,97%,"Soon I'll be sixty years old, my daddy got sixty-one. Rememb...",No win (3 of 5)
389.,2017-08-29 11:33:50,86.80,97%,Have you ever experienced a time when no matter how hard you...,No win (3 of 4)
388.,2017-08-25 03:53:24,81.60,97%,You cannot defeat me with a blade that does not sparkle with...,No win (4 of 5)
387.,2017-08-25 03:52:37,77.88,97%,"For once I can say, ""This is mine you can't take it."" As lon...",No win (3 of 5)
386.,2017-08-25 03:51:57,87.64,97%,"Samatha is a state in which the mind is brought to rest, foc...",No win (4 of 5)
385.,2017-08-25 03:49:26,75.44,96%,And I don't believe in the existence of angels but looking a...,No win (4 of 5)
384.,2017-08-25 03:48:28,76.38,97%,"Now you might ask yourself, if by yourself you mean me, ""Ste...",No win (3 of 5)
383.,2017-08-25 03:47:29,77.31,97%,We're no strangers to love. You know the rules and so do I. ...,Win (1 of 5)
382.,2017-08-25 03:46:55,89.59,97%,You have no respect for excessive authority or obsolete trad...,Win (1 of 5)
381.,2017-08-25 03:46:22,70.06,97%,Anyone seen this before? The Laffer curve. Anyone know what ...,No win (2 of 5)
380.,2017-08-25 03:45:12,70.98,97%,"But for to telle yow al hir beautee, it lyth nat in my tonge...",Win (1 of 2)
379.,2017-08-25 03:44:07,67.57,95%,"Prior to the 1970's, because the United States had long been...",No win (2 of 2)
378.,2017-08-25 03:42:39,73.99,95%,"Get it straight buster - I'm not here to say please, I'm her...",No win (2 of 4)
377.,2017-08-25 03:41:46,80.28,98%,Glancing through the 1977 Atlanta Yellow Pages reveals a cit...,Win (1 of 4)
376.,2017-08-25 03:40:56,87.14,97%,"Take a drink, my friend, and say what you have in your heart...",No win (2 of 4)
375.,2017-08-25 03:40:27,74.98,96%,So I'm two inches away from her. Her luscious lips part. Jus...,No win (2 of 5)
374.,2017-08-03 12:53:01,82.99,97%,The theory of music emphasizes the elements from which music...,Win (1 of 5)
373.,2017-08-03 12:46:39,77.85,96%,I want you to be very clear about this: You were fired. I wa...,No win (2 of 5)
372.,2017-08-03 12:43:07,83.68,97%,"And I am whatever you say I am. If I wasn't, then why would ...",Win (1 of 4)
371.,2017-08-03 12:41:31,79.83,97%,I was looking for myself and asking everyone except myself q...,No win (4 of 4)
370.,2017-08-03 12:40:27,92.38,98%,Welcome to the room of people who have rooms of people that ...,No win (4 of 4)
369.,2017-08-03 12:39:52,75.38,95%,"Because they're at the bottom of the scale, nerds are a safe...",Win (1 of 4)
368.,2017-08-03 12:38:26,82.95,97%,"You needn't take it any further, sir. You've proved to me th...",No win (2 of 3)
367.,2017-06-25 13:53:44,72.36,96%,"I'm going to improvise. Listen, there's something you should...",No win (3 of 3)
366.,2017-06-16 15:03:00,83.61,96%,"Perhaps I will die too, she told herself, and the thought di...",Win (1 of 4)
365.,2017-06-16 15:01:39,88.48,98%,"If you're committed enough, you can make any story work. I o...",No win (4 of 5)
364.,2017-06-16 15:01:10,76.24,97%,"There are men who possess a peculiarly strong visual memory,...",No win (3 of 3)
363.,2017-06-16 15:00:17,89.56,97%,"Despair comes slowly, crawling its way up inside you until i...",No win (2 of 4)
362.,2017-06-16 14:59:21,86.86,99%,You could choke a dozen donkeys on that! And you're haggling...,Win (1 of 3)
361.,2017-06-16 14:58:24,73.24,98%,"In short order, Carter then proceeded to kill any chance he ...",No win (3 of 5)
360.,2017-06-16 14:57:15,92.02,98%,"Look and think as far ahead as possible. Often, a driver's n...",Win (1 of 5)
359.,2017-06-16 14:54:44,79.65,97%,Without a queen the locust swarm turned the ground to black....,No win (2 of 4)
358.,2017-05-31 07:41:37,83.08,95%,The things we do outlast our mortality. The things we do are...,No win (4 of 5)
357.,2017-05-31 07:37:00,93.45,97%,It was one of those days when it's a minute away from snowin...,Win (1 of 3)
356.,2017-05-31 07:36:03,79.88,92%,San Francisco in the middle sixties was a very special time ...,No win (3 of 4)
355.,2017-05-31 07:35:14,80.73,94%,Quality humor doesn't just deliver one gag and then tax the ...,Win (1 of 4)
354.,2017-05-31 07:34:19,87.24,96%,"To pass beyond is what I seek, I fear that I may be too weak...",Win (1 of 5)
353.,2017-05-31 07:33:00,83.30,98%,It takes more than a calorie of fossil fuel energy to produc...,No win (2 of 5)
352.,2017-05-31 07:31:55,97.16,99%,Perhaps it was an old flame he was in mourning for from the ...,Win (1 of 5)
351.,2017-05-31 07:30:45,68.19,90%,Pork and beans are actually cooked in the can. One fairly la...,Win (1 of 5)
350.,2017-05-31 07:29:46,74.10,90%,"We all have too many wheels, screws and valves to judge each...",No win (5 of 5)
349.,2017-05-31 07:29:01,86.95,95%,We all know people who are very bright but who do not always...,No win (3 of 5)
348.,2017-05-31 07:28:11,74.79,94%,"Our story begins, as these stories often do, with a young up...",Win (1 of 4)
347.,2017-05-31 07:26:26,79.32,95%,I would wear the blue overalls of the fieldworker and often ...,No win (2 of 5)
346.,2017-05-31 07:25:31,75.60,93%,"All Ninja are men of peace, and must always remain so or los...",No win (2 of 4)
345.,2017-05-31 07:24:21,92.90,96%,Focus your attention on the Now and tell me what problem you...,No win (2 of 5)
344.,2017-05-31 07:23:36,93.74,97%,"But pure, unadulterated feelings are dangerous in their own ...",Win (1 of 4)
343.,2017-05-29 02:47:25,72.99,94%,The matter between the stars is collectively termed the inte...,No win (5 of 5)
342.,2017-05-29 02:45:13,70.83,96%,The development of a living body of literature became indica...,Win (1 of 5)
341.,2017-05-29 02:43:58,84.03,92%,"The brain can be a tool. It can recall phone numbers, solve ...",Win (1 of 5)
340.,2017-05-19 15:03:33,79.38,95%,Whenever I find myself growing grim about the mouth; wheneve...,Win (1 of 4)
339.,2017-05-19 15:02:12,82.13,92%,"Never give up, no matter how far behind you are, no matter h...",No win (4 of 5)
338.,2017-05-18 14:55:48,76.18,93%,"I'll make him an offer he can't refuse. You see, Johnny, we ...",No win (5 of 5)
337.,2017-05-18 14:54:40,67.81,93%,We might begin by asking why the pregnant man image has been...,No win (4 of 5)
336.,2017-05-18 14:53:24,82.89,94%,I was even convinced that during those moments her face chan...,No win (4 of 4)
335.,2017-05-18 14:52:16,104.11,97%,When I'm alone I dream of the horizon and words fail me. The...,No win (2 of 5)
334.,2017-05-18 14:51:26,73.48,92%,There are negotiations being made that are going to answer a...,No win (3 of 3)
333.,2017-05-18 14:49:59,67.16,91%,"So ran the speech. Burdened and sick at heart, he feigned ho...",No win (2 of 3)
332.,2017-05-18 14:49:23,83.77,95%,You're inches away from death every time you go on a mission...,No win (2 of 4)
331.,2017-04-12 04:30:14,82.15,93%,"He always seemed to women different from what he was, and th...",No win (3 of 5)
330.,2017-04-12 04:29:21,95.73,96%,"When you are typing on a typewriter, your input appears dire...",Win (1 of 4)
329.,2017-04-12 04:28:45,87.38,94%,San Francisco in the middle sixties was a very special time ...,Win (1 of 4)
328.,2017-04-12 04:28:03,74.24,95%,The matter between the stars is collectively termed the inte...,No win (2 of 5)
327.,2017-04-12 04:26:56,70.56,93%,"He was one of the numerous and varied legion of dullards, of...",Win (1 of 4)
326.,2017-04-12 04:26:06,94.16,96%,"She would follow, her dream of love, the dictates of her hea...",No win (5 of 5)
325.,2017-04-12 04:25:23,92.77,99%,"And though my journeys did take me to a great many states, a...",No win (2 of 4)
324.,2017-04-12 04:24:33,94.37,96%,"The robins were singing vespers in the high tree-tops, filli...",Win (1 of 5)
323.,2017-04-12 04:23:46,79.74,89%,"It's the wanting you, never getting you. Keeps me wanting yo...",No win (2 of 3)
322.,2017-04-10 09:56:08,70.00,96%,"Beta flecks, another type of imperfection, are small regions...",No win (2 of 4)
321.,2017-04-10 09:55:00,76.77,95%,The bonds between ourselves and another person exists only i...,No win (2 of 5)
320.,2017-04-10 09:53:39,78.12,90%,"It's been a long day without you, my friend, and I'll tell y...",No win (3 of 4)
319.,2017-04-10 09:53:05,81.39,94%,"One day you're in a funk about things, telling a friend that...",No win (4 of 5)
318.,2017-04-10 09:51:59,77.49,96%,"Yes, not only humans but also every other organism in the co...",No win (2 of 5)
317.,2017-04-10 09:50:55,88.80,97%,If you're working out in front of a mirror and watching your...,No win (2 of 4)
316.,2017-04-10 09:49:55,83.04,95%,There was a time not that long ago when many drivers thought...,No win (3 of 5)
315.,2017-04-09 15:13:47,75.84,93%,There are still some places where you can get all you can ea...,No win (3 of 4)
314.,2017-04-09 15:12:29,66.36,93%,"Titanium is extracted from ores, such as rutile, where the f...",No win (3 of 4)
313.,2017-04-09 15:11:16,81.77,94%,"The rest of my attention is back at the offices of Facebook,...",No win (2 of 5)
312.,2017-04-09 14:59:09,106.80,100%,We look not at the things which are what you would call seen...,Win (1 of 5)
311.,2017-04-01 14:41:32,78.74,95%,Instead of hiring workers during the peak hog kill in the wi...,Win (1 of 5)
310.,2017-04-01 14:40:25,76.55,98%,"We have all got to exert ourselves a little to keep sane, an...",No win (3 of 5)
309.,2017-04-01 14:39:51,87.82,96%,There was a time not that long ago when many drivers thought...,No win (4 of 5)
308.,2017-04-01 14:37:56,97.64,98%,I don't want to live someone else's idea of how to live. Don...,No win (4 of 5)
307.,2017-04-01 14:37:08,69.93,95%,"On a personal note, his death is very sad. But on a professi...",No win (3 of 3)
306.,2017-04-01 14:35:31,83.42,95%,"The world's changing out there, there are a lot of new, exci...",No win (3 of 5)
305.,2017-04-01 14:34:21,68.96,94%,Topology is generally considered to be one of the three linc...,Win (1 of 3)
304.,2017-04-01 14:32:53,77.64,95%,"I used to analyze myself down to the last thread, used to co...",No win (2 of 4)
303.,2017-04-01 14:31:27,92.41,97%,"I went to the police, like a good American. These two boys w...",Win (1 of 5)
302.,2017-04-01 14:30:36,84.39,95%,"I've never tried to keep a specific person alive before, and...",Win (1 of 5)
301.,2017-03-10 13:36:18,76.05,95%,"I rejected those answers; instead, I chose something differe...",No win (2 of 4)
300.,2017-03-10 13:35:07,89.86,96%,I still think about the letter you asked me to write. It nag...,No win (2 of 4)
299.,2017-03-03 12:44:57,68.24,85%,"Everyone gets everything he wants. I wanted a mission, and f...",No win (2 of 5)
298.,2017-03-03 12:44:10,90.07,97%,The man who lies to himself and listens to his own lie comes...,No win (3 of 5)
297.,2017-03-03 12:43:28,76.82,93%,"Living men are bound by time... Thus, their lives have an ur...",No win (3 of 3)
296.,2017-03-03 09:55:17,75.67,92%,"I'll make him an offer he can't refuse. You see, Johnny, we ...",No win (3 of 5)
295.,2017-03-03 09:54:10,80.97,98%,"For string theory to make sense, the universe should have ni...",No win (4 of 5)
294.,2017-03-03 09:53:32,70.50,92%,"Our story begins, as these stories often do, with a young up...",No win (3 of 5)
293.,2017-03-03 09:51:35,74.48,90%,Wherever they might be they always remember that the past wa...,Win (1 of 3)
292.,2017-03-02 13:31:23,89.28,96%,"I'm Rick Harrison, and this is my pawn shop. I work here wit...",Win (1 of 5)
291.,2017-03-02 13:30:14,84.99,95%,The shearers' hut had bark walls and a tin roof. The floors ...,No win (2 of 5)
290.,2017-03-02 13:29:15,81.44,97%,"I pulled up to the house about 7 or 8, and I yelled to the c...",Win (1 of 5)
289.,2017-02-28 13:50:30,79.51,94%,Music finds a comfortable parallel with that of human langua...,No win (2 of 5)
288.,2017-02-28 13:49:56,80.19,95%,I'm waking up to ash and dust. I wipe my brow and I sweat my...,No win (4 of 5)
287.,2017-02-28 13:48:58,76.48,94%,Unlike the other four senses located in the logical regions ...,No win (3 of 5)
286.,2017-02-28 13:48:04,72.95,96%,Plato is always concerned to advocate views that will make p...,No win (2 of 2)
285.,2017-02-25 08:41:46,80.38,97%,"It's an odd feeling, farewell. There is such envy in it. Men...",No win (4 of 4)
284.,2017-02-25 08:41:02,86.63,95%,"Everyone gets everything he wants. I wanted a mission, and f...",No win (3 of 5)
283.,2017-02-25 08:40:26,88.35,93%,"With people like us, you should hang out, get to know what t...",No win (2 of 3)
282.,2017-02-25 08:39:54,75.17,95%,"For thirty years, I've sailed the seas and seen good and bad...",No win (4 of 4)
281.,2017-02-25 08:38:58,69.42,94%,Abnormally rapid speculative enhancement of prices for exist...,No win (4 of 5)
280.,2017-02-25 08:38:11,85.69,95%,We imagine that when we are thrown out of our usual ruts all...,No win (3 of 5)
279.,2017-02-25 08:37:29,78.13,92%,The major difference between a thing that might go wrong and...,No win (4 of 4)
278.,2017-02-25 08:36:43,86.02,95%,The most precious treasures we have in life are the images w...,No win (2 of 5)
277.,2017-02-25 08:35:55,66.24,95%,"Under the headline ""Wonderful Typing,"" the New York Times re...",Win (1 of 4)
276.,2017-02-25 08:34:43,87.77,95%,And isn't that a minor miracle? The state of the world today...,No win (2 of 4)
275.,2017-02-25 08:33:53,65.25,92%,A survey of the 101 top-grossing G-rated movies from 1990 to...,No win (2 of 5)
274.,2017-02-25 08:32:43,81.17,97%,"Where I come from, there's a terrible drought. We saw pictur...",No win (5 of 5)
273.,2017-02-25 08:32:05,76.69,92%,"Science isn't about ""why"". It's about ""why not"". Why is so m...",No win (3 of 4)
272.,2017-02-25 08:31:10,91.98,96%,You know I work all day to get you money to buy you things. ...,No win (4 of 5)
271.,2017-02-25 08:30:34,76.80,96%,"To be a poet is to have a soul so quick to discern, that no ...",No win (2 of 3)
270.,2017-02-25 08:29:30,89.83,97%,"I used to think she was quite intelligent, in my stupidity. ...",No win (3 of 5)
269.,2017-02-20 12:00:37,73.78,97%,Perhaps I'm just projecting my own concern about it. I know ...,Win (1 of 5)
268.,2017-02-20 11:59:38,70.54,95%,The Western States nervous under the beginning change. Texas...,Win (1 of 2)
267.,2017-02-20 11:58:28,75.74,96%,"On Ethernet networks, collisions occur when two nodes attemp...",No win (3 of 3)
266.,2017-02-20 11:57:17,73.32,95%,"I am the truth, I am the wisdom of the fallen - I'm the yout...",No win (2 of 3)
265.,2017-02-20 11:56:05,75.64,96%,"On a manual typewriter, strike the key with a nice sharp str...",No win (5 of 5)
264.,2017-02-20 11:55:13,69.25,92%,"Whether you're a student, secretary, office administrator, m...",No win (3 of 5)
263.,2017-02-20 11:54:15,81.90,97%,I said that I would see you because I had heard that you wer...,No win (4 of 5)
262.,2017-02-20 11:53:06,85.85,98%,She was feeling the pressure of the world outside and she wa...,No win (3 of 5)
261.,2017-02-20 11:52:15,79.00,96%,Mom says each of us has a veil between ourselves and the res...,No win (2 of 5)
260.,2017-02-20 03:13:37,73.00,98%,Many wines have more than 14 percent alcohol because the win...,No win (2 of 5)
259.,2017-02-19 06:35:32,72.81,92%,I have never done a day's work in my life - honest or dishon...,Win (1 of 2)
258.,2017-02-18 15:59:04,73.64,94%,"Often, we assume that a familiar situation will be but a rep...",No win (3 of 5)
257.,2017-02-18 15:58:09,89.58,98%,"So I was sitting in my cubicle today, and I realized, ever s...",Win (1 of 5)
256.,2017-02-18 15:57:25,82.61,96%,Although some men who were easy with their words said that i...,Win (1 of 5)
255.,2017-02-18 15:56:48,75.51,94%,Hero - not the champion player who plays the perfect game. N...,No win (2 of 5)
254.,2017-02-18 15:56:04,65.91,89%,"I had felt it growing, this feeling that had been hiding ben...",No win (3 of 3)
253.,2017-02-18 15:55:01,84.59,95%,Messes of men in farmer poverty; not much for monks but we p...,Win (1 of 4)
252.,2017-02-18 09:38:45,89.95,97%,"And now, as I close my task, subduing my desire to linger ye...",Win (1 of 3)
251.,2017-02-13 08:05:26,75.14,96%,"He spoke and rose to full height, sword in air, then cleft t...",Win (1 of 2)
250.,2017-02-13 08:03:16,61.73,90%,The supreme question about a work of art is out of how deep ...,Win (1 of 2)
249.,2017-02-13 07:53:58,60.12,87%,"Ergonomics is a term that combines the Greek word ergon, mea...",No win (2 of 2)
248.,2017-02-13 06:09:06,82.01,95%,"Sutler. Come now, Mr. Creedy, you knew this was coming. You ...",Win (1 of 2)
247.,2017-02-13 06:08:13,81.29,93%,I don't know why he saved my life. Maybe in those last momen...,No win (4 of 5)
246.,2017-02-13 06:07:20,67.42,94%,"""But I don't want to go among mad people,"" Alice remarked. ""...",Win (1 of 4)
245.,2017-02-13 06:06:26,85.76,97%,"What I want you to be - I don't mean physically but morally,...",No win (2 of 3)
244.,2017-02-13 06:05:16,80.84,95%,"The fact that we live at the bottom of a deep gravity well, ...",No win (2 of 3)
243.,2017-02-13 06:04:08,77.62,94%,He also swore himself by a binding oath that whatever wife h...,No win (3 of 4)
242.,2017-02-13 06:03:36,77.86,95%,"When you have children, you always have family. They will al...",Win (1 of 5)
241.,2017-02-13 06:02:41,86.59,93%,"We want a good life with a nose for things, the fresh wind a...",Win (1 of 5)
240.,2017-02-13 06:01:44,80.15,95%,"I had a job, I had a girl. I had something going, mister, in...",No win (4 of 5)
239.,2017-02-13 06:00:25,71.91,91%,The math is compelling. Most of the people in the world are ...,No win (3 of 5)
238.,2017-02-13 05:59:20,75.13,93%,"In general, many of these targets are easier marks if you ar...",No win (2 of 4)
237.,2017-02-13 05:57:19,100.33,97%,"Yes, it was her he was looking at, and there was meaning in ...",Win (1 of 4)
236.,2017-02-11 12:35:33,81.58,94%,The days go on and on... they don't end. All my life needed ...,No win (3 of 5)
235.,2017-02-11 12:34:47,82.99,94%,All the blue light reflections that color my mind when I sle...,Win (1 of 5)
234.,2017-02-11 12:33:46,72.89,96%,"There is more to color than a swatch in a book, or a pull do...",No win (2 of 5)
233.,2017-02-11 12:32:49,76.02,94%,We're no strangers to love. You know the rules and so do I. ...,Win (1 of 5)
232.,2017-02-11 12:31:51,66.01,94%,If we suppose that the external world has appeared in the pa...,No win (4 of 5)
231.,2017-02-08 13:45:52,68.79,89%,Space is big. Really big. You just won't believe how vastly ...,No win (2 of 5)
230.,2017-02-04 05:03:41,83.72,97%,"Above all, don't lie to yourself. The man who lies to himsel...",No win (2 of 5)
229.,2017-02-04 05:02:48,77.61,98%,"Let me get this straight. You think that your client, one of...",Win (1 of 5)
228.,2017-02-03 16:28:08,74.78,96%,The vastness of the heavens stretches my imagination - stuck...,Win (1 of 5)
227.,2017-02-02 03:25:07,74.38,95%,Isn't everybody tired of the fighting? Isn't everybody tired...,No win (3 of 5)
226.,2017-01-18 14:42:03,65.75,91%,Vigorous writing is concise. A sentence should contain no un...,No win (2 of 5)
225.,2017-01-18 14:17:03,77.82,93%,"Open to everything happy and sad, seeing the good when it's ...",No win (3 of 5)
224.,2017-01-18 14:15:40,54.86,90%,Friday morning Qwilleran sat at his typewriter and stared at...,No win (5 of 5)
223.,2017-01-03 14:07:45,71.88,93%,To drive out of the Central Valley of California on a hot da...,No win (2 of 4)
222.,2017-01-03 14:06:10,68.18,89%,A freedom fighter learns the hard way that it is the oppress...,No win (5 of 5)
221.,2017-01-03 14:05:12,91.42,95%,"This planet has, or rather had, a problem, which was this: m...",Win (1 of 5)
220.,2017-01-03 14:04:12,60.44,95%,"a) [MAN] A man ordered 2,000 drums of pink ping pong balls i...",Win (1 of 3)
219.,2016-12-29 04:46:29,74.41,95%,"When I really worry about something, I don't just fool aroun...",No win (3 of 5)
218.,2016-12-29 04:45:44,81.08,94%,I do not deny that what happened to us is a thing worth laug...,No win (2 of 5)
217.,2016-12-29 04:44:58,65.58,96%,You could choke a dozen donkeys on that! And you're haggling...,No win (3 of 4)
216.,2016-12-29 04:44:08,68.59,94%,"In short, our gentleman became so caught up in reading that ...",No win (2 of 4)
