114.,2014-07-04 04:43:19,105.73,97%,So I'm two inches away from her. Her luscious lips part. Jus...,No win (2 of 5)
113.,2014-07-04 04:42:49,125.43,99%,There's sometimes a buggy. How many drivers does a buggy hav...,No win (2 of 4)
112.,2014-07-04 04:42:17,117.89,93%,"Whether they use the title or not, many lyrics have evocativ...",No win (2 of 2)
111.,2014-07-04 04:41:43,113.95,99%,"The melted mozzarella layer, which we shall designate MML, i...",No win (3 of 3)
110.,2014-07-04 04:40:33,127.64,97%,The odds are that you will generally meet the worst of them....,No win (2 of 3)
109.,2014-07-04 04:39:58,114.32,95%,"Well, the way they make shows is, they make one show. That s...",No win (2 of 2)
108.,2014-07-04 04:39:07,110.61,92%,"When the light of life has gone, no change for the meter. Th...",No win (2 of 2)
107.,2014-07-04 04:38:26,123.71,99%,"Look, you should admit to yourself that Microsoft will miss ...",No win (3 of 3)
106.,2014-02-22 03:42:27,112.53,87%,Focus your attention on the Now and tell me what problem you...,Win (1 of 2)
105.,2014-02-22 03:41:30,135.43,98%,But the two men were not lonely at all. At home they were co...,Win (1 of 3)
104.,2014-02-17 04:44:31,131.80,98%,I've been looking so long at these pictures of you that I al...,Win (1 of 4)
103.,2014-02-17 04:43:05,122.87,99%,All time is all time. It does not change. It does not lend i...,Win (1 of 4)
102.,2014-02-17 04:41:51,132.15,100%,I don't believe in painted roses or bleeding hearts while bu...,Win (1 of 2)
101.,2014-02-17 04:39:50,126.08,94%,Being able to quit things that don't work is integral to bei...,Win (1 of 4)
100.,2014-02-17 04:38:44,112.83,93%,I don't believe in painted roses or bleeding hearts while bu...,Win (1 of 5)
99.,2014-02-17 04:37:27,115.79,93%,It is possible that I already had some presentiment of my fu...,No win (4 of 4)
98.,2014-02-17 04:36:35,142.69,100%,The place to improve the world is first in one's own heart a...,Win (1 of 4)
97.,2014-02-17 04:36:02,93.03,94%,"It may seem quite novelistic to you, and I am willing to agr...",No win (2 of 2)
96.,2014-02-15 02:31:05,126.77,96%,"Right, I am going to tell you how this works. You're going i...",No win (2 of 5)
95.,2014-02-15 02:30:05,109.12,93%,But the two men were not lonely at all. At home they were co...,Win (1 of 5)
94.,2014-02-15 02:28:58,94.24,75%,"Ever since I was a child, folks have thought they had me peg...",No win (2 of 3)
93.,2014-02-15 02:28:13,115.10,90%,I've always wondered about this coat business. When I'm in a...,No win (1 of 1)
92.,2014-02-15 02:27:31,102.14,90%,"But, pray how could that which I spoke so many years ago, an...",Win (1 of 3)
91.,2014-02-15 02:26:11,106.37,91%,The only message I got was from the company that holds my st...,Win (1 of 3)
90.,2014-02-15 02:25:05,109.74,95%,Do I really look like a guy with a plan? You know what I am?...,Win (1 of 3)
89.,2013-11-26 22:35:56,110.01,94%,"They say that right after God created man, he took a rib fro...",Win (1 of 2)
88.,2013-11-25 22:49:12,116.18,93%,"It's a blue savanna song: somewhere cross the desert, someti...",No win (2 of 5)
87.,2013-11-25 22:47:07,108.44,96%,"There are men who possess a peculiarly strong visual memory,...",Win (1 of 3)
86.,2013-11-23 18:10:32,119.68,96%,I've seen things you people wouldn't believe. Attack ships o...,Win (1 of 3)
85.,2013-11-23 18:09:23,103.04,91%,"Let's sort the buyers from the spiers, the needy from the gr...",No win (2 of 2)
84.,2013-11-23 18:08:32,109.13,93%,"Today, you people are no longer maggots. Today, you are Mari...",No win (2 of 4)
83.,2013-11-23 18:07:50,125.44,92%,"But no matter how effective the lesson was, I never really u...",Win (1 of 3)
82.,2013-11-23 18:06:16,138.83,100%,"I don't believe in an interventionist God, but I know, darli...",Win (1 of 5)
81.,2013-11-23 02:50:08,100.52,97%,"But suddenly, I viddied that thinking was for the gloopy one...",Win (1 of 3)
80.,2013-11-23 02:49:29,99.13,96%,"It may seem quite novelistic to you, and I am willing to agr...",Win (1 of 5)
79.,2013-11-23 02:48:37,120.32,99%,Instead of hiring workers during the peak hog kill in the wi...,Win (1 of 2)
78.,2013-11-23 02:47:53,102.58,96%,"Throughout my academic career, I'd given some pretty good ta...",No win (1 of 1)
77.,2013-11-23 02:47:18,107.75,91%,So it's all come back round to breaking apart again. Breakin...,Win (1 of 3)
76.,2013-11-23 02:45:42,126.02,99%,"Today, computers have taken this ancient art out of the craf...",Win (1 of 2)
75.,2013-11-23 02:44:50,132.62,99%,I am learning about twenty new Italian words a day. Where am...,Win (1 of 2)
74.,2013-11-23 02:44:09,122.09,97%,Every time I think of you I feel shot right through with a b...,Win (1 of 3)
73.,2013-11-23 02:43:23,113.22,99%,"This was the most delicious meal he'd had in recent years, a...",No win (2 of 4)
72.,2013-11-22 22:03:46,112.87,95%,"A little boy went out to play. When he opened his door, he s...",Win (1 of 3)
71.,2013-11-22 22:03:14,115.02,96%,"Because they're at the bottom of the scale, nerds are a safe...",No win (2 of 2)
70.,2013-11-22 22:02:30,108.99,94%,"Let's sort the buyers from the spiers, the needy from the gr...",Win (1 of 5)
69.,2013-11-22 22:01:48,107.87,97%,"Do you smell that? Napalm, son. Nothing else in the world sm...",Win (1 of 5)
68.,2013-11-22 22:01:11,90.60,84%,"What about Tony? You know, Bullet Tooth Tony. He'll find you...",No win (4 of 4)
67.,2013-11-22 22:00:30,117.82,98%,"Combat for a naval aviator is fought in short, violent burst...",Win (1 of 5)
66.,2013-11-22 21:59:44,104.17,96%,"The problem is, Willie, is that Charles and yourself are not...",Win (1 of 4)
65.,2013-11-22 21:59:11,107.82,96%,At first they had tried to keep the finding quiet. After all...,No win (2 of 4)
64.,2013-11-22 21:58:24,115.40,94%,"She's got a smile that, it seems to me, reminds me of childh...",No win (2 of 4)
63.,2013-11-22 21:57:45,97.51,90%,"Keying text quickly is important, but it is more important t...",No win (2 of 2)
62.,2013-11-22 21:56:53,106.66,92%,"If you don't get what you want, you suffer; if you get what ...",Win (1 of 3)
61.,2013-11-22 21:55:59,86.59,91%,"So, I'm tending bar there at Ecklund & Swedlin's last Tu...",No win (2 of 3)
60.,2013-11-22 21:54:57,114.05,97%,"The time I waited seemed endless, and I felt doubts and fear...",No win (3 of 3)
59.,2013-11-22 21:54:27,119.31,91%,All time is all time. It does not change. It does not lend i...,Win (1 of 3)
58.,2013-11-22 21:52:15,98.61,93%,The basic concept is simple: a satellite in geosynchronous o...,Win (1 of 2)
57.,2013-11-22 21:51:15,128.80,97%,"Has it been five years? Six? It seems like a lifetime, the k...",Win (1 of 4)
56.,2013-11-22 21:50:29,126.97,100%,So what's in this for you? Should you rush out in search of ...,Win (1 of 3)
55.,2013-11-22 21:49:48,117.17,96%,All the blue light reflections that color my mind when I sle...,Win (1 of 4)
54.,2013-11-22 21:48:57,102.25,97%,Facts can be thought of as objective or subjective. Things a...,Win (1 of 3)
53.,2013-11-22 21:48:01,107.06,98%,I know that you weren't bored that day because there was a l...,Win (1 of 4)
52.,2013-11-22 21:46:41,106.99,97%,Do I really look like a guy with a plan? You know what I am?...,Win (1 of 5)
51.,2013-11-22 16:50:00,117.09,95%,"The terminator wouldn't stop, it would never leave him. It w...",No win (2 of 4)
50.,2013-11-22 16:48:49,116.79,97%,"Imagine considering ""if"" as a two-finger movement instead of...",Win (1 of 5)
49.,2013-11-22 16:47:31,113.61,96%,These contests provided ample opportunity to demonstrate the...,Win (1 of 5)
48.,2013-11-22 16:46:18,131.70,99%,Remember that humor is written backwards. That means you fir...,No win (4 of 5)
47.,2013-11-22 16:45:50,105.60,95%,Supermarket aisles are the perfect place to practice your gl...,Win (1 of 3)
46.,2013-11-22 16:44:56,99.90,88%,So what's in this for you? Should you rush out in search of ...,Win (1 of 4)
45.,2013-11-22 16:44:08,111.21,92%,"Whether they use the title or not, many lyrics have evocativ...",Win (1 of 4)
44.,2013-11-22 16:43:35,105.48,97%,"Picking up the pieces, half alive in a nine 'til five, vacan...",No win (2 of 2)
43.,2013-11-22 16:42:38,123.11,94%,"I hope that whoever you are, you escape this place. I hope t...",No win (2 of 3)
42.,2013-11-21 15:54:47,126.63,98%,"The goal of the true seeker is to become a sage, or superior...",Win (1 of 2)
41.,2013-11-20 18:27:07,113.94,96%,Too often writers believe that they can emphasize words by p...,Win (1 of 2)
40.,2013-11-20 18:25:31,112.20,89%,I've been looking so long at these pictures of you that I al...,Win (1 of 3)
39.,2013-11-20 14:18:41,104.25,95%,At first they had tried to keep the finding quiet. After all...,No win (2 of 3)
38.,2013-11-20 01:29:04,131.46,99%,The most precious treasures we have in life are the images w...,Win (1 of 3)
37.,2013-11-20 01:28:19,118.90,93%,Always do your best - your best is going to change from mome...,Win (1 of 3)
36.,2013-11-20 01:27:31,118.33,98%,"Contrary to the feminist cant, there are many things we can ...",Win (1 of 4)
35.,2013-11-20 01:26:55,108.20,95%,The pathology of setting a deadline to the earliest articula...,Win (1 of 3)
34.,2013-11-20 01:25:59,122.69,96%,Music finds a comfortable parallel with that of human langua...,No win (2 of 2)
33.,2013-11-20 01:25:31,105.06,92%,"When she returns to the forum page, her post is there. It is...",Win (1 of 3)
32.,2013-11-20 01:24:40,98.69,96%,"It was an effect of light: quick sunlight dappling, yellow l...",Win (1 of 3)
31.,2013-11-20 01:23:38,117.55,94%,I've always wondered about this coat business. When I'm in a...,No win (3 of 3)
30.,2013-11-20 01:22:59,105.09,93%,"Milt, with the excellent timing of a master comedy writer, w...",Win (1 of 3)
29.,2013-11-19 16:58:01,103.36,91%,It is possible that I already had some presentiment of my fu...,No win (3 of 3)
28.,2013-11-19 16:57:19,101.81,91%,"But older than me now, more constant, more real, and the fur...",No win (2 of 3)
27.,2013-11-19 16:56:42,105.01,96%,"Thirdly, however, these wars could now be waged with the new...",No win (2 of 2)
26.,2013-11-19 16:56:00,95.04,94%,"What good's a reward if you ain't around to use it? Besides,...",No win (3 of 3)
25.,2013-11-19 16:55:34,99.85,97%,I thought climbing the Devil's Thumb would fix all that was ...,No win (2 of 3)
24.,2013-11-19 16:54:57,95.94,88%,You have to wonder: how do the machines know what Tasty Whea...,No win (2 of 3)
23.,2013-11-19 16:53:56,118.06,94%,All that year the animals worked like slaves. But they were ...,Win (1 of 5)
22.,2013-11-19 16:53:13,109.03,98%,"It was an effect of light: quick sunlight dappling, yellow l...",Win (1 of 2)
21.,2013-11-19 16:52:21,109.91,95%,"But, pray how could that which I spoke so many years ago, an...",No win (2 of 4)
20.,2013-11-19 16:51:38,119.46,99%,"If you are given too many choices, if you are forced to cons...",Win (1 of 3)
19.,2013-11-19 16:50:54,86.32,89%,The treatment of atoms with more than one electron requires ...,No win (2 of 2)
18.,2013-11-19 16:49:46,109.84,96%,I'm telling it like it is. Get used to it or put this book d...,Win (1 of 3)
17.,2013-11-19 16:48:54,113.23,92%,The odds are that you will generally meet the worst of them....,Win (1 of 5)
16.,2013-11-19 16:48:14,122.64,98%,I can already hear your tune calling me across the room. Whe...,Win (1 of 4)
15.,2013-11-19 16:47:26,89.66,87%,Most popular song lyrics have two sections - a verse and a b...,No win (3 of 3)
14.,2013-11-19 16:46:36,88.55,88%,"It was an effect of light: quick sunlight dappling, yellow l...",No win (2 of 4)
13.,2013-11-19 16:45:36,110.57,94%,"They say that right after God created man, he took a rib fro...",No win (2 of 5)
12.,2013-11-19 16:44:48,125.71,96%,"She's got a smile that, it seems to me, reminds me of childh...",No win (2 of 5)
11.,2013-11-19 16:43:39,91.30,94%,"After the grapes are crushed, yeasts (tiny one-celled organi...",No win (3 of 4)
10.,2013-11-19 16:42:59,114.45,98%,Too often writers believe that they can emphasize words by p...,Win (1 of 4)
9.,2013-11-19 16:42:07,102.97,90%,In order to face down the danger that is stalking us and mov...,No win (2 of 3)
8.,2013-11-19 16:41:08,117.02,96%,Rhymes trap you into saying things you don't want to say. A ...,Win (1 of 3)
7.,2013-11-19 16:40:29,117.62,94%,"Many people limit themselves to leading boring, dull lives b...",Win (1 of 4)
6.,2013-11-19 16:39:34,111.14,96%,"Finally, gentlemen, there are people with an hereditary anim...",Win (1 of 4)
5.,2013-11-19 16:38:30,98.17,88%,"That's Tommy. He tells people he was named after a gun, but ...",Win (1 of 4)
4.,2013-11-19 16:37:41,129.01,100%,"But no matter how effective the lesson was, I never really u...",Win (1 of 4)
3.,2013-11-19 16:36:44,102.65,92%,His soul swooned slowly as he heard the snow falling faintly...,No win (2 of 5)
2.,2013-11-19 16:36:07,93.86,92%,Always do your best - your best is going to change from mome...,No win (2 of 3)
1.,2013-11-19 16:35:21,99.51,97%,"Air-conditioned, odorless, illuminated by buzzing fluorescen...",Win (1 of 4)
