339.,2018-01-16 21:48:46,124.01,99%,"I find I'm so excited, I can barely sit still or hold a thou...",No win (2 of 5)
338.,2018-01-16 21:47:40,91.18,97%,"So we finish 18 and he's gonna stiff me. And I say, 'Hey, La...",No win (4 of 5)
337.,2018-01-16 21:46:51,121.10,98%,I suddenly had the impression that I had been left all alone...,No win (4 of 4)
336.,2018-01-16 21:46:12,122.76,99%,"How many winners were losers, successes failures, rich men p...",Win (1 of 3)
335.,2018-01-02 21:13:25,138.65,99%,"The hills are alive with the sound of music, with songs they...",No win (2 of 5)
334.,2017-12-29 21:15:25,110.45,99%,Good games offer players a set of challenging problems and t...,No win (2 of 3)
333.,2017-12-29 21:14:55,107.04,99%,"Pooka. From old Celtic mythology, a fairy spirit in animal f...",Win (1 of 4)
332.,2017-12-29 21:14:11,127.02,98%,"How can I just let you walk away, just let you leave without...",No win (2 of 3)
331.,2017-12-29 21:13:07,103.36,98%,"Give not thyself up, then, to fire, lest it invert thee, dea...",No win (2 of 4)
330.,2017-12-29 21:12:33,123.37,99%,"Samatha is a state in which the mind is brought to rest, foc...",No win (2 of 3)
329.,2017-10-18 07:06:45,129.85,99%,"We turn away to face the cold, enduring chill, as the day be...",Win (1 of 3)
328.,2017-10-18 07:05:05,107.49,97%,There are many things that I would like to say to you but I ...,No win (3 of 3)
327.,2017-10-03 03:18:43,113.46,98%,Always seems to me you only see what people want you to see....,No win (3 of 4)
326.,2017-10-03 03:18:13,119.54,98%,I said that I would see you because I had heard that you wer...,No win (2 of 2)
325.,2017-09-27 02:39:10,130.62,98%,"And as we wind on down the road, our shadows taller than our...",Win (1 of 4)
324.,2017-09-27 02:37:38,127.20,98%,"When I close my eyes, I am at the center of the sun. And I c...",Win (1 of 5)
323.,2017-09-27 02:36:06,140.58,100%,"You know no one and no one knows you, and at the same time y...",No win (2 of 5)
322.,2017-09-27 02:35:10,100.77,99%,"When I close my eyes, I am at the center of the sun. And I c...",No win (3 of 5)
321.,2017-09-27 02:34:45,136.84,100%,"One man, one family driven from the land; this rusty car cre...",Win (1 of 5)
320.,2017-09-27 02:33:34,110.40,96%,"Look Dave, I can see you're really upset about this. I hones...",Win (1 of 5)
319.,2017-09-27 02:32:46,121.35,99%,"A young Jedi named Darth Vader, who was a pupil of mine unti...",Win (1 of 2)
318.,2017-09-27 02:31:27,137.82,99%,One of the most tragic things I know about human nature is t...,Win (1 of 3)
317.,2017-09-27 02:30:32,131.79,97%,"You have a class of young strong men and women, and they wan...",Win (1 of 4)
316.,2017-05-05 02:44:20,129.27,94%,"It's been a hard day's night, and I'd been working like a do...",Win (1 of 3)
315.,2017-04-28 19:49:38,119.42,97%,"If you imagine an orange, there may occur in your cortex a s...",No win (2 of 4)
314.,2017-04-04 04:20:12,106.08,89%,"I felt that even when they were polite they hardly saw me, t...",Win (1 of 4)
313.,2017-04-04 04:18:12,125.52,100%,"Contrary to the feminist cant, there are many things we can ...",Win (1 of 2)
312.,2017-04-04 04:17:42,113.35,92%,"There was only one catch and that was Catch-22, which specif...",Win (1 of 3)
311.,2017-04-03 20:12:26,138.29,100%,"It was a marvelous night, the sort of night one only experie...",Win (1 of 4)
310.,2017-04-03 20:11:51,113.24,94%,"That fear had been inside him for many years, it had lived w...",No win (3 of 3)
309.,2017-04-03 20:11:11,123.43,92%,What's cool about really little kids is that they don't say ...,No win (2 of 3)
308.,2017-03-17 03:40:04,111.63,87%,"I had been right, I was still right, I was always right. I h...",No win (2 of 3)
307.,2017-03-17 03:39:23,126.81,96%,All time is all time. It does not change. It does not lend i...,Win (1 of 3)
306.,2017-03-17 03:38:47,89.37,92%,"Moses supposes his toeses are roses, but Moses supposes erro...",No win (2 of 3)
305.,2017-03-17 03:31:20,124.84,99%,Now the scandal and the light are to be distributed differen...,Win (1 of 3)
304.,2017-03-14 21:12:07,126.12,95%,"Mostly, I could tell, I made him feel uncomfortable. He didn...",Win (1 of 5)
303.,2017-03-14 21:11:25,110.72,91%,"It was a strange feeling, holding the rifle. It somehow remo...",No win (2 of 3)
302.,2017-03-14 21:10:05,118.21,93%,Do not go gentle into that good night. Old age should burn a...,No win (2 of 4)
301.,2017-03-14 05:19:01,114.73,92%,He moved to the trees. Where the bark was peeling from the t...,Win (1 of 4)
300.,2017-03-14 04:10:03,111.50,87%,"Why'd you come, you knew you should have stayed. I tried to ...",No win (2 of 2)
299.,2017-03-14 03:59:19,127.42,97%,"I'd pull your eyes out of your head, and put them in my own ...",Win (1 of 5)
298.,2017-01-20 04:16:49,123.36,93%,Don't bother trying to explain your emotions. Live everythin...,No win (2 of 5)
297.,2017-01-20 04:16:15,104.85,91%,"You needn't take it any further, sir. You've proved to me th...",No win (2 of 3)
296.,2017-01-20 04:07:05,130.84,95%,"So much of this story is about human will, about what we can...",No win (3 of 3)
295.,2017-01-09 03:32:48,122.10,93%,I can already hear your tune calling me across the room. Whe...,No win (2 of 5)
294.,2017-01-09 03:30:06,124.19,96%,We were playing checkers. I used to kid her once in a while ...,Win (1 of 4)
293.,2017-01-09 03:29:05,122.88,96%,Language is one of the keys to being human. It allows us to ...,Win (1 of 3)
292.,2017-01-09 03:28:23,116.37,93%,"He guessed as well as he could, and crawled along for a good...",Win (1 of 3)
291.,2017-01-09 03:27:13,129.29,98%,"You ask Raymond what he does for a living and he says, ""I br...",Win (1 of 4)
290.,2017-01-09 03:26:07,107.51,87%,I can already hear your tune calling me across the room. Whe...,Win (1 of 2)
289.,2016-12-31 22:48:20,121.15,97%,I felt the urge to reassure him that I was like everybody el...,Win (1 of 3)
288.,2016-12-31 22:43:18,140.86,100%,There's a hole in the world like a great black pit. And the ...,Win (1 of 5)
287.,2016-12-31 22:41:52,105.01,90%,"You know, sweetheart, if there's one thing I've learned, it'...",No win (3 of 5)
286.,2016-12-31 22:38:15,106.48,90%,"Oh, no, sir. I'm sorry, sir. I could never answer to a whist...",Win (1 of 3)
285.,2016-12-31 22:29:30,121.81,92%,"The time I waited seemed endless, and I felt doubts and fear...",No win (3 of 4)
284.,2016-12-31 22:23:56,113.99,92%,"These nights are endless, and a man can sleep through them, ...",Win (1 of 3)
283.,2016-12-31 22:17:07,127.69,95%,"Precious are the dead that lie there, every stone over them ...",Win (1 of 5)
282.,2016-12-31 22:12:38,146.92,100%,"In the casino, the cardinal rule is to keep them playing and...",No win (2 of 3)
281.,2016-12-30 06:20:49,102.78,87%,"Me? I'm dishonest, and a dishonest man you can always trust ...",Win (1 of 5)
280.,2016-12-28 19:16:46,103.84,88%,As much money and life as you could want! The two things mos...,No win (2 of 4)
279.,2016-12-28 19:16:01,109.80,95%,"Now, that's 200 dollars, dead or alive. I'm aware this is pr...",No win (2 of 3)
278.,2016-12-28 04:59:34,112.51,91%,"Above all, don't lie to yourself. The man who lies to himsel...",No win (2 of 3)
277.,2016-12-28 04:58:32,101.19,86%,"I don't want to sell anything, buy anything, or process anyt...",Win (1 of 4)
276.,2016-12-28 04:57:24,120.89,90%,"Ticking away the moments that make up a dull day, you fritte...",No win (4 of 5)
275.,2016-12-27 06:16:53,121.94,97%,"If one day I could get out of here, I would allow myself to ...",Win (1 of 3)
274.,2016-12-27 04:44:33,121.09,91%,Humans need to practice what they are learning a good deal b...,Win (1 of 3)
273.,2016-12-27 03:33:04,147.05,96%,You don't care about anything except you. You just want to p...,Win (1 of 3)
272.,2016-12-26 05:43:16,108.95,93%,Don't bother trying to explain your emotions. Live everythin...,No win (2 of 4)
271.,2016-12-26 05:42:30,103.37,87%,"But I'm glad you'll see me as I am. Above all, I wouldn't wa...",No win (2 of 3)
270.,2016-12-26 05:41:43,125.68,96%,"Precious are the dead that lie there, every stone over them ...",Win (1 of 5)
269.,2016-12-26 05:40:54,107.92,91%,I was looking for myself and asking everyone except myself q...,No win (2 of 5)
268.,2016-12-26 05:40:11,114.66,93%,"And in the world a heart of darkness, a firezone, where poet...",No win (2 of 5)
267.,2016-12-26 05:39:28,110.94,99%,"The more stupid one is, the closer one is to reality. The mo...",Win (1 of 4)
266.,2016-12-26 05:38:47,117.89,97%,With the coming of Dean Moriarty began the part of my life y...,Win (1 of 3)
265.,2016-12-26 05:38:05,94.87,88%,The Swarms have crushed the meager human resistance and laid...,Win (1 of 4)
264.,2016-12-26 05:36:18,112.21,90%,Never give up on everything if one thing is too hard. Never ...,No win (2 of 3)
263.,2016-12-26 05:35:30,106.39,89%,One just can't imagine what prison is like from outside. You...,No win (3 of 3)
262.,2016-07-03 20:32:36,56.52,85%,"I went to the woods because I wished to live deliberately, t...",No win (2 of 4)
261.,2016-07-03 20:31:38,72.55,90%,"I'm so glad you came, I'm so glad you remembered, to see how...",No win (2 of 2)
260.,2016-07-03 20:30:53,118.49,92%,"Hope you're feeling better now, hope you got my letter, how ...",Win (1 of 3)
259.,2016-07-03 20:30:01,139.94,100%,I never said I would stay to the end - I knew I would leave ...,Win (1 of 3)
258.,2016-05-12 23:14:46,130.98,98%,Come sail your ships around me and burn your bridges down. W...,Win (1 of 2)
257.,2016-05-12 23:13:56,103.33,91%,"What about Tony? You know, Bullet Tooth Tony. He'll find you...",Win (1 of 2)
256.,2016-05-12 23:13:14,129.74,96%,"Look Dave, I can see you're really upset about this. I hones...",Win (1 of 2)
255.,2016-05-12 04:28:25,131.31,98%,"Take my love, take my land, take me where I cannot stand. I ...",Win (1 of 5)
254.,2016-05-11 02:29:41,118.32,89%,I must not fear. Fear is the mind killer. Fear is the little...,No win (2 of 2)
253.,2016-05-11 02:27:20,123.01,98%,"In fact, the mere act of opening the box will determine the ...",Win (1 of 3)
252.,2016-05-11 02:24:40,133.95,98%,All that year the animals worked like slaves. But they were ...,Win (1 of 5)
251.,2016-05-09 06:05:45,103.43,90%,I can and do say that nothing human beings have ever before ...,No win (2 of 3)
250.,2016-05-09 06:04:29,127.34,97%,"Many people limit themselves to leading boring, dull lives b...",No win (2 of 2)
249.,2016-05-09 06:03:47,108.54,94%,The basis of the Aztecs' success in creating a great state a...,No win (2 of 4)
248.,2016-05-09 06:02:54,117.08,97%,"That day, for no particular reason, I decided to go for a li...",Win (1 of 2)
247.,2016-05-09 06:01:12,122.83,98%,"Right, I am going to tell you how this works. You're going i...",Win (1 of 5)
246.,2015-12-02 22:17:44,130.48,97%,We've known each other for many years but this is the first ...,Win (1 of 3)
245.,2015-10-15 17:31:17,125.98,96%,There was a time not that long ago when many drivers thought...,No win (2 of 4)
244.,2015-10-15 17:30:27,128.86,99%,You have two choices: you can keep running and hiding and bl...,Win (1 of 4)
243.,2015-10-15 17:28:49,118.44,95%,"Keying text quickly is important, but it is more important t...",No win (2 of 2)
242.,2015-10-15 08:23:44,126.52,96%,"May your hands always be busy, may your feet always be swift...",Win (1 of 3)
241.,2015-10-15 08:23:12,121.18,96%,We live in an age when people do more writing than they have...,Win (1 of 5)
240.,2015-10-15 08:22:28,115.00,96%,Don't bother trying to explain your emotions. Live everythin...,Win (1 of 5)
239.,2015-10-15 08:21:30,111.79,95%,There are very few things I wish I could change about those ...,Win (1 of 5)
238.,2015-10-15 08:20:47,109.76,95%,At first they had tried to keep the finding quiet. After all...,Win (1 of 5)
237.,2015-10-15 08:20:02,120.17,100%,"I had a job, I had a girl. I had something going, mister, in...",No win (2 of 4)
236.,2015-10-15 08:19:20,102.33,95%,"Around midafternoon, the snow thinned into sleet, and some u...",Win (1 of 2)
235.,2015-09-21 23:25:29,135.39,97%,Let me tell you why you're here. You're here because you kno...,Win (1 of 3)
234.,2015-09-21 23:23:49,127.96,99%,The truth of the matter is that there are a lot of available...,Win (1 of 2)
233.,2015-09-21 23:23:10,118.11,99%,Commas and periods always go inside quotation marks. Colons ...,Win (1 of 3)
232.,2015-09-21 23:06:14,116.72,94%,The unknown future rolls toward us. I face it for the first ...,Win (1 of 3)
231.,2015-09-21 23:04:22,113.95,98%,"In 1966, Andy Dufresne escaped from Shawshank prison. All th...",Win (1 of 3)
230.,2015-09-21 23:03:24,119.01,95%,There are still some places where you can get all you can ea...,Win (1 of 5)
229.,2015-09-12 19:27:25,120.03,95%,Jay made up for the lack of glamour in his assignment by hav...,Win (1 of 4)
228.,2015-09-12 19:26:37,114.02,96%,I can teach you how to bewitch the mind and ensnare the sens...,No win (2 of 3)
227.,2015-09-12 19:25:27,108.48,89%,It doesn't mean much to be able to filter out most present-d...,Win (1 of 5)
226.,2015-08-21 07:14:29,131.17,96%,We've known each other for many years but this is the first ...,Win (1 of 4)
225.,2015-08-21 07:13:25,130.69,98%,Music finds a comfortable parallel with that of human langua...,Win (1 of 2)
224.,2015-08-08 21:45:04,119.66,100%,A total of twenty-five friends were headed from San Francisc...,Win (1 of 2)
223.,2015-08-06 05:51:38,121.45,94%,"As if that blind rage had washed me clean, rid me of hope; f...",Win (1 of 4)
222.,2015-08-06 05:50:21,129.29,100%,There's a hole in the world like a great black pit. And the ...,Win (1 of 4)
221.,2015-08-06 05:46:12,124.95,99%,"In general, many of these targets are easier marks if you ar...",Win (1 of 3)
220.,2015-07-30 04:55:20,111.54,97%,"Picking up the pieces, half alive in a nine 'til five, vacan...",Win (1 of 4)
219.,2015-07-30 04:54:39,121.74,97%,Every time I think of you I feel shot right through with a b...,Win (1 of 2)
218.,2015-07-30 04:53:50,107.64,90%,How many roads must a man walk down before you call him a ma...,Win (1 of 3)
217.,2015-07-30 04:53:00,119.92,94%,She's got eyes of the bluest skies as if they thought of rai...,Win (1 of 3)
216.,2015-07-30 04:52:21,104.91,95%,We're no strangers to love. You know the rules and so do I. ...,No win (2 of 2)
215.,2015-07-30 04:51:52,108.49,93%,"When I really worry about something, I don't just fool aroun...",Win (1 of 3)
214.,2015-07-23 07:15:05,111.64,94%,I've seen things you people wouldn't believe. Attack ships o...,No win (2 of 3)
213.,2015-03-29 05:55:16,130.27,97%,"One day you're in a funk about things, telling a friend that...",No win (2 of 3)
212.,2015-03-29 05:50:01,105.44,87%,"O clear intelligence, force beyond all measure! Gentlemen, I...",Win (1 of 2)
211.,2015-01-26 04:04:18,129.92,99%,"Well, it just so happens, this hacienda comes with its very ...",Win (1 of 3)
210.,2015-01-26 04:02:26,147.41,100%,"Your face has fallen sad now, for you know the time is nigh....",Win (1 of 4)
209.,2015-01-26 04:01:50,118.58,97%,"Everyone said I was daft to build a castle on a swamp, but I...",No win (2 of 3)
208.,2015-01-26 03:58:51,119.53,98%,"Do you smell that? Napalm, son. Nothing else in the world sm...",Win (1 of 2)
207.,2015-01-02 16:31:31,125.67,97%,At the time when Britain faced a plunge into chaos and darkn...,Win (1 of 3)
206.,2015-01-02 16:30:03,130.51,94%,The place to improve the world is first in one's own heart a...,No win (2 of 5)
205.,2015-01-02 16:27:53,130.46,100%,"When I was your age, television was called books. And this i...",Win (1 of 2)
204.,2014-12-20 19:25:16,123.50,97%,I never said I would stay to the end - I knew I would leave ...,Win (1 of 4)
203.,2014-12-20 19:07:37,117.33,95%,"I rejected those answers; instead, I chose something differe...",No win (1 of 1)
202.,2014-12-20 18:47:51,122.84,97%,In order to become an elf I filled out ten pages' worth of f...,No win (2 of 4)
201.,2014-10-29 04:11:35,118.36,99%,"When you are typing on a typewriter, your input appears dire...",No win (2 of 3)
200.,2014-10-29 04:10:27,128.25,94%,There are very few things I wish I could change about those ...,Win (1 of 3)
199.,2014-10-29 04:07:09,123.23,98%,There are still some places where you can get all you can ea...,Win (1 of 2)
198.,2014-10-29 04:06:13,111.22,92%,A few light taps upon the pane made him turn to the window. ...,Win (1 of 3)
197.,2014-10-28 04:05:15,135.38,95%,There are very few things I wish I could change about those ...,Win (1 of 3)
196.,2014-09-27 17:41:48,124.08,95%,Every time I think of you I feel shot right through with a b...,No win (3 of 3)
195.,2014-09-18 16:29:25,116.07,94%,The example of painting can teach us not only how to manage ...,No win (2 of 3)
194.,2014-09-18 16:28:43,121.73,99%,Imagine for a moment if we once again knew these few unremar...,Win (1 of 4)
193.,2014-09-18 07:16:08,122.15,98%,"But, pray how could that which I spoke so many years ago, an...",Win (1 of 3)
192.,2014-09-16 02:23:08,113.96,95%,"Now that I know that I'm breaking to pieces, I'll pull out m...",No win (2 of 3)
191.,2014-09-15 20:42:27,138.30,98%,"I hope that whoever you are, you escape this place. I hope t...",Win (1 of 3)
190.,2014-09-15 20:40:30,121.30,97%,If I'm curt with you it's because time is a factor. I think ...,No win (2 of 3)
189.,2014-09-15 20:38:42,128.38,97%,We've known each other for many years but this is the first ...,Win (1 of 5)
188.,2014-09-15 20:37:37,125.97,97%,Too often writers believe that they can emphasize words by p...,Win (1 of 4)
187.,2014-09-15 20:35:35,116.80,98%,"I rejected those answers; instead, I chose something differe...",Win (1 of 2)
186.,2014-09-15 20:34:46,116.15,96%,Let's face it: there are tons of things in your home and lif...,No win (2 of 3)
185.,2014-09-15 20:34:06,98.22,92%,"I know a bloke who knows a bloke who knows a bloke. Now, I k...",No win (3 of 3)
184.,2014-08-20 05:45:23,132.81,99%,"In general, many of these targets are easier marks if you ar...",Win (1 of 2)
183.,2014-08-20 05:38:04,137.50,100%,There's a hole in the world like a great black pit. And the ...,Win (1 of 3)
182.,2014-08-16 02:42:48,118.12,96%,"Keying text quickly is important, but it is more important t...",Win (1 of 3)
181.,2014-08-16 02:40:19,133.33,98%,"She's got a smile that, it seems to me, reminds me of childh...",Win (1 of 3)
180.,2014-08-09 22:18:36,110.59,93%,Well I woke in mid-afternoon cause that's when it all hurts ...,No win (2 of 5)
179.,2014-08-09 22:17:59,121.74,96%,"If you want to drive a race car well, whether to win an Indy...",Win (1 of 3)
178.,2014-08-09 22:16:47,132.42,98%,I have quit three jobs and been fired from all the rest. Get...,Win (1 of 3)
177.,2014-08-09 22:15:41,118.15,93%,Always do your best - your best is going to change from mome...,No win (3 of 3)
176.,2014-08-09 22:14:40,108.25,94%,There are two places on Earth that serve as canaries in the ...,Win (1 of 2)
175.,2014-08-05 21:02:37,117.55,98%,"The goal of the true seeker is to become a sage, or superior...",No win (2 of 2)
174.,2014-08-05 21:00:23,128.90,100%,But the two men were not lonely at all. At home they were co...,Win (1 of 2)
173.,2014-08-02 20:14:44,130.55,96%,"Right, I am going to tell you how this works. You're going i...",Win (1 of 3)
172.,2014-08-02 20:13:14,124.95,99%,"There was me, that is Alex, and my three droogs, that is Pet...",No win (2 of 3)
171.,2014-08-02 20:11:06,137.02,100%,"Whenever you watch the mind, you withdraw consciousness from...",Win (1 of 4)
170.,2014-08-02 20:09:29,132.76,100%,"Ticking away the moments that make up a dull day, you fritte...",Win (1 of 4)
169.,2014-08-01 19:28:00,133.34,98%,The ultimate way to compose is to be able to keyboard as fas...,Win (1 of 3)
168.,2014-08-01 19:20:02,127.49,100%,I never said I would stay to the end - I knew I would leave ...,Win (1 of 3)
167.,2014-08-01 19:17:01,111.70,94%,"The problem is, Willie, is that Charles and yourself are not...",Win (1 of 3)
166.,2014-08-01 19:16:32,114.20,97%,"Hey Mr. Tambourine Man, play a song for me, I'm not sleepy a...",Win (1 of 2)
165.,2014-08-01 19:10:43,125.16,94%,I am learning about twenty new Italian words a day. Where am...,Win (1 of 3)
164.,2014-08-01 19:09:53,127.99,99%,I can already hear your tune calling me across the room. Whe...,Win (1 of 3)
163.,2014-07-31 04:15:34,111.05,90%,There's a hole in the world like a great black pit. And the ...,No win (2 of 4)
162.,2014-07-30 22:05:45,123.27,98%,"Let's sort the buyers from the spiers, the needy from the gr...",Win (1 of 4)
161.,2014-07-30 22:04:48,128.79,99%,I'd just like to point out that you were given every opportu...,No win (2 of 3)
160.,2014-07-30 22:04:00,118.35,94%,"We turn away to face the cold, enduring chill, as the day be...",No win (3 of 4)
159.,2014-07-30 19:50:46,123.24,93%,I said that I would see you because I had heard that you wer...,No win (3 of 3)
158.,2014-07-30 18:32:08,128.99,98%,We were playing checkers. I used to kid her once in a while ...,Win (1 of 3)
157.,2014-07-30 18:30:37,108.20,92%,I don't believe in painted roses or bleeding hearts while bu...,No win (3 of 3)
156.,2014-07-30 18:30:06,122.83,99%,"Thirdly, however, these wars could now be waged with the new...",No win (3 of 3)
155.,2014-07-29 18:04:42,121.08,96%,Always do your best - your best is going to change from mome...,Win (1 of 3)
154.,2014-07-21 06:31:06,113.26,93%,"If you want to drive a race car well, whether to win an Indy...",Win (1 of 3)
153.,2014-07-21 06:30:05,120.20,94%,Step out the front door like a ghost into the fog where no o...,Win (1 of 5)
152.,2014-07-21 06:29:25,107.98,92%,The unknown future rolls toward us. I face it for the first ...,No win (2 of 3)
151.,2014-07-21 06:28:35,123.29,94%,"Life is not suffering; it's just that you will suffer it, ra...",No win (2 of 3)
150.,2014-07-21 06:27:16,120.37,95%,I will need my spectacles and a clear head. Today I broke my...,Win (1 of 4)
149.,2014-07-21 06:25:36,124.06,97%,Let's face it: there are tons of things in your home and lif...,Win (1 of 2)
148.,2014-07-21 06:22:25,121.63,94%,"The less you do with the controls, the less chance of error....",Win (1 of 3)
147.,2014-07-21 06:21:41,124.61,96%,I've flown seven million miles. And I've been waiting on peo...,No win (2 of 3)
146.,2014-07-21 05:36:02,122.07,95%,Sometimes you concentrate more on racing the cars around you...,No win (2 of 4)
145.,2014-07-21 03:40:01,122.36,95%,We sit silently and watch the world around us. This has take...,Win (1 of 2)
144.,2014-07-16 22:17:11,112.37,95%,A glooming peace this morning with it brings. The sun for so...,No win (5 of 5)
143.,2014-07-16 20:00:52,111.06,88%,"Well, the way they make shows is, they make one show. That s...",Win (1 of 5)
142.,2014-07-16 05:49:54,113.43,93%,"The problem is, Willie, is that Charles and yourself are not...",No win (2 of 3)
141.,2014-07-16 05:49:01,122.91,95%,"Races are not won in the first corner; however, they are oft...",Win (1 of 5)
140.,2014-07-16 05:45:49,127.46,97%,"I'm so glad you came, I'm so glad you remembered, to see how...",Win (1 of 3)
139.,2014-07-16 05:39:25,127.95,100%,Who has a safety deposit box full of money and six passports...,Win (1 of 4)
138.,2014-07-13 04:46:05,109.69,96%,"That day, for no particular reason, I decided to go for a li...",Win (1 of 2)
137.,2014-07-13 04:43:26,128.06,95%,Is it really necessary to send that email? The more emails y...,Win (1 of 3)
136.,2014-07-13 04:33:34,132.04,97%,Now I want you to think and stop being a smart aleck. A man'...,Win (1 of 2)
135.,2014-07-11 06:27:26,122.67,97%,"If you want to drive a race car well, whether to win an Indy...",Win (1 of 2)
134.,2014-07-11 06:11:56,130.67,95%,"If you don't get what you want, you suffer; if you get what ...",Win (1 of 3)
133.,2014-07-11 06:09:18,130.03,100%,I don't know why he saved my life. Maybe in those last momen...,Win (1 of 3)
132.,2014-07-09 05:55:12,143.88,100%,"That's Tommy. He tells people he was named after a gun, but ...",Win (1 of 3)
131.,2014-07-09 05:54:29,131.30,100%,"A little boy went out to play. When he opened his door, he s...",Win (1 of 3)
130.,2014-07-09 05:54:05,109.61,93%,Corn is what feeds the steer that becomes the steak. Corn fe...,No win (3 of 3)
129.,2014-07-09 05:52:48,113.81,97%,"Yet one fine day, in a fit of euphoria, after he had picked ...",No win (3 of 3)
128.,2014-07-09 05:51:51,128.58,95%,If there is one thing the history of evolution has taught us...,Win (1 of 2)
127.,2014-07-06 03:10:06,112.10,92%,"If we all go for the blonde and block each other, not a sing...",Win (1 of 2)
126.,2014-07-06 03:09:06,111.78,90%,How many roads must a man walk down before you call him a ma...,No win (2 of 4)
125.,2014-07-06 03:07:51,138.87,100%,I've always wondered about this coat business. When I'm in a...,No win (1 of 1)
124.,2014-07-06 03:07:07,133.90,98%,The example of painting can teach us not only how to manage ...,Win (1 of 4)
123.,2014-07-06 03:06:20,114.87,92%,"When you are typing on a typewriter, your input appears dire...",Win (1 of 3)
122.,2014-07-06 03:05:34,118.56,97%,Everything we hold dear likewise resolves into its original ...,Win (1 of 3)
121.,2014-07-06 03:04:08,131.52,97%,"The creation ends in South Georgia, at the very edge of the ...",Win (1 of 3)
120.,2014-07-04 04:54:07,100.58,93%,"What about Tony? You know, Bullet Tooth Tony. He'll find you...",No win (2 of 4)
119.,2014-07-04 04:53:28,114.41,98%,It takes more than a calorie of fossil fuel energy to produc...,Win (1 of 2)
118.,2014-07-04 04:52:30,113.58,88%,The place to improve the world is first in one's own heart a...,No win (2 of 2)
117.,2014-07-04 04:46:36,119.59,97%,I've flown seven million miles. And I've been waiting on peo...,No win (1 of 1)
116.,2014-07-04 04:45:41,114.30,94%,Yet the web of thought has no such creases and is more like ...,No win (1 of 1)
115.,2014-07-04 04:44:48,118.63,95%,"I'm so glad you came, I'm so glad you remembered, to see how...",No win (3 of 5)
