117.,2015-06-05 08:57:25,79.79,93%,"I never wanted to become someone like him. So secure, conten...",No win (3 of 4)
116.,2015-06-04 11:13:44,70.73,93%,"Geometry sets out from certain conceptions such as ""plane,"" ...",No win (2 of 5)
115.,2015-06-01 11:01:18,80.99,92%,"Prior to the 1970's, because the United States had long been...",No win (2 of 5)
114.,2015-06-01 10:59:47,84.92,95%,"I was stealing saltshakers again. Ten, sometimes twelve a ni...",No win (2 of 4)
113.,2015-06-01 10:57:50,94.75,93%,"I hope that whoever you are, you escape this place. I hope t...",No win (2 of 3)
112.,2015-06-01 10:55:47,83.59,93%,"I'm so glad you came, I'm so glad you remembered, to see how...",No win (3 of 3)
111.,2015-06-01 10:51:44,74.15,93%,This business is filled to the brim with unrealistic people ...,No win (3 of 3)
110.,2015-06-01 10:46:44,81.23,93%,The unknown future rolls toward us. I face it for the first ...,No win (2 of 5)
109.,2015-06-01 10:45:45,75.98,93%,"Wilkinson County was a recipient of one of the new ""separate...",No win (2 of 3)
108.,2015-06-01 10:44:11,81.87,94%,Overhead the albatross hangs motionless upon the air and dee...,No win (3 of 5)
107.,2015-06-01 10:42:57,90.95,95%,"The day dawned bleak and chill, a moving wall of gray light ...",No win (2 of 4)
106.,2015-06-01 10:41:14,97.25,96%,"Hanging by threads of palest silver, I could have stayed tha...",No win (3 of 4)
105.,2015-06-01 10:40:12,88.91,93%,"I often see racers, particularly at the back of the pack in ...",No win (2 of 3)
104.,2015-06-01 10:38:39,74.05,92%,Some have a positive vocation for breaking open safes: from ...,No win (2 of 5)
103.,2015-06-01 10:37:42,86.32,96%,"Life is not suffering; it's just that you will suffer it, ra...",No win (2 of 5)
102.,2015-06-01 10:36:49,89.21,94%,Since the 1980s virtually all the sodas and most of the frui...,Win (1 of 3)
101.,2015-06-01 10:35:38,86.90,94%,"In the casino, the cardinal rule is to keep them playing and...",No win (2 of 4)
100.,2015-06-01 10:34:52,85.73,93%,Stab a sorry heart with your favorite finger. Paint the whol...,No win (2 of 5)
99.,2015-06-01 10:34:00,79.89,91%,Lucid but wholly false recollections can easily be induced b...,No win (2 of 3)
98.,2015-06-01 10:33:17,82.36,97%,And I don't believe in the existence of angels but looking a...,No win (2 of 5)
97.,2015-06-01 10:32:19,98.22,97%,"Remember, if the time should come when you have to make a ch...",Win (1 of 4)
96.,2015-06-01 10:31:28,96.06,99%,I was having this awful nightmare that I was 32. And then I ...,No win (3 of 5)
95.,2015-06-01 10:31:01,87.07,97%,"When I really worry about something, I don't just fool aroun...",No win (3 of 5)
94.,2015-06-01 10:30:10,85.46,93%,"When she returns to the forum page, her post is there. It is...",Win (1 of 4)
93.,2015-06-01 10:29:15,91.81,96%,"The creation ends in South Georgia, at the very edge of the ...",Win (1 of 4)
92.,2015-06-01 10:28:12,86.33,95%,God help the man who ever really loves you. You'd break his ...,Win (1 of 4)
91.,2015-06-01 10:27:37,83.97,95%,"If I leave here tomorrow, would you still remember me? For I...",No win (2 of 3)
90.,2015-06-01 10:26:39,84.16,95%,"This planet has, or rather had, a problem, which was this: m...",No win (2 of 3)
89.,2015-06-01 10:25:40,70.53,91%,If I'm curt with you it's because time is a factor. I think ...,No win (3 of 4)
88.,2015-06-01 10:24:43,84.39,95%,"Double, double, toil and trouble; fire burn, and cauldron bu...",Win (1 of 5)
87.,2015-05-31 19:44:38,87.23,95%,"But, pray how could that which I spoke so many years ago, an...",No win (2 of 3)
86.,2015-05-31 19:43:45,90.24,99%,The invention of the wheel represented a major turning point...,Win (1 of 3)
85.,2015-05-31 19:42:55,76.70,92%,"Comfortable, Mullet? It seems sadly ironic that it's that ti...",Win (1 of 2)
84.,2015-05-31 19:42:00,75.98,89%,You've got a way to keep me on your side. You give me cause ...,No win (2 of 4)
83.,2015-05-31 19:41:21,81.11,97%,I was having this awful nightmare that I was 32. And then I ...,No win (4 of 5)
82.,2015-05-31 19:40:37,80.02,98%,Aztec rule was based upon a system of tribute and fear over ...,Win (1 of 3)
81.,2015-05-31 19:35:34,94.62,96%,The major difference between a thing that might go wrong and...,No win (4 of 4)
80.,2015-05-31 19:33:33,73.45,91%,"Yes, the newspapers were right: snow was general all over Ir...",Win (1 of 2)
79.,2015-05-31 19:32:37,85.65,96%,The men in the room suddenly realized that they didn't want ...,No win (2 of 3)
78.,2015-05-31 19:31:03,96.25,99%,"Ticking away the moments that make up a dull day, you fritte...",Win (1 of 2)
77.,2015-05-31 18:32:36,81.67,98%,"A robot may not injure a human being, or, through inaction, ...",Win (1 of 5)
76.,2015-05-31 18:31:20,83.55,98%,"Remember, if the time should come when you have to make a ch...",No win (2 of 4)
75.,2015-05-31 18:28:58,70.92,92%,"Let me get this straight. You think that your client, one of...",Win (1 of 2)
74.,2015-05-31 10:48:03,77.09,94%,Suppose you suggest to your husband that subsidized llama fa...,No win (2 of 5)
73.,2015-05-31 10:47:13,83.83,91%,Since every piece of matter in the Universe is in some way a...,Win (1 of 2)
72.,2015-05-31 10:46:12,79.51,93%,A problem in communication is that people don't smile enough...,No win (4 of 4)
71.,2015-05-31 10:45:21,82.83,94%,Suppose you suggest to your husband that subsidized llama fa...,No win (3 of 4)
70.,2015-05-31 10:44:31,81.12,94%,"On a manual typewriter, strike the key with a nice sharp str...",No win (4 of 5)
69.,2015-05-31 10:43:45,89.58,94%,"I hope that whoever you are, you escape this place. I hope t...",No win (2 of 2)
68.,2015-05-31 10:42:48,89.61,94%,"In general, many of these targets are easier marks if you ar...",Win (1 of 5)
67.,2015-05-31 10:41:36,76.95,94%,"In the late 1960s, a growing number of people became concern...",No win (2 of 2)
66.,2015-05-31 10:40:22,81.85,98%,So I'm two inches away from her. Her luscious lips part. Jus...,Win (1 of 4)
65.,2015-05-31 10:39:46,80.20,95%,When beetles fight these battles in a bottle with their padd...,No win (2 of 2)
64.,2015-05-31 10:39:04,95.87,95%,I suddenly had the impression that I had been left all alone...,Win (1 of 4)
63.,2015-05-31 10:37:59,91.04,98%,We don't read and write poetry because it's cute. We read an...,Win (1 of 5)
62.,2015-05-31 10:37:02,87.13,95%,In the beginning there was only a small amount of injustice ...,No win (3 of 4)
61.,2015-05-31 10:33:07,94.81,98%,Even the best-designed chair won't make up for bad posture. ...,Win (1 of 3)
60.,2015-05-31 10:32:21,89.64,98%,Your faith was strong but you needed proof. You saw her bath...,Win (1 of 5)
59.,2015-05-31 10:31:16,95.75,97%,Writing is hard work. A clear sentence is no accident. Very ...,Win (1 of 3)
58.,2015-05-31 10:30:34,64.17,87%,"Ergonomics is a term that combines the Greek word ergon, mea...",No win (3 of 3)
57.,2015-05-31 10:29:40,69.35,92%,Although the United Nations does not have the power to enfor...,Win (1 of 3)
56.,2015-05-31 10:28:44,80.51,93%,"Do you smell that? Napalm, son. Nothing else in the world sm...",No win (2 of 5)
55.,2015-05-31 10:27:55,96.40,97%,One essential rule: make sure the joke is the last possible ...,No win (3 of 5)
54.,2015-05-31 09:21:17,75.14,96%,We don't need no education. We don't need no thought control...,No win (2 of 4)
53.,2015-05-31 09:20:16,83.67,94%,"I was shaking like a leaf, so without thinking I lit up a ci...",Win (1 of 4)
52.,2015-05-31 09:19:04,70.55,90%,"Prior to the 1970's, because the United States had long been...",Win (1 of 2)
51.,2015-05-31 09:17:35,84.02,93%,The beginner writes just twenty pieces. The professional wri...,Win (1 of 4)
50.,2015-05-31 09:16:56,85.19,94%,Everything we hold dear likewise resolves into its original ...,No win (2 of 3)
49.,2015-05-31 09:15:49,93.15,96%,Unlike the other four senses located in the logical regions ...,No win (2 of 5)
48.,2015-05-31 09:15:01,86.97,96%,One thing I've learned in the last seven years: in every gam...,Win (1 of 5)
47.,2015-05-31 09:14:21,95.94,98%,"When I close my eyes, I am at the center of the sun. And I c...",Win (1 of 4)
46.,2015-05-31 09:13:44,77.20,92%,"Your face has fallen sad now, for you know the time is nigh....",No win (2 of 2)
45.,2015-05-31 09:12:58,74.03,96%,"Kid, I've flown from one side of this galaxy to the other, a...",No win (3 of 4)
44.,2015-05-31 09:12:06,73.47,93%,"In the witch trials, it was nearly impossible to provide com...",No win (2 of 3)
43.,2015-05-31 09:10:53,84.70,95%,In order to become an elf I filled out ten pages' worth of f...,No win (3 of 3)
42.,2015-05-31 09:09:42,73.02,92%,"Whether you're a student, secretary, office administrator, m...",Win (1 of 3)
41.,2015-05-31 09:08:54,88.75,97%,He managed to open the cupboard door with his nose and found...,Win (1 of 5)
40.,2015-05-31 09:08:06,82.58,95%,Data is by definition easy to copy. And the Internet makes c...,No win (1 of 1)
39.,2015-05-31 09:06:58,92.06,95%,"People get ready, there's a train coming. You don't need no ...",Win (1 of 3)
38.,2015-05-31 09:04:48,105.57,99%,"No matter how bad things are, you can always make things wor...",Win (1 of 4)
37.,2015-05-31 09:04:17,81.77,95%,"I was shaking like a leaf, so without thinking I lit up a ci...",No win (2 of 4)
36.,2015-05-31 09:03:07,82.82,97%,There was a stage and a PA up in western Massachusetts and t...,No win (2 of 3)
35.,2015-05-31 09:02:09,89.80,98%,"Let me put it this way, Mr. Amor. The 9000 series is the mos...",Win (1 of 4)
34.,2015-05-31 09:01:15,78.75,95%,Since every piece of matter in the Universe is in some way a...,Win (1 of 3)
33.,2015-05-31 03:54:05,85.18,96%,"But it is important to know this, to know your roots. To kno...",No win (2 of 3)
32.,2015-05-31 03:43:21,85.51,96%,I never said I would stay to the end - I knew I would leave ...,No win (2 of 5)
31.,2015-05-31 03:42:18,89.55,98%,Your inner child will be happy to know that when it comes to...,No win (2 of 4)
30.,2015-05-31 03:40:44,74.48,96%,"Everybody's talking about revolution, evolution, mastication...",No win (2 of 3)
29.,2015-05-31 03:38:31,85.61,96%,A few light taps upon the pane made him turn to the window. ...,Win (1 of 3)
28.,2015-05-31 03:37:46,83.48,97%,We all know people who are very bright but who do not always...,Win (1 of 5)
27.,2015-05-31 03:36:59,67.99,88%,"Some pilots like the excitement of our missions, knowing tha...",No win (2 of 5)
26.,2015-05-31 03:36:01,73.50,89%,"You found paradise in America. You had a good trade, made a ...",No win (2 of 5)
25.,2015-05-31 03:34:44,87.18,97%,"The time I waited seemed endless, and I felt doubts and fear...",Win (1 of 2)
24.,2015-05-31 03:34:02,78.95,91%,We were playing checkers. I used to kid her once in a while ...,Win (1 of 4)
23.,2015-05-31 03:32:55,78.72,98%,I know that you weren't bored that day because there was a l...,Win (1 of 5)
22.,2015-05-31 03:31:51,77.89,95%,"After the grapes are crushed, yeasts (tiny one-celled organi...",Win (1 of 5)
21.,2015-05-31 03:28:51,69.45,91%,"Alfred Hitchcock once said, ""Drama is life with the dull bit...",No win (3 of 3)
20.,2015-05-31 03:27:42,57.26,95%,"To be fair, English is full of booby traps for the unwary fo...",No win (4 of 5)
19.,2015-05-31 03:26:14,95.81,100%,Who has a safety deposit box full of money and six passports...,Win (1 of 5)
18.,2015-05-31 03:23:46,91.02,97%,"The goal of the true seeker is to become a sage, or superior...",Win (1 of 4)
17.,2015-05-31 02:04:23,60.86,92%,Scissors cuts paper. Paper covers rock. Rock crushes lizard....,Win (1 of 4)
16.,2015-05-31 02:03:21,63.09,87%,"Trudging slowly over wet sand, back to the bench where your ...",No win (4 of 5)
15.,2015-05-31 02:02:35,85.90,96%,Don't bother trying to explain your emotions. Live everythin...,No win (2 of 3)
14.,2015-05-31 02:01:42,77.41,93%,It's the possibility of having a dream come true that makes ...,No win (3 of 5)
13.,2015-05-31 02:00:48,73.83,91%,The feeling of having no power over people and events is gen...,No win (2 of 3)
12.,2015-05-31 01:59:30,77.74,92%,Paper as we know it today was invented in China in around 10...,Win (1 of 2)
11.,2015-05-31 01:58:34,78.34,91%,"There are perhaps twenty regular posters on the forum, and s...",Win (1 of 2)
10.,2015-05-31 01:57:21,81.52,93%,At first they had tried to keep the finding quiet. After all...,No win (3 of 3)
9.,2015-05-31 01:56:08,84.50,94%,The pathology of setting a deadline to the earliest articula...,No win (3 of 4)
8.,2015-05-31 01:55:07,80.40,93%,Is it really necessary to send that email? The more emails y...,No win (3 of 5)
7.,2015-05-31 01:54:09,77.72,94%,The evidence in the standard history of Qwerty versus Dvorak...,Win (1 of 4)
6.,2015-05-31 01:52:39,76.80,92%,It is greatly to America's advantage that it is a congenial ...,No win (3 of 4)
5.,2015-05-31 01:51:34,87.08,97%,Mac knew the score even if Aunt Ella didn't. Shot through th...,Win (1 of 3)
4.,2015-05-31 01:50:22,65.10,85%,"Historically, most wines contained less than 14 percent alco...",No win (2 of 3)
3.,2015-05-31 01:49:17,79.73,93%,"Keying text quickly is important, but it is more important t...",Win (1 of 4)
2.,2015-05-31 01:48:26,80.80,93%,"Samatha is a state in which the mind is brought to rest, foc...",No win (3 of 3)
1.,2015-05-31 01:45:56,116.61,100%,The quick brown fox jumps over the lazy dog.,Win (1 of 3)
