86.,2012-03-11 18:45:35,91.34,94%,"In general, many of these targets are easier marks if you ar...",Win (1 of 2)
85.,2011-09-04 11:37:21,139.85,97%,"Ticking away the moments that make up a dull day, you fritte...",Win (1 of 3)
84.,2011-09-04 11:35:12,124.00,98%,And I will strike down upon thee with great vengeance and fu...,No win (1 of 1)
83.,2011-09-04 11:34:15,111.00,95%,"Now you might ask yourself, if by yourself you mean me, ""Ste...",Win (1 of 2)
82.,2011-09-04 01:45:00,139.13,100%,For it is not enough to have a good mind; the main thing is ...,Win (1 of 3)
81.,2011-09-04 01:43:47,120.05,98%,"I was shaking like a leaf, so without thinking I lit up a ci...",Win (1 of 4)
80.,2010-08-05 10:54:56,131.32,100%,"It was a marvelous night, the sort of night one only experie...",Win (1 of 2)
79.,2010-08-05 10:54:15,123.58,100%,"People get ready, there's a train coming. You don't need no ...",Win (1 of 3)
78.,2010-08-05 10:53:09,119.97,100%,Sholes consulted with an educator who helped him analyze the...,Win (1 of 2)
77.,2010-08-05 10:51:56,123.48,100%,"Warmer water increases the moisture content of storms, and w...",Win (1 of 3)
76.,2010-08-05 10:51:00,118.85,100%,"When I was your age, television was called books. And this i...",Win (1 of 4)
75.,2010-08-05 10:50:21,106.85,100%,"The Orient was almost a European invention, and had been sin...",Win (1 of 2)
74.,2010-08-05 10:49:39,101.69,100%,"Whether they use the title or not, many lyrics have evocativ...",Win (1 of 2)
73.,2010-05-23 16:23:20,140.48,100%,The odds are that you will generally meet the worst of them....,Win (1 of 4)
72.,2010-05-23 16:20:58,125.90,100%,"My dog barks some. Mentally you picture my dog, but I have n...",Win (1 of 4)
71.,2010-05-23 16:20:26,124.89,100%,"As if that blind rage had washed me clean, rid me of hope; f...",Win (1 of 3)
70.,2010-05-23 16:18:13,133.00,100%,The only preventive thing I do is wash clothes after buying ...,Win (1 of 3)
69.,2010-05-23 16:17:18,138.34,100%,"It was a marvelous night, the sort of night one only experie...",Win (1 of 2)
68.,2010-05-23 16:15:25,145.03,100%,"They say that right after God created man, he took a rib fro...",Win (1 of 4)
67.,2010-05-23 16:14:01,122.58,100%,The pathology of setting a deadline to the earliest articula...,No win (2 of 3)
66.,2010-05-23 16:12:17,137.38,100%,Remember that humor is written backwards. That means you fir...,Win (1 of 2)
65.,2010-05-23 16:10:50,131.30,100%,Yet the web of thought has no such creases and is more like ...,Win (1 of 2)
64.,2010-05-23 16:10:01,117.78,100%,Quality humor doesn't just deliver one gag and then tax the ...,Win (1 of 4)
63.,2010-05-23 16:08:59,138.42,100%,"That day, for no particular reason, I decided to go for a li...",Win (1 of 3)
62.,2010-05-23 16:06:44,117.38,100%,"It may seem quite novelistic to you, and I am willing to agr...",Win (1 of 3)
61.,2010-05-23 16:05:06,143.95,100%,The time has come for man to set himself a goal. The time ha...,Win (1 of 3)
60.,2009-02-26 00:01:26,116.04,100%,"They had been given a sign - a powerful, lucid sign - that u...",Win (1 of 2)
59.,2009-02-25 23:55:29,115.30,100%,Quality humor doesn't just deliver one gag and then tax the ...,Win (1 of 3)
58.,2009-02-25 23:54:10,111.39,100%,"And today, Lady Liberty is under attack from the cable chann...",Win (1 of 4)
57.,2009-02-25 23:52:40,123.79,100%,"Ezekiel twenty-five, seventeen: The path of the righteous ma...",Win (1 of 2)
56.,2009-02-25 23:50:55,118.05,100%,"A lot of people, especially this one psychoanalyst guy they ...",Win (1 of 3)
55.,2009-02-25 23:49:37,112.64,100%,"That's Tommy. He tells people he was named after a gun, but ...",Win (1 of 3)
54.,2009-02-25 23:48:02,124.61,100%,"I can feel the heat closing in, feel them out there making t...",Win (1 of 3)
53.,2009-02-25 23:46:54,134.86,100%,"The problem is, Willie, is that Charles and yourself are not...",Win (1 of 4)
52.,2009-02-25 23:46:15,48.13,100%,What should have been swift revenge turned into an all out w...,No win (4 of 4)
51.,2009-02-25 23:44:09,116.87,100%,You could choke a dozen donkeys on that! And you're haggling...,Win (1 of 3)
50.,2009-02-25 23:42:38,145.11,100%,Let's face it: there are tons of things in your home and lif...,Win (1 of 3)
49.,2009-02-25 23:41:32,130.49,100%,Space is big. Really big. You just won't believe how vastly ...,Win (1 of 3)
48.,2009-01-19 16:47:39,121.84,100%,For it is not enough to have a good mind; the main thing is ...,No win (2 of 4)
47.,2009-01-19 16:46:54,92.35,100%,I had a friend who was a heavy drinker. If somebody asked hi...,No win (2 of 4)
46.,2009-01-19 16:46:16,119.09,100%,Few smart kids can spare the attention that popularity requi...,Win (1 of 5)
45.,2009-01-19 16:45:05,139.62,100%,"There was me, that is Alex, and my three droogs, that is Pet...",Win (1 of 5)
44.,2009-01-19 16:43:33,108.81,100%,"I had a job, I had a girl. I had something going, mister, in...",Win (1 of 5)
43.,2008-12-27 18:52:09,115.41,100%,The inner surface of the cell wall touches the cytoplasmic m...,Win (1 of 5)
42.,2008-12-27 18:51:35,107.30,100%,You could choke a dozen donkeys on that! And you're haggling...,Win (1 of 3)
41.,2008-12-27 18:50:56,127.48,100%,If there is one thing the history of evolution has taught us...,Win (1 of 3)
40.,2008-12-27 18:50:26,123.36,100%,Even the best-designed chair won't make up for bad posture. ...,Win (1 of 4)
39.,2008-12-27 18:43:50,133.93,100%,The only preventive thing I do is wash clothes after buying ...,Win (1 of 3)
38.,2008-12-27 18:42:55,126.09,100%,"You needn't take it any further, sir. You've proved to me th...",Win (1 of 3)
37.,2008-12-15 03:06:19,128.84,100%,"That's Tommy. He tells people he was named after a gun, but ...",Win (1 of 5)
36.,2008-12-15 03:05:18,127.62,100%,She's got eyes of the bluest skies as if they thought of rai...,Win (1 of 5)
35.,2008-12-15 03:04:01,130.53,100%,It was one of those days when it's a minute away from snowin...,Win (1 of 4)
34.,2008-12-15 03:02:45,127.37,100%,"Well, the way they make shows is, they make one show. That s...",Win (1 of 4)
33.,2008-12-15 03:01:27,131.77,100%,"If we all go for the blonde and block each other, not a sing...",Win (1 of 4)
32.,2008-12-15 02:59:58,116.36,100%,"An essential characteristic of the superhero mythology is, t...",Win (1 of 4)
31.,2008-12-15 02:58:16,121.15,100%,Too often writers believe that they can emphasize words by p...,Win (1 of 5)
30.,2008-12-15 02:56:54,121.97,100%,"Warmer water increases the moisture content of storms, and w...",Win (1 of 5)
29.,2008-12-15 02:55:39,107.12,100%,"The National Rifle Association says that, ""Guns don't kill p...",Win (1 of 3)
28.,2008-12-15 02:54:19,137.46,100%,"There is no pain, you are receding. A distant ship smoke on ...",Win (1 of 4)
27.,2008-12-15 02:53:10,123.37,100%,If I'm curt with you it's because time is a factor. I think ...,Win (1 of 5)
26.,2008-12-15 02:52:04,123.53,100%,All that year the animals worked like slaves. But they were ...,Win (1 of 4)
25.,2008-12-15 02:50:30,131.66,100%,"A long time ago, I was in Burma, my friends and I were worki...",Win (1 of 3)
24.,2008-12-15 02:48:59,105.67,100%,"The result has been the emergence of what some call the ""win...",Win (1 of 5)
23.,2008-12-15 02:47:30,127.36,100%,The only preventive thing I do is wash clothes after buying ...,Win (1 of 5)
22.,2008-12-15 02:46:19,134.10,100%,"To evaluate an option from the other side's point of view, c...",Win (1 of 5)
21.,2008-12-15 02:45:05,115.64,100%,Supermarket aisles are the perfect place to practice your gl...,Win (1 of 5)
20.,2008-12-15 02:43:49,123.44,100%,But speculations on the structure of the universe also move ...,Win (1 of 4)
19.,2008-12-15 02:42:29,113.69,100%,"You needn't take it any further, sir. You've proved to me th...",Win (1 of 5)
18.,2008-12-15 02:39:28,111.87,100%,"I'd been walking for hours and, as usual, I'd lost track of ...",Win (1 of 5)
17.,2008-12-15 02:38:06,115.81,100%,"What good's a reward if you ain't around to use it? Besides,...",Win (1 of 3)
16.,2008-12-15 02:37:22,111.13,100%,If I'm curt with you it's because time is a factor. I think ...,Win (1 of 3)
15.,2008-12-15 02:36:36,108.73,100%,"If you are given too many choices, if you are forced to cons...",Win (1 of 4)
14.,2008-12-07 23:56:16,126.54,100%,Maybe what I think Tasty Wheat tasted like actually tasted l...,Win (1 of 3)
13.,2008-12-07 23:54:34,128.28,100%,It doesn't mean much to be able to filter out most present-d...,Win (1 of 3)
12.,2008-12-07 23:46:53,125.35,100%,"The creation ends in South Georgia, at the very edge of the ...",Win (1 of 3)
11.,2008-12-07 23:45:04,124.21,100%,Who has a safety deposit box full of money and six passports...,Win (1 of 3)
10.,2008-12-07 23:43:24,135.09,100%,It's the possibility of having a dream come true that makes ...,Win (1 of 3)
9.,2008-12-07 23:41:27,121.33,100%,A giant inverted steel pyramid is perfectly balanced on its ...,Win (1 of 3)
8.,2008-12-07 23:39:41,118.36,100%,"Let me get this straight. You think that your client, one of...",Win (1 of 3)
7.,2008-12-07 23:37:29,106.35,100%,Supermarket aisles are the perfect place to practice your gl...,Win (1 of 3)
6.,2008-12-07 23:19:53,125.04,100%,Overhead the albatross hangs motionless upon the air and dee...,Win (1 of 2)
5.,2008-12-07 23:17:56,121.12,100%,Any finite number divided by infinity is as near to nothing ...,Win (1 of 2)
4.,2008-12-07 23:16:30,130.08,100%,So what's in this for you? Should you rush out in search of ...,Win (1 of 2)
3.,2008-12-07 23:14:44,117.57,100%,In order to face down the danger that is stalking us and mov...,Win (1 of 2)
2.,2008-11-16 01:55:54,130.48,100%,Lucid but wholly false recollections can easily be induced b...,Win (1 of 5)
1.,2008-11-15 14:31:48,124.56,100%,"Let's sort the buyers from the spiers, the needy from the gr...",Win (1 of 3)
