312.,2012-10-05 02:54:28,118.34,97%,"When I was a kid, you never saw radicchio in the produce sec...",Win (1 of 5)
311.,2012-10-05 02:53:36,133.97,97%,Good games offer players a set of challenging problems and t...,Win (1 of 2)
310.,2012-10-05 02:53:07,122.73,98%,"When Betty and Billy fell asleep, he walked down to the kitc...",Win (1 of 3)
309.,2012-10-05 02:52:11,133.43,97%,If you're working out in front of a mirror and watching your...,Win (1 of 3)
308.,2012-10-05 02:51:27,117.09,97%,"It turned out that the sweet-talking, tattoo-sporting pikey ...",Win (1 of 2)
307.,2012-10-05 02:50:37,111.43,95%,"Finally, gentlemen, there are people with an hereditary anim...",Win (1 of 4)
306.,2012-10-05 02:49:28,122.60,97%,Glancing through the 1977 Atlanta Yellow Pages reveals a cit...,Win (1 of 2)
305.,2012-10-05 02:48:34,146.03,99%,"When you are typing on a typewriter, your input appears dire...",Win (1 of 5)
304.,2012-10-05 02:47:56,115.33,96%,"Historically, most wines contained less than 14 percent alco...",Win (1 of 2)
303.,2012-10-05 02:47:02,121.27,98%,"They knew they were privileged to have these choices, but th...",Win (1 of 2)
302.,2012-10-05 02:45:51,159.11,100%,"I went to the woods because I wished to live deliberately, t...",Win (1 of 5)
301.,2012-10-05 02:45:15,112.90,93%,"After the grapes are crushed, yeasts (tiny one-celled organi...",Win (1 of 5)
300.,2012-10-05 02:44:33,139.16,99%,Overhead the albatross hangs motionless upon the air and dee...,Win (1 of 2)
299.,2012-10-05 02:43:49,132.01,97%,"I'm so glad you came, I'm so glad you remembered, the walkin...",Win (1 of 4)
298.,2012-10-05 02:43:11,127.81,97%,"A lot of people, especially this one psychoanalyst guy they ...",Win (1 of 4)
297.,2012-10-05 02:42:20,125.18,96%,Well I woke in mid-afternoon cause that's when it all hurts ...,Win (1 of 2)
296.,2012-10-05 02:41:32,118.65,95%,The theory of music emphasizes the elements from which music...,Win (1 of 3)
295.,2012-10-05 02:40:35,111.14,94%,"I was hugely impressed. Kirk, I mean Shatner, was the ultima...",Win (1 of 4)
294.,2012-10-05 02:40:03,133.35,100%,"Well, it just so happens, this hacienda comes with its very ...",Win (1 of 2)
293.,2012-10-05 02:39:21,117.16,96%,Facts can be thought of as objective or subjective. Things a...,Win (1 of 2)
292.,2012-10-04 01:12:28,106.05,95%,"Now you might ask yourself, if by yourself you mean me, ""Ste...",Win (1 of 2)
291.,2012-10-04 01:11:06,126.64,97%,Typing competitions provided another test of the Qwerty keyb...,Win (1 of 3)
290.,2012-10-04 01:10:02,125.91,96%,"When I really worry about something, I don't just fool aroun...",Win (1 of 2)
289.,2012-10-04 01:09:24,121.13,94%,The time has come for man to set himself a goal. The time ha...,No win (2 of 3)
288.,2012-10-04 01:08:19,125.01,96%,"I'm so glad you came, I'm so glad you remembered, the walkin...",Win (1 of 5)
287.,2012-10-04 01:07:36,138.10,100%,"There was me, that is Alex, and my three droogs, that is Pet...",Win (1 of 3)
286.,2012-10-04 01:06:37,148.34,100%,"When you are typing on a typewriter, your input appears dire...",Win (1 of 4)
285.,2012-10-04 01:03:26,130.59,97%,"With no map to navigate one's life, some of us have stood st...",Win (1 of 5)
284.,2012-10-04 01:02:20,135.59,99%,I can already hear your tune calling me across the room. Whe...,Win (1 of 5)
283.,2012-10-04 01:01:23,126.59,95%,It was hard to toss things I had once thought were valuable ...,Win (1 of 3)
282.,2012-10-04 01:00:22,122.11,99%,"Historian James C. Cobb has described southern identity as ""...",Win (1 of 4)
281.,2012-10-04 00:59:26,133.40,98%,Some have a positive vocation for breaking open safes: from ...,Win (1 of 3)
280.,2012-10-04 00:58:36,140.46,99%,"When we conceive of the sweetest being ever, we are conceivi...",Win (1 of 5)
279.,2012-10-04 00:57:02,106.15,93%,I still see things that are not here. I just choose not to a...,No win (2 of 5)
278.,2012-10-04 00:55:56,141.78,100%,"I don't believe in an interventionist God, but I know, darli...",No win (1 of 1)
277.,2012-10-04 00:55:11,122.62,96%,"Trudging slowly over wet sand, back to the bench where your ...",No win (2 of 3)
276.,2012-10-01 19:03:40,121.22,94%,The wine list looks so imposing that you finally give up lab...,Win (1 of 2)
275.,2012-10-01 19:02:45,127.99,95%,The wine list looks so imposing that you finally give up lab...,Win (1 of 2)
274.,2012-10-01 19:01:43,137.09,98%,I said that I would see you because I had heard that you wer...,Win (1 of 2)
273.,2012-10-01 19:00:50,128.37,97%,"I can feel the heat closing in, feel them out there making t...",Win (1 of 4)
272.,2012-10-01 19:00:02,122.21,97%,"In general, many of these targets are easier marks if you ar...",No win (1 of 1)
271.,2012-10-01 18:59:05,110.08,91%,Remembering you running soft through the night. You were big...,Win (1 of 3)
270.,2012-10-01 18:57:36,132.50,99%,"I was hugely impressed. Kirk, I mean Shatner, was the ultima...",Win (1 of 3)
269.,2012-10-01 18:57:00,131.39,98%,The streets were cleared by a Critical Mass bike ride and we...,Win (1 of 4)
268.,2012-10-01 18:56:09,133.00,98%,Sholes consulted with an educator who helped him analyze the...,Win (1 of 5)
267.,2012-10-01 18:55:22,130.34,98%,Your faith was strong but you needed proof. You saw her bath...,Win (1 of 4)
266.,2012-10-01 18:54:28,155.79,99%,"Contrary to the feminist cant, there are many things we can ...",Win (1 of 3)
265.,2012-10-01 18:53:57,111.55,94%,"The problem is, Willie, is that Charles and yourself are not...",No win (2 of 4)
264.,2012-10-01 18:53:08,156.45,100%,"I'm so glad you came, I'm so glad you remembered, the walkin...",Win (1 of 3)
263.,2012-10-01 18:52:22,121.70,97%,"Finally, gentlemen, there are people with an hereditary anim...",Win (1 of 3)
262.,2012-10-01 18:51:18,119.33,95%,Don't take anything personally - nothing others do is becaus...,Win (1 of 3)
261.,2012-10-01 18:50:23,129.72,93%,There is something about yourself that you don't know. Somet...,No win (2 of 4)
260.,2012-10-01 16:51:31,127.71,97%,It was hard to toss things I had once thought were valuable ...,Win (1 of 2)
259.,2012-10-01 16:50:19,142.37,99%,We go waiting for the stars to come showering down. From Mos...,No win (2 of 3)
258.,2012-10-01 16:49:28,115.93,94%,Facts can be thought of as objective or subjective. Things a...,No win (2 of 2)
257.,2012-10-01 16:46:42,120.84,96%,Who has a safety deposit box full of money and six passports...,No win (1 of 1)
256.,2012-10-01 16:46:01,116.41,97%,The basis of the Aztecs' success in creating a great state a...,No win (2 of 3)
255.,2012-10-01 16:44:24,143.72,98%,"There are perhaps twenty regular posters on the forum, and s...",No win (2 of 2)
254.,2012-10-01 16:43:35,131.19,96%,"I went to the woods because I wished to live deliberately, t...",Win (1 of 3)
253.,2012-10-01 16:42:53,123.49,96%,I drew the blankets over my head and tried to think of Chris...,No win (2 of 3)
252.,2012-10-01 16:41:42,126.69,98%,We don't need no education. We don't need no thought control...,No win (2 of 4)
251.,2012-10-01 16:40:52,125.65,98%,But if in efficient causes it is possible to go on to infini...,No win (2 of 4)
250.,2012-10-01 16:40:07,112.07,93%,The alternative to binge travel - the mini retirement - enta...,Win (1 of 2)
249.,2012-10-01 16:39:23,118.40,95%,There are two places on Earth that serve as canaries in the ...,Win (1 of 3)
248.,2012-10-01 16:38:29,138.26,99%,"I've heard there was a secret chord that David played, and i...",Win (1 of 4)
247.,2012-10-01 16:37:43,131.92,99%,One essential rule: make sure the joke is the last possible ...,Win (1 of 5)
246.,2012-10-01 16:37:04,142.86,100%,"No matter how bad things are, you can always make things wor...",Win (1 of 4)
245.,2012-10-01 16:36:33,115.51,94%,"I can feel the heat closing in, feel them out there making t...",Win (1 of 3)
244.,2012-10-01 16:35:39,144.43,97%,"Ticking away the moments that make up a dull day, you fritte...",Win (1 of 3)
243.,2012-10-01 02:51:28,116.89,96%,It takes more than a calorie of fossil fuel energy to produc...,No win (2 of 4)
242.,2012-10-01 02:50:36,138.29,98%,She's got eyes of the bluest skies as if they thought of rai...,Win (1 of 3)
241.,2012-10-01 02:49:45,123.03,96%,"Today, you people are no longer maggots. Today, you are Mari...",Win (1 of 2)
240.,2012-10-01 02:48:49,144.68,99%,There's a hole in the world like a great black pit. And the ...,Win (1 of 4)
239.,2012-10-01 02:48:20,106.78,94%,Most popular song lyrics have two sections - a verse and a b...,No win (2 of 4)
238.,2012-10-01 02:47:29,117.67,95%,"Often, we assume that a familiar situation will be but a rep...",No win (2 of 5)
237.,2012-10-01 02:46:46,128.12,96%,I thought climbing the Devil's Thumb would fix all that was ...,Win (1 of 3)
236.,2012-10-01 02:45:44,155.72,100%,To an outsider's ear it sounds absurdly wild and ridiculous ...,Win (1 of 5)
235.,2012-10-01 02:45:18,129.40,98%,Well I woke in mid-afternoon cause that's when it all hurts ...,Win (1 of 2)
234.,2012-10-01 02:43:51,145.78,99%,You've got a way to keep me on your side. You give me cause ...,Win (1 of 2)
233.,2012-10-01 02:43:14,119.94,95%,The only preventive thing I do is wash clothes after buying ...,Win (1 of 5)
232.,2012-10-01 02:42:32,121.50,97%,What should have been swift revenge turned into an all out w...,No win (2 of 2)
231.,2012-10-01 02:41:37,138.99,100%,"Yet one fine day, in a fit of euphoria, after he had picked ...",Win (1 of 5)
230.,2012-10-01 02:40:53,109.73,94%,My entire life had been on a predictable trajectory dominate...,Win (1 of 3)
229.,2012-10-01 00:38:31,109.18,97%,The chemistry of an element is determined by the manner in w...,No win (2 of 4)
228.,2012-10-01 00:37:43,127.37,96%,"Combat for a naval aviator is fought in short, violent burst...",Win (1 of 3)
227.,2012-10-01 00:36:39,134.79,97%,"There are perhaps twenty regular posters on the forum, and s...",No win (1 of 1)
226.,2012-10-01 00:35:44,109.20,95%,We might begin by asking why the pregnant man image has been...,Win (1 of 4)
225.,2012-10-01 00:26:04,152.14,98%,If I'm curt with you it's because time is a factor. I think ...,Win (1 of 3)
224.,2012-10-01 00:25:31,138.27,98%,Stab a sorry heart with your favorite finger. Paint the whol...,No win (1 of 1)
223.,2012-10-01 00:24:29,154.39,100%,"Ever since I was a child, folks have thought they had me peg...",Win (1 of 3)
222.,2012-10-01 00:23:54,142.47,97%,"If you really want to hear about it, the first thing you'll ...",No win (2 of 2)
221.,2012-10-01 00:22:53,132.78,95%,"When you are typing on a typewriter, your input appears dire...",No win (2 of 5)
220.,2012-10-01 00:22:14,133.84,97%,Images of broken light which dance before me like a million ...,No win (2 of 4)
219.,2012-10-01 00:21:29,139.12,100%,"Never give up, no matter how far behind you are, no matter h...",Win (1 of 2)
218.,2012-10-01 00:20:35,128.72,97%,I'd just like to point out that you were given every opportu...,Win (1 of 3)
217.,2012-10-01 00:19:45,128.75,94%,"When she returns to the forum page, her post is there. It is...",Win (1 of 3)
216.,2012-10-01 00:18:46,134.54,99%,Ideology: the process of making ideas. The work was generall...,Win (1 of 4)
215.,2012-10-01 00:15:19,129.85,96%,"Contrary to the feminist cant, there are many things we can ...",Win (1 of 5)
214.,2012-10-01 00:14:45,132.46,96%,A glooming peace this morning with it brings. The sun for so...,Win (1 of 3)
213.,2012-09-30 14:32:19,137.33,96%,"The sooner your kids appreciate the value of work, the more ...",No win (2 of 4)
212.,2012-09-30 01:22:27,73.72,94%,Language is one of the keys to being human. It allows us to ...,Win (1 of 2)
211.,2012-09-30 01:17:27,126.80,97%,"You found paradise in America. You had a good trade, made a ...",Win (1 of 2)
210.,2012-09-30 01:15:36,138.67,99%,But if in efficient causes it is possible to go on to infini...,Win (1 of 2)
209.,2012-09-30 01:14:00,117.66,97%,My entire life had been on a predictable trajectory dominate...,Win (1 of 2)
208.,2012-09-30 01:03:45,118.22,97%,Ideology: the process of making ideas. The work was generall...,No win (2 of 3)
207.,2012-09-30 00:47:52,116.10,96%,"Don't practice too much at first, or you're likely to develo...",Win (1 of 3)
206.,2012-09-30 00:46:33,113.98,95%,"Whether you're a student, secretary, office administrator, m...",Win (1 of 3)
205.,2012-09-30 00:45:07,130.68,99%,"Hi, and welcome to the future. San Dimas, California, 2688. ...",Win (1 of 3)
204.,2012-09-30 00:28:47,121.74,97%,"The idea of ""Mr. Right"" has been passed down over the genera...",No win (2 of 3)
203.,2012-09-30 00:27:42,122.47,97%,The Inca believed that if one did not give thanks and obedie...,Win (1 of 2)
202.,2012-09-30 00:26:58,140.04,100%,"You needn't take it any further, sir. You've proved to me th...",Win (1 of 4)
201.,2012-09-30 00:26:20,96.49,90%,"They say that right after God created man, he took a rib fro...",No win (4 of 5)
200.,2012-09-30 00:25:34,124.25,97%,"Ergonomics is a term that combines the Greek word ergon, mea...",Win (1 of 3)
199.,2012-09-30 00:24:45,132.18,97%,Instead of hiring workers during the peak hog kill in the wi...,Win (1 of 4)
198.,2012-09-30 00:23:47,133.75,99%,Any finite number divided by infinity is as near to nothing ...,Win (1 of 5)
197.,2012-09-30 00:22:53,138.82,100%,"After removal from the oven, the pizza is sliced and plated ...",Win (1 of 3)
196.,2012-09-30 00:22:06,135.81,98%,Convection also plays a minor role because of the relative t...,Win (1 of 4)
195.,2012-09-30 00:21:00,113.15,95%,We live in a charmed world. If we have money we can buy lite...,Win (1 of 2)
194.,2012-09-30 00:19:06,128.92,97%,"We turn away to face the cold, enduring chill, as the day be...",Win (1 of 4)
193.,2012-09-30 00:18:09,127.78,97%,Language is one of the keys to being human. It allows us to ...,Win (1 of 3)
192.,2012-09-29 19:46:10,128.06,99%,"Finally, gentlemen, there are people with an hereditary anim...",Win (1 of 2)
191.,2012-09-29 19:45:00,122.97,94%,I never said I would stay to the end - I knew I would leave ...,No win (2 of 3)
190.,2012-09-29 14:08:17,139.33,100%,"People get ready, there's a train coming. You don't need no ...",Win (1 of 3)
189.,2012-09-29 14:07:42,106.45,91%,"A little boy went out to play. When he opened his door, he s...",Win (1 of 2)
188.,2012-09-29 14:06:48,120.25,97%,My entire life had been on a predictable trajectory dominate...,Win (1 of 4)
187.,2012-09-28 18:41:38,128.61,96%,Instead of hiring workers during the peak hog kill in the wi...,Win (1 of 2)
186.,2012-09-28 18:39:45,157.10,99%,Is it sweeter to exist only in the mind or to exist both in ...,Win (1 of 2)
185.,2012-09-28 18:38:46,139.20,97%,"The creation ends in South Georgia, at the very edge of the ...",No win (2 of 4)
184.,2012-09-28 18:37:47,141.20,98%,"Let's sort the buyers from the spiers, the needy from the gr...",Win (1 of 3)
183.,2012-09-28 18:36:54,135.69,96%,San Francisco in the middle sixties was a very special time ...,Win (1 of 2)
182.,2012-09-28 18:36:06,139.84,98%,The unknown future rolls toward us. I face it for the first ...,Win (1 of 3)
181.,2012-09-28 18:35:30,125.78,96%,"Do you smell that? Napalm, son. Nothing else in the world sm...",No win (3 of 3)
180.,2012-09-28 18:34:48,142.91,97%,"Ticking away the moments that make up a dull day, you fritte...",No win (2 of 2)
179.,2012-09-28 18:33:30,123.99,95%,At first they had tried to keep the finding quiet. After all...,No win (2 of 2)
178.,2012-09-28 18:28:53,129.10,97%,"Keying text quickly is important, but it is more important t...",No win (2 of 4)
177.,2012-09-28 14:53:49,130.99,98%,"There are men who possess a peculiarly strong visual memory,...",Win (1 of 2)
176.,2012-09-28 14:52:17,102.90,96%,"Hey Mr. Tambourine Man, play a song for me, I'm not sleepy a...",Win (1 of 2)
175.,2012-09-28 14:49:29,105.65,96%,"Prior to the 1970's, because the United States had long been...",Win (1 of 2)
174.,2012-09-28 14:47:28,115.18,98%,One thing I've learned in the last seven years: in every gam...,Win (1 of 2)
173.,2012-09-28 14:45:27,128.54,96%,He rode past me and kept on goin'. Never said nothin' goin' ...,Win (1 of 2)
172.,2012-09-28 14:43:33,148.22,98%,"I'm so glad you came, I'm so glad you remembered, to see how...",Win (1 of 2)
171.,2012-09-28 14:42:36,149.88,98%,"The Earth is a world, the world is a ball, a ball in a game ...",Win (1 of 2)
170.,2012-09-28 14:41:23,128.87,98%,"O clear intelligence, force beyond all measure! Gentlemen, I...",Win (1 of 2)
169.,2012-09-28 14:40:04,135.70,99%,I've always wondered about this coat business. When I'm in a...,Win (1 of 2)
168.,2012-09-28 14:38:31,129.22,99%,The inner surface of the cell wall touches the cytoplasmic m...,Win (1 of 2)
167.,2012-09-28 14:36:14,154.59,99%,Chance and chance alone has a message for us. Everything tha...,Win (1 of 2)
166.,2012-09-28 14:34:52,122.47,95%,"Thirdly, however, these wars could now be waged with the new...",Win (1 of 2)
165.,2012-09-27 20:18:40,117.10,97%,Indonesia is a nation of islands - more than seventeen thous...,Win (1 of 3)
164.,2012-09-27 20:17:50,120.65,95%,I suddenly had the impression that I had been left all alone...,Win (1 of 3)
163.,2012-09-27 20:16:28,144.09,99%,The unknown future rolls toward us. I face it for the first ...,Win (1 of 4)
162.,2012-09-27 20:15:57,118.46,92%,"That's Tommy. He tells people he was named after a gun, but ...",Win (1 of 3)
161.,2012-09-27 20:13:44,134.71,96%,"A computer needs a manager to administer its operations, jus...",Win (1 of 3)
160.,2012-09-27 20:12:51,161.39,100%,I've been looking so long at these pictures of you that I al...,Win (1 of 4)
159.,2012-09-27 20:12:10,134.41,97%,"When we pulled out into the winter night and the real snow, ...",Win (1 of 5)
158.,2012-09-27 20:10:31,148.69,100%,A few light taps upon the pane made him turn to the window. ...,Win (1 of 5)
157.,2012-09-27 20:09:52,123.62,96%,"They had been given a sign - a powerful, lucid sign - that u...",Win (1 of 2)
156.,2012-09-27 20:08:37,141.02,98%,"A lot of people, especially this one psychoanalyst guy they ...",Win (1 of 4)
155.,2012-09-27 20:07:21,139.34,99%,Yet the web of thought has no such creases and is more like ...,Win (1 of 3)
154.,2012-09-27 20:06:26,144.32,98%,This business is filled to the brim with unrealistic people ...,Win (1 of 3)
153.,2012-09-27 01:01:27,122.51,98%,"Today, computers have taken this ancient art out of the craf...",No win (3 of 3)
152.,2012-09-27 01:00:34,131.82,96%,"Let me get this straight. You think that your client, one of...",No win (3 of 3)
151.,2012-09-27 00:59:19,114.22,97%,"All Ninja are men of peace, and must always remain so or los...",No win (3 of 4)
150.,2012-09-27 00:13:43,115.37,95%,"Common knowledge has bicyclists always riding into the wind,...",Win (1 of 3)
149.,2012-09-27 00:12:44,125.45,93%,"A computer needs a manager to administer its operations, jus...",Win (1 of 4)
148.,2012-09-27 00:11:49,138.55,99%,"Comfortable, Mullet? It seems sadly ironic that it's that ti...",Win (1 of 3)
147.,2012-09-27 00:11:19,104.35,94%,"Get it straight buster - I'm not here to say please, I'm her...",Win (1 of 2)
146.,2012-09-27 00:10:31,120.50,95%,"Whether they use the title or not, many lyrics have evocativ...",Win (1 of 4)
145.,2012-09-27 00:09:34,132.86,99%,Chance and chance alone has a message for us. Everything tha...,Win (1 of 3)
144.,2012-09-27 00:08:35,133.39,98%,"My friend, I shall be pedagogic, and say you ought to start ...",No win (2 of 4)
143.,2012-09-27 00:07:53,125.80,94%,I have quit three jobs and been fired from all the rest. Get...,No win (2 of 2)
142.,2012-09-27 00:05:27,137.52,98%,There's a piece of Maria in every song that I sing. And the ...,No win (3 of 4)
141.,2012-09-27 00:04:08,121.98,96%,"Whenever you watch the mind, you withdraw consciousness from...",No win (2 of 4)
140.,2012-09-27 00:03:24,127.88,97%,"I had a job, I had a girl. I had something going, mister, in...",Win (1 of 2)
139.,2012-09-27 00:02:29,126.49,98%,"Often, we assume that a familiar situation will be but a rep...",Win (1 of 2)
138.,2012-09-27 00:01:35,132.28,98%,Commas and periods always go inside quotation marks. Colons ...,Win (1 of 5)
137.,2012-09-27 00:00:26,144.25,98%,So it's all come back round to breaking apart again. Breakin...,Win (1 of 2)
136.,2012-09-26 23:59:15,143.65,99%,There's sometimes a buggy. How many drivers does a buggy hav...,Win (1 of 3)
135.,2012-09-26 23:58:27,116.23,96%,"Whether you're a student, secretary, office administrator, m...",Win (1 of 2)
134.,2012-09-26 13:39:26,118.50,97%,"Yeah, you just take Soupy-Sales to prom 'cause I can think o...",Win (1 of 5)
133.,2012-09-26 13:34:18,121.01,97%,"I don't want tickets, I need you to find me a painting, a cl...",Win (1 of 2)
132.,2012-09-26 13:33:06,123.82,95%,You've got a way to keep me on your side. You give me cause ...,Win (1 of 2)
131.,2012-09-26 13:32:37,122.14,96%,If there is one thing the history of evolution has taught us...,No win (2 of 2)
130.,2012-09-26 13:32:02,112.90,95%,Since the 1980s virtually all the sodas and most of the frui...,Win (1 of 5)
129.,2012-09-26 13:31:04,120.32,98%,All the blue light reflections that color my mind when I sle...,No win (2 of 4)
128.,2012-09-26 13:29:47,131.11,97%,To an outsider's ear it sounds absurdly wild and ridiculous ...,Win (1 of 4)
127.,2012-09-26 13:29:13,105.07,96%,"Oh bliss! Bliss and heaven! Oh, it was gorgeousness and gorg...",Win (1 of 3)
126.,2012-09-26 13:28:22,128.23,98%,"Excellent. He's enterprising, aggressive, outgoing, young, b...",Win (1 of 4)
125.,2012-09-26 13:27:49,122.52,97%,Mac knew the score even if Aunt Ella didn't. Shot through th...,Win (1 of 3)
124.,2012-09-26 13:26:16,129.31,100%,"Imagine this: Here we are, a plane full of grown human being...",No win (1 of 1)
123.,2012-09-26 13:25:30,129.84,98%,Danger is a topic you're often asked about as a sprinter. Th...,Win (1 of 2)
122.,2012-09-26 13:24:28,141.04,100%,"Life is not suffering; it's just that you will suffer it, ra...",Win (1 of 5)
121.,2012-09-26 13:23:40,121.85,98%,You could choke a dozen donkeys on that! And you're haggling...,Win (1 of 3)
120.,2012-09-26 13:22:51,140.07,100%,The great edifice of variety and choice that is an American ...,Win (1 of 2)
119.,2012-09-26 13:21:40,118.03,95%,Lucid but wholly false recollections can easily be induced b...,Win (1 of 2)
118.,2012-09-26 13:20:37,142.46,100%,"And in the world a heart of darkness, a firezone, where poet...",Win (1 of 5)
117.,2012-09-26 13:19:30,140.71,99%,For it is not enough to have a good mind; the main thing is ...,No win (1 of 1)
116.,2012-09-26 13:18:18,113.26,95%,"I'd been walking for hours and, as usual, I'd lost track of ...",Win (1 of 4)
115.,2012-09-26 04:54:36,135.71,100%,"That's Tommy. He tells people he was named after a gun, but ...",Win (1 of 3)
114.,2012-09-26 04:53:30,124.31,97%,Images of broken light which dance before me like a million ...,Win (1 of 4)
113.,2012-09-26 04:52:50,129.92,99%,And I don't believe in the existence of angels but looking a...,Win (1 of 3)
112.,2012-09-26 04:51:59,135.01,99%,I've been looking so long at these pictures of you that I al...,Win (1 of 4)
111.,2012-09-26 04:51:19,124.27,98%,I've been thinking lots about my life and how quick I'd wash...,No win (2 of 4)
110.,2012-09-26 04:50:29,126.85,99%,"A zealot might be, for instance, an individual with a person...",No win (1 of 1)
109.,2012-09-26 04:49:44,122.82,97%,Facts can be thought of as objective or subjective. Things a...,No win (1 of 1)
108.,2012-09-26 04:48:46,133.04,97%,Sometimes you concentrate more on racing the cars around you...,No win (2 of 4)
107.,2012-09-26 04:47:31,121.95,97%,Mac knew the score even if Aunt Ella didn't. Shot through th...,No win (2 of 3)
106.,2012-09-26 04:46:27,122.60,99%,Three changes occur while the stacked disk structure equilib...,Win (1 of 2)
105.,2012-09-26 04:43:43,130.30,98%,We go waiting for the stars to come showering down. From Mos...,No win (3 of 4)
104.,2012-09-26 04:42:47,130.68,98%,"To evaluate an option from the other side's point of view, c...",Win (1 of 3)
103.,2012-09-26 04:42:02,122.44,99%,The invention of the wheel represented a major turning point...,Win (1 of 3)
102.,2012-09-26 04:41:02,115.55,97%,"Excellent. He's enterprising, aggressive, outgoing, young, b...",Win (1 of 5)
101.,2012-09-26 04:39:05,136.75,99%,I've been looking so long at these pictures of you that I al...,Win (1 of 2)
100.,2012-09-26 04:38:03,117.60,98%,"There are men who possess a peculiarly strong visual memory,...",Win (1 of 2)
99.,2012-09-26 04:37:10,130.18,99%,"Good games stay within, but at the outer edge, of the player...",Win (1 of 4)
98.,2012-09-26 04:36:14,140.29,100%,A giant inverted steel pyramid is perfectly balanced on its ...,Win (1 of 4)
97.,2012-09-26 04:34:38,129.72,98%,Imagine for a moment if we once again knew these few unremar...,Win (1 of 3)
96.,2012-09-26 04:32:59,113.70,95%,The theory of music emphasizes the elements from which music...,No win (2 of 2)
95.,2012-09-26 04:31:21,128.53,99%,Facts can be thought of as objective or subjective. Things a...,Win (1 of 2)
94.,2012-09-26 04:30:28,112.82,96%,"You needn't take it any further, sir. You've proved to me th...",Win (1 of 3)
93.,2012-09-26 04:28:57,145.03,100%,I am learning about twenty new Italian words a day. Where am...,Win (1 of 2)
92.,2012-09-26 04:27:55,127.95,99%,"The goal of the true seeker is to become a sage, or superior...",No win (2 of 3)
91.,2012-09-26 04:27:03,125.25,97%,Don't take anything personally - nothing others do is becaus...,No win (2 of 3)
90.,2012-09-26 04:25:57,116.73,96%,Popularity is only partially about individual attractiveness...,Win (1 of 3)
89.,2012-09-26 04:25:06,125.64,98%,"Whenever you watch the mind, you withdraw consciousness from...",No win (2 of 2)
88.,2012-09-26 04:24:09,114.47,97%,"Now that I know that I'm breaking to pieces, I'll pull out m...",No win (2 of 3)
87.,2012-09-26 04:22:41,105.32,96%,What? A swallow carrying a coconut? It's not a question of w...,Win (1 of 3)
