537.,2017-07-17 22:18:53,137.27,100%,Involuntarily I glanced seaward - and distinguished nothing ...,Win (1 of 3)
536.,2017-07-17 22:18:14,128.93,99%,Everyone has questions about the economy. Why can't I live a...,Win (1 of 4)
535.,2017-07-17 22:17:10,127.21,99%,When beetles fight these battles in a bottle with their padd...,No win (1 of 1)
534.,2017-07-17 22:16:22,136.86,100%,One key element of any society is its collection of statuses...,Win (1 of 3)
533.,2017-07-17 22:15:16,149.68,98%,"For all the things you've done, for the things you might hav...",No win (2 of 2)
532.,2017-07-17 22:14:51,122.93,99%,"I turned back, and perceived a vast opaque body between me a...",No win (2 of 3)
531.,2017-07-17 22:14:07,128.82,99%,"To pass beyond is what I seek, I fear that I may be too weak...",No win (2 of 2)
530.,2017-07-17 22:13:31,136.44,99%,Very well. You belong to that unfortunate category that I wo...,Win (1 of 5)
529.,2017-07-17 22:12:40,125.97,99%,Titanium was discovered in 1790 but not purified until the e...,No win (2 of 3)
528.,2017-07-17 22:11:55,131.46,98%,Thus they went on living in a reality that was slipping away...,No win (2 of 4)
527.,2017-07-17 22:11:16,141.20,99%,"Warmer water increases the moisture content of storms, and w...",Win (1 of 3)
526.,2017-07-17 22:10:16,145.90,99%,Outside of two men on a train platform there's nothing in si...,Win (1 of 2)
525.,2017-07-17 22:09:37,141.29,99%,"Suffering has been stronger than all other teaching, and has...",No win (2 of 3)
524.,2017-07-17 22:01:09,138.90,100%,All the girls in the world were divided into two classes: on...,Win (1 of 5)
523.,2017-07-17 22:00:33,113.34,98%,"When you're dead, they really fix you up. I hope to hell whe...",No win (2 of 2)
522.,2017-07-17 20:52:02,132.23,99%,Language is one of the keys to being human. It allows us to ...,Win (1 of 2)
521.,2017-07-17 20:50:31,103.59,99%,"a) [MAN] A man ordered 2,000 drums of pink ping pong balls i...",Win (1 of 3)
520.,2017-07-17 20:49:12,131.42,99%,"Everyone gets everything he wants. I wanted a mission, and f...",Win (1 of 4)
519.,2017-07-17 20:48:39,143.51,99%,There is something about yourself that you don't know. Somet...,Win (1 of 2)
518.,2017-07-17 20:47:10,138.71,99%,Being able to quit things that don't work is integral to bei...,Win (1 of 2)
517.,2017-07-17 20:44:57,141.42,100%,We don't need no education. We don't need no thought control...,Win (1 of 3)
516.,2017-07-17 20:44:19,138.81,99%,I felt good and all washed clean of sin for the first time I...,Win (1 of 2)
515.,2017-07-17 20:42:56,129.68,99%,Although reflection mapping can be used to produce a number ...,Win (1 of 4)
514.,2017-07-17 20:42:10,132.79,99%,Oh I'm sure that's exactly what you want these people to bel...,Win (1 of 5)
513.,2017-07-17 20:41:14,114.58,97%,Everything that has transpired has done so according to my d...,No win (3 of 3)
512.,2017-07-17 20:40:13,123.37,98%,Now look at this picture. Look at it hard. Then turn the pag...,No win (2 of 4)
511.,2017-07-17 20:39:29,132.92,99%,"Poverty is a peculiar, insidious thing: a cause whose effect...",Win (1 of 2)
510.,2017-07-17 20:38:52,131.56,99%,"You look in excellent health to me, Potter, so you will excu...",No win (2 of 5)
509.,2017-07-17 20:37:50,139.28,99%,You're inches away from death every time you go on a mission...,Win (1 of 2)
508.,2017-07-17 20:37:01,112.22,98%,I'll tell you a secret. Something they don't teach you in yo...,Win (1 of 5)
507.,2017-07-17 20:18:39,125.54,99%,"You see, if you shoot pool with some employee here, you can ...",No win (1 of 1)
506.,2017-07-17 20:17:49,113.62,99%,"Tyrone: ""I don't want that dog dribbling on my seats."" Vinny...",No win (1 of 1)
505.,2017-07-17 20:17:02,150.98,100%,"And certainly, the mistakes that we male and female mortals ...",Win (1 of 2)
504.,2017-07-17 20:16:32,133.90,100%,"As to your dead guy, occupational hazard. Drug dealer gettin...",Win (1 of 2)
503.,2017-07-17 20:16:03,136.93,99%,You can't look me in the eye and say that you love me and yo...,Win (1 of 4)
502.,2017-07-17 20:14:27,132.08,99%,Hacking will begin killing people soon. Already there are me...,Win (1 of 3)
501.,2017-07-17 20:13:38,107.56,98%,"Historian James C. Cobb has described southern identity as ""...",Win (1 of 2)
500.,2017-07-17 20:12:36,129.94,98%,All that year the animals worked like slaves. But they were ...,Win (1 of 2)
499.,2017-07-17 20:11:38,147.40,100%,"Yes, they think we're dumb. They call us the common people. ...",Win (1 of 5)
498.,2017-07-17 20:10:54,134.59,99%,"Being in a minority, even in a minority of one, did not make...",Win (1 of 4)
497.,2017-07-17 20:10:07,145.84,100%,"Silence fell between them, as tangible as the dark tree shad...",Win (1 of 3)
496.,2017-07-17 20:09:19,150.21,99%,"I hope that whoever you are, you escape this place. I hope t...",Win (1 of 4)
495.,2017-07-17 20:08:15,145.85,100%,Be impeccable with your word - speak with integrity. Say onl...,Win (1 of 4)
494.,2017-07-17 20:07:30,132.60,99%,"Keying text quickly is important, but it is more important t...",No win (2 of 4)
493.,2017-07-17 20:06:56,117.74,97%,We imagine that when we are thrown out of our usual ruts all...,No win (2 of 2)
492.,2017-07-17 20:06:24,129.14,99%,"And I despise your books, I despise wisdom and the blessings...",Win (1 of 2)
491.,2017-07-17 20:05:26,127.34,99%,How can an Image-Fiction writer hope to make people more cri...,No win (1 of 1)
490.,2017-07-17 20:04:47,121.72,98%,"There are naive questions, tedious questions, ill-phrased qu...",No win (1 of 1)
489.,2017-07-17 20:04:02,137.75,100%,I declare after all there is no enjoyment like reading! How ...,Win (1 of 4)
488.,2017-07-17 20:03:22,128.76,100%,You and your words flooded my senses; your sentences left me...,Win (1 of 3)
487.,2017-07-17 20:02:46,118.79,97%,If we play Bach on an old and well-preserved Silbermann orga...,Win (1 of 2)
486.,2017-07-17 20:01:35,128.64,99%,"I wonder, how you can expect to gain an idea of my usual tea...",No win (3 of 5)
485.,2017-07-16 15:54:10,122.68,98%,"Ticking away the moments that make up a dull day, you fritte...",No win (3 of 4)
484.,2017-07-16 15:53:36,117.65,96%,I do not deny that what happened to us is a thing worth laug...,No win (2 of 2)
483.,2017-07-16 15:51:47,139.29,100%,"It's a thousand pages, give or take a few. I'll be writing m...",Win (1 of 5)
482.,2017-07-16 15:51:16,125.82,98%,"It was a strange feeling, holding the rifle. It somehow remo...",No win (2 of 3)
481.,2017-07-16 15:49:11,111.41,97%,"They had been given a sign - a powerful, lucid sign - that u...",Win (1 of 2)
480.,2017-07-16 15:45:51,119.95,97%,"Dave, although you took very thorough precautions in the pod...",No win (2 of 3)
479.,2017-07-16 15:41:49,145.91,100%,Language is one of the keys to being human. It allows us to ...,Win (1 of 2)
478.,2017-07-16 15:41:12,126.70,98%,There's sometimes a buggy. How many drivers does a buggy hav...,No win (3 of 4)
477.,2017-07-16 15:40:31,123.18,98%,I have something here for you. Your father wanted you to hav...,No win (2 of 4)
476.,2017-07-16 15:39:52,111.62,98%,"Finally, don't expect your cooking to taste exactly like res...",No win (3 of 4)
475.,2017-07-16 15:38:42,132.86,99%,"In the past, peripheral countries have been primarily export...",Win (1 of 3)
474.,2017-07-16 15:38:02,117.64,99%,"Yet one fine day, in a fit of euphoria, after he had picked ...",No win (2 of 5)
473.,2017-07-16 15:36:32,142.88,99%,"Very well, gentlemen. This, and maybe other similar things, ...",Win (1 of 4)
472.,2017-07-16 15:34:41,135.70,99%,"Ticking away the moments that make up a dull day, you fritte...",No win (2 of 3)
471.,2017-07-16 15:34:02,131.54,99%,To think that the affairs of this life always remain in the ...,Win (1 of 5)
470.,2017-07-16 15:33:02,113.66,98%,Three shiny steel doors stand at the centre of the hallway. ...,No win (2 of 5)
469.,2017-07-16 15:32:22,124.71,98%,If we were left solely to the wordy wit of legislators in Co...,Win (1 of 4)
468.,2017-07-16 15:31:45,134.06,99%,"On a manual typewriter, strike the key with a nice sharp str...",Win (1 of 4)
467.,2017-07-16 15:30:43,133.75,99%,No visitors allowed by decree of the Big Bob-omb. I shall ne...,Win (1 of 5)
466.,2017-07-16 15:29:58,125.11,98%,"He always seemed to women different from what he was, and th...",No win (2 of 4)
465.,2017-07-16 15:29:05,142.72,99%,"I also thought about my wife, the most important person in m...",Win (1 of 3)
464.,2017-07-16 15:27:43,122.89,99%,I'm gonna fight 'em off. A seven nation army couldn't hold m...,No win (1 of 1)
463.,2017-07-16 15:26:38,137.48,100%,"On a dark desert highway, cool wind in my hair, warm smell o...",Win (1 of 2)
462.,2017-07-16 15:25:42,157.15,100%,"With people like us, you should hang out, get to know what t...",Win (1 of 5)
461.,2017-07-16 15:25:17,102.31,98%,"If an exoplanet happens to transit its star, we can often de...",Win (1 of 2)
460.,2017-07-16 15:24:10,151.50,99%,A hero can be anyone. Even a man doing something as simple a...,Win (1 of 4)
459.,2017-07-16 15:22:59,131.67,99%,"When I left my home and my family, I was no more than a boy ...",Win (1 of 4)
458.,2017-07-16 15:22:20,123.22,98%,"With gene therapy, we can remove those genes which we know m...",Win (1 of 4)
457.,2017-07-16 15:21:39,133.60,98%,We passionately long that there may be another life in which...,Win (1 of 5)
456.,2017-07-16 15:19:44,108.71,97%,Everything that has transpired has done so according to my d...,Win (1 of 2)
455.,2017-07-16 15:18:31,129.95,98%,"It led me by the hand, as if to fill the niches in the memor...",Win (1 of 5)
454.,2017-07-16 15:17:45,139.30,99%,"Comfortable, Mullet? It seems sadly ironic that it's that ti...",Win (1 of 4)
453.,2017-07-16 15:17:00,142.55,99%,We passionately long that there may be another life in which...,Win (1 of 4)
452.,2017-07-16 15:16:19,122.79,99%,How can an Image-Fiction writer hope to make people more cri...,Win (1 of 4)
451.,2017-07-16 15:15:38,115.17,98%,"Under such circumstances I naturally gravitated to London, t...",Win (1 of 3)
450.,2017-07-16 15:15:07,126.72,98%,I thought climbing the Devil's Thumb would fix all that was ...,No win (2 of 4)
449.,2017-07-16 15:14:21,133.29,100%,We've learned that the balance of nutrients in cow's milk do...,Win (1 of 3)
448.,2017-07-16 15:12:43,128.89,99%,We may climb into the thin and cold realm of pure geometry a...,Win (1 of 2)
447.,2017-07-16 15:10:27,142.34,99%,"I was once like you are now, and I know that it's not easy t...",Win (1 of 5)
446.,2017-07-16 15:09:39,139.43,99%,"The brain can be a tool. It can recall phone numbers, solve ...",Win (1 of 4)
445.,2017-07-16 15:08:31,141.76,99%,You'll never have that kind of relationship in a world where...,Win (1 of 5)
444.,2017-07-16 14:34:37,104.66,97%,"A young Jedi named Darth Vader, who was a pupil of mine unti...",Win (1 of 3)
443.,2017-07-15 21:12:04,112.49,98%,"First, your return to shore was not part of our negotiations...",No win (3 of 5)
442.,2017-07-15 21:11:11,102.05,98%,"Historian James C. Cobb has described southern identity as ""...",Win (1 of 2)
441.,2017-07-15 21:10:15,112.77,98%,"But, pray how could that which I spoke so many years ago, an...",Win (1 of 2)
440.,2017-07-15 21:09:30,103.72,97%,"It may seem quite novelistic to you, and I am willing to agr...",No win (2 of 3)
439.,2017-07-15 21:08:34,137.07,100%,"I am very proud, revengeful, ambitious, with more offences a...",Win (1 of 5)
438.,2017-07-15 21:08:04,132.98,99%,"You know no one and no one knows you, and at the same time y...",Win (1 of 3)
437.,2017-07-14 20:13:47,110.34,97%,"Night gathers, and now my watch begins. It shall not end unt...",Win (1 of 3)
436.,2017-07-14 20:07:38,129.76,99%,"On a manual typewriter, strike the key with a nice sharp str...",Win (1 of 3)
435.,2017-07-14 19:10:57,113.22,98%,Everyone has a moment in history which belongs particularly ...,Win (1 of 2)
434.,2017-07-14 19:09:43,146.60,100%,Underneath the bridge the tarp has sprung a leak and the ani...,Win (1 of 5)
433.,2017-07-14 19:08:22,130.99,99%,"Today, raisins have no seeds. When we pop a raisin into our ...",No win (2 of 3)
432.,2017-07-14 19:07:35,124.07,99%,"My son, from whence this madness, this neglect of my command...",Win (1 of 3)
431.,2017-07-14 19:06:55,127.04,98%,"You held me down, but I got up, already brushing off the dus...",No win (2 of 4)
430.,2017-07-14 19:05:58,127.29,99%,"Opponents of a ""scientific"" approach to the social sciences ...",No win (2 of 4)
429.,2017-07-14 19:04:40,124.70,99%,"Whenever I despair, I remember that the way of truth and lov...",Win (1 of 5)
428.,2017-07-14 19:03:51,148.48,100%,In the beginning there was only a small amount of injustice ...,Win (1 of 3)
427.,2017-07-14 19:03:12,134.13,99%,It was also a lot easier for online teachers to hold their s...,Win (1 of 4)
426.,2017-07-14 19:02:28,131.77,99%,It was about this time I conceived the bold and arduous proj...,Win (1 of 5)
425.,2017-07-14 19:01:31,123.05,98%,"Pause you who read this, and think for a moment of the long ...",No win (2 of 2)
424.,2017-07-14 19:00:36,127.94,100%,"If one day I could get out of here, I would allow myself to ...",No win (2 of 5)
423.,2017-07-14 19:00:00,126.03,99%,"Now, my three friends could hardly fail to notice that I dis...",Win (1 of 5)
422.,2017-07-14 18:59:13,123.40,99%,"Around midafternoon, the snow thinned into sleet, and some u...",Win (1 of 4)
421.,2017-07-12 20:57:58,113.26,97%,"""Without pain, how could we know joy?"" This is an old argume...",No win (2 of 3)
420.,2017-07-12 20:56:47,121.63,99%,Most Americans do not own passports. They're not a naturally...,Win (1 of 4)
419.,2017-07-12 20:55:54,135.64,99%,So what's in this for you? Should you rush out in search of ...,Win (1 of 5)
418.,2017-07-12 20:53:22,131.63,99%,"I hope that whoever you are, you escape this place. I hope t...",No win (2 of 4)
417.,2017-07-12 20:52:20,124.85,99%,I'll tell you a secret. Something they don't teach you in yo...,No win (2 of 3)
416.,2017-07-12 20:51:12,127.73,99%,The scientists were always hanging cores on me to regulate m...,Win (1 of 3)
415.,2017-07-12 20:49:55,122.55,99%,"Samatha is a state in which the mind is brought to rest, foc...",Win (1 of 4)
414.,2017-07-12 20:48:56,129.06,99%,Ideology: the process of making ideas. The work was generall...,No win (2 of 4)
413.,2017-07-12 20:47:38,116.08,98%,You could choke a dozen donkeys on that! And you're haggling...,Win (1 of 5)
412.,2017-07-12 20:46:46,132.54,100%,"Poverty is a peculiar, insidious thing: a cause whose effect...",Win (1 of 5)
411.,2017-07-12 20:46:05,120.78,98%,"And I despise your books, I despise wisdom and the blessings...",Win (1 of 4)
410.,2017-07-12 20:44:54,110.64,98%,"Whether you're a student, secretary, office administrator, m...",Win (1 of 4)
409.,2017-07-12 20:43:39,139.38,99%,Poets claim that we recapture for a moment the self that we ...,Win (1 of 4)
408.,2017-07-12 20:42:51,108.13,97%,Zolner shook a Lucky Strike out of the pack. Antipov struck ...,Win (1 of 5)
407.,2017-07-12 20:41:42,114.91,98%,European powers faced a variety of challenges in administeri...,Win (1 of 4)
406.,2017-07-12 20:40:21,128.12,99%,At the time when Britain faced a plunge into chaos and darkn...,Win (1 of 3)
405.,2017-07-12 20:39:04,126.96,99%,"She belonged to a different age, but being so entire, so com...",Win (1 of 3)
404.,2017-07-12 20:38:21,120.30,99%,"Things, events, that occupy space yet come to an end when so...",Win (1 of 4)
403.,2017-06-27 22:51:07,105.71,98%,"Wilkinson County was a recipient of one of the new ""separate...",Win (1 of 5)
402.,2017-06-27 22:50:09,107.03,98%,From the time I was really little - maybe just a few months ...,Win (1 of 5)
401.,2017-06-27 22:49:11,115.92,99%,"I got that sunshine in my pocket, got that good soul in my f...",No win (2 of 4)
400.,2017-06-27 22:48:27,99.04,96%,You're worth more dead than alive! Why don't you go to the r...,Win (1 of 4)
399.,2017-06-27 22:47:10,116.17,98%,The key goals in user-interface design are increase in speed...,Win (1 of 2)
398.,2017-06-27 22:46:23,101.86,98%,"Benjamin Franklin, tactless in his youth, became so diplomat...",Win (1 of 4)
397.,2017-06-27 22:45:37,125.42,98%,And he told us of his life in the land of submarines.,No win (2 of 2)
396.,2017-06-27 22:45:14,112.68,98%,Danger is a topic you're often asked about as a sprinter. Th...,Win (1 of 4)
395.,2017-06-27 22:44:06,133.82,100%,It is by will alone I set my mind in motion. It is by the ju...,Win (1 of 3)
394.,2017-06-27 22:43:19,107.68,98%,"This planet has, or rather had, a problem, which was this: m...",No win (2 of 3)
393.,2017-06-27 22:42:25,116.55,99%,For we are not as faithful to the being we have most loved a...,No win (2 of 3)
392.,2017-06-27 22:41:47,124.11,100%,"I did my best, it wasn't much. I couldn't feel, so I tried t...",No win (2 of 4)
391.,2017-06-27 22:41:03,120.98,99%,"My aunt used to live in Paris. I remember, she used to come ...",No win (2 of 3)
390.,2017-06-27 22:39:18,123.48,99%,I took a wrong turn on the way to the bathroom and found mys...,Win (1 of 5)
389.,2017-06-27 22:38:13,129.30,99%,"You found paradise in America. You had a good trade, made a ...",Win (1 of 3)
388.,2017-06-27 22:36:15,112.85,98%,"It so happened that during those days, among so many other c...",Win (1 of 3)
387.,2017-06-27 22:35:15,101.47,97%,If our civilization goes the way of the dodo and the remnant...,No win (3 of 5)
386.,2017-06-27 22:34:07,120.83,99%,I have no idea how I untangled the complicated process of wo...,Win (1 of 3)
385.,2017-06-27 22:33:16,129.48,99%,When I'm alone I dream of the horizon and words fail me. The...,Win (1 of 4)
384.,2017-06-27 22:32:27,127.59,100%,"Around midafternoon, the snow thinned into sleet, and some u...",No win (2 of 5)
383.,2017-06-27 22:31:47,123.06,99%,"Never give up, no matter how far behind you are, no matter h...",No win (4 of 4)
382.,2017-06-27 22:30:54,116.15,99%,"In short order, Carter then proceeded to kill any chance he ...",Win (1 of 4)
381.,2017-06-27 22:29:52,122.66,99%,"You're right, I did lose a million dollars last year. I expe...",No win (2 of 5)
380.,2017-06-27 22:29:13,122.04,99%,To an outsider's ear it sounds absurdly wild and ridiculous ...,No win (2 of 5)
379.,2017-06-27 22:28:38,131.16,99%,"When I left my home and my family, I was no more than a boy ...",Win (1 of 4)
378.,2017-06-27 22:27:19,120.19,97%,Although reflection mapping can be used to produce a number ...,No win (2 of 3)
377.,2017-06-27 22:26:32,92.37,99%,"""But I don't want to go among mad people,"" Alice remarked. ""...",No win (2 of 4)
376.,2017-06-27 22:25:39,127.25,100%,"Beta flecks, another type of imperfection, are small regions...",Win (1 of 5)
375.,2017-06-27 22:24:28,130.82,99%,You don't care about anything except you. You just want to p...,No win (2 of 4)
374.,2017-06-27 22:23:32,133.41,99%,Punishment and negative reinforcement are opposites. Punishm...,Win (1 of 3)
373.,2017-06-27 22:22:42,112.87,97%,The key goals in user-interface design are increase in speed...,Win (1 of 2)
372.,2017-06-27 22:21:57,103.88,97%,I wish that strife would vanish away from among gods and mor...,No win (3 of 3)
371.,2017-06-27 22:21:10,108.66,99%,"Why so much grief for me? No man will hurl me down to Death,...",No win (1 of 1)
370.,2017-06-27 22:19:57,139.15,99%,Yet high over the city our line of yellow windows must have ...,Win (1 of 5)
369.,2017-06-27 22:18:57,134.37,99%,Our evaluations of reflection and transmission at material i...,No win (2 of 5)
368.,2017-06-27 22:17:56,119.35,98%,"One day soon, man is going to be able to harness incredible ...",Win (1 of 5)
367.,2017-06-27 22:16:39,111.20,98%,I had a friend who was a heavy drinker. If somebody asked hi...,No win (3 of 5)
366.,2017-06-27 22:15:36,115.74,98%,Teenage angst has paid off well. Now I'm bored and old. Self...,Win (1 of 4)
365.,2017-06-27 22:14:49,129.56,99%,"Samatha is a state in which the mind is brought to rest, foc...",Win (1 of 5)
364.,2017-06-27 22:13:28,125.30,99%,"Today, the world has changed. The Soviet Union has splintere...",No win (3 of 5)
363.,2017-06-27 22:12:37,110.27,99%,"With the lights out, it's less dangerous. Here we are now, e...",Win (1 of 5)
362.,2017-06-27 22:10:28,116.57,99%,"Sutler can no longer trust you, can he, Mr. Creedy? And we b...",No win (1 of 1)
361.,2017-06-27 22:09:00,121.30,98%,"Son, a woman is a lot like a... a refrigerator! They're abou...",Win (1 of 2)
360.,2017-06-27 22:08:12,108.88,98%,"I had neither kith nor kin in England, and was therefore as ...",No win (2 of 4)
359.,2017-06-27 22:07:20,107.59,97%,"My mind is open so wide since you came inside, I feel so ali...",No win (2 of 2)
358.,2017-06-27 22:06:02,127.09,99%,"And I despise your books, I despise wisdom and the blessings...",Win (1 of 3)
357.,2017-06-27 22:04:44,108.37,98%,"The place where you now stand was the Golden Land, but evil ...",No win (3 of 4)
356.,2017-06-27 22:02:58,109.93,97%,"For a time, pink was preferred for boys, because it was ""a d...",No win (2 of 3)
355.,2017-06-27 22:02:00,98.22,97%,There was a time in the Depression of the 1930s when conserv...,Win (1 of 3)
354.,2017-06-27 22:00:48,124.88,98%,I would say he has quite a few problems. His energy seems to...,No win (2 of 2)
353.,2017-06-27 21:59:38,97.90,97%,"Pulp: 1. A soft, moist, shapeless mass or matter. 2. A magaz...",Win (1 of 2)
352.,2017-06-27 21:58:54,127.78,99%,I only lose my fear when I run. I won't lose a tear when I r...,No win (4 of 5)
351.,2017-06-27 21:58:04,131.39,99%,The procedure for dealing with rigid body kinetics problems ...,Win (1 of 5)
350.,2017-06-27 21:56:56,116.63,98%,"He started running, up and up, until he hurled himself into ...",Win (1 of 5)
349.,2017-06-27 21:55:13,148.60,100%,"But I believe in true love, you know? I don't believe that e...",Win (1 of 2)
348.,2017-06-27 21:54:23,115.59,98%,"Picture yourself in a boat on a river, with tangerine trees ...",Win (1 of 5)
347.,2017-06-27 21:53:20,131.44,99%,This is a plea for peace to the oppressors of the world and ...,Win (1 of 3)
346.,2017-06-27 21:52:16,126.50,99%,It was one of those days when it's a minute away from snowin...,Win (1 of 5)
345.,2017-06-27 21:51:23,111.49,99%,"A lot of people, especially this one psychoanalyst guy they ...",Win (1 of 5)
344.,2017-06-27 21:50:28,106.18,97%,"A little boy went out to play. When he opened his door, he s...",No win (2 of 5)
343.,2017-06-27 21:49:52,101.48,97%,They're talking about things of which they don't have the sl...,No win (3 of 5)
342.,2015-08-28 14:36:52,120.15,98%,We often believe the more we practice a skill or technique -...,No win (1 of 1)
341.,2014-07-25 21:33:37,110.26,96%,The basis of the Aztecs' success in creating a great state a...,Win (1 of 2)
340.,2014-07-25 21:31:34,126.42,97%,"But, pray how could that which I spoke so many years ago, an...",Win (1 of 2)
339.,2014-07-25 21:29:25,151.47,100%,"For centuries, the battle of morality was fought between tho...",Win (1 of 2)
338.,2013-11-10 20:19:51,121.01,93%,"When she returns to the forum page, her post is there. It is...",No win (3 of 4)
337.,2013-11-10 20:19:11,113.27,95%,Space is big. Really big. You just won't believe how vastly ...,Win (1 of 3)
336.,2012-12-24 14:36:52,111.38,95%,"However, let us leave aside the philosophical, social, and e...",Win (1 of 3)
335.,2012-12-24 14:35:44,126.68,97%,"Every craft and every investigation, and likewise every acti...",Win (1 of 2)
334.,2012-12-24 14:33:08,131.46,98%,I thought climbing the Devil's Thumb would fix all that was ...,Win (1 of 3)
333.,2012-12-24 14:31:38,132.22,99%,We don't need no education. We don't need no thought control...,Win (1 of 3)
332.,2012-12-24 14:29:42,115.54,95%,The beginner writes just twenty pieces. The professional wri...,Win (1 of 2)
331.,2012-12-24 14:26:51,135.87,97%,"When Betty and Billy fell asleep, he walked down to the kitc...",Win (1 of 5)
330.,2012-12-24 14:26:03,116.10,96%,"The term ""barbarian"" was created by the Greeks; it was origi...",Win (1 of 4)
329.,2012-12-24 14:25:16,113.11,95%,"Geometry sets out from certain conceptions such as ""plane,"" ...",Win (1 of 3)
328.,2012-12-24 14:23:35,112.62,96%,"Tis but thy name that is my enemy. Thou art thyself, though ...",Win (1 of 2)
327.,2012-12-24 14:22:46,118.93,97%,"Whether you're a student, secretary, office administrator, m...",Win (1 of 3)
326.,2012-12-24 14:21:53,123.85,96%,Commas and periods always go inside quotation marks. Colons ...,Win (1 of 4)
325.,2012-12-21 13:16:29,124.04,97%,"You ask Raymond what he does for a living and he says, ""I br...",Win (1 of 4)
324.,2012-10-15 00:38:50,111.07,94%,We might begin by asking why the pregnant man image has been...,Win (1 of 5)
323.,2012-10-05 03:47:11,117.32,97%,Instead of hiring workers during the peak hog kill in the wi...,Win (1 of 3)
322.,2012-10-05 03:46:16,130.46,93%,"Ticking away the moments that make up a dull day, you fritte...",No win (2 of 4)
321.,2012-10-05 03:44:49,143.78,100%,"There is no pain, you are receding. A distant ship smoke on ...",Win (1 of 4)
320.,2012-10-05 03:44:02,120.86,97%,"Yeah, you just take Soupy-Sales to prom 'cause I can think o...",Win (1 of 2)
319.,2012-10-05 03:43:01,129.70,97%,"They had been given a sign - a powerful, lucid sign - that u...",Win (1 of 2)
318.,2012-10-05 03:37:55,130.62,97%,"With no map to navigate one's life, some of us have stood st...",Win (1 of 2)
317.,2012-10-05 03:36:05,114.73,96%,"The goal of the true seeker is to become a sage, or superior...",Win (1 of 2)
316.,2012-10-05 03:35:05,116.11,96%,Lucid but wholly false recollections can easily be induced b...,Win (1 of 3)
315.,2012-10-05 03:34:25,126.56,96%,San Francisco in the middle sixties was a very special time ...,No win (2 of 3)
314.,2012-10-05 03:33:47,126.51,97%,Who has a safety deposit box full of money and six passports...,Win (1 of 5)
313.,2012-10-05 03:32:47,131.48,99%,"Throughout my academic career, I'd given some pretty good ta...",Win (1 of 3)
