707.,2017-09-24 00:38:02,70.27,97%,It didn't stop you from writing it. As if every thought that...,No win (3 of 4)
706.,2017-09-23 02:45:12,56.06,94%,"Now Lina, you've been reading all those fan magazines again!...",No win (3 of 5)
705.,2017-09-23 02:14:42,75.94,97%,Do you wanna come with me? 'Cause if you do then I should wa...,No win (2 of 5)
704.,2017-09-21 23:14:13,79.36,98%,"Surely death has found me, it has kept a hold of me all this...",Win (1 of 4)
703.,2017-09-21 23:13:30,58.98,96%,"The first part of the Rite, which ends with the sweat-induci...",No win (2 of 5)
702.,2017-09-20 07:22:16,78.17,98%,"Stand tall, boy. Have some respect for yourself. Don't you k...",No win (2 of 4)
701.,2017-09-19 07:17:52,72.36,96%,As you know the concept of the suction pump is centuries old...,No win (3 of 4)
700.,2017-09-17 02:57:51,69.59,97%,"The word science is derived from a Latin verb meaning ""to kn...",No win (2 of 5)
699.,2017-09-15 08:46:39,77.64,97%,"Now, my three friends could hardly fail to notice that I dis...",Win (1 of 5)
698.,2017-09-13 02:10:49,72.59,97%,Well I woke in mid-afternoon cause that's when it all hurts ...,Win (1 of 4)
697.,2017-09-12 05:54:41,68.00,96%,A choice tells the world what is most important to a human b...,No win (4 of 5)
696.,2017-09-12 05:53:48,73.23,98%,You know how far I'm prepared to go. I will be a boat and ro...,Win (1 of 4)
695.,2017-09-12 01:16:30,77.41,97%,"Then you compared a woman's love to Hell, to barren land whe...",No win (3 of 5)
694.,2017-09-11 07:40:51,70.39,96%,I'm a cop - I'm good at reading people - so I know I can tru...,No win (4 of 4)
693.,2017-09-09 02:18:08,76.84,98%,In order to become an elf I filled out ten pages' worth of f...,No win (2 of 3)
692.,2017-09-08 08:56:48,74.99,97%,"Warmer water increases the moisture content of storms, and w...",Win (1 of 4)
691.,2017-09-04 07:10:59,70.36,97%,"There was me, that is Alex, and my three droogs, that is Pet...",No win (2 of 4)
690.,2017-09-04 06:57:13,62.84,97%,"The other night I dreamt of knives, continental drift divide...",Win (1 of 4)
689.,2017-09-04 06:56:09,75.40,99%,"Help me if you can, I'm feeling down and I do appreciate you...",Win (1 of 3)
688.,2017-08-31 23:19:15,83.61,98%,"""Mad Dog Time"" is the first movie I have seen that does not ...",No win (2 of 3)
687.,2017-08-31 06:37:07,72.91,96%,"Come, boy, see for yourself. From here, you will witness the...",No win (3 of 5)
686.,2017-08-31 05:04:37,82.65,97%,The weird thing about houses is that they almost always look...,Win (1 of 2)
685.,2017-08-30 09:37:45,67.97,96%,"Ultimately, the real yield on stocks - and, therefore, throu...",Win (1 of 4)
684.,2017-08-22 07:17:55,74.35,96%,There are two places on Earth that serve as canaries in the ...,No win (3 of 4)
683.,2017-08-22 06:11:05,69.89,97%,"For most people, the ringing of a phone was a welcome sign. ...",Win (1 of 4)
682.,2017-08-22 04:02:18,63.90,95%,"Historian James C. Cobb has described southern identity as ""...",No win (3 of 5)
681.,2017-08-22 03:56:13,81.86,100%,But then he'll wonder why I haven't been married. You know w...,No win (2 of 4)
680.,2017-08-22 02:53:04,76.36,98%,"Hello, hello, hello, is there anybody in there? Just nod if ...",No win (3 of 4)
679.,2017-08-21 06:51:18,68.28,97%,The supreme question about a work of art is out of how deep ...,No win (4 of 5)
678.,2017-08-21 06:43:11,69.68,96%,We were playing checkers. I used to kid her once in a while ...,No win (4 of 4)
677.,2017-08-21 06:27:13,72.29,96%,Pain and suffering are always inevitable for a large intelli...,No win (2 of 4)
676.,2017-08-21 06:21:51,87.03,98%,"There is some love that will not go away. You're here, there...",Win (1 of 5)
675.,2017-08-21 04:21:12,69.37,96%,"Hanging by threads of palest silver, I could have stayed tha...",No win (2 of 4)
674.,2017-08-21 03:09:07,79.66,98%,"Every craft and every investigation, and likewise every acti...",No win (3 of 4)
673.,2017-08-21 00:33:22,71.38,97%,"Everyone laughed and looked around, surprised to discover th...",No win (2 of 5)
672.,2017-08-21 00:25:20,80.29,97%,"Waving colored flags, we won't surrender, there's no standin...",Win (1 of 2)
671.,2017-08-21 00:22:57,68.75,96%,I did. I killed him. Threw him right over a rope bridge. I w...,No win (4 of 4)
670.,2017-08-20 08:18:02,84.86,94%,There is something about yourself that you don't know.,No win (3 of 5)
669.,2017-08-20 07:37:52,74.62,97%,Space ain't man's final frontier. Man's final frontier is th...,No win (2 of 3)
668.,2017-08-20 07:35:49,70.98,95%,"If one day I could get out of here, I would allow myself to ...",No win (2 of 5)
667.,2017-08-20 07:31:18,73.86,97%,"Well, the time has come to say, is dehumanization such a bad...",No win (2 of 2)
666.,2017-08-20 04:18:46,75.27,97%,One just can't imagine what prison is like from outside. You...,No win (2 of 5)
665.,2017-08-20 03:19:22,73.18,98%,He's better at this than I've ever been at anything in my li...,No win (4 of 5)
664.,2017-08-20 02:44:20,74.11,97%,Haven't I taught you anything? What have I always told you? ...,No win (2 of 2)
663.,2017-08-20 01:24:21,72.65,98%,"When you are typing on a typewriter, your input appears dire...",Win (1 of 4)
662.,2017-08-20 01:14:27,74.41,97%,The number one challenge I've seen with myself and with othe...,No win (2 of 5)
661.,2017-08-20 01:10:41,72.29,97%,Resistance is the measurement of the ability of electrons to...,No win (2 of 5)
660.,2017-08-19 07:24:21,70.34,96%,What's cool about really little kids is that they don't say ...,No win (2 of 3)
659.,2017-08-19 06:46:00,70.85,96%,"To evaluate an option from the other side's point of view, c...",No win (2 of 4)
658.,2017-08-19 05:10:14,71.80,97%,"Must the citizen ever for a moment, or in the least degree, ...",No win (3 of 4)
657.,2017-08-19 02:12:26,74.80,97%,I read this thing the other day about how when you hear that...,No win (3 of 3)
656.,2017-08-19 00:43:36,74.58,96%,"It's a thousand pages, give or take a few. I'll be writing m...",No win (2 of 5)
655.,2017-08-19 00:22:11,62.24,95%,"And, anyway, it's not about making money, it's about taking ...",No win (2 of 2)
654.,2017-08-18 23:10:11,78.13,98%,"Let me tell you what's gonna happen, Officer Grimly. I'm goi...",No win (2 of 4)
653.,2017-08-18 09:52:19,72.77,98%,Take my hand for a minute. We're in it. Imagine all the pain...,No win (4 of 5)
652.,2017-08-18 09:26:36,69.88,96%,"Mom, I know your intentions are good but aren't the police t...",Win (1 of 5)
651.,2017-08-18 09:21:36,65.96,96%,Always do your best - your best is going to change from mome...,No win (4 of 4)
650.,2017-08-18 08:15:39,77.79,98%,"Furthermore, those not understanding this intensity will say...",No win (4 of 5)
649.,2017-08-18 07:58:36,83.45,98%,"What good's a reward if you ain't around to use it? Besides,...",No win (3 of 5)
648.,2017-08-18 06:55:51,69.21,96%,"Demand is related to wants. If goods and services were free,...",No win (4 of 4)
647.,2017-08-18 06:45:41,73.61,96%,That's because we're uncool. And while women will always be ...,No win (3 of 4)
646.,2017-08-18 06:34:53,78.69,98%,"The terminator wouldn't stop, it would never leave him. It w...",No win (3 of 3)
645.,2017-08-18 06:28:18,84.39,98%,"For all those times you stood by me, for all the truth that ...",No win (4 of 5)
644.,2017-08-18 06:17:16,79.70,99%,"In synchronous communications, the sender and receiver must ...",No win (2 of 5)
643.,2017-08-18 05:54:38,79.24,96%,"We've had vicious kings and we've had idiot kings, but I don...",No win (2 of 5)
642.,2017-08-18 05:51:07,71.98,97%,Many think that probabilities do not exist in real life. Nev...,Win (1 of 5)
641.,2017-08-18 05:31:53,83.55,99%,"In this grave hour, perhaps the most fateful in our history,...",No win (2 of 5)
640.,2017-08-18 05:18:15,73.06,98%,I want to say I'm sorry for stuff I haven't done yet. Things...,Win (1 of 4)
639.,2017-08-18 04:54:29,74.09,97%,In the beginning there was only a small amount of injustice ...,Win (1 of 5)
638.,2017-08-18 04:51:26,77.76,98%,The feeling of having no power over people and events is gen...,No win (3 of 5)
637.,2017-08-16 05:06:11,70.90,97%,"You needn't take it any further, sir. You've proved to me th...",No win (2 of 5)
636.,2017-08-16 05:01:53,69.42,96%,"The sooner your kids appreciate the value of work, the more ...",No win (5 of 5)
635.,2017-08-16 04:51:01,84.30,99%,Any attack made by the Rebels against this station would be ...,Win (1 of 5)
634.,2017-08-16 01:17:29,68.48,96%,"You see, I'm moving on fast. Finally got the pass, gonna lea...",No win (2 of 4)
633.,2017-08-16 01:10:17,67.22,96%,Few smart kids can spare the attention that popularity requi...,No win (2 of 5)
632.,2017-08-16 00:53:36,75.39,97%,"The presence of a noble nature, generous in its wishes, arde...",No win (3 of 4)
631.,2017-08-15 13:07:35,67.23,96%,"Every magic trick consists of three parts, or acts. The firs...",Win (1 of 5)
630.,2017-08-15 12:26:48,68.35,96%,"Every breath you take and every move you make, every bond yo...",No win (4 of 5)
629.,2017-08-15 11:37:16,68.33,96%,Ideology: the process of making ideas. The work was generall...,No win (2 of 5)
628.,2017-08-15 09:58:31,66.00,96%,"Among the Sioux Indians of South Dakota, it is regarded as i...",No win (3 of 4)
627.,2017-08-15 09:42:41,72.96,98%,"And I have one of those very loud, stupid laughs. I mean if ...",No win (3 of 4)
626.,2017-08-15 08:57:52,71.47,97%,"This made me reflect, how vain an attempt it is for a man to...",No win (3 of 5)
625.,2017-08-15 08:54:12,67.51,97%,"I rejected those answers; instead, I chose something differe...",No win (3 of 5)
624.,2017-08-15 08:44:51,70.26,97%,We may formulate the general principle that the tempo is cor...,No win (3 of 5)
623.,2017-08-15 08:25:43,73.58,96%,"When you go on the run, the first thing you do is lay down t...",No win (4 of 5)
622.,2017-08-15 07:18:21,76.56,98%,Nothing drives people to the church faster than the thought ...,No win (2 of 5)
621.,2017-08-15 06:37:23,78.63,96%,What have I got to do to make you love me? What have I got t...,No win (4 of 5)
620.,2017-08-15 06:33:13,67.57,95%,"You clearly don't know who you're talking to, so let me clue...",No win (4 of 5)
619.,2017-08-15 06:29:10,66.22,96%,I walked awhile among the rocks: the sky was perfectly clear...,No win (2 of 5)
618.,2017-08-15 04:55:14,77.32,98%,I feel that way all the time. Like I'm from some other plane...,No win (4 of 5)
617.,2017-08-14 15:20:05,65.41,97%,We don't need no education. We don't need no thought control...,No win (4 of 4)
616.,2017-08-14 14:25:29,69.94,96%,"Night gathers, and now my watch begins. It shall not end unt...",No win (3 of 5)
615.,2017-08-14 14:22:13,68.04,96%,"Dear Mr. Vernon, We accept the fact that we had to sacrifice...",No win (4 of 5)
614.,2017-08-13 08:30:51,86.75,99%,I wanna be inside your heaven. Take me to the place you cry ...,No win (3 of 4)
613.,2017-08-13 08:01:52,69.69,97%,"Life is not suffering; it's just that you will suffer it, ra...",No win (3 of 5)
612.,2017-08-13 07:54:50,66.20,97%,"Last thing I remember, I was running for the door, I had to ...",No win (2 of 2)
611.,2017-08-13 07:06:38,74.17,96%,Your inner child will be happy to know that when it comes to...,Win (1 of 4)
610.,2017-08-13 07:02:52,78.63,98%,And then he calls me a jerk and says the last guy who though...,Win (1 of 3)
609.,2017-08-13 06:54:03,72.19,96%,Wow! I've never seen so many guests from different parts of ...,No win (2 of 3)
608.,2017-08-13 05:05:45,62.96,95%,"Obviously, my attempt at fooling her had been unsuccessful. ...",No win (3 of 3)
607.,2017-08-13 04:31:41,79.46,98%,"Every second he breathed, the smell of the grass, the cool a...",Win (1 of 4)
606.,2017-08-13 04:25:42,66.59,96%,We live in an age when people do more writing than they have...,No win (3 of 4)
605.,2017-08-13 03:13:00,74.22,97%,"There is no pain, you are receding. A distant ship smoke on ...",No win (2 of 5)
604.,2017-08-13 02:57:35,73.20,97%,His sympathy made tears spring to Lina's eyes. Doon looked s...,No win (3 of 3)
603.,2017-08-13 02:40:26,80.13,98%,That's because we're uncool. And while women will always be ...,No win (2 of 5)
602.,2017-08-12 12:57:02,76.63,98%,A great teacher has little external history to record. His l...,No win (3 of 4)
601.,2017-08-12 09:18:35,74.69,98%,To wash down your chicken nuggets with virtually any soft dr...,No win (3 of 5)
600.,2017-08-12 03:07:24,65.89,95%,"For centuries, human society has taken the gifts of nature f...",No win (4 of 5)
599.,2017-08-11 09:36:50,63.03,96%,"And what haunts me, is that in all the faces of all the bear...",No win (5 of 5)
598.,2017-08-11 07:07:57,69.06,95%,"According to all known laws of aviation, there is no way tha...",No win (2 of 5)
597.,2017-08-11 05:20:13,76.66,98%,You know what nobody's mentioned? Is that this is supposed t...,No win (3 of 5)
596.,2017-08-11 05:16:31,88.94,99%,There's a hole in the world like a great black pit. And the ...,Win (1 of 5)
595.,2017-08-11 04:44:07,67.65,97%,You have to wonder: how do the machines know what Tasty Whea...,No win (2 of 3)
594.,2017-08-11 03:17:03,61.43,94%,"The old sea captain, not surprisingly, was an excellent witn...",No win (3 of 5)
593.,2017-08-11 03:15:11,57.89,93%,"If you're committed enough, you can make any story work. I o...",No win (3 of 3)
592.,2017-08-11 03:02:45,84.25,98%,"The only people for me are the mad ones, the ones who are ma...",No win (2 of 4)
591.,2017-08-11 02:19:35,74.15,97%,Maybe you should come with me for a few weeks. See what happ...,No win (4 of 5)
590.,2017-08-11 02:09:08,70.66,96%,What distinguished Ellington from most of his contemporaries...,No win (2 of 3)
589.,2017-08-11 01:44:00,68.96,97%,You sit around here and you spin your little webs and you th...,Win (1 of 5)
588.,2017-08-10 11:01:37,69.19,97%,"You look in excellent health to me, Potter, so you will excu...",No win (2 of 5)
587.,2017-08-10 09:18:02,64.61,95%,"Don't look back, keep your head held high. Don't ask them wh...",No win (3 of 5)
586.,2017-08-10 08:26:38,67.69,96%,"I want you to know that the day you saw something in me, my ...",No win (3 of 5)
585.,2017-08-10 08:10:01,69.67,98%,"Come, Friend, you too must die. Why moan about it so? Even P...",No win (2 of 5)
584.,2017-08-10 08:05:51,66.41,96%,The theory of music emphasizes the elements from which music...,No win (3 of 4)
583.,2017-08-10 08:00:19,69.13,97%,He pushes people away before they get a chance to leave him....,Win (1 of 5)
582.,2017-08-10 07:50:02,76.34,97%,It just so happens that your friend here is only mostly dead...,No win (2 of 5)
581.,2017-08-10 07:42:34,74.13,98%,"Aight, look, I know you're not earning what you expected and...",No win (2 of 5)
580.,2017-08-10 07:41:50,78.45,99%,Pain and suffering are always inevitable for a large intelli...,No win (4 of 5)
579.,2017-08-10 04:43:30,65.96,96%,A hero can be anyone. Even a man doing something as simple a...,No win (4 of 5)
578.,2017-08-10 04:31:24,70.35,96%,"Translating from one language to another, unless it is from ...",Win (1 of 5)
577.,2017-08-10 03:37:36,80.82,97%,"Ticking away the moments that make up a dull day, you fritte...",No win (2 of 5)
576.,2017-08-10 00:29:11,69.46,95%,I declare after all there is no enjoyment like reading! How ...,Win (1 of 5)
575.,2017-08-09 23:51:18,74.50,97%,"He was one of the numerous and varied legion of dullards, of...",No win (3 of 5)
574.,2017-08-09 07:55:09,83.40,98%,"One day you're in a funk about things, telling a friend that...",No win (4 of 5)
573.,2017-08-09 06:01:23,67.48,96%,"Ultimately, the real yield on stocks - and, therefore, throu...",No win (4 of 5)
572.,2017-08-08 04:26:56,72.89,97%,Nobody said it was easy. It's such a shame for us to part. N...,No win (2 of 5)
571.,2017-08-07 07:04:15,79.06,98%,"You know no one and no one knows you, and at the same time y...",Win (1 of 5)
570.,2017-08-07 06:50:51,75.47,98%,There's not a day goes by I don't feel regret. Not because I...,Win (1 of 4)
569.,2017-08-07 06:40:19,80.77,99%,She wants me to take responsibility for everything that went...,Win (1 of 5)
568.,2017-08-07 06:31:18,69.28,96%,Quality humor doesn't just deliver one gag and then tax the ...,No win (2 of 2)
567.,2017-08-07 06:26:03,75.81,97%,I don't know what the world may need but a V-8 engine's a go...,No win (2 of 5)
566.,2017-08-07 06:24:38,72.56,96%,"Well, that's all the time we had for our movie. We hope you ...",Win (1 of 5)
565.,2017-08-07 06:02:25,70.85,96%,"The day dawned bleak and chill, a moving wall of gray light ...",No win (2 of 4)
564.,2017-08-04 12:07:56,64.84,96%,Yes. I consider myself a nerd. And this movie has uplifted m...,No win (5 of 5)
563.,2017-08-04 11:56:52,64.76,96%,"I have felt as bleak as I've felt since puberty, and have fi...",No win (4 of 5)
562.,2017-08-04 02:43:21,80.73,98%,"When we pulled out into the winter night and the real snow, ...",Win (1 of 4)
561.,2017-08-04 02:06:50,80.91,97%,"What really knocks me out is a book that, when you're all do...",No win (2 of 5)
560.,2017-08-04 01:13:10,73.30,97%,"I wonder, how you can expect to gain an idea of my usual tea...",Win (1 of 3)
559.,2017-08-03 11:53:10,65.04,96%,"By love you mean big lightning bolts to the heart, where you...",No win (2 of 5)
558.,2017-08-02 18:38:33,71.05,97%,"I ran out of tears when I was 18, so nobody made me but the ...",No win (3 of 5)
557.,2017-08-02 17:51:03,71.45,97%,Heaven did not seem to be my home; and I broke my heart with...,No win (4 of 5)
556.,2017-08-02 09:55:59,70.67,97%,"Ah, the lengthening hours in the refinery, belching fire int...",Win (1 of 5)
555.,2017-08-02 08:13:37,71.39,97%,I've met another man. He's the best man I've ever met. He's ...,No win (2 of 5)
554.,2017-08-02 00:16:37,72.31,99%,We go waiting for the stars to come showering down. From Mos...,No win (3 of 5)
553.,2017-08-01 08:51:24,72.12,97%,Good games offer players a set of challenging problems and t...,No win (2 of 4)
552.,2017-08-01 08:44:17,68.30,96%,You think the dead we loved ever truly leave us? You think t...,No win (3 of 5)
551.,2017-08-01 07:30:25,63.71,96%,But do you remember Gandalf's words: Even Gollum may have so...,Win (1 of 5)
550.,2017-08-01 06:34:11,78.51,97%,"It was a strange feeling, holding the rifle. It somehow remo...",No win (3 of 5)
549.,2017-07-31 07:12:10,62.22,94%,"Samatha is a state in which the mind is brought to rest, foc...",No win (4 of 4)
548.,2017-07-31 07:03:40,69.50,97%,"Around midafternoon, the snow thinned into sleet, and some u...",No win (3 of 4)
547.,2017-07-31 06:47:11,67.28,95%,"Once there were two moons in the sky, but one wandered too c...",No win (5 of 5)
546.,2017-07-31 03:24:10,70.38,96%,"To feel it so like myself, indeed, so brotherly, made me rea...",No win (3 of 4)
545.,2017-07-31 00:39:37,69.56,96%,Unlike the other four senses located in the logical regions ...,No win (2 of 4)
544.,2017-07-31 00:29:28,82.41,97%,I felt good and all washed clean of sin for the first time I...,Win (1 of 5)
543.,2017-07-30 09:41:35,66.31,95%,I called Betsy again at her office and she said maybe we'd g...,No win (4 of 5)
542.,2017-07-30 09:08:52,81.08,97%,Make no mistake about people who leap from burning windows. ...,Win (1 of 5)
541.,2017-07-30 09:07:21,77.76,98%,Wow! I've never seen so many guests from different parts of ...,Win (1 of 3)
540.,2017-07-30 06:42:47,80.90,97%,Don't take anything personally - nothing others do is becaus...,No win (2 of 5)
539.,2017-07-30 03:55:50,74.67,98%,"No, that is what I'm trying to tell you. He is still a child...",Win (1 of 4)
538.,2017-07-30 03:48:43,78.85,97%,For the same reasons that scientific standards change within...,No win (3 of 5)
537.,2017-07-29 23:16:27,68.80,97%,Ready are you? What know you of ready? For eight hundred yea...,No win (3 of 5)
536.,2017-07-29 23:13:44,64.75,96%,"In the witch trials, it was nearly impossible to provide com...",No win (4 of 5)
535.,2017-07-29 10:01:21,69.77,98%,Good games offer players a set of challenging problems and t...,No win (3 of 4)
534.,2017-07-29 09:51:40,73.73,98%,I've been thinking lots about my life and how quick I'd wash...,No win (2 of 5)
533.,2017-07-29 09:35:18,72.33,98%,Here's the cool part: I will eventually go to Schiaparelli a...,No win (3 of 5)
532.,2017-07-29 09:10:14,55.06,95%,Everything that has transpired has done so according to my d...,No win (4 of 5)
531.,2017-07-29 08:02:51,70.55,97%,"In this building, it's either kill or be killed. You make no...",Win (1 of 5)
530.,2017-07-29 03:07:51,66.70,96%,"In general, many of these targets are easier marks if you ar...",No win (2 of 5)
529.,2017-07-27 11:51:33,65.18,95%,Sure is mellow grazin' in the grass. What a trip just watchi...,No win (3 of 5)
528.,2017-07-27 06:55:06,75.96,98%,A life is made up of a great number of small incidents and a...,No win (2 of 5)
527.,2017-07-27 05:42:16,66.73,96%,"But, pray how could that which I spoke so many years ago, an...",No win (3 of 5)
526.,2017-07-26 22:50:35,69.18,97%,"Obviously, my attempt at fooling her had been unsuccessful. ...",No win (2 of 5)
525.,2017-07-26 09:06:20,69.80,98%,"Fine art is dead, Hobbes. Nobody understands it. Nobody like...",No win (2 of 3)
524.,2017-07-26 08:46:12,66.66,97%,"If one day I could get out of here, I would allow myself to ...",Win (1 of 5)
523.,2017-07-26 08:35:45,61.94,97%,I've been trying to get answers from him. Where does he come...,No win (4 of 4)
522.,2017-07-26 08:34:39,66.29,96%,Thus they went on living in a reality that was slipping away...,No win (3 of 4)
521.,2017-07-25 08:48:59,73.54,97%,It's a pity that folk as talk about fighting the Enemy can't...,No win (3 of 4)
520.,2017-07-24 13:47:03,82.50,98%,And I will look down and see my murmuring bones and the deep...,Win (1 of 5)
519.,2017-07-24 04:02:38,77.18,99%,If he stayed at home and carried on with his normal life he ...,No win (3 of 3)
518.,2017-07-23 15:09:28,74.69,98%,How can you see into my eyes like open doors leading you dow...,No win (4 of 5)
517.,2017-07-22 23:14:27,68.72,97%,"You cannot entice a true thief, and thief by vocation, into ...",No win (4 of 5)
516.,2017-07-22 23:04:13,69.24,97%,Monsters are closing in! Throw your pack against them and pu...,Win (1 of 5)
515.,2017-07-22 22:29:02,63.78,96%,Unlike the other four senses located in the logical regions ...,No win (3 of 5)
514.,2017-07-22 13:00:53,64.58,98%,"Now Lina, you've been reading all those fan magazines again!...",No win (4 of 5)
513.,2017-07-22 07:57:15,67.13,96%,"In general, many of these targets are easier marks if you ar...",No win (2 of 5)
512.,2017-07-22 07:55:53,71.62,98%,"Furthermore, those not understanding this intensity will say...",Win (1 of 3)
511.,2017-07-21 10:28:24,66.50,96%,I'll tell you a secret. Something they don't teach you in yo...,No win (4 of 5)
510.,2017-07-21 02:50:47,69.78,96%,Because the peoples of Micronesia and Palau did not have a w...,Win (1 of 3)
509.,2017-07-21 02:41:31,69.60,97%,"We turn away to face the cold, enduring chill, as the day be...",No win (5 of 5)
508.,2017-07-20 21:36:31,66.58,97%,"Alfred Hitchcock once said, ""Drama is life with the dull bit...",No win (3 of 4)
507.,2017-07-20 21:19:40,92.94,100%,There is something about yourself that you don't know.,No win (3 of 5)
506.,2017-07-20 08:12:36,73.69,97%,"Oh, what sad times are these when passing ruffians can say N...",No win (3 of 3)
505.,2017-07-20 08:09:31,71.00,98%,"Imagine this: Here we are, a plane full of grown human being...",No win (2 of 4)
504.,2017-07-20 06:57:41,65.83,96%,You know I work all day to get you money to buy you things. ...,No win (4 of 5)
503.,2017-07-16 06:12:40,59.69,94%,"I'll make him an offer he can't refuse. You see, Johnny, we ...",Win (1 of 5)
502.,2017-07-16 00:43:08,68.17,97%,A melancholy air can never be the right thing; what you want...,No win (2 of 3)
501.,2017-07-15 12:46:48,63.68,96%,"With the lights out, it's less dangerous. Here we are now, e...",No win (3 of 5)
500.,2017-07-15 12:19:23,70.40,96%,Unlike the other four senses located in the logical regions ...,No win (2 of 5)
499.,2017-07-15 03:33:12,76.77,98%,I know now that it's over. I knew it then. There would be no...,Win (1 of 2)
498.,2017-07-15 03:06:05,65.03,96%,Although reflection mapping can be used to produce a number ...,No win (2 of 5)
497.,2017-07-15 00:29:33,65.25,97%,I know that you weren't bored that day because there was a l...,No win (3 of 4)
496.,2017-07-14 09:31:59,67.55,97%,It takes more than a calorie of fossil fuel energy to produc...,No win (3 of 5)
495.,2017-07-13 04:40:42,63.49,97%,He was perfectly astonished with the historical account gave...,No win (2 of 4)
494.,2017-07-07 15:12:22,59.40,95%,"My brother, your father, he and I. Opposites. But I never do...",No win (4 of 5)
493.,2017-07-06 09:39:14,82.37,97%,I'd have wasted a lot of time and trouble before I learned t...,Win (1 of 5)
492.,2017-07-04 16:08:39,70.73,97%,He could not be mistaken. There were no other eyes like thos...,No win (2 of 5)
491.,2017-07-04 06:50:16,68.09,97%,In two dimensions we say that a rigid body has only one rota...,Win (1 of 4)
490.,2017-06-30 04:27:29,66.94,96%,"To be fair, English is full of booby traps for the unwary fo...",No win (2 of 5)
489.,2017-06-30 04:26:34,83.29,98%,And so with the sunshine and the great bursts of leaves grow...,Win (1 of 4)
488.,2017-06-30 04:04:12,82.34,98%,From compositional considerations the tomato layer would be ...,Win (1 of 5)
487.,2017-06-28 13:31:15,67.17,97%,"This town is very peaceful. Yes, and that is why there are s...",No win (4 of 5)
486.,2017-06-28 11:15:25,77.98,97%,"She can lead you to love, she can take you or leave you, she...",No win (3 of 5)
485.,2017-06-28 11:14:43,72.36,98%,I drew the blankets over my head and tried to think of Chris...,No win (2 of 5)
484.,2017-06-28 11:07:30,69.03,97%,"For as long as I can remember, I have always found it easier...",No win (4 of 5)
483.,2017-06-28 10:47:51,77.23,98%,"Life is not suffering; it's just that you will suffer it, ra...",Win (1 of 5)
