14.,2012-05-09 13:21:51,102.32,97%,"Finally, gentlemen, there are people with an hereditary anim...",Win (1 of 2)
13.,2012-05-09 13:17:30,122.78,94%,Good games offer players a set of challenging problems and t...,Win (1 of 3)
12.,2012-05-09 13:01:05,140.35,98%,The ultimate way to compose is to be able to keyboard as fas...,Win (1 of 5)
11.,2012-05-09 13:00:22,103.22,92%,"Ever since I was a child, folks have thought they had me peg...",No win (2 of 2)
10.,2012-05-09 12:58:00,125.43,95%,"As if that blind rage had washed me clean, rid me of hope; f...",Win (1 of 4)
9.,2012-05-09 12:55:44,112.61,97%,"It's a sunny, woodsy day in Lumberton, so get those chainsaw...",Win (1 of 3)
8.,2012-05-09 12:54:44,130.50,96%,"I hope that whoever you are, you escape this place. I hope t...",Win (1 of 4)
7.,2012-05-09 12:52:57,107.68,94%,The Inca believed that if one did not give thanks and obedie...,Win (1 of 2)
6.,2012-05-09 12:52:05,111.48,93%,"Yet one fine day, in a fit of euphoria, after he had picked ...",No win (2 of 3)
5.,2012-05-09 12:48:14,118.56,97%,Many rivers to cross but I can't seem to find my way over. W...,No win (2 of 2)
4.,2012-05-09 12:47:27,106.70,95%,The Inca believed that if one did not give thanks and obedie...,No win (3 of 4)
3.,2012-05-09 12:45:50,99.35,94%,Corn is what feeds the steer that becomes the steak. Corn fe...,No win (3 of 3)
2.,2012-05-09 12:43:10,123.60,98%,Let's face it: there are tons of things in your home and lif...,Win (1 of 3)
1.,2012-05-09 12:39:43,114.30,98%,"When we conceive of the sweetest being ever, we are conceivi...",Win (1 of 4)
