240.,2012-05-25 15:27:51,110.46,92%,I've always wondered about this coat business. When I'm in a...,Win (1 of 3)
239.,2012-05-25 15:27:08,122.59,97%,A few light taps upon the pane made him turn to the window. ...,No win (2 of 2)
238.,2012-05-25 15:26:27,122.43,99%,"The term ""barbarian"" was created by the Greeks; it was origi...",No win (2 of 2)
237.,2012-05-25 15:25:51,107.29,95%,"When I was a kid, you never saw radicchio in the produce sec...",No win (2 of 5)
236.,2012-05-23 17:55:15,109.05,93%,There are two places on Earth that serve as canaries in the ...,Win (1 of 3)
235.,2012-05-23 17:53:44,113.63,94%,We began to recognize in them a strange obsession. After all...,Win (1 of 5)
234.,2012-05-23 17:52:58,112.09,93%,Step out the front door like a ghost into the fog where no o...,No win (2 of 4)
233.,2012-05-23 17:52:15,105.17,91%,"Time is tricky. You have whole months, even years, when noth...",No win (2 of 2)
232.,2012-05-23 17:51:20,105.98,92%,"Every craft and every investigation, and likewise every acti...",No win (2 of 2)
231.,2012-05-23 17:50:18,110.33,93%,One essential rule: make sure the joke is the last possible ...,No win (2 of 3)
230.,2012-05-22 14:13:46,114.72,95%,Consider this: Is the pious being loved by the gods because ...,No win (1 of 1)
229.,2012-05-22 14:12:06,113.71,97%,"You just couldn't let me go, could you? This is what happens...",Win (1 of 3)
228.,2012-05-22 14:10:34,113.94,98%,You could choke a dozen donkeys on that! And you're haggling...,No win (2 of 5)
227.,2012-05-22 14:10:01,102.33,95%,Lucid but wholly false recollections can easily be induced b...,No win (4 of 4)
226.,2012-05-22 13:43:48,103.05,90%,"Trudging slowly over wet sand, back to the bench where your ...",Win (1 of 2)
225.,2012-05-22 13:43:07,102.59,94%,The pickpockets' profession demands extraordinary nimbleness...,Win (1 of 3)
224.,2012-05-22 13:41:57,121.55,100%,The beginner writes just twenty pieces. The professional wri...,Win (1 of 3)
223.,2012-05-22 13:38:33,123.56,96%,"Historically, most wines contained less than 14 percent alco...",Win (1 of 4)
222.,2012-05-22 13:37:48,111.32,94%,"After the grapes are crushed, yeasts (tiny one-celled organi...",Win (1 of 3)
221.,2012-05-22 13:36:49,139.05,97%,"Right, I am going to tell you how this works. You're going i...",Win (1 of 4)
220.,2012-05-22 13:35:56,115.88,91%,Remember that humor is written backwards. That means you fir...,Win (1 of 2)
219.,2012-05-21 14:19:40,116.65,94%,The problem we now face is that this thin layer of atmospher...,No win (2 of 4)
218.,2012-05-21 14:18:42,131.76,96%,Unlike the other four senses located in the logical regions ...,Win (1 of 2)
217.,2012-05-21 14:18:02,101.30,92%,"Tis but thy name that is my enemy. Thou art thyself, though ...",No win (2 of 4)
216.,2012-05-21 14:16:35,132.83,98%,I had the impression of being abandoned by everyone when the...,Win (1 of 3)
215.,2012-05-21 14:14:44,117.69,93%,"He was rough around the edges. He'd been to school, but neve...",Win (1 of 4)
214.,2012-05-21 14:13:42,132.14,95%,"You have a class of young strong men and women, and they wan...",Win (1 of 2)
213.,2012-05-21 14:12:59,105.49,94%,Data is by definition easy to copy. And the Internet makes c...,No win (1 of 1)
212.,2012-05-21 14:12:00,124.27,94%,"And I said, I don't care if they lay me off either, because ...",No win (1 of 1)
211.,2012-05-21 14:10:38,150.09,100%,"No matter how bad things are, you can always make things wor...",Win (1 of 3)
210.,2012-05-21 14:10:10,122.09,95%,"I know that the idea of raising well-rounded, smarter kids c...",No win (4 of 4)
209.,2012-05-21 13:42:58,127.86,97%,"Trudging slowly over wet sand, back to the bench where your ...",No win (1 of 1)
208.,2012-05-21 13:42:00,136.83,97%,Remembering you running soft through the night. You were big...,Win (1 of 4)
207.,2012-05-21 13:41:24,125.99,98%,There's a hole in the world like a great black pit. And the ...,No win (2 of 4)
206.,2012-05-21 13:39:34,137.02,96%,There is something about yourself that you don't know. Somet...,Win (1 of 3)
205.,2012-05-21 13:38:31,136.66,98%,But the two men were not lonely at all. At home they were co...,No win (2 of 3)
204.,2012-05-21 13:35:39,115.11,97%,At the time when Britain faced a plunge into chaos and darkn...,Win (1 of 2)
203.,2012-05-21 13:34:41,114.08,95%,Groups of illegal miners smuggle themselves down in freight ...,Win (1 of 3)
202.,2012-05-21 13:33:52,110.53,93%,"When Betty and Billy fell asleep, he walked down to the kitc...",No win (2 of 2)
201.,2012-05-18 13:14:44,140.05,96%,"When I really worry about something, I don't just fool aroun...",Win (1 of 5)
200.,2012-05-18 13:14:12,104.78,91%,"Comfortable, Mullet? It seems sadly ironic that it's that ti...",No win (2 of 3)
199.,2012-05-18 13:12:50,111.35,96%,"Ergonomics is a term that combines the Greek word ergon, mea...",Win (1 of 4)
198.,2012-05-18 13:12:07,115.30,94%,A giant inverted steel pyramid is perfectly balanced on its ...,Win (1 of 4)
197.,2012-05-18 13:11:19,127.23,96%,"No matter how bad things are, you can always make things wor...",Win (1 of 2)
196.,2012-05-18 13:10:30,119.72,98%,"The result has been the emergence of what some call the ""win...",Win (1 of 4)
195.,2012-05-18 13:09:34,141.07,99%,I remember when we used to sit in the government yard in Tre...,Win (1 of 4)
194.,2012-05-18 13:03:12,136.52,99%,A few light taps upon the pane made him turn to the window. ...,Win (1 of 3)
193.,2012-05-18 13:02:37,119.82,93%,"Thirdly, however, these wars could now be waged with the new...",Win (1 of 5)
192.,2012-05-18 13:00:18,136.66,98%,Let's face it: there are tons of things in your home and lif...,Win (1 of 3)
191.,2012-05-18 12:59:27,114.20,94%,Corn is what feeds the steer that becomes the steak. Corn fe...,Win (1 of 5)
190.,2012-05-18 12:58:13,118.55,94%,"And you know it's time to go, through the sleet and driving ...",Win (1 of 3)
189.,2012-05-18 12:57:31,125.03,96%,Your faith was strong but you needed proof. You saw her bath...,No win (2 of 3)
188.,2012-05-18 12:26:40,118.20,94%,It was hard to toss things I had once thought were valuable ...,No win (3 of 3)
187.,2012-05-18 12:25:34,96.09,91%,He had spent enormous amounts of time at the great libraries...,Win (1 of 2)
186.,2012-05-18 12:24:40,102.28,95%,"An essential characteristic of the superhero mythology is, t...",No win (1 of 1)
185.,2012-05-18 12:23:00,134.75,97%,"Samatha is a state in which the mind is brought to rest, foc...",Win (1 of 3)
184.,2012-05-18 12:22:16,112.78,94%,"Combat for a naval aviator is fought in short, violent burst...",Win (1 of 3)
183.,2012-05-18 12:21:23,117.30,96%,"I know a bloke who knows a bloke who knows a bloke. Now, I k...",Win (1 of 3)
182.,2012-05-17 13:28:36,107.03,94%,There are very few things I wish I could change about those ...,Win (1 of 3)
181.,2012-05-17 13:27:37,101.54,91%,Instead of hiring workers during the peak hog kill in the wi...,No win (2 of 4)
180.,2012-05-17 13:26:38,137.13,99%,"Life is not suffering; it's just that you will suffer it, ra...",Win (1 of 4)
179.,2012-05-17 13:26:08,102.90,94%,The great edifice of variety and choice that is an American ...,No win (2 of 4)
178.,2012-05-17 13:25:14,129.80,99%,The streets were cleared by a Critical Mass bike ride and we...,Win (1 of 2)
177.,2012-05-17 12:45:21,133.25,98%,"Right, I am going to tell you how this works. You're going i...",Win (1 of 3)
176.,2012-05-17 12:44:23,105.04,94%,"The idea of ""Mr. Right"" has been passed down over the genera...",Win (1 of 2)
175.,2012-05-17 12:43:25,104.09,91%,Space is big. Really big. You just won't believe how vastly ...,Win (1 of 3)
174.,2012-05-17 12:42:44,104.50,91%,"To evaluate an option from the other side's point of view, c...",No win (2 of 4)
173.,2012-05-17 12:42:03,116.99,96%,"The only people for me are the mad ones, the ones who are ma...",Win (1 of 2)
172.,2012-05-17 12:41:11,103.17,93%,"Prior to the 1970's, because the United States had long been...",No win (2 of 2)
171.,2012-05-16 14:47:41,120.17,95%,"He started running, up and up, until he hurled himself into ...",Win (1 of 3)
170.,2012-05-16 14:46:57,108.12,96%,The evidence in the standard history of Qwerty versus Dvorak...,No win (2 of 4)
169.,2012-05-16 14:46:00,108.54,93%,"Two households, both alike in dignity (in fair Verona, where...",No win (2 of 3)
168.,2012-05-16 14:45:04,101.14,91%,"However, let us leave aside the philosophical, social, and e...",No win (3 of 3)
167.,2012-05-16 14:43:39,119.36,97%,A giant inverted steel pyramid is perfectly balanced on its ...,Win (1 of 3)
166.,2012-05-16 14:42:51,131.05,95%,"When I really worry about something, I don't just fool aroun...",Win (1 of 5)
165.,2012-05-16 14:41:38,94.54,91%,A total of twenty-five friends were headed from San Francisc...,No win (2 of 2)
164.,2012-05-16 13:22:20,124.22,98%,"With no map to navigate one's life, some of us have stood st...",Win (1 of 2)
163.,2012-05-16 13:11:57,118.25,96%,"Some pilots like the excitement of our missions, knowing tha...",Win (1 of 2)
162.,2012-05-16 13:11:15,116.71,94%,"Everyone said I was daft to build a castle on a swamp, but I...",Win (1 of 2)
161.,2012-05-16 13:10:23,108.72,94%,"In May 1980, Fidel Castro opened the harbor at Mariel, Cuba ...",Win (1 of 2)
160.,2012-05-16 13:09:28,127.00,97%,"It's a sunny, woodsy day in Lumberton, so get those chainsaw...",No win (1 of 1)
159.,2012-05-16 13:02:04,140.10,97%,"People get ready, there's a train coming. You don't need no ...",Win (1 of 4)
158.,2012-05-16 13:01:22,142.08,99%,"Often, we assume that a familiar situation will be but a rep...",No win (1 of 1)
157.,2012-05-16 13:00:31,121.71,96%,"Samatha is a state in which the mind is brought to rest, foc...",No win (1 of 1)
156.,2012-05-16 12:59:35,125.77,97%,I said that I would see you because I had heard that you wer...,Win (1 of 3)
155.,2012-05-16 12:48:49,116.38,96%,"I'm so glad you came, I'm so glad you remembered, to see how...",Win (1 of 4)
154.,2012-05-16 12:48:18,111.06,94%,"Thirdly, however, these wars could now be waged with the new...",No win (2 of 4)
153.,2012-05-16 12:47:34,92.47,88%,It's the possibility of having a dream come true that makes ...,No win (3 of 3)
152.,2012-05-16 12:41:32,123.62,95%,"I know that the idea of raising well-rounded, smarter kids c...",Win (1 of 3)
151.,2012-05-16 12:40:13,126.53,97%,I thought climbing the Devil's Thumb would fix all that was ...,Win (1 of 3)
150.,2012-05-16 12:39:35,128.15,95%,Every time I think of you I feel shot right through with a b...,Win (1 of 2)
149.,2012-05-16 12:38:53,94.04,97%,"Ergonomics is a term that combines the Greek word ergon, mea...",No win (1 of 1)
148.,2012-05-16 12:36:48,150.30,97%,"Ticking away the moments that make up a dull day, you fritte...",Win (1 of 4)
147.,2012-05-16 12:36:13,101.72,95%,"Double, double, toil and trouble; fire burn, and cauldron bu...",Win (1 of 3)
146.,2012-05-16 12:35:17,121.23,96%,"With no map to navigate one's life, some of us have stood st...",Win (1 of 2)
145.,2012-05-15 13:52:13,105.53,91%,I never said I would stay to the end - I knew I would leave ...,No win (4 of 4)
144.,2012-05-15 13:51:19,100.67,92%,We might begin by asking why the pregnant man image has been...,No win (3 of 3)
143.,2012-05-15 13:50:27,121.30,97%,Paper as we know it today was invented in China in around 10...,No win (2 of 4)
142.,2012-05-15 13:49:33,102.71,90%,We've arranged a global civilization in which most crucial e...,Win (1 of 2)
141.,2012-05-15 13:48:19,130.70,98%,"Ticking away the moments that make up a dull day, you fritte...",Win (1 of 4)
140.,2012-05-15 13:47:23,117.92,96%,He canceled all his commitments and pulled together the most...,Win (1 of 4)
139.,2012-05-15 13:29:14,121.46,96%,"This was the most delicious meal he'd had in recent years, a...",Win (1 of 4)
138.,2012-05-15 13:27:46,83.19,90%,"Today, computers have taken this ancient art out of the craf...",Win (1 of 2)
137.,2012-05-15 13:26:42,121.10,100%,Good games offer players a set of challenging problems and t...,No win (2 of 3)
136.,2012-05-15 13:26:09,133.89,97%,"And you know it's time to go, through the sleet and driving ...",Win (1 of 4)
135.,2012-05-15 13:25:34,123.90,94%,I never said I would stay to the end - I knew I would leave ...,Win (1 of 3)
134.,2012-05-15 13:22:46,139.19,98%,Always do your best - your best is going to change from mome...,Win (1 of 4)
133.,2012-05-15 13:22:06,115.58,93%,It is possible that I already had some presentiment of my fu...,No win (2 of 3)
132.,2012-05-15 13:14:22,136.08,97%,"I'm so glad you came, I'm so glad you remembered, the walkin...",Win (1 of 3)
131.,2012-05-15 13:13:49,122.37,96%,Few smart kids can spare the attention that popularity requi...,Win (1 of 2)
130.,2012-05-15 13:12:26,111.92,93%,"If you want to drive a race car well, whether to win an Indy...",No win (1 of 1)
129.,2012-05-15 13:11:23,115.85,97%,"Throughout my academic career, I'd given some pretty good ta...",Win (1 of 3)
128.,2012-05-15 13:10:48,87.83,88%,"In the English language, swearing is essential to effective ...",No win (2 of 2)
127.,2012-05-15 13:09:52,107.15,89%,So what's in this for you? Should you rush out in search of ...,No win (2 of 2)
126.,2012-05-15 12:52:49,111.33,93%,"Picking up the pieces, half alive in a nine 'til five, vacan...",Win (1 of 4)
125.,2012-05-15 12:52:05,132.09,98%,"The Earth is a world, the world is a ball, a ball in a game ...",No win (2 of 3)
124.,2012-05-15 12:50:59,111.63,96%,"Hey Mr. Tambourine Man, play a song for me, I'm not sleepy a...",No win (2 of 2)
123.,2012-05-15 12:50:20,115.01,92%,For it is not enough to have a good mind; the main thing is ...,No win (3 of 3)
122.,2012-05-15 12:49:21,106.87,93%,The basic concept is simple: a satellite in geosynchronous o...,No win (2 of 2)
121.,2012-05-15 12:48:19,136.68,99%,"Every craft and every investigation, and likewise every acti...",Win (1 of 4)
120.,2012-05-15 12:47:15,99.68,88%,The Inca believed that if one did not give thanks and obedie...,Win (1 of 3)
119.,2012-05-15 12:41:49,131.54,97%,"But suddenly, I viddied that thinking was for the gloopy one...",Win (1 of 2)
118.,2012-05-15 12:41:08,125.09,94%,Don't make assumptions - find the courage to ask questions a...,Win (1 of 2)
117.,2012-05-15 12:40:25,135.28,98%,"I went to the woods because I wished to live deliberately, t...",Win (1 of 2)
116.,2012-05-15 12:39:51,106.44,95%,"Radiation could be precisely determined, in principle, if we...",Win (1 of 2)
115.,2012-05-15 12:35:06,144.32,98%,"If you really want to hear about it, the first thing you'll ...",Win (1 of 3)
114.,2012-05-15 12:33:07,118.67,95%,The streets were cleared by a Critical Mass bike ride and we...,Win (1 of 3)
113.,2012-05-15 12:32:25,98.57,93%,"King, eh? Very nice. And how'd you get that, eh? By exploiti...",No win (2 of 3)
112.,2012-05-15 12:31:32,117.56,95%,"Has it been five years? Six? It seems like a lifetime, the k...",No win (2 of 2)
111.,2012-05-15 12:30:37,118.73,96%,"Milt, with the excellent timing of a master comedy writer, w...",Win (1 of 3)
110.,2012-05-15 12:29:50,140.34,99%,I don't believe in painted roses or bleeding hearts while bu...,Win (1 of 3)
109.,2012-05-15 12:28:05,109.24,94%,"Trudging slowly over wet sand, back to the bench where your ...",Win (1 of 4)
108.,2012-05-15 12:27:28,124.27,96%,Is it sweeter to exist only in the mind or to exist both in ...,Win (1 of 4)
107.,2012-05-15 12:26:46,128.88,98%,There's a hole in the world like a great black pit. And the ...,Win (1 of 2)
106.,2012-05-15 12:26:09,106.32,92%,"He started running, up and up, until he hurled himself into ...",Win (1 of 3)
105.,2012-05-15 12:25:16,113.01,96%,Once you get into the processed foods you have to be a fairl...,Win (1 of 3)
104.,2012-05-15 12:24:17,131.23,98%,He rode past me and kept on goin'. Never said nothin' goin' ...,Win (1 of 3)
103.,2012-05-15 12:20:34,130.87,99%,Music finds a comfortable parallel with that of human langua...,No win (2 of 4)
102.,2012-05-15 09:46:14,108.64,96%,Since the 1980s virtually all the sodas and most of the frui...,Win (1 of 3)
101.,2012-05-15 09:45:11,107.62,91%,There is a theory which states that if anybody ever discover...,Win (1 of 2)
100.,2012-05-15 09:44:23,110.93,95%,"I'm so glad you came, I'm so glad you remembered, to see how...",Win (1 of 2)
99.,2012-05-15 09:43:35,130.62,97%,I've been looking so long at these pictures of you that I al...,Win (1 of 4)
98.,2012-05-15 09:42:57,101.43,95%,"Tis but thy name that is my enemy. Thou art thyself, though ...",Win (1 of 2)
97.,2012-05-14 14:15:24,129.19,97%,And then he calls me a jerk and says the last guy who though...,Win (1 of 2)
96.,2012-05-14 14:14:37,112.27,96%,Supermarket aisles are the perfect place to practice your gl...,Win (1 of 2)
95.,2012-05-14 14:13:45,107.16,94%,Had dreams. Two of 'em. Both had my father. It's peculiar. I...,No win (3 of 4)
94.,2012-05-14 14:12:44,122.75,94%,Sometimes you concentrate more on racing the cars around you...,No win (3 of 3)
93.,2012-05-14 13:56:56,103.00,94%,My entire life had been on a predictable trajectory dominate...,Win (1 of 3)
92.,2012-05-14 13:55:16,113.15,96%,Three changes occur while the stacked disk structure equilib...,No win (2 of 5)
91.,2012-05-14 13:54:13,126.69,99%,It is possible that I already had some presentiment of my fu...,Win (1 of 2)
90.,2012-05-14 13:52:26,113.19,94%,"Padre, these are subtleties! We are not concerned with motiv...",Win (1 of 4)
89.,2012-05-14 13:50:54,131.76,99%,Most popular song lyrics have two sections - a verse and a b...,Win (1 of 5)
88.,2012-05-14 13:46:13,113.94,96%,"I know that the idea of raising well-rounded, smarter kids c...",Win (1 of 3)
87.,2012-05-14 13:44:56,120.68,98%,"However, let us leave aside the philosophical, social, and e...",Win (1 of 3)
86.,2012-05-14 13:40:19,127.20,98%,There is a theory which states that if anybody ever discover...,Win (1 of 2)
85.,2012-05-14 13:38:03,108.93,96%,"Don't practice too much at first, or you're likely to develo...",Win (1 of 2)
84.,2012-05-14 13:21:36,124.83,95%,"That fear had been inside him for many years, it had lived w...",Win (1 of 2)
83.,2012-05-14 13:20:51,95.85,97%,"Well, it just so happens, this hacienda comes with its very ...",No win (3 of 5)
82.,2012-05-14 13:20:13,91.41,89%,Is it really necessary to send that email? The more emails y...,No win (2 of 4)
81.,2012-05-14 13:17:15,148.80,99%,"I hope that whoever you are, you escape this place. I hope t...",Win (1 of 3)
80.,2012-05-14 13:16:10,95.60,97%,"As if that blind rage had washed me clean, rid me of hope; f...",No win (2 of 5)
79.,2012-05-14 13:15:17,116.54,98%,In 1969 four computers located around the country were in co...,Win (1 of 2)
78.,2012-05-14 12:57:09,123.50,94%,"Everyone said I was daft to build a castle on a swamp, but I...",Win (1 of 4)
77.,2012-05-14 12:56:15,114.54,97%,"Yes, the newspapers were right: snow was general all over Ir...",Win (1 of 3)
76.,2012-05-14 12:53:58,136.94,98%,"And I said, I don't care if they lay me off either, because ...",Win (1 of 2)
75.,2012-05-14 12:52:40,106.29,96%,"Padre, these are subtleties! We are not concerned with motiv...",No win (2 of 3)
74.,2012-05-14 12:51:42,113.66,95%,Being able to quit things that don't work is integral to bei...,No win (3 of 5)
73.,2012-05-14 12:51:06,121.47,95%,"A computer needs a manager to administer its operations, jus...",Win (1 of 5)
72.,2012-05-14 12:46:47,107.24,93%,Many wines have more than 14 percent alcohol because the win...,Win (1 of 4)
71.,2012-05-14 12:45:43,117.20,95%,"When she returns to the forum page, her post is there. It is...",Win (1 of 4)
70.,2012-05-14 12:45:01,117.04,93%,"When I really worry about something, I don't just fool aroun...",No win (2 of 4)
69.,2012-05-14 12:43:49,108.76,94%,"I often see racers, particularly at the back of the pack in ...",No win (1 of 1)
68.,2012-05-14 12:40:58,127.58,98%,We were playing checkers. I used to kid her once in a while ...,No win (1 of 1)
67.,2012-05-14 12:37:03,114.46,97%,"Yeah, you just take Soupy-Sales to prom 'cause I can think o...",Win (1 of 3)
66.,2012-05-14 12:36:05,113.36,97%,"In the English language, swearing is essential to effective ...",No win (3 of 4)
65.,2012-05-14 12:33:22,135.86,97%,"Samatha is a state in which the mind is brought to rest, foc...",Win (1 of 3)
64.,2012-05-14 12:32:46,122.81,94%,Remembering you running soft through the night. You were big...,Win (1 of 3)
63.,2012-05-14 12:29:55,125.63,98%,Parisian French is different from Provincial French and Germ...,Win (1 of 3)
62.,2012-05-14 12:29:22,103.75,92%,To an outsider's ear it sounds absurdly wild and ridiculous ...,No win (2 of 2)
61.,2012-05-14 12:27:45,112.43,96%,"Thirdly, however, these wars could now be waged with the new...",Win (1 of 4)
60.,2012-05-14 12:26:57,97.14,91%,"Listen, strange women lyin' in ponds distributin' swords is ...",Win (1 of 2)
59.,2012-05-14 12:26:18,116.34,95%,"Let me get this straight. You think that your client, one of...",Win (1 of 3)
58.,2012-05-14 12:25:35,108.57,92%,You have to wonder: how do the machines know what Tasty Whea...,No win (1 of 1)
57.,2012-05-14 12:24:31,129.40,100%,The beginner writes just twenty pieces. The professional wri...,Win (1 of 2)
56.,2012-05-14 12:23:53,123.84,97%,"Contrary to the feminist cant, there are many things we can ...",No win (1 of 1)
55.,2012-05-10 12:59:47,129.63,97%,And I don't believe in the existence of angels but looking a...,Win (1 of 3)
54.,2012-05-10 12:58:23,114.96,93%,I'd just like to point out that you were given every opportu...,Win (1 of 5)
53.,2012-05-10 12:57:07,106.09,95%,"She looked terrific. I said to myself, ""Maybe she's going to...",No win (2 of 5)
52.,2012-05-10 12:56:03,101.58,93%,But speculations on the structure of the universe also move ...,No win (3 of 3)
51.,2012-05-10 12:55:12,138.84,98%,"Your face has fallen sad now, for you know the time is nigh....",No win (2 of 3)
50.,2012-05-10 12:50:57,106.59,94%,"To evaluate an option from the other side's point of view, c...",Win (1 of 5)
49.,2012-05-10 12:50:15,112.84,96%,"That's Tommy. He tells people he was named after a gun, but ...",Win (1 of 5)
48.,2012-05-10 12:49:41,130.54,98%,Step out the front door like a ghost into the fog where no o...,Win (1 of 2)
47.,2012-05-10 12:45:02,126.98,95%,So it's all come back round to breaking apart again. Breakin...,Win (1 of 5)
46.,2012-05-10 12:44:11,103.99,93%,Involuntarily I glanced seaward - and distinguished nothing ...,Win (1 of 3)
45.,2012-05-10 12:43:16,111.47,93%,One thing I've learned in the last seven years: in every gam...,No win (3 of 5)
44.,2012-05-10 12:39:35,135.67,97%,Language is one of the keys to being human. It allows us to ...,Win (1 of 5)
43.,2012-05-10 12:38:21,107.68,95%,There are two places on Earth that serve as canaries in the ...,Win (1 of 2)
42.,2012-05-10 12:35:06,123.43,97%,"When Betty and Billy fell asleep, he walked down to the kitc...",No win (2 of 3)
41.,2012-05-10 12:34:15,106.08,95%,"Yes, the newspapers were right: snow was general all over Ir...",No win (2 of 4)
40.,2012-05-10 12:33:36,97.84,92%,"They knew they were privileged to have these choices, but th...",No win (2 of 4)
39.,2012-05-10 12:32:24,124.02,98%,What should have been swift revenge turned into an all out w...,Win (1 of 5)
38.,2012-05-10 12:30:23,124.83,98%,Yet the web of thought has no such creases and is more like ...,Win (1 of 5)
37.,2012-05-10 12:29:42,113.45,97%,"You found paradise in America. You had a good trade, made a ...",Win (1 of 3)
36.,2012-05-10 12:28:45,109.37,95%,"I'd been walking for hours and, as usual, I'd lost track of ...",Win (1 of 3)
35.,2012-05-09 14:17:19,97.21,90%,The theory of music emphasizes the elements from which music...,No win (3 of 3)
34.,2012-05-09 14:16:27,118.84,95%,"Run to the bedroom, in the suitcase on the left, you'll find...",No win (2 of 3)
33.,2012-05-09 14:13:29,112.15,95%,"Picking up the pieces, half alive in a nine 'til five, vacan...",No win (2 of 3)
32.,2012-05-09 14:12:46,121.44,98%,It takes more than a calorie of fossil fuel energy to produc...,No win (3 of 4)
31.,2012-05-09 14:10:06,100.77,91%,But speculations on the structure of the universe also move ...,No win (4 of 5)
30.,2012-05-09 14:08:33,133.77,97%,Sometimes you concentrate more on racing the cars around you...,No win (2 of 3)
29.,2012-05-09 14:05:15,116.76,93%,"Now that I know that I'm breaking to pieces, I'll pull out m...",No win (2 of 5)
28.,2012-05-09 14:02:40,146.22,98%,Good games offer players a set of challenging problems and t...,Win (1 of 4)
27.,2012-05-09 14:01:59,116.88,96%,Most popular song lyrics have two sections - a verse and a b...,No win (3 of 3)
26.,2012-05-09 13:59:54,116.26,97%,"There was me, that is Alex, and my three droogs, that is Pet...",Win (1 of 3)
25.,2012-05-09 13:59:06,93.67,97%,"What good's a reward if you ain't around to use it? Besides,...",No win (3 of 4)
24.,2012-05-09 13:57:09,114.45,97%,And then he calls me a jerk and says the last guy who though...,Win (1 of 2)
23.,2012-05-09 13:56:27,85.17,93%,"What about Tony? You know, Bullet Tooth Tony. He'll find you...",No win (3 of 4)
22.,2012-05-09 13:55:46,118.27,99%,"The term ""barbarian"" was created by the Greeks; it was origi...",No win (2 of 2)
21.,2012-05-09 13:54:52,134.18,97%,For it is not enough to have a good mind; the main thing is ...,Win (1 of 3)
20.,2012-05-09 13:53:29,131.28,98%,I had the impression of being abandoned by everyone when the...,Win (1 of 4)
19.,2012-05-09 13:51:35,100.57,91%,Images of broken light which dance before me like a million ...,No win (3 of 4)
18.,2012-05-09 13:50:22,139.70,99%,"Life is not suffering; it's just that you will suffer it, ra...",Win (1 of 3)
17.,2012-05-09 13:49:50,96.79,90%,"And you know it's time to go, through the sleet and driving ...",No win (3 of 5)
16.,2012-05-09 13:49:03,138.22,98%,So it's all come back round to breaking apart again. Breakin...,Win (1 of 2)
15.,2012-05-09 13:48:15,116.05,97%,We all know people who are very bright but who do not always...,Win (1 of 3)
