160.,2012-06-23 03:55:44,128.07,98%,Lucid but wholly false recollections can easily be induced b...,Win (1 of 3)
159.,2012-06-21 07:25:04,117.58,96%,"When you are typing on a typewriter, your input appears dire...",Win (1 of 3)
158.,2012-06-21 07:24:32,122.90,97%,"Races are not won in the first corner; however, they are oft...",Win (1 of 4)
157.,2012-06-21 07:21:28,135.77,99%,We often believe the more we practice a skill or technique -...,Win (1 of 3)
156.,2012-06-21 07:20:30,127.17,97%,Now I want you to think and stop being a smart aleck. A man'...,Win (1 of 3)
155.,2012-06-21 07:19:48,129.38,98%,"But no matter how effective the lesson was, I never really u...",Win (1 of 2)
154.,2012-06-21 07:19:08,116.51,96%,"Races are not won in the first corner; however, they are oft...",Win (1 of 4)
153.,2012-06-21 07:18:10,111.08,97%,It takes more than a calorie of fossil fuel energy to produc...,No win (3 of 3)
152.,2012-06-21 07:13:12,149.41,100%,All that year the animals worked like slaves. But they were ...,Win (1 of 2)
151.,2012-06-21 07:12:01,134.01,98%,San Francisco in the middle sixties was a very special time ...,No win (2 of 3)
150.,2012-06-21 07:09:07,107.36,98%,"Listen, strange women lyin' in ponds distributin' swords is ...",No win (2 of 3)
149.,2012-06-21 03:14:11,136.54,99%,Since every piece of matter in the Universe is in some way a...,Win (1 of 2)
148.,2012-06-21 03:07:44,121.23,97%,"The goal of the true seeker is to become a sage, or superior...",No win (1 of 1)
147.,2012-06-21 03:06:34,126.13,98%,Instead of hiring workers during the peak hog kill in the wi...,Win (1 of 3)
146.,2012-06-21 02:53:26,128.11,97%,She's got eyes of the bluest skies as if they thought of rai...,No win (2 of 2)
145.,2012-06-21 02:51:29,127.56,97%,"In general, many of these targets are easier marks if you ar...",Win (1 of 2)
144.,2012-06-21 02:49:48,123.07,95%,There's a piece of Maria in every song that I sing. And the ...,Win (1 of 3)
143.,2012-06-21 02:48:00,115.61,97%,Convection also plays a minor role because of the relative t...,Win (1 of 2)
142.,2012-06-20 23:49:25,133.66,95%,"Time is tricky. You have whole months, even years, when noth...",Win (1 of 5)
141.,2012-06-20 23:48:13,126.20,95%,Well I woke in mid-afternoon cause that's when it all hurts ...,Win (1 of 3)
140.,2012-06-20 23:46:52,135.24,99%,"Ticking away the moments that make up a dull day, you fritte...",Win (1 of 2)
139.,2012-06-20 21:22:21,134.40,99%,There's a hole in the world like a great black pit. And the ...,Win (1 of 3)
138.,2012-06-20 21:18:26,138.89,96%,Although his voice was also broken by uncertainty and his ha...,Win (1 of 4)
137.,2012-06-20 21:16:14,131.77,97%,I suddenly had the impression that I had been left all alone...,Win (1 of 2)
136.,2012-06-20 21:13:43,124.36,98%,It was one of those days when it's a minute away from snowin...,Win (1 of 2)
135.,2012-06-20 21:09:34,118.84,99%,"She was a genius of sadness, immersing herself in it, separa...",No win (1 of 1)
134.,2012-06-20 21:07:44,122.01,99%,My entire life had been on a predictable trajectory dominate...,Win (1 of 2)
133.,2012-06-20 21:04:34,125.39,95%,"Comfortable, Mullet? It seems sadly ironic that it's that ti...",Win (1 of 3)
132.,2012-06-20 21:03:23,133.53,98%,Come sail your ships around me and burn your bridges down. W...,Win (1 of 2)
131.,2012-06-20 05:16:17,141.00,95%,These contests provided ample opportunity to demonstrate the...,No win (1 of 1)
130.,2012-06-20 05:14:52,124.73,99%,Danger is a topic you're often asked about as a sprinter. Th...,Win (1 of 3)
129.,2012-06-20 04:32:49,121.11,96%,"My friend, I shall be pedagogic, and say you ought to start ...",Win (1 of 3)
128.,2012-06-20 04:29:41,128.78,97%,"If we all go for the blonde and block each other, not a sing...",Win (1 of 4)
127.,2012-06-20 04:28:20,131.54,93%,I must not fear. Fear is the mind killer. Fear is the little...,Win (1 of 3)
126.,2012-06-20 03:45:08,133.13,99%,"Kid, I've flown from one side of this galaxy to the other, a...",Win (1 of 3)
125.,2012-06-19 04:37:52,121.86,96%,"When I really worry about something, I don't just fool aroun...",Win (1 of 3)
124.,2012-06-19 04:37:15,117.75,95%,To an outsider's ear it sounds absurdly wild and ridiculous ...,Win (1 of 3)
123.,2012-06-19 04:36:46,118.52,97%,"In the witch trials, it was nearly impossible to provide com...",Win (1 of 4)
122.,2012-06-19 04:35:11,151.60,100%,"I know a bloke who knows a bloke who knows a bloke. Now, I k...",Win (1 of 3)
121.,2012-06-19 04:34:26,130.96,98%,"Your face has fallen sad now, for you know the time is nigh....",Win (1 of 5)
120.,2012-06-17 19:51:52,116.68,99%,"In the English language, swearing is essential to effective ...",Win (1 of 2)
119.,2012-06-17 05:58:23,154.70,100%,Let's face it: there are tons of things in your home and lif...,Win (1 of 4)
118.,2012-06-17 04:27:24,136.14,98%,Don't take anything personally - nothing others do is becaus...,Win (1 of 4)
117.,2012-06-17 04:26:19,142.03,98%,We've known each other for many years but this is the first ...,Win (1 of 2)
116.,2012-06-17 04:23:45,131.53,99%,It's the possibility of having a dream come true that makes ...,Win (1 of 2)
115.,2012-06-17 04:22:41,127.32,92%,Even the best-designed chair won't make up for bad posture. ...,Win (1 of 2)
114.,2012-06-17 04:21:35,120.13,97%,"Double, double, toil and trouble; fire burn, and cauldron bu...",Win (1 of 3)
113.,2012-06-17 04:20:38,125.33,98%,The beginner writes just twenty pieces. The professional wri...,No win (1 of 1)
112.,2012-06-17 01:15:29,112.75,98%,"There was me, that is Alex, and my three droogs, that is Pet...",Win (1 of 3)
111.,2012-06-17 01:15:00,112.33,95%,"The problem is, Willie, is that Charles and yourself are not...",No win (2 of 4)
110.,2012-06-17 01:14:33,114.70,98%,"Imagine considering ""if"" as a two-finger movement instead of...",Win (1 of 4)
109.,2012-06-17 01:13:46,113.48,98%,"But older than me now, more constant, more real, and the fur...",Win (1 of 4)
108.,2012-06-17 01:12:35,127.79,97%,And I will strike down upon thee with great vengeance and fu...,Win (1 of 3)
107.,2012-06-17 01:10:58,130.78,98%,Is it sweeter to exist only in the mind or to exist both in ...,Win (1 of 3)
106.,2012-06-17 00:37:04,121.87,97%,All that year the animals worked like slaves. But they were ...,Win (1 of 3)
105.,2012-06-17 00:34:50,139.52,99%,"But no matter how effective the lesson was, I never really u...",Win (1 of 4)
104.,2012-06-17 00:34:02,115.56,94%,We've arranged a global civilization in which most crucial e...,No win (2 of 3)
103.,2012-06-16 20:39:44,132.79,98%,Consider this: Is the pious being loved by the gods because ...,Win (1 of 3)
102.,2012-06-16 20:38:40,129.82,98%,"When I really worry about something, I don't just fool aroun...",Win (1 of 3)
101.,2012-06-16 20:37:22,120.99,99%,"However, let us leave aside the philosophical, social, and e...",No win (2 of 5)
100.,2012-06-16 20:35:12,112.76,98%,"When you are typing on a typewriter, your input appears dire...",Win (1 of 3)
99.,2012-06-16 18:29:52,125.95,98%,"My friend, I shall be pedagogic, and say you ought to start ...",No win (1 of 1)
98.,2012-06-16 18:27:25,134.60,97%,"There is no physical separation after the slicing, so that e...",Win (1 of 3)
97.,2012-06-16 18:26:37,125.08,98%,"I rejected those answers; instead, I chose something differe...",Win (1 of 2)
96.,2012-06-16 18:24:30,123.12,96%,Remember that humor is written backwards. That means you fir...,No win (2 of 4)
95.,2012-06-16 18:23:07,139.62,98%,The truth of the matter is that there are a lot of available...,No win (1 of 1)
94.,2012-06-16 18:22:31,131.62,100%,If there is one thing the history of evolution has taught us...,Win (1 of 3)
93.,2012-06-16 18:21:00,146.23,100%,There's a hole in the world like a great black pit. And the ...,Win (1 of 3)
92.,2012-06-16 18:19:28,118.94,99%,And then he calls me a jerk and says the last guy who though...,Win (1 of 4)
91.,2012-06-16 18:18:52,119.14,95%,The unknown future rolls toward us. I face it for the first ...,Win (1 of 2)
90.,2012-06-16 18:18:20,131.45,97%,But speculations on the structure of the universe also move ...,No win (1 of 1)
89.,2012-06-16 18:17:40,133.96,99%,Rhymes trap you into saying things you don't want to say. A ...,Win (1 of 3)
88.,2012-06-16 18:16:24,128.74,96%,"No matter how bad things are, you can always make things wor...",Win (1 of 3)
87.,2012-06-16 17:36:40,119.11,97%,So what's in this for you? Should you rush out in search of ...,Win (1 of 3)
86.,2012-06-16 17:34:22,130.13,95%,"It was a marvelous night, the sort of night one only experie...",Win (1 of 3)
85.,2012-06-16 17:33:36,123.74,98%,"You ask Raymond what he does for a living and he says, ""I br...",Win (1 of 3)
84.,2012-06-16 17:32:31,112.91,96%,"When you are typing on a typewriter, your input appears dire...",No win (3 of 3)
83.,2012-06-16 17:31:34,135.58,100%,"They say that right after God created man, he took a rib fro...",No win (3 of 3)
82.,2012-06-16 17:29:39,115.53,97%,Most popular song lyrics have two sections - a verse and a b...,Win (1 of 3)
81.,2012-06-16 17:28:30,124.25,97%,A giant inverted steel pyramid is perfectly balanced on its ...,No win (2 of 5)
80.,2012-06-16 17:27:49,124.96,97%,All time is all time. It does not change. It does not lend i...,No win (2 of 5)
79.,2012-06-16 17:26:53,129.81,97%,How many roads must a man walk down before you call him a ma...,No win (3 of 3)
78.,2012-06-16 17:25:02,128.09,100%,"The time I waited seemed endless, and I felt doubts and fear...",Win (1 of 4)
77.,2012-06-16 16:42:20,132.71,99%,I've flown seven million miles. And I've been waiting on peo...,Win (1 of 5)
76.,2012-06-16 16:40:49,131.83,99%,These contests provided ample opportunity to demonstrate the...,Win (1 of 3)
75.,2012-06-16 16:40:09,127.30,98%,But if in efficient causes it is possible to go on to infini...,Win (1 of 5)
74.,2012-06-16 16:38:51,155.27,100%,"In the casino, the cardinal rule is to keep them playing and...",Win (1 of 5)
73.,2012-06-16 16:38:19,110.11,94%,To an outsider's ear it sounds absurdly wild and ridiculous ...,No win (2 of 3)
72.,2012-06-16 16:36:21,135.39,98%,I'd just like to point out that you were given every opportu...,Win (1 of 2)
71.,2012-06-16 16:35:33,122.49,97%,"Kid, I've flown from one side of this galaxy to the other, a...",Win (1 of 3)
70.,2012-06-16 16:34:27,142.63,100%,"When you are typing on a typewriter, your input appears dire...",Win (1 of 3)
69.,2012-06-16 16:32:48,121.10,95%,These contests provided ample opportunity to demonstrate the...,Win (1 of 4)
68.,2012-06-16 06:09:41,121.07,99%,"The time I waited seemed endless, and I felt doubts and fear...",Win (1 of 3)
67.,2012-06-16 06:08:38,133.94,99%,"People get ready, there's a train coming. You don't need no ...",Win (1 of 3)
66.,2012-06-16 06:07:36,133.00,98%,"When we pulled out into the winter night and the real snow, ...",Win (1 of 3)
65.,2012-06-16 06:05:50,119.61,96%,A giant inverted steel pyramid is perfectly balanced on its ...,No win (2 of 3)
64.,2012-06-16 06:04:16,145.04,100%,One thing I've learned in the last seven years: in every gam...,Win (1 of 3)
63.,2012-06-16 06:02:59,125.83,100%,It is by will alone I set my mind in motion. It is by the ju...,Win (1 of 4)
62.,2012-06-16 06:02:26,120.79,95%,Your inner child will be happy to know that when it comes to...,Win (1 of 2)
61.,2012-06-16 06:01:43,111.83,96%,"Imagine this: Here we are, a plane full of grown human being...",Win (1 of 2)
60.,2012-06-16 06:00:52,124.79,98%,"Ever since I was a child, folks have thought they had me peg...",No win (3 of 3)
59.,2012-06-16 05:58:19,136.37,99%,"When I really worry about something, I don't just fool aroun...",Win (1 of 2)
58.,2012-06-16 04:47:57,109.62,93%,Be impeccable with your word - speak with integrity. Say onl...,No win (3 of 4)
57.,2012-06-16 03:42:11,111.33,95%,The theory of music emphasizes the elements from which music...,No win (2 of 3)
56.,2012-06-16 03:41:14,117.42,95%,"As if that blind rage had washed me clean, rid me of hope; f...",Win (1 of 3)
55.,2012-06-16 03:35:19,137.88,100%,"But older than me now, more constant, more real, and the fur...",Win (1 of 3)
54.,2012-06-16 03:34:36,140.72,99%,For it is not enough to have a good mind; the main thing is ...,Win (1 of 3)
53.,2012-06-16 03:32:54,117.08,92%,Remember that humor is written backwards. That means you fir...,No win (3 of 3)
52.,2012-06-16 03:31:21,123.00,98%,"Historically, most wines contained less than 14 percent alco...",Win (1 of 2)
51.,2012-06-16 02:37:25,140.08,100%,Always do your best - your best is going to change from mome...,Win (1 of 3)
50.,2012-06-16 02:35:25,125.08,98%,He canceled all his commitments and pulled together the most...,No win (2 of 3)
49.,2012-06-16 02:33:50,129.75,98%,"After removal from the oven, the pizza is sliced and plated ...",Win (1 of 3)
48.,2012-06-16 02:32:12,119.01,94%,Let me tell you why you're here. You're here because you kno...,No win (2 of 2)
47.,2012-06-16 02:27:17,122.59,96%,"In general, many of these targets are easier marks if you ar...",No win (2 of 3)
46.,2012-06-16 02:25:16,130.85,97%,"As if that blind rage had washed me clean, rid me of hope; f...",No win (2 of 2)
45.,2012-06-16 02:23:46,131.83,100%,The theory of music emphasizes the elements from which music...,Win (1 of 5)
44.,2012-06-16 02:23:07,109.40,96%,"Wilkinson County was a recipient of one of the new ""separate...",No win (2 of 2)
43.,2012-06-16 01:44:41,128.80,98%,"Right, I am going to tell you how this works. You're going i...",Win (1 of 3)
42.,2012-06-16 01:43:43,122.87,92%,You've got a way to keep me on your side. You give me cause ...,No win (3 of 3)
41.,2012-06-16 01:43:06,135.09,97%,"Comfortable, Mullet? It seems sadly ironic that it's that ti...",Win (1 of 4)
40.,2012-06-16 01:28:21,136.17,100%,Lucid but wholly false recollections can easily be induced b...,Win (1 of 3)
39.,2012-06-16 00:23:19,116.49,97%,Mac knew the score even if Aunt Ella didn't. Shot through th...,No win (2 of 4)
38.,2012-06-16 00:22:16,112.66,96%,"I often see racers, particularly at the back of the pack in ...",Win (1 of 3)
37.,2012-06-15 23:32:36,136.30,99%,"Because they're at the bottom of the scale, nerds are a safe...",Win (1 of 2)
36.,2012-06-15 23:31:56,122.19,97%,"Now that I know that I'm breaking to pieces, I'll pull out m...",Win (1 of 3)
35.,2012-06-15 23:31:02,119.98,98%,"I'd been walking for hours and, as usual, I'd lost track of ...",Win (1 of 2)
34.,2012-06-15 23:28:44,130.70,99%,I suddenly had the impression that I had been left all alone...,Win (1 of 4)
33.,2012-06-15 23:21:19,114.99,97%,"This planet has, or rather had, a problem, which was this: m...",No win (3 of 4)
32.,2012-06-15 23:09:37,113.08,95%,"Do you smell that? Napalm, son. Nothing else in the world sm...",Win (1 of 2)
31.,2012-06-15 23:07:40,124.79,97%,"Often, we assume that a familiar situation will be but a rep...",Win (1 of 3)
30.,2012-06-15 23:07:00,126.94,98%,Step out the front door like a ghost into the fog where no o...,Win (1 of 2)
29.,2012-06-15 23:06:16,126.74,97%,I've been thinking lots about my life and how quick I'd wash...,Win (1 of 2)
28.,2012-06-15 23:02:38,120.79,96%,"What about Tony? You know, Bullet Tooth Tony. He'll find you...",Win (1 of 3)
27.,2012-06-15 23:01:57,123.28,97%,I never said I would stay to the end - I knew I would leave ...,Win (1 of 2)
26.,2012-06-15 23:00:07,114.50,98%,"Picking up the pieces, half alive in a nine 'til five, vacan...",Win (1 of 3)
25.,2012-06-15 22:58:20,142.63,98%,"The terminator wouldn't stop, it would never leave him. It w...",Win (1 of 3)
24.,2012-06-15 22:57:02,133.03,99%,"My darling, you have to be standing up in order to be able t...",Win (1 of 3)
23.,2012-06-15 22:56:03,157.50,100%,"But no matter how effective the lesson was, I never really u...",Win (1 of 2)
22.,2012-06-15 22:54:12,119.94,97%,"The result has been the emergence of what some call the ""win...",Win (1 of 3)
21.,2012-06-15 22:51:55,115.23,93%,The most precious treasures we have in life are the images w...,Win (1 of 3)
20.,2012-06-15 22:51:23,117.18,97%,Supermarket aisles are the perfect place to practice your gl...,Win (1 of 3)
19.,2012-06-15 21:43:08,122.10,98%,"The world of typing has changed. In the 1970s, every busines...",Win (1 of 2)
18.,2012-06-15 20:48:10,111.89,96%,"They knew they were privileged to have these choices, but th...",Win (1 of 3)
17.,2012-06-15 20:47:19,116.31,96%,"Comfortable, Mullet? It seems sadly ironic that it's that ti...",No win (2 of 3)
16.,2012-06-15 20:46:47,117.74,98%,Don't make assumptions - find the courage to ask questions a...,No win (3 of 3)
15.,2012-06-15 20:44:47,120.30,95%,There is something about yourself that you don't know. Somet...,No win (3 of 3)
14.,2012-06-15 20:28:00,111.71,98%,The great edifice of variety and choice that is an American ...,Win (1 of 2)
13.,2012-06-15 20:27:09,122.59,97%,Lucid but wholly false recollections can easily be induced b...,No win (2 of 3)
12.,2012-06-15 20:25:49,121.63,95%,It was one of those days when it's a minute away from snowin...,Win (1 of 2)
11.,2012-06-15 20:24:57,119.66,98%,"I've heard there was a secret chord that David played, and i...",Win (1 of 2)
10.,2012-06-15 20:24:20,129.40,100%,If I'm curt with you it's because time is a factor. I think ...,Win (1 of 3)
9.,2012-06-15 20:23:45,115.97,97%,Mac knew the score even if Aunt Ella didn't. Shot through th...,Win (1 of 3)
8.,2012-06-15 20:22:56,136.98,99%,"My name is Turkish. Funny name for an Englishman, I know. My...",Win (1 of 3)
7.,2012-06-15 20:21:54,130.07,97%,"Combat for a naval aviator is fought in short, violent burst...",Win (1 of 3)
6.,2012-06-15 20:20:27,118.86,96%,To drive out of the Central Valley of California on a hot da...,Win (1 of 3)
5.,2012-06-15 20:18:45,145.99,100%,"As if that blind rage had washed me clean, rid me of hope; f...",Win (1 of 2)
4.,2012-06-15 20:15:11,114.53,94%,"Historically, most wines contained less than 14 percent alco...",Win (1 of 3)
3.,2012-06-15 20:13:01,147.50,100%,The place to improve the world is first in one's own heart a...,Win (1 of 3)
2.,2012-06-15 20:12:30,111.26,94%,"You needn't take it any further, sir. You've proved to me th...",No win (1 of 1)
1.,2012-06-15 20:08:16,123.96,99%,"At the very end of these food chains (which is to say, at th...",Win (1 of 3)
