51.,2012-10-03 12:32:15,97.83,98%,Chance and chance alone has a message for us. Everything tha...,No win (4 of 5)
50.,2012-10-03 12:31:20,102.48,100%,But speculations on the structure of the universe also move ...,No win (2 of 4)
49.,2012-10-03 12:30:36,96.70,96%,"I went to the woods because I wished to live deliberately, t...",No win (2 of 5)
48.,2012-10-03 11:03:52,92.20,96%,If I'm curt with you it's because time is a factor. I think ...,No win (2 of 4)
47.,2012-10-03 11:03:10,99.71,100%,If there is one thing the history of evolution has taught us...,Win (1 of 3)
46.,2012-10-03 11:02:00,88.65,97%,"However, let us leave aside the philosophical, social, and e...",Win (1 of 4)
45.,2012-10-03 11:00:54,88.42,98%,"""This man right here,"" McGuinness said, pointing at Kenna, ""...",No win (1 of 1)
44.,2012-10-03 09:34:26,94.50,97%,San Francisco in the middle sixties was a very special time ...,No win (2 of 2)
43.,2012-10-03 09:33:33,93.61,99%,The development of a living body of literature became indica...,Win (1 of 3)
42.,2012-10-03 09:32:13,92.21,99%,"Alfred Hitchcock once said, ""Drama is life with the dull bit...",Win (1 of 4)
41.,2012-10-03 09:31:08,94.02,98%,I am learning about twenty new Italian words a day. Where am...,Win (1 of 3)
40.,2012-10-03 09:30:18,89.75,99%,"Hi, and welcome to the future. San Dimas, California, 2688. ...",No win (2 of 5)
39.,2012-10-03 09:29:28,88.95,95%,"There is no physical separation after the slicing, so that e...",No win (3 of 4)
38.,2012-10-03 02:19:10,94.91,99%,"You found paradise in America. You had a good trade, made a ...",No win (2 of 4)
37.,2012-10-03 02:17:36,89.73,98%,"If you are given too many choices, if you are forced to cons...",No win (3 of 4)
36.,2012-10-02 14:43:21,97.64,97%,"The terminator wouldn't stop, it would never leave him. It w...",No win (3 of 5)
35.,2012-10-02 14:42:17,102.74,99%,"We turn away to face the cold, enduring chill, as the day be...",No win (3 of 3)
34.,2012-10-02 14:41:24,93.52,99%,We may climb into the thin and cold realm of pure geometry a...,No win (2 of 4)
33.,2012-10-02 14:40:42,92.46,99%,A few light taps upon the pane made him turn to the window. ...,No win (3 of 5)
32.,2012-10-02 14:37:44,92.20,96%,"Let me get this straight. You think that your client, one of...",Win (1 of 4)
31.,2012-10-02 14:36:44,105.60,100%,"In the casino, the cardinal rule is to keep them playing and...",No win (3 of 5)
30.,2012-10-02 14:36:05,90.43,98%,"Hi, and welcome to the future. San Dimas, California, 2688. ...",No win (2 of 5)
29.,2012-10-02 14:35:10,98.44,98%,"If you want to drive a race car well, whether to win an Indy...",Win (1 of 5)
28.,2012-10-02 14:33:25,90.43,98%,Lucid but wholly false recollections can easily be induced b...,No win (4 of 5)
27.,2012-10-02 03:04:31,91.91,99%,The Inca believed that if one did not give thanks and obedie...,Win (1 of 4)
26.,2012-10-02 03:03:45,89.30,96%,"The world of typing has changed. In the 1970s, every busines...",No win (2 of 3)
25.,2012-10-02 03:02:36,102.37,98%,The time has come for man to set himself a goal. The time ha...,No win (2 of 4)
24.,2012-10-02 03:01:22,110.52,100%,The example of painting can teach us not only how to manage ...,Win (1 of 4)
23.,2012-10-02 03:00:33,93.03,98%,The beginner writes just twenty pieces. The professional wri...,Win (1 of 4)
22.,2012-10-02 02:59:30,99.26,99%,"Has it been five years? Six? It seems like a lifetime, the k...",No win (2 of 2)
21.,2012-10-02 02:58:27,96.50,99%,It was hard to toss things I had once thought were valuable ...,Win (1 of 2)
20.,2012-10-02 02:57:14,94.93,98%,It was one of those days when it's a minute away from snowin...,No win (2 of 4)
19.,2012-10-02 02:48:11,82.21,97%,A total of twenty-five friends were headed from San Francisc...,Win (1 of 3)
18.,2012-10-02 02:46:48,90.54,96%,For it is not enough to have a good mind; the main thing is ...,No win (4 of 5)
17.,2012-10-02 02:45:48,99.42,100%,There are very few things I wish I could change about those ...,No win (3 of 5)
16.,2012-10-02 02:44:47,95.97,98%,"Some pilots like the excitement of our missions, knowing tha...",Win (1 of 5)
15.,2012-10-02 02:44:02,95.93,97%,"Some pilots like the excitement of our missions, knowing tha...",No win (2 of 4)
14.,2012-10-02 02:40:09,90.71,100%,Do you know what they call a Quarter-pounder with cheese in ...,No win (2 of 5)
13.,2012-10-02 02:39:29,94.85,97%,"Ticking away the moments that make up a dull day, you fritte...",No win (2 of 3)
12.,2012-10-02 02:38:29,87.92,97%,"The Orient was almost a European invention, and had been sin...",Win (1 of 2)
11.,2012-10-02 02:37:49,86.55,98%,"That's Tommy. He tells people he was named after a gun, but ...",No win (2 of 5)
10.,2012-10-02 02:37:15,95.81,98%,"Samatha is a state in which the mind is brought to rest, foc...",No win (3 of 4)
9.,2012-10-02 02:33:20,101.60,99%,"Many people limit themselves to leading boring, dull lives b...",No win (3 of 4)
8.,2012-10-02 02:32:28,104.46,100%,"I don't want tickets, I need you to find me a painting, a cl...",Win (1 of 4)
7.,2012-10-02 02:31:39,95.19,98%,"Your face has fallen sad now, for you know the time is nigh....",Win (1 of 4)
6.,2012-10-02 02:30:44,97.58,99%,Typing competitions provided another test of the Qwerty keyb...,No win (2 of 3)
5.,2012-10-02 02:28:08,96.49,98%,"But no matter how effective the lesson was, I never really u...",No win (2 of 4)
4.,2012-10-01 08:41:50,97.21,99%,"Ezekiel twenty-five, seventeen: The path of the righteous ma...",Win (1 of 4)
3.,2012-10-01 08:40:52,97.99,97%,"The terminator wouldn't stop, it would never leave him. It w...",No win (2 of 3)
2.,2012-10-01 08:35:22,86.81,94%,In order to become an elf I filled out ten pages' worth of f...,No win (4 of 4)
1.,2012-10-01 08:34:19,92.91,99%,I know that you weren't bored that day because there was a l...,Win (1 of 5)
