422.,2018-03-10 12:14:32,104.97,97%,"More than anyone I'd ever met, he seemed to participate in l...",No win (2 of 2)
421.,2018-03-10 12:13:00,92.66,98%,The truth of the matter is that there are a lot of available...,No win (2 of 2)
420.,2018-03-10 12:11:45,110.94,100%,"Finally, don't expect your cooking to taste exactly like res...",Win (1 of 2)
419.,2018-02-26 23:21:57,103.49,97%,I'm not the protagonist of a novel or anything... I'm a coll...,Win (1 of 2)
418.,2018-02-26 23:20:16,86.16,97%,But there is virtually no relationship between being an expe...,Win (1 of 2)
417.,2018-02-26 23:18:03,112.70,98%,You know what nobody's mentioned? Is that this is supposed t...,Win (1 of 3)
416.,2018-02-26 23:16:33,94.20,98%,Facts can be thought of as objective or subjective. Things a...,Win (1 of 2)
415.,2018-02-26 23:15:12,105.14,98%,Here's what I think happened: the old man heard the fight be...,Win (1 of 2)
414.,2018-02-26 23:13:18,105.25,98%,Much of my life had been devoted to trying not to cry in fro...,Win (1 of 2)
413.,2018-02-26 23:11:05,79.07,95%,"I remembered the line from the Hindu scripture, the Bhagavad...",Win (1 of 3)
412.,2018-02-26 23:09:23,104.61,99%,"By now, I assume you know your father's been accused of a ve...",Win (1 of 3)
411.,2018-02-26 23:08:08,109.79,98%,"I'll tell you a riddle. You're waiting for a train, a train ...",Win (1 of 3)
410.,2018-02-26 23:06:51,100.21,97%,The day is made up of 24 hours and an infinite number of mom...,Win (1 of 3)
409.,2018-02-26 23:05:51,99.67,97%,"Brother, I've seen all kinds of dishonesty in my day, but th...",Win (1 of 3)
408.,2018-02-26 23:04:30,96.63,98%,I went to a party at the local county jail; all the cons wer...,Win (1 of 3)
407.,2018-02-26 23:02:24,108.99,98%,Perhaps however the most satisfactory definition of a rock i...,Win (1 of 3)
406.,2018-02-26 23:01:12,95.93,98%,"Apart from the excruciating pain, this is great! I've been w...",Win (1 of 2)
405.,2018-02-26 23:00:12,111.08,98%,Maybe he is different but that doesn't mean that he's guilty...,Win (1 of 2)
404.,2018-02-26 22:58:50,102.87,98%,"You are the true master of death, because the true master do...",No win (3 of 3)
403.,2017-09-17 17:00:40,97.05,97%,"Here it is at last, the first 150-minute trailer. ""Armageddo...",Win (1 of 2)
402.,2017-09-17 16:59:09,90.76,98%,"Excellent. He's enterprising, aggressive, outgoing, young, b...",Win (1 of 3)
401.,2017-09-17 16:57:23,92.39,98%,'Cause I'm a 21st century digital boy. I don't know how to r...,Win (1 of 3)
400.,2017-09-17 16:55:38,119.99,100%,"Yes, it was her he was looking at, and there was meaning in ...",Win (1 of 3)
399.,2017-07-30 19:59:44,105.82,98%,"You know, you go to thrift shops and you go to garage sales ...",Win (1 of 3)
398.,2017-07-30 19:57:38,103.26,98%,We think it is time that you recognized that you are masters...,Win (1 of 3)
397.,2017-07-30 19:56:28,101.43,98%,Covert intelligence involves a lot of waiting around. Any me...,Win (1 of 3)
396.,2017-07-30 19:54:51,89.47,97%,"Opponents of a ""scientific"" approach to the social sciences ...",Win (1 of 3)
395.,2017-07-30 19:52:46,80.99,96%,"You don't get to choose if you get hurt in this world, but y...",No win (3 of 3)
394.,2017-07-30 19:51:44,112.02,99%,"Baby, what's it gonna hurt if they don't know, makin' everyb...",Win (1 of 3)
393.,2017-07-30 19:50:35,98.97,98%,They may have even had a brief discussion about recovering m...,Win (1 of 3)
392.,2017-07-30 19:49:13,99.65,98%,"Growing to hate decisive moments, the only thing within a br...",Win (1 of 3)
391.,2017-07-30 19:48:09,79.05,98%,"Ergonomics is a term that combines the Greek word ergon, mea...",Win (1 of 3)
390.,2017-07-30 19:46:41,99.80,98%,It would perhaps not be amiss to point out that he had alway...,Win (1 of 3)
389.,2017-02-18 21:22:03,98.86,96%,"It was Silver's voice, and before I had heard a dozen words,...",Win (1 of 2)
388.,2017-02-04 23:05:30,91.04,93%,Ever seen the size of one of their molars? They go through b...,Win (1 of 2)
387.,2017-02-04 23:03:43,100.68,97%,"Whether you're a student, secretary, office administrator, m...",Win (1 of 3)
386.,2017-02-04 23:02:09,97.02,91%,"The problem is, Willie, is that Charles and yourself are not...",Win (1 of 2)
385.,2017-02-04 23:01:02,113.95,98%,"There are perhaps twenty regular posters on the forum, and s...",Win (1 of 2)
384.,2017-02-04 22:59:39,92.42,93%,"My brother, your father, he and I. Opposites. But I never do...",Win (1 of 2)
383.,2017-02-04 22:58:30,109.80,97%,I called Betsy again at her office and she said maybe we'd g...,Win (1 of 2)
382.,2017-01-19 16:06:53,90.92,92%,"Open to everything happy and sad, seeing the good when it's ...",Win (1 of 2)
381.,2017-01-02 22:56:51,99.70,98%,"Finally, don't expect your cooking to taste exactly like res...",Win (1 of 2)
380.,2017-01-02 22:55:39,99.35,96%,At the time when Britain faced a plunge into chaos and darkn...,Win (1 of 2)
379.,2017-01-02 22:54:00,103.79,98%,"Yes, the newspapers were right: snow was general all over Ir...",Win (1 of 2)
378.,2017-01-02 22:50:42,108.59,96%,"My meaning simply is, that whatever I have tried to do in li...",Win (1 of 2)
377.,2017-01-02 22:49:21,92.80,94%,In 1969 four computers located around the country were in co...,Win (1 of 2)
376.,2017-01-02 22:47:46,118.39,98%,And isn't that a minor miracle? The state of the world today...,Win (1 of 2)
375.,2017-01-02 22:45:56,100.09,97%,"If you are one of earth's inhabitants, how blest your father...",Win (1 of 2)
374.,2017-01-02 22:44:33,110.04,96%,"Being in a minority, even in a minority of one, did not make...",Win (1 of 2)
373.,2017-01-02 22:43:19,114.09,99%,"I don't want tickets, I need you to find me a painting, a cl...",Win (1 of 2)
372.,2017-01-02 22:42:05,92.64,92%,Popularity is only partially about individual attractiveness...,Win (1 of 2)
371.,2017-01-02 22:40:38,95.68,96%,"Finally, gentlemen, there are people with an hereditary anim...",Win (1 of 2)
370.,2016-10-08 21:00:30,92.60,95%,There is a theory which states that if anybody ever discover...,Win (1 of 3)
369.,2016-10-08 20:59:34,110.62,99%,"They say, ""Find a purpose in your life and live it."" But, so...",Win (1 of 3)
368.,2016-10-08 20:58:46,98.36,97%,"The problem is, Willie, is that Charles and yourself are not...",Win (1 of 3)
367.,2016-10-08 20:57:06,88.19,93%,Solving the following riddle will reveal the awful secret be...,No win (2 of 3)
366.,2016-10-08 20:56:08,105.99,98%,How do I live without the ones I love? Time still turns the ...,Win (1 of 2)
365.,2016-10-08 20:54:23,65.22,90%,When is a legend a legend? Why is a myth a myth? How old and...,Win (1 of 3)
364.,2016-10-08 20:53:27,81.40,91%,"When she returns to the forum page, her post is there. It is...",No win (2 of 3)
363.,2016-10-08 20:52:21,86.15,93%,It is greatly to America's advantage that it is a congenial ...,Win (1 of 3)
362.,2016-10-08 20:51:09,117.79,99%,"If you don't get what you want, you suffer; if you get what ...",Win (1 of 3)
361.,2016-10-08 20:50:14,93.35,94%,I thought maybe I'd run to the end of town. And when I got t...,Win (1 of 3)
360.,2016-10-08 20:49:17,101.71,98%,"The milk and cheese and yogurt, which once came from dairy c...",Win (1 of 2)
359.,2016-10-08 20:48:24,87.66,94%,The quick brown fox jumps over the lazy dog.,No win (2 of 3)
358.,2016-10-08 20:47:46,89.04,95%,"In the early history of topology, results were primarily mot...",No win (2 of 3)
357.,2016-10-08 20:46:58,93.33,96%,God help the man who ever really loves you. You'd break his ...,Win (1 of 3)
356.,2016-10-08 20:45:52,94.36,95%,"I don't want to sell anything, buy anything, or process anyt...",Win (1 of 4)
355.,2016-10-08 20:44:46,74.84,90%,When beetles fight these battles in a bottle with their padd...,No win (3 of 4)
354.,2016-10-08 20:43:47,103.43,97%,"Look, you should admit to yourself that Microsoft will miss ...",Win (1 of 4)
353.,2016-10-08 20:42:49,74.79,87%,"Look at the stars. Same stars as last week, last year, when ...",No win (3 of 3)
352.,2016-10-08 20:41:49,101.81,100%,"Around midafternoon, the snow thinned into sleet, and some u...",Win (1 of 3)
351.,2016-10-08 20:40:55,70.50,92%,The pickpockets' profession demands extraordinary nimbleness...,Win (1 of 3)
350.,2016-10-08 20:39:54,86.23,94%,"Keying text quickly is important, but it is more important t...",Win (1 of 4)
349.,2016-10-08 20:36:04,84.69,92%,"Alfred Hitchcock once said, ""Drama is life with the dull bit...",Win (1 of 4)
348.,2016-10-08 20:34:58,89.52,97%,"""Before I died,"" Anorak says, speaking in a much deeper voic...",Win (1 of 4)
347.,2016-10-08 20:33:51,119.74,99%,"After you got six pieces, you gotta get rid of 'em. Of cours...",Win (1 of 4)
346.,2016-10-08 20:33:06,111.97,99%,Many introverted hackers who are next to inarticulate in per...,Win (1 of 4)
345.,2016-10-08 20:32:26,82.07,92%,Parisian French is different from Provincial French and Germ...,Win (1 of 4)
344.,2016-10-08 20:31:22,88.96,94%,"Run to the bedroom, in the suitcase on the left, you'll find...",Win (1 of 3)
343.,2016-10-08 20:29:52,86.49,96%,Typing competitions provided another test of the Qwerty keyb...,Win (1 of 3)
342.,2016-10-08 20:28:46,88.67,93%,"There are perhaps twenty regular posters on the forum, and s...",No win (2 of 3)
341.,2016-10-08 20:26:47,103.27,95%,"We can experience nothing but the present moment, live in no...",Win (1 of 3)
340.,2016-10-08 20:25:58,95.89,95%,It's about realizing that there are no problems. Only situat...,No win (2 of 3)
339.,2016-10-08 20:24:58,104.68,97%,"Now, sir, we'll talk if you like. I'll tell you right out, I...",Win (1 of 3)
338.,2016-10-08 20:24:10,91.85,96%,Sholes split up the most common pairings of letters in the E...,Win (1 of 2)
337.,2016-10-08 20:23:01,83.31,96%,"A zealot might be, for instance, an individual with a person...",Win (1 of 3)
336.,2016-10-08 20:21:46,86.24,95%,"Whether they use the title or not, many lyrics have evocativ...",No win (2 of 3)
335.,2016-10-08 20:19:36,101.64,98%,Suppose you suggest to your husband that subsidized llama fa...,Win (1 of 3)
334.,2016-10-08 20:18:32,95.09,94%,"You don't know what's in store, but you know what you're her...",Win (1 of 3)
333.,2016-10-08 20:17:40,76.30,90%,A chorus is the high-point of a lyric's energy as well as th...,No win (2 of 3)
332.,2016-10-08 20:16:49,117.23,100%,This country is hard on people. Hard and crazy. Got the devi...,Win (1 of 3)
331.,2016-10-08 20:15:56,106.25,98%,"When we pulled out into the winter night and the real snow, ...",Win (1 of 2)
330.,2016-10-08 20:15:00,78.36,89%,"An idea is like a virus, resilient, highly contagious. The s...",No win (3 of 3)
329.,2016-10-08 20:14:07,70.38,90%,"Webster defines intelligence as, ""the ability to apprehend i...",Win (1 of 2)
328.,2016-10-08 20:12:35,114.18,99%,Is it really necessary to send that email? The more emails y...,Win (1 of 2)
327.,2016-10-08 20:11:36,63.71,99%,"So don't be afraid; your heart is in me, and it's racing so ...",No win (2 of 2)
326.,2016-10-08 20:10:36,103.38,95%,"In general, many of these targets are easier marks if you ar...",Win (1 of 2)
325.,2016-10-08 20:09:38,109.82,97%,"Look, you should admit to yourself that Microsoft will miss ...",Win (1 of 3)
324.,2016-10-08 20:08:28,84.31,93%,"You cannot entice a true thief, and thief by vocation, into ...",Win (1 of 3)
323.,2016-10-08 20:06:39,102.60,95%,It's about realizing that there are no problems. Only situat...,No win (2 of 2)
322.,2016-10-08 20:05:41,123.71,100%,While there are few problems in today's world that the Unite...,Win (1 of 2)
321.,2016-10-08 20:04:56,81.12,90%,"The milk and cheese and yogurt, which once came from dairy c...",No win (2 of 2)
320.,2016-10-08 20:03:50,98.59,94%,It doesn't mean much to be able to filter out most present-d...,Win (1 of 2)
319.,2016-10-08 20:02:38,99.81,97%,"Because they're at the bottom of the scale, nerds are a safe...",Win (1 of 2)
318.,2016-10-08 20:01:35,94.68,95%,"As civilizations grew, humans spread out across the face of ...",Win (1 of 2)
317.,2016-10-08 20:00:13,104.81,98%,What? A swallow carrying a coconut? It's not a question of w...,Win (1 of 2)
316.,2016-10-08 19:58:46,102.02,96%,"I'm a hopeless dancer, but this looks like you just screw in...",Win (1 of 2)
315.,2016-10-08 19:57:42,98.58,97%,"Yeah, you just take Soupy-Sales to prom 'cause I can think o...",Win (1 of 2)
314.,2016-10-08 19:56:22,97.65,96%,"As a child, I was aware that, at night, infrared vision woul...",Win (1 of 2)
313.,2016-10-08 19:53:00,96.73,93%,If I'm curt with you it's because time is a factor. I think ...,Win (1 of 2)
312.,2016-10-08 19:51:35,109.46,96%,You're going in the drink and I am going to make a cup of te...,Win (1 of 2)
311.,2016-10-08 19:46:29,95.64,99%,Everybody knows that your average bedroom monster is reptili...,Win (1 of 3)
310.,2016-10-08 19:45:02,103.44,97%,Popularity is only partially about individual attractiveness...,No win (2 of 2)
309.,2016-10-08 19:43:19,82.77,98%,"Finally, don't expect your cooking to taste exactly like res...",Win (1 of 2)
308.,2016-10-08 19:42:03,83.74,94%,Jay made up for the lack of glamour in his assignment by hav...,No win (2 of 2)
307.,2016-10-08 19:36:29,92.50,93%,All we need for morality is contained in these words: make o...,Win (1 of 2)
306.,2016-10-08 19:33:31,112.78,100%,At first they had tried to keep the finding quiet. After all...,Win (1 of 2)
305.,2016-10-08 19:30:54,96.33,97%,"Me? I'm dishonest, and a dishonest man you can always trust ...",Win (1 of 2)
304.,2016-10-08 19:29:12,104.34,96%,Stab a sorry heart with your favorite finger. Paint the whol...,Win (1 of 2)
303.,2016-10-08 19:27:59,86.67,97%,With the coming of Dean Moriarty began the part of my life y...,Win (1 of 2)
302.,2016-10-08 19:27:00,93.16,98%,So I'm two inches away from her. Her luscious lips part. Jus...,Win (1 of 3)
301.,2016-10-08 19:25:56,91.78,95%,"But, pray how could that which I spoke so many years ago, an...",No win (2 of 3)
300.,2016-10-08 19:23:34,86.55,93%,"His long black hair crackled, and crazy energies flashed out...",Win (1 of 3)
299.,2016-10-08 19:22:17,110.62,96%,The girls I like best are ones I never feel much like kiddin...,Win (1 of 3)
298.,2016-10-08 18:07:49,91.06,94%,Come sail your ships around me and burn your bridges down. W...,Win (1 of 2)
297.,2016-10-08 18:06:24,99.33,95%,"After you got six pieces, you gotta get rid of 'em. Of cours...",Win (1 of 2)
296.,2016-10-08 18:04:52,111.54,98%,"This is what we call love. When you are loved, you can do an...",Win (1 of 3)
295.,2016-10-08 18:03:42,95.83,94%,"Well, it just so happens, this hacienda comes with its very ...",Win (1 of 3)
294.,2016-10-08 18:01:33,92.66,93%,When we got to the Mint I parked on the street in front of t...,Win (1 of 4)
293.,2016-10-08 17:58:12,110.58,97%,I just want to tell you how I'm feeling. Gotta make you unde...,Win (1 of 4)
292.,2016-10-08 17:55:32,97.27,95%,It's the possibility of having a dream come true that makes ...,Win (1 of 4)
291.,2016-10-08 17:52:51,102.89,95%,"The sooner your kids appreciate the value of work, the more ...",Win (1 of 4)
290.,2016-10-08 17:51:31,89.08,93%,"You there, my friend. Come, let me hold you. Now, with a sig...",Win (1 of 4)
289.,2016-10-08 17:49:36,122.88,99%,"You have a class of young strong men and women, and they wan...",Win (1 of 4)
288.,2016-10-08 17:48:00,99.43,97%,Now the scandal and the light are to be distributed differen...,Win (1 of 5)
287.,2016-10-08 17:43:30,91.25,91%,"Then she lit up a candle, and she showed me the way. There w...",Win (1 of 3)
286.,2016-09-17 21:43:11,101.36,95%,"After you got six pieces, you gotta get rid of 'em. Of cours...",Win (1 of 2)
285.,2016-09-17 21:42:01,104.87,94%,That's the way romance is. Usually that's the way that it go...,Win (1 of 4)
284.,2016-09-17 21:41:03,91.85,97%,"Bullet Tooth Tony: ""I gotta see a man who looks like he migh...",No win (2 of 3)
283.,2016-09-17 21:39:50,106.83,97%,Since every piece of matter in the Universe is in some way a...,Win (1 of 2)
282.,2016-09-17 21:38:26,101.17,94%,Your problem is you spent your whole life thinking there are...,Win (1 of 3)
281.,2016-09-17 21:37:15,99.05,94%,"I don't believe in an interventionist God, but I know, darli...",Win (1 of 2)
280.,2016-09-17 21:36:01,91.74,95%,Everybody knows that your average bedroom monster is reptili...,Win (1 of 3)
279.,2016-09-17 21:34:14,119.73,97%,You're here because you know something. What you know you ca...,Win (1 of 2)
278.,2016-09-17 21:32:51,119.20,97%,"But it is important to know this, to know your roots. To kno...",Win (1 of 3)
277.,2016-08-02 17:55:26,105.17,97%,"Everyone said I was daft to build a castle on a swamp, but I...",Win (1 of 2)
276.,2016-08-02 17:42:15,101.46,94%,The ultimate way to compose is to be able to keyboard as fas...,Win (1 of 2)
275.,2016-08-02 17:38:55,100.13,94%,It was hard to toss things I had once thought were valuable ...,Win (1 of 2)
274.,2016-08-02 17:37:30,112.22,98%,I used to dread getting older because I thought I would not ...,Win (1 of 2)
273.,2016-08-02 17:35:14,108.68,97%,"I'm so glad you came, I'm so glad you remembered, to see how...",Win (1 of 3)
272.,2016-08-02 17:33:09,97.50,95%,"Because they're at the bottom of the scale, nerds are a safe...",Win (1 of 3)
271.,2016-08-02 17:30:53,92.06,96%,"Bullet Tooth Tony: ""I gotta see a man who looks like he migh...",Win (1 of 2)
270.,2016-07-29 21:21:19,102.35,98%,"Your primary objective should be to touch-type; that is, to ...",Win (1 of 2)
269.,2016-07-29 20:52:48,99.45,94%,"It's a blue savanna song: somewhere cross the desert, someti...",Win (1 of 3)
268.,2016-07-29 20:51:38,95.28,96%,I had a friend who was a heavy drinker. If somebody asked hi...,Win (1 of 3)
267.,2016-07-29 20:50:19,117.65,100%,"If one day I could get out of here, I would allow myself to ...",Win (1 of 3)
266.,2016-07-29 20:46:50,126.54,100%,Remembering you standing quiet in the rain as I ran to your ...,Win (1 of 3)
265.,2016-07-29 20:45:33,90.09,97%,"It may seem quite novelistic to you, and I am willing to agr...",Win (1 of 3)
264.,2016-07-29 20:40:42,101.62,95%,"You could substitute raspberries or any other fruit, but 99....",Win (1 of 3)
263.,2016-07-29 20:39:46,98.28,97%,What? A swallow carrying a coconut? It's not a question of w...,Win (1 of 2)
262.,2016-07-29 20:36:50,99.69,96%,There was a stage and a PA up in western Massachusetts and t...,Win (1 of 2)
261.,2016-07-29 20:35:20,110.46,97%,"What about Tony? You know, Bullet Tooth Tony. He'll find you...",Win (1 of 2)
260.,2016-07-29 20:34:15,104.27,97%,So I'm two inches away from her. Her luscious lips part. Jus...,Win (1 of 2)
259.,2016-07-29 20:31:14,97.53,94%,We were all in our late twenties or early-to-middle thirties...,Win (1 of 3)
258.,2016-07-29 20:29:55,99.49,96%,"If you are given too many choices, if you are forced to cons...",Win (1 of 3)
257.,2016-07-29 20:28:29,120.09,99%,In the beginning there was only a small amount of injustice ...,Win (1 of 3)
256.,2016-07-29 20:24:16,103.19,97%,Remembering you standing quiet in the rain as I ran to your ...,No win (1 of 1)
255.,2016-07-29 19:29:51,103.09,95%,"Do you smell that? Napalm, son. Nothing else in the world sm...",Win (1 of 2)
254.,2016-07-29 19:28:28,112.47,96%,Remembering you standing quiet in the rain as I ran to your ...,Win (1 of 2)
253.,2016-07-29 19:26:50,106.64,95%,"Ticking away the moments that make up a dull day, you fritte...",Win (1 of 2)
252.,2016-07-25 22:43:47,96.89,96%,"If you begin to repeat an error, or if your concentration or...",Win (1 of 2)
251.,2016-07-25 22:36:49,99.22,95%,We don't need no education. We don't need no thought control...,No win (2 of 2)
250.,2016-07-25 22:34:57,122.61,100%,"So I was sitting in my cubicle today, and I realized, ever s...",Win (1 of 3)
249.,2016-07-25 22:33:53,92.50,93%,"Listen up, maggots. You are not special. You are not a beaut...",Win (1 of 3)
248.,2016-07-25 22:32:31,102.07,97%,"Warmer water increases the moisture content of storms, and w...",Win (1 of 2)
247.,2016-07-25 22:29:55,116.88,100%,"After you got six pieces, you gotta get rid of 'em. Of cours...",Win (1 of 3)
246.,2016-07-25 22:29:09,92.52,92%,"What about Tony? You know, Bullet Tooth Tony. He'll find you...",Win (1 of 2)
245.,2016-07-25 22:06:34,105.45,94%,"Look, you should admit to yourself that Microsoft will miss ...",Win (1 of 2)
244.,2016-07-25 22:05:00,101.14,98%,The great edifice of variety and choice that is an American ...,Win (1 of 2)
243.,2016-07-25 22:03:27,109.43,96%,"You could substitute raspberries or any other fruit, but 99....",Win (1 of 2)
242.,2016-07-25 22:02:00,105.91,95%,If you spend too much time trying to find out what is good o...,Win (1 of 2)
241.,2016-07-25 22:00:28,112.60,98%,A glooming peace this morning with it brings. The sun for so...,Win (1 of 2)
240.,2016-07-25 21:58:40,108.83,97%,The chemistry of an element is determined by the manner in w...,Win (1 of 2)
239.,2016-07-25 21:57:15,104.88,95%,"When I was your age, television was called books. And this i...",Win (1 of 2)
238.,2016-07-25 21:55:56,108.73,98%,"A sensitive and honest-minded man, if he's concerned about e...",Win (1 of 2)
237.,2016-07-25 21:52:03,103.67,95%,Make sure to secure the door when I am gone. There are many ...,No win (2 of 3)
236.,2016-07-25 21:50:33,102.39,94%,A freedom fighter learns the hard way that it is the oppress...,Win (1 of 3)
235.,2016-07-25 21:47:29,111.08,98%,"My darling, you have to be standing up in order to be able t...",Win (1 of 3)
234.,2016-07-25 21:46:32,126.82,99%,There is something about yourself that you don't know. Somet...,Win (1 of 2)
233.,2016-07-25 21:44:46,102.59,98%,"Bullet Tooth Tony: ""I gotta see a man who looks like he migh...",Win (1 of 2)
232.,2016-07-23 18:53:12,113.52,98%,The major difference between a thing that might go wrong and...,Win (1 of 3)
231.,2016-07-23 18:48:48,124.25,100%,Come sail your ships around me and burn your bridges down. W...,Win (1 of 3)
230.,2016-07-23 18:47:31,109.88,98%,"She's got a smile that, it seems to me, reminds me of childh...",Win (1 of 3)
229.,2016-07-23 18:43:57,101.01,96%,The chemistry of an element is determined by the manner in w...,Win (1 of 3)
228.,2016-07-23 18:42:20,96.64,97%,"Listen up, maggots. You are not special. You are not a beaut...",Win (1 of 3)
227.,2016-07-23 18:41:11,100.97,95%,If there is one thing the history of evolution has taught us...,Win (1 of 2)
226.,2016-07-23 18:39:54,114.09,99%,It's about realizing that there are no problems. Only situat...,Win (1 of 3)
225.,2016-07-23 18:39:05,112.09,98%,"They say, ""Find a purpose in your life and live it."" But, so...",Win (1 of 2)
224.,2016-07-23 18:38:09,107.18,98%,I thought climbing the Devil's Thumb would fix all that was ...,Win (1 of 3)
223.,2016-07-23 18:37:08,117.17,99%,One thing I've learned in the last seven years: in every gam...,Win (1 of 3)
222.,2016-07-23 18:36:14,96.99,94%,Writing is hard work. A clear sentence is no accident. Very ...,Win (1 of 3)
221.,2016-07-23 18:29:46,117.71,98%,"Everyone said I was daft to build a castle on a swamp, but I...",Win (1 of 3)
220.,2016-07-23 18:28:08,101.78,94%,We've known each other for many years but this is the first ...,Win (1 of 3)
219.,2016-07-23 18:26:55,106.85,98%,We all know people who are very bright but who do not always...,Win (1 of 2)
218.,2016-07-23 18:25:14,110.33,97%,Now did you answer cause you thought that's what I wanted to...,Win (1 of 3)
217.,2016-07-23 18:20:14,103.34,94%,Come sail your ships around me and burn your bridges down. W...,Win (1 of 2)
216.,2016-07-22 20:43:53,110.05,97%,The alternative to binge travel - the mini retirement - enta...,Win (1 of 2)
215.,2016-07-22 20:40:52,123.11,100%,Humans need to practice what they are learning a good deal b...,Win (1 of 2)
214.,2016-07-22 20:31:41,110.51,98%,I am learning about twenty new Italian words a day. Where am...,Win (1 of 2)
213.,2016-07-22 20:27:59,110.77,97%,Music finds a comfortable parallel with that of human langua...,Win (1 of 2)
212.,2016-07-22 20:26:16,108.67,97%,We've known each other for many years but this is the first ...,Win (1 of 2)
211.,2016-07-22 20:24:00,104.43,99%,Music finds a comfortable parallel with that of human langua...,Win (1 of 2)
210.,2016-07-22 20:21:06,122.45,99%,I must not fear. Fear is the mind killer. Fear is the little...,Win (1 of 2)
209.,2016-07-22 20:18:50,105.47,99%,"It's all there, black and white, clear as crystal! You stole...",Win (1 of 2)
208.,2016-07-22 20:08:16,111.57,98%,"The Earth is a world, the world is a ball, a ball in a game ...",Win (1 of 2)
207.,2016-07-22 20:07:28,98.04,94%,"And I said, I don't care if they lay me off either, because ...",Win (1 of 2)
206.,2016-07-22 20:06:25,108.52,98%,"He said that if culture is a house, then language was the ke...",Win (1 of 2)
205.,2016-07-22 20:03:58,99.44,95%,This business is filled to the brim with unrealistic people ...,Win (1 of 3)
204.,2016-07-22 20:02:19,131.98,98%,You're here because you know something. What you know you ca...,Win (1 of 3)
203.,2016-07-22 20:00:50,110.66,97%,We live in an age when people do more writing than they have...,Win (1 of 3)
202.,2016-07-22 19:59:38,100.19,98%,In 1969 four computers located around the country were in co...,Win (1 of 2)
201.,2016-07-22 19:58:10,116.11,97%,And in the dream I knew that he was goin' on ahead and that ...,Win (1 of 2)
200.,2016-07-22 19:55:34,106.11,96%,"Time is tricky. You have whole months, even years, when noth...",Win (1 of 3)
199.,2016-07-12 18:21:38,100.89,98%,"There was me, that is Alex, and my three droogs, that is Pet...",Win (1 of 2)
198.,2016-07-12 18:17:22,119.24,99%,"But it is important to know this, to know your roots. To kno...",Win (1 of 2)
197.,2016-07-12 18:16:17,118.42,99%,"Jamie saved my life. She taught me everything. About life, h...",Win (1 of 3)
196.,2016-07-12 18:14:07,107.27,97%,Your inner child will be happy to know that when it comes to...,Win (1 of 3)
195.,2016-07-12 18:12:51,104.05,94%,As much money and life as you could want! The two things mos...,Win (1 of 3)
