194.,2016-07-12 18:11:34,95.82,91%,"Whenever you watch the mind, you withdraw consciousness from...",Win (1 of 2)
193.,2016-07-12 18:10:27,105.43,96%,Language is one of the keys to being human. It allows us to ...,Win (1 of 3)
192.,2016-07-12 18:08:03,112.52,98%,So it's all come back round to breaking apart again. Breakin...,Win (1 of 3)
191.,2016-07-12 18:05:53,100.73,96%,God help the man who ever really loves you. You'd break his ...,Win (1 of 3)
190.,2016-07-12 18:03:13,92.51,93%,What should have been swift revenge turned into an all out w...,Win (1 of 3)
189.,2016-07-12 18:01:01,101.88,95%,"Contrary to the feminist cant, there are many things we can ...",Win (1 of 3)
188.,2016-07-12 17:59:52,106.25,97%,"Good games stay within, but at the outer edge, of the player...",Win (1 of 3)
187.,2016-07-12 17:58:22,106.81,97%,Well this seems to be a waste of my time. That is nine hundr...,Win (1 of 4)
186.,2016-07-12 17:56:59,129.23,99%,How many times have you seen the leader of a race have a mec...,Win (1 of 3)
185.,2016-07-12 17:54:33,115.89,99%,We were playing checkers. I used to kid her once in a while ...,Win (1 of 3)
184.,2016-07-12 17:52:55,106.30,97%,"Every time you practice a technique incorrectly, you're incr...",Win (1 of 3)
183.,2016-07-12 17:50:39,121.73,100%,One essential rule: make sure the joke is the last possible ...,Win (1 of 3)
182.,2016-07-12 17:49:43,99.81,95%,Although his voice was also broken by uncertainty and his ha...,Win (1 of 2)
181.,2016-07-12 17:48:40,98.52,96%,"If you are given too many choices, if you are forced to cons...",Win (1 of 3)
180.,2016-07-12 17:47:11,106.20,94%,"We speak of something carried and something carrying, of som...",Win (1 of 2)
179.,2016-07-12 17:22:32,104.25,98%,"A little boy went out to play. When he opened his door, he s...",Win (1 of 4)
178.,2016-07-12 17:21:27,106.32,97%,"I'm so glad you came, I'm so glad you remembered, to see how...",Win (1 of 3)
177.,2016-07-12 17:19:53,116.82,99%,"There is no pain, you are receding. A distant ship smoke on ...",Win (1 of 5)
176.,2016-07-12 17:18:20,105.18,97%,He managed to open the cupboard door with his nose and found...,Win (1 of 4)
175.,2016-07-12 17:15:12,103.67,95%,There are very few things I wish I could change about those ...,Win (1 of 5)
174.,2016-07-12 17:13:48,110.15,99%,It's about realizing that there are no problems. Only situat...,Win (1 of 5)
173.,2016-07-12 17:01:16,103.75,97%,Few smart kids can spare the attention that popularity requi...,Win (1 of 3)
172.,2016-07-12 16:59:45,107.75,97%,Humans need to practice what they are learning a good deal b...,Win (1 of 4)
171.,2016-07-12 16:58:19,102.19,96%,Space is big. Really big. You just won't believe how vastly ...,Win (1 of 4)
170.,2016-07-10 23:15:04,101.11,98%,And then he calls me a jerk and says the last guy who though...,Win (1 of 2)
169.,2016-07-10 23:13:46,110.93,96%,There is something about yourself that you don't know. Somet...,Win (1 of 2)
168.,2016-07-10 23:12:21,112.53,98%,Many rivers to cross but I can't seem to find my way over. W...,Win (1 of 2)
167.,2016-07-10 23:11:09,92.83,94%,"The only people for me are the mad ones, the ones who are ma...",Win (1 of 2)
166.,2016-07-10 23:09:40,95.14,96%,"""This man right here,"" McGuinness said, pointing at Kenna, ""...",Win (1 of 2)
165.,2016-07-10 23:06:49,97.67,97%,"Yes, the newspapers were right: snow was general all over Ir...",Win (1 of 2)
164.,2016-07-10 23:05:33,110.26,97%,"Samatha is a state in which the mind is brought to rest, foc...",Win (1 of 2)
163.,2016-07-10 23:04:09,106.06,100%,"Good games stay within, but at the outer edge, of the player...",Win (1 of 2)
162.,2016-07-10 23:02:49,106.63,96%,"However we choose to feed ourselves, we eat by the grace of ...",Win (1 of 2)
161.,2016-07-10 22:59:48,111.14,100%,The number one challenge I've seen with myself and with othe...,Win (1 of 3)
160.,2016-07-10 22:58:27,107.32,96%,"But no matter how effective the lesson was, I never really u...",Win (1 of 3)
159.,2016-07-10 22:57:08,79.63,88%,When we got to the Mint I parked on the street in front of t...,No win (2 of 3)
158.,2016-07-10 22:55:27,125.44,99%,The good news is that your child has a natural desire to do ...,Win (1 of 3)
157.,2016-07-10 22:51:32,107.84,100%,"I've heard there was a secret chord that David played, and i...",Win (1 of 3)
156.,2016-07-10 22:50:13,122.81,100%,And I don't believe in the existence of angels but looking a...,Win (1 of 3)
155.,2016-07-10 22:47:24,111.85,98%,"The less you do with the controls, the less chance of error....",Win (1 of 3)
154.,2016-07-10 22:46:15,102.69,97%,"A sensitive and honest-minded man, if he's concerned about e...",Win (1 of 3)
153.,2016-07-10 22:43:25,102.29,97%,"It's a sunny, woodsy day in Lumberton, so get those chainsaw...",Win (1 of 3)
152.,2016-07-10 22:42:15,116.66,98%,"You know, sweetheart, if there's one thing I've learned, it'...",Win (1 of 3)
151.,2016-07-10 22:41:09,107.78,97%,The major difference between a thing that might go wrong and...,Win (1 of 3)
150.,2016-07-10 22:38:23,102.37,97%,"Jamie saved my life. She taught me everything. About life, h...",Win (1 of 3)
149.,2016-07-10 22:35:23,118.36,97%,"You have a class of young strong men and women, and they wan...",Win (1 of 3)
148.,2016-07-10 22:24:26,97.25,96%,"She looked terrific. I said to myself, ""Maybe she's going to...",Win (1 of 3)
147.,2016-07-10 22:21:18,117.55,99%,"Your primary objective should be to touch-type; that is, to ...",Win (1 of 3)
146.,2016-07-10 22:19:39,94.23,95%,"You cannot pass! I am a servant of the Secret Fire, wielder ...",Win (1 of 3)
145.,2016-07-10 22:16:52,101.82,97%,"But suddenly, I viddied that thinking was for the gloopy one...",Win (1 of 2)
144.,2016-07-10 22:15:14,102.89,97%,"Remember, if the time should come when you have to make a ch...",Win (1 of 4)
143.,2016-07-10 22:13:37,122.77,100%,Don't take anything personally - nothing others do is becaus...,Win (1 of 4)
142.,2016-07-10 22:12:32,114.62,98%,Ever seen the size of one of their molars? They go through b...,Win (1 of 3)
141.,2016-07-10 22:11:16,125.75,100%,Now I want you to think and stop being a smart aleck. A man'...,Win (1 of 3)
140.,2016-07-05 18:14:03,101.17,93%,I think you're gonna find - when all this stuff is over and ...,No win (2 of 2)
139.,2016-07-05 18:12:57,112.17,96%,Writing is hard work. A clear sentence is no accident. Very ...,Win (1 of 2)
138.,2016-07-05 18:11:13,79.68,90%,"Comfortable, Mullet? It seems sadly ironic that it's that ti...",No win (2 of 2)
137.,2016-07-05 18:09:43,104.02,97%,Always do your best - your best is going to change from mome...,Win (1 of 2)
136.,2016-07-05 18:08:26,101.06,96%,Most popular song lyrics have two sections - a verse and a b...,Win (1 of 2)
135.,2016-07-05 18:06:49,85.84,93%,"It was an effect of light: quick sunlight dappling, yellow l...",Win (1 of 2)
134.,2016-07-05 18:04:47,113.19,98%,"It's a blue savanna song: somewhere cross the desert, someti...",Win (1 of 2)
133.,2016-07-05 17:49:41,102.16,95%,One essential rule: make sure the joke is the last possible ...,Win (1 of 3)
132.,2016-07-05 17:48:22,93.77,93%,"When you are typing on a typewriter, your input appears dire...",Win (1 of 4)
131.,2016-07-05 17:46:44,101.48,96%,We have a criminal jury system which is superior to any in t...,Win (1 of 2)
130.,2016-07-05 17:45:31,106.30,96%,"Dropping through sky, through the glass of the roof, through...",Win (1 of 4)
129.,2016-07-05 17:44:19,92.04,95%,"Well, it just so happens, this hacienda comes with its very ...",Win (1 of 3)
128.,2016-07-05 17:42:55,95.88,95%,"Grits and fried chicken won't disappear, but perhaps future ...",Win (1 of 4)
127.,2016-07-05 17:41:26,90.50,97%,"In 1966, Andy Dufresne escaped from Shawshank prison. All th...",Win (1 of 3)
126.,2016-07-05 17:39:56,98.63,96%,"They say, ""Find a purpose in your life and live it."" But, so...",Win (1 of 2)
125.,2016-07-05 17:38:19,103.12,96%,The chemistry of an element is determined by the manner in w...,Win (1 of 2)
124.,2016-07-05 17:36:32,88.07,91%,"As if that blind rage had washed me clean, rid me of hope; f...",Win (1 of 3)
123.,2016-06-27 19:21:03,106.07,97%,We have a criminal jury system which is superior to any in t...,Win (1 of 2)
122.,2016-06-27 19:19:37,94.94,95%,And that's what this whole thing is about. Calling home. Ins...,Win (1 of 3)
121.,2016-06-27 19:12:37,121.86,99%,"If you don't get what you want, you suffer; if you get what ...",Win (1 of 3)
120.,2016-06-27 19:08:18,83.98,93%,"In May 1980, Fidel Castro opened the harbor at Mariel, Cuba ...",Win (1 of 3)
119.,2016-06-27 19:06:23,81.14,92%,"After removal from the oven, the pizza is sliced and plated ...",Win (1 of 4)
118.,2016-06-27 19:04:55,93.43,94%,Do you know what they call a Quarter-pounder with cheese in ...,Win (1 of 4)
117.,2016-06-27 19:03:21,99.33,96%,Data is by definition easy to copy. And the Internet makes c...,Win (1 of 2)
116.,2016-06-27 19:01:20,120.09,97%,Remembering you standing quiet in the rain as I ran to your ...,Win (1 of 3)
115.,2016-06-27 18:59:52,103.49,98%,So I'm two inches away from her. Her luscious lips part. Jus...,Win (1 of 4)
114.,2016-06-27 18:58:42,94.28,94%,"Hi, and welcome to the future. San Dimas, California, 2688. ...",Win (1 of 4)
113.,2016-06-27 18:56:35,100.51,99%,"First, the layer of dough bakes into bread, a low-water-cont...",Win (1 of 4)
112.,2016-06-21 21:23:50,99.96,98%,One scientist I met recently told me he reckoned that the av...,Win (1 of 2)
111.,2016-06-21 21:22:05,106.95,99%,I know that you weren't bored that day because there was a l...,Win (1 of 2)
110.,2016-06-21 21:16:21,96.50,96%,"I've heard there was a secret chord that David played, and i...",Win (1 of 4)
109.,2016-06-21 21:15:21,29.14,93%,"What good's a reward if you ain't around to use it? Besides,...",No win (3 of 3)
108.,2016-06-21 21:12:09,104.21,96%,Unlike the other four senses located in the logical regions ...,Win (1 of 3)
107.,2016-06-21 21:08:30,101.18,97%,"Contrary to the feminist cant, there are many things we can ...",Win (1 of 3)
106.,2016-06-21 21:07:06,112.87,99%,"The less you do with the controls, the less chance of error....",Win (1 of 3)
105.,2016-06-21 21:02:10,98.29,96%,"All at sea again, and now my hurricanes, have brought down t...",Win (1 of 3)
104.,2016-06-21 21:00:52,96.77,97%,"Hello, hello, hello, is there anybody in there? Just nod if ...",Win (1 of 3)
103.,2016-06-21 20:59:25,110.14,99%,Is it really necessary to send that email? The more emails y...,Win (1 of 3)
102.,2016-06-21 20:58:01,99.80,94%,"The terminator wouldn't stop, it would never leave him. It w...",Win (1 of 2)
101.,2016-06-21 20:56:40,91.86,95%,Groups of illegal miners smuggle themselves down in freight ...,Win (1 of 2)
100.,2016-06-21 20:54:50,84.76,91%,"You could substitute raspberries or any other fruit, but 99....",No win (2 of 3)
99.,2016-06-21 20:53:30,72.01,89%,When is a legend a legend? Why is a myth a myth? How old and...,Win (1 of 3)
98.,2016-06-21 20:52:01,101.67,96%,"I leave you with photographs, pictures of trickery, and stai...",Win (1 of 3)
97.,2016-06-21 20:49:33,111.41,97%,"When I close my eyes, I am at the center of the sun. And I c...",Win (1 of 3)
96.,2016-06-21 20:48:16,85.51,94%,"You cannot entice a true thief, and thief by vocation, into ...",Win (1 of 3)
95.,2016-06-21 20:46:40,99.59,96%,"You could substitute raspberries or any other fruit, but 99....",Win (1 of 3)
94.,2016-06-21 20:45:36,104.98,95%,"Baby, ever wondered why I could make you laugh and cry? Ecli...",Win (1 of 2)
93.,2016-06-21 20:44:09,91.84,94%,"Run to the bedroom, in the suitcase on the left, you'll find...",Win (1 of 3)
92.,2016-06-21 20:42:25,68.53,93%,Good games offer players a set of challenging problems and t...,No win (2 of 3)
91.,2016-06-21 20:39:41,74.07,90%,"Over the past decade, we've seen strong economic growth but ...",Win (1 of 3)
90.,2016-06-21 20:38:09,120.46,98%,The place to improve the world is first in one's own heart a...,Win (1 of 3)
89.,2016-06-21 20:36:31,71.48,89%,The inner surface of the cell wall touches the cytoplasmic m...,Win (1 of 3)
88.,2016-06-21 20:35:05,101.21,93%,Rhymes trap you into saying things you don't want to say. A ...,Win (1 of 3)
87.,2016-06-21 20:33:27,114.21,99%,"No matter how bad things are, you can always make things wor...",Win (1 of 3)
86.,2016-06-21 20:32:16,116.01,98%,One essential rule: make sure the joke is the last possible ...,Win (1 of 3)
85.,2016-06-21 20:26:58,104.72,96%,"After removal from the oven, the pizza is sliced and plated ...",Win (1 of 3)
84.,2016-06-21 20:25:22,108.90,97%,You won't kill me out of some misplaced sense of self-righte...,Win (1 of 3)
83.,2016-06-21 20:21:39,85.32,90%,"If you begin to repeat an error, or if your concentration or...",Win (1 of 2)
82.,2016-06-21 20:20:03,105.45,95%,"The sooner your kids appreciate the value of work, the more ...",Win (1 of 3)
81.,2016-06-21 20:18:37,88.83,89%,"I believe in love, and I know that you do too. And I believe...",No win (2 of 4)
80.,2016-06-21 20:17:07,111.60,97%,Ever seen the size of one of their molars? They go through b...,Win (1 of 5)
79.,2016-06-21 20:16:05,110.42,97%,If I'm curt with you it's because time is a factor. I think ...,Win (1 of 4)
78.,2016-06-21 20:14:31,129.95,99%,You've got a way to keep me on your side. You give me cause ...,Win (1 of 2)
77.,2016-06-21 20:12:44,121.77,99%,"I don't want tickets, I need you to find me a painting, a cl...",Win (1 of 3)
76.,2016-06-21 20:11:06,100.55,95%,"Picking up the pieces, half alive in a nine 'til five, vacan...",Win (1 of 3)
75.,2016-06-21 20:09:00,105.52,95%,"Look and think as far ahead as possible. Often, a driver's n...",Win (1 of 3)
74.,2016-06-21 20:07:23,100.56,94%,The ultimate way to compose is to be able to keyboard as fas...,Win (1 of 5)
73.,2016-06-21 20:06:01,80.78,87%,Space is big. Really big. You just won't believe how vastly ...,Win (1 of 3)
72.,2016-06-21 20:04:18,97.74,95%,"Yet one fine day, in a fit of euphoria, after he had picked ...",Win (1 of 3)
71.,2016-06-21 20:02:35,111.43,98%,"When I really worry about something, I don't just fool aroun...",Win (1 of 5)
70.,2016-06-21 20:01:17,95.49,95%,"It's all there, black and white, clear as crystal! You stole...",Win (1 of 5)
69.,2016-06-21 20:00:10,113.63,98%,I must not fear. Fear is the mind killer. Fear is the little...,Win (1 of 5)
68.,2016-06-21 19:58:57,99.36,97%,The only message I got was from the company that holds my st...,Win (1 of 3)
67.,2016-06-21 19:57:33,110.07,99%,I've seen things you people wouldn't believe. Attack ships o...,Win (1 of 4)
66.,2016-06-21 19:55:50,95.03,97%,Supermarket aisles are the perfect place to practice your gl...,Win (1 of 5)
65.,2016-06-21 19:54:20,91.63,96%,Lucid but wholly false recollections can easily be induced b...,Win (1 of 5)
64.,2016-06-21 19:52:38,90.08,93%,"The world of typing has changed. In the 1970s, every busines...",Win (1 of 5)
63.,2016-06-21 19:50:54,103.47,96%,If you're working out in front of a mirror and watching your...,Win (1 of 4)
62.,2016-06-21 19:49:19,121.91,99%,"The typewriter had a problem, though. Try to type quickly on...",Win (1 of 5)
61.,2016-06-21 19:48:10,105.82,98%,Instead of hiring workers during the peak hog kill in the wi...,Win (1 of 4)
60.,2016-06-21 19:45:23,77.63,93%,My entire life had been on a predictable trajectory dominate...,Win (1 of 4)
59.,2016-06-21 19:42:11,98.50,97%,Groups of illegal miners smuggle themselves down in freight ...,Win (1 of 4)
58.,2016-06-21 19:40:36,118.08,97%,"We speak of something carried and something carrying, of som...",Win (1 of 3)
57.,2016-06-21 19:39:27,96.17,98%,Make sure to secure the door when I am gone. There are many ...,Win (1 of 4)
56.,2016-06-21 19:38:08,94.29,95%,"It's all there, black and white, clear as crystal! You stole...",Win (1 of 3)
55.,2016-06-21 19:36:17,85.88,91%,"Let's sort the buyers from the spiers, the needy from the gr...",Win (1 of 4)
54.,2016-06-21 19:34:48,98.99,95%,The chemistry of an element is determined by the manner in w...,Win (1 of 3)
53.,2016-06-21 19:33:13,94.32,96%,It is greatly to America's advantage that it is a congenial ...,Win (1 of 3)
52.,2016-06-21 19:31:58,108.38,96%,"With no map to navigate one's life, some of us have stood st...",Win (1 of 2)
51.,2016-06-21 19:30:26,100.89,99%,The men in the room suddenly realized that they didn't want ...,Win (1 of 3)
50.,2016-06-21 19:29:04,93.16,94%,"Everybody's talking about revolution, evolution, mastication...",Win (1 of 3)
49.,2016-06-21 19:27:47,118.51,99%,"Everyone said I was daft to build a castle on a swamp, but I...",Win (1 of 2)
48.,2016-06-21 19:25:43,80.88,95%,"Under the headline ""Wonderful Typing,"" the New York Times re...",Win (1 of 3)
47.,2016-06-21 19:24:16,94.35,96%,Music finds a comfortable parallel with that of human langua...,Win (1 of 3)
46.,2016-06-21 19:23:08,105.08,96%,The example of painting can teach us not only how to manage ...,Win (1 of 3)
45.,2016-06-21 19:22:05,113.89,99%,When we got to the Mint I parked on the street in front of t...,Win (1 of 2)
44.,2016-06-21 19:20:36,109.82,98%,There are very few things I wish I could change about those ...,Win (1 of 2)
43.,2016-06-15 22:15:54,108.95,97%,You've got a way to keep me on your side. You give me cause ...,Win (1 of 2)
42.,2016-06-15 22:14:07,79.37,97%,"Often, we assume that a familiar situation will be but a rep...",Win (1 of 3)
41.,2016-06-15 22:12:45,95.89,95%,Make sure to secure the door when I am gone. There are many ...,Win (1 of 3)
40.,2016-06-15 22:11:11,98.18,97%,"Often, we assume that a familiar situation will be but a rep...",Win (1 of 3)
39.,2016-06-15 22:09:44,95.52,94%,"As if that blind rage had washed me clean, rid me of hope; f...",Win (1 of 3)
38.,2016-06-15 22:08:22,86.29,93%,"I can feel the heat closing in, feel them out there making t...",Win (1 of 3)
37.,2016-06-15 22:06:51,107.18,98%,"You know, sweetheart, if there's one thing I've learned, it'...",Win (1 of 3)
36.,2016-06-15 22:05:27,100.16,97%,We all know people who are very bright but who do not always...,Win (1 of 3)
35.,2016-06-15 22:03:40,97.82,96%,"Some pilots like the excitement of our missions, knowing tha...",Win (1 of 3)
34.,2016-06-15 22:02:27,87.51,96%,"Good games stay within, but at the outer edge, of the player...",Win (1 of 3)
33.,2016-06-15 22:00:30,93.64,94%,The chemistry of an element is determined by the manner in w...,Win (1 of 3)
32.,2016-06-15 21:59:05,105.75,98%,"Look and think as far ahead as possible. Often, a driver's n...",Win (1 of 3)
31.,2016-06-15 21:57:37,102.09,97%,"So I was sitting in my cubicle today, and I realized, ever s...",Win (1 of 2)
30.,2016-06-15 21:56:29,94.99,95%,"I know what ""exacerbate"" means. There is not a word or a sen...",Win (1 of 3)
29.,2016-06-15 21:55:04,90.67,96%,"She looked terrific. I said to myself, ""Maybe she's going to...",Win (1 of 3)
28.,2016-06-15 21:53:01,84.26,99%,"If one day I could get out of here, I would allow myself to ...",Win (1 of 3)
27.,2016-06-15 21:51:33,121.72,98%,Now did you answer cause you thought that's what I wanted to...,Win (1 of 3)
26.,2016-06-15 21:50:31,94.68,91%,"Not too many days from this day, not too many hours from thi...",Win (1 of 3)
25.,2016-06-15 21:49:00,96.75,96%,The example of painting can teach us not only how to manage ...,Win (1 of 3)
24.,2016-06-15 21:46:46,115.41,98%,I think you're gonna find - when all this stuff is over and ...,Win (1 of 3)
23.,2016-06-15 21:45:31,98.99,97%,Overhead the albatross hangs motionless upon the air and dee...,Win (1 of 3)
22.,2016-06-15 21:43:53,89.17,94%,"When she returns to the forum page, her post is there. It is...",Win (1 of 3)
21.,2016-06-15 21:42:13,95.78,99%,In order to become an elf I filled out ten pages' worth of f...,Win (1 of 3)
20.,2016-06-15 21:40:41,104.72,98%,I've been thinking lots about my life and how quick I'd wash...,Win (1 of 2)
19.,2016-06-15 21:39:01,115.31,100%,I think you're gonna find - when all this stuff is over and ...,Win (1 of 3)
18.,2016-06-15 21:37:56,105.57,99%,"I believe in love, and I know that you do too. And I believe...",Win (1 of 3)
17.,2016-06-15 21:36:21,82.21,94%,I would never want to forfeit my genders. Along with Aunt Au...,Win (1 of 2)
16.,2016-06-15 21:35:06,82.39,93%,"He's got a two day head start on you, which is more than he ...",Win (1 of 3)
15.,2016-06-15 21:32:27,85.73,97%,"To some, the rules of etiquette may seem outdated, stuffy an...",Win (1 of 3)
14.,2016-06-15 21:30:40,93.30,95%,Good games offer players a set of challenging problems and t...,Win (1 of 3)
13.,2016-06-15 21:29:27,100.40,98%,"A sensitive and honest-minded man, if he's concerned about e...",Win (1 of 3)
12.,2016-06-15 21:28:07,104.35,97%,"If the driver would only slow down, the car would actually g...",Win (1 of 4)
11.,2016-06-15 21:25:51,100.36,98%,"Whenever you watch the mind, you withdraw consciousness from...",Win (1 of 4)
10.,2016-06-15 21:23:45,108.93,99%,Paranoia is a survival trait when you run in my circles. It ...,Win (1 of 4)
9.,2016-06-15 21:22:12,105.61,99%,"I'm so glad you came, I'm so glad you remembered, to see how...",Win (1 of 4)
8.,2016-06-15 21:20:40,114.51,99%,It was one of those days when it's a minute away from snowin...,Win (1 of 3)
7.,2016-06-15 21:19:09,102.80,97%,One thing I've learned in the last seven years: in every gam...,Win (1 of 3)
6.,2016-06-15 21:16:32,92.80,95%,We're no strangers to love. You know the rules and so do I. ...,Win (1 of 4)
5.,2016-06-15 21:14:03,104.22,99%,"Thing is Butch, right now you got ability. But painful as it...",Win (1 of 3)
4.,2016-06-15 21:12:29,102.28,99%,"Because they're at the bottom of the scale, nerds are a safe...",Win (1 of 4)
3.,2016-06-15 21:10:45,98.83,98%,Caravans were being raided in a forest north of Rangoon by a...,Win (1 of 3)
2.,2016-06-15 21:09:19,79.05,91%,"At least he had a BMW. He might live in a dump, but the worl...",Win (1 of 3)
1.,2016-06-15 21:07:31,85.86,97%,"Radiation could be precisely determined, in principle, if we...",Win (1 of 3)
