312.,2017-07-17 02:22:43,70.20,98%,"Burning my bridges and smashing my mirrors, turning to see i...",No win (2 of 2)
311.,2017-07-17 02:21:40,64.04,97%,"I'm on Johnson Avenue in San Luis Obispo, and I'm five years...",No win (2 of 5)
310.,2017-07-17 02:20:46,70.64,97%,In all the houses keys to memorizing objects and feelings ha...,Win (1 of 4)
309.,2017-07-17 02:15:36,69.06,97%,"She's got a smile that, it seems to me, reminds me of childh...",No win (4 of 5)
308.,2017-07-17 02:14:34,66.15,96%,"Despair comes slowly, crawling its way up inside you until i...",No win (4 of 4)
307.,2017-07-17 02:12:59,74.55,99%,"To produce a mighty book, you must choose a mighty theme. No...",No win (2 of 5)
306.,2017-07-17 02:11:56,55.56,95%,"Nepheline, leucite, and sodalite are minerals allied to the ...",No win (5 of 5)
305.,2017-07-17 02:10:30,70.34,98%,What's Joey Zasa got to do with this? Joey Zasa's a pazzo. J...,No win (2 of 5)
304.,2017-07-17 02:09:19,79.97,99%,With the money they earn they'll be able to buy more police ...,No win (4 of 5)
303.,2017-07-15 03:02:05,65.29,97%,"I felt that even when they were polite they hardly saw me, t...",Win (1 of 3)
302.,2017-07-15 03:00:25,63.29,97%,One way to combat the horizon effect is to continue search w...,Win (1 of 2)
301.,2017-07-15 02:54:55,62.06,97%,Few smart kids can spare the attention that popularity requi...,Win (1 of 3)
300.,2017-07-15 02:48:44,84.49,98%,"That's right, and the one who wins gets a prize, only there ...",Win (1 of 3)
299.,2017-07-15 02:47:27,71.84,99%,"I'll miss the sea, but a person needs new experiences. They ...",Win (1 of 3)
298.,2017-07-15 02:46:06,66.55,98%,The hallway is luxurious and tasteful. Tapestries and painti...,Win (1 of 3)
297.,2017-07-15 02:44:48,72.10,97%,That's the way it is. It's down there and I'm in here. I gue...,Win (1 of 3)
296.,2017-07-15 02:43:23,73.17,98%,"The brain can be a tool. It can recall phone numbers, solve ...",Win (1 of 3)
295.,2017-07-15 02:41:17,66.62,97%,Come sail your ships around me and burn your bridges down. W...,Win (1 of 3)
294.,2017-07-15 02:39:08,65.08,97%,Any finite number divided by infinity is as near to nothing ...,Win (1 of 3)
293.,2017-07-15 02:36:55,63.08,97%,"See the stone set in your eyes, see the thorn twist in your ...",Win (1 of 3)
292.,2017-07-15 02:35:27,80.43,98%,I must not fear. Fear is the mind killer. Fear is the little...,Win (1 of 3)
291.,2017-07-15 02:26:36,71.81,97%,I've flown seven million miles. And I've been waiting on peo...,Win (1 of 3)
290.,2017-07-15 02:24:51,72.42,98%,"Demand is related to wants. If goods and services were free,...",Win (1 of 2)
289.,2017-07-15 02:22:34,62.70,97%,"A lot of people, especially this one psychoanalyst guy they ...",Win (1 of 2)
288.,2017-07-15 02:18:50,75.12,98%,"Allow me first to apologize for this interruption. I do, lik...",Win (1 of 3)
287.,2017-07-15 02:17:25,68.24,98%,"It's all there, black and white, clear as crystal! You stole...",Win (1 of 3)
286.,2017-07-15 02:13:56,71.85,98%,Writing is hard work. A clear sentence is no accident. Very ...,Win (1 of 3)
285.,2017-07-15 02:12:22,63.67,96%,"When you're dead, they really fix you up. I hope to hell whe...",Win (1 of 2)
284.,2017-07-15 02:10:30,79.20,98%,"Formerly, when I would feel a desire to understand someone, ...",Win (1 of 2)
283.,2017-07-15 01:35:38,79.43,97%,"Life is not suffering; it's just that you will suffer it, ra...",Win (1 of 3)
282.,2017-07-15 01:34:30,69.64,96%,All we need for morality is contained in these words: make o...,Win (1 of 3)
281.,2017-07-15 01:33:07,79.42,98%,I will need my spectacles and a clear head. Today I broke my...,Win (1 of 3)
280.,2017-07-15 01:31:56,60.91,97%,"Pulp: 1. A soft, moist, shapeless mass or matter. 2. A magaz...",Win (1 of 3)
279.,2017-07-15 01:30:26,73.19,97%,"The stuff we call ""software"" is not like anything that human...",Win (1 of 3)
278.,2017-07-15 01:28:54,59.54,96%,The hallway is luxurious and tasteful. Tapestries and painti...,Win (1 of 3)
277.,2017-07-15 01:27:03,64.88,97%,"And Saint Attila raised the hand grenade up on high, saying,...",Win (1 of 3)
276.,2017-07-15 01:25:13,68.47,96%,I must not fear. Fear is the mind killer. Fear is the little...,Win (1 of 3)
275.,2017-07-15 01:08:47,76.22,99%,"Listen up, maggots. You are not special. You are not a beaut...",Win (1 of 3)
274.,2017-07-14 05:59:10,55.16,96%,I'm gonna fight 'em off. A seven nation army couldn't hold m...,No win (3 of 4)
273.,2017-07-14 05:57:58,54.79,95%,I hope I cut myself shaving tomorrow. I hope it bleeds all d...,No win (3 of 5)
272.,2017-07-14 05:57:03,68.88,100%,Peter Bailey was not a businessman. That's what killed him. ...,No win (2 of 5)
271.,2017-07-14 05:56:12,71.57,99%,Quality humor doesn't just deliver one gag and then tax the ...,No win (4 of 5)
270.,2017-07-14 05:54:27,72.02,97%,There are two places on Earth that serve as canaries in the ...,No win (3 of 5)
269.,2017-07-14 05:53:06,68.31,98%,I wanna be inside your heaven. Take me to the place you cry ...,No win (3 of 5)
268.,2017-07-14 05:52:13,72.13,97%,Caddy got the box and set it on the floor and opened it. It ...,No win (4 of 5)
267.,2017-07-14 05:51:24,71.71,97%,We imagine that when we are thrown out of our usual ruts all...,Win (1 of 3)
266.,2017-07-14 05:49:59,70.06,97%,"There are perhaps twenty regular posters on the forum, and s...",No win (3 of 5)
265.,2017-07-14 05:47:59,79.74,98%,"I love the ground under his feet, and the air over his head,...",No win (2 of 5)
264.,2017-07-14 05:46:57,66.15,96%,I thought climbing the Devil's Thumb would fix all that was ...,Win (1 of 4)
263.,2017-07-14 05:45:01,93.10,100%,"For all the things you've done, for the things you might hav...",No win (2 of 5)
262.,2017-07-14 05:44:33,64.19,98%,"All at sea again, and now my hurricanes, have brought down t...",Win (1 of 3)
261.,2017-07-13 03:24:48,66.46,96%,"Yes, not only humans but also every other organism in the co...",No win (4 of 5)
260.,2017-07-13 03:22:58,71.48,98%,"I am invisible, understand, simply because people refuse to ...",Win (1 of 5)
259.,2017-07-13 03:19:43,83.59,99%,"Hey you... did you ever realize what you'd become, and did y...",Win (1 of 3)
258.,2017-07-13 03:18:38,69.25,97%,A vector is a quantity that has both magnitude and direction...,No win (4 of 5)
257.,2017-07-13 03:15:33,67.54,99%,"Silence fell between them, as tangible as the dark tree shad...",No win (2 of 5)
256.,2017-07-13 03:14:32,67.43,97%,I would say he has quite a few problems. His energy seems to...,No win (5 of 5)
255.,2017-07-13 03:12:37,60.89,97%,"And I have one of those very loud, stupid laughs. I mean if ...",No win (2 of 4)
254.,2017-07-13 03:11:17,75.84,99%,"Samatha is a state in which the mind is brought to rest, foc...",No win (2 of 3)
253.,2017-07-13 03:10:05,64.03,97%,"Listen, strange women lyin' in ponds distributin' swords is ...",Win (1 of 5)
252.,2017-07-13 03:07:20,77.93,98%,We were the people who were not in the papers. We lived in t...,No win (3 of 5)
251.,2017-07-13 03:05:40,81.65,99%,I know now that it's over. I knew it then. There would be no...,No win (2 of 5)
250.,2017-07-13 03:03:56,60.70,96%,"Growing to hate decisive moments, the only thing within a br...",No win (4 of 5)
249.,2017-07-13 03:01:33,73.30,98%,Haven't you ever happened to come across in a book some vagu...,No win (2 of 3)
248.,2017-07-13 03:00:43,63.77,97%,"But this rough magic I here abjure, and when I have required...",No win (3 of 5)
247.,2017-07-13 02:59:25,74.57,98%,"Ticking away the moments that make up a dull day, you fritte...",No win (3 of 5)
246.,2017-07-13 02:58:21,67.92,98%,This is a plea for peace to the oppressors of the world and ...,No win (2 of 5)
245.,2017-07-13 02:56:51,60.43,95%,The number one challenge I've seen with myself and with othe...,No win (4 of 5)
244.,2017-07-13 02:55:45,54.47,95%,The great edifice of variety and choice that is an American ...,No win (4 of 5)
243.,2017-07-13 02:54:23,68.81,97%,You boys may have had gelato with Stan Lee and gotten autogr...,No win (2 of 5)
242.,2017-07-13 02:53:28,57.41,96%,We've come up with a camera so tiny it fits into this oversi...,No win (3 of 3)
241.,2017-07-13 02:51:31,63.06,98%,A giant inverted steel pyramid is perfectly balanced on its ...,Win (1 of 2)
240.,2017-07-13 02:49:30,62.45,98%,Your father's light saber. This is the weapon of a Jedi Knig...,Win (1 of 2)
239.,2017-07-13 02:47:26,72.67,99%,I never said I would stay to the end - I knew I would leave ...,Win (1 of 2)
238.,2017-07-13 02:45:21,61.70,98%,"The car has stopped. Vinny: ""What have you stopped here for?...",Win (1 of 2)
237.,2017-07-13 02:43:19,63.10,96%,"All right, I'll go in there for Dorothy. Wicked Witch or no ...",Win (1 of 3)
236.,2017-07-13 02:41:43,71.70,98%,"My name is Turkish. Funny name for an Englishman, I know. My...",Win (1 of 2)
235.,2017-07-12 07:41:02,65.25,95%,"Then she lit up a candle, and she showed me the way. There w...",No win (3 of 4)
234.,2017-07-12 07:39:31,75.62,98%,It just so happens that your friend here is only mostly dead...,No win (5 of 5)
233.,2017-07-12 07:37:21,77.65,98%,"He always seemed to women different from what he was, and th...",No win (4 of 5)
232.,2017-07-12 07:32:31,74.47,98%,Just because there are things I don't remember doesn't make ...,Win (1 of 5)
231.,2017-07-12 07:31:57,62.70,97%,"And I am whatever you say I am. If I wasn't, then why would ...",No win (2 of 4)
230.,2017-07-12 07:30:03,72.09,98%,"And it's whispered that soon, if we all call the tune, then ...",No win (3 of 5)
229.,2017-07-12 07:28:16,82.23,97%,"There was never any more inception than there is now, nor an...",No win (2 of 5)
228.,2017-07-12 07:26:31,80.66,100%,"Man, don't tell me how good I was. I just got away with it b...",No win (4 of 5)
227.,2017-07-12 07:25:30,53.91,97%,The inner surface of the cell wall touches the cytoplasmic m...,No win (2 of 3)
226.,2017-07-12 06:12:24,77.88,97%,You have an urgent look about you... Has something happened?...,No win (2 of 5)
225.,2017-07-12 06:11:12,58.43,97%,"I don't want tickets, I need you to find me a painting, a cl...",No win (2 of 3)
224.,2017-07-12 06:09:14,56.06,98%,Data is by definition easy to copy. And the Internet makes c...,No win (3 of 5)
223.,2017-07-12 06:07:37,62.79,99%,"In fact, the mere act of opening the box will determine the ...",No win (4 of 5)
222.,2017-07-12 05:08:40,64.50,98%,"But, pray how could that which I spoke so many years ago, an...",Win (1 of 3)
221.,2017-07-12 05:07:05,71.33,99%,This is why we're here. Because this little gray rock sells ...,Win (1 of 2)
220.,2017-07-12 03:55:02,77.47,98%,And when he rode past I seen he was carryin' fire in a horn ...,Win (1 of 3)
219.,2017-07-12 03:53:13,60.17,96%,A problem in communication is that people don't smile enough...,Win (1 of 3)
218.,2017-07-12 03:51:20,63.01,98%,We're all taught from a young age that there are only two ch...,Win (1 of 3)
217.,2017-07-12 03:49:45,62.35,96%,"I know what you think it means, sonny. To me, it's just a ma...",Win (1 of 2)
216.,2017-07-12 03:19:04,58.62,97%,Those who reject the argument that natural science has progr...,Win (1 of 4)
215.,2017-07-12 03:17:09,65.58,97%,"On the 11:00 news tonight, a certain kind of soft drink has ...",No win (2 of 5)
214.,2017-07-12 03:15:30,68.14,98%,"All life's battles teach us something, even those we lose. W...",Win (1 of 4)
213.,2017-07-12 03:13:44,71.64,98%,"It was the most horrible, the most repellent thing she had e...",No win (2 of 5)
212.,2017-07-12 03:12:04,75.03,98%,"I was just guessing at numbers and figures, pulling the puzz...",No win (2 of 5)
211.,2017-07-12 03:10:43,66.18,98%,While the simple act of putting one foot in front of the oth...,No win (2 of 5)
210.,2017-07-12 03:08:33,67.88,98%,"In the late 1960s, a growing number of people became concern...",No win (2 of 6)
209.,2017-07-12 03:06:21,62.53,98%,"People get ready, there's a train coming. You don't need no ...",No win (2 of 4)
208.,2017-07-11 03:25:04,66.51,97%,"It was a marvelous night, the sort of night one only experie...",No win (3 of 5)
207.,2017-07-11 03:23:02,68.59,99%,"Now Lina, you've been reading all those fan magazines again!...",Win (1 of 4)
206.,2017-07-11 03:21:10,58.29,97%,"She came into a room; she stood, as he had often seen her, i...",Win (1 of 5)
205.,2017-07-11 03:19:29,58.29,95%,"Now you might ask yourself, if by yourself you mean me, ""Ste...",No win (2 of 5)
204.,2017-07-11 03:18:09,58.66,97%,"You just couldn't let me go, could you? This is what happens...",Win (1 of 3)
203.,2017-07-11 03:16:39,55.88,97%,"I was just guessing at numbers and figures, pulling the puzz...",No win (3 of 5)
202.,2017-07-11 03:14:43,71.95,98%,"Anything that happens, happens. Anything that, in happening,...",No win (2 of 5)
201.,2017-07-11 03:10:50,74.83,97%,The real evil is the power to kill people. Someone who finds...,Win (1 of 5)
200.,2017-07-11 03:09:15,70.60,97%,Once in a lifetime there comes a motion picture which change...,Win (1 of 5)
199.,2017-07-11 03:08:20,66.81,98%,We may climb into the thin and cold realm of pure geometry a...,No win (2 of 4)
198.,2017-07-11 03:06:08,69.03,98%,"Our minds are born festering with sin. Some are so blighted,...",Win (1 of 3)
197.,2017-07-11 03:04:58,61.62,98%,I wish I could just make you turn around and see me cry. The...,No win (4 of 4)
196.,2017-07-11 03:01:30,70.91,99%,I only lose my fear when I run. I won't lose a tear when I r...,No win (2 of 4)
195.,2017-07-11 03:00:39,50.27,96%,It doesn't mean much to be able to filter out most present-d...,No win (3 of 5)
194.,2017-07-11 01:34:09,77.32,99%,"In the casino, the cardinal rule is to keep them playing and...",Win (1 of 2)
193.,2017-07-11 01:32:31,67.58,97%,The math is compelling. Most of the people in the world are ...,Win (1 of 2)
192.,2017-07-11 01:30:39,65.86,98%,It's no sacrifice. Just a simple word. It's two hearts livin...,Win (1 of 2)
191.,2017-07-11 01:29:21,57.44,98%,"We're knights of the Round Table, we dance whene'er we're ab...",Win (1 of 3)
190.,2017-07-11 01:27:43,53.53,96%,Now look at this picture. Look at it hard. Then turn the pag...,Win (1 of 3)
189.,2017-07-11 01:25:46,58.29,98%,"It is a curious thing, Harry, but perhaps those who are best...",Win (1 of 3)
188.,2017-07-11 01:22:06,67.83,98%,Antoon used to import paint cans. That's simply too expensiv...,Win (1 of 3)
187.,2017-07-11 01:20:36,72.66,98%,"He said that if culture is a house, then language was the ke...",Win (1 of 3)
186.,2017-07-11 01:19:14,70.56,97%,"After you got six pieces, you gotta get rid of 'em. Of cours...",Win (1 of 3)
185.,2017-07-11 01:17:49,69.63,99%,"When you're dead, they really fix you up. I hope to hell whe...",Win (1 of 3)
184.,2017-07-11 01:16:03,58.34,97%,I never imagined a boy like you could give me so much troubl...,Win (1 of 3)
183.,2017-07-11 01:14:19,60.78,97%,The life pods are launching. We should hurry. The Covenant a...,Win (1 of 3)
182.,2017-07-11 01:12:57,59.95,96%,All I asked was for you to behave like a princess. Even roya...,Win (1 of 3)
181.,2017-07-11 01:11:29,70.83,98%,Relativity is relatively easy to understand. But there's one...,Win (1 of 3)
180.,2017-07-11 01:09:26,65.62,98%,I guess this time you're really leaving. I heard your suitca...,Win (1 of 3)
179.,2017-07-11 01:07:30,62.76,96%,There are usually three types of people I deal with when sel...,Win (1 of 3)
178.,2017-07-11 01:05:28,73.18,98%,We've arranged a global civilization in which most crucial e...,Win (1 of 3)
177.,2017-07-11 01:03:44,74.77,99%,You were the chosen one! It was said that you would destroy ...,Win (1 of 3)
176.,2017-07-11 01:02:15,80.61,99%,I'd have wasted a lot of time and trouble before I learned t...,Win (1 of 2)
175.,2017-07-11 00:50:29,61.29,97%,Now this is a story all about how my life got flipped-turned...,Win (1 of 3)
174.,2017-07-11 00:49:10,75.39,97%,"Everybody knows in their bones that something is eternal, an...",Win (1 of 3)
173.,2017-07-11 00:48:06,57.97,97%,I sincerely believe that if women study male lessons on conc...,Win (1 of 3)
172.,2017-07-11 00:46:21,69.15,99%,"She was a genius of sadness, immersing herself in it, separa...",Win (1 of 3)
171.,2017-07-11 00:45:01,73.10,99%,"I sing the body electric, the armies of those I love engirth...",Win (1 of 3)
170.,2017-07-11 00:43:32,70.54,98%,"There is so much darkness in Ember, Lina. It's not just outs...",Win (1 of 3)
169.,2017-07-11 00:42:06,63.47,96%,Just because there are things I don't remember doesn't make ...,Win (1 of 3)
168.,2017-07-11 00:40:55,79.92,99%,"Take a drink, my friend, and say what you have in your heart...",Win (1 of 3)
167.,2017-07-11 00:39:33,70.16,100%,And that's what this whole thing is about. Calling home. Ins...,Win (1 of 3)
166.,2017-07-11 00:37:36,65.61,97%,"He started ripping the bark, using his fingernails at first,...",Win (1 of 3)
165.,2017-07-11 00:35:33,68.46,98%,"Even though there may be a deceiver of some sort, very power...",Win (1 of 3)
164.,2017-07-11 00:33:47,63.76,98%,"Picture yourself in a boat on a river, with tangerine trees ...",Win (1 of 3)
163.,2017-07-11 00:32:12,69.45,99%,"This made me reflect, how vain an attempt it is for a man to...",Win (1 of 3)
162.,2017-07-11 00:30:44,59.36,98%,"Now, hold on, Mr. Potter. You're right when you say my fathe...",Win (1 of 2)
161.,2017-07-11 00:28:47,72.47,99%,"When I close my eyes, I am at the center of the sun. And I c...",Win (1 of 3)
160.,2017-07-11 00:27:46,75.05,100%,"The green eyes, you're the one that I wanted to find and any...",Win (1 of 3)
159.,2017-07-10 08:05:53,59.57,97%,Who's going to take you home and hold you when things aren't...,Win (1 of 3)
158.,2017-07-10 08:04:53,69.37,97%,"And it says to you love when you can, cry when you have to, ...",Win (1 of 3)
157.,2017-07-10 08:03:35,59.08,98%,"It is a truth universally acknowledged, that a single man in...",Win (1 of 3)
156.,2017-07-10 08:02:28,57.28,97%,Oh... and how is education supposed to make me feel smarter?...,Win (1 of 3)
155.,2017-07-10 07:52:50,62.02,98%,The increase of disorder or entropy is what distinguishes th...,Win (1 of 3)
154.,2017-07-10 07:51:32,62.05,97%,A glooming peace this morning with it brings. The sun for so...,Win (1 of 2)
153.,2017-07-10 07:49:53,51.13,96%,"Over the past decade, we've seen strong economic growth but ...",Win (1 of 3)
152.,2017-07-10 07:47:55,61.02,98%,"It may seem quite novelistic to you, and I am willing to agr...",No win (1 of 1)
151.,2017-07-08 02:45:22,63.59,97%,There are usually three types of people I deal with when sel...,Win (1 of 5)
150.,2017-07-08 02:42:52,69.22,98%,"You must love your work, and not be always looking over the ...",No win (4 of 5)
149.,2017-07-08 02:26:21,76.93,97%,"Patience, he thought. So much of this was patience - waiting...",Win (1 of 5)
148.,2017-07-08 02:25:25,68.78,100%,And he told us of his life in the land of submarines.,No win (2 of 5)
147.,2017-07-08 01:34:02,72.42,100%,I still want to smack him. Or remind him that the last trans...,No win (2 of 4)
146.,2017-07-08 01:18:54,70.11,99%,Is that what your little note says? It must be hard living y...,No win (2 of 5)
145.,2017-07-08 01:18:03,65.40,99%,"They call me the king of the spreadsheets, got 'em printed o...",No win (2 of 5)
144.,2017-07-08 01:16:59,71.01,98%,Don't bother trying to explain your emotions. Live everythin...,No win (3 of 4)
143.,2017-07-08 01:16:01,63.25,98%,Oh... and how is education supposed to make me feel smarter?...,No win (2 of 5)
142.,2017-07-08 01:15:03,61.30,98%,"Webster defines intelligence as, ""the ability to apprehend i...",No win (3 of 5)
141.,2017-07-08 00:59:22,68.38,97%,There's a harsh truth to face. No way I'm gonna make it on t...,Win (1 of 3)
140.,2017-07-08 00:57:22,54.17,97%,"It turned out that the sweet-talking, tattoo-sporting pikey ...",Win (1 of 3)
139.,2017-07-08 00:55:18,74.30,97%,Reading is not a natural process; the habits necessary for e...,Win (1 of 3)
138.,2017-07-08 00:50:00,56.66,98%,And that's what this whole thing is about. Calling home. Ins...,Win (1 of 3)
137.,2017-07-08 00:47:40,68.33,98%,What's Joey Zasa got to do with this? Joey Zasa's a pazzo. J...,Win (1 of 4)
136.,2017-07-08 00:45:52,54.44,97%,"Two households, both alike in dignity (in fair Verona, where...",Win (1 of 4)
135.,2017-07-08 00:43:34,65.70,97%,"It's the wanting you, never getting you. Keeps me wanting yo...",Win (1 of 3)
134.,2017-07-08 00:38:50,64.88,96%,"It's a thousand pages, give or take a few. I'll be writing m...",Win (1 of 3)
133.,2017-07-08 00:37:30,66.32,98%,"You know, sweetheart, if there's one thing I've learned, it'...",Win (1 of 3)
132.,2017-07-08 00:33:27,68.06,97%,"The terminator wouldn't stop, it would never leave him. It w...",No win (3 of 4)
131.,2017-07-08 00:32:02,66.73,97%,"But I'm glad you'll see me as I am. Above all, I wouldn't wa...",No win (2 of 3)
130.,2017-07-08 00:30:54,57.16,96%,You think the dead we loved ever truly leave us? You think t...,No win (3 of 4)
129.,2017-07-07 07:08:38,56.78,96%,"The seeds of life - fiery is their force, divine their birth...",No win (2 of 4)
128.,2017-07-07 07:03:56,73.88,97%,"Remember, if the time should come when you have to make a ch...",Win (1 of 5)
127.,2017-07-07 07:02:47,63.61,98%,Through error you come to the truth! I am a man because I er...,Win (1 of 4)
126.,2017-07-07 02:43:11,66.98,97%,"I rejected those answers; instead, I chose something differe...",Win (1 of 4)
125.,2017-07-06 08:22:44,53.86,97%,Ronald Reagan? The actor? Then who's Vice President? Jerry L...,Win (1 of 3)
124.,2017-07-06 08:21:23,62.15,97%,"It's so easy to hate your brother, it should be hard. It's s...",No win (4 of 5)
123.,2017-07-06 08:19:53,66.75,98%,"You see, if you shoot pool with some employee here, you can ...",Win (1 of 4)
122.,2017-07-06 08:18:40,63.11,97%,"In general, many of these targets are easier marks if you ar...",No win (3 of 5)
121.,2017-07-06 08:17:47,58.74,96%,You boys may have had gelato with Stan Lee and gotten autogr...,No win (5 of 5)
120.,2017-07-06 08:16:55,70.42,99%,"Every second he breathed, the smell of the grass, the cool a...",No win (4 of 5)
119.,2017-07-06 08:15:51,63.00,96%,"Yes, it was Link who helped me escape from the dungeon! When...",No win (3 of 4)
118.,2017-07-06 08:14:44,76.95,100%,What's the use you learning to do right when it's troublesom...,Win (1 of 4)
117.,2017-07-06 08:13:33,57.79,98%,"Sir, a couple of brief points: firstly, you're not a qualifi...",Win (1 of 4)
116.,2017-07-06 08:09:07,72.37,98%,"Today, you people are no longer maggots. Today, you are Mari...",Win (1 of 3)
115.,2017-07-06 08:06:56,61.27,98%,I watched a bear once. His leg was in a steel trap. It chewe...,No win (2 of 4)
114.,2017-07-06 08:05:06,63.92,98%,"There are two kinds of fibers in our muscles, red and white....",No win (4 of 4)
113.,2017-07-06 08:03:06,65.47,98%,"This town is very peaceful. Yes, and that is why there are s...",No win (3 of 5)
112.,2017-07-06 08:01:37,60.12,96%,"Vanity and pride are different things, though the words are ...",Win (1 of 5)
111.,2017-07-06 08:00:30,54.76,97%,Quartz is the commonest of the crystalline forms of silicon ...,No win (3 of 5)
110.,2017-07-06 07:41:01,58.88,99%,"In the old days of the Cold War, Zukovsky worked for the KGB...",No win (2 of 5)
109.,2017-07-06 07:38:54,57.85,99%,If you spend too much time trying to find out what is good o...,No win (4 of 5)
108.,2017-07-06 03:15:04,62.31,97%,"If all else perished, and he remained, I should still contin...",Win (1 of 2)
107.,2017-07-06 03:13:21,58.80,97%,"No man is an island, entire of itself; every man is a piece ...",Win (1 of 2)
106.,2017-07-06 03:11:07,51.75,96%,We might begin by asking why the pregnant man image has been...,Win (1 of 2)
105.,2017-07-06 03:08:43,60.72,97%,I find it wholesome to be alone the greater part of the time...,Win (1 of 2)
104.,2017-07-05 08:26:04,69.77,98%,"As happens sometimes, a moment settled and hovered and remai...",Win (1 of 2)
103.,2017-07-05 08:24:29,81.99,100%,"They had taken it all away from him now, they had turned awa...",Win (1 of 2)
102.,2017-07-05 08:23:12,60.30,99%,"Pulp: 1. A soft, moist, shapeless mass or matter. 2. A magaz...",Win (1 of 2)
101.,2017-07-05 07:57:45,69.64,97%,Sometimes you concentrate more on racing the cars around you...,Win (1 of 3)
100.,2017-07-05 07:55:32,60.18,97%,"The man who reviews his own life, as I do mine, in going on ...",Win (1 of 4)
99.,2017-07-05 07:53:25,65.48,98%,Unlike the other four senses located in the logical regions ...,Win (1 of 4)
98.,2017-07-05 07:51:38,63.47,98%,"It was as if that great rush of anger had washed me clean, e...",Win (1 of 4)
97.,2017-07-05 07:49:45,63.19,99%,The Western States nervous under the beginning change. Texas...,Win (1 of 4)
96.,2017-07-05 07:46:22,63.11,98%,"I figured I could get a job at a filling station somewhere, ...",Win (1 of 4)
95.,2017-07-05 07:44:50,66.67,98%,"I know a bloke who knows a bloke who knows a bloke. Now, I k...",Win (1 of 3)
94.,2017-07-05 07:43:29,72.84,99%,And I will look down and see my murmuring bones and the deep...,Win (1 of 4)
93.,2017-07-05 07:42:03,63.64,98%,"Look at these, they're amazing! Which one do you like more? ...",Win (1 of 3)
92.,2017-07-05 07:40:22,61.18,97%,What's cool about really little kids is that they don't say ...,Win (1 of 4)
91.,2017-07-05 07:38:00,67.42,97%,"I rejected those answers; instead, I chose something differe...",Win (1 of 2)
90.,2017-07-05 07:35:54,73.81,99%,"Death really did not matter to him but life did, and therefo...",Win (1 of 3)
89.,2017-07-05 07:34:39,71.75,98%,One of the most tragic things I know about human nature is t...,Win (1 of 3)
88.,2017-07-05 05:43:04,70.27,99%,"Very well, gentlemen. This, and maybe other similar things, ...",Win (1 of 3)
87.,2017-07-05 05:40:34,61.59,98%,What you gonna do with your man there? You're always gonna h...,Win (1 of 3)
86.,2017-07-05 05:38:36,53.89,99%,"Oh, supercalifragilisticexpialidocious! Even though the soun...",Win (1 of 3)
