85.,2017-07-05 05:36:54,55.92,97%,"In short order, Carter then proceeded to kill any chance he ...",Win (1 of 3)
84.,2017-07-05 05:34:35,68.29,97%,"Some day, and that day may never come, I will call upon you ...",Win (1 of 3)
83.,2017-07-05 05:33:08,76.78,99%,I just told you the truth. I told you the truth the first ti...,Win (1 of 3)
82.,2017-07-05 05:31:17,68.20,98%,I said that I would see you because I had heard that you wer...,Win (1 of 3)
81.,2017-07-05 05:29:29,60.56,97%,Directories contain elements that describe objects in the wo...,Win (1 of 3)
80.,2017-07-05 05:27:41,63.94,98%,"The unhappy are egoistic, spiteful, unjust, cruel, and less ...",Win (1 of 3)
79.,2017-07-05 05:25:21,66.30,98%,I'm alive in a city in a country of the world. And I want to...,Win (1 of 3)
78.,2017-07-05 03:15:42,68.41,99%,"If you don't get what you want, you suffer; if you get what ...",No win (2 of 5)
77.,2017-07-05 03:14:01,58.84,99%,"Today, computers have taken this ancient art out of the craf...",Win (1 of 3)
76.,2017-07-05 03:11:57,59.74,97%,The unknown future rolls toward us. I face it for the first ...,No win (5 of 5)
75.,2017-07-05 03:09:35,68.60,98%,You don't care about anything except you. You just want to p...,Win (1 of 5)
74.,2017-07-05 03:07:08,60.38,96%,San Francisco in the middle sixties was a very special time ...,No win (5 of 5)
73.,2017-07-05 02:55:01,67.90,98%,The Sky People have sent us a message that they can take wha...,Win (1 of 2)
72.,2017-07-05 02:53:21,55.76,97%,"Now Lina, you've been reading all those fan magazines again!...",Win (1 of 2)
71.,2017-07-05 02:51:29,57.83,98%,"There is so much darkness in Ember, Lina. It's not just outs...",Win (1 of 2)
70.,2017-07-05 02:49:52,55.66,96%,I've seen things you people wouldn't believe. Attack ships o...,Win (1 of 2)
69.,2017-07-04 07:32:30,60.38,97%,"I am the truth, I am the wisdom of the fallen - I'm the yout...",Win (1 of 2)
68.,2017-07-04 07:30:12,59.50,98%,The man wrote the best books of his generation. And he was a...,Win (1 of 2)
67.,2017-07-04 02:57:55,83.38,99%,We look not at the things which are what you would call seen...,Win (1 of 5)
66.,2017-07-04 02:56:52,69.44,98%,"And as we let our own light shine, we unconsciously give oth...",No win (3 of 5)
65.,2017-07-04 02:54:27,56.24,97%,"As a child, I was aware that, at night, infrared vision woul...",No win (5 of 5)
64.,2017-07-04 02:53:20,61.97,98%,"Now, imagine a universe in which the laws of physics are as ...",Win (1 of 3)
63.,2017-07-04 02:50:49,55.17,97%,"For thirty years, I've sailed the seas and seen good and bad...",Win (1 of 2)
62.,2017-07-04 02:48:26,61.14,98%,His chess ideas are like pieces of his body he's reluctant t...,No win (3 of 5)
61.,2017-07-04 02:47:02,63.40,98%,Do not go gentle into that good night. Old age should burn a...,No win (4 of 5)
60.,2017-07-04 02:44:55,59.51,97%,We go waiting for the stars to come showering down. From Mos...,No win (4 of 4)
59.,2017-07-04 02:43:22,61.41,97%,"You know, Michael; now that you're so respectable, I think y...",No win (2 of 5)
58.,2017-07-04 02:36:50,62.51,98%,If there really is a complete unified theory that governs ev...,No win (2 of 5)
57.,2017-07-03 06:54:33,65.74,99%,He soon felt that the fulfillment of his desires gave him on...,No win (2 of 5)
56.,2017-07-03 06:53:13,60.74,97%,Love can touch us one time and last for a lifetime and never...,No win (2 of 4)
55.,2017-07-03 06:52:00,56.14,98%,"Stand tall, boy. Have some respect for yourself. Don't you k...",Win (1 of 2)
54.,2017-07-03 06:06:11,64.83,97%,"Ticking away the moments that make up a dull day, you fritte...",Win (1 of 3)
53.,2017-07-03 06:04:43,59.70,97%,"I know I'm supposed to help you, but I can't. Instead of bei...",Win (1 of 3)
52.,2017-07-03 06:03:18,76.72,99%,"No matter how bad things are, you can always make things wor...",Win (1 of 3)
51.,2017-07-03 06:01:56,73.85,99%,"As civilizations grew, humans spread out across the face of ...",Win (1 of 3)
50.,2017-07-03 06:00:07,57.45,97%,"Our world, with its rules of causality, has trained us to be...",Win (1 of 3)
49.,2017-07-03 05:57:45,55.06,97%,Well this seems to be a waste of my time. That is nine hundr...,Win (1 of 3)
48.,2017-07-03 05:55:47,65.06,97%,"What really knocks me out is a book that, when you're all do...",Win (1 of 3)
47.,2017-07-03 05:54:07,63.40,98%,"Whoever could make two ears of corn, or two blades of grass,...",Win (1 of 3)
46.,2017-07-03 05:52:48,58.97,96%,Break my heart. Break it a thousand times if you like. It wa...,Win (1 of 2)
45.,2017-07-03 05:51:35,66.29,97%,"That's right, and the one who wins gets a prize, only there ...",Win (1 of 2)
44.,2017-07-03 05:50:08,74.40,99%,You're not like the others. I've seen a few; I know. When I ...,Win (1 of 2)
43.,2017-07-03 05:48:02,59.65,96%,"Do you know why you're not afraid to die, Spock? You're more...",Win (1 of 3)
42.,2017-07-03 05:45:02,61.55,98%,"I'm Banta, the blacksmith. I'm forging a bell for the King t...",Win (1 of 2)
41.,2017-07-03 05:43:05,65.24,99%,"To move through a tree of paths using hill climbing, proceed...",Win (1 of 2)
40.,2017-07-03 05:41:07,49.31,97%,"What about Tony? You know, Bullet Tooth Tony. He'll find you...",Win (1 of 2)
39.,2017-07-03 05:36:52,64.91,97%,"My youth is slipping, my youth is slipping away. Safe in mon...",Win (1 of 3)
38.,2017-07-03 05:35:22,62.70,97%,Not only do we come into fairly regular contact with people ...,Win (1 of 2)
37.,2017-07-03 05:33:51,68.25,99%,"I saw her today at the reception, a glass of wine in her han...",Win (1 of 3)
36.,2017-07-03 05:32:23,57.21,98%,"After water, protein is the most plentiful substance in our ...",Win (1 of 3)
35.,2017-07-03 05:30:39,65.86,98%,"Like painting, most software is intended for a human audienc...",Win (1 of 3)
34.,2017-07-03 05:28:58,67.36,98%,"Baby, ever wondered why I could make you laugh and cry? Ecli...",Win (1 of 3)
33.,2017-07-03 05:27:28,57.42,96%,The streets were cleared by a Critical Mass bike ride and we...,Win (1 of 3)
32.,2017-07-03 05:20:31,56.49,97%,He had changed since his New Haven years. Now he was a sturd...,Win (1 of 3)
31.,2017-07-03 05:18:54,61.62,96%,Confession is not betrayal. What you say or do doesn't matte...,Win (1 of 3)
30.,2017-07-03 05:17:38,59.13,96%,"Keying text quickly is important, but it is more important t...",Win (1 of 3)
29.,2017-07-03 05:16:29,59.67,97%,I have often wished to be human. I study people carefully in...,Win (1 of 3)
28.,2017-07-03 05:15:04,64.54,98%,"I don't believe in an interventionist God, but I know, darli...",Win (1 of 3)
27.,2017-07-03 05:13:16,61.38,99%,"All at sea again, and now my hurricanes, have brought down t...",Win (1 of 3)
26.,2017-07-03 05:11:35,68.65,99%,"Yes, they think we're dumb. They call us the common people. ...",Win (1 of 3)
25.,2017-07-03 05:10:01,58.27,97%,"Everyone said I was daft to build a castle on a swamp, but I...",Win (1 of 3)
24.,2017-07-03 03:49:36,60.11,98%,"In the old days of the Cold War, Zukovsky worked for the KGB...",Win (1 of 4)
23.,2017-06-30 07:30:41,72.80,99%,"You see, I'm moving on fast. Finally got the pass, gonna lea...",Win (1 of 4)
22.,2017-06-30 07:29:21,58.95,98%,Heaven did not seem to be my home; and I broke my heart with...,Win (1 of 4)
21.,2017-06-30 07:27:33,72.88,98%,What incensed him the most was the blatant jokes of the ones...,Win (1 of 4)
20.,2017-06-30 07:26:08,59.40,97%,How can you see into my eyes like open doors leading you dow...,Win (1 of 4)
19.,2017-06-30 07:24:15,59.04,98%,"Padre, these are subtleties! We are not concerned with motiv...",Win (1 of 3)
18.,2017-06-30 05:46:45,60.68,99%,Because the peoples of Micronesia and Palau did not have a w...,Win (1 of 4)
17.,2017-06-30 05:44:56,65.84,98%,When we got to the Mint I parked on the street in front of t...,Win (1 of 4)
16.,2017-06-30 05:43:36,71.34,98%,"Was it all put into words, or did both understand that they ...",Win (1 of 4)
15.,2017-06-30 05:42:07,60.35,96%,Plato is always concerned to advocate views that will make p...,Win (1 of 4)
14.,2017-06-30 05:40:31,62.50,98%,"Because some men aren't looking for anything logical, like m...",Win (1 of 4)
13.,2017-06-30 05:38:54,59.60,98%,All music is what awakes from you when you are reminded by t...,Win (1 of 3)
12.,2017-06-30 05:31:07,56.86,97%,Do you know I've been sitting here thinking to myself: that ...,Win (1 of 3)
11.,2017-06-30 05:28:47,45.18,97%,Scissors cuts paper. Paper covers rock. Rock crushes lizard....,Win (1 of 3)
10.,2017-06-30 05:17:51,59.68,97%,"He started running, up and up, until he hurled himself into ...",Win (1 of 4)
9.,2017-06-30 05:15:36,58.79,96%,"Precious are the dead that lie there, every stone over them ...",Win (1 of 5)
8.,2017-06-30 05:13:27,58.10,97%,Unlike the other four senses located in the logical regions ...,Win (1 of 4)
7.,2017-06-30 05:11:32,60.26,98%,We live in an age when people do more writing than they have...,Win (1 of 4)
6.,2017-06-30 05:09:38,62.48,98%,"Well, a scavenger hunt is exactly like a treasure hunt, exce...",Win (1 of 5)
5.,2017-06-30 05:06:44,61.77,97%,If I fling one bag of trash out of my car window and onto th...,Win (1 of 5)
4.,2017-06-30 05:05:03,58.40,97%,The supreme question about a work of art is out of how deep ...,Win (1 of 5)
3.,2017-06-30 05:03:02,54.24,96%,"The rest of my attention is back at the offices of Facebook,...",Win (1 of 3)
2.,2017-06-30 05:00:46,59.49,97%,I'll tell you a secret. Something they don't teach you in yo...,Win (1 of 4)
1.,2017-06-30 04:58:16,51.80,98%,The process of determining what pixels should be written for...,Win (1 of 5)
