279.,2014-05-31 17:31:15,130.74,100%,Since every piece of matter in the Universe is in some way a...,Win (1 of 5)
278.,2014-05-27 17:40:37,106.31,99%,"Padre, these are subtleties! We are not concerned with motiv...",Win (1 of 3)
277.,2014-05-27 17:39:31,118.91,94%,Let me tell you why you're here. You're here because you kno...,No win (2 of 2)
276.,2014-05-24 15:23:34,115.55,94%,"In the casino, the cardinal rule is to keep them playing and...",No win (3 of 3)
275.,2014-05-24 15:22:59,113.78,99%,"Do you smell that? Napalm, son. Nothing else in the world sm...",No win (2 of 3)
274.,2014-05-24 15:22:25,121.82,97%,"Because they're at the bottom of the scale, nerds are a safe...",No win (2 of 3)
273.,2014-05-24 15:21:31,106.03,100%,"It turned out that the sweet-talking, tattoo-sporting pikey ...",No win (2 of 2)
272.,2014-05-24 15:11:58,120.53,97%,I have quit three jobs and been fired from all the rest. Get...,No win (2 of 5)
271.,2014-05-24 15:11:10,132.40,100%,"I hope that whoever you are, you escape this place. I hope t...",Win (1 of 5)
270.,2014-05-24 15:10:21,129.82,100%,I suddenly had the impression that I had been left all alone...,Win (1 of 4)
269.,2014-05-24 15:09:41,119.60,100%,If there is one thing the history of evolution has taught us...,No win (2 of 5)
268.,2014-05-24 15:09:03,124.93,100%,"If you really want to hear about it, the first thing you'll ...",No win (2 of 4)
267.,2014-05-24 15:08:11,120.04,100%,We all know people who are very bright but who do not always...,Win (1 of 3)
266.,2014-05-24 15:07:32,110.99,98%,The only preventive thing I do is wash clothes after buying ...,Win (1 of 4)
265.,2014-05-24 15:06:51,120.90,99%,"Look and think as far ahead as possible. Often, a driver's n...",Win (1 of 3)
264.,2014-05-24 15:06:04,102.11,98%,"The Orient was almost a European invention, and had been sin...",Win (1 of 2)
263.,2014-05-24 15:05:23,117.36,97%,Quality humor doesn't just deliver one gag and then tax the ...,Win (1 of 2)
262.,2014-05-24 15:04:28,111.33,99%,"As the netted bag says, this potato was grown in Idaho, that...",Win (1 of 2)
261.,2014-05-24 15:03:40,121.21,100%,"When you are typing on a typewriter, your input appears dire...",No win (2 of 3)
260.,2014-05-24 15:03:00,116.07,97%,San Francisco in the middle sixties was a very special time ...,Win (1 of 3)
259.,2014-05-24 15:02:12,131.73,100%,There's a hole in the world like a great black pit. And the ...,No win (2 of 3)
258.,2014-05-24 15:01:36,128.98,100%,Humans need to practice what they are learning a good deal b...,Win (1 of 3)
257.,2014-05-24 15:00:54,115.34,97%,Language is one of the keys to being human. It allows us to ...,Win (1 of 5)
256.,2014-05-24 15:00:06,119.98,96%,Popularity is only partially about individual attractiveness...,Win (1 of 2)
255.,2014-05-24 11:56:31,101.29,98%,"As the netted bag says, this potato was grown in Idaho, that...",Win (1 of 2)
254.,2014-05-24 11:50:13,118.98,95%,There's a piece of Maria in every song that I sing. And the ...,No win (2 of 4)
253.,2014-05-24 11:49:22,117.68,98%,We were playing checkers. I used to kid her once in a while ...,Win (1 of 3)
252.,2014-05-24 11:48:08,106.62,100%,I had a friend who was a heavy drinker. If somebody asked hi...,Win (1 of 4)
251.,2014-05-24 11:47:24,126.16,100%,I'd just like to point out that you were given every opportu...,Win (1 of 4)
250.,2014-05-24 11:46:27,121.58,99%,"Do you smell that? Napalm, son. Nothing else in the world sm...",Win (1 of 2)
249.,2014-05-24 11:45:48,96.23,99%,"In the English language, swearing is essential to effective ...",Win (1 of 3)
248.,2014-05-24 11:45:05,115.78,100%,"Well, it just so happens, this hacienda comes with its very ...",Win (1 of 2)
247.,2014-05-24 11:44:17,106.53,97%,"The goal of the true seeker is to become a sage, or superior...",Win (1 of 3)
246.,2014-05-24 11:41:28,114.63,99%,At first they had tried to keep the finding quiet. After all...,Win (1 of 2)
245.,2014-05-24 11:40:15,129.57,99%,"I'm so glad you came, I'm so glad you remembered, to see how...",Win (1 of 2)
244.,2014-05-24 11:39:36,111.15,99%,He canceled all his commitments and pulled together the most...,Win (1 of 4)
243.,2014-05-24 11:37:47,110.16,96%,But the two men were not lonely at all. At home they were co...,Win (1 of 3)
242.,2014-05-24 11:36:53,117.54,97%,I will need my spectacles and a clear head. Today I broke my...,No win (2 of 3)
241.,2014-05-24 11:36:21,122.53,96%,"One day you're in a funk about things, telling a friend that...",Win (1 of 2)
240.,2014-05-24 11:35:26,121.99,99%,"No matter how bad things are, you can always make things wor...",Win (1 of 2)
239.,2014-05-24 11:34:51,120.62,96%,So it's all come back round to breaking apart again. Breakin...,No win (2 of 3)
238.,2014-05-24 11:33:59,123.59,98%,The time has come for man to set himself a goal. The time ha...,Win (1 of 2)
237.,2014-05-24 11:33:06,113.14,98%,"Let's sort the buyers from the spiers, the needy from the gr...",Win (1 of 3)
236.,2014-05-24 11:32:14,109.91,97%,"I know a bloke who knows a bloke who knows a bloke. Now, I k...",Win (1 of 2)
235.,2014-05-24 11:31:45,90.68,93%,"Wilkinson County was a recipient of one of the new ""separate...",No win (2 of 2)
234.,2014-05-24 11:30:51,106.31,95%,"If I leave here tomorrow, would you still remember me? For I...",Win (1 of 2)
233.,2014-05-24 11:30:06,124.95,99%,"No matter how bad things are, you can always make things wor...",Win (1 of 3)
232.,2014-05-24 11:27:48,107.58,91%,"The less you do with the controls, the less chance of error....",No win (1 of 1)
231.,2014-05-24 11:27:01,127.73,99%,Every time I think of you I feel shot right through with a b...,Win (1 of 4)
230.,2014-05-24 11:26:02,123.44,94%,"The less you do with the controls, the less chance of error....",No win (2 of 3)
229.,2014-05-24 11:25:32,120.60,100%,I am learning about twenty new Italian words a day. Where am...,No win (1 of 1)
228.,2014-05-24 11:24:49,114.40,99%,A giant inverted steel pyramid is perfectly balanced on its ...,Win (1 of 4)
227.,2014-05-24 11:23:59,110.72,94%,"If I leave here tomorrow, would you still remember me? For I...",Win (1 of 5)
226.,2014-05-24 11:23:12,116.40,98%,You have to wonder: how do the machines know what Tasty Whea...,No win (2 of 3)
225.,2014-05-24 11:22:03,110.02,97%,"It was an effect of light: quick sunlight dappling, yellow l...",Win (1 of 3)
224.,2014-05-24 11:20:58,123.78,99%,The odds are that you will generally meet the worst of them....,Win (1 of 5)
223.,2014-05-24 11:20:17,106.66,90%,Too often writers believe that they can emphasize words by p...,No win (2 of 4)
222.,2014-05-24 11:19:10,115.12,97%,Too often writers believe that they can emphasize words by p...,Win (1 of 3)
221.,2014-05-24 11:18:17,110.31,97%,"Prior to the 1970's, because the United States had long been...",Win (1 of 3)
220.,2014-05-24 11:17:16,107.36,95%,"King, eh? Very nice. And how'd you get that, eh? By exploiti...",Win (1 of 4)
219.,2014-05-24 11:16:34,124.52,100%,"I don't want tickets, I need you to find me a painting, a cl...",No win (2 of 5)
218.,2014-05-24 11:15:49,114.72,97%,"Every craft and every investigation, and likewise every acti...",Win (1 of 2)
217.,2014-05-24 11:14:48,123.41,100%,I've flown seven million miles. And I've been waiting on peo...,Win (1 of 4)
216.,2014-05-24 11:13:49,129.10,100%,All the blue light reflections that color my mind when I sle...,Win (1 of 5)
215.,2014-05-24 11:13:00,138.25,100%,Well I woke in mid-afternoon cause that's when it all hurts ...,Win (1 of 5)
214.,2014-05-24 11:12:19,123.96,100%,Involuntarily I glanced seaward - and distinguished nothing ...,Win (1 of 4)
213.,2014-05-24 11:11:38,120.06,99%,"If you want to drive a race car well, whether to win an Indy...",Win (1 of 2)
212.,2014-05-24 11:10:37,119.92,98%,"I know that the idea of raising well-rounded, smarter kids c...",Win (1 of 4)
211.,2014-05-24 11:09:51,113.14,95%,"My darling, you have to be standing up in order to be able t...",Win (1 of 2)
210.,2014-05-24 11:09:09,136.07,100%,Now I want you to think and stop being a smart aleck. A man'...,Win (1 of 3)
209.,2014-05-24 11:08:01,144.28,100%,The example of painting can teach us not only how to manage ...,Win (1 of 3)
208.,2014-05-24 11:07:23,117.78,100%,"What about Tony? You know, Bullet Tooth Tony. He'll find you...",Win (1 of 4)
207.,2014-05-24 11:06:49,131.41,100%,Be impeccable with your word - speak with integrity. Say onl...,Win (1 of 2)
206.,2014-05-24 11:06:15,109.21,98%,Typing competitions provided another test of the Qwerty keyb...,Win (1 of 3)
205.,2014-05-24 11:05:23,123.70,92%,"She's got a smile that, it seems to me, reminds me of childh...",Win (1 of 2)
204.,2014-05-20 20:14:08,123.44,99%,"It was a marvelous night, the sort of night one only experie...",No win (2 of 4)
203.,2014-05-17 20:15:58,126.67,100%,"The world of typing has changed. In the 1970s, every busines...",Win (1 of 3)
202.,2014-05-17 20:15:00,124.44,100%,"The less you do with the controls, the less chance of error....",No win (2 of 4)
201.,2014-05-17 20:14:22,111.94,100%,"And today, Lady Liberty is under attack from the cable chann...",Win (1 of 4)
200.,2014-05-17 20:13:22,122.52,100%,"On a manual typewriter, strike the key with a nice sharp str...",Win (1 of 3)
199.,2014-05-17 20:12:49,98.22,96%,Buddhism addresses two major types of meditation. Vipassana ...,Win (1 of 3)
198.,2014-05-17 20:11:56,95.11,90%,You could choke a dozen donkeys on that! And you're haggling...,Win (1 of 2)
197.,2014-05-17 20:11:12,124.38,100%,Who is Keyser Soze? He is supposed to be Turkish. Some say h...,Win (1 of 2)
196.,2014-05-17 20:10:09,117.83,98%,But speculations on the structure of the universe also move ...,Win (1 of 3)
195.,2014-05-17 20:09:17,111.33,96%,"Let's sort the buyers from the spiers, the needy from the gr...",Win (1 of 3)
194.,2014-05-17 20:08:17,133.70,100%,"Many people limit themselves to leading boring, dull lives b...",Win (1 of 2)
193.,2014-05-17 20:07:31,121.78,99%,The invention of the wheel represented a major turning point...,No win (3 of 3)
192.,2014-05-17 20:06:36,121.98,99%,These contests provided ample opportunity to demonstrate the...,No win (2 of 3)
191.,2014-05-17 20:05:35,119.27,99%,"Let's sort the buyers from the spiers, the needy from the gr...",Win (1 of 3)
190.,2014-05-17 20:04:29,133.55,100%,You're going in the drink and I am going to make a cup of te...,Win (1 of 5)
189.,2014-05-17 20:03:51,132.06,98%,"For centuries, the battle of morality was fought between tho...",No win (2 of 3)
188.,2014-05-17 20:03:10,132.35,99%,There are very few things I wish I could change about those ...,No win (2 of 2)
187.,2014-05-17 20:02:22,133.03,100%,I've been thinking lots about my life and how quick I'd wash...,No win (2 of 5)
186.,2014-05-17 20:01:39,137.11,100%,The alternative to binge travel - the mini retirement - enta...,Win (1 of 2)
185.,2014-05-17 20:00:48,133.54,100%,"Now that I know that I'm breaking to pieces, I'll pull out m...",Win (1 of 4)
184.,2014-05-17 19:59:32,127.35,99%,"Right, I am going to tell you how this works. You're going i...",No win (2 of 2)
183.,2014-05-17 19:58:38,114.35,96%,"When I really worry about something, I don't just fool aroun...",Win (1 of 2)
182.,2014-05-17 19:57:52,98.99,96%,"Historian James C. Cobb has described southern identity as ""...",No win (3 of 3)
181.,2014-05-17 19:56:47,99.65,98%,Glancing through the 1977 Atlanta Yellow Pages reveals a cit...,Win (1 of 3)
180.,2014-05-17 19:56:05,124.32,97%,"Now that I know that I'm breaking to pieces, I'll pull out m...",Win (1 of 3)
179.,2014-05-17 19:55:09,115.67,99%,I still see things that are not here. I just choose not to a...,No win (2 of 4)
178.,2014-05-17 19:54:30,109.55,98%,My entire life had been on a predictable trajectory dominate...,Win (1 of 2)
177.,2014-05-17 19:53:35,114.29,97%,These contests provided ample opportunity to demonstrate the...,Win (1 of 2)
176.,2014-05-17 19:52:50,110.65,96%,"Because they're at the bottom of the scale, nerds are a safe...",Win (1 of 2)
175.,2014-05-17 19:51:53,106.59,97%,"Oh bliss! Bliss and heaven! Oh, it was gorgeousness and gorg...",No win (2 of 2)
174.,2014-05-17 19:50:55,120.57,100%,Who is Keyser Soze? He is supposed to be Turkish. Some say h...,Win (1 of 3)
173.,2014-05-17 19:49:53,122.01,98%,The ultimate way to compose is to be able to keyboard as fas...,Win (1 of 3)
172.,2014-05-17 19:49:04,130.58,100%,"I don't want tickets, I need you to find me a painting, a cl...",Win (1 of 3)
171.,2014-05-17 19:48:18,129.99,99%,I can already hear your tune calling me across the room. Whe...,Win (1 of 4)
170.,2014-05-17 19:47:20,142.07,100%,"I hope that whoever you are, you escape this place. I hope t...",Win (1 of 5)
169.,2014-05-17 19:46:37,108.04,96%,We may climb into the thin and cold realm of pure geometry a...,Win (1 of 5)
168.,2014-05-16 16:57:07,102.31,98%,"In 1966, Andy Dufresne escaped from Shawshank prison. All th...",No win (2 of 4)
167.,2014-05-16 16:55:59,129.16,100%,"Keying text quickly is important, but it is more important t...",Win (1 of 5)
166.,2014-05-16 16:55:23,125.08,99%,We were playing checkers. I used to kid her once in a while ...,Win (1 of 3)
165.,2014-05-16 16:53:57,124.84,99%,I must not fear. Fear is the mind killer. Fear is the little...,Win (1 of 5)
164.,2014-05-16 16:52:24,106.86,99%,"A lot of people, especially this one psychoanalyst guy they ...",No win (2 of 4)
163.,2014-05-16 16:51:05,118.34,94%,"This planet has, or rather had, a problem, which was this: m...",No win (3 of 5)
162.,2014-05-16 16:50:17,104.37,94%,Who has a safety deposit box full of money and six passports...,No win (3 of 5)
161.,2014-05-16 16:49:32,119.72,100%,"When we pulled out into the winter night and the real snow, ...",Win (1 of 4)
160.,2014-05-16 16:47:06,92.43,94%,"According to the popular story, the keyboard invented by Aug...",No win (3 of 5)
159.,2014-05-16 16:45:57,123.45,99%,One essential rule: make sure the joke is the last possible ...,No win (2 of 4)
158.,2014-05-16 16:42:28,118.10,97%,There is a theory which states that if anybody ever discover...,No win (2 of 2)
157.,2014-05-16 16:41:40,97.92,96%,"I rejected those answers; instead, I chose something differe...",No win (4 of 5)
156.,2014-05-16 16:40:48,116.36,100%,Most popular song lyrics have two sections - a verse and a b...,No win (3 of 4)
155.,2014-05-16 16:40:04,113.55,99%,"The idea of ""Mr. Right"" has been passed down over the genera...",No win (2 of 5)
154.,2014-05-16 16:39:06,112.77,99%,All the blue light reflections that color my mind when I sle...,No win (3 of 5)
153.,2014-05-16 16:38:24,125.71,100%,"When we conceive of the sweetest being ever, we are conceivi...",No win (2 of 3)
152.,2014-05-16 16:37:42,116.60,96%,"Contrary to the feminist cant, there are many things we can ...",No win (3 of 5)
151.,2014-05-16 16:37:01,127.01,100%,"Many people limit themselves to leading boring, dull lives b...",No win (2 of 5)
150.,2014-05-16 16:36:16,114.12,100%,"There are men who possess a peculiarly strong visual memory,...",Win (1 of 5)
149.,2014-05-16 16:35:31,120.76,100%,"I often see racers, particularly at the back of the pack in ...",No win (3 of 3)
148.,2014-05-16 16:34:29,107.28,95%,"Comfortable, Mullet? It seems sadly ironic that it's that ti...",No win (2 of 4)
147.,2014-05-16 16:33:49,132.47,100%,If I'm curt with you it's because time is a factor. I think ...,Win (1 of 3)
146.,2014-05-16 16:33:15,111.79,99%,Involuntarily I glanced seaward - and distinguished nothing ...,Win (1 of 3)
145.,2014-05-16 16:32:31,121.84,100%,And I will strike down upon thee with great vengeance and fu...,Win (1 of 2)
144.,2014-05-16 16:31:47,124.47,95%,"She's got a smile that, it seems to me, reminds me of childh...",No win (2 of 5)
143.,2014-05-16 16:31:07,121.26,99%,The beginner writes just twenty pieces. The professional wri...,No win (2 of 4)
142.,2014-05-16 16:30:25,124.48,100%,"Yet one fine day, in a fit of euphoria, after he had picked ...",Win (1 of 3)
141.,2014-05-16 16:29:36,122.37,99%,The chemistry of an element is determined by the manner in w...,No win (2 of 3)
140.,2014-05-16 16:28:12,118.72,99%,But speculations on the structure of the universe also move ...,Win (1 of 2)
139.,2014-05-15 18:50:58,95.46,97%,"The National Rifle Association says that, ""Guns don't kill p...",No win (3 of 5)
138.,2014-05-15 18:50:04,94.71,92%,I still see things that are not here. I just choose not to a...,No win (2 of 4)
137.,2014-05-15 18:49:16,86.79,95%,"Double, double, toil and trouble; fire burn, and cauldron bu...",No win (2 of 5)
136.,2014-05-15 18:48:03,119.23,100%,"In the late 1960s, a growing number of people became concern...",Win (1 of 3)
135.,2014-05-15 18:47:07,98.90,98%,"In the English language, swearing is essential to effective ...",Win (1 of 4)
134.,2014-05-15 18:46:27,105.23,95%,"My name is Turkish. Funny name for an Englishman, I know. My...",Win (1 of 3)
133.,2014-05-15 18:45:24,99.38,95%,You could choke a dozen donkeys on that! And you're haggling...,No win (3 of 3)
132.,2014-05-15 18:44:30,129.61,98%,One thing I've learned in the last seven years: in every gam...,Win (1 of 2)
131.,2014-05-15 18:43:48,126.76,99%,"Ticking away the moments that make up a dull day, you fritte...",Win (1 of 2)
130.,2014-05-15 18:42:39,120.35,98%,"The only people for me are the mad ones, the ones who are ma...",No win (1 of 1)
129.,2014-05-15 18:41:46,119.79,100%,"A little boy went out to play. When he opened his door, he s...",No win (2 of 2)
128.,2014-05-15 18:41:15,111.09,98%,"Common knowledge has bicyclists always riding into the wind,...",Win (1 of 3)
127.,2014-05-15 18:40:06,93.56,95%,"Prior to the 1970's, because the United States had long been...",Win (1 of 3)
126.,2014-05-15 18:38:50,122.72,100%,Commas and periods always go inside quotation marks. Colons ...,Win (1 of 5)
125.,2014-05-15 18:37:56,106.48,95%,"I know that the idea of raising well-rounded, smarter kids c...",No win (3 of 5)
124.,2014-05-15 18:36:59,109.87,99%,From compositional considerations the tomato layer would be ...,Win (1 of 3)
123.,2014-05-15 18:35:54,123.90,100%,Don't take anything personally - nothing others do is becaus...,Win (1 of 5)
122.,2014-05-15 18:35:17,126.97,100%,Groups of illegal miners smuggle themselves down in freight ...,Win (1 of 3)
121.,2014-05-15 18:34:38,121.48,97%,It was hard to toss things I had once thought were valuable ...,Win (1 of 3)
120.,2014-05-15 18:33:39,127.05,100%,There is something about yourself that you don't know. Somet...,Win (1 of 2)
119.,2014-05-15 18:32:55,103.15,94%,"They knew they were privileged to have these choices, but th...",Win (1 of 5)
118.,2014-05-15 18:31:49,129.10,100%,"I had a job, I had a girl. I had something going, mister, in...",Win (1 of 4)
117.,2014-05-15 18:31:04,119.89,100%,Instead of hiring workers during the peak hog kill in the wi...,Win (1 of 4)
116.,2014-05-15 18:30:12,103.12,97%,"She looked terrific. I said to myself, ""Maybe she's going to...",Win (1 of 4)
115.,2014-05-15 18:29:00,134.60,100%,"But no matter how effective the lesson was, I never really u...",Win (1 of 4)
114.,2014-05-15 18:28:18,113.79,96%,Your inner child will be happy to know that when it comes to...,No win (2 of 5)
113.,2014-05-15 18:27:31,113.31,99%,"In the witch trials, it was nearly impossible to provide com...",Win (1 of 4)
112.,2014-05-15 18:26:24,101.87,98%,The evidence in the standard history of Qwerty versus Dvorak...,No win (3 of 4)
111.,2014-05-15 18:25:15,115.26,100%,"I did my best, it wasn't much. I couldn't feel, so I tried t...",Win (1 of 4)
110.,2014-05-15 18:24:42,112.64,97%,Any finite number divided by infinity is as near to nothing ...,Win (1 of 5)
109.,2014-05-15 18:23:56,109.97,98%,"I'd been walking for hours and, as usual, I'd lost track of ...",Win (1 of 2)
108.,2014-05-15 18:22:53,133.93,100%,"You have a class of young strong men and women, and they wan...",Win (1 of 3)
107.,2014-05-15 18:22:15,101.73,98%,Glancing through the 1977 Atlanta Yellow Pages reveals a cit...,No win (3 of 3)
106.,2014-05-15 18:21:22,122.87,100%,I am learning about twenty new Italian words a day. Where am...,Win (1 of 3)
105.,2014-05-15 18:20:41,127.22,99%,But the two men were not lonely at all. At home they were co...,No win (2 of 3)
104.,2014-05-15 18:20:05,119.08,98%,All that year the animals worked like slaves. But they were ...,Win (1 of 4)
103.,2014-05-15 18:19:24,118.65,96%,"A zealot might be, for instance, an individual with a person...",Win (1 of 4)
102.,2014-05-15 18:18:25,141.02,100%,Good games offer players a set of challenging problems and t...,Win (1 of 2)
101.,2014-05-15 18:17:23,109.45,98%,The pickpockets' profession demands extraordinary nimbleness...,No win (2 of 3)
100.,2014-05-15 18:16:36,123.64,99%,Any finite number divided by infinity is as near to nothing ...,Win (1 of 2)
99.,2014-05-15 18:15:41,113.84,97%,Paper as we know it today was invented in China in around 10...,No win (2 of 3)
98.,2014-05-15 18:14:54,133.90,99%,"One day you're in a funk about things, telling a friend that...",No win (2 of 4)
97.,2014-05-15 18:13:36,114.32,99%,"The only people for me are the mad ones, the ones who are ma...",Win (1 of 5)
96.,2014-05-15 18:12:28,108.89,98%,"Warmer water increases the moisture content of storms, and w...",Win (1 of 3)
95.,2014-05-15 18:11:39,117.91,100%,In order to become an elf I filled out ten pages' worth of f...,Win (1 of 3)
94.,2014-05-15 18:08:40,109.30,94%,It is by will alone I set my mind in motion. It is by the ju...,Win (1 of 3)
93.,2014-05-15 18:07:54,112.29,91%,The place to improve the world is first in one's own heart a...,No win (3 of 5)
92.,2014-05-15 18:07:13,119.70,99%,I don't believe in painted roses or bleeding hearts while bu...,Win (1 of 4)
91.,2014-05-15 18:06:36,127.44,100%,Stab a sorry heart with your favorite finger. Paint the whol...,Win (1 of 5)
90.,2014-05-15 18:06:02,122.74,98%,We often believe the more we practice a skill or technique -...,No win (2 of 4)
89.,2014-05-15 18:05:09,126.33,97%,Now I want you to think and stop being a smart aleck. A man'...,No win (2 of 4)
88.,2014-05-15 18:04:32,126.00,99%,"Whether they use the title or not, many lyrics have evocativ...",Win (1 of 5)
87.,2014-05-15 18:03:56,142.88,100%,There are very few things I wish I could change about those ...,Win (1 of 5)
86.,2014-05-15 18:02:58,135.53,100%,"This planet has, or rather had, a problem, which was this: m...",Win (1 of 4)
85.,2014-05-15 18:01:16,114.98,98%,The beginner writes just twenty pieces. The professional wri...,Win (1 of 4)
84.,2014-05-15 18:00:18,123.53,94%,You've got a way to keep me on your side. You give me cause ...,Win (1 of 5)
83.,2014-05-15 17:59:40,108.43,99%,Instead of hiring workers during the peak hog kill in the wi...,No win (1 of 1)
82.,2014-05-15 17:58:35,114.76,97%,The basis of the Aztecs' success in creating a great state a...,Win (1 of 4)
81.,2014-05-15 17:57:42,124.93,97%,One essential rule: make sure the joke is the last possible ...,Win (1 of 3)
80.,2014-05-15 17:56:57,120.71,100%,"Picking up the pieces, half alive in a nine 'til five, vacan...",Win (1 of 3)
79.,2014-05-15 17:56:14,114.23,100%,"When I was a kid, you never saw radicchio in the produce sec...",Win (1 of 4)
78.,2014-05-15 17:55:18,119.32,97%,There are very few things I wish I could change about those ...,Win (1 of 4)
77.,2014-05-15 17:54:33,117.64,99%,Typing competitions provided another test of the Qwerty keyb...,Win (1 of 4)
76.,2014-05-15 17:53:43,108.33,96%,"I'd been walking for hours and, as usual, I'd lost track of ...",Win (1 of 4)
75.,2014-05-15 17:52:44,112.64,96%,Is it really necessary to send that email? The more emails y...,No win (2 of 4)
74.,2014-05-15 17:52:04,109.32,99%,"In short order, Carter then proceeded to kill any chance he ...",Win (1 of 2)
73.,2014-05-15 17:50:55,122.53,99%,Consider this: Is the pious being loved by the gods because ...,Win (1 of 3)
72.,2014-05-15 17:49:58,117.07,99%,Once you get into the processed foods you have to be a fairl...,Win (1 of 3)
71.,2014-05-15 17:49:18,106.04,96%,"Often, we assume that a familiar situation will be but a rep...",Win (1 of 2)
70.,2014-05-15 17:48:33,129.81,97%,There are very few things I wish I could change about those ...,Win (1 of 5)
69.,2014-05-15 17:47:48,112.93,98%,"When we pulled out into the winter night and the real snow, ...",No win (2 of 2)
68.,2014-05-15 17:46:41,134.53,100%,It was one of those days when it's a minute away from snowin...,No win (2 of 3)
67.,2014-05-15 17:45:51,106.34,96%,"Today, you people are no longer maggots. Today, you are Mari...",Win (1 of 5)
66.,2014-05-15 17:44:55,140.48,100%,"What good's a reward if you ain't around to use it? Besides,...",Win (1 of 2)
65.,2014-05-15 17:44:27,122.17,99%,At first they had tried to keep the finding quiet. After all...,Win (1 of 2)
64.,2014-05-15 17:43:39,127.36,99%,"Because they're at the bottom of the scale, nerds are a safe...",Win (1 of 2)
63.,2014-05-15 17:42:51,131.91,100%,I thought climbing the Devil's Thumb would fix all that was ...,Win (1 of 2)
62.,2014-05-15 17:42:17,120.53,98%,"When I really worry about something, I don't just fool aroun...",No win (2 of 2)
61.,2014-05-15 17:41:41,124.63,99%,And I will strike down upon thee with great vengeance and fu...,No win (3 of 4)
60.,2014-05-15 17:41:07,130.94,98%,"She's got a smile that, it seems to me, reminds me of childh...",No win (2 of 3)
59.,2014-05-15 17:40:29,107.71,95%,The recipe for turning fruit into wine goes something like t...,No win (3 of 3)
58.,2014-05-15 17:39:23,134.38,99%,So it's all come back round to breaking apart again. Breakin...,No win (3 of 5)
57.,2014-05-15 17:38:33,133.51,100%,For it is not enough to have a good mind; the main thing is ...,No win (2 of 5)
56.,2014-05-15 17:37:52,119.34,94%,The unknown future rolls toward us. I face it for the first ...,No win (2 of 4)
55.,2014-05-15 17:37:24,120.99,96%,We all know people who are very bright but who do not always...,No win (2 of 3)
