54.,2014-05-15 17:36:40,122.54,99%,Facts can be thought of as objective or subjective. Things a...,No win (2 of 3)
53.,2014-05-15 17:35:35,107.82,95%,"And I said, I don't care if they lay me off either, because ...",No win (2 of 4)
52.,2014-05-15 17:34:30,115.56,97%,"If you don't get what you want, you suffer; if you get what ...",No win (2 of 3)
51.,2014-05-15 17:23:14,107.65,97%,The recipe for turning fruit into wine goes something like t...,Win (1 of 5)
50.,2014-05-15 17:22:04,128.74,99%,It was hard to toss things I had once thought were valuable ...,Win (1 of 5)
49.,2014-05-15 17:20:51,103.82,98%,"In May 1980, Fidel Castro opened the harbor at Mariel, Cuba ...",Win (1 of 3)
48.,2014-05-15 17:19:54,114.30,95%,Groups of illegal miners smuggle themselves down in freight ...,Win (1 of 4)
47.,2014-05-15 17:18:56,120.69,99%,"Everyone said I was daft to build a castle on a swamp, but I...",Win (1 of 4)
46.,2014-05-15 17:17:57,110.28,98%,"Some pilots like the excitement of our missions, knowing tha...",Win (1 of 3)
45.,2014-05-15 17:17:11,97.65,91%,"However, let us leave aside the philosophical, social, and e...",No win (2 of 2)
44.,2014-05-15 17:13:55,125.01,99%,"On a manual typewriter, strike the key with a nice sharp str...",Win (1 of 3)
43.,2014-05-15 16:56:55,119.91,99%,There are two places on Earth that serve as canaries in the ...,Win (1 of 5)
42.,2014-05-15 16:55:55,133.00,96%,"In the casino, the cardinal rule is to keep them playing and...",Win (1 of 2)
41.,2014-05-15 16:54:57,108.13,97%,"I often see racers, particularly at the back of the pack in ...",Win (1 of 2)
40.,2014-05-15 16:53:46,105.48,94%,"The idea of ""Mr. Right"" has been passed down over the genera...",No win (3 of 3)
39.,2014-05-15 16:52:12,120.02,99%,"Hello, hello, hello, is there anybody in there? Just nod if ...",No win (2 of 5)
38.,2014-05-15 16:51:26,115.80,99%,"When I was your age, television was called books. And this i...",Win (1 of 5)
37.,2014-05-15 16:50:42,124.98,97%,There are very few things I wish I could change about those ...,Win (1 of 4)
36.,2014-05-15 16:49:44,131.94,99%,"Whether they use the title or not, many lyrics have evocativ...",Win (1 of 2)
35.,2014-05-15 16:49:11,109.35,100%,"It's a sunny, woodsy day in Lumberton, so get those chainsaw...",Win (1 of 3)
34.,2014-05-15 16:34:26,116.56,99%,We don't need no education. We don't need no thought control...,Win (1 of 3)
33.,2014-05-15 16:33:34,132.04,99%,"When the light of life has gone, no change for the meter. Th...",Win (1 of 5)
32.,2014-05-15 16:32:45,120.08,99%,"There is no pain, you are receding. A distant ship smoke on ...",Win (1 of 3)
31.,2014-05-15 16:31:30,125.46,99%,It doesn't mean much to be able to filter out most present-d...,Win (1 of 3)
30.,2014-05-15 16:29:52,130.67,99%,The alternative to binge travel - the mini retirement - enta...,Win (1 of 3)
29.,2014-05-15 16:29:08,117.26,99%,"Thirdly, however, these wars could now be waged with the new...",Win (1 of 3)
28.,2014-05-15 16:28:17,74.87,84%,"Listen, strange women lyin' in ponds distributin' swords is ...",Win (1 of 4)
27.,2014-05-15 16:27:13,97.33,99%,What? A swallow carrying a coconut? It's not a question of w...,Win (1 of 4)
26.,2014-05-15 16:26:21,113.19,99%,And I will strike down upon thee with great vengeance and fu...,No win (2 of 5)
25.,2014-05-15 16:25:49,92.66,91%,Be impeccable with your word - speak with integrity. Say onl...,No win (3 of 3)
24.,2014-05-15 16:25:00,121.08,100%,"I was hugely impressed. Kirk, I mean Shatner, was the ultima...",Win (1 of 3)
23.,2014-05-15 16:22:23,122.63,99%,"When she returns to the forum page, her post is there. It is...",Win (1 of 5)
22.,2014-05-15 16:21:30,102.49,99%,I had a friend who was a heavy drinker. If somebody asked hi...,Win (1 of 4)
21.,2014-05-15 16:20:45,111.17,98%,I sincerely believe that if women study male lessons on conc...,Win (1 of 5)
20.,2014-05-15 16:18:09,97.44,94%,The pickpockets' profession demands extraordinary nimbleness...,Win (1 of 3)
19.,2014-05-15 16:17:30,106.31,85%,Remember that humor is written backwards. That means you fir...,Win (1 of 2)
18.,2014-05-15 16:14:49,101.61,93%,The beginner writes just twenty pieces. The professional wri...,Win (1 of 5)
17.,2014-05-15 16:13:53,112.31,99%,"Throughout my academic career, I'd given some pretty good ta...",Win (1 of 4)
16.,2014-05-15 16:13:16,106.63,98%,"Yet one fine day, in a fit of euphoria, after he had picked ...",Win (1 of 4)
15.,2014-05-15 16:12:23,122.09,99%,I will need my spectacles and a clear head. Today I broke my...,Win (1 of 5)
14.,2014-05-15 16:11:44,107.43,98%,At first they had tried to keep the finding quiet. After all...,Win (1 of 5)
13.,2014-05-15 16:10:43,90.35,97%,"Listen, strange women lyin' in ponds distributin' swords is ...",Win (1 of 3)
12.,2014-05-15 16:06:13,117.07,98%,"In general, many of these targets are easier marks if you ar...",Win (1 of 2)
11.,2014-05-15 16:04:58,99.54,97%,"Prior to the 1970's, because the United States had long been...",Win (1 of 3)
10.,2014-05-15 16:03:37,116.87,99%,"Get it straight buster - I'm not here to say please, I'm her...",Win (1 of 4)
9.,2014-05-15 16:02:54,108.49,96%,He canceled all his commitments and pulled together the most...,Win (1 of 4)
8.,2014-05-15 16:02:00,126.22,100%,I remember when we used to sit in the government yard in Tre...,Win (1 of 4)
7.,2014-05-15 16:00:54,105.10,98%,"Run to the bedroom, in the suitcase on the left, you'll find...",No win (1 of 1)
6.,2014-05-15 15:59:41,125.79,99%,"Well, the way they make shows is, they make one show. That s...",Win (1 of 2)
5.,2014-05-15 15:58:35,116.54,100%,If I'm curt with you it's because time is a factor. I think ...,Win (1 of 3)
4.,2014-05-15 15:57:51,90.97,98%,"Anyway, like I was saying, shrimp is the fruit of the sea. Y...",Win (1 of 3)
3.,2014-05-15 15:57:04,111.79,98%,"Samatha is a state in which the mind is brought to rest, foc...",No win (2 of 4)
2.,2014-05-15 15:55:58,112.95,100%,Danger is a topic you're often asked about as a sprinter. Th...,Win (1 of 2)
1.,2014-05-15 15:54:33,125.23,100%,There's a hole in the world like a great black pit. And the ...,Win (1 of 4)
