496.,2011-06-22 16:38:13,67.77,96%,There's a hole in the world like a great black pit. And the ...,Win (1 of 4)
495.,2011-06-22 16:37:31,59.34,93%,"Imagine a vast sheet of paper on which straight Lines, Trian...",No win (4 of 4)
494.,2011-06-22 16:35:37,53.71,94%,Lucid but wholly false recollections can easily be induced b...,No win (4 of 4)
493.,2011-06-22 16:33:53,61.19,94%,I don't know why he saved my life. Maybe in those last momen...,No win (2 of 3)
492.,2011-06-22 16:32:39,64.22,96%,"I don't believe in an interventionist God, but I know, darli...",No win (4 of 4)
491.,2011-06-19 16:38:45,59.87,94%,"He's got a two day head start on you, which is more than he ...",Win (1 of 4)
490.,2011-06-19 16:37:24,62.65,96%,Sparkling wines are wines that contain carbon dioxide bubble...,Win (1 of 4)
489.,2011-06-19 16:36:37,66.40,96%,It is possible that I already had some presentiment of my fu...,Win (1 of 2)
488.,2011-06-19 16:35:08,59.98,93%,"You found paradise in America. You had a good trade, made a ...",No win (3 of 3)
487.,2011-06-19 16:33:36,68.54,98%,Don't make assumptions - find the courage to ask questions a...,Win (1 of 5)
486.,2011-06-17 17:30:23,65.70,97%,But the two men were not lonely at all. At home they were co...,Win (1 of 2)
485.,2011-06-17 17:29:11,66.27,96%,We began to recognize in them a strange obsession. After all...,No win (3 of 5)
484.,2011-06-17 17:27:58,56.80,93%,At the time when Britain faced a plunge into chaos and darkn...,No win (2 of 4)
483.,2011-06-17 17:26:18,54.99,93%,Space is big. Really big. You just won't believe how vastly ...,No win (4 of 4)
482.,2011-06-17 17:25:16,51.05,94%,"What good's a reward if you ain't around to use it? Besides,...",No win (2 of 5)
481.,2011-06-17 17:24:23,63.67,94%,"Many people limit themselves to leading boring, dull lives b...",No win (2 of 4)
480.,2010-10-26 07:43:05,56.12,100%,One thing I've learned in the last seven years: in every gam...,No win (4 of 4)
479.,2010-10-26 07:41:45,53.26,100%,"Around midafternoon, the snow thinned into sleet, and some u...",No win (4 of 5)
478.,2010-10-25 10:29:58,64.51,100%,"Whether you're a student, secretary, office administrator, m...",Win (1 of 4)
477.,2010-10-25 10:29:03,45.47,100%,"Imagine this: Here we are, a plane full of grown human being...",No win (2 of 2)
476.,2010-10-19 11:30:11,60.58,100%,"The goal of the true seeker is to become a sage, or superior...",No win (3 of 4)
475.,2010-10-19 11:28:48,63.29,100%,"Good games stay within, but at the outer edge, of the player...",No win (4 of 5)
474.,2010-10-19 11:27:57,67.05,100%,One essential rule: make sure the joke is the last possible ...,No win (4 of 4)
473.,2010-10-07 09:34:26,58.18,100%,"There are two kinds of fibers in our muscles, red and white....",No win (3 of 5)
472.,2010-10-07 09:33:00,58.82,100%,It's the possibility of having a dream come true that makes ...,No win (3 of 3)
471.,2010-10-07 09:31:41,55.26,100%,"I went to the woods because I wished to live deliberately, t...",No win (3 of 3)
470.,2010-10-07 09:30:29,68.08,100%,But the two men were not lonely at all. At home they were co...,No win (2 of 4)
469.,2010-10-07 09:29:22,59.38,100%,There are still some places where you can get all you can ea...,No win (2 of 4)
468.,2010-07-14 12:57:13,54.92,100%,Sholes consulted with an educator who helped him analyze the...,No win (2 of 3)
467.,2010-07-14 12:55:25,66.69,100%,"No matter how bad things are, you can always make things wor...",No win (2 of 2)
466.,2010-07-14 12:53:58,61.50,100%,Parisian French is different from Provincial French and Germ...,Win (1 of 3)
465.,2010-07-14 12:28:10,67.73,100%,"It was a marvelous night, the sort of night one only experie...",Win (1 of 5)
464.,2010-07-13 17:56:51,64.60,100%,All that year the animals worked like slaves. But they were ...,Win (1 of 2)
463.,2010-07-13 17:54:49,58.05,100%,"My friend, I shall be pedagogic, and say you ought to start ...",Win (1 of 5)
462.,2010-07-13 17:53:40,60.55,100%,Gardeners know how to grow top-notch crops. They determine w...,Win (1 of 5)
461.,2010-07-13 17:51:20,49.23,100%,There's sometimes a buggy. How many drivers does a buggy hav...,No win (2 of 2)
460.,2010-06-10 13:05:55,59.49,100%,"Around midafternoon, the snow thinned into sleet, and some u...",Win (1 of 4)
459.,2010-06-09 06:53:49,58.15,100%,"When I really worry about something, I don't just fool aroun...",No win (2 of 3)
458.,2010-06-04 17:14:27,63.73,100%,She's got eyes of the bluest skies as if they thought of rai...,Win (1 of 3)
457.,2010-06-04 17:13:03,60.57,100%,"A computer needs a manager to administer its operations, jus...",No win (2 of 3)
456.,2010-06-04 17:12:06,59.95,100%,"I'm so glad you came, I'm so glad you remembered to see how ...",Win (1 of 2)
455.,2010-06-04 17:10:49,59.53,100%,"Imagine a vast sheet of paper on which straight Lines, Trian...",Win (1 of 3)
454.,2010-06-04 17:09:06,58.68,100%,"When you are typing on a typewriter, your input appears dire...",No win (2 of 2)
453.,2010-06-03 16:43:22,56.71,100%,Music finds a comfortable parallel with that of human langua...,No win (4 of 4)
452.,2010-06-03 16:41:32,61.89,100%,Gardeners know how to grow top-notch crops. They determine w...,Win (1 of 2)
451.,2010-06-03 16:39:27,57.78,100%,Gardeners know how to grow top-notch crops. They determine w...,No win (2 of 3)
450.,2010-06-03 16:38:07,72.13,100%,"Well, the way they make shows is, they make one show. That s...",No win (3 of 5)
449.,2010-06-03 16:30:02,66.63,100%,"I don't want tickets, I need you to find me a painting, a cl...",No win (2 of 2)
448.,2010-06-03 16:28:51,63.93,100%,"The melted mozzarella layer, which we shall designate MML, i...",No win (2 of 4)
447.,2010-05-27 11:15:09,60.86,100%,Every time I think of you I feel shot right through with a b...,No win (3 of 4)
446.,2010-05-27 09:40:50,64.01,100%,And I will strike down upon thee with great vengeance and fu...,No win (1 of 1)
445.,2010-05-27 09:39:58,54.49,100%,You have to wonder: how do the machines know what Tasty Whea...,No win (1 of 1)
444.,2010-05-27 09:21:51,56.97,100%,For it is not enough to have a good mind; the main thing is ...,No win (2 of 4)
443.,2010-05-25 16:30:31,58.28,100%,Everything we hold dear likewise resolves into its original ...,No win (2 of 3)
442.,2010-05-25 16:28:48,71.00,100%,The odds are that you will generally meet the worst of them....,No win (2 of 3)
441.,2010-05-25 16:27:41,61.79,100%,The unknown future rolls toward us. I face it for the first ...,Win (1 of 3)
440.,2010-05-25 16:26:43,62.59,100%,Step out the front door like a ghost into the fog where no o...,No win (2 of 2)
439.,2010-05-25 16:25:28,54.48,100%,He had spent enormous amounts of time at the great libraries...,No win (4 of 4)
438.,2010-05-25 16:22:51,67.68,100%,"If we all go for the blonde and block each other, not a sing...",Win (1 of 3)
437.,2010-05-25 16:20:45,52.50,100%,"Wilkinson County was a recipient of one of the new ""separate...",Win (1 of 3)
436.,2010-05-25 16:18:00,60.30,100%,I had the impression of being abandoned by everyone when the...,No win (3 of 4)
435.,2010-05-25 16:15:59,61.99,100%,From compositional considerations the tomato layer would be ...,No win (3 of 3)
434.,2010-05-25 16:14:03,67.69,100%,All time is all time. It does not change. It does not lend i...,No win (3 of 5)
433.,2010-05-25 16:12:54,53.54,100%,"Anyway, like I was saying, shrimp is the fruit of the sea. Y...",Win (1 of 3)
432.,2010-05-25 16:11:06,56.30,100%,Many wines have more than 14 percent alcohol because the win...,Win (1 of 3)
431.,2010-05-25 16:08:48,58.37,100%,The problem we now face is that this thin layer of atmospher...,No win (4 of 5)
430.,2010-05-25 16:06:56,66.30,100%,"A little boy went out to play. When he opened his door, he s...",Win (1 of 3)
429.,2010-05-25 16:04:10,71.72,100%,The place to improve the world is first in one's own heart a...,No win (2 of 3)
428.,2010-05-25 16:02:57,65.07,100%,And I will strike down upon thee with great vengeance and fu...,No win (2 of 5)
427.,2010-05-25 16:02:01,58.69,100%,For it is not enough to have a good mind; the main thing is ...,Win (1 of 3)
426.,2010-05-25 10:27:26,65.36,100%,"And in the world a heart of darkness, a firezone, where poet...",No win (1 of 1)
425.,2010-05-25 10:23:32,59.75,100%,"He started running, up and up, until he hurled himself into ...",No win (1 of 1)
424.,2010-05-25 10:21:52,69.50,100%,"We turn away to face the cold, enduring chill, as the day be...",No win (1 of 1)
423.,2010-05-25 10:20:21,71.03,100%,A glooming peace this morning with it brings. The sun for so...,No win (1 of 1)
422.,2010-05-25 10:19:03,72.41,100%,The place to improve the world is first in one's own heart a...,No win (1 of 1)
421.,2010-05-25 10:18:00,54.86,100%,I must nevertheless point out that our profession very close...,No win (1 of 1)
420.,2010-05-25 10:16:08,55.58,100%,"Warmer water increases the moisture content of storms, and w...",No win (1 of 1)
419.,2010-05-25 07:38:38,59.77,100%,I remember when we used to sit in the government yard in Tre...,No win (1 of 1)
418.,2010-05-25 07:36:07,66.36,100%,But speculations on the structure of the universe also move ...,No win (1 of 1)
417.,2010-05-25 07:34:48,65.53,100%,The example of painting can teach us not only how to manage ...,No win (1 of 1)
416.,2010-05-25 07:33:50,61.74,100%,Rhymes trap you into saying things you don't want to say. A ...,No win (1 of 1)
415.,2010-05-25 07:32:40,67.26,100%,"Many people limit themselves to leading boring, dull lives b...",No win (1 of 1)
414.,2010-05-25 07:31:28,52.80,100%,"The Orient was almost a European invention, and had been sin...",No win (1 of 1)
413.,2010-05-25 07:30:18,53.44,100%,We may climb into the thin and cold realm of pure geometry a...,No win (1 of 1)
412.,2010-05-24 07:14:05,50.76,100%,"You needn't take it any further, sir. You've proved to me th...",No win (3 of 5)
411.,2010-05-21 19:21:12,56.74,100%,In order to face down the danger that is stalking us and mov...,No win (1 of 1)
410.,2010-05-21 19:17:50,61.75,100%,"Good games stay within, but at the outer edge, of the player...",No win (2 of 3)
409.,2010-05-21 19:15:56,65.03,100%,"Thirdly, however, these wars could now be waged with the new...",No win (2 of 5)
408.,2010-05-21 19:12:54,63.11,100%,"Well, the way they make shows is, they make one show. That s...",No win (2 of 3)
407.,2010-05-21 10:58:54,61.52,100%,The alternative to binge travel - the mini retirement - enta...,No win (4 of 5)
406.,2010-05-21 10:52:59,57.87,100%,The wine list looks so imposing that you finally give up lab...,No win (2 of 5)
405.,2010-05-21 10:50:24,54.68,100%,"It's a sunny, woodsy day in Lumberton, so get those chainsaw...",No win (2 of 5)
404.,2010-05-21 10:49:15,60.38,100%,"But suddenly, I viddied that thinking was for the gloopy one...",Win (1 of 4)
403.,2010-05-21 10:47:57,66.70,100%,"Contrary to the feminist cant, there are many things we can ...",No win (2 of 3)
402.,2010-05-21 10:46:55,52.18,100%,He managed to open the cupboard door with his nose and found...,No win (3 of 5)
401.,2010-05-21 10:40:54,60.67,100%,"Often, we assume that a familiar situation will be but a rep...",No win (2 of 4)
400.,2010-05-21 10:39:38,59.18,100%,Your inner child will be happy to know that when it comes to...,Win (1 of 4)
399.,2010-05-21 10:38:18,65.10,100%,"One day you're in a funk about things, telling a friend that...",No win (1 of 1)
398.,2010-05-21 10:36:59,61.82,100%,"Ticking away the moments that make up a dull day, you fritte...",No win (2 of 2)
397.,2010-05-21 10:35:02,57.46,100%,"A computer needs a manager to administer its operations, jus...",No win (4 of 5)
396.,2010-05-21 10:34:13,55.50,100%,"Picking up the pieces, half alive in a nine 'til five, vacan...",Win (1 of 4)
395.,2010-05-21 10:32:57,59.65,100%,Language is one of the keys to being human. It allows us to ...,No win (4 of 5)
394.,2010-05-21 07:29:03,54.68,100%,The unknown future rolls toward us. I face it for the first ...,No win (4 of 5)
393.,2010-05-20 15:08:58,61.35,100%,The unknown future rolls toward us. I face it for the first ...,Win (1 of 4)
392.,2010-05-20 15:07:53,51.74,100%,"If I leave here tomorrow, would you still remember me? For I...",No win (3 of 4)
391.,2010-05-20 15:06:25,57.98,100%,"In short order, Carter then proceeded to kill any chance he ...",No win (2 of 4)
390.,2010-05-20 15:03:58,69.61,100%,Humans need to practice what they are learning a good deal b...,No win (3 of 4)
389.,2010-05-20 15:02:59,52.71,100%,"Picking up the pieces, half alive in a nine 'til five, vacan...",No win (4 of 4)
388.,2010-05-19 09:17:32,49.73,100%,"The National Rifle Association says that, ""Guns don't kill p...",No win (1 of 1)
387.,2010-05-19 09:15:37,58.83,100%,"No matter how bad things are, you can always make things wor...",No win (1 of 1)
386.,2010-05-19 09:13:37,69.13,100%,Good games offer players a set of challenging problems and t...,No win (1 of 1)
385.,2010-05-19 09:12:04,51.93,100%,And then he calls me a jerk and says the last guy who though...,No win (1 of 1)
384.,2010-05-19 09:10:45,63.50,100%,"You have a class of young strong men and women, and they wan...",No win (1 of 1)
383.,2010-05-19 09:09:03,65.33,100%,"I had a dream. There was our world, and the world was dark b...",No win (1 of 1)
382.,2010-05-19 09:07:43,52.09,100%,"I've heard there was a secret chord that David played, and i...",No win (1 of 1)
381.,2010-05-18 15:59:59,51.90,100%,We've arranged a global civilization in which most crucial e...,No win (2 of 2)
380.,2010-05-18 06:56:07,51.99,100%,"Life is not suffering; it's just that you will suffer it, ra...",No win (1 of 1)
379.,2010-05-17 09:58:12,46.43,100%,Who is Keyser Soze? He is supposed to be Turkish. Some say h...,No win (1 of 1)
378.,2010-05-14 06:54:18,53.80,100%,"Warmer water increases the moisture content of storms, and w...",No win (1 of 1)
377.,2010-05-14 06:52:47,56.95,100%,"Many people limit themselves to leading boring, dull lives b...",No win (1 of 1)
376.,2010-05-13 17:59:00,58.29,100%,In order to face down the danger that is stalking us and mov...,No win (1 of 1)
375.,2010-05-12 16:04:17,59.33,100%,The only preventive thing I do is wash clothes after buying ...,No win (3 of 5)
374.,2010-05-12 16:03:02,59.35,100%,"Let's sort the buyers from the spiers, the needy from the gr...",No win (2 of 3)
373.,2010-05-12 16:01:36,59.98,100%,The example of painting can teach us not only how to manage ...,No win (3 of 4)
372.,2010-05-12 07:27:24,56.36,100%,"Hi, and welcome to the future. San Dimas, California, 2688. ...",Win (1 of 2)
371.,2010-05-11 15:24:03,45.77,100%,The development of a living body of literature became indica...,No win (3 of 4)
370.,2010-05-11 15:21:12,55.30,100%,There was a stage and a PA up in western Massachusetts and t...,Win (1 of 5)
369.,2010-05-11 15:19:31,60.59,100%,Convection also plays a minor role because of the relative t...,No win (2 of 3)
368.,2010-05-11 15:18:20,52.62,100%,"Milt, with the excellent timing of a master comedy writer, w...",No win (2 of 4)
367.,2010-05-11 15:17:00,52.67,100%,"The boy has not a real choice, has he? Self-interest, the fe...",No win (3 of 4)
366.,2010-05-11 15:05:42,60.30,100%,The example of painting can teach us not only how to manage ...,No win (2 of 4)
365.,2010-05-11 15:00:48,58.19,100%,"When the light of life has gone, no change for the meter. Th...",No win (3 of 5)
364.,2010-05-11 14:59:31,54.55,100%,There's a hole in the world like a great black pit. And the ...,No win (4 of 5)
363.,2010-05-11 14:57:16,58.07,100%,"But, pray how could that which I spoke so many years ago, an...",No win (1 of 1)
362.,2010-05-11 14:26:09,54.60,100%,If I'm curt with you it's because time is a factor. I think ...,No win (1 of 1)
361.,2010-05-11 14:25:06,52.14,100%,I've seen things you people wouldn't believe. Attack ships o...,No win (1 of 1)
360.,2010-05-11 14:23:10,55.11,100%,There are still some places where you can get all you can ea...,No win (1 of 1)
359.,2010-05-11 14:21:28,58.61,100%,Language is one of the keys to being human. It allows us to ...,No win (1 of 1)
358.,2010-05-11 11:09:42,51.40,100%,I suddenly had the impression that I had been left all alone...,No win (1 of 1)
357.,2010-05-11 10:53:56,50.72,100%,Space is big. Really big. You just won't believe how vastly ...,No win (1 of 1)
356.,2010-05-11 10:30:39,53.61,100%,Overhead the albatross hangs motionless upon the air and dee...,Win (1 of 3)
355.,2010-05-11 10:28:47,56.99,100%,When considering the cultural significance of this intriguin...,No win (2 of 3)
354.,2010-05-11 10:27:31,71.30,100%,"The Earth is a world, the world is a ball, a ball in a game ...",No win (2 of 3)
353.,2010-05-11 10:26:02,62.42,100%,San Francisco in the middle sixties was a very special time ...,No win (3 of 3)
352.,2010-05-11 10:24:35,63.77,100%,"I went to the woods because I wished to live deliberately, t...",Win (1 of 5)
351.,2010-05-11 10:23:17,63.74,100%,Rhymes trap you into saying things you don't want to say. A ...,No win (3 of 4)
350.,2010-05-11 10:22:07,56.66,100%,"Kid, I've flown from one side of this galaxy to the other, a...",No win (4 of 5)
349.,2010-05-11 10:20:51,54.74,100%,"King, eh? Very nice. And how'd you get that, eh? By exploiti...",Win (1 of 4)
348.,2010-05-11 10:19:44,52.70,100%,"I don't want tickets, I need you to find me a painting, a cl...",No win (2 of 2)
347.,2010-05-11 08:02:59,52.16,100%,"If you are given too many choices, if you are forced to cons...",No win (1 of 1)
346.,2010-05-10 16:36:31,57.62,100%,The chemistry of an element is determined by the manner in w...,No win (1 of 1)
345.,2010-05-10 16:35:29,50.62,100%,"Do you smell that? Napalm, son. Nothing else in the world sm...",No win (1 of 1)
344.,2010-05-10 16:33:48,55.85,100%,"My name is Turkish. Funny name for an Englishman, I know. My...",No win (1 of 1)
343.,2010-05-10 16:31:58,59.19,100%,"If you are given too many choices, if you are forced to cons...",No win (1 of 1)
342.,2010-05-10 16:30:15,61.92,100%,Now I want you to think and stop being a smart aleck. A man'...,No win (1 of 1)
341.,2010-05-10 06:58:42,55.88,100%,Ideology: the process of making ideas. Certain artisans were...,No win (1 of 1)
340.,2010-05-09 19:03:33,55.99,100%,The ultimate way to compose is to be able to keyboard as fas...,No win (1 of 1)
339.,2010-05-09 19:01:23,48.84,100%,The evidence in the standard history of Qwerty versus Dvorak...,No win (1 of 1)
338.,2010-05-09 18:59:03,55.82,100%,Space is big. Really big. You just won't believe how vastly ...,No win (1 of 1)
337.,2010-05-09 18:56:56,60.64,100%,There's sometimes a buggy. How many drivers does a buggy hav...,No win (1 of 1)
336.,2010-05-09 18:54:58,53.27,100%,Many wines have more than 14 percent alcohol because the win...,No win (1 of 1)
335.,2010-05-09 18:52:09,57.10,100%,"Imagine a vast sheet of paper on which straight Lines, Trian...",No win (5 of 5)
334.,2010-05-09 18:49:35,63.90,100%,"The brain can be a tool. It can recall phone numbers, solve ...",No win (2 of 2)
333.,2010-05-09 18:47:23,52.51,100%,In order to become an elf I filled out ten pages' worth of f...,No win (3 of 3)
332.,2010-05-09 18:45:22,60.55,100%,Let's face it: there are tons of things in your home and lif...,No win (3 of 3)
331.,2010-05-09 16:25:27,51.01,100%,Yet the web of thought has no such creases and is more like ...,No win (1 of 1)
330.,2010-05-09 16:23:58,52.85,100%,The problem we now face is that this thin layer of atmospher...,No win (1 of 1)
329.,2010-05-09 16:21:33,57.80,100%,We began to recognize in them a strange obsession. After all...,No win (1 of 1)
328.,2010-05-09 16:19:09,60.33,100%,"As if that blind rage had washed me clean, rid me of hope; f...",No win (1 of 1)
327.,2010-05-09 16:17:54,57.40,100%,"The only people for me are the mad ones, the ones who are ma...",No win (1 of 1)
326.,2010-05-09 16:16:20,55.51,100%,Although the United Nations does not have the power to enfor...,No win (1 of 1)
325.,2010-05-09 16:15:03,58.24,100%,The basis of the Aztecs' success in creating a great state a...,No win (1 of 1)
324.,2010-05-09 16:13:24,65.56,100%,"Many people limit themselves to leading boring, dull lives b...",No win (1 of 1)
323.,2010-05-09 16:11:11,58.20,100%,Images of broken light which dance before me like a million ...,No win (3 of 4)
322.,2010-05-08 20:06:44,45.25,100%,Being able to quit things that don't work is integral to bei...,No win (1 of 1)
321.,2010-05-08 16:37:15,56.53,100%,"My darling, you have to be standing up in order to be able t...",No win (1 of 1)
320.,2010-05-08 16:36:04,56.01,100%,"But, pray how could that which I spoke so many years ago, an...",No win (1 of 1)
319.,2010-05-08 16:34:43,52.20,100%,"I know a bloke who knows a bloke who knows a bloke. Now, I k...",No win (1 of 1)
318.,2010-05-08 16:33:25,60.04,100%,I will need my spectacles and a clear head. Today I broke my...,No win (1 of 1)
317.,2010-05-08 16:32:34,60.53,100%,Let's face it: there are tons of things in your home and lif...,No win (1 of 1)
316.,2010-05-08 16:31:24,55.33,100%,"My friend, I shall be pedagogic, and say you ought to start ...",No win (1 of 1)
315.,2010-05-08 16:30:11,62.61,100%,The good news is that your child has a natural desire to do ...,No win (1 of 1)
314.,2010-05-08 16:29:15,56.00,100%,I can already hear your tune calling me across the room. Whe...,No win (1 of 1)
313.,2010-05-08 16:27:49,58.19,100%,Language is one of the keys to being human. It allows us to ...,No win (1 of 1)
312.,2010-05-08 16:26:37,52.34,100%,The treatment of atoms with more than one electron requires ...,No win (1 of 1)
311.,2010-05-08 16:24:39,56.85,100%,"I'd been walking for hours and, as usual, I'd lost track of ...",Win (1 of 3)
310.,2010-05-08 16:22:49,46.73,100%,"A lot of people, especially this one psychoanalyst guy they ...",Win (1 of 2)
309.,2010-05-08 14:56:09,50.66,100%,"Some pilots like the excitement of our missions, knowing tha...",Win (1 of 2)
308.,2010-05-08 14:54:38,52.45,100%,"Two years ago this property cost one million pounds. Today, ...",No win (2 of 5)
307.,2010-05-08 14:53:06,59.16,100%,"When I really worry about something, I don't just fool aroun...",No win (3 of 3)
306.,2010-05-08 14:51:58,55.85,100%,"Whenever you watch the mind, you withdraw consciousness from...",No win (1 of 1)
305.,2010-05-08 14:50:40,53.67,100%,The beginner writes just twenty pieces. The professional wri...,No win (1 of 1)
304.,2010-05-08 14:49:14,60.56,100%,I have quit three jobs and been fired from all the rest. Get...,No win (1 of 1)
303.,2010-05-08 14:47:57,59.87,100%,It is greatly to America's advantage that it is a congenial ...,No win (1 of 1)
302.,2010-05-08 13:23:29,49.99,100%,"The melted mozzarella layer, which we shall designate MML, i...",No win (3 of 3)
301.,2010-05-07 17:42:48,64.62,100%,"I went to the woods because I wished to live deliberately, t...",No win (1 of 1)
300.,2010-05-07 17:36:49,62.30,100%,I still see things that are not here. I just choose not to a...,No win (1 of 1)
299.,2010-05-07 17:35:41,53.15,100%,"He was rough around the edges. He'd been to school, but neve...",No win (1 of 1)
298.,2010-05-07 17:33:36,52.43,100%,"An essential characteristic of the superhero mythology is, t...",No win (1 of 1)
297.,2010-05-07 17:31:42,59.49,100%,"But, pray how could that which I spoke so many years ago, an...",No win (1 of 1)
296.,2010-05-07 17:30:28,54.24,100%,"I've heard there was a secret chord that David played, and i...",No win (1 of 1)
295.,2010-05-07 17:29:20,50.52,100%,"It's a sunny, woodsy day in Lumberton, so get those chainsaw...",No win (1 of 1)
294.,2010-05-07 17:28:00,49.88,100%,"Anyway, like I was saying, shrimp is the fruit of the sea. Y...",No win (1 of 1)
293.,2010-05-07 17:26:51,59.61,100%,The place to improve the world is first in one's own heart a...,No win (1 of 1)
292.,2010-05-07 17:25:37,53.84,100%,To an outsider's ear it sounds absurdly wild and ridiculous ...,No win (1 of 1)
291.,2010-05-07 17:24:35,59.95,100%,"In the casino, the cardinal rule is to keep them playing and...",No win (1 of 1)
290.,2010-05-07 17:23:34,46.35,100%,In 1969 four computers located around the country were in co...,No win (1 of 1)
289.,2010-05-07 17:20:41,54.92,100%,The inner surface of the cell wall touches the cytoplasmic m...,Win (1 of 3)
288.,2010-05-07 17:18:35,50.02,100%,I said that I would see you because I had heard that you wer...,No win (3 of 4)
287.,2010-05-07 17:15:54,67.04,100%,"I went to the woods because I wished to live deliberately, t...",Win (1 of 2)
286.,2010-05-07 10:53:22,45.77,100%,"Yeah, you just take Soupy-Sales to prom 'cause I can think o...",No win (1 of 1)
285.,2010-05-07 10:50:45,59.80,100%,"Yet one fine day, in a fit of euphoria, after he had picked ...",No win (1 of 1)
284.,2010-05-07 10:49:16,50.95,100%,So my heart goes out to them. Figuratively. I would never ac...,No win (1 of 1)
283.,2010-05-07 10:47:35,57.40,100%,I can already hear your tune calling me across the room. Whe...,No win (1 of 1)
282.,2010-05-07 10:46:15,53.26,100%,"She was a genius of sadness, immersing herself in it, separa...",No win (1 of 1)
281.,2010-05-07 10:44:25,51.28,100%,Who has a safety deposit box full of money and six passports...,No win (1 of 1)
280.,2010-05-07 10:43:15,42.92,100%,My entire life had been on a predictable trajectory dominate...,No win (1 of 1)
279.,2010-05-07 10:41:27,53.94,100%,"The melted mozzarella layer, which we shall designate MML, i...",No win (1 of 1)
278.,2010-05-07 10:40:15,58.04,100%,"Other keyboard layouts have been created since, and some are...",No win (1 of 1)
277.,2010-05-07 10:39:08,62.07,100%,Caravans were being raided in a forest north of Rangoon by a...,No win (1 of 1)
276.,2010-05-07 10:37:40,51.06,100%,"There are men who possess a peculiarly strong visual memory,...",No win (1 of 1)
275.,2010-05-07 10:35:46,54.42,100%,"They say that right after God created man, he took a rib fro...",No win (1 of 1)
274.,2010-05-06 16:15:38,51.43,100%,"And in the world a heart of darkness, a firezone, where poet...",Win (1 of 4)
