49.,2010-04-15 16:47:16,51.39,100%,Is it really necessary to send that email? The more emails y...,Win (1 of 2)
48.,2010-04-15 16:45:10,48.15,100%,It was one of those days when it's a minute away from snowin...,Win (1 of 5)
47.,2010-04-15 13:01:21,42.12,100%,I still see things that are not here. I just choose not to a...,No win (1 of 1)
46.,2010-04-15 12:59:14,42.07,100%,He implies there is a correlation between his daily work and...,No win (3 of 5)
45.,2010-04-15 12:56:06,50.32,100%,Remember that humor is written backwards. That means you fir...,No win (2 of 5)
44.,2010-04-15 12:55:06,40.84,100%,"Oh bliss! Bliss and heaven! Oh, it was gorgeousness and gorg...",No win (2 of 3)
43.,2010-04-15 12:53:37,50.14,100%,It is possible that I already had some presentiment of my fu...,Win (1 of 2)
42.,2010-04-15 12:51:55,43.35,100%,"Here, the oregano and other trace materials sitting on the s...",Win (1 of 4)
41.,2010-04-15 12:41:18,40.33,100%,Quality humor doesn't just deliver one gag and then tax the ...,No win (4 of 5)
40.,2010-04-15 12:37:32,41.30,100%,"The sooner your kids appreciate the value of work, the more ...",No win (2 of 3)
39.,2010-04-15 12:32:29,50.54,100%,Now did you answer cause you thought that's what I wanted to...,Win (1 of 4)
38.,2010-04-15 12:18:16,42.73,100%,Convection also plays a minor role because of the relative t...,No win (2 of 2)
37.,2010-04-15 10:42:21,45.06,100%,It is greatly to America's advantage that it is a congenial ...,Win (1 of 3)
36.,2010-04-15 10:28:57,54.29,100%,The alternative to binge travel - the mini retirement - enta...,No win (2 of 5)
35.,2010-04-15 10:27:14,41.58,100%,Remember that humor is written backwards. That means you fir...,No win (2 of 5)
34.,2010-04-15 10:25:35,45.68,100%,"But suddenly, I viddied that thinking was for the gloopy one...",No win (2 of 3)
33.,2010-04-15 10:23:30,51.30,100%,"Ticking away the moments that make up a dull day, you fritte...",Win (1 of 4)
32.,2010-04-15 10:22:09,52.41,100%,When considering the cultural significance of this intriguin...,Win (1 of 5)
31.,2010-04-15 10:21:04,38.16,100%,"A computer needs a manager to administer its operations, jus...",No win (3 of 4)
30.,2010-04-14 15:12:34,35.79,100%,"Anyway, like I was saying, shrimp is the fruit of the sea. Y...",Win (1 of 2)
29.,2010-04-14 14:54:54,39.77,100%,"He was rough around the edges. He'd been to school, but neve...",No win (2 of 4)
28.,2010-04-14 14:52:21,37.80,100%,"I'd been walking for hours and, as usual, I'd lost track of ...",No win (4 of 5)
27.,2010-04-14 14:50:15,49.83,100%,You're going in the drink and I am going to make a cup of te...,Win (1 of 4)
26.,2010-04-14 14:48:58,39.33,100%,"Here, the oregano and other trace materials sitting on the s...",No win (3 of 4)
25.,2010-04-14 14:47:47,41.71,100%,"I laugh at the whole notion of ""Mr. Right"" and you should to...",Win (1 of 3)
24.,2010-04-14 14:46:10,42.15,100%,"A computer needs a manager to administer its operations, jus...",No win (4 of 4)
23.,2010-04-14 14:44:53,36.37,100%,"The term ""barbarian"" was created by the Greeks; it was origi...",No win (2 of 4)
22.,2010-04-14 14:43:24,41.56,100%,"Your primary objective should be to touch-type; that is, to ...",No win (3 of 4)
21.,2010-04-14 14:35:40,48.11,100%,"I hope that whoever you are, you escape this place. I hope t...",No win (3 of 3)
20.,2010-04-14 14:34:02,45.93,100%,"And in the world a heart of darkness, a firezone, where poet...",No win (3 of 4)
19.,2010-04-14 14:30:50,45.61,100%,"The terminator wouldn't stop, it would never leave him. It w...",No win (3 of 5)
18.,2010-04-14 14:28:42,50.03,100%,San Francisco in the middle sixties was a very special time ...,No win (2 of 4)
17.,2010-04-14 14:27:17,39.37,100%,Being able to quit things that don't work is integral to bei...,No win (3 of 5)
16.,2010-04-14 14:25:37,42.59,100%,"Common knowledge has bicyclists always riding into the wind,...",No win (5 of 5)
15.,2010-04-14 14:23:25,43.91,100%,Although the United Nations does not have the power to enfor...,No win (3 of 4)
14.,2010-04-14 14:19:04,41.92,100%,He managed to open the cupboard door with his nose and found...,No win (4 of 4)
13.,2010-04-14 14:16:57,42.33,100%,"In 1972, domestic oil production peaked and then began its i...",No win (4 of 5)
12.,2010-04-14 14:13:12,50.11,100%,All time is all time. It does not change. It does not lend i...,Win (1 of 5)
11.,2010-04-14 14:11:29,43.57,100%,At the time when Britain faced a plunge into chaos and darkn...,No win (4 of 5)
10.,2010-04-14 08:18:00,47.26,100%,Those who proceed only very slowly can make much greater pro...,Win (1 of 2)
9.,2010-04-14 07:43:41,42.22,100%,"There are two kinds of fibers in our muscles, red and white....",Win (1 of 3)
8.,2010-04-14 07:20:26,49.08,100%,Facts can be thought of as objective or subjective. Things a...,Win (1 of 2)
7.,2010-04-14 07:18:39,41.59,100%,All time is all time. It does not change. It does not lend i...,Win (1 of 2)
6.,2010-04-14 07:15:48,44.95,100%,"Ezekiel twenty-five, seventeen: The path of the righteous ma...",No win (3 of 3)
5.,2010-04-14 07:08:26,54.27,100%,"You have a class of young strong men and women, and they wan...",No win (3 of 5)
4.,2010-04-14 07:07:05,45.14,100%,By studying the cooling of pizza in the gravity free environ...,No win (3 of 4)
3.,2010-04-14 07:04:29,36.76,100%,"In 1972, domestic oil production peaked and then began its i...",Win (1 of 2)
2.,2010-04-14 07:02:08,50.26,100%,"Every craft and every investigation, and likewise every acti...",No win (3 of 5)
1.,2010-04-14 06:59:41,51.80,100%,"She's got a smile that, it seems to me, reminds me of childh...",No win (2 of 4)
