273.,2010-05-06 16:14:06,58.02,100%,"I had a dream. There was our world, and the world was dark b...",Win (1 of 4)
272.,2010-05-06 16:12:37,50.60,100%,"To evaluate an option from the other side's point of view, c...",No win (2 of 2)
271.,2010-05-06 16:11:15,53.38,100%,The only message I got was from the company that holds my st...,No win (2 of 2)
270.,2010-05-06 16:10:02,47.64,100%,"You needn't take it any further, sir. You've proved to me th...",No win (2 of 3)
269.,2010-05-06 16:08:39,49.98,100%,"I don't want tickets, I need you to find me a painting, a cl...",Win (1 of 5)
268.,2010-05-06 16:06:56,55.90,100%,"Yes, the newspapers were right: snow was general all over Ir...",Win (1 of 3)
267.,2010-05-06 16:04:17,48.08,100%,We sit silently and watch the world around us. This has take...,No win (3 of 4)
266.,2010-05-05 15:28:05,45.03,100%,I must nevertheless point out that our profession very close...,No win (1 of 1)
265.,2010-05-05 15:26:38,47.61,100%,The unknown future rolls toward us. I face it for the first ...,No win (1 of 1)
264.,2010-05-05 15:25:39,52.96,100%,"A zealot might be, for instance, an individual with a person...",No win (1 of 1)
263.,2010-05-05 15:24:12,46.33,100%,Lucid but wholly false recollections can easily be induced b...,No win (1 of 1)
262.,2010-05-05 15:22:32,58.35,100%,"I had a dream. There was our world, and the world was dark b...",No win (1 of 1)
261.,2010-05-05 15:21:05,54.14,100%,There is a theory which states that if anybody ever discover...,No win (1 of 1)
260.,2010-05-05 15:19:50,54.48,100%,"It was a marvelous night, the sort of night one only experie...",No win (1 of 1)
259.,2010-05-05 15:18:37,46.84,100%,These contests provided ample opportunity to demonstrate the...,No win (1 of 1)
258.,2010-05-05 15:17:07,49.98,100%,"I don't want tickets, I need you to find me a painting, a cl...",No win (1 of 1)
257.,2010-05-05 15:15:47,47.79,100%,"Often, we assume that a familiar situation will be but a rep...",No win (1 of 1)
256.,2010-05-05 15:14:29,53.18,100%,"But, pray how could that which I spoke so many years ago, an...",No win (1 of 1)
255.,2010-05-05 14:26:55,50.04,100%,Instead of hiring workers during the peak hog kill in the wi...,No win (2 of 2)
254.,2010-05-05 14:25:10,51.76,100%,"Because they're at the bottom of the scale, nerds are a safe...",No win (2 of 4)
253.,2010-05-05 14:23:41,55.03,100%,But the two men were not lonely at all. At home they were co...,Win (1 of 3)
252.,2010-05-05 14:22:36,53.27,100%,"If you are given too many choices, if you are forced to cons...",Win (1 of 3)
251.,2010-05-05 14:21:10,59.61,100%,"Yet one fine day, in a fit of euphoria, after he had picked ...",Win (1 of 4)
250.,2010-05-05 14:19:42,46.91,100%,"Keying text quickly is important, but it is more important t...",No win (3 of 5)
249.,2010-05-05 14:18:39,53.88,100%,The basis of the Aztecs' success in creating a great state a...,No win (3 of 3)
248.,2010-05-05 14:17:03,67.54,100%,"We speak of something carried and something carrying, of som...",No win (2 of 5)
247.,2010-05-05 14:15:46,57.57,100%,At the time when Britain faced a plunge into chaos and darkn...,Win (1 of 3)
246.,2010-05-05 14:14:13,52.91,100%,"Yes, the newspapers were right: snow was general all over Ir...",No win (4 of 5)
245.,2010-05-05 14:13:02,62.87,100%,"They say that right after God created man, he took a rib fro...",Win (1 of 2)
244.,2010-05-03 18:26:56,55.52,100%,The only message I got was from the company that holds my st...,No win (2 of 3)
243.,2010-05-03 18:25:17,45.70,100%,"In 1972, domestic oil production peaked and then began its i...",No win (2 of 4)
242.,2010-05-03 18:23:02,55.21,100%,"I hope that whoever you are, you escape this place. I hope t...",No win (3 of 5)
241.,2010-05-03 18:20:14,51.99,100%,"You ask Raymond what he does for a living and he says, ""I br...",No win (2 of 3)
240.,2010-05-03 18:18:22,48.75,100%,We may climb into the thin and cold realm of pure geometry a...,No win (2 of 3)
239.,2010-05-03 14:06:14,48.32,100%,"She's got a smile that, it seems to me, reminds me of childh...",Win (1 of 2)
238.,2010-05-03 10:47:30,48.71,100%,I said that I would see you because I had heard that you wer...,No win (2 of 5)
237.,2010-05-03 10:45:18,54.62,100%,"When we conceive of the sweetest being ever, we are conceivi...",Win (1 of 4)
236.,2010-05-03 10:30:59,52.04,100%,"There are men who possess a peculiarly strong visual memory,...",Win (1 of 5)
235.,2010-05-03 10:28:54,57.01,100%,There is a theory which states that if anybody ever discover...,No win (3 of 4)
234.,2010-05-03 10:27:40,46.41,100%,"My dog barks some. Mentally you picture my dog, but I have n...",Win (1 of 4)
233.,2010-05-03 10:26:31,49.58,100%,The treatment of atoms with more than one electron requires ...,No win (2 of 3)
232.,2010-05-03 10:24:41,56.90,100%,"When I was your age, television was called books. And this i...",No win (2 of 4)
231.,2010-05-03 10:23:25,56.63,100%,"Well, it just so happens, this hacienda comes with its very ...",No win (2 of 3)
230.,2010-05-03 10:22:18,50.30,100%,"But suddenly, I viddied that thinking was for the gloopy one...",No win (2 of 3)
229.,2010-05-03 08:08:31,47.65,100%,So what's in this for you? Should you rush out in search of ...,Win (1 of 4)
228.,2010-05-03 08:06:49,48.08,100%,Although his voice was also broken by uncertainty and his ha...,No win (3 of 4)
227.,2010-05-02 20:25:16,53.83,100%,At the time when Britain faced a plunge into chaos and darkn...,No win (2 of 2)
226.,2010-05-02 20:23:38,53.96,100%,You have to wonder: how do the machines know what Tasty Whea...,No win (3 of 3)
225.,2010-05-02 20:20:44,53.93,100%,I will need my spectacles and a clear head. Today I broke my...,No win (2 of 5)
224.,2010-05-02 20:18:25,51.35,100%,It was one of those days when it's a minute away from snowin...,No win (2 of 2)
223.,2010-05-02 20:16:47,57.08,100%,"I went to the woods because I wished to live deliberately, t...",Win (1 of 2)
222.,2010-05-02 20:14:33,49.40,100%,"There is no physical separation after the slicing, so that e...",No win (4 of 5)
221.,2010-05-02 20:13:05,59.71,100%,Now I want you to think and stop being a smart aleck. A man'...,No win (3 of 3)
220.,2010-05-02 20:12:05,57.31,100%,"There are two kinds of fibers in our muscles, red and white....",Win (1 of 3)
219.,2010-05-02 19:29:59,58.42,100%,"When we conceive of the sweetest being ever, we are conceivi...",No win (2 of 2)
218.,2010-05-02 19:23:23,55.38,100%,Space is big. Really big. You just won't believe how vastly ...,Win (1 of 2)
217.,2010-05-02 19:22:10,62.42,100%,Now I want you to think and stop being a smart aleck. A man'...,Win (1 of 4)
216.,2010-05-02 19:19:49,58.89,100%,"I can feel the heat closing in, feel them out there making t...",Win (1 of 2)
215.,2010-05-02 19:18:27,52.69,100%,"He's got a two day head start on you, which is more than he ...",No win (2 of 3)
214.,2010-05-02 19:17:05,55.44,100%,"It was a marvelous night, the sort of night one only experie...",No win (3 of 4)
213.,2010-05-02 19:13:44,52.67,100%,"O clear intelligence, force beyond all measure! Gentlemen, I...",No win (2 of 3)
212.,2010-05-02 14:20:40,62.03,100%,I will need my spectacles and a clear head. Today I broke my...,Win (1 of 2)
211.,2010-05-02 14:04:53,50.92,100%,"I hope that whoever you are, you escape this place. I hope t...",No win (2 of 3)
210.,2010-05-02 14:02:41,51.57,100%,"That's Tommy. He tells people he was named after a gun, but ...",Win (1 of 2)
209.,2010-05-02 14:00:48,52.20,100%,So what's in this for you? Should you rush out in search of ...,No win (3 of 3)
208.,2010-05-02 13:58:53,56.12,100%,"No matter how bad things are, you can always make things wor...",Win (1 of 2)
207.,2010-05-02 13:51:04,49.55,100%,Although the United Nations does not have the power to enfor...,No win (4 of 4)
206.,2010-05-01 20:03:06,55.63,100%,It was hard to toss things I had once thought were valuable ...,Win (1 of 3)
205.,2010-05-01 20:01:12,48.37,100%,The basic concept is simple: a satellite in geosynchronous o...,No win (2 of 2)
204.,2010-05-01 19:59:29,50.20,100%,Although the United Nations does not have the power to enfor...,No win (2 of 2)
203.,2010-05-01 19:52:43,52.57,100%,"I had a job, I had a girl. I had something going, mister, in...",No win (2 of 3)
202.,2010-05-01 19:33:01,50.69,100%,The invention of the wheel represented a major turning point...,Win (1 of 2)
201.,2010-05-01 19:03:17,58.61,100%,The problem we now face is that this thin layer of atmospher...,No win (3 of 3)
200.,2010-05-01 19:01:06,49.54,100%,"They had been given a sign - a powerful, lucid sign - that u...",No win (5 of 5)
199.,2010-05-01 18:59:02,55.87,100%,By studying the cooling of pizza in the gravity free environ...,Win (1 of 3)
198.,2010-05-01 18:57:57,62.51,100%,Many rivers to cross but I can't seem to find my way over. W...,Win (1 of 3)
197.,2010-05-01 13:27:19,40.74,100%,"You ask Raymond what he does for a living and he says, ""I br...",No win (5 of 5)
196.,2010-05-01 13:24:32,58.35,100%,Now I want you to think and stop being a smart aleck. A man'...,Win (1 of 5)
195.,2010-05-01 13:19:54,56.70,100%,"You have a class of young strong men and women, and they wan...",No win (3 of 3)
194.,2010-05-01 13:18:23,56.35,100%,He canceled all his commitments and pulled together the most...,Win (1 of 2)
193.,2010-04-30 16:17:34,48.27,100%,"Let's sort the buyers from the spiers, the needy from the gr...",Win (1 of 4)
192.,2010-04-30 14:46:57,50.30,100%,We go waiting for the stars to come showering down. From Mos...,No win (2 of 5)
191.,2010-04-30 14:45:20,54.17,100%,You're going in the drink and I am going to make a cup of te...,Win (1 of 3)
190.,2010-04-30 14:41:40,46.22,100%,"Run to the bedroom, in the suitcase on the left, you'll find...",No win (3 of 3)
189.,2010-04-30 14:39:05,58.04,100%,The odds are that you will generally meet the worst of them....,Win (1 of 4)
188.,2010-04-30 14:37:57,53.71,100%,"Because they're at the bottom of the scale, nerds are a safe...",No win (2 of 3)
187.,2010-04-30 14:36:25,52.02,100%,And I will strike down upon thee with great vengeance and fu...,No win (4 of 5)
186.,2010-04-30 14:34:57,50.32,100%,The chemistry of an element is determined by the manner in w...,No win (3 of 4)
185.,2010-04-30 14:33:51,50.54,100%,Most popular song lyrics have two sections - a verse and a b...,No win (4 of 4)
184.,2010-04-30 14:32:10,53.04,100%,"Allow me first to apologize for this interruption. I do, lik...",Win (1 of 2)
183.,2010-04-30 14:30:35,56.70,100%,There's sometimes a buggy. How many drivers does a buggy hav...,Win (1 of 2)
182.,2010-04-30 14:29:13,54.27,100%,So what's in this for you? Should you rush out in search of ...,No win (3 of 4)
181.,2010-04-29 19:29:17,51.91,100%,I drew the blankets over my head and tried to think of Chris...,No win (2 of 2)
180.,2010-04-29 19:27:22,53.28,100%,The problem we now face is that this thin layer of atmospher...,No win (2 of 4)
179.,2010-04-29 19:25:01,57.22,100%,She's got eyes of the bluest skies as if they thought of rai...,No win (2 of 3)
178.,2010-04-29 19:23:49,55.49,100%,I had the impression of being abandoned by everyone when the...,Win (1 of 3)
177.,2010-04-29 19:22:05,51.95,100%,The basic concept is simple: a satellite in geosynchronous o...,Win (1 of 4)
176.,2010-04-29 19:19:07,52.13,100%,"There was me, that is Alex, and my three droogs, that is Pet...",Win (1 of 3)
175.,2010-04-29 19:17:45,59.52,100%,Images of broken light which dance before me like a million ...,No win (3 of 4)
174.,2010-04-29 19:16:18,54.22,100%,All that year the animals worked like slaves. But they were ...,No win (3 of 3)
173.,2010-04-29 17:39:22,51.68,100%,"They say that right after God created man, he took a rib fro...",No win (2 of 2)
172.,2010-04-29 17:37:50,55.45,100%,"If you don't get what you want, you suffer; if you get what ...",No win (2 of 3)
171.,2010-04-29 17:36:11,46.22,100%,And I will strike down upon thee with great vengeance and fu...,No win (3 of 3)
170.,2010-04-29 17:34:59,56.76,100%,"On a manual typewriter, strike the key with a nice sharp str...",Win (1 of 4)
169.,2010-04-29 17:33:35,50.71,100%,Convection also plays a minor role because of the relative t...,No win (2 of 4)
168.,2010-04-29 17:32:13,53.53,100%,If there is one thing the history of evolution has taught us...,Win (1 of 4)
167.,2010-04-29 17:31:04,49.66,100%,"Other keyboard layouts have been created since, and some are...",Win (1 of 4)
166.,2010-04-29 17:29:47,54.78,100%,"Every craft and every investigation, and likewise every acti...",No win (2 of 4)
165.,2010-04-29 17:27:29,47.15,100%,"Like painting, most software is intended for a human audienc...",No win (2 of 2)
164.,2010-04-29 17:24:54,51.44,100%,"Radiation could be precisely determined, in principle, if we...",Win (1 of 5)
163.,2010-04-29 17:24:06,44.07,100%,Although the United Nations does not have the power to enfor...,No win (2 of 3)
162.,2010-04-29 17:22:22,54.30,100%,One essential rule: make sure the joke is the last possible ...,No win (2 of 4)
161.,2010-04-29 17:21:04,42.99,100%,"There was me, that is Alex, and my three droogs, that is Pet...",No win (3 of 4)
160.,2010-04-29 17:19:58,47.38,100%,I drew the blankets over my head and tried to think of Chris...,No win (2 of 4)
159.,2010-04-29 17:18:06,58.36,100%,"In the casino, the cardinal rule is to keep them playing and...",No win (2 of 4)
158.,2010-04-29 17:16:51,54.40,100%,You're going in the drink and I am going to make a cup of te...,No win (2 of 4)
157.,2010-04-29 17:15:26,51.72,100%,Popularity is only partially about individual attractiveness...,No win (3 of 4)
156.,2010-04-29 17:14:02,51.61,100%,"The boy has not a real choice, has he? Self-interest, the fe...",No win (2 of 5)
155.,2010-04-29 17:12:06,48.08,100%,"The goal of the true seeker is to become a sage, or superior...",No win (2 of 3)
154.,2010-04-29 17:10:26,50.44,100%,I will need my spectacles and a clear head. Today I broke my...,No win (3 of 5)
153.,2010-04-29 13:06:56,45.41,100%,"Today, you people are no longer maggots. Today, you are Mari...",No win (4 of 5)
152.,2010-04-29 13:05:09,46.16,100%,Jay made up for the lack of glamour in his assignment by hav...,No win (2 of 2)
151.,2010-04-29 13:03:15,47.51,100%,"The sooner your kids appreciate the value of work, the more ...",Win (1 of 5)
150.,2010-04-29 13:01:36,53.99,100%,You won't kill me out of some misplaced sense of self-righte...,Win (1 of 4)
149.,2010-04-29 12:59:52,46.06,100%,Being able to quit things that don't work is integral to bei...,No win (2 of 5)
148.,2010-04-29 12:58:32,44.91,100%,"To some, the rules of etiquette may seem outdated, stuffy an...",No win (3 of 5)
147.,2010-04-29 12:56:43,45.38,100%,"Imagine this: Here we are, a plane full of grown human being...",Win (1 of 3)
146.,2010-04-29 12:54:48,53.19,100%,"Good games stay within, but at the outer edge, of the player...",No win (2 of 5)
145.,2010-04-29 12:53:29,53.68,100%,Humans need to practice what they are learning a good deal b...,No win (4 of 5)
144.,2010-04-29 12:52:01,44.00,100%,Lucid but wholly false recollections can easily be induced b...,No win (4 of 5)
143.,2010-04-29 12:50:44,51.11,100%,At the time when Britain faced a plunge into chaos and darkn...,No win (2 of 3)
142.,2010-04-29 11:33:01,50.74,100%,"All Ninja are men of peace, and must always remain so or los...",No win (3 of 4)
141.,2010-04-29 10:46:14,46.03,100%,I will need my spectacles and a clear head. Today I broke my...,No win (1 of 1)
140.,2010-04-29 10:39:54,53.48,100%,Caravans were being raided in a forest north of Rangoon by a...,Win (1 of 4)
139.,2010-04-28 15:28:49,61.24,100%,"I went to the woods because I wished to live deliberately, t...",No win (4 of 5)
138.,2010-04-28 15:27:41,56.96,100%,It's the possibility of having a dream come true that makes ...,No win (2 of 5)
137.,2010-04-28 15:26:13,56.62,100%,Overhead the albatross hangs motionless upon the air and dee...,No win (2 of 4)
136.,2010-04-28 15:25:05,50.96,100%,"Keying text quickly is important, but it is more important t...",No win (2 of 3)
135.,2010-04-28 15:23:47,53.00,100%,He had spent enormous amounts of time at the great libraries...,No win (3 of 3)
134.,2010-04-28 15:22:07,48.06,100%,"People get ready, there's a train coming. You don't need no ...",No win (5 of 5)
133.,2010-04-28 15:21:03,44.09,100%,I know that you weren't bored that day because there was a l...,No win (4 of 5)
132.,2010-04-28 08:38:27,46.59,100%,"Imagine this: Here we are, a plane full of grown human being...",No win (2 of 2)
131.,2010-04-28 08:19:22,51.78,100%,"Do you smell that? Napalm, son. Nothing else in the world sm...",Win (1 of 2)
130.,2010-04-28 08:16:09,49.31,100%,I suddenly had the impression that I had been left all alone...,Win (1 of 2)
129.,2010-04-28 08:13:19,48.36,100%,"I rejected those answers; instead, I chose something differe...",Win (1 of 2)
128.,2010-04-28 08:09:12,45.37,100%,"What good's a reward if you ain't around to use it? Besides,...",Win (1 of 2)
127.,2010-04-28 08:05:24,48.91,100%,"Let's sort the buyers from the spiers, the needy from the gr...",Win (1 of 2)
126.,2010-04-28 08:02:22,39.62,100%,"What about Tony? You know, Bullet Tooth Tony. He'll find you...",Win (1 of 2)
125.,2010-04-28 07:57:29,46.29,100%,"And today, Lady Liberty is under attack from the cable chann...",Win (1 of 2)
124.,2010-04-28 07:52:25,46.18,100%,Who is Keyser Soze? He is supposed to be Turkish. Some say h...,Win (1 of 2)
123.,2010-04-28 07:51:03,48.67,100%,"As if that blind rage had washed me clean, rid me of hope; f...",Win (1 of 2)
122.,2010-04-28 07:42:50,45.37,100%,Maybe what I think Tasty Wheat tasted like actually tasted l...,Win (1 of 3)
121.,2010-04-28 07:40:49,47.87,100%,"The result has been the emergence of what some call the ""win...",No win (2 of 4)
120.,2010-04-28 07:38:59,48.20,100%,"There is no pain, you are receding. A distant ship smoke on ...",No win (2 of 4)
119.,2010-04-28 07:37:13,50.13,100%,"But, pray how could that which I spoke so many years ago, an...",Win (1 of 2)
118.,2010-04-28 07:35:43,42.68,100%,"Disillusion is the greatest gift I can give you. But, becaus...",No win (3 of 4)
117.,2010-04-28 07:23:42,58.85,100%,"Blessed is he, who in the name of charity and good will, she...",No win (2 of 4)
116.,2010-04-27 16:42:06,42.75,100%,"The Orient was almost a European invention, and had been sin...",No win (3 of 3)
115.,2010-04-27 16:40:38,49.03,100%,"For centuries, the battle of morality was fought between tho...",No win (2 of 4)
114.,2010-04-27 16:34:02,48.81,100%,In order to face down the danger that is stalking us and mov...,No win (2 of 5)
113.,2010-04-27 16:31:55,49.17,100%,"I rejected those answers; instead, I chose something differe...",Win (1 of 2)
112.,2010-04-27 16:29:45,47.94,100%,"If you don't get what you want, you suffer; if you get what ...",Win (1 of 5)
111.,2010-04-27 16:27:57,42.77,100%,The basis of the Aztecs' success in creating a great state a...,No win (4 of 5)
110.,2010-04-27 16:26:08,44.67,100%,The inner surface of the cell wall touches the cytoplasmic m...,No win (2 of 5)
109.,2010-04-27 16:24:11,50.15,100%,By studying the cooling of pizza in the gravity free environ...,No win (3 of 3)
108.,2010-04-27 16:23:08,47.18,100%,Stab a sorry heart with your favorite finger. Paint the whol...,No win (3 of 5)
107.,2010-04-27 16:21:17,48.20,100%,The problem we now face is that this thin layer of atmospher...,No win (3 of 5)
106.,2010-04-27 16:19:12,51.28,100%,"The melted mozzarella layer, which we shall designate MML, i...",No win (2 of 5)
105.,2010-04-27 16:17:58,57.88,100%,"We speak of something carried and something carrying, of som...",No win (3 of 5)
104.,2010-04-27 15:23:26,48.66,100%,"It's a blue savanna song: somewhere cross the desert, someti...",No win (3 of 4)
103.,2010-04-27 14:37:39,41.43,100%,"An essential characteristic of the superhero mythology is, t...",No win (2 of 4)
102.,2010-04-27 14:35:16,47.18,100%,"Because they're at the bottom of the scale, nerds are a safe...",No win (2 of 3)
101.,2010-04-27 14:33:40,51.75,100%,"Well, the way they make shows is, they make one show. That s...",No win (2 of 3)
100.,2010-04-27 14:30:46,53.01,100%,She's got eyes of the bluest skies as if they thought of rai...,No win (1 of 1)
99.,2010-04-27 14:29:31,52.19,100%,There are still some places where you can get all you can ea...,Win (1 of 2)
98.,2010-04-27 14:27:54,54.39,100%,Is it sweeter to exist only in the mind or to exist both in ...,Win (1 of 2)
97.,2010-04-27 14:26:21,49.05,100%,Being able to quit things that don't work is integral to bei...,No win (1 of 1)
96.,2010-04-27 14:24:50,49.33,100%,"Many people limit themselves to leading boring, dull lives b...",No win (3 of 5)
95.,2010-04-27 14:23:09,54.54,100%,The most precious treasures we have in life are the images w...,No win (2 of 5)
94.,2010-04-27 10:47:32,41.40,100%,"The problem is, Willie, is that Charles and yourself are not...",No win (4 of 5)
93.,2010-04-27 10:46:16,47.01,100%,"It was a marvelous night, the sort of night one only experie...",No win (3 of 5)
92.,2010-04-27 10:44:36,52.12,100%,Even the best-designed chair won't make up for bad posture. ...,No win (5 of 5)
91.,2010-04-27 10:43:09,46.37,100%,"A long time ago, I was in Burma, my friends and I were worki...",No win (3 of 3)
90.,2010-04-27 10:40:45,57.14,100%,"At first we were silent, but finally we considered ourselves...",No win (2 of 3)
89.,2010-04-27 10:39:16,54.61,100%,"And in the world a heart of darkness, a firezone, where poet...",Win (1 of 3)
88.,2010-04-27 10:34:27,47.50,100%,"Here, the oregano and other trace materials sitting on the s...",Win (1 of 3)
87.,2010-04-27 10:28:46,56.58,100%,"In the casino, the cardinal rule is to keep them playing and...",No win (3 of 5)
86.,2010-04-27 10:27:14,48.72,100%,"I went to the woods because I wished to live deliberately, t...",No win (3 of 4)
85.,2010-04-27 10:25:50,57.70,100%,"When we pulled out into the winter night and the real snow, ...",Win (1 of 5)
84.,2010-04-27 10:24:00,48.43,100%,There are still some places where you can get all you can ea...,No win (3 of 4)
83.,2010-04-27 10:20:58,49.84,100%,Involuntarily I glanced seaward - and distinguished nothing ...,Win (1 of 5)
82.,2010-04-27 10:19:29,51.95,100%,"They say that right after God created man, he took a rib fro...",Win (1 of 5)
81.,2010-04-27 10:18:08,47.39,100%,"But suddenly, I viddied that thinking was for the gloopy one...",Win (1 of 2)
80.,2010-04-26 20:38:36,42.15,100%,And I will strike down upon thee with great vengeance and fu...,No win (1 of 1)
79.,2010-04-26 20:35:51,46.27,100%,"The boy has not a real choice, has he? Self-interest, the fe...",No win (1 of 1)
78.,2010-04-26 20:33:35,46.39,100%,Everything we hold dear likewise resolves into its original ...,No win (3 of 3)
77.,2010-04-26 20:28:19,53.57,100%,"And you know it's time to go, through the sleet and driving ...",Win (1 of 3)
76.,2010-04-26 20:27:01,53.29,100%,"For centuries, human society has taken the gifts of nature f...",No win (2 of 2)
75.,2010-04-26 20:25:37,46.64,100%,"On a manual typewriter, strike the key with a nice sharp str...",No win (3 of 4)
74.,2010-04-26 20:24:15,48.33,100%,I'm telling it like it is. Get used to it or put this book d...,No win (3 of 5)
73.,2010-04-26 20:22:18,43.35,100%,The invention of the wheel represented a major turning point...,Win (1 of 5)
72.,2010-04-26 08:15:15,47.52,100%,"I had a job, I had a girl. I had something going, mister, in...",No win (2 of 3)
71.,2010-04-26 08:13:29,46.81,100%,"No man is an island, entire of itself; every man is a piece ...",No win (2 of 5)
70.,2010-04-26 08:09:29,50.33,100%,"She's got a smile that, it seems to me, reminds me of childh...",Win (1 of 5)
69.,2010-04-26 08:07:56,36.78,100%,How many roads must a man walk down before you call him a ma...,No win (4 of 4)
68.,2010-04-26 08:05:55,41.46,100%,"Excellent. He's enterprising, aggressive, outgoing, young, b...",No win (3 of 3)
67.,2010-04-26 08:03:44,41.01,100%,Sholes consulted with an educator who helped him analyze the...,No win (2 of 4)
66.,2010-04-26 08:01:45,45.24,100%,"Hi, and welcome to the future. San Dimas, California, 2688. ...",No win (2 of 4)
65.,2010-04-26 07:59:37,40.76,100%,"Ticking away the moments that make up a dull day, you fritte...",No win (3 of 3)
64.,2010-04-26 07:57:57,42.64,100%,"What about Tony? You know, Bullet Tooth Tony. He'll find you...",No win (2 of 4)
63.,2010-04-26 07:56:19,44.07,100%,"Anyway, like I was saying, shrimp is the fruit of the sea. Y...",Win (1 of 4)
62.,2010-04-26 07:54:28,48.16,100%,"Burning my bridges and smashing my mirrors, turning to see i...",Win (1 of 5)
61.,2010-04-26 07:53:02,42.28,100%,"Comfortable, Mullet? It seems sadly ironic that it's that ti...",No win (4 of 4)
60.,2010-04-26 07:01:53,50.17,100%,You're going in the drink and I am going to make a cup of te...,No win (2 of 3)
59.,2010-04-22 15:24:02,43.90,100%,"And today, Lady Liberty is under attack from the cable chann...",Win (1 of 3)
58.,2010-04-22 12:48:27,46.74,100%,In order to face down the danger that is stalking us and mov...,No win (2 of 4)
57.,2010-04-19 15:19:55,46.45,100%,So what's in this for you? Should you rush out in search of ...,No win (3 of 4)
56.,2010-04-15 17:11:45,47.31,100%,"Let me get this straight. You think that your client, one of...",No win (2 of 5)
55.,2010-04-15 17:10:10,44.72,100%,"I can feel the heat closing in, feel them out there making t...",No win (3 of 4)
54.,2010-04-15 17:07:31,48.63,100%,"And in the world a heart of darkness, a firezone, where poet...",No win (2 of 5)
53.,2010-04-15 16:57:59,43.44,100%,I had the impression of being abandoned by everyone when the...,No win (2 of 4)
52.,2010-04-15 16:54:30,51.69,100%,Convection also plays a minor role because of the relative t...,Win (1 of 4)
51.,2010-04-15 16:52:34,54.17,100%,The unknown future rolls toward us. I face it for the first ...,Win (1 of 3)
50.,2010-04-15 16:48:48,46.69,100%,"People get ready, there's a train coming. You don't need no ...",Win (1 of 5)
