592.,2013-06-17 05:53:52,59.25,97%,Any finite number divided by infinity is as near to nothing ...,Win (1 of 3)
591.,2013-06-14 11:54:48,57.44,96%,"Imagine this: Here we are, a plane full of grown human being...",No win (4 of 4)
590.,2013-06-14 11:53:10,63.02,96%,He had spent enormous amounts of time at the great libraries...,No win (4 of 5)
589.,2013-06-14 11:50:39,59.84,95%,"We turn away to face the cold, enduring chill, as the day be...",No win (2 of 4)
588.,2013-06-14 11:49:18,64.31,97%,Once you get into the processed foods you have to be a fairl...,Win (1 of 5)
587.,2013-06-14 11:47:34,62.08,98%,In 1969 four computers located around the country were in co...,Win (1 of 3)
586.,2013-06-14 11:46:10,60.36,97%,Your inner child will be happy to know that when it comes to...,No win (2 of 5)
585.,2013-06-14 11:43:35,63.18,96%,The ultimate way to compose is to be able to keyboard as fas...,No win (3 of 5)
584.,2013-06-14 11:39:41,63.86,96%,The unknown future rolls toward us. I face it for the first ...,No win (4 of 4)
583.,2013-06-14 11:38:57,61.23,99%,The streets were cleared by a Critical Mass bike ride and we...,No win (3 of 5)
582.,2013-06-14 11:33:18,64.73,97%,"Keying text quickly is important, but it is more important t...",Win (1 of 4)
581.,2013-06-14 11:31:17,59.15,95%,Is this the real life? Is this just fantasy? Caught in a lan...,Win (1 of 5)
580.,2013-06-14 11:29:59,70.08,100%,We all know people who are very bright but who do not always...,Win (1 of 5)
579.,2013-06-14 11:27:46,61.74,99%,I don't believe in painted roses or bleeding hearts while bu...,No win (2 of 3)
578.,2013-06-14 10:55:12,59.69,97%,He had spent enormous amounts of time at the great libraries...,No win (4 of 5)
577.,2013-06-14 10:53:09,56.96,95%,"The day dawned bleak and chill, a moving wall of gray light ...",No win (2 of 3)
576.,2013-06-14 10:51:37,59.96,97%,"And you know it's time to go, through the sleet and driving ...",No win (2 of 4)
575.,2013-06-14 07:54:58,58.29,95%,"As the netted bag says, this potato was grown in Idaho, that...",Win (1 of 4)
574.,2013-06-14 07:52:48,59.23,96%,"Many people limit themselves to leading boring, dull lives b...",No win (3 of 3)
573.,2013-06-14 07:26:10,60.29,97%,"My friend, I shall be pedagogic, and say you ought to start ...",No win (3 of 3)
572.,2013-06-14 07:25:11,57.79,95%,All time is all time. It does not change. It does not lend i...,No win (3 of 3)
571.,2013-06-14 07:15:07,62.12,95%,"There is no pain, you are receding. A distant ship smoke on ...",Win (1 of 4)
570.,2013-06-14 07:13:51,55.98,94%,Although the United Nations does not have the power to enfor...,No win (4 of 5)
569.,2013-06-14 07:12:36,56.36,97%,It doesn't mean much to be able to filter out most present-d...,Win (1 of 5)
568.,2013-06-14 06:00:13,55.37,94%,A few light taps upon the pane made him turn to the window. ...,No win (2 of 2)
567.,2013-06-14 05:59:06,53.16,95%,I drew the blankets over my head and tried to think of Chris...,No win (4 of 5)
566.,2013-06-14 05:40:25,59.65,97%,"The creation ends in South Georgia, at the very edge of the ...",No win (3 of 5)
565.,2013-06-13 12:16:01,57.39,97%,"You found paradise in America. You had a good trade, made a ...",No win (2 of 5)
564.,2013-06-13 12:11:38,54.21,96%,A few light taps upon the pane made him turn to the window. ...,No win (3 of 4)
563.,2013-06-13 12:09:08,58.41,98%,The great edifice of variety and choice that is an American ...,Win (1 of 3)
562.,2013-06-13 12:07:50,55.67,97%,"There are men who possess a peculiarly strong visual memory,...",No win (3 of 3)
561.,2013-06-13 12:03:20,56.33,96%,"Ever since I was a child, folks have thought they had me peg...",No win (5 of 5)
560.,2013-06-13 12:02:38,55.65,97%,"Air-conditioned, odorless, illuminated by buzzing fluorescen...",No win (3 of 5)
559.,2013-06-13 10:01:48,60.61,96%,"This planet has, or rather had, a problem, which was this: m...",No win (2 of 5)
558.,2013-06-13 09:59:33,64.03,100%,I was long into my second decade of living single before I c...,No win (3 of 4)
557.,2013-06-13 08:05:19,53.58,94%,"You needn't take it any further, sir. You've proved to me th...",No win (3 of 5)
556.,2013-06-13 08:01:51,61.99,98%,"There are two kinds of fibers in our muscles, red and white....",No win (3 of 3)
555.,2013-06-13 07:22:26,59.04,96%,I still see things that are not here. I just choose not to a...,Win (1 of 3)
554.,2013-06-13 07:18:51,54.85,97%,"Alfred Hitchcock once said, ""Drama is life with the dull bit...",No win (3 of 3)
553.,2013-06-13 07:16:23,59.35,97%,There are still some places where you can get all you can ea...,No win (2 of 5)
552.,2013-06-13 07:07:25,59.96,97%,"In short order, Carter then proceeded to kill any chance he ...",No win (2 of 5)
551.,2013-06-13 07:03:54,65.14,98%,I have quit three jobs and been fired from all the rest. Get...,Win (1 of 5)
550.,2013-06-13 07:02:18,62.46,97%,You're going in the drink and I am going to make a cup of te...,No win (2 of 3)
549.,2013-06-13 07:01:18,56.05,95%,"You have a class of young strong men and women, and they wan...",No win (4 of 4)
548.,2013-06-13 06:13:48,59.93,95%,Too often writers believe that they can emphasize words by p...,No win (2 of 3)
547.,2013-06-13 05:42:09,61.78,97%,In order to face down the danger that is stalking us and mov...,Win (1 of 2)
546.,2013-06-13 05:40:16,58.09,97%,"Get it straight buster - I'm not here to say please, I'm her...",No win (2 of 4)
545.,2013-06-13 05:37:58,65.12,98%,"Samatha is a state in which the mind is brought to rest, foc...",Win (1 of 5)
544.,2013-06-12 12:53:42,55.73,97%,"First of all, you must be comfortable, otherwise it will be ...",No win (3 of 3)
543.,2013-06-12 12:52:45,58.45,94%,All that year the animals worked like slaves. But they were ...,Win (1 of 2)
542.,2013-06-12 12:51:30,58.45,94%,Quality humor doesn't just deliver one gag and then tax the ...,No win (3 of 3)
541.,2013-06-12 12:20:53,53.20,92%,Supermarket aisles are the perfect place to practice your gl...,No win (4 of 4)
540.,2013-06-12 12:19:27,60.71,97%,"The creation ends in South Georgia, at the very edge of the ...",No win (2 of 5)
539.,2013-06-12 11:41:05,59.66,94%,"You have a class of young strong men and women, and they wan...",No win (4 of 5)
538.,2013-06-12 11:38:33,58.35,92%,Is it sweeter to exist only in the mind or to exist both in ...,No win (3 of 5)
537.,2013-06-12 11:28:15,60.30,92%,We all know people who are very bright but who do not always...,Win (1 of 5)
536.,2013-06-12 11:27:12,65.94,97%,"I was shaking like a leaf, so without thinking I lit up a ci...",No win (2 of 5)
535.,2013-06-12 11:25:45,61.88,97%,"There is no pain, you are receding. A distant ship smoke on ...",Win (1 of 5)
534.,2013-06-12 10:31:17,65.20,97%,From compositional considerations the tomato layer would be ...,No win (2 of 4)
533.,2013-06-12 10:30:26,65.04,97%,"The less you do with the controls, the less chance of error....",No win (2 of 4)
532.,2013-06-12 10:29:36,62.44,95%,"Keying text quickly is important, but it is more important t...",No win (2 of 3)
531.,2013-06-12 10:28:28,53.73,97%,Buddhism addresses two major types of meditation. Vipassana ...,Win (1 of 4)
530.,2013-06-12 10:22:24,60.08,93%,"I know that the idea of raising well-rounded, smarter kids c...",No win (3 of 3)
529.,2013-06-12 10:20:56,55.75,95%,So what's in this for you? Should you rush out in search of ...,No win (2 of 2)
528.,2013-06-12 10:18:51,58.80,96%,I've flown seven million miles. And I've been waiting on peo...,No win (5 of 5)
527.,2013-06-12 10:17:35,62.34,97%,I've been thinking lots about my life and how quick I'd wash...,No win (3 of 5)
526.,2013-06-12 10:16:32,54.97,97%,The recipe for turning fruit into wine goes something like t...,Win (1 of 2)
525.,2013-06-12 10:02:59,57.24,96%,I can already hear your tune calling me across the room. Whe...,No win (5 of 5)
524.,2013-06-12 09:54:21,60.05,97%,There is a theory which states that if anybody ever discover...,No win (2 of 4)
523.,2013-06-12 09:53:11,57.18,97%,"Ezekiel twenty-five, seventeen: The path of the righteous ma...",Win (1 of 5)
522.,2013-06-12 09:39:02,57.77,96%,We've arranged a global civilization in which most crucial e...,No win (2 of 5)
521.,2013-06-12 09:37:06,60.22,96%,"Today, computers have taken this ancient art out of the craf...",No win (2 of 5)
520.,2013-06-12 09:32:33,56.49,96%,Corn is what feeds the steer that becomes the steak. Corn fe...,No win (3 of 5)
519.,2013-06-12 09:30:35,65.43,97%,His soul swooned slowly as he heard the snow falling faintly...,No win (2 of 4)
518.,2013-06-12 06:30:18,52.37,93%,By studying the cooling of pizza in the gravity free environ...,No win (3 of 3)
517.,2013-06-12 05:32:05,60.95,94%,"We speak of something carried and something carrying, of som...",No win (2 of 3)
516.,2013-06-12 05:28:04,61.53,98%,"I had a dream. There was our world, and the world was dark b...",No win (2 of 5)
515.,2013-06-11 13:01:30,55.49,95%,The basic concept is simple: a satellite in geosynchronous o...,No win (2 of 4)
514.,2013-06-11 12:39:14,49.69,95%,"Oh bliss! Bliss and heaven! Oh, it was gorgeousness and gorg...",No win (1 of 1)
513.,2013-06-11 12:38:06,56.57,93%,"If you are given too many choices, if you are forced to cons...",No win (2 of 5)
512.,2013-06-11 12:36:22,54.26,96%,"Two households, both alike in dignity (in fair Verona, where...",No win (2 of 5)
511.,2013-06-11 12:33:32,60.11,98%,"My darling, you have to be standing up in order to be able t...",No win (4 of 4)
510.,2013-06-11 12:32:28,54.04,92%,One essential rule: make sure the joke is the last possible ...,No win (5 of 5)
509.,2013-06-11 12:31:26,52.97,96%,"The result has been the emergence of what some call the ""win...",No win (4 of 5)
508.,2013-06-11 12:29:55,65.54,98%,I must nevertheless point out that our profession very close...,Win (1 of 4)
507.,2013-06-11 12:28:49,58.55,96%,Lucid but wholly false recollections can easily be induced b...,No win (2 of 4)
506.,2013-06-11 12:11:39,61.06,98%,I'm telling it like it is. Get used to it or put this book d...,No win (2 of 5)
505.,2013-06-11 11:48:53,57.91,95%,Few smart kids can spare the attention that popularity requi...,No win (2 of 2)
504.,2013-06-11 11:47:23,55.20,96%,Glancing through the 1977 Atlanta Yellow Pages reveals a cit...,No win (2 of 4)
503.,2013-06-11 11:46:17,61.25,95%,"A computer needs a manager to administer its operations, jus...",Win (1 of 4)
502.,2013-06-11 11:45:31,54.92,97%,Your inner child will be happy to know that when it comes to...,Win (1 of 2)
501.,2013-06-11 11:19:08,51.14,95%,I'd just like to point out that you were given every opportu...,No win (4 of 5)
500.,2013-06-11 05:18:24,55.28,97%,The development of a living body of literature became indica...,Win (1 of 4)
499.,2013-06-11 05:15:43,53.47,97%,We go waiting for the stars to come showering down. From Mos...,No win (4 of 5)
498.,2013-06-10 13:08:09,52.10,95%,Many wines have more than 14 percent alcohol because the win...,No win (3 of 5)
497.,2013-06-10 12:51:42,54.80,94%,"It's a blue savanna song: somewhere cross the desert, someti...",No win (2 of 4)
496.,2013-06-10 12:50:37,59.57,94%,"One day you're in a funk about things, telling a friend that...",No win (2 of 2)
495.,2013-06-10 12:48:25,51.75,95%,You could choke a dozen donkeys on that! And you're haggling...,No win (3 of 5)
494.,2013-06-10 12:47:19,66.17,96%,The time has come for man to set himself a goal. The time ha...,No win (3 of 3)
493.,2013-06-10 12:45:50,60.17,96%,Everything we hold dear likewise resolves into its original ...,No win (3 of 5)
492.,2013-06-10 12:44:20,56.22,95%,I must not fear. Fear is the mind killer. Fear is the little...,No win (2 of 2)
491.,2013-06-10 12:43:06,55.11,92%,Language is one of the keys to being human. It allows us to ...,Win (1 of 2)
490.,2013-06-10 12:41:54,61.98,94%,The most precious treasures we have in life are the images w...,Win (1 of 5)
489.,2013-06-10 08:52:27,51.47,94%,"Listen, strange women lyin' in ponds distributin' swords is ...",No win (3 of 3)
488.,2013-06-10 08:51:25,54.59,93%,To wash down your chicken nuggets with virtually any soft dr...,No win (2 of 2)
487.,2013-06-10 06:00:14,60.33,96%,The time has come for man to set himself a goal. The time ha...,No win (5 of 5)
486.,2013-06-07 12:46:49,57.58,94%,"But older than me now, more constant, more real, and the fur...",No win (3 of 5)
485.,2013-06-07 12:45:53,51.36,94%,I remember when we used to sit in the government yard in Tre...,No win (3 of 5)
484.,2013-06-07 12:43:54,59.68,99%,"O clear intelligence, force beyond all measure! Gentlemen, I...",No win (4 of 5)
483.,2013-06-07 12:43:07,57.40,94%,"Contrary to the feminist cant, there are many things we can ...",Win (1 of 3)
482.,2013-06-07 12:39:25,51.20,95%,"I did my best, it wasn't much. I couldn't feel, so I tried t...",No win (3 of 3)
481.,2013-06-07 12:38:03,64.08,97%,"As if that blind rage had washed me clean, rid me of hope; f...",No win (2 of 5)
480.,2013-06-07 12:34:47,59.53,96%,"And I said, I don't care if they lay me off either, because ...",No win (2 of 4)
479.,2013-06-07 12:27:45,60.27,99%,"As if that blind rage had washed me clean, rid me of hope; f...",No win (2 of 5)
478.,2013-06-07 12:26:40,57.84,97%,"I'm so glad you came, I'm so glad you remembered, to see how...",No win (5 of 5)
477.,2013-06-07 12:25:40,58.93,97%,"For centuries, human society has taken the gifts of nature f...",Win (1 of 4)
476.,2013-06-07 10:06:48,58.33,96%,"There is no physical separation after the slicing, so that e...",No win (2 of 5)
475.,2013-06-07 09:17:40,58.29,96%,"There are two kinds of fibers in our muscles, red and white....",No win (2 of 3)
474.,2013-06-07 09:16:15,56.79,96%,"Let me get this straight. You think that your client, one of...",No win (4 of 5)
473.,2013-06-07 09:14:23,50.18,93%,All the blue light reflections that color my mind when I sle...,No win (4 of 5)
472.,2013-06-06 11:28:22,59.63,94%,"For centuries, human society has taken the gifts of nature f...",No win (2 of 3)
471.,2013-06-06 11:27:16,56.05,93%,"Ticking away the moments that make up a dull day, you fritte...",No win (5 of 5)
470.,2013-06-06 11:24:08,58.46,96%,"In short order, Carter then proceeded to kill any chance he ...",Win (1 of 3)
469.,2013-06-06 10:53:32,56.07,94%,The basis of the Aztecs' success in creating a great state a...,No win (4 of 5)
468.,2013-06-06 10:52:03,58.47,92%,"Many people limit themselves to leading boring, dull lives b...",No win (4 of 5)
467.,2013-06-06 10:50:17,60.12,95%,"And I said, I don't care if they lay me off either, because ...",Win (1 of 3)
466.,2013-06-06 10:48:44,57.89,95%,"There is no physical separation after the slicing, so that e...",Win (1 of 3)
465.,2013-06-06 10:47:06,58.07,95%,The odds are that you will generally meet the worst of them....,No win (4 of 5)
464.,2013-06-06 09:14:18,53.01,96%,Don't make assumptions - find the courage to ask questions a...,Win (1 of 4)
463.,2013-06-06 05:26:20,57.47,96%,"But, pray how could that which I spoke so many years ago, an...",No win (4 of 5)
462.,2013-06-06 05:24:10,56.84,97%,Yet the web of thought has no such creases and is more like ...,Win (1 of 2)
461.,2013-06-06 05:20:22,56.05,95%,"I know that the idea of raising well-rounded, smarter kids c...",No win (3 of 3)
460.,2013-06-06 05:18:48,57.75,95%,I had the impression of being abandoned by everyone when the...,No win (3 of 5)
459.,2013-06-05 07:00:04,61.00,96%,And when he rode past I seen he was carryin' fire in a horn ...,No win (2 of 3)
458.,2013-06-05 06:58:01,51.61,95%,"For centuries, human society has taken the gifts of nature f...",No win (2 of 4)
457.,2013-06-03 12:36:00,56.21,98%,I've always wondered about this coat business. When I'm in a...,No win (3 of 5)
456.,2013-06-03 12:14:03,56.44,92%,"This planet has, or rather had, a problem, which was this: m...",No win (2 of 4)
455.,2013-06-03 12:09:36,54.08,92%,He implies there is a correlation between his daily work and...,No win (4 of 4)
454.,2013-06-03 11:03:31,56.73,97%,Paper as we know it today was invented in China in around 10...,Win (1 of 3)
453.,2013-06-03 11:02:06,48.08,94%,"Get it straight buster - I'm not here to say please, I'm her...",No win (4 of 5)
452.,2013-06-03 10:52:21,57.05,96%,At first they had tried to keep the finding quiet. After all...,No win (3 of 4)
451.,2013-06-03 09:23:24,57.03,94%,"First of all, you must be comfortable, otherwise it will be ...",Win (1 of 4)
450.,2013-06-03 09:21:11,62.42,96%,"We speak of something carried and something carrying, of som...",No win (2 of 3)
449.,2013-05-31 12:54:47,54.32,95%,All time is all time. It does not change. It does not lend i...,No win (3 of 5)
448.,2013-05-31 12:31:15,53.25,94%,How many roads must a man walk down before you call him a ma...,No win (3 of 5)
447.,2013-05-31 12:23:36,60.28,97%,"That fear had been inside him for many years, it had lived w...",No win (2 of 4)
446.,2013-05-31 12:15:33,59.19,98%,All time is all time. It does not change. It does not lend i...,No win (2 of 3)
445.,2013-05-31 11:18:39,57.75,98%,"Do you smell that? Napalm, son. Nothing else in the world sm...",Win (1 of 3)
444.,2013-05-31 11:14:38,60.60,99%,To wash down your chicken nuggets with virtually any soft dr...,Win (1 of 3)
443.,2013-05-31 10:55:22,55.39,95%,I am learning about twenty new Italian words a day. Where am...,No win (3 of 4)
442.,2013-05-31 10:03:22,54.02,95%,Danger is a topic you're often asked about as a sprinter. Th...,Win (1 of 5)
441.,2013-05-31 09:57:05,58.84,97%,Yet the web of thought has no such creases and is more like ...,No win (5 of 5)
440.,2013-05-31 09:56:06,56.05,95%,The problem we now face is that this thin layer of atmospher...,Win (1 of 2)
439.,2013-05-31 09:35:25,50.57,96%,Groups of illegal miners smuggle themselves down in freight ...,No win (2 of 4)
438.,2013-05-31 09:19:18,55.22,98%,"The melted mozzarella layer, which we shall designate MML, i...",No win (2 of 3)
437.,2013-05-31 09:18:13,59.68,98%,"But no matter how effective the lesson was, I never really u...",No win (4 of 5)
436.,2013-05-28 13:38:39,54.36,97%,"Prior to the 1970's, because the United States had long been...",Win (1 of 2)
435.,2013-05-28 13:36:47,56.13,96%,Glancing through the 1977 Atlanta Yellow Pages reveals a cit...,Win (1 of 4)
434.,2013-05-28 13:35:03,56.34,96%,A giant inverted steel pyramid is perfectly balanced on its ...,No win (2 of 5)
433.,2013-05-28 13:33:40,55.40,96%,Although the United Nations does not have the power to enfor...,No win (2 of 5)
432.,2013-05-28 13:30:59,55.52,95%,In order to become an elf I filled out ten pages' worth of f...,No win (2 of 3)
431.,2013-05-28 13:26:46,58.94,97%,There are still some places where you can get all you can ea...,No win (3 of 5)
430.,2013-05-28 13:20:21,55.53,95%,The time has come for man to set himself a goal. The time ha...,No win (2 of 4)
429.,2013-05-28 13:17:33,62.69,97%,Images of broken light which dance before me like a million ...,Win (1 of 5)
428.,2013-05-28 13:16:31,55.57,97%,I don't know why he saved my life. Maybe in those last momen...,No win (2 of 3)
427.,2013-05-28 13:01:33,52.97,95%,We were all in our late twenties or early-to-middle thirties...,No win (2 of 4)
426.,2013-05-28 13:00:23,55.43,96%,It is greatly to America's advantage that it is a congenial ...,No win (3 of 3)
425.,2013-05-28 12:59:14,58.73,96%,Groups of illegal miners smuggle themselves down in freight ...,Win (1 of 5)
424.,2013-05-28 12:51:18,58.17,95%,"The sooner your kids appreciate the value of work, the more ...",No win (4 of 5)
423.,2013-05-28 12:04:58,52.99,97%,The great edifice of variety and choice that is an American ...,No win (3 of 4)
422.,2013-05-28 11:56:31,62.29,98%,"The creation ends in South Georgia, at the very edge of the ...",No win (3 of 4)
421.,2013-05-28 11:50:53,57.64,96%,I drew the blankets over my head and tried to think of Chris...,Win (1 of 4)
420.,2013-05-24 12:51:06,54.00,99%,It is greatly to America's advantage that it is a congenial ...,No win (2 of 5)
419.,2013-05-24 12:49:56,54.86,95%,I am learning about twenty new Italian words a day. Where am...,No win (3 of 5)
418.,2013-05-24 12:48:47,59.55,96%,The problem we now face is that this thin layer of atmospher...,No win (2 of 5)
417.,2013-05-24 12:47:11,52.35,94%,So what's in this for you? Should you rush out in search of ...,No win (2 of 5)
416.,2013-05-24 12:45:39,51.06,94%,Some have a positive vocation for breaking open safes: from ...,No win (3 of 5)
415.,2013-05-24 12:38:43,56.46,95%,"My name is Turkish. Funny name for an Englishman, I know. My...",No win (5 of 5)
414.,2013-05-24 12:36:37,60.00,97%,"This planet has, or rather had, a problem, which was this: m...",Win (1 of 2)
413.,2013-05-24 12:21:46,58.16,97%,"As if that blind rage had washed me clean, rid me of hope; f...",No win (5 of 5)
412.,2013-05-24 05:53:10,56.57,97%,"As if that blind rage had washed me clean, rid me of hope; f...",Win (1 of 5)
411.,2013-05-24 05:51:54,56.05,97%,The chemistry of an element is determined by the manner in w...,Win (1 of 3)
410.,2013-05-23 18:10:45,52.19,91%,"I know that the idea of raising well-rounded, smarter kids c...",No win (3 of 4)
409.,2013-05-23 18:09:02,59.80,97%,The odds are that you will generally meet the worst of them....,Win (1 of 2)
408.,2013-05-23 18:07:56,55.41,94%,"The creation ends in South Georgia, at the very edge of the ...",No win (3 of 4)
407.,2013-05-23 18:06:22,58.23,96%,And I don't believe in the existence of angels but looking a...,No win (4 of 5)
406.,2013-05-23 18:05:07,52.72,93%,"To some, the rules of etiquette may seem outdated, stuffy an...",No win (3 of 4)
405.,2013-05-23 18:03:33,55.60,97%,Being able to quit things that don't work is integral to bei...,No win (3 of 5)
404.,2013-05-23 18:02:30,51.75,92%,"I believe in love, and I know that you do too. And I believe...",No win (5 of 5)
403.,2013-05-23 13:36:15,51.90,95%,The truth of the matter is that there are a lot of available...,No win (2 of 4)
402.,2013-05-23 13:35:04,48.72,92%,He canceled all his commitments and pulled together the most...,No win (3 of 4)
401.,2013-05-23 13:33:44,54.70,97%,"And though my journeys did take me to a great many states, a...",No win (5 of 5)
400.,2013-05-23 13:28:58,65.77,95%,"The problem is, Willie, is that Charles and yourself are not...",No win (2 of 3)
399.,2013-05-23 13:28:08,54.65,93%,He had spent enormous amounts of time at the great libraries...,No win (4 of 5)
398.,2013-05-23 13:26:45,54.32,96%,We've arranged a global civilization in which most crucial e...,No win (4 of 5)
397.,2013-05-23 13:25:46,52.64,95%,"Specialized uniforms, such as nun and priest garb, can be mo...",Win (1 of 5)
396.,2013-05-23 13:19:25,49.39,96%,"One respondent said ""For women - a lot of games are crap - t...",No win (3 of 5)
395.,2013-05-23 13:12:55,53.17,95%,"A little boy went out to play. When he opened his door, he s...",No win (2 of 4)
394.,2013-05-23 13:11:59,57.66,96%,Being comfortable in the car is critical. If you're not comf...,No win (5 of 5)
393.,2013-05-23 13:08:50,52.68,95%,The problem we now face is that this thin layer of atmospher...,Win (1 of 3)
392.,2013-05-23 12:35:49,51.66,94%,From compositional considerations the tomato layer would be ...,No win (2 of 2)
391.,2013-05-23 11:48:50,53.63,95%,All that year the animals worked like slaves. But they were ...,Win (1 of 4)
390.,2013-05-23 11:47:28,50.47,91%,"In the capital of the Sunbelt South, the quiet revolution of...",No win (2 of 4)
389.,2013-05-23 11:46:36,56.55,98%,"When I was your age, television was called books. And this i...",No win (3 of 4)
388.,2013-05-23 10:51:41,54.87,96%,Come sail your ships around me and burn your bridges down. W...,No win (2 of 4)
387.,2013-05-23 10:46:07,53.61,95%,Groups of illegal miners smuggle themselves down in freight ...,No win (2 of 4)
386.,2013-05-23 10:10:14,54.63,96%,"I'd been walking for hours and, as usual, I'd lost track of ...",Win (1 of 4)
385.,2013-05-23 10:08:48,49.00,94%,"And though my journeys did take me to a great many states, a...",No win (4 of 5)
384.,2013-05-23 10:02:41,51.71,94%,"Whether you're a student, secretary, office administrator, m...",No win (4 of 4)
383.,2013-05-23 05:24:05,57.88,97%,He implies there is a correlation between his daily work and...,Win (1 of 3)
382.,2013-05-22 18:24:19,49.94,93%,I will need my spectacles and a clear head. Today I broke my...,No win (5 of 5)
381.,2013-05-22 18:23:25,50.39,94%,The only message I got was from the company that holds my st...,No win (4 of 4)
380.,2013-05-22 18:21:43,57.67,97%,I still see things that are not here. I just choose not to a...,Win (1 of 5)
379.,2013-05-22 18:19:58,52.70,93%,"I know that the idea of raising well-rounded, smarter kids c...",No win (4 of 5)
378.,2013-05-22 18:18:22,61.47,98%,"Warmer water increases the moisture content of storms, and w...",No win (2 of 5)
377.,2013-05-22 18:17:06,52.87,93%,"You have a class of young strong men and women, and they wan...",No win (3 of 3)
376.,2013-05-22 18:15:49,52.61,96%,To wash down your chicken nuggets with virtually any soft dr...,No win (5 of 5)
375.,2013-05-22 18:14:40,47.66,96%,"She looked terrific. I said to myself, ""Maybe she's going to...",No win (3 of 3)
374.,2013-05-22 18:12:30,64.36,98%,There are still some places where you can get all you can ea...,Win (1 of 5)
373.,2013-05-22 12:04:39,52.55,95%,"And I said, I don't care if they lay me off either, because ...",No win (2 of 4)
372.,2013-05-22 11:55:58,50.72,94%,"The goal of the true seeker is to become a sage, or superior...",No win (4 of 5)
371.,2013-05-22 11:31:12,54.36,95%,"No man is an island, entire of itself; every man is a piece ...",No win (3 of 5)
370.,2013-05-22 11:12:54,47.63,95%,Having endured the racial turmoil of the Civil Rights Moveme...,No win (4 of 4)
369.,2013-05-22 09:02:15,54.22,95%,San Francisco in the middle sixties was a very special time ...,No win (2 of 3)
368.,2013-05-22 08:56:31,53.83,97%,Maybe what I think Tasty Wheat tasted like actually tasted l...,Win (1 of 4)
