367.,2013-05-22 08:48:50,54.99,94%,"One day you're in a funk about things, telling a friend that...",No win (3 of 3)
366.,2013-05-21 15:16:26,51.85,92%,"The only people for me are the mad ones, the ones who are ma...",No win (3 of 3)
365.,2013-05-21 15:14:45,53.74,96%,I know that you weren't bored that day because there was a l...,No win (2 of 4)
364.,2013-05-21 15:13:19,62.58,98%,"You could substitute raspberries or any other fruit, but 99....",Win (1 of 4)
363.,2013-05-21 15:12:37,50.36,91%,"Warmer water increases the moisture content of storms, and w...",No win (5 of 5)
362.,2013-05-21 15:11:13,55.11,96%,"No man is an island, entire of itself; every man is a piece ...",No win (3 of 4)
361.,2013-05-21 15:09:36,56.61,97%,There's sometimes a buggy. How many drivers does a buggy hav...,Win (1 of 2)
360.,2013-05-21 15:08:02,47.97,94%,"Anyway, like I was saying, shrimp is the fruit of the sea. Y...",No win (2 of 5)
359.,2013-05-21 15:06:56,49.39,95%,"She looked terrific. I said to myself, ""Maybe she's going to...",No win (3 of 3)
358.,2013-05-21 15:05:45,55.37,97%,The streets were cleared by a Critical Mass bike ride and we...,No win (2 of 2)
357.,2013-05-21 15:03:10,55.40,93%,Once you get into the processed foods you have to be a fairl...,No win (2 of 5)
356.,2013-05-21 15:01:57,47.10,96%,You could choke a dozen donkeys on that! And you're haggling...,Win (1 of 5)
355.,2013-05-21 15:00:54,52.56,96%,Your inner child will be happy to know that when it comes to...,No win (2 of 3)
354.,2013-05-21 14:58:25,53.71,98%,Stab a sorry heart with your favorite finger. Paint the whol...,No win (3 of 5)
353.,2013-05-21 14:57:19,54.56,97%,Rhymes trap you into saying things you don't want to say. A ...,Win (1 of 3)
352.,2013-05-21 14:56:10,50.65,96%,"We turn away to face the cold, enduring chill, as the day be...",No win (4 of 5)
351.,2013-05-21 12:41:27,46.33,94%,There was a stage and a PA up in western Massachusetts and t...,No win (2 of 4)
350.,2013-05-21 08:26:15,46.65,95%,The Inca believed that if one did not give thanks and obedie...,No win (3 of 4)
349.,2013-05-21 04:56:58,52.42,96%,There are still some places where you can get all you can ea...,No win (2 of 4)
348.,2013-05-21 04:54:37,52.75,97%,The time has come for man to set himself a goal. The time ha...,No win (3 of 3)
347.,2013-05-20 19:29:28,44.62,89%,"In the late 1960s, a growing number of people became concern...",No win (2 of 2)
346.,2013-05-20 19:27:31,51.39,96%,"Your face has fallen sad now, for you know the time is nigh....",No win (2 of 3)
345.,2013-05-20 19:26:05,50.84,95%,Chance and chance alone has a message for us. Everything tha...,No win (2 of 4)
344.,2013-05-20 19:24:34,42.59,95%,"Alfred Hitchcock once said, ""Drama is life with the dull bit...",No win (2 of 2)
343.,2013-05-20 19:22:39,48.98,93%,The beginner writes just twenty pieces. The professional wri...,No win (2 of 4)
342.,2013-05-20 19:21:28,47.95,93%,One essential rule: make sure the joke is the last possible ...,No win (3 of 3)
341.,2013-05-20 19:20:19,48.09,94%,To an outsider's ear it sounds absurdly wild and ridiculous ...,No win (2 of 4)
340.,2013-05-20 19:13:27,51.71,97%,We've known each other for many years but this is the first ...,No win (3 of 4)
339.,2013-05-20 17:59:53,56.84,95%,Although his voice was also broken by uncertainty and his ha...,No win (4 of 4)
338.,2013-05-20 17:58:21,54.37,94%,At first they had tried to keep the finding quiet. After all...,Win (1 of 4)
337.,2013-05-20 17:57:02,55.21,97%,A giant inverted steel pyramid is perfectly balanced on its ...,Win (1 of 2)
336.,2013-05-20 17:55:24,64.67,99%,One essential rule: make sure the joke is the last possible ...,Win (1 of 2)
335.,2013-05-20 17:53:36,55.04,96%,You're here because you know something. What you know you ca...,No win (2 of 4)
334.,2013-05-20 17:51:51,58.04,97%,How many times have you seen the leader of a race have a mec...,No win (2 of 3)
333.,2013-05-20 17:50:09,57.97,96%,Remembering you running soft through the night. You were big...,No win (4 of 5)
332.,2013-05-20 17:49:11,52.36,94%,I drew the blankets over my head and tried to think of Chris...,No win (2 of 4)
331.,2013-05-20 17:47:51,56.48,96%,"I'm so glad you came, I'm so glad you remembered to see how ...",Win (1 of 2)
330.,2013-05-20 17:46:56,48.61,96%,Aztec rule was based upon a system of tribute and fear over ...,No win (3 of 4)
329.,2013-05-20 17:45:10,60.43,98%,"I had a dream. There was our world, and the world was dark b...",No win (3 of 4)
328.,2013-05-20 17:43:43,50.78,93%,"There is no pain, you are receding. A distant ship smoke on ...",No win (4 of 5)
327.,2013-05-20 17:41:13,54.69,97%,The invention of the wheel represented a major turning point...,Win (1 of 2)
326.,2013-05-20 17:39:54,58.26,99%,Even the best-designed chair won't make up for bad posture. ...,No win (4 of 5)
325.,2013-05-20 17:38:59,44.28,95%,"Anyway, like I was saying, shrimp is the fruit of the sea. Y...",No win (2 of 3)
324.,2013-05-20 17:37:47,49.46,97%,"Everyone said I was daft to build a castle on a swamp, but I...",No win (3 of 5)
323.,2013-05-20 17:36:25,55.33,96%,A giant inverted steel pyramid is perfectly balanced on its ...,Win (1 of 4)
322.,2013-05-20 17:34:54,62.98,100%,Good games offer players a set of challenging problems and t...,Win (1 of 4)
321.,2013-05-20 17:34:15,49.38,91%,"Allow me first to apologize for this interruption. I do, lik...",No win (3 of 4)
320.,2013-05-20 17:33:09,48.78,90%,Yet the web of thought has no such creases and is more like ...,No win (3 of 5)
319.,2013-05-20 17:31:58,44.46,96%,"So, I'm tending bar there at Ecklund & Swedlin's last Tu...",No win (4 of 5)
318.,2013-05-20 17:30:05,61.97,97%,Unlike the other four senses located in the logical regions ...,Win (1 of 4)
317.,2013-05-20 17:28:56,54.85,96%,I think you're gonna find - when all this stuff is over and ...,Win (1 of 2)
316.,2013-05-20 17:25:54,48.90,92%,"Imagine considering ""if"" as a two-finger movement instead of...",No win (3 of 4)
315.,2013-05-20 17:24:23,53.22,95%,There are still some places where you can get all you can ea...,No win (3 of 4)
314.,2013-05-20 17:22:38,45.41,90%,A giant inverted steel pyramid is perfectly balanced on its ...,No win (3 of 3)
313.,2013-05-20 17:21:00,53.36,95%,"When I really worry about something, I don't just fool aroun...",No win (3 of 5)
312.,2013-05-20 17:19:59,45.01,93%,"Now you might ask yourself, if by yourself you mean me, ""Ste...",No win (4 of 4)
311.,2013-05-20 17:18:28,53.42,96%,"For centuries, human society has taken the gifts of nature f...",Win (1 of 4)
310.,2013-05-20 16:34:13,50.30,97%,The great edifice of variety and choice that is an American ...,No win (2 of 2)
309.,2013-05-20 16:31:04,50.74,92%,For it is not enough to have a good mind; the main thing is ...,No win (2 of 3)
308.,2013-05-20 16:29:30,54.07,96%,I can already hear your tune calling me across the room. Whe...,No win (2 of 3)
307.,2013-05-20 16:28:14,47.55,94%,"My friend, I shall be pedagogic, and say you ought to start ...",No win (4 of 4)
306.,2013-05-20 16:26:57,48.33,95%,"Every time you practice a technique incorrectly, you're incr...",No win (2 of 5)
305.,2013-05-20 16:25:43,45.60,94%,There's a hole in the world like a great black pit. And the ...,No win (2 of 3)
304.,2013-05-20 16:24:41,37.33,90%,"Excellent. He's enterprising, aggressive, outgoing, young, b...",No win (3 of 3)
303.,2013-05-20 16:23:18,44.98,89%,"Burning my bridges and smashing my mirrors, turning to see i...",No win (3 of 3)
302.,2013-05-20 13:37:25,56.60,96%,"In the casino, the cardinal rule is to keep them playing and...",No win (2 of 4)
301.,2013-05-20 13:35:13,49.17,94%,"Combat for a naval aviator is fought in short, violent burst...",No win (3 of 4)
300.,2013-05-20 13:33:39,56.48,96%,I never said I would stay to the end - I knew I would leave ...,Win (1 of 2)
299.,2013-05-20 13:32:03,57.79,98%,The place to improve the world is first in one's own heart a...,No win (2 of 2)
298.,2013-05-20 13:27:24,55.37,97%,For it is not enough to have a good mind; the main thing is ...,Win (1 of 3)
297.,2013-05-20 13:25:52,58.33,98%,I've been looking so long at these pictures of you that I al...,No win (3 of 5)
296.,2013-05-20 13:24:16,55.25,95%,"Life is not suffering; it's just that you will suffer it, ra...",No win (3 of 4)
295.,2013-05-20 13:22:37,47.19,92%,Yet the web of thought has no such creases and is more like ...,No win (4 of 5)
294.,2013-05-20 13:21:23,50.66,94%,"Life is not suffering; it's just that you will suffer it, ra...",No win (3 of 5)
293.,2013-05-20 13:16:28,43.16,88%,"I've heard there was a secret chord that David played, and i...",No win (4 of 5)
292.,2013-05-20 13:14:13,47.27,91%,"Yet one fine day, in a fit of euphoria, after he had picked ...",Win (1 of 3)
291.,2013-05-20 13:12:38,53.19,93%,"When she returns to the forum page, her post is there. It is...",No win (3 of 5)
290.,2013-05-20 07:35:33,53.84,96%,I'm telling it like it is. Get used to it or put this book d...,Win (1 of 3)
289.,2013-05-20 07:32:29,52.83,97%,I will need my spectacles and a clear head. Today I broke my...,No win (4 of 5)
288.,2013-05-20 07:31:39,47.70,98%,"She was a genius of sadness, immersing herself in it, separa...",No win (3 of 4)
287.,2013-05-20 07:29:54,56.77,97%,"After removal from the oven, the pizza is sliced and plated ...",No win (4 of 4)
286.,2013-05-20 07:28:34,54.87,98%,"Whenever you watch the mind, you withdraw consciousness from...",No win (1 of 1)
285.,2013-05-20 07:27:16,41.61,94%,Parisian French is different from Provincial French and Germ...,No win (3 of 5)
284.,2013-05-20 04:06:06,48.82,95%,"When she returns to the forum page, her post is there. It is...",No win (3 of 5)
283.,2013-05-20 04:04:49,50.49,96%,The problem we now face is that this thin layer of atmospher...,No win (2 of 4)
282.,2013-05-20 04:02:34,56.75,97%,And in the dream I knew that he was goin' on ahead and that ...,No win (2 of 5)
281.,2013-05-20 04:00:05,51.81,96%,There are two places on Earth that serve as canaries in the ...,No win (2 of 4)
280.,2013-05-20 03:55:23,44.25,94%,In order to face down the danger that is stalking us and mov...,No win (2 of 3)
279.,2013-05-20 03:52:41,45.69,91%,Good games offer players a set of challenging problems and t...,No win (3 of 3)
278.,2013-05-20 03:47:47,43.15,94%,"If you don't get what you want, you suffer; if you get what ...",No win (2 of 4)
277.,2013-05-17 13:24:14,56.27,98%,"When she returns to the forum page, her post is there. It is...",No win (3 of 5)
276.,2013-05-17 13:21:35,49.10,93%,I've always wondered about this coat business. When I'm in a...,No win (4 of 5)
275.,2013-05-17 13:20:09,53.90,95%,Every time I think of you I feel shot right through with a b...,No win (2 of 4)
274.,2013-05-17 13:18:36,47.06,94%,Rhymes trap you into saying things you don't want to say. A ...,No win (4 of 4)
273.,2013-05-17 13:14:33,47.46,96%,"Well, it just so happens, this hacienda comes with its very ...",No win (2 of 3)
272.,2013-05-17 13:12:48,56.82,95%,But speculations on the structure of the universe also move ...,No win (2 of 3)
271.,2013-05-17 13:11:31,51.77,93%,I suddenly had the impression that I had been left all alone...,No win (4 of 5)
270.,2013-05-17 13:10:16,54.94,98%,We all know people who are very bright but who do not always...,No win (2 of 5)
269.,2013-05-17 13:09:10,49.79,92%,"First of all, you must be comfortable, otherwise it will be ...",No win (2 of 5)
268.,2013-05-17 13:07:00,46.56,93%,"When I was a kid, you never saw radicchio in the produce sec...",No win (4 of 4)
267.,2013-05-17 13:04:16,48.38,96%,A few light taps upon the pane made him turn to the window. ...,No win (4 of 4)
266.,2013-05-17 12:59:28,50.09,94%,I suddenly had the impression that I had been left all alone...,No win (4 of 5)
265.,2013-05-17 09:21:26,49.91,90%,"The brain can be a tool. It can recall phone numbers, solve ...",No win (2 of 4)
264.,2013-05-17 09:18:59,56.32,97%,"When the light of life has gone, no change for the meter. Th...",No win (2 of 3)
263.,2013-05-17 09:17:51,51.38,97%,"Whether they use the title or not, many lyrics have evocativ...",No win (4 of 4)
262.,2013-05-17 09:16:58,55.58,95%,Typing competitions provided another test of the Qwerty keyb...,Win (1 of 3)
261.,2013-05-17 09:15:49,54.53,92%,Humans need to practice what they are learning a good deal b...,Win (1 of 5)
260.,2013-05-17 09:14:36,56.59,95%,Well I woke in mid-afternoon cause that's when it all hurts ...,No win (2 of 3)
259.,2013-05-17 09:13:26,52.25,92%,The alternative to binge travel - the mini retirement - enta...,No win (4 of 4)
258.,2013-05-17 09:12:13,48.34,92%,The theory of music emphasizes the elements from which music...,No win (3 of 4)
257.,2013-05-17 09:10:37,45.08,96%,"Tis but thy name that is my enemy. Thou art thyself, though ...",No win (2 of 4)
256.,2013-05-17 08:59:43,52.27,96%,By studying the cooling of pizza in the gravity free environ...,No win (4 of 4)
255.,2013-05-17 08:58:57,54.47,98%,We've known each other for many years but this is the first ...,No win (4 of 4)
254.,2013-05-17 08:56:28,55.29,96%,"Whenever you watch the mind, you withdraw consciousness from...",No win (2 of 5)
253.,2013-05-16 21:57:18,52.42,96%,"The brain can be a tool. It can recall phone numbers, solve ...",No win (4 of 5)
252.,2013-05-16 21:55:29,54.27,95%,I am learning about twenty new Italian words a day. Where am...,No win (2 of 3)
251.,2013-05-16 21:52:50,46.70,94%,"The Orient was almost a European invention, and had been sin...",Win (1 of 2)
250.,2013-05-16 21:51:36,50.89,98%,We may climb into the thin and cold realm of pure geometry a...,No win (2 of 5)
249.,2013-05-16 21:50:36,48.78,95%,We were playing checkers. I used to kid her once in a while ...,No win (2 of 4)
248.,2013-05-16 21:48:49,49.73,97%,"But, pray how could that which I spoke so many years ago, an...",No win (3 of 4)
247.,2013-05-16 21:47:20,53.64,96%,"That fear had been inside him for many years, it had lived w...",No win (2 of 4)
246.,2013-05-16 21:45:09,55.85,98%,The good news is that your child has a natural desire to do ...,Win (1 of 3)
245.,2013-05-16 21:44:15,50.51,93%,"Like painting, most software is intended for a human audienc...",Win (1 of 3)
244.,2013-05-16 21:43:10,51.65,97%,"Common knowledge has bicyclists always riding into the wind,...",No win (3 of 4)
243.,2013-05-16 21:41:26,54.06,96%,"A computer needs a manager to administer its operations, jus...",No win (3 of 4)
242.,2013-05-16 21:40:39,54.96,99%,"If you don't get what you want, you suffer; if you get what ...",No win (1 of 1)
241.,2013-05-16 21:16:36,49.29,95%,"I was hugely impressed. Kirk, I mean Shatner, was the ultima...",Win (1 of 5)
240.,2013-05-16 21:15:15,46.25,95%,Data is by definition easy to copy. And the Internet makes c...,No win (2 of 4)
239.,2013-05-16 21:13:28,47.86,95%,"Whether they use the title or not, many lyrics have evocativ...",Win (1 of 5)
238.,2013-05-16 21:12:27,54.09,98%,Your ring finger is the most difficult of all fingers to con...,No win (4 of 5)
237.,2013-05-16 21:11:17,53.46,99%,I've seen things you people wouldn't believe. Attack ships o...,No win (2 of 5)
236.,2013-05-16 21:09:58,43.54,95%,I drew the blankets over my head and tried to think of Chris...,No win (2 of 3)
235.,2013-05-16 21:08:19,38.63,92%,We all know people who are very bright but who do not always...,No win (3 of 3)
234.,2013-05-16 13:19:32,54.20,95%,But speculations on the structure of the universe also move ...,Win (1 of 4)
233.,2013-05-16 12:35:23,46.60,95%,A few light taps upon the pane made him turn to the window. ...,No win (4 of 5)
232.,2013-05-16 12:29:02,40.80,90%,Every time I think of you I feel shot right through with a b...,Win (1 of 5)
231.,2013-05-16 11:31:20,42.11,92%,You've got a way to keep me on your side. You give me cause ...,No win (5 of 5)
230.,2013-05-16 10:52:38,51.66,98%,"Yes, the newspapers were right: snow was general all over Ir...",No win (3 of 5)
229.,2013-05-16 09:56:26,46.06,96%,"Ezekiel twenty-five, seventeen: The path of the righteous ma...",No win (3 of 4)
228.,2013-05-16 08:12:50,44.98,95%,"Imagine this: Here we are, a plane full of grown human being...",No win (2 of 3)
227.,2013-05-16 08:11:00,46.71,97%,"First, the layer of dough bakes into bread, a low-water-cont...",No win (5 of 5)
226.,2013-05-16 08:09:21,42.96,94%,"It is a period of civil war. Rebel spaceships, striking from...",No win (2 of 2)
225.,2013-05-16 08:07:35,49.52,95%,"Burning my bridges and smashing my mirrors, turning to see i...",Win (1 of 5)
224.,2013-05-16 08:06:02,51.22,99%,"I had a dream. There was our world, and the world was dark b...",No win (3 of 5)
223.,2013-05-16 08:03:25,46.90,96%,The pickpockets' profession demands extraordinary nimbleness...,No win (2 of 5)
222.,2013-05-16 07:59:26,53.19,98%,"No matter how bad things are, you can always make things wor...",No win (4 of 5)
221.,2013-05-16 07:58:08,45.38,98%,You've got a way to keep me on your side. You give me cause ...,No win (4 of 5)
220.,2013-05-16 07:56:50,45.37,92%,Always do your best - your best is going to change from mome...,No win (3 of 4)
219.,2013-05-16 07:55:19,52.22,95%,At first they had tried to keep the finding quiet. After all...,No win (5 of 5)
218.,2013-05-16 07:38:52,52.38,98%,I've seen things you people wouldn't believe. Attack ships o...,No win (2 of 5)
217.,2013-05-16 07:37:38,49.88,98%,"Whether they use the title or not, many lyrics have evocativ...",No win (2 of 5)
216.,2013-05-16 07:36:28,44.73,93%,I remember when we used to sit in the government yard in Tre...,No win (3 of 4)
215.,2013-05-16 07:34:58,52.38,97%,"The melted mozzarella layer, which we shall designate MML, i...",No win (2 of 5)
214.,2013-05-16 07:33:48,47.84,96%,"Never give up, no matter how far behind you are, no matter h...",Win (1 of 5)
213.,2013-05-16 05:14:35,41.51,93%,"That's Tommy. He tells people he was named after a gun, but ...",No win (2 of 4)
212.,2013-05-15 13:05:49,39.47,95%,"Disillusion is the greatest gift I can give you. But, becaus...",No win (4 of 5)
211.,2013-05-15 12:58:16,45.67,96%,"Get it straight buster - I'm not here to say please, I'm her...",No win (2 of 2)
210.,2013-05-15 12:54:40,51.35,95%,And I will strike down upon thee with great vengeance and fu...,No win (2 of 4)
209.,2013-05-15 12:53:37,52.02,96%,"No matter how bad things are, you can always make things wor...",Win (1 of 4)
208.,2013-05-15 12:51:51,45.55,94%,Instead of hiring workers during the peak hog kill in the wi...,Win (1 of 3)
207.,2013-05-15 12:50:01,49.77,97%,With the coming of Dean Moriarty began the part of my life y...,No win (4 of 4)
206.,2013-05-15 12:48:26,44.31,96%,Sparkling wines are wines that contain carbon dioxide bubble...,No win (4 of 5)
205.,2013-05-15 12:47:22,47.70,94%,"That fear had been inside him for many years, it had lived w...",No win (2 of 3)
204.,2013-05-15 12:45:59,48.53,97%,"Today, you people are no longer maggots. Today, you are Mari...",No win (2 of 4)
203.,2013-05-15 12:41:48,46.04,95%,"Do you smell that? Napalm, son. Nothing else in the world sm...",No win (2 of 3)
202.,2013-05-15 12:18:36,45.49,96%,Be impeccable with your word - speak with integrity. Say onl...,No win (4 of 5)
201.,2013-05-15 12:16:18,41.77,92%,"Ever since I was a child, folks have thought they had me peg...",No win (4 of 4)
200.,2013-05-15 12:08:59,47.19,94%,I think you're gonna find - when all this stuff is over and ...,No win (4 of 5)
199.,2013-05-15 11:35:09,55.87,95%,Humans need to practice what they are learning a good deal b...,No win (2 of 5)
198.,2013-05-15 11:32:33,49.21,94%,"However we choose to feed ourselves, we eat by the grace of ...",No win (5 of 5)
197.,2013-05-15 11:31:35,51.06,96%,It was hard to toss things I had once thought were valuable ...,No win (2 of 4)
196.,2013-05-15 11:30:10,53.42,97%,His soul swooned slowly as he heard the snow falling faintly...,Win (1 of 4)
195.,2013-05-15 08:43:48,42.74,93%,We've arranged a global civilization in which most crucial e...,No win (2 of 4)
194.,2013-05-15 08:40:04,40.80,94%,Stab a sorry heart with your favorite finger. Paint the whol...,Win (1 of 3)
193.,2013-05-15 08:38:35,38.73,95%,This country is hard on people. Hard and crazy. Got the devi...,No win (3 of 5)
192.,2013-05-15 08:23:46,44.23,91%,"First of all, you must be comfortable, otherwise it will be ...",No win (2 of 4)
191.,2013-05-15 08:22:33,40.63,90%,If there is one thing the history of evolution has taught us...,No win (2 of 5)
190.,2013-05-15 08:17:10,45.80,91%,"Ticking away the moments that make up a dull day, you fritte...",No win (2 of 4)
189.,2013-05-15 08:15:58,56.48,96%,The ultimate way to compose is to be able to keyboard as fas...,No win (3 of 4)
188.,2013-05-15 08:14:33,43.13,92%,"O clear intelligence, force beyond all measure! Gentlemen, I...",No win (3 of 4)
187.,2013-05-15 08:13:15,43.53,94%,"Let me get this straight. You think that your client, one of...",No win (2 of 4)
186.,2013-05-15 08:11:21,46.97,92%,"Throughout my academic career, I'd given some pretty good ta...",No win (4 of 5)
185.,2013-05-15 08:10:16,45.11,92%,This business is filled to the brim with unrealistic people ...,No win (5 of 5)
184.,2013-05-15 08:08:59,47.83,93%,"Ultimately, this is not about solving your problems. It's ab...",Win (1 of 5)
183.,2013-05-15 08:07:36,52.34,95%,But if in efficient causes it is possible to go on to infini...,Win (1 of 3)
182.,2013-05-15 07:59:59,47.23,94%,To wash down your chicken nuggets with virtually any soft dr...,No win (3 of 4)
181.,2013-05-15 07:57:09,45.68,91%,"Historically, most wines contained less than 14 percent alco...",No win (4 of 5)
180.,2013-05-15 07:55:09,48.71,94%,We were playing checkers. I used to kid her once in a while ...,No win (2 of 5)
179.,2013-05-15 07:53:20,39.90,88%,"Keying text quickly is important, but it is more important t...",No win (2 of 4)
178.,2013-05-15 07:52:22,47.52,90%,"First of all, you must be comfortable, otherwise it will be ...",Win (1 of 2)
177.,2013-05-15 07:51:08,42.43,89%,There are two places on Earth that serve as canaries in the ...,No win (2 of 5)
176.,2013-05-15 07:49:11,43.55,89%,"But older than me now, more constant, more real, and the fur...",No win (5 of 5)
175.,2013-05-15 07:46:26,39.93,89%,Do you know what they call a Quarter-pounder with cheese in ...,No win (5 of 5)
174.,2013-05-15 07:45:25,43.08,88%,"In the capital of the Sunbelt South, the quiet revolution of...",No win (3 of 4)
173.,2013-05-15 05:51:59,38.67,87%,By studying the cooling of pizza in the gravity free environ...,No win (3 of 3)
172.,2013-05-15 05:50:43,39.85,91%,"Look, you should admit to yourself that Microsoft will miss ...",No win (3 of 3)
171.,2013-05-13 22:26:18,46.34,91%,"Webster defines intelligence as, ""the ability to apprehend i...",No win (3 of 3)
170.,2013-05-13 21:53:43,47.69,91%,"Hello, hello, hello, is there anybody in there? Just nod if ...",No win (3 of 4)
169.,2013-05-13 21:52:17,47.57,92%,"There is no pain, you are receding. A distant ship smoke on ...",No win (5 of 5)
168.,2013-05-13 21:33:13,54.24,91%,The most precious treasures we have in life are the images w...,No win (2 of 2)
167.,2013-05-13 21:32:05,54.48,94%,"There is no physical separation after the slicing, so that e...",No win (4 of 4)
166.,2013-05-13 21:30:51,46.90,93%,It doesn't mean much to be able to filter out most present-d...,No win (2 of 5)
165.,2013-05-13 21:29:38,47.96,90%,Step out the front door like a ghost into the fog where no o...,No win (2 of 4)
164.,2013-05-13 21:28:04,52.91,96%,I know that you weren't bored that day because there was a l...,No win (2 of 4)
163.,2013-05-13 21:26:49,58.09,98%,"Around midafternoon, the snow thinned into sleet, and some u...",No win (2 of 3)
162.,2013-05-13 21:25:49,46.59,91%,Being comfortable in the car is critical. If you're not comf...,No win (2 of 2)
161.,2013-05-13 21:23:22,49.41,92%,I'd just like to point out that you were given every opportu...,No win (2 of 4)
160.,2013-05-13 21:21:40,52.06,95%,"When you are typing on a typewriter, your input appears dire...",Win (1 of 3)
159.,2013-05-13 21:20:36,42.78,94%,So I'm two inches away from her. Her luscious lips part. Jus...,No win (3 of 3)
158.,2013-05-13 21:19:35,50.51,92%,Being able to quit things that don't work is integral to bei...,No win (2 of 2)
157.,2013-05-13 21:18:18,52.34,97%,Glancing through the 1977 Atlanta Yellow Pages reveals a cit...,No win (2 of 3)
156.,2013-05-13 21:17:09,51.79,93%,But the two men were not lonely at all. At home they were co...,Win (1 of 3)
155.,2013-05-13 21:13:58,48.23,93%,His soul swooned slowly as he heard the snow falling faintly...,No win (4 of 4)
154.,2013-05-13 21:13:01,57.80,95%,San Francisco in the middle sixties was a very special time ...,No win (5 of 5)
153.,2013-05-13 21:11:38,51.75,93%,"In 1972, domestic oil production peaked and then began its i...",No win (2 of 5)
152.,2013-05-13 21:10:24,51.34,94%,"A zealot might be, for instance, an individual with a person...",Win (1 of 3)
151.,2013-05-13 21:08:39,43.58,88%,"She's got a smile that, it seems to me, reminds me of childh...",No win (3 of 3)
150.,2013-05-13 21:06:57,49.52,90%,"The melted mozzarella layer, which we shall designate MML, i...",No win (2 of 3)
149.,2013-05-13 21:05:43,50.53,95%,Even the best-designed chair won't make up for bad posture. ...,No win (2 of 4)
148.,2013-05-13 21:04:32,46.82,92%,"The term ""barbarian"" was created by the Greeks; it was origi...",Win (1 of 2)
147.,2013-05-13 21:03:20,48.89,95%,"All Ninja are men of peace, and must always remain so or los...",No win (4 of 5)
146.,2013-05-13 21:01:04,51.44,93%,But the two men were not lonely at all. At home they were co...,Win (1 of 2)
145.,2013-05-13 20:59:49,46.25,90%,"And I said, I don't care if they lay me off either, because ...",No win (5 of 5)
144.,2013-05-13 17:45:13,47.99,94%,With the coming of Dean Moriarty began the part of my life y...,No win (3 of 4)
143.,2013-05-13 17:43:25,48.92,95%,For it is not enough to have a good mind; the main thing is ...,No win (2 of 2)
