142.,2013-05-13 17:41:46,50.46,95%,"She's got a smile that, it seems to me, reminds me of childh...",No win (3 of 3)
141.,2013-05-13 17:40:29,51.71,93%,"When we conceive of the sweetest being ever, we are conceivi...",No win (4 of 5)
140.,2013-05-13 17:38:58,52.12,95%,I am learning about twenty new Italian words a day. Where am...,No win (2 of 5)
139.,2013-05-13 17:37:34,49.40,94%,"In 1972, domestic oil production peaked and then began its i...",Win (1 of 2)
138.,2013-05-13 17:36:14,47.44,92%,Having endured the racial turmoil of the Civil Rights Moveme...,Win (1 of 2)
137.,2013-05-13 17:34:41,46.92,89%,"There is no physical separation after the slicing, so that e...",Win (1 of 4)
136.,2013-05-13 17:32:31,52.21,92%,"I went to the woods because I wished to live deliberately, t...",No win (2 of 5)
135.,2013-05-13 17:31:28,45.50,92%,So it's all come back round to breaking apart again. Breakin...,Win (1 of 3)
134.,2013-05-13 17:29:21,52.64,95%,Language is one of the keys to being human. It allows us to ...,No win (2 of 4)
133.,2013-05-13 17:28:09,44.25,89%,"Time is tricky. You have whole months, even years, when noth...",No win (3 of 3)
132.,2013-05-13 17:25:32,43.16,92%,"""This man right here,"" McGuinness said, pointing at Kenna, ""...",Win (1 of 4)
131.,2013-05-13 17:23:44,52.46,94%,Language is one of the keys to being human. It allows us to ...,No win (2 of 4)
130.,2013-05-13 17:22:26,47.26,93%,"Often, we assume that a familiar situation will be but a rep...",No win (3 of 4)
129.,2013-05-13 17:21:06,44.64,92%,"There is no physical separation after the slicing, so that e...",No win (2 of 4)
128.,2013-05-13 17:19:39,40.21,89%,"I've heard there was a secret chord that David played, and i...",No win (2 of 5)
127.,2013-05-13 17:16:42,42.25,91%,"Run to the bedroom, in the suitcase on the left, you'll find...",No win (2 of 4)
126.,2013-05-13 17:14:23,47.94,90%,There are very few things I wish I could change about those ...,Win (1 of 5)
125.,2013-05-13 17:12:55,50.04,92%,"There are two kinds of fibers in our muscles, red and white....",No win (2 of 5)
124.,2013-05-13 17:11:21,46.32,92%,"In 1972, domestic oil production peaked and then began its i...",No win (2 of 5)
123.,2013-05-13 17:10:01,51.62,94%,"Samatha is a state in which the mind is brought to rest, foc...",Win (1 of 3)
122.,2013-05-13 17:07:34,43.27,89%,Let me tell you why you're here. You're here because you kno...,No win (2 of 2)
121.,2013-05-13 17:05:36,43.69,88%,The only preventive thing I do is wash clothes after buying ...,No win (3 of 4)
120.,2013-05-13 17:04:05,48.64,93%,The place to improve the world is first in one's own heart a...,Win (1 of 5)
119.,2013-05-13 17:02:23,46.17,95%,And I will strike down upon thee with great vengeance and fu...,Win (1 of 5)
118.,2013-05-13 17:00:46,48.16,94%,"He started running, up and up, until he hurled himself into ...",No win (2 of 5)
117.,2013-05-13 16:59:01,42.58,90%,"All Ninja are men of peace, and must always remain so or los...",Win (1 of 4)
116.,2013-05-13 16:57:06,45.21,91%,"If you are given too many choices, if you are forced to cons...",No win (5 of 5)
115.,2013-05-13 16:55:35,48.74,93%,Remembering you running soft through the night. You were big...,No win (2 of 3)
114.,2013-05-13 16:54:29,52.94,93%,"In the casino, the cardinal rule is to keep them playing and...",Win (1 of 5)
113.,2013-05-13 16:53:19,47.91,95%,"Kid, I've flown from one side of this galaxy to the other, a...",No win (2 of 4)
112.,2013-05-13 16:52:01,43.40,92%,It is greatly to America's advantage that it is a congenial ...,No win (3 of 3)
111.,2013-05-13 16:50:32,40.34,92%,"Anyway, like I was saying, shrimp is the fruit of the sea. Y...",No win (2 of 4)
110.,2013-05-13 16:48:13,44.96,89%,Remembering you running soft through the night. You were big...,No win (2 of 4)
109.,2013-05-13 16:47:03,45.31,91%,The ultimate way to compose is to be able to keyboard as fas...,Win (1 of 5)
108.,2013-05-13 16:45:22,47.84,93%,"Ultimately, this is not about solving your problems. It's ab...",No win (2 of 3)
107.,2013-05-13 16:43:58,46.95,93%,He canceled all his commitments and pulled together the most...,Win (1 of 3)
106.,2013-05-13 16:42:31,43.47,91%,"Many people limit themselves to leading boring, dull lives b...",No win (4 of 5)
105.,2013-05-12 20:17:18,45.97,88%,Don't take anything personally - nothing others do is becaus...,Win (1 of 2)
104.,2013-05-12 20:15:57,45.08,93%,"It turned out that the sweet-talking, tattoo-sporting pikey ...",Win (1 of 3)
103.,2013-05-12 20:14:20,45.47,90%,"The melted mozzarella layer, which we shall designate MML, i...",No win (5 of 5)
102.,2013-05-12 20:13:08,45.11,91%,"In 1972, domestic oil production peaked and then began its i...",Win (1 of 2)
101.,2013-05-12 20:10:15,43.98,90%,"Let's sort the buyers from the spiers, the needy from the gr...",No win (3 of 3)
100.,2013-05-12 20:08:10,44.32,94%,We don't need no education. We don't need no thought control...,Win (1 of 3)
99.,2013-05-12 19:32:11,47.16,92%,"He was rough around the edges. He'd been to school, but neve...",No win (3 of 3)
98.,2013-05-12 19:29:47,49.00,91%,"No man is an island, entire of itself; every man is a piece ...",No win (2 of 5)
97.,2013-05-12 19:28:02,45.73,90%,"To some, the rules of etiquette may seem outdated, stuffy an...",No win (2 of 4)
96.,2013-05-12 19:26:53,41.16,88%,"However we choose to feed ourselves, we eat by the grace of ...",No win (2 of 2)
95.,2013-05-12 19:25:28,48.96,94%,Involuntarily I glanced seaward - and distinguished nothing ...,No win (2 of 3)
94.,2013-05-12 19:24:07,51.48,96%,Even the best-designed chair won't make up for bad posture. ...,No win (3 of 4)
93.,2013-05-12 19:23:00,47.03,95%,"That's Tommy. He tells people he was named after a gun, but ...",Win (1 of 3)
92.,2013-05-12 19:21:44,45.05,90%,What should have been swift revenge turned into an all out w...,No win (2 of 2)
91.,2013-05-12 19:20:07,40.99,87%,"Over the past decade, we've seen strong economic growth but ...",No win (3 of 4)
90.,2013-05-12 19:18:50,50.84,93%,"When I was your age, television was called books. And this i...",No win (2 of 4)
89.,2013-05-12 19:17:49,46.15,92%,"To some, the rules of etiquette may seem outdated, stuffy an...",Win (1 of 2)
88.,2013-05-12 19:16:04,43.93,91%,"When you are typing on a typewriter, your input appears dire...",No win (3 of 4)
87.,2013-05-12 19:14:51,40.52,92%,"Imagine considering ""if"" as a two-finger movement instead of...",No win (3 of 4)
86.,2013-05-12 18:57:57,44.05,90%,Popularity is only partially about individual attractiveness...,No win (2 of 3)
85.,2013-05-12 18:56:31,46.67,89%,"In the late 1960s, a growing number of people became concern...",Win (1 of 2)
84.,2013-05-12 18:54:36,47.63,94%,The only message I got was from the company that holds my st...,Win (1 of 4)
83.,2013-05-12 18:53:15,52.34,95%,Although the United Nations does not have the power to enfor...,No win (2 of 5)
82.,2013-05-12 18:51:57,39.62,92%,And then he calls me a jerk and says the last guy who though...,No win (3 of 3)
81.,2013-05-12 18:50:22,48.75,93%,Unlike the other four senses located in the logical regions ...,Win (1 of 3)
80.,2013-05-12 18:48:40,43.63,89%,The Inca believed that if one did not give thanks and obedie...,No win (2 of 3)
79.,2013-05-12 18:47:21,45.30,93%,"After the grapes are crushed, yeasts (tiny one-celled organi...",Win (1 of 4)
78.,2013-05-12 18:46:06,40.18,92%,"At the very end of these food chains (which is to say, at th...",No win (5 of 5)
77.,2013-05-12 18:44:57,41.01,89%,Chance and chance alone has a message for us. Everything tha...,No win (2 of 4)
76.,2013-05-12 18:15:08,52.95,97%,"As if that blind rage had washed me clean, rid me of hope; f...",Win (1 of 3)
75.,2013-05-12 18:13:40,45.99,90%,Many rivers to cross but I can't seem to find my way over. W...,Win (1 of 4)
74.,2013-05-12 18:12:29,51.05,95%,The treatment of atoms with more than one electron requires ...,No win (3 of 4)
73.,2013-05-12 18:10:40,43.47,94%,Who has a safety deposit box full of money and six passports...,Win (1 of 3)
72.,2013-05-12 18:06:42,41.32,90%,"Radiation could be precisely determined, in principle, if we...",No win (2 of 3)
71.,2013-05-12 18:05:30,40.80,89%,"There is no pain, you are receding. A distant ship smoke on ...",No win (2 of 3)
70.,2013-05-12 18:03:25,43.43,91%,"Burning my bridges and smashing my mirrors, turning to see i...",No win (4 of 4)
69.,2013-05-12 18:01:53,39.23,96%,Who is Keyser Soze? He is supposed to be Turkish. Some say h...,No win (3 of 4)
68.,2013-05-12 18:00:45,41.83,93%,Groups of illegal miners smuggle themselves down in freight ...,No win (4 of 4)
67.,2013-05-12 17:59:14,32.92,89%,"Ergonomics is a term that combines the Greek word ergon, mea...",No win (2 of 2)
66.,2013-05-12 17:56:48,42.54,94%,He canceled all his commitments and pulled together the most...,No win (3 of 4)
65.,2013-05-10 11:51:33,37.55,88%,While it may hold true that the final few seconds of a bike ...,No win (3 of 5)
64.,2013-05-10 11:50:08,38.14,87%,"Life is not suffering; it's just that you will suffer it, ra...",No win (4 of 5)
63.,2013-05-10 11:49:00,47.28,93%,Ideology: the process of making ideas. Certain artisans were...,Win (1 of 2)
62.,2013-05-10 11:47:24,37.19,89%,And then he calls me a jerk and says the last guy who though...,No win (3 of 5)
61.,2013-05-10 11:45:59,48.66,92%,One thing I've learned in the last seven years: in every gam...,No win (3 of 4)
60.,2013-05-10 11:44:54,45.58,92%,"Listen, strange women lyin' in ponds distributin' swords is ...",Win (1 of 2)
59.,2013-05-10 11:43:25,41.15,90%,I'm telling it like it is. Get used to it or put this book d...,No win (3 of 5)
58.,2013-05-10 11:41:20,48.99,89%,"In most cases, there is more to be gained by maximizing the ...",No win (3 of 5)
57.,2013-05-10 11:39:19,45.41,94%,There's a hole in the world like a great black pit. And the ...,No win (3 of 5)
56.,2013-05-10 11:38:18,45.16,92%,"In May 1980, Fidel Castro opened the harbor at Mariel, Cuba ...",No win (3 of 5)
55.,2013-05-10 11:36:26,41.23,90%,"I laugh at the whole notion of ""Mr. Right"" and you should to...",No win (4 of 5)
54.,2013-05-10 11:34:51,46.65,94%,I sincerely believe that if women study male lessons on conc...,No win (2 of 3)
53.,2013-05-10 11:33:26,45.03,93%,Maybe what I think Tasty Wheat tasted like actually tasted l...,No win (4 of 5)
52.,2013-05-10 11:32:00,46.43,91%,"Well, the way they make shows is, they make one show. That s...",No win (5 of 5)
51.,2013-05-10 11:30:12,41.28,89%,Your faith was strong but you needed proof. You saw her bath...,No win (3 of 4)
50.,2013-05-10 11:28:53,46.34,93%,"I'm so glad you came, I'm so glad you remembered to see how ...",No win (2 of 4)
49.,2013-05-10 11:27:47,44.93,91%,"Ticking away the moments that make up a dull day, you fritte...",No win (5 of 5)
48.,2013-05-10 11:26:39,40.92,87%,"When the light of life has gone, no change for the meter. Th...",No win (3 of 5)
47.,2013-05-10 11:25:07,45.70,93%,"Keying text quickly is important, but it is more important t...",No win (3 of 5)
46.,2013-05-10 11:23:52,50.15,96%,"I don't believe in an interventionist God, but I know, darli...",No win (2 of 3)
45.,2013-05-10 11:22:29,51.46,96%,"For centuries, the battle of morality was fought between tho...",No win (2 of 5)
44.,2013-05-10 11:21:16,43.46,92%,"That's Tommy. He tells people he was named after a gun, but ...",No win (3 of 5)
43.,2013-05-10 11:19:02,43.93,89%,Stab a sorry heart with your favorite finger. Paint the whol...,No win (4 of 5)
42.,2013-05-10 11:17:35,46.53,93%,Quality humor doesn't just deliver one gag and then tax the ...,No win (3 of 5)
41.,2013-05-10 11:16:16,42.74,93%,"It's a sunny, woodsy day in Lumberton, so get those chainsaw...",No win (3 of 5)
40.,2013-05-10 11:14:55,43.93,92%,In 1969 four computers located around the country were in co...,Win (1 of 4)
39.,2013-05-10 11:12:58,43.89,89%,Language is one of the keys to being human. It allows us to ...,No win (3 of 5)
38.,2013-05-10 11:11:26,34.61,90%,Glancing through the 1977 Atlanta Yellow Pages reveals a cit...,No win (4 of 5)
37.,2013-05-09 13:53:14,40.36,90%,Many rivers to cross but I can't seem to find my way over. W...,No win (4 of 4)
36.,2013-05-09 13:51:38,37.57,95%,"My dog barks some. Mentally you picture my dog, but I have n...",No win (3 of 3)
35.,2013-05-09 13:50:17,41.66,92%,"In May 1980, Fidel Castro opened the harbor at Mariel, Cuba ...",No win (3 of 3)
34.,2013-05-09 13:48:11,38.89,90%,Many rivers to cross but I can't seem to find my way over. W...,No win (3 of 4)
33.,2013-05-09 13:44:30,43.11,92%,"I don't believe in an interventionist God, but I know, darli...",No win (2 of 5)
32.,2013-05-09 13:42:48,45.91,92%,"If you begin to repeat an error, or if your concentration or...",No win (2 of 4)
31.,2013-05-09 13:41:29,45.39,95%,"On a manual typewriter, strike the key with a nice sharp str...",No win (2 of 5)
30.,2013-05-09 13:40:10,43.07,95%,"Hi, and welcome to the future. San Dimas, California, 2688. ...",Win (1 of 5)
29.,2013-05-09 13:38:15,50.12,97%,"In the casino, the cardinal rule is to keep them playing and...",No win (3 of 5)
28.,2013-05-09 13:34:54,32.35,87%,"A little boy went out to play. When he opened his door, he s...",No win (2 of 4)
27.,2013-05-09 07:24:32,42.52,91%,Consider this: Is the pious being loved by the gods because ...,Win (1 of 2)
26.,2013-05-09 07:23:34,37.18,92%,"Kid, I've flown from one side of this galaxy to the other, a...",Win (1 of 2)
25.,2013-05-09 07:21:55,37.06,90%,Although his voice was also broken by uncertainty and his ha...,No win (3 of 3)
24.,2013-05-08 15:43:31,41.92,92%,"Hello, hello, hello, is there anybody in there? Just nod if ...",No win (3 of 4)
23.,2013-05-08 15:41:48,36.64,85%,Who has a safety deposit box full of money and six passports...,No win (2 of 3)
22.,2013-05-08 15:40:19,39.95,90%,One scientist I met recently told me he reckoned that the av...,No win (3 of 4)
21.,2013-05-08 15:38:36,47.44,95%,"Samatha is a state in which the mind is brought to rest, foc...",Win (1 of 2)
20.,2013-05-08 15:37:11,46.27,95%,"There are two kinds of fibers in our muscles, red and white....",No win (2 of 3)
19.,2013-05-08 15:34:56,38.43,91%,"Burning my bridges and smashing my mirrors, turning to see i...",No win (2 of 4)
18.,2013-05-08 15:33:18,36.99,90%,Is it really necessary to send that email? The more emails y...,No win (2 of 4)
17.,2013-05-08 15:31:19,34.90,89%,"The time I waited seemed endless, and I felt doubts and fear...",No win (2 of 5)
16.,2013-05-08 15:27:35,39.91,92%,Yet the web of thought has no such creases and is more like ...,No win (2 of 4)
15.,2013-05-08 15:25:57,42.16,91%,The alternative to binge travel - the mini retirement - enta...,No win (3 of 5)
14.,2013-05-08 15:24:25,41.02,95%,One essential rule: make sure the joke is the last possible ...,No win (3 of 3)
13.,2013-05-08 15:22:59,40.56,94%,"During the battle, Rebel spies managed to steal secret plans...",No win (2 of 4)
12.,2013-05-08 15:21:22,32.83,86%,"And I said, I don't care if they lay me off either, because ...",No win (3 of 5)
11.,2013-05-08 15:20:13,39.15,92%,Don't make assumptions - find the courage to ask questions a...,No win (3 of 4)
10.,2013-05-08 15:16:10,37.22,93%,"But suddenly, I viddied that thinking was for the gloopy one...",No win (4 of 4)
9.,2013-05-08 12:39:52,36.53,90%,The brain can be a tool. But when you can't stop thinking of...,No win (3 of 5)
8.,2013-05-08 12:38:16,38.58,90%,She's got eyes of the bluest skies as if they thought of rai...,No win (4 of 5)
7.,2013-05-08 11:46:01,32.51,86%,I've flown seven million miles. And I've been waiting on peo...,No win (3 of 4)
6.,2013-05-08 11:44:23,41.40,92%,Now I want you to think and stop being a smart aleck. A man'...,No win (2 of 3)
5.,2013-05-08 11:43:01,31.71,83%,"When I really worry about something, I don't just fool aroun...",No win (3 of 5)
4.,2013-05-08 11:41:06,36.72,89%,I have quit three jobs and been fired from all the rest. Get...,No win (2 of 3)
3.,2013-05-08 11:39:18,23.42,93%,"To evaluate an option from the other side's point of view, c...",No win (2 of 5)
2.,2013-05-08 11:36:52,36.58,90%,All time is all time. It does not change. It does not lend i...,No win (4 of 4)
1.,2013-05-08 11:33:18,49.67,95%,San Francisco in the middle sixties was a very special time ...,No win (3 of 4)
