101.,2008-11-02 18:04:32,115.14,100%,"I'd been walking for hours and, as usual, I'd lost track of ...",Win (1 of 5)
100.,2008-11-02 18:03:16,129.32,100%,She's got eyes of the bluest skies as if they thought of rai...,Win (1 of 5)
99.,2008-11-02 18:02:14,110.47,100%,It was hard to toss things I had once thought were valuable ...,Win (1 of 3)
98.,2008-11-02 18:01:09,97.99,100%,I had a friend who was a heavy drinker. If somebody asked hi...,No win (2 of 2)
97.,2008-11-02 18:00:12,125.95,100%,"Often, we assume that a familiar situation will be but a rep...",Win (1 of 4)
96.,2008-11-02 17:59:20,130.16,100%,In order to face down the danger that is stalking us and mov...,Win (1 of 2)
95.,2008-11-02 17:58:05,117.95,100%,"The Earth is a world, the world is a ball, a ball in a game ...",Win (1 of 3)
94.,2008-11-02 17:57:26,122.30,100%,I said that I would see you because I had heard that you wer...,Win (1 of 4)
93.,2008-11-02 17:56:35,116.71,100%,"Hello, hello, hello, is there anybody in there? Just nod if ...",Win (1 of 4)
92.,2008-11-02 17:55:38,110.79,100%,I've seen things you people wouldn't believe. Attack ships o...,No win (2 of 4)
91.,2008-11-02 17:54:45,107.51,100%,We've arranged a global civilization in which most crucial e...,Win (1 of 2)
90.,2008-11-02 17:54:03,129.17,100%,"But suddenly, I viddied that thinking was for the gloopy one...",Win (1 of 3)
89.,2008-11-02 17:53:13,108.61,100%,What should have been swift revenge turned into an all out w...,No win (2 of 5)
88.,2008-11-02 17:51:21,105.93,100%,"That day, for no particular reason, I decided to go for a li...",Win (1 of 5)
87.,2008-11-02 17:50:25,125.18,100%,The beginner writes just twenty pieces. The professional wri...,Win (1 of 3)
86.,2008-11-02 17:49:38,103.86,100%,"Oh bliss! Bliss and heaven! Oh, it was gorgeousness and gorg...",Win (1 of 2)
85.,2008-11-02 17:48:41,105.15,100%,In order to face down the danger that is stalking us and mov...,No win (2 of 5)
84.,2008-11-02 17:47:40,117.57,100%,"It turned out that the sweet-talking, tattoo-sporting pikey ...",Win (1 of 4)
83.,2008-11-02 17:46:45,110.43,100%,So what's in this for you? Should you rush out in search of ...,No win (2 of 5)
82.,2008-11-02 17:46:05,113.42,100%,Being able to quit things that don't work is integral to bei...,Win (1 of 4)
81.,2008-11-02 17:45:27,95.31,100%,"I was hugely impressed. Kirk, I mean Shatner, was the ultima...",Win (1 of 4)
80.,2008-11-02 17:44:50,108.63,100%,The streets were cleared by a Critical Mass bike ride and we...,No win (2 of 4)
79.,2008-11-02 17:44:03,117.41,100%,The most precious treasures we have in life are the images w...,Win (1 of 4)
78.,2008-11-02 17:43:25,95.13,100%,"On a manual typewriter, strike the key with a nice sharp str...",No win (2 of 3)
77.,2008-11-02 17:42:41,101.69,100%,"The day dawned bleak and chill, a moving wall of gray light ...",Win (1 of 3)
76.,2008-11-02 17:41:39,107.70,100%,"He's got a two day head start on you, which is more than he ...",Win (1 of 3)
75.,2008-11-02 17:40:53,112.09,100%,Facts can be thought of as objective or subjective. Things a...,Win (1 of 4)
74.,2008-11-02 17:39:52,101.13,100%,He had spent enormous amounts of time at the great libraries...,Win (1 of 3)
73.,2008-11-02 17:38:57,100.33,100%,I had a friend who was a heavy drinker. If somebody asked hi...,Win (1 of 3)
72.,2008-11-02 17:38:17,116.95,100%,"Get it straight buster - I'm not here to say please, I'm her...",No win (2 of 3)
71.,2008-11-02 17:37:28,98.49,100%,"Prior to the 1970's, because the United States had long been...",Win (1 of 3)
70.,2008-11-02 17:36:06,113.47,100%,"As if that blind rage had washed me clean, rid me of hope; f...",Win (1 of 3)
69.,2008-11-02 17:35:28,104.60,100%,The treatment of atoms with more than one electron requires ...,Win (1 of 3)
68.,2008-11-02 17:34:20,120.58,100%,And I will strike down upon thee with great vengeance and fu...,Win (1 of 5)
67.,2008-11-02 17:33:44,111.43,100%,"My darling, you have to be standing up in order to be able t...",Win (1 of 4)
66.,2008-11-02 17:32:54,109.67,100%,"The result has been the emergence of what some call the ""win...",Win (1 of 5)
65.,2008-11-02 17:31:59,123.47,100%,The most precious treasures we have in life are the images w...,Win (1 of 4)
64.,2008-11-02 15:30:31,91.97,100%,"Trudging slowly over wet sand, back to the bench where your ...",Win (1 of 5)
63.,2008-11-02 15:29:52,104.67,100%,What? A swallow carrying a coconut? It's not a question of w...,Win (1 of 5)
62.,2008-11-02 15:29:01,135.05,100%,"And you know it's time to go, through the sleet and driving ...",Win (1 of 4)
61.,2008-11-02 15:28:23,107.50,100%,Step out the front door like a ghost into the fog where no o...,No win (2 of 4)
60.,2008-11-02 15:27:28,118.94,100%,"As if that blind rage had washed me clean, rid me of hope; f...",Win (1 of 5)
59.,2008-11-02 15:26:43,112.26,100%,There's sometimes a buggy. How many drivers does a buggy hav...,No win (2 of 5)
58.,2008-11-02 15:26:00,118.18,100%,"This planet has, or rather had, a problem, which was this: m...",Win (1 of 4)
57.,2008-11-02 15:25:06,113.02,100%,A glooming peace this morning with it brings. The sun for so...,Win (1 of 4)
56.,2008-11-02 15:24:15,111.47,100%,"The brain can be a tool. It can recall phone numbers, solve ...",Win (1 of 4)
55.,2008-11-02 15:23:19,116.75,100%,"Good evening, London. Allow me first to apologize for this i...",Win (1 of 3)
54.,2008-11-02 15:22:14,110.96,100%,"That day, for no particular reason, I decided to go for a li...",Win (1 of 3)
53.,2008-11-02 15:21:11,121.45,100%,"Ticking away the moments that make up a dull day, you fritte...",Win (1 of 4)
52.,2008-11-02 15:20:03,113.45,100%,"You have a class of young strong men and women, and they wan...",Win (1 of 5)
51.,2008-11-02 15:19:26,111.92,100%,Overhead the albatross hangs motionless upon the air and dee...,Win (1 of 3)
50.,2008-11-02 15:18:48,119.87,100%,We sit silently and watch the world around us. This has take...,Win (1 of 5)
49.,2008-11-02 15:17:46,115.64,100%,We sit silently and watch the world around us. This has take...,Win (1 of 5)
48.,2008-11-02 15:16:47,111.91,100%,"Run to the bedroom, in the suitcase on the left, you'll find...",Win (1 of 5)
47.,2008-11-02 15:15:46,104.93,100%,I don't believe in painted roses or bleeding hearts while bu...,Win (1 of 4)
46.,2008-11-02 15:15:13,110.22,100%,"There is no pain, you are receding. A distant ship smoke on ...",Win (1 of 4)
45.,2008-11-02 15:14:23,112.75,100%,"If you are given too many choices, if you are forced to cons...",Win (1 of 5)
44.,2008-11-02 15:13:38,100.40,100%,"Comfortable, Mullet? It seems sadly ironic that it's that ti...",Win (1 of 3)
43.,2008-11-02 15:13:09,112.22,100%,"A lot of people, especially this one psychoanalyst guy they ...",Win (1 of 3)
42.,2008-11-02 15:12:15,101.81,100%,"Get it straight buster - I'm not here to say please, I'm her...",Win (1 of 2)
41.,2008-11-02 15:11:25,109.81,100%,"Often, we assume that a familiar situation will be but a rep...",Win (1 of 4)
40.,2008-11-02 15:10:43,101.28,100%,I'm telling it like it is. Get used to it or put this book d...,Win (1 of 5)
39.,2008-11-02 15:09:44,106.81,100%,"I rejected those answers; instead, I chose something differe...",No win (2 of 4)
38.,2008-11-02 15:08:52,119.19,100%,The alternative to binge travel - the mini retirement - enta...,Win (1 of 5)
37.,2008-11-02 15:08:13,104.61,100%,"I rejected those answers; instead, I chose something differe...",Win (1 of 4)
36.,2008-11-02 15:07:14,115.47,100%,I've seen things you people wouldn't believe. Attack ships o...,Win (1 of 5)
35.,2008-11-02 15:06:37,115.01,100%,We all know people who are very bright but who do not always...,No win (2 of 5)
34.,2008-11-02 15:06:00,105.02,100%,Data is by definition easy to copy. And the Internet makes c...,No win (3 of 5)
33.,2008-11-02 15:05:03,88.53,100%,"In 1966, Andy Dufresne escaped from Shawshank prison. All th...",No win (3 of 4)
32.,2008-11-02 15:04:13,109.57,100%,Do I really look like a guy with a plan? You know what I am?...,No win (2 of 5)
31.,2008-11-02 15:03:21,110.53,100%,"Look, you should admit to yourself that Microsoft will miss ...",Win (1 of 3)
30.,2008-11-02 15:02:29,103.76,100%,It's the possibility of having a dream come true that makes ...,No win (2 of 5)
29.,2008-11-02 15:01:53,110.43,100%,Too often writers believe that they can emphasize words by p...,Win (1 of 4)
28.,2008-11-02 15:01:03,98.47,100%,Quality humor doesn't just deliver one gag and then tax the ...,No win (2 of 3)
27.,2008-11-02 15:00:18,87.59,100%,"An essential characteristic of the superhero mythology is, t...",No win (2 of 4)
26.,2008-11-02 14:59:09,108.87,100%,"My dog barks some. Mentally you picture my dog, but I have n...",No win (2 of 4)
25.,2008-11-02 14:58:22,107.08,100%,Sholes consulted with an educator who helped him analyze the...,Win (1 of 3)
24.,2008-11-02 14:57:19,109.35,100%,"It turned out that the sweet-talking, tattoo-sporting pikey ...",No win (2 of 4)
23.,2008-11-02 14:56:35,103.46,100%,The inner surface of the cell wall touches the cytoplasmic m...,Win (1 of 5)
22.,2008-11-02 14:55:50,117.67,100%,We've known each other for many years but this is the first ...,Win (1 of 5)
21.,2008-11-02 14:54:57,127.82,100%,I am learning about twenty new Italian words a day. Where am...,Win (1 of 5)
20.,2008-11-02 14:54:15,114.80,100%,Any finite number divided by infinity is as near to nothing ...,Win (1 of 5)
19.,2008-11-02 14:53:29,89.96,100%,"Geometry sets out from certain conceptions such as ""plane,"" ...",No win (2 of 4)
18.,2008-11-02 14:52:12,93.17,100%,"I rejected those answers; instead, I chose something differe...",No win (2 of 4)
17.,2008-11-02 14:51:10,144.78,100%,"On a manual typewriter, strike the key with a nice sharp str...",Win (1 of 5)
16.,2008-11-02 14:50:36,90.42,100%,"Oh bliss! Bliss and heaven! Oh, it was gorgeousness and gorg...",Win (1 of 5)
15.,2008-11-02 14:49:57,109.44,100%,Is this the real life? Is this just fantasy? Caught in a lan...,No win (2 of 4)
14.,2008-11-02 14:49:07,126.84,100%,"I had a dream. There was our world, and the world was dark b...",Win (1 of 5)
13.,2008-11-02 14:48:19,95.77,100%,"The result has been the emergence of what some call the ""win...",No win (2 of 5)
12.,2008-11-02 14:47:21,107.43,100%,"That day, for no particular reason, I decided to go for a li...",Win (1 of 5)
11.,2008-11-02 14:46:31,100.18,100%,The problem we now face is that this thin layer of atmospher...,No win (2 of 5)
10.,2008-11-02 14:45:31,108.78,100%,"Trudging slowly over wet sand, back to the bench where your ...",Win (1 of 4)
9.,2008-11-02 14:44:58,102.48,100%,"If you don't get what you want, you suffer; if you get what ...",No win (2 of 5)
8.,2008-11-02 14:44:03,105.04,100%,"Has it been five years? Six? It seems like a lifetime, the k...",Win (1 of 3)
7.,2008-11-02 14:43:04,125.80,100%,"We turn away to face the cold, enduring chill, as the day be...",Win (1 of 5)
6.,2008-11-02 14:42:24,124.91,100%,Do you know what they call a Quarter-pounder with cheese in ...,Win (1 of 5)
5.,2008-11-02 14:41:49,125.37,100%,Good games offer players a set of challenging problems and t...,Win (1 of 5)
4.,2008-11-02 14:41:21,116.76,100%,"And you know it's time to go, through the sleet and driving ...",Win (1 of 5)
3.,2008-11-02 14:25:08,112.61,100%,Do you know what they call a Quarter-pounder with cheese in ...,Win (1 of 3)
2.,2008-11-02 14:24:30,111.00,100%,Too often writers believe that they can emphasize words by p...,Win (1 of 2)
1.,2008-11-02 14:22:56,88.80,100%,Involuntarily I glanced seaward - and distinguished nothing ...,Win (1 of 5)
