551.,2017-09-23 18:06:50,107.87,98%,"We acquire a taste for salt. By consuming less salt, we can ...",Win (1 of 5)
550.,2017-09-23 18:05:55,127.01,99%,There are many things we've never done. We've never made our...,Win (1 of 3)
549.,2017-09-23 18:05:06,118.30,99%,"Why, if I had half a chance, I could make an entire movie us...",Win (1 of 5)
548.,2017-09-23 18:04:25,111.64,99%,"Let me tell you the story of right hand, left hand. It's a t...",No win (2 of 2)
547.,2017-09-23 18:03:37,99.93,96%,"That's what makes you dangerous. It's not the mask, it's not...",No win (3 of 5)
546.,2017-09-23 18:02:54,129.97,99%,The Sky People have sent us a message that they can take wha...,Win (1 of 2)
545.,2017-09-23 18:01:18,128.71,99%,"To understand what I'm about to tell you, you need to do som...",Win (1 of 2)
544.,2017-09-23 18:00:10,98.37,96%,She is frequently kind and she's suddenly cruel. She can do ...,No win (2 of 2)
543.,2017-09-23 17:59:30,124.64,99%,We never see the light of day. We plan this thing for weeks ...,Win (1 of 5)
542.,2017-09-23 17:58:43,141.98,99%,"She can lead you to love, she can take you or leave you, she...",Win (1 of 5)
541.,2017-09-23 17:58:21,116.99,97%,It was one of those days when it's a minute away from snowin...,No win (2 of 3)
540.,2017-09-23 17:57:29,137.34,99%,We'd like to know a little bit about you for our files. We'd...,Win (1 of 3)
539.,2017-09-23 17:56:52,104.47,98%,"Titanium is extracted from ores, such as rutile, where the f...",No win (2 of 5)
538.,2017-09-23 17:55:56,130.13,98%,"Love is a command, not just a feeling. Somehow, in the roman...",Win (1 of 4)
537.,2017-09-23 17:55:02,148.02,100%,"And as we wind on down the road, our shadows taller than our...",No win (2 of 4)
536.,2017-09-23 17:54:29,126.79,99%,Mankind doesn't need warfare and bloodshed to prove itself. ...,No win (2 of 3)
535.,2017-09-23 17:53:51,101.11,96%,"'I have come,' he said. 'But I do not choose now to do what ...",No win (2 of 4)
534.,2017-09-23 17:53:21,115.99,96%,"I was just guessing at numbers and figures, pulling the puzz...",No win (3 of 5)
533.,2017-09-23 17:52:54,116.97,97%,"I can feel the heat closing in, feel them out there making t...",Win (1 of 5)
532.,2017-09-23 17:51:56,134.23,99%,"Because some men aren't looking for anything logical, like m...",Win (1 of 3)
531.,2017-09-23 17:51:20,134.55,99%,The most precious treasures we have in life are the images w...,Win (1 of 5)
530.,2017-09-23 17:49:54,136.90,99%,All we need for morality is contained in these words: make o...,Win (1 of 5)
529.,2017-09-23 17:49:26,117.80,98%,"Now that I look back, I don't know why I was so stressed abo...",No win (2 of 3)
528.,2017-09-23 17:48:58,123.30,98%,To an outsider's ear it sounds absurdly wild and ridiculous ...,Win (1 of 3)
527.,2017-09-23 17:48:12,140.80,100%,That's because we're uncool. And while women will always be ...,Win (1 of 4)
526.,2017-09-23 17:47:33,128.16,98%,"Precious are the dead that lie there, every stone over them ...",No win (2 of 5)
525.,2017-09-23 17:46:50,120.75,97%,It now becomes clear that consistency is not a property of a...,No win (2 of 3)
524.,2017-09-23 17:46:11,109.72,98%,You and your words flooded my senses; your sentences left me...,Win (1 of 5)
523.,2017-09-23 17:45:33,113.70,97%,"When Chekhov saw the long winter, he saw a winter bleak and ...",No win (1 of 1)
522.,2017-09-23 17:44:40,134.18,98%,"Demand is related to wants. If goods and services were free,...",Win (1 of 3)
521.,2017-09-23 17:43:56,135.53,99%,Ah how shameless - the way these mortals blame the gods. Fro...,No win (2 of 4)
520.,2017-09-23 17:43:22,140.34,99%,"Every second he breathed, the smell of the grass, the cool a...",Win (1 of 4)
519.,2017-09-23 17:42:28,132.57,99%,But he understood at last what Dumbledore had been trying to...,Win (1 of 3)
518.,2017-09-23 17:41:20,121.14,98%,"For instance, last Monday, he told me to have the Great Wall...",Win (1 of 3)
517.,2017-09-23 17:40:06,137.63,99%,You forget everything. The hours slip by. You travel in your...,No win (2 of 3)
516.,2017-09-23 17:39:08,131.13,99%,The man wrote the best books of his generation. And he was a...,No win (3 of 4)
515.,2017-09-23 17:38:28,103.46,97%,Quit complaining! This way I don't have to waste money on mo...,Win (1 of 2)
514.,2017-09-23 17:37:45,123.27,99%,"This was the most delicious meal he'd had in recent years, a...",No win (2 of 2)
513.,2017-09-23 17:37:01,107.70,98%,Although Dr. Manhattan was the most prominent by far of the ...,No win (2 of 4)
512.,2017-09-23 17:35:58,116.29,98%,I did. I killed him. Threw him right over a rope bridge. I w...,No win (3 of 5)
511.,2013-11-25 00:19:18,111.35,93%,"I don't believe in an interventionist God, but I know, darli...",No win (2 of 4)
510.,2013-11-25 00:18:36,123.46,95%,Even the best-designed chair won't make up for bad posture. ...,No win (2 of 4)
509.,2013-11-25 00:18:01,105.72,93%,"You just couldn't let me go, could you? This is what happens...",Win (1 of 5)
508.,2013-11-25 00:16:48,135.77,98%,And I don't believe in the existence of angels but looking a...,Win (1 of 3)
507.,2013-11-25 00:16:02,125.81,94%,He had spent enormous amounts of time at the great libraries...,Win (1 of 3)
506.,2013-11-25 00:14:44,119.49,93%,You have to wonder: how do the machines know what Tasty Whea...,Win (1 of 3)
505.,2013-11-25 00:13:45,116.81,95%,There's a hole in the world like a great black pit. And the ...,Win (1 of 4)
504.,2012-11-15 14:22:04,119.09,94%,"To some, the rules of etiquette may seem outdated, stuffy an...",Win (1 of 2)
503.,2012-01-09 23:00:23,113.69,90%,"And you know it's time to go, through the sleet and driving ...",Win (1 of 3)
502.,2012-01-09 22:59:11,111.07,90%,"It was an effect of light: quick sunlight dappling, yellow l...",No win (2 of 3)
501.,2012-01-09 22:58:19,118.59,92%,Although the United Nations does not have the power to enfor...,No win (2 of 3)
500.,2012-01-09 22:57:11,110.49,91%,"A zealot might be, for instance, an individual with a person...",No win (2 of 4)
499.,2012-01-09 22:55:50,134.15,98%,"O clear intelligence, force beyond all measure! Gentlemen, I...",Win (1 of 4)
498.,2012-01-09 22:54:40,147.80,98%,One thing I've learned in the last seven years: in every gam...,No win (2 of 4)
497.,2012-01-09 22:52:48,125.62,94%,We may climb into the thin and cold realm of pure geometry a...,Win (1 of 3)
496.,2011-07-28 22:02:56,138.05,97%,There's a hole in the world like a great black pit. And the ...,Win (1 of 2)
495.,2011-07-28 22:00:09,139.96,97%,"Combat for a naval aviator is fought in short, violent burst...",Win (1 of 3)
494.,2011-07-28 21:59:01,110.53,92%,The unknown future rolls toward us. I face it for the first ...,Win (1 of 3)
493.,2011-03-16 13:26:30,151.10,100%,"I went to the woods because I wished to live deliberately, t...",Win (1 of 3)
492.,2011-03-16 13:25:25,129.17,100%,"He's got a two day head start on you, which is more than he ...",No win (2 of 3)
491.,2011-03-16 13:24:28,130.31,100%,Good games offer players a set of challenging problems and t...,No win (2 of 3)
490.,2011-03-16 13:23:33,123.39,100%,He had spent enormous amounts of time at the great libraries...,Win (1 of 3)
489.,2011-03-16 13:21:23,123.94,100%,There is a theory which states that if anybody ever discover...,Win (1 of 2)
488.,2010-11-04 15:11:15,126.45,100%,Supermarket aisles are the perfect place to practice your gl...,Win (1 of 3)
487.,2010-09-22 18:33:51,116.43,100%,Ideology: the process of making ideas. The work was generall...,Win (1 of 2)
486.,2010-09-22 18:32:03,92.04,100%,"Geometry sets out from certain conceptions such as ""plane,"" ...",Win (1 of 2)
485.,2010-09-22 18:30:04,115.37,100%,Many wines have more than 14 percent alcohol because the win...,Win (1 of 2)
484.,2010-09-22 18:28:23,124.98,100%,I said that I would see you because I had heard that you wer...,Win (1 of 2)
483.,2010-09-22 18:27:20,126.63,100%,"They had been given a sign - a powerful, lucid sign - that u...",Win (1 of 2)
482.,2010-09-22 18:26:10,126.59,100%,I know that you weren't bored that day because there was a l...,Win (1 of 2)
481.,2009-12-02 18:12:40,124.87,100%,It was hard to toss things I had once thought were valuable ...,Win (1 of 3)
480.,2009-12-02 18:11:35,118.35,100%,I don't believe in painted roses or bleeding hearts while bu...,Win (1 of 4)
479.,2009-12-02 18:10:53,126.04,100%,"For centuries, human society has taken the gifts of nature f...",Win (1 of 3)
478.,2009-12-02 18:09:09,120.02,100%,I've seen things you people wouldn't believe. Attack ships o...,Win (1 of 2)
477.,2009-12-02 18:08:12,149.98,100%,Many rivers to cross but I can't seem to find my way over. W...,Win (1 of 3)
476.,2009-12-02 17:52:46,110.53,100%,We began to recognize in them a strange obsession. After all...,Win (1 of 2)
475.,2009-12-01 20:02:46,116.64,100%,"The boy has not a real choice, has he? Self-interest, the fe...",Win (1 of 3)
474.,2009-12-01 20:01:58,130.15,100%,"I went to the woods because I wished to live deliberately, t...",No win (2 of 4)
473.,2009-11-30 22:15:27,138.17,100%,You're going in the drink and I am going to make a cup of te...,Win (1 of 2)
472.,2009-11-30 22:14:26,111.29,100%,"I know that the idea of raising well-rounded, smarter kids c...",Win (1 of 2)
471.,2009-11-30 22:13:02,110.54,100%,"Finally, gentlemen, there are people with an hereditary anim...",Win (1 of 2)
470.,2009-11-30 22:11:18,117.72,100%,"And I said, I don't care if they lay me off either, because ...",Win (1 of 2)
469.,2009-11-30 22:10:03,118.45,100%,"The Earth is a world, the world is a ball, a ball in a game ...",Win (1 of 2)
468.,2009-11-30 22:08:33,114.49,100%,"Hello, hello, hello, is there anybody in there? Just nod if ...",Win (1 of 2)
467.,2009-11-30 22:07:19,116.61,100%,"Good games stay within, but at the outer edge, of the player...",Win (1 of 2)
466.,2009-11-30 22:05:40,122.33,100%,"Throughout my academic career, I'd given some pretty good ta...",Win (1 of 2)
465.,2009-11-30 22:04:42,104.02,100%,"Ever since I was a child, folks have thought they had me peg...",Win (1 of 2)
464.,2009-11-30 22:02:59,114.17,100%,It was one of those days when it's a minute away from snowin...,No win (2 of 2)
463.,2009-11-30 22:01:43,137.49,100%,"Whether they use the title or not, many lyrics have evocativ...",Win (1 of 2)
462.,2009-11-30 22:00:55,123.39,100%,Language is one of the keys to being human. It allows us to ...,Win (1 of 2)
461.,2009-11-30 21:59:54,102.72,100%,"Look, you should admit to yourself that Microsoft will miss ...",No win (2 of 2)
460.,2009-11-30 21:58:48,103.76,100%,"Hi, and welcome to the future. San Dimas, California, 2688. ...",Win (1 of 2)
459.,2009-11-30 21:57:33,127.41,100%,"He's got a two day head start on you, which is more than he ...",Win (1 of 2)
458.,2009-11-30 21:56:01,125.26,100%,Many rivers to cross but I can't seem to find my way over. W...,Win (1 of 2)
457.,2009-11-30 21:54:26,116.79,100%,"Today, computers have taken this ancient art out of the craf...",Win (1 of 2)
456.,2009-11-30 21:51:48,128.81,100%,"After removal from the oven, the pizza is sliced and plated ...",Win (1 of 2)
455.,2009-11-30 21:50:01,122.90,100%,"Right, I am going to tell you how this works. You're going i...",Win (1 of 2)
454.,2009-11-30 21:48:31,138.96,100%,"As if that blind rage had washed me clean, rid me of hope; f...",Win (1 of 2)
453.,2009-11-30 21:47:19,141.10,100%,Although his voice was also broken by uncertainty and his ha...,Win (1 of 2)
452.,2009-11-30 21:45:43,141.22,100%,"Trudging slowly over wet sand, back to the bench where your ...",Win (1 of 2)
451.,2009-11-30 21:44:50,120.56,100%,"Do you smell that? Napalm, son. Nothing else in the world sm...",Win (1 of 2)
450.,2009-11-30 21:43:50,131.49,100%,The problem we now face is that this thin layer of atmospher...,Win (1 of 2)
449.,2009-11-30 21:41:17,127.04,100%,It is possible that I already had some presentiment of my fu...,Win (1 of 2)
448.,2009-11-30 21:40:25,93.87,100%,"What about Tony? You know, Bullet Tooth Tony. He'll find you...",Win (1 of 2)
447.,2009-11-30 21:39:09,120.73,100%,Indonesia is a nation of islands - more than seventeen thous...,Win (1 of 2)
446.,2009-11-30 21:37:51,107.56,100%,"No man is an island, entire of itself; every man is a piece ...",Win (1 of 2)
445.,2009-11-30 21:35:40,116.98,100%,We were playing checkers. I used to kid her once in a while ...,Win (1 of 2)
444.,2009-11-30 21:33:27,150.29,100%,It doesn't mean much to be able to filter out most present-d...,Win (1 of 2)
443.,2009-11-30 21:31:56,105.45,100%,"You cannot entice a true thief, and thief by vocation, into ...",Win (1 of 2)
442.,2009-11-30 21:30:35,108.87,100%,"Good evening, London. Allow me first to apologize for this i...",Win (1 of 2)
441.,2009-11-30 21:28:57,104.85,100%,Supermarket aisles are the perfect place to practice your gl...,Win (1 of 2)
440.,2009-11-30 21:26:20,123.18,100%,But the two men were not lonely at all. At home they were co...,Win (1 of 2)
439.,2009-11-30 21:22:30,110.72,100%,Aztec rule was based upon a system of tribute and fear over ...,Win (1 of 2)
438.,2009-11-30 21:21:30,111.36,100%,"Kid, I've flown from one side of this galaxy to the other, a...",No win (2 of 3)
437.,2009-07-10 22:15:05,112.96,100%,"I'd been walking for hours and, as usual, I'd lost track of ...",Win (1 of 2)
436.,2009-07-10 22:13:57,113.11,100%,He had spent enormous amounts of time at the great libraries...,Win (1 of 2)
435.,2009-07-10 22:12:18,116.90,100%,He had spent enormous amounts of time at the great libraries...,Win (1 of 2)
434.,2009-07-10 22:10:46,132.25,100%,"To evaluate an option from the other side's point of view, c...",Win (1 of 2)
433.,2009-07-10 22:09:45,130.97,100%,"It is a period of civil war. Rebel spaceships, striking from...",Win (1 of 2)
432.,2009-07-10 22:08:39,122.38,100%,So what's in this for you? Should you rush out in search of ...,Win (1 of 2)
431.,2008-11-26 22:45:20,107.34,100%,"Yet one fine day, in a fit of euphoria, after he had picked ...",No win (2 of 2)
430.,2008-11-26 22:43:53,112.73,100%,We've arranged a global civilization in which most crucial e...,Win (1 of 2)
429.,2008-11-26 22:41:55,102.05,100%,"If I leave here tomorrow, would you still remember me? For I...",No win (2 of 2)
428.,2008-11-26 22:40:31,107.47,100%,"Warmer water increases the moisture content of storms, and w...",Win (1 of 2)
427.,2008-11-26 22:39:28,101.36,100%,The inner surface of the cell wall touches the cytoplasmic m...,Win (1 of 2)
426.,2008-11-26 22:38:12,119.03,100%,"Combat for a naval aviator is fought in short, violent burst...",Win (1 of 2)
425.,2008-11-26 22:36:25,80.43,100%,"Anyway, like I was saying, shrimp is the fruit of the sea. Y...",Win (1 of 2)
424.,2008-11-26 22:35:01,104.04,100%,"Everyone said I was daft to build a castle on a swamp, but I...",Win (1 of 2)
423.,2008-11-26 22:33:59,114.16,100%,If there is one thing the history of evolution has taught us...,Win (1 of 2)
422.,2008-11-26 22:33:02,100.43,100%,"Oh bliss! Bliss and heaven! Oh, it was gorgeousness and gorg...",Win (1 of 2)
421.,2008-11-26 22:31:57,107.28,100%,Maybe what I think Tasty Wheat tasted like actually tasted l...,No win (2 of 2)
420.,2008-11-26 22:30:42,108.19,100%,I thought climbing the Devil's Thumb would fix all that was ...,Win (1 of 2)
419.,2008-11-26 22:28:51,121.94,100%,Is it really necessary to send that email? The more emails y...,Win (1 of 2)
418.,2008-11-26 22:26:14,102.87,100%,"I rejected those answers; instead, I chose something differe...",Win (1 of 3)
417.,2008-11-26 22:23:58,127.78,100%,Who has a safety deposit box full of money and six passports...,Win (1 of 2)
416.,2008-11-21 23:28:08,92.95,100%,"Ezekiel twenty-five, seventeen: The path of the righteous ma...",No win (2 of 2)
415.,2008-11-21 23:26:34,122.60,100%,Who has a safety deposit box full of money and six passports...,Win (1 of 2)
414.,2008-11-21 23:25:21,134.77,100%,"I had a dream. There was our world, and the world was dark b...",Win (1 of 2)
413.,2008-11-21 23:24:07,111.59,100%,At first they had tried to keep the finding quiet. After all...,Win (1 of 2)
412.,2008-11-21 23:22:47,96.50,100%,"No man is an island, entire of itself; every man is a piece ...",No win (2 of 2)
411.,2008-11-21 23:21:24,114.38,100%,"The problem is, Willie, is that Charles and yourself are not...",Win (1 of 2)
410.,2008-11-21 23:20:18,141.56,100%,Humans need to practice what they are learning a good deal b...,Win (1 of 2)
409.,2008-11-21 23:19:29,109.59,100%,"The world of typing has changed. In the 1970s, every busines...",Win (1 of 2)
408.,2008-11-21 23:18:07,117.79,100%,It doesn't mean much to be able to filter out most present-d...,Win (1 of 2)
407.,2008-11-21 23:17:08,100.13,100%,But speculations on the structure of the universe also move ...,Win (1 of 2)
406.,2008-11-21 23:15:59,95.34,100%,What? A swallow carrying a coconut? It's not a question of w...,Win (1 of 2)
405.,2008-11-21 23:14:38,108.71,100%,It doesn't mean much to be able to filter out most present-d...,Win (1 of 2)
404.,2008-11-21 23:13:28,119.98,100%,Facts can be thought of as objective or subjective. Things a...,Win (1 of 2)
403.,2008-11-21 23:12:11,102.38,100%,"Excellent. He's enterprising, aggressive, outgoing, young, b...",Win (1 of 2)
402.,2008-11-21 23:10:08,110.05,100%,The problem we now face is that this thin layer of atmospher...,Win (1 of 2)
401.,2008-11-21 23:08:30,111.42,100%,"When we pulled out into the winter night and the real snow, ...",Win (1 of 2)
400.,2008-11-21 23:07:28,109.66,100%,"Get it straight buster - I'm not here to say please, I'm her...",Win (1 of 2)
399.,2008-11-21 23:06:09,115.12,100%,For it is not enough to have a good mind; the main thing is ...,Win (1 of 2)
398.,2008-11-21 23:04:24,99.05,100%,"Oh bliss! Bliss and heaven! Oh, it was gorgeousness and gorg...",Win (1 of 2)
397.,2008-11-21 23:03:00,114.39,100%,We all know people who are very bright but who do not always...,Win (1 of 2)
396.,2008-11-21 23:01:32,123.60,100%,"Everyone said I was daft to build a castle on a swamp, but I...",Win (1 of 2)
395.,2008-11-21 22:36:45,128.42,100%,All that year the animals worked like slaves. But they were ...,Win (1 of 2)
394.,2008-11-16 20:23:06,138.35,100%,"We turn away to face the cold, enduring chill, as the day be...",Win (1 of 5)
393.,2008-11-16 20:21:19,123.12,100%,"I was hugely impressed. Kirk, I mean Shatner, was the ultima...",Win (1 of 5)
392.,2008-11-16 20:20:44,120.15,100%,The chemistry of an element is determined by the manner in w...,Win (1 of 5)
391.,2008-11-16 20:19:57,128.44,100%,"As if that blind rage had washed me clean, rid me of hope; f...",Win (1 of 5)
390.,2008-11-16 20:19:19,143.12,100%,We've arranged a global civilization in which most crucial e...,Win (1 of 3)
389.,2008-11-16 20:17:34,129.15,100%,Step out the front door like a ghost into the fog where no o...,Win (1 of 4)
388.,2008-11-16 20:16:47,136.31,100%,"This planet has, or rather had, a problem, which was this: m...",Win (1 of 5)
387.,2008-11-16 20:16:04,109.96,100%,"Often, we assume that a familiar situation will be but a rep...",Win (1 of 3)
386.,2008-11-16 20:15:04,110.80,100%,Is this the real life? Is this just fantasy? Caught in a lan...,Win (1 of 5)
385.,2008-11-16 20:14:19,111.27,100%,We don't need no education. We don't need no thought control...,Win (1 of 3)
384.,2008-11-16 20:13:34,119.34,100%,"Trudging slowly over wet sand, back to the bench where your ...",Win (1 of 3)
383.,2008-11-16 20:12:54,116.27,100%,"Thirdly, however, these wars could now be waged with the new...",Win (1 of 3)
382.,2008-11-16 20:12:03,126.31,100%,"She's got a smile that, it seems to me, reminds me of childh...",Win (1 of 3)
381.,2008-11-15 22:49:12,112.50,100%,The inner surface of the cell wall touches the cytoplasmic m...,Win (1 of 5)
380.,2008-11-15 12:00:41,132.50,100%,I have quit three jobs and been fired from all the rest. Get...,Win (1 of 5)
379.,2008-11-15 11:59:53,113.07,100%,"That's Tommy. He tells people he was named after a gun, but ...",Win (1 of 5)
378.,2008-11-15 11:59:23,137.27,100%,The example of painting can teach us not only how to manage ...,Win (1 of 4)
377.,2008-11-15 11:57:58,123.41,100%,"When I was your age, television was called books. And this i...",Win (1 of 3)
376.,2008-11-15 11:56:30,115.81,100%,But the two men were not lonely at all. At home they were co...,Win (1 of 5)
375.,2008-11-15 11:55:53,116.78,100%,"Let me get this straight. You think that your client, one of...",Win (1 of 5)
374.,2008-11-15 10:11:31,108.25,100%,"Warmer water increases the moisture content of storms, and w...",Win (1 of 4)
373.,2008-11-15 10:10:41,123.12,100%,I said that I would see you because I had heard that you wer...,Win (1 of 3)
372.,2008-11-15 10:09:51,124.36,100%,"To evaluate an option from the other side's point of view, c...",Win (1 of 4)
371.,2008-11-15 10:09:04,117.75,100%,"He's got a two day head start on you, which is more than he ...",Win (1 of 3)
370.,2008-11-15 10:07:19,130.41,100%,"The time I waited seemed endless, and I felt doubts and fear...",Win (1 of 4)
369.,2008-11-15 10:06:43,114.05,100%,The chemistry of an element is determined by the manner in w...,Win (1 of 3)
368.,2008-11-15 10:06:03,127.30,100%,The only preventive thing I do is wash clothes after buying ...,Win (1 of 4)
367.,2008-11-15 10:04:40,127.54,100%,"Let me get this straight. You think that your client, one of...",Win (1 of 4)
366.,2008-11-13 22:33:08,120.73,100%,Humans need to practice what they are learning a good deal b...,Win (1 of 5)
365.,2008-11-13 22:24:53,123.95,100%,I am learning about twenty new Italian words a day. Where am...,Win (1 of 5)
364.,2008-11-13 22:21:38,118.14,100%,"Often, we assume that a familiar situation will be but a rep...",Win (1 of 5)
363.,2008-11-13 22:20:16,143.07,100%,"Ever since I was a child, folks have thought they had me peg...",Win (1 of 5)
362.,2008-11-13 22:18:31,128.93,100%,"He's got a two day head start on you, which is more than he ...",Win (1 of 4)
361.,2008-11-13 22:17:55,132.08,100%,We all know people who are very bright but who do not always...,Win (1 of 4)
360.,2008-11-13 22:17:25,114.74,100%,Now I want you to think and stop being a smart aleck. A man'...,Win (1 of 4)
359.,2008-11-13 22:16:41,125.65,100%,What should have been swift revenge turned into an all out w...,Win (1 of 4)
358.,2008-11-13 22:06:15,136.39,100%,It doesn't mean much to be able to filter out most present-d...,Win (1 of 5)
357.,2008-11-13 21:09:56,116.82,100%,The problem we now face is that this thin layer of atmospher...,Win (1 of 4)
356.,2008-11-13 18:11:14,132.29,100%,I said that I would see you because I had heard that you wer...,Win (1 of 4)
355.,2008-11-13 18:08:38,136.45,100%,Being able to quit things that don't work is integral to bei...,Win (1 of 4)
354.,2008-11-13 18:07:19,126.29,100%,If I'm curt with you it's because time is a factor. I think ...,Win (1 of 5)
353.,2008-11-13 18:06:52,117.62,100%,"Get it straight buster - I'm not here to say please, I'm her...",Win (1 of 5)
352.,2008-11-13 18:05:50,125.95,100%,Let me tell you why you're here. You're here because you kno...,Win (1 of 5)
351.,2008-11-13 18:04:19,120.17,100%,We've known each other for many years but this is the first ...,Win (1 of 3)
350.,2008-11-13 18:02:13,116.10,100%,I've always wondered about this coat business. When I'm in a...,Win (1 of 3)
349.,2008-11-13 18:01:25,137.24,100%,"You needn't take it any further, sir. You've proved to me th...",Win (1 of 3)
348.,2008-11-13 18:00:35,123.11,100%,I have quit three jobs and been fired from all the rest. Get...,Win (1 of 3)
347.,2008-11-13 17:59:50,128.43,100%,"She's got a smile that, it seems to me, reminds me of childh...",No win (2 of 4)
346.,2008-11-13 17:59:12,118.75,100%,Few smart kids can spare the attention that popularity requi...,Win (1 of 4)
345.,2008-11-12 23:04:12,114.55,100%,The only preventive thing I do is wash clothes after buying ...,Win (1 of 5)
344.,2008-11-12 23:03:11,113.52,100%,"The time I waited seemed endless, and I felt doubts and fear...",Win (1 of 4)
343.,2008-11-12 23:02:32,106.33,100%,"I know a bloke who knows a bloke who knows a bloke. Now, I k...",Win (1 of 4)
342.,2008-11-12 23:01:40,124.01,100%,Now I want you to think and stop being a smart aleck. A man'...,Win (1 of 5)
341.,2008-11-11 22:19:40,119.46,100%,"He's got a two day head start on you, which is more than he ...",Win (1 of 2)
340.,2008-11-11 22:18:53,120.97,100%,Popularity is only partially about individual attractiveness...,Win (1 of 5)
339.,2008-11-11 21:33:04,104.79,100%,So what's in this for you? Should you rush out in search of ...,Win (1 of 5)
338.,2008-11-11 21:32:19,100.47,100%,"The problem is, Willie, is that Charles and yourself are not...",No win (2 of 5)
337.,2008-11-11 21:14:59,141.22,100%,I will need my spectacles and a clear head. Today I broke my...,Win (1 of 5)
336.,2008-11-11 21:14:27,121.64,100%,I've seen things you people wouldn't believe. Attack ships o...,Win (1 of 5)
335.,2008-11-11 21:13:32,114.16,100%,"Ticking away the moments that make up a dull day, you fritte...",Win (1 of 5)
334.,2008-11-11 21:11:38,128.42,100%,It's the possibility of having a dream come true that makes ...,Win (1 of 4)
333.,2008-11-11 21:11:03,135.67,100%,"As if that blind rage had washed me clean, rid me of hope; f...",Win (1 of 3)
332.,2008-11-11 21:09:19,148.12,100%,I will need my spectacles and a clear head. Today I broke my...,Win (1 of 4)
331.,2008-11-11 21:08:28,122.00,100%,It doesn't mean much to be able to filter out most present-d...,Win (1 of 4)
330.,2008-11-11 21:07:26,121.41,100%,Good games offer players a set of challenging problems and t...,Win (1 of 5)
329.,2008-11-11 21:06:53,113.77,100%,"To evaluate an option from the other side's point of view, c...",Win (1 of 5)
328.,2008-11-11 21:06:15,113.73,100%,A giant inverted steel pyramid is perfectly balanced on its ...,Win (1 of 5)
327.,2008-11-11 21:03:59,127.83,100%,I don't believe in painted roses or bleeding hearts while bu...,Win (1 of 4)
