326.,2008-11-11 21:03:24,110.82,100%,We don't need no education. We don't need no thought control...,Win (1 of 5)
325.,2008-11-11 21:02:42,131.12,100%,"I was hugely impressed. Kirk, I mean Shatner, was the ultima...",Win (1 of 4)
324.,2008-11-11 21:01:50,122.54,100%,"Whether you're a student, secretary, office administrator, m...",Win (1 of 5)
323.,2008-11-11 21:00:56,111.41,100%,"The terminator wouldn't stop, it would never leave him. It w...",Win (1 of 4)
322.,2008-11-11 21:00:05,123.59,100%,The ultimate way to compose is to be able to keyboard as fas...,Win (1 of 4)
321.,2008-11-11 20:58:39,117.04,100%,I will need my spectacles and a clear head. Today I broke my...,Win (1 of 5)
320.,2008-11-07 18:30:10,116.65,100%,Language is one of the keys to being human. It allows us to ...,Win (1 of 3)
319.,2008-11-06 22:20:47,119.92,100%,It doesn't mean much to be able to filter out most present-d...,Win (1 of 5)
318.,2008-11-06 22:19:21,118.54,100%,We don't need no education. We don't need no thought control...,Win (1 of 4)
317.,2008-11-06 22:18:38,114.03,100%,I said that I would see you because I had heard that you wer...,No win (2 of 5)
316.,2008-11-06 22:17:43,119.34,100%,"Kid, I've flown from one side of this galaxy to the other, a...",Win (1 of 4)
315.,2008-11-06 22:16:41,132.42,100%,"This planet has, or rather had, a problem, which was this: m...",Win (1 of 4)
314.,2008-11-06 22:06:17,105.92,100%,"My dog barks some. Mentally you picture my dog, but I have n...",No win (2 of 5)
313.,2008-11-06 20:32:27,116.39,100%,"My darling, you have to be standing up in order to be able t...",Win (1 of 5)
312.,2008-11-06 20:31:42,133.50,100%,I've seen things you people wouldn't believe. Attack ships o...,Win (1 of 4)
311.,2008-11-06 20:30:13,126.21,100%,"Throughout my academic career, I'd given some pretty good ta...",Win (1 of 5)
310.,2008-11-06 20:29:31,135.10,100%,And I will strike down upon thee with great vengeance and fu...,Win (1 of 5)
309.,2008-11-06 20:28:57,123.46,100%,We all know people who are very bright but who do not always...,No win (2 of 5)
308.,2008-11-06 20:27:40,116.91,100%,The alternative to binge travel - the mini retirement - enta...,Win (1 of 3)
307.,2008-11-06 20:26:50,115.23,100%,"Keying text quickly is important, but it is more important t...",Win (1 of 5)
306.,2008-11-06 20:25:54,122.34,100%,"When I was your age, television was called books. And this i...",Win (1 of 3)
305.,2008-11-06 20:24:54,121.99,100%,"As if that blind rage had washed me clean, rid me of hope; f...",Win (1 of 4)
304.,2008-11-06 20:21:53,110.97,100%,We've arranged a global civilization in which most crucial e...,Win (1 of 4)
303.,2008-11-06 20:21:20,104.22,100%,"My dog barks some. Mentally you picture my dog, but I have n...",No win (2 of 5)
302.,2008-11-06 18:30:38,125.75,100%,Images of broken light which dance before me like a million ...,Win (1 of 5)
301.,2008-11-06 18:30:00,119.72,100%,He had spent enormous amounts of time at the great libraries...,Win (1 of 5)
300.,2008-11-06 18:29:18,114.27,100%,"Throughout my academic career, I'd given some pretty good ta...",Win (1 of 5)
299.,2008-11-06 18:28:50,117.09,100%,"Well, it just so happens, this hacienda comes with its very ...",Win (1 of 5)
298.,2008-11-06 18:28:08,120.77,100%,"You found paradise in America. You had a good trade, made a ...",Win (1 of 5)
297.,2008-11-06 18:26:08,124.28,100%,Chance and chance alone has a message for us. Everything tha...,Win (1 of 4)
296.,2008-11-06 18:25:21,104.87,100%,"Keying text quickly is important, but it is more important t...",Win (1 of 5)
295.,2008-11-06 18:24:47,113.51,100%,Data is by definition easy to copy. And the Internet makes c...,Win (1 of 5)
294.,2008-11-06 18:23:54,134.96,100%,"And in the world a heart of darkness, a firezone, where poet...",Win (1 of 4)
293.,2008-11-06 18:23:10,109.15,100%,The inner surface of the cell wall touches the cytoplasmic m...,Win (1 of 5)
292.,2008-11-06 17:46:28,128.77,100%,Images of broken light which dance before me like a million ...,Win (1 of 4)
291.,2008-11-06 17:45:43,134.37,100%,"Because they're at the bottom of the scale, nerds are a safe...",Win (1 of 5)
290.,2008-11-06 17:44:16,137.40,100%,"When I was your age, television was called books. And this i...",Win (1 of 5)
289.,2008-11-06 17:43:35,128.03,100%,"The time I waited seemed endless, and I felt doubts and fear...",Win (1 of 4)
288.,2008-11-06 17:42:48,110.57,100%,"You needn't take it any further, sir. You've proved to me th...",Win (1 of 5)
287.,2008-11-06 17:42:00,114.66,100%,Facts can be thought of as objective or subjective. Things a...,Win (1 of 5)
286.,2008-11-06 17:41:01,118.23,100%,"This planet has, or rather had, a problem, which was this: m...",Win (1 of 2)
285.,2008-11-06 17:39:33,110.73,100%,We don't need no education. We don't need no thought control...,Win (1 of 3)
284.,2008-11-05 21:55:22,118.69,100%,It was hard to toss things I had once thought were valuable ...,Win (1 of 3)
283.,2008-11-05 20:22:42,113.64,100%,"Keying text quickly is important, but it is more important t...",Win (1 of 3)
282.,2008-11-05 20:21:35,124.63,100%,"A little boy went out to play. When he opened his door, he s...",Win (1 of 3)
281.,2008-11-05 20:20:37,101.50,100%,The inner surface of the cell wall touches the cytoplasmic m...,Win (1 of 2)
280.,2008-11-04 23:49:58,111.46,100%,He canceled all his commitments and pulled together the most...,Win (1 of 2)
279.,2008-11-04 23:48:42,109.47,100%,He had spent enormous amounts of time at the great libraries...,Win (1 of 2)
278.,2008-11-04 23:45:48,110.52,100%,"Keying text quickly is important, but it is more important t...",Win (1 of 2)
277.,2008-11-04 23:44:21,108.60,100%,If you're working out in front of a mirror and watching your...,Win (1 of 2)
276.,2008-11-04 23:43:02,113.54,100%,"Good games stay within, but at the outer edge, of the player...",Win (1 of 2)
275.,2008-11-04 23:41:50,131.02,100%,Let me tell you why you're here. You're here because you kno...,Win (1 of 2)
274.,2008-11-04 23:37:11,103.49,100%,One thing I've learned in the last seven years: in every gam...,Win (1 of 2)
273.,2008-11-04 23:35:45,122.09,100%,"On a manual typewriter, strike the key with a nice sharp str...",Win (1 of 2)
272.,2008-11-04 23:24:48,128.35,100%,"Time is tricky. You have whole months, even years, when noth...",Win (1 of 2)
271.,2008-11-04 23:22:49,103.49,100%,"The Orient was almost a European invention, and had been sin...",Win (1 of 2)
270.,2008-11-04 23:18:21,126.21,100%,She's got eyes of the bluest skies as if they thought of rai...,Win (1 of 2)
269.,2008-11-04 23:16:08,109.42,100%,"Allow me first to apologize for this interruption. I do, lik...",Win (1 of 2)
268.,2008-11-04 23:13:10,106.22,100%,If I'm curt with you it's because time is a factor. I think ...,Win (1 of 4)
267.,2008-11-04 23:09:52,112.24,100%,"And you know it's time to go, through the sleet and driving ...",Win (1 of 2)
266.,2008-11-04 22:43:53,115.36,100%,"Yes, the newspapers were right: snow was general all over Ir...",Win (1 of 4)
265.,2008-11-04 22:42:02,110.11,100%,"Yes, the newspapers were right: snow was general all over Ir...",Win (1 of 4)
264.,2008-11-04 22:41:20,110.50,100%,Facts can be thought of as objective or subjective. Things a...,Win (1 of 3)
263.,2008-11-04 22:40:29,111.17,100%,"Ticking away the moments that make up a dull day, you fritte...",No win (3 of 5)
262.,2008-11-04 22:39:26,107.61,100%,"Hey Mr. Tambourine Man, play a song for me, I'm not sleepy a...",No win (3 of 4)
261.,2008-11-04 22:38:25,114.61,100%,If you're working out in front of a mirror and watching your...,Win (1 of 5)
260.,2008-11-04 22:37:30,121.24,100%,There is a theory which states that if anybody ever discover...,Win (1 of 4)
259.,2008-11-04 22:36:44,104.02,100%,So I'm two inches away from her. Her luscious lips part. Jus...,Win (1 of 3)
258.,2008-11-04 22:34:28,116.48,100%,"Imagine a vast sheet of paper on which straight Lines, Trian...",Win (1 of 4)
257.,2008-11-04 22:33:35,115.21,100%,"If you really want to hear about it, the first thing you'll ...",Win (1 of 5)
256.,2008-11-04 21:29:55,121.23,100%,One essential rule: make sure the joke is the last possible ...,No win (2 of 4)
255.,2008-11-04 21:29:21,126.60,100%,"I hope that whoever you are, you escape this place. I hope t...",No win (2 of 5)
254.,2008-11-04 21:27:40,107.27,100%,"No matter how bad things are, you can always make things wor...",Win (1 of 3)
253.,2008-11-04 21:26:06,113.70,100%,It is possible that I already had some presentiment of my fu...,No win (2 of 5)
252.,2008-11-04 21:25:28,115.63,100%,"Tis but thy name that is my enemy. Thou art thyself, though ...",Win (1 of 5)
251.,2008-11-04 21:24:41,125.87,100%,Who has a safety deposit box full of money and six passports...,Win (1 of 4)
250.,2008-11-04 20:56:01,121.82,100%,The chemistry of an element is determined by the manner in w...,Win (1 of 4)
249.,2008-11-04 20:55:21,123.82,100%,I suddenly had the impression that I had been left all alone...,Win (1 of 4)
248.,2008-11-04 20:54:40,114.36,100%,The chemistry of an element is determined by the manner in w...,Win (1 of 4)
247.,2008-11-04 20:51:12,122.06,100%,"In the casino, the cardinal rule is to keep them playing and...",No win (2 of 5)
246.,2008-11-04 20:50:37,107.32,100%,Data is by definition easy to copy. And the Internet makes c...,Win (1 of 5)
245.,2008-11-04 20:49:33,123.51,100%,Popularity is only partially about individual attractiveness...,Win (1 of 4)
244.,2008-11-04 20:48:34,115.98,100%,A giant inverted steel pyramid is perfectly balanced on its ...,Win (1 of 3)
243.,2008-11-04 20:47:36,126.41,100%,If there is one thing the history of evolution has taught us...,Win (1 of 3)
242.,2008-11-04 20:46:58,124.78,100%,And I will strike down upon thee with great vengeance and fu...,Win (1 of 3)
241.,2008-11-04 20:44:53,99.24,100%,A giant inverted steel pyramid is perfectly balanced on its ...,No win (2 of 5)
240.,2008-11-04 20:44:00,108.24,100%,"The day dawned bleak and chill, a moving wall of gray light ...",Win (1 of 5)
239.,2008-11-04 20:42:56,116.87,100%,I said that I would see you because I had heard that you wer...,Win (1 of 3)
238.,2008-11-04 20:15:38,110.39,100%,"Do you smell that? Napalm, son. Nothing else in the world sm...",Win (1 of 5)
237.,2008-11-04 19:27:13,109.48,100%,"Padre, these are subtleties! We are not concerned with motiv...",Win (1 of 3)
236.,2008-11-04 19:26:16,110.71,100%,What should have been swift revenge turned into an all out w...,Win (1 of 3)
235.,2008-11-04 19:25:31,110.43,100%,"You found paradise in America. You had a good trade, made a ...",Win (1 of 3)
234.,2008-11-04 19:24:42,117.45,100%,"Time is tricky. You have whole months, even years, when noth...",Win (1 of 4)
233.,2008-11-04 19:23:55,109.97,100%,"A long time ago, I was in Burma, my friends and I were worki...",Win (1 of 3)
232.,2008-11-04 16:39:28,110.15,100%,"When I really worry about something, I don't just fool aroun...",No win (2 of 5)
231.,2008-11-04 16:38:48,117.18,100%,There's sometimes a buggy. How many drivers does a buggy hav...,Win (1 of 4)
230.,2008-11-04 16:38:12,113.63,100%,"But, pray how could that which I spoke so many years ago, an...",Win (1 of 4)
229.,2008-11-04 16:37:29,112.01,100%,He canceled all his commitments and pulled together the most...,Win (1 of 4)
228.,2008-11-04 16:36:47,114.26,100%,"I'd been walking for hours and, as usual, I'd lost track of ...",Win (1 of 4)
227.,2008-11-04 16:35:46,115.72,100%,Let's face it: there are tons of things in your home and lif...,Win (1 of 3)
226.,2008-11-04 16:34:57,105.55,100%,"The boy has not a real choice, has he? Self-interest, the fe...",Win (1 of 4)
225.,2008-11-04 15:15:43,120.30,100%,"It was a marvelous night, the sort of night one only experie...",Win (1 of 3)
224.,2008-11-04 15:13:58,109.63,100%,My entire life had been on a predictable trajectory dominate...,Win (1 of 4)
223.,2008-11-04 15:13:08,124.21,100%,"You have a class of young strong men and women, and they wan...",Win (1 of 4)
222.,2008-11-04 15:12:26,106.19,100%,"The only people for me are the mad ones, the ones who are ma...",Win (1 of 3)
221.,2008-11-04 15:11:24,124.27,100%,"Keying text quickly is important, but it is more important t...",Win (1 of 5)
220.,2008-11-04 15:10:46,104.26,100%,"Throughout my academic career, I'd given some pretty good ta...",Win (1 of 4)
219.,2008-11-04 15:10:08,105.80,100%,"Everyone said I was daft to build a castle on a swamp, but I...",Win (1 of 5)
218.,2008-11-04 15:09:14,108.63,100%,We don't need no education. We don't need no thought control...,Win (1 of 3)
217.,2008-11-04 15:08:25,103.20,100%,You have to wonder: how do the machines know what Tasty Whea...,Win (1 of 5)
216.,2008-11-04 15:07:22,121.85,100%,For it is not enough to have a good mind; the main thing is ...,Win (1 of 5)
215.,2008-11-04 13:32:02,115.04,100%,Let me tell you why you're here. You're here because you kno...,Win (1 of 3)
214.,2008-11-04 13:30:58,116.74,100%,"Today, you people are no longer maggots. Today, you are Mari...",Win (1 of 4)
213.,2008-11-04 12:50:06,117.59,100%,"A little boy went out to play. When he opened his door, he s...",Win (1 of 5)
212.,2008-11-04 12:49:39,104.34,100%,You could choke a dozen donkeys on that! And you're haggling...,Win (1 of 5)
211.,2008-11-04 12:48:38,134.92,100%,Space is big. Really big. You just won't believe how vastly ...,Win (1 of 5)
210.,2008-11-04 12:48:08,104.13,100%,He canceled all his commitments and pulled together the most...,Win (1 of 5)
209.,2008-11-04 12:47:09,97.64,100%,"I was shaking like a leaf, so without thinking I lit up a ci...",No win (2 of 4)
208.,2008-11-04 12:45:44,126.84,100%,We've arranged a global civilization in which most crucial e...,Win (1 of 5)
207.,2008-11-04 12:15:37,107.65,100%,Do I really look like a guy with a plan? You know what I am?...,Win (1 of 5)
206.,2008-11-04 12:13:07,123.84,100%,"He's got a two day head start on you, which is more than he ...",Win (1 of 3)
205.,2008-11-04 12:12:22,131.02,100%,"There is no pain, you are receding. A distant ship smoke on ...",Win (1 of 4)
204.,2008-11-04 12:10:59,121.68,100%,Chance and chance alone has a message for us. Everything tha...,Win (1 of 3)
203.,2008-11-04 12:10:16,112.93,100%,The only preventive thing I do is wash clothes after buying ...,Win (1 of 4)
202.,2008-11-04 12:09:12,133.61,100%,The example of painting can teach us not only how to manage ...,Win (1 of 3)
201.,2008-11-04 12:08:32,117.45,100%,"Combat for a naval aviator is fought in short, violent burst...",Win (1 of 5)
200.,2008-11-03 23:41:50,104.17,100%,Who is Keyser Soze? He is supposed to be Turkish. Some say h...,Win (1 of 5)
199.,2008-11-03 23:40:31,103.16,100%,"I'd been walking for hours and, as usual, I'd lost track of ...",No win (2 of 4)
198.,2008-11-03 23:26:52,121.05,100%,She's got eyes of the bluest skies as if they thought of rai...,Win (1 of 5)
197.,2008-11-03 23:26:11,110.89,100%,And I will strike down upon thee with great vengeance and fu...,Win (1 of 5)
196.,2008-11-03 18:30:33,119.54,100%,Too often writers believe that they can emphasize words by p...,Win (1 of 5)
195.,2008-11-03 18:29:41,104.75,100%,"The day dawned bleak and chill, a moving wall of gray light ...",Win (1 of 3)
194.,2008-11-03 18:28:41,122.39,100%,"As if that blind rage had washed me clean, rid me of hope; f...",Win (1 of 5)
193.,2008-11-03 12:15:50,72.20,100%,"An essential characteristic of the superhero mythology is, t...",Win (1 of 3)
192.,2008-11-03 10:59:44,118.13,100%,"Let's sort the buyers from the spiers, the needy from the gr...",Win (1 of 4)
191.,2008-11-03 10:57:19,125.10,100%,"When I really worry about something, I don't just fool aroun...",Win (1 of 3)
190.,2008-11-03 10:56:46,101.65,100%,He canceled all his commitments and pulled together the most...,Win (1 of 4)
189.,2008-11-03 10:55:59,106.53,100%,"Common knowledge has bicyclists always riding into the wind,...",Win (1 of 3)
188.,2008-11-03 10:54:56,123.97,100%,Since every piece of matter in the Universe is in some way a...,Win (1 of 5)
187.,2008-11-03 10:54:13,101.49,100%,"Milt, with the excellent timing of a master comedy writer, w...",Win (1 of 4)
186.,2008-11-03 10:40:58,114.09,100%,"The time I waited seemed endless, and I felt doubts and fear...",Win (1 of 5)
185.,2008-11-03 10:40:22,126.45,100%,Let me tell you why you're here. You're here because you kno...,Win (1 of 4)
184.,2008-11-03 10:39:23,117.83,100%,We've known each other for many years but this is the first ...,Win (1 of 5)
183.,2008-11-03 10:38:26,114.75,100%,The ultimate way to compose is to be able to keyboard as fas...,Win (1 of 5)
182.,2008-11-03 10:37:38,113.78,100%,Humans need to practice what they are learning a good deal b...,Win (1 of 4)
181.,2008-11-03 10:37:03,117.46,100%,One essential rule: make sure the joke is the last possible ...,Win (1 of 4)
180.,2008-11-03 10:36:27,119.42,100%,"She's got a smile that, it seems to me, reminds me of childh...",Win (1 of 5)
179.,2008-11-03 10:35:24,134.06,100%,"Life is not suffering; it's just that you will suffer it, ra...",Win (1 of 4)
178.,2008-11-03 10:34:58,110.69,100%,All time is all time. It does not change. It does not lend i...,Win (1 of 4)
177.,2008-11-03 10:34:20,102.73,100%,"And I said, I don't care if they lay me off either, because ...",Win (1 of 4)
176.,2008-11-03 10:33:22,114.85,100%,"For centuries, the battle of morality was fought between tho...",Win (1 of 5)
175.,2008-11-03 10:32:42,124.01,100%,"Ticking away the moments that make up a dull day, you fritte...",Win (1 of 3)
174.,2008-11-03 10:31:34,130.58,100%,I have quit three jobs and been fired from all the rest. Get...,Win (1 of 4)
173.,2008-11-03 10:30:50,126.86,100%,"The terminator wouldn't stop, it would never leave him. It w...",Win (1 of 5)
172.,2008-11-03 10:29:58,115.78,100%,I've seen things you people wouldn't believe. Attack ships o...,Win (1 of 5)
171.,2008-11-03 10:29:21,106.26,100%,"Kid, I've flown from one side of this galaxy to the other, a...",Win (1 of 5)
170.,2008-11-03 10:28:28,112.38,100%,"As if that blind rage had washed me clean, rid me of hope; f...",Win (1 of 3)
169.,2008-11-03 10:27:39,118.66,100%,It is possible that I already had some presentiment of my fu...,Win (1 of 4)
168.,2008-11-03 10:26:56,108.28,100%,"If I leave here tomorrow, would you still remember me? For I...",Win (1 of 5)
167.,2008-11-03 10:26:06,114.72,100%,The example of painting can teach us not only how to manage ...,Win (1 of 4)
166.,2008-11-03 10:25:25,116.30,100%,I have quit three jobs and been fired from all the rest. Get...,Win (1 of 3)
165.,2008-11-03 10:24:43,100.78,100%,"I rejected those answers; instead, I chose something differe...",Win (1 of 3)
164.,2008-11-02 22:53:56,118.94,100%,"Common knowledge has bicyclists always riding into the wind,...",Win (1 of 5)
163.,2008-11-02 22:53:10,111.19,100%,San Francisco in the middle sixties was a very special time ...,Win (1 of 4)
162.,2008-11-02 22:52:30,117.52,100%,The problem we now face is that this thin layer of atmospher...,Win (1 of 4)
161.,2008-11-02 22:43:44,115.47,100%,So what's in this for you? Should you rush out in search of ...,No win (2 of 5)
160.,2008-11-02 22:43:05,104.45,100%,"Today, you people are no longer maggots. Today, you are Mari...",Win (1 of 5)
159.,2008-11-02 22:42:18,118.94,100%,Typing competitions provided another test of the Qwerty keyb...,Win (1 of 4)
158.,2008-11-02 22:37:41,103.32,100%,"When we pulled out into the winter night and the real snow, ...",Win (1 of 3)
157.,2008-11-02 21:47:46,107.32,100%,He had spent enormous amounts of time at the great libraries...,Win (1 of 5)
156.,2008-11-02 21:47:00,113.17,100%,"The terminator wouldn't stop, it would never leave him. It w...",Win (1 of 4)
155.,2008-11-02 19:35:53,102.24,100%,These contests provided ample opportunity to demonstrate the...,Win (1 of 3)
154.,2008-11-02 19:00:06,110.31,100%,"Everyone said I was daft to build a castle on a swamp, but I...",Win (1 of 4)
153.,2008-11-02 18:59:13,109.18,100%,"Today, you people are no longer maggots. Today, you are Mari...",Win (1 of 5)
152.,2008-11-02 18:57:02,120.31,100%,Images of broken light which dance before me like a million ...,Win (1 of 4)
151.,2008-11-02 18:56:26,123.78,100%,Images of broken light which dance before me like a million ...,Win (1 of 5)
150.,2008-11-02 18:55:16,110.74,100%,The unknown future rolls toward us. I face it for the first ...,Win (1 of 3)
149.,2008-11-02 18:53:50,119.48,100%,"Let's sort the buyers from the spiers, the needy from the gr...",No win (2 of 3)
148.,2008-11-02 18:52:59,117.12,100%,"This planet has, or rather had, a problem, which was this: m...",No win (2 of 5)
147.,2008-11-02 18:51:09,111.42,100%,If you're working out in front of a mirror and watching your...,Win (1 of 4)
146.,2008-11-02 18:50:04,95.38,100%,One thing I've learned in the last seven years: in every gam...,No win (2 of 5)
145.,2008-11-02 18:49:13,93.22,100%,"The National Rifle Association says that, ""Guns don't kill p...",Win (1 of 4)
144.,2008-11-02 18:48:14,122.05,100%,"Let me get this straight. You think that your client, one of...",No win (2 of 5)
143.,2008-11-02 18:47:19,116.94,100%,At first they had tried to keep the finding quiet. After all...,Win (1 of 2)
142.,2008-11-02 18:46:13,110.02,100%,"Keying text quickly is important, but it is more important t...",Win (1 of 5)
141.,2008-11-02 18:44:59,127.96,100%,We've known each other for many years but this is the first ...,Win (1 of 5)
140.,2008-11-02 18:44:10,106.43,100%,Too often writers believe that they can emphasize words by p...,Win (1 of 3)
139.,2008-11-02 18:43:01,93.67,100%,Lucid but wholly false recollections can easily be induced b...,No win (2 of 3)
138.,2008-11-02 18:42:21,126.32,100%,We don't need no education. We don't need no thought control...,Win (1 of 5)
137.,2008-11-02 18:41:09,105.46,100%,"Whether you're a student, secretary, office administrator, m...",Win (1 of 3)
136.,2008-11-02 18:40:03,109.96,100%,"Common knowledge has bicyclists always riding into the wind,...",Win (1 of 4)
135.,2008-11-02 18:38:56,98.51,100%,"Listen, strange women lyin' in ponds distributin' swords is ...",Win (1 of 3)
134.,2008-11-02 18:37:18,113.42,100%,"Kid, I've flown from one side of this galaxy to the other, a...",Win (1 of 3)
133.,2008-11-02 18:36:39,107.71,100%,"Disillusion is the greatest gift I can give you. But, becaus...",Win (1 of 4)
132.,2008-11-02 18:35:42,110.30,100%,Humans need to practice what they are learning a good deal b...,Win (1 of 4)
131.,2008-11-02 18:33:28,133.87,100%,"Keying text quickly is important, but it is more important t...",Win (1 of 5)
130.,2008-11-02 18:33:00,106.21,100%,So what's in this for you? Should you rush out in search of ...,Win (1 of 4)
129.,2008-11-02 18:32:14,108.43,100%,Facts can be thought of as objective or subjective. Things a...,Win (1 of 4)
128.,2008-11-02 18:31:02,120.37,100%,It's the possibility of having a dream come true that makes ...,Win (1 of 2)
127.,2008-11-02 18:30:24,112.71,100%,"Yes, the newspapers were right: snow was general all over Ir...",Win (1 of 5)
126.,2008-11-02 18:29:29,124.69,100%,Humans need to practice what they are learning a good deal b...,No win (2 of 5)
125.,2008-11-02 18:28:58,103.54,100%,The only message I got was from the company that holds my st...,Win (1 of 3)
124.,2008-11-02 18:26:59,124.59,100%,"Keying text quickly is important, but it is more important t...",Win (1 of 4)
123.,2008-11-02 18:26:19,112.49,100%,At first they had tried to keep the finding quiet. After all...,Win (1 of 4)
122.,2008-11-02 18:25:26,105.61,100%,"Common knowledge has bicyclists always riding into the wind,...",Win (1 of 3)
121.,2008-11-02 18:24:28,99.68,100%,"They had been given a sign - a powerful, lucid sign - that u...",No win (2 of 5)
120.,2008-11-02 18:23:27,119.12,100%,"In the casino, the cardinal rule is to keep them playing and...",Win (1 of 5)
119.,2008-11-02 18:22:50,123.41,100%,"I had a dream. There was our world, and the world was dark b...",Win (1 of 5)
118.,2008-11-02 18:20:48,111.57,100%,It is possible that I already had some presentiment of my fu...,Win (1 of 4)
117.,2008-11-02 18:19:52,108.50,100%,"But suddenly, I viddied that thinking was for the gloopy one...",No win (2 of 5)
116.,2008-11-02 18:19:09,118.40,100%,The chemistry of an element is determined by the manner in w...,Win (1 of 3)
115.,2008-11-02 18:18:34,123.62,100%,"It was a marvelous night, the sort of night one only experie...",Win (1 of 5)
114.,2008-11-02 18:17:14,108.83,100%,Do you know what they call a Quarter-pounder with cheese in ...,No win (3 of 5)
113.,2008-11-02 18:16:25,101.54,100%,"Common knowledge has bicyclists always riding into the wind,...",Win (1 of 4)
112.,2008-11-02 18:15:13,93.10,100%,I had a friend who was a heavy drinker. If somebody asked hi...,Win (1 of 4)
111.,2008-11-02 18:14:27,121.47,100%,"In the casino, the cardinal rule is to keep them playing and...",Win (1 of 4)
110.,2008-11-02 18:13:35,116.02,100%,But the two men were not lonely at all. At home they were co...,Win (1 of 4)
109.,2008-11-02 18:12:41,99.72,100%,"Tis but thy name that is my enemy. Thou art thyself, though ...",No win (2 of 4)
108.,2008-11-02 18:11:35,120.36,100%,A giant inverted steel pyramid is perfectly balanced on its ...,Win (1 of 5)
107.,2008-11-02 18:10:29,116.88,100%,If there is one thing the history of evolution has taught us...,Win (1 of 3)
106.,2008-11-02 18:09:42,109.55,100%,Now I want you to think and stop being a smart aleck. A man'...,No win (3 of 3)
105.,2008-11-02 18:09:03,110.52,100%,We don't need no education. We don't need no thought control...,Win (1 of 3)
104.,2008-11-02 18:07:41,129.88,100%,Do I really look like a guy with a plan? You know what I am?...,Win (1 of 5)
103.,2008-11-02 18:06:52,129.72,100%,"Thirdly, however, these wars could now be waged with the new...",Win (1 of 4)
102.,2008-11-02 18:05:21,123.47,100%,Images of broken light which dance before me like a million ...,Win (1 of 4)
