418.,2015-12-27 02:01:29,136.02,96%,Is it sweeter to exist only in the mind or to exist both in ...,Win (1 of 3)
417.,2015-12-27 02:00:26,122.81,94%,"When I was your age, television was called books. And this i...",No win (2 of 3)
416.,2015-12-27 01:59:24,139.06,98%,Many rivers to cross but I can't seem to find my way over. W...,Win (1 of 3)
415.,2015-12-27 01:58:26,134.63,98%,Commas and periods always go inside quotation marks. Colons ...,Win (1 of 3)
414.,2015-12-26 01:47:28,138.04,98%,Let me tell you why you're here. You're here because you kno...,Win (1 of 2)
413.,2015-12-26 01:46:32,125.05,93%,Well I woke in mid-afternoon cause that's when it all hurts ...,Win (1 of 3)
412.,2015-12-26 01:45:41,124.45,93%,"Many people limit themselves to leading boring, dull lives b...",Win (1 of 3)
411.,2015-12-26 01:44:53,117.73,90%,Involuntarily I glanced seaward - and distinguished nothing ...,Win (1 of 2)
410.,2015-12-26 01:44:06,117.85,92%,To drive out of the Central Valley of California on a hot da...,Win (1 of 3)
409.,2015-12-25 21:06:11,135.18,98%,Well I woke in mid-afternoon cause that's when it all hurts ...,No win (2 of 3)
408.,2015-12-25 21:05:34,120.91,96%,"You cannot pass! I am a servant of the Secret Fire, wielder ...",No win (2 of 4)
407.,2015-12-25 21:05:03,134.34,96%,"Listen up, maggots. You are not special. You are not a beaut...",Win (1 of 5)
406.,2015-12-25 21:04:36,134.82,96%,"Burning my bridges and smashing my mirrors, turning to see i...",Win (1 of 3)
405.,2015-12-25 21:03:58,131.69,96%,We were playing checkers. I used to kid her once in a while ...,Win (1 of 2)
404.,2015-12-25 21:02:48,127.45,96%,"That's Tommy. He tells people he was named after a gun, but ...",Win (1 of 4)
403.,2015-12-25 21:01:38,120.17,92%,"Races are not won in the first corner; however, they are oft...",Win (1 of 3)
402.,2015-12-25 21:00:04,119.61,92%,In order to become an elf I filled out ten pages' worth of f...,Win (1 of 4)
401.,2015-12-25 20:59:16,137.56,98%,"The brain can be a tool. It can recall phone numbers, solve ...",Win (1 of 5)
400.,2015-12-25 20:49:40,131.72,98%,Don't make assumptions - find the courage to ask questions a...,Win (1 of 4)
399.,2015-12-25 20:49:09,116.84,89%,I suddenly had the impression that I had been left all alone...,No win (1 of 1)
398.,2015-12-25 18:52:02,146.62,98%,The day is made up of 24 hours and an infinite number of mom...,Win (1 of 3)
397.,2015-12-24 20:48:58,135.21,99%,If there is one thing the history of evolution has taught us...,No win (2 of 3)
396.,2015-12-24 20:48:21,135.55,98%,"Hanging by threads of palest silver, I could have stayed tha...",Win (1 of 4)
395.,2015-12-24 20:47:51,125.80,92%,Good games offer players a set of challenging problems and t...,Win (1 of 5)
394.,2015-12-24 20:47:14,126.22,97%,"You ask Raymond what he does for a living and he says, ""I br...",Win (1 of 5)
393.,2015-12-24 20:46:19,108.06,89%,"That fear had been inside him for many years, it had lived w...",No win (2 of 4)
392.,2015-12-22 00:57:20,120.73,92%,I said that I would see you because I had heard that you wer...,Win (1 of 3)
391.,2015-12-22 00:55:52,124.43,95%,There are very few things I wish I could change about those ...,Win (1 of 5)
390.,2015-12-22 00:54:53,129.11,97%,Don't bother trying to explain your emotions. Live everythin...,No win (2 of 4)
389.,2015-12-22 00:54:22,115.00,94%,"Milt, with the excellent timing of a master comedy writer, w...",Win (1 of 3)
388.,2015-12-10 00:05:34,134.61,100%,"Comfortable, Mullet? It seems sadly ironic that it's that ti...",Win (1 of 5)
387.,2015-12-10 00:05:08,118.86,96%,It's really hard to do nothing totally. Even just sitting he...,Win (1 of 2)
386.,2015-12-10 00:04:37,110.61,95%,"I did my best, it wasn't much. I couldn't feel, so I tried t...",No win (2 of 3)
385.,2015-12-09 09:33:35,108.36,94%,Don't make assumptions - find the courage to ask questions a...,No win (2 of 5)
384.,2015-12-09 09:32:58,92.64,89%,"Finally, there are those languages, such as Turkish, Finnish...",No win (2 of 4)
383.,2015-12-08 09:08:10,136.87,98%,"Combat for a naval aviator is fought in short, violent burst...",Win (1 of 5)
382.,2015-12-08 09:06:04,118.15,95%,"I was shaking like a leaf, so without thinking I lit up a ci...",Win (1 of 5)
381.,2015-11-30 21:26:06,118.13,93%,"Ever since I was a child, folks have thought they had me peg...",Win (1 of 3)
380.,2015-11-30 21:25:35,109.19,94%,The wine list looks so imposing that you finally give up lab...,Win (1 of 5)
379.,2015-11-30 21:24:44,115.95,96%,"King, eh? Very nice. And how'd you get that, eh? By exploiti...",Win (1 of 4)
378.,2015-11-30 21:24:11,120.48,94%,"That's Tommy. He tells people he was named after a gun, but ...",Win (1 of 4)
377.,2015-11-30 21:23:43,115.87,94%,We're no strangers to love. You know the rules and so do I. ...,Win (1 of 5)
376.,2015-11-30 21:21:38,127.76,98%,"Yet one fine day, in a fit of euphoria, after he had picked ...",Win (1 of 3)
375.,2015-11-30 21:20:41,92.78,87%,Buddhism addresses two major types of meditation. Vipassana ...,Win (1 of 3)
374.,2015-11-30 21:19:41,101.97,89%,"There is more to color than a swatch in a book, or a pull do...",No win (2 of 4)
373.,2015-11-30 21:17:23,115.18,92%,"If you want to drive a race car well, whether to win an Indy...",Win (1 of 2)
372.,2015-11-30 21:15:30,97.72,86%,"What about Tony? You know, Bullet Tooth Tony. He'll find you...",No win (3 of 3)
371.,2015-11-30 21:14:32,137.26,99%,"When I was your age, television was called books. And this i...",Win (1 of 4)
370.,2015-11-30 21:13:53,109.19,90%,"Never give up, no matter how far behind you are, no matter h...",No win (2 of 3)
369.,2015-11-30 21:12:31,119.74,95%,"I can feel the heat closing in, feel them out there making t...",Win (1 of 2)
368.,2015-11-30 21:11:49,127.52,96%,Focus your attention on the Now and tell me what problem you...,No win (2 of 4)
367.,2015-11-30 21:11:06,127.78,95%,If I'm curt with you it's because time is a factor. I think ...,Win (1 of 5)
366.,2015-11-30 21:10:29,128.30,97%,"There are perhaps twenty regular posters on the forum, and s...",Win (1 of 5)
365.,2015-11-30 21:09:10,131.99,98%,"Our world, with its rules of causality, has trained us to be...",Win (1 of 4)
364.,2015-11-30 21:08:32,124.19,96%,Consider this: Is the pious being loved by the gods because ...,Win (1 of 2)
363.,2015-11-15 18:18:09,121.18,94%,"The Orient was almost a European invention, and had been sin...",Win (1 of 2)
362.,2015-11-15 17:50:17,136.58,98%,You have two choices: you can keep running and hiding and bl...,Win (1 of 4)
361.,2015-11-15 17:30:37,123.00,98%,"No matter how bad things are, you can always make things wor...",Win (1 of 3)
360.,2015-11-15 17:30:00,110.05,92%,"As customers of all races, nationalities, and cultures visit...",Win (1 of 3)
359.,2015-11-08 18:56:42,120.57,96%,"Let me get this straight. You think that your client, one of...",Win (1 of 3)
358.,2015-11-08 18:55:58,117.28,93%,"When I really worry about something, I don't just fool aroun...",Win (1 of 2)
357.,2015-11-08 18:55:18,97.66,88%,The pickpockets' profession demands extraordinary nimbleness...,Win (1 of 4)
356.,2015-11-08 18:54:44,124.23,96%,"I was shaking like a leaf, so without thinking I lit up a ci...",No win (1 of 1)
355.,2015-11-08 18:53:49,125.87,96%,I've been thinking lots about my life and how quick I'd wash...,Win (1 of 4)
354.,2015-10-30 08:56:21,120.84,95%,There are still some places where you can get all you can ea...,Win (1 of 3)
353.,2015-10-28 08:53:14,112.80,95%,I sincerely believe that if women study male lessons on conc...,Win (1 of 2)
352.,2015-10-28 08:52:16,120.51,98%,Gardeners know how to grow top-notch crops. They determine w...,No win (1 of 1)
351.,2015-10-19 22:42:05,133.95,100%,The theory of music emphasizes the elements from which music...,Win (1 of 3)
350.,2015-10-19 12:21:19,126.92,98%,I used to dread getting older because I thought I would not ...,Win (1 of 3)
349.,2015-10-15 22:50:02,132.10,99%,Don't bother trying to explain your emotions. Live everythin...,Win (1 of 2)
348.,2015-10-15 22:49:23,104.78,89%,Corn is what feeds the steer that becomes the steak. Corn fe...,No win (2 of 3)
347.,2015-10-12 23:46:32,130.44,97%,"But it is important to know this, to know your roots. To kno...",Win (1 of 5)
346.,2015-10-12 23:45:59,120.57,94%,"I was hugely impressed. Kirk, I mean Shatner, was the ultima...",Win (1 of 2)
345.,2015-10-12 23:45:13,136.43,99%,The unknown future rolls toward us. I face it for the first ...,No win (2 of 5)
344.,2015-10-04 21:41:33,135.79,99%,There was a time not that long ago when many drivers thought...,Win (1 of 3)
343.,2015-09-27 15:30:06,118.76,96%,"Our world, with its rules of causality, has trained us to be...",Win (1 of 2)
342.,2015-09-27 15:29:14,119.53,94%,"Don't practice too much at first, or you're likely to develo...",No win (2 of 3)
341.,2015-09-26 23:54:13,124.64,97%,"Yes, the newspapers were right: snow was general all over Ir...",Win (1 of 4)
340.,2015-09-24 00:34:50,118.99,97%,There was a stage and a PA up in western Massachusetts and t...,Win (1 of 2)
339.,2015-09-24 00:34:00,108.77,93%,The invention of the wheel represented a major turning point...,Win (1 of 2)
338.,2015-09-24 00:33:07,130.27,98%,Although the United Nations does not have the power to enfor...,Win (1 of 2)
337.,2015-09-24 00:32:12,107.40,91%,"In the moment when I truly understand my enemy, understand h...",No win (2 of 3)
336.,2015-09-24 00:31:20,120.27,95%,"The brain can be a tool. It can recall phone numbers, solve ...",Win (1 of 4)
335.,2015-09-24 00:30:33,112.23,93%,"Tis but thy name that is my enemy. Thou art thyself, though ...",No win (2 of 4)
334.,2015-09-24 00:29:49,113.54,88%,"But older than me now, more constant, more real, and the fur...",Win (1 of 5)
333.,2015-09-20 16:38:42,118.73,94%,We don't read and write poetry because it's cute. We read an...,Win (1 of 4)
332.,2015-09-20 12:26:14,129.05,98%,I've been thinking lots about my life and how quick I'd wash...,Win (1 of 5)
331.,2015-09-06 22:41:59,124.71,98%,"That's Tommy. He tells people he was named after a gun, but ...",No win (2 of 4)
330.,2015-09-06 22:41:34,116.64,91%,We all know people who are very bright but who do not always...,No win (2 of 5)
329.,2015-09-06 22:40:59,105.91,89%,Is it really necessary to send that email? The more emails y...,Win (1 of 4)
328.,2015-09-06 22:40:09,125.90,97%,You can know the name of a bird in all the languages of the ...,No win (2 of 3)
327.,2015-09-06 22:39:24,127.10,97%,You've got a way to keep me on your side. You give me cause ...,No win (3 of 4)
326.,2015-09-06 22:38:55,109.52,85%,Now I want you to think and stop being a smart aleck. A man'...,No win (2 of 5)
325.,2015-09-06 22:38:21,121.14,94%,"Comfortable, Mullet? It seems sadly ironic that it's that ti...",Win (1 of 3)
324.,2015-09-06 22:37:44,123.83,94%,"After removal from the oven, the pizza is sliced and plated ...",Win (1 of 4)
323.,2015-09-06 17:08:28,122.07,94%,"Despair comes slowly, crawling its way up inside you until i...",Win (1 of 2)
322.,2015-09-06 17:07:44,125.30,93%,When we got to the Mint I parked on the street in front of t...,Win (1 of 2)
321.,2015-09-05 21:18:22,118.48,93%,I can teach you how to bewitch the mind and ensnare the sens...,Win (1 of 4)
320.,2015-09-05 21:17:25,130.16,97%,"Some pilots like the excitement of our missions, knowing tha...",No win (2 of 4)
319.,2015-09-05 21:16:43,115.35,94%,"And I said, I don't care if they lay me off either, because ...",Win (1 of 2)
318.,2015-09-05 21:15:46,108.33,93%,The recipe for turning fruit into wine goes something like t...,Win (1 of 2)
317.,2015-09-02 23:22:08,132.66,97%,"What good's a reward if you ain't around to use it? Besides,...",Win (1 of 3)
316.,2015-09-02 23:21:39,98.62,89%,I sincerely believe that if women study male lessons on conc...,No win (4 of 5)
315.,2015-08-30 22:33:32,121.69,98%,I thought climbing the Devil's Thumb would fix all that was ...,Win (1 of 3)
314.,2015-08-30 22:33:01,110.62,88%,"My darling, you have to be standing up in order to be able t...",No win (1 of 1)
313.,2015-08-28 21:10:37,116.01,93%,One essential rule: make sure the joke is the last possible ...,No win (2 of 3)
312.,2015-08-28 17:53:03,120.64,97%,Don't make assumptions - find the courage to ask questions a...,Win (1 of 5)
311.,2015-08-28 17:52:23,123.36,92%,"Comfortable, Mullet? It seems sadly ironic that it's that ti...",Win (1 of 2)
310.,2015-08-28 17:41:34,125.23,95%,But if in efficient causes it is possible to go on to infini...,No win (1 of 1)
309.,2015-08-27 23:07:47,120.47,94%,"I often see racers, particularly at the back of the pack in ...",No win (2 of 5)
308.,2015-08-27 16:26:45,110.99,90%,"I'm so glad you came, I'm so glad you remembered, to see how...",Win (1 of 3)
307.,2015-08-27 16:26:11,90.11,85%,"I was shaking like a leaf, so without thinking I lit up a ci...",No win (3 of 4)
306.,2015-08-27 16:25:04,111.87,88%,Many rivers to cross but I can't seem to find my way over. W...,Win (1 of 3)
305.,2015-08-27 16:24:15,132.25,96%,I used to dread getting older because I thought I would not ...,Win (1 of 3)
304.,2015-08-27 16:23:35,120.30,91%,Too often writers believe that they can emphasize words by p...,Win (1 of 3)
303.,2015-08-27 16:22:35,113.65,91%,The men in the room suddenly realized that they didn't want ...,Win (1 of 4)
302.,2015-08-27 16:21:33,124.97,94%,I suddenly had the impression that I had been left all alone...,Win (1 of 4)
301.,2015-08-27 16:20:49,110.48,90%,"It's a blue savanna song: somewhere cross the desert, someti...",Win (1 of 5)
300.,2015-08-27 16:20:13,109.16,93%,You could choke a dozen donkeys on that! And you're haggling...,Win (1 of 4)
299.,2015-08-27 16:19:37,108.81,88%,"And though my journeys did take me to a great many states, a...",Win (1 of 4)
298.,2015-08-27 16:18:35,109.51,93%,Data is by definition easy to copy. And the Internet makes c...,Win (1 of 3)
297.,2015-08-27 16:17:45,126.11,96%,"She's got a smile that, it seems to me, reminds me of childh...",Win (1 of 2)
296.,2015-08-27 16:17:06,110.62,92%,"The melted mozzarella layer, which we shall designate MML, i...",Win (1 of 4)
295.,2015-08-27 16:16:25,109.94,93%,"Hello, babies. Welcome to Earth. It's hot in the summer and ...",No win (2 of 4)
294.,2015-08-27 16:15:53,90.47,87%,"Trudging slowly over wet sand, back to the bench where your ...",No win (2 of 3)
293.,2015-08-27 16:15:13,111.01,92%,"No man is an island, entire of itself; every man is a piece ...",Win (1 of 2)
292.,2015-08-27 16:14:15,121.78,93%,The theory of music emphasizes the elements from which music...,Win (1 of 5)
291.,2015-08-27 16:13:29,123.57,93%,Well I woke in mid-afternoon cause that's when it all hurts ...,Win (1 of 4)
290.,2015-08-27 16:12:34,134.41,98%,The time has come for man to set himself a goal. The time ha...,Win (1 of 4)
289.,2015-08-27 16:11:39,118.86,90%,The unknown future rolls toward us. I face it for the first ...,Win (1 of 2)
288.,2015-08-25 23:33:14,123.26,96%,Although the United Nations does not have the power to enfor...,Win (1 of 4)
287.,2015-08-25 01:59:21,123.00,97%,"Alfred Hitchcock once said, ""Drama is life with the dull bit...",Win (1 of 3)
286.,2015-08-24 22:33:47,121.12,97%,"Picking up the pieces, half alive in a nine 'til five, vacan...",Win (1 of 4)
285.,2015-08-24 22:33:03,127.66,96%,The only preventive thing I do is wash clothes after buying ...,Win (1 of 5)
284.,2015-08-24 22:32:23,117.36,92%,A glooming peace this morning with it brings. The sun for so...,Win (1 of 5)
283.,2015-08-24 22:31:42,108.76,88%,There's a hole in the world like a great black pit. And the ...,Win (1 of 4)
282.,2015-08-24 20:42:19,126.94,96%,"My name is Turkish. Funny name for an Englishman, I know. My...",Win (1 of 3)
281.,2015-08-24 20:41:24,125.18,90%,I am learning about twenty new Italian words a day. Where am...,Win (1 of 3)
280.,2015-08-24 20:40:32,104.67,90%,"A computer needs a manager to administer its operations, jus...",No win (2 of 4)
279.,2015-08-24 20:39:48,125.98,95%,"I was hugely impressed. Kirk, I mean Shatner, was the ultima...",Win (1 of 4)
278.,2015-08-24 20:38:59,122.29,95%,"But pure, unadulterated feelings are dangerous in their own ...",Win (1 of 3)
277.,2015-08-24 20:37:49,122.44,95%,"When we pulled out into the winter night and the real snow, ...",No win (2 of 2)
276.,2015-08-24 04:21:59,132.14,98%,"Samatha is a state in which the mind is brought to rest, foc...",Win (1 of 4)
275.,2015-05-19 11:51:43,115.23,92%,"That fear had been inside him for many years, it had lived w...",Win (1 of 4)
274.,2015-04-13 12:27:36,108.58,93%,Don't bother trying to explain your emotions. Live everythin...,Win (1 of 3)
273.,2015-04-01 11:49:17,76.85,94%,Focus your attention on the Now and tell me what problem you...,No win (2 of 4)
272.,2015-03-25 17:46:34,120.19,97%,Instead of hiring workers during the peak hog kill in the wi...,Win (1 of 4)
271.,2015-03-25 17:45:45,112.66,95%,"My friend, I shall be pedagogic, and say you ought to start ...",Win (1 of 4)
270.,2015-03-25 17:45:03,119.18,97%,"Imagine this: Here we are, a plane full of grown human being...",No win (1 of 1)
269.,2015-03-25 17:44:13,107.84,96%,"You needn't take it any further, sir. You've proved to me th...",No win (2 of 2)
268.,2015-03-24 00:07:06,101.63,93%,"Prior to the 1970's, because the United States had long been...",Win (1 of 2)
267.,2015-03-17 11:38:52,93.45,95%,"Don't practice too much at first, or you're likely to develo...",Win (1 of 2)
266.,2015-03-10 11:34:47,121.98,97%,I will need my spectacles and a clear head. Today I broke my...,Win (1 of 4)
265.,2015-02-22 16:38:51,124.31,97%,Typing competitions provided another test of the Qwerty keyb...,Win (1 of 3)
264.,2015-02-16 20:29:29,117.23,97%,"In May 1980, Fidel Castro opened the harbor at Mariel, Cuba ...",Win (1 of 4)
263.,2015-02-16 20:28:36,108.00,93%,The Inca believed that if one did not give thanks and obedie...,No win (2 of 3)
262.,2015-02-16 03:55:51,106.97,95%,"You just couldn't let me go, could you? This is what happens...",Win (1 of 2)
261.,2015-02-15 19:00:13,129.88,96%,I think you're gonna find - when all this stuff is over and ...,Win (1 of 3)
260.,2015-02-09 11:46:14,105.76,94%,"Alfred Hitchcock once said, ""Drama is life with the dull bit...",Win (1 of 3)
259.,2015-02-05 00:22:35,131.63,97%,"To evaluate an option from the other side's point of view, c...",Win (1 of 5)
258.,2015-02-05 00:21:52,121.23,96%,"Comfortable, Mullet? It seems sadly ironic that it's that ti...",Win (1 of 4)
257.,2015-02-05 00:21:22,114.95,93%,A glooming peace this morning with it brings. The sun for so...,Win (1 of 2)
256.,2015-02-05 00:20:43,113.31,94%,"Keying text quickly is important, but it is more important t...",Win (1 of 5)
255.,2015-02-05 00:20:12,129.35,97%,"The only people for me are the mad ones, the ones who are ma...",Win (1 of 2)
254.,2015-02-05 00:19:12,108.83,93%,To drive out of the Central Valley of California on a hot da...,Win (1 of 3)
253.,2015-02-04 11:37:22,114.82,95%,Although the United Nations does not have the power to enfor...,No win (2 of 5)
252.,2015-02-03 11:56:28,117.24,94%,Space is big. Really big. You just won't believe how vastly ...,Win (1 of 2)
251.,2015-02-03 11:55:58,116.84,94%,"Warmer water increases the moisture content of storms, and w...",Win (1 of 4)
250.,2015-02-03 11:55:15,121.13,97%,"Yes, the newspapers were right: snow was general all over Ir...",Win (1 of 4)
249.,2015-02-03 11:54:34,110.01,93%,Who is Keyser Soze? He is supposed to be Turkish. Some say h...,No win (1 of 1)
248.,2015-02-03 11:48:53,110.41,94%,"Whether you're a student, secretary, office administrator, m...",Win (1 of 3)
247.,2015-02-03 11:46:57,108.40,93%,"In the witch trials, it was nearly impossible to provide com...",Win (1 of 4)
246.,2015-02-03 11:46:05,108.16,94%,"Throughout my academic career, I'd given some pretty good ta...",No win (1 of 1)
245.,2015-02-03 11:45:30,117.57,94%,"I know a bloke who knows a bloke who knows a bloke. Now, I k...",Win (1 of 2)
244.,2015-02-03 11:42:24,131.84,97%,"Well, the way they make shows is, they make one show. That s...",Win (1 of 3)
243.,2015-01-30 11:49:22,118.07,97%,Overhead the albatross hangs motionless upon the air and dee...,No win (2 of 4)
242.,2015-01-30 11:48:14,120.37,95%,"There are perhaps twenty regular posters on the forum, and s...",Win (1 of 2)
241.,2015-01-30 11:47:20,124.37,100%,It doesn't mean much to be able to filter out most present-d...,Win (1 of 5)
240.,2015-01-30 11:46:48,105.89,91%,For it is not enough to have a good mind; the main thing is ...,No win (3 of 5)
239.,2015-01-30 11:45:58,129.44,96%,Many rivers to cross but I can't seem to find my way over. W...,No win (2 of 3)
238.,2015-01-30 11:45:16,112.36,97%,"But suddenly, I viddied that thinking was for the gloopy one...",Win (1 of 2)
237.,2015-01-30 11:42:11,122.28,95%,I've seen things you people wouldn't believe. Attack ships o...,Win (1 of 2)
236.,2015-01-30 11:41:35,106.90,94%,The basic concept is simple: a satellite in geosynchronous o...,Win (1 of 3)
235.,2015-01-30 11:38:29,113.46,94%,At the time when Britain faced a plunge into chaos and darkn...,Win (1 of 4)
234.,2015-01-30 11:33:22,111.56,91%,Always do your best - your best is going to change from mome...,Win (1 of 4)
233.,2015-01-30 11:32:31,133.50,97%,Facts can be thought of as objective or subjective. Things a...,Win (1 of 2)
232.,2015-01-30 11:25:01,131.38,99%,From compositional considerations the tomato layer would be ...,No win (2 of 3)
231.,2015-01-30 11:24:18,122.44,95%,There's sometimes a buggy. How many drivers does a buggy hav...,No win (2 of 3)
230.,2015-01-30 11:22:18,124.29,98%,"My friend, I shall be pedagogic, and say you ought to start ...",No win (2 of 3)
229.,2015-01-30 11:21:39,112.03,93%,"A computer needs a manager to administer its operations, jus...",Win (1 of 5)
228.,2015-01-25 20:20:05,115.86,94%,There are still some places where you can get all you can ea...,Win (1 of 3)
227.,2015-01-25 20:17:45,115.81,94%,In order to become an elf I filled out ten pages' worth of f...,Win (1 of 2)
226.,2015-01-25 20:16:53,129.16,97%,The place to improve the world is first in one's own heart a...,Win (1 of 4)
225.,2015-01-25 20:16:10,118.58,96%,"The melted mozzarella layer, which we shall designate MML, i...",No win (2 of 5)
224.,2015-01-22 11:32:52,97.47,91%,My entire life had been on a predictable trajectory dominate...,No win (2 of 4)
223.,2015-01-22 11:32:03,108.15,93%,The inner surface of the cell wall touches the cytoplasmic m...,Win (1 of 4)
222.,2015-01-22 11:29:52,126.04,98%,"However, let us leave aside the philosophical, social, and e...",Win (1 of 4)
221.,2015-01-22 11:28:54,117.72,96%,I've seen things you people wouldn't believe. Attack ships o...,Win (1 of 2)
220.,2015-01-21 11:54:08,112.85,94%,"But, pray how could that which I spoke so many years ago, an...",Win (1 of 3)
219.,2015-01-21 11:49:38,128.15,100%,The pathology of setting a deadline to the earliest articula...,Win (1 of 4)
218.,2015-01-21 11:47:30,118.38,96%,"To some, the rules of etiquette may seem outdated, stuffy an...",Win (1 of 3)
217.,2015-01-21 11:46:45,109.12,92%,"But, pray how could that which I spoke so many years ago, an...",No win (2 of 5)
216.,2015-01-21 11:46:00,106.57,89%,It is possible that I already had some presentiment of my fu...,No win (2 of 4)
215.,2015-01-21 11:44:35,125.98,95%,She's got eyes of the bluest skies as if they thought of rai...,No win (2 of 2)
214.,2015-01-21 11:43:56,117.52,96%,"Let me get this straight. You think that your client, one of...",Win (1 of 3)
213.,2015-01-21 11:43:05,114.68,95%,"The Orient was almost a European invention, and had been sin...",No win (2 of 3)
212.,2015-01-21 11:42:25,96.16,94%,He canceled all his commitments and pulled together the most...,No win (2 of 4)
211.,2015-01-21 11:41:40,127.14,99%,"Throughout my academic career, I'd given some pretty good ta...",Win (1 of 5)
210.,2015-01-21 11:41:11,121.48,96%,Even the best-designed chair won't make up for bad posture. ...,No win (3 of 3)
209.,2015-01-21 11:37:55,104.23,88%,"Whether they use the title or not, many lyrics have evocativ...",Win (1 of 5)
208.,2015-01-21 11:37:19,99.32,91%,Some have a positive vocation for breaking open safes: from ...,Win (1 of 3)
207.,2015-01-21 11:34:37,120.26,95%,"I often see racers, particularly at the back of the pack in ...",Win (1 of 2)
206.,2015-01-21 11:32:21,131.55,98%,"Whenever you watch the mind, you withdraw consciousness from...",Win (1 of 3)
205.,2015-01-21 01:02:01,124.97,99%,There is a theory which states that if anybody ever discover...,No win (3 of 5)
204.,2015-01-21 01:01:24,116.78,96%,Let me tell you why you're here. You're here because you kno...,No win (3 of 3)
203.,2014-11-22 15:58:54,109.96,92%,"Two households, both alike in dignity (in fair Verona, where...",Win (1 of 3)
202.,2014-11-22 15:58:01,118.50,97%,There was a stage and a PA up in western Massachusetts and t...,Win (1 of 3)
201.,2014-11-22 15:57:14,112.61,93%,"That fear had been inside him for many years, it had lived w...",No win (3 of 3)
200.,2014-10-22 11:36:38,113.61,93%,"Listen, strange women lyin' in ponds distributin' swords is ...",No win (3 of 3)
199.,2014-10-02 18:12:09,127.95,97%,"Ultimately, this is not about solving your problems. It's ab...",Win (1 of 3)
198.,2014-10-02 18:11:31,114.60,96%,"There was me, that is Alex, and my three droogs, that is Pet...",No win (2 of 4)
197.,2014-10-02 18:10:52,114.46,95%,"Whenever you watch the mind, you withdraw consciousness from...",No win (2 of 4)
196.,2014-10-02 18:10:13,123.18,96%,Too often writers believe that they can emphasize words by p...,No win (1 of 1)
195.,2014-10-02 18:09:22,121.75,96%,The chemistry of an element is determined by the manner in w...,Win (1 of 5)
194.,2014-10-02 18:08:47,110.33,93%,"Hey Mr. Tambourine Man, play a song for me, I'm not sleepy a...",No win (2 of 3)
193.,2014-10-02 18:08:16,119.32,96%,"I don't want tickets, I need you to find me a painting, a cl...",No win (2 of 4)
