192.,2014-10-02 18:07:14,120.52,93%,I will need my spectacles and a clear head. Today I broke my...,Win (1 of 4)
191.,2014-09-15 10:27:11,112.92,95%,"No man is an island, entire of itself; every man is a piece ...",Win (1 of 4)
190.,2014-09-15 10:24:34,117.07,96%,Once you get into the processed foods you have to be a fairl...,Win (1 of 3)
189.,2014-09-15 10:23:50,114.95,95%,"People get ready, there's a train coming. You don't need no ...",Win (1 of 3)
188.,2014-09-15 10:22:36,105.02,94%,"Air-conditioned, odorless, illuminated by buzzing fluorescen...",No win (1 of 1)
187.,2014-09-15 10:21:42,122.55,99%,I will need my spectacles and a clear head. Today I broke my...,Win (1 of 4)
186.,2014-05-19 00:59:11,112.14,93%,There are still some places where you can get all you can ea...,No win (2 of 4)
185.,2014-05-14 12:51:05,107.94,95%,"Common knowledge has bicyclists always riding into the wind,...",Win (1 of 2)
184.,2014-05-05 13:43:57,92.93,94%,All the blue light reflections that color my mind when I sle...,No win (2 of 4)
183.,2014-05-04 23:37:16,120.67,97%,"If you want to drive a race car well, whether to win an Indy...",No win (2 of 5)
182.,2014-05-04 23:36:22,109.57,94%,She's got eyes of the bluest skies as if they thought of rai...,No win (2 of 5)
181.,2014-05-04 23:35:37,124.70,97%,"But no matter how effective the lesson was, I never really u...",Win (1 of 4)
180.,2014-05-04 23:35:03,108.63,94%,But speculations on the structure of the universe also move ...,Win (1 of 4)
179.,2014-05-04 23:34:15,114.88,94%,Many wines have more than 14 percent alcohol because the win...,Win (1 of 5)
178.,2014-05-02 13:58:11,104.36,96%,Don't make assumptions - find the courage to ask questions a...,Win (1 of 4)
177.,2014-04-29 13:28:30,114.20,96%,"Some pilots like the excitement of our missions, knowing tha...",Win (1 of 3)
176.,2014-04-29 13:27:45,107.05,93%,We began to recognize in them a strange obsession. After all...,Win (1 of 4)
175.,2014-04-29 13:26:59,116.33,94%,Be impeccable with your word - speak with integrity. Say onl...,Win (1 of 3)
174.,2014-04-29 13:26:24,111.56,94%,Humans need to practice what they are learning a good deal b...,No win (2 of 4)
173.,2014-04-28 13:38:43,81.55,93%,I've seen things you people wouldn't believe. Attack ships o...,No win (2 of 2)
172.,2014-04-24 13:43:48,107.34,95%,"One day you're in a funk about things, telling a friend that...",No win (2 of 5)
171.,2014-04-24 13:34:01,107.66,91%,All time is all time. It does not change. It does not lend i...,No win (2 of 5)
170.,2014-04-24 12:48:16,94.17,87%,Is it sweeter to exist only in the mind or to exist both in ...,No win (2 of 3)
169.,2014-04-23 14:04:26,111.47,92%,"And you know it's time to go, through the sleet and driving ...",Win (1 of 5)
168.,2014-04-23 14:03:47,99.22,91%,He canceled all his commitments and pulled together the most...,No win (2 of 5)
167.,2014-04-23 14:03:04,113.89,96%,Even the best-designed chair won't make up for bad posture. ...,No win (3 of 4)
166.,2014-04-23 14:02:32,105.48,91%,I must not fear. Fear is the mind killer. Fear is the little...,No win (3 of 4)
165.,2014-04-23 14:01:47,120.75,96%,"The terminator wouldn't stop, it would never leave him. It w...",Win (1 of 4)
164.,2014-04-23 14:00:50,90.62,88%,Indonesia is a nation of islands - more than seventeen thous...,No win (3 of 4)
163.,2014-04-23 13:59:31,118.11,97%,"When you are typing on a typewriter, your input appears dire...",No win (2 of 4)
162.,2014-04-23 13:58:12,92.30,96%,I never said I would stay to the end - I knew I would leave ...,Win (1 of 2)
161.,2014-04-23 13:52:04,123.71,98%,There are very few things I wish I could change about those ...,Win (1 of 3)
160.,2014-04-23 13:46:03,108.67,95%,"Whether you're a student, secretary, office administrator, m...",Win (1 of 3)
159.,2014-04-23 13:45:26,116.02,95%,"This was the most delicious meal he'd had in recent years, a...",Win (1 of 4)
158.,2014-04-23 13:44:35,116.31,95%,"Don't practice too much at first, or you're likely to develo...",Win (1 of 4)
157.,2014-04-22 23:42:34,121.76,97%,Don't take anything personally - nothing others do is becaus...,No win (3 of 3)
156.,2014-04-22 23:41:43,122.17,98%,"Keying text quickly is important, but it is more important t...",No win (2 of 2)
155.,2014-04-22 23:41:07,108.97,96%,"In short order, Carter then proceeded to kill any chance he ...",No win (3 of 3)
154.,2014-03-20 16:57:43,101.39,93%,"She was a genius of sadness, immersing herself in it, separa...",Win (1 of 3)
153.,2014-03-20 16:56:47,114.27,95%,"Today, computers have taken this ancient art out of the craf...",Win (1 of 5)
152.,2014-03-20 16:55:55,114.29,94%,"My name is Turkish. Funny name for an Englishman, I know. My...",Win (1 of 3)
151.,2014-03-20 16:55:07,112.58,95%,"What good's a reward if you ain't around to use it? Besides,...",No win (2 of 5)
150.,2014-03-20 16:54:39,115.77,96%,The basic concept is simple: a satellite in geosynchronous o...,Win (1 of 3)
149.,2014-03-20 16:53:23,118.65,95%,"Good evening, London. Allow me first to apologize for this i...",Win (1 of 4)
148.,2014-03-20 16:52:03,120.64,96%,And then he calls me a jerk and says the last guy who though...,No win (2 of 5)
147.,2014-03-20 16:51:27,116.54,96%,"He started running, up and up, until he hurled himself into ...",Win (1 of 2)
146.,2014-03-20 16:50:40,100.18,92%,I had a friend who was a heavy drinker. If somebody asked hi...,No win (1 of 1)
145.,2014-03-20 16:49:59,117.03,92%,"Historically, most wines contained less than 14 percent alco...",Win (1 of 4)
144.,2014-03-20 16:49:25,104.69,92%,Since every piece of matter in the Universe is in some way a...,No win (2 of 3)
143.,2014-03-20 16:48:17,107.24,93%,Your faith was strong but you needed proof. You saw her bath...,No win (2 of 2)
142.,2014-03-20 16:47:40,109.87,93%,"We turn away to face the cold, enduring chill, as the day be...",Win (1 of 3)
141.,2014-03-18 16:17:12,104.09,90%,The streets were cleared by a Critical Mass bike ride and we...,No win (2 of 4)
140.,2014-03-18 16:15:39,131.24,97%,"O clear intelligence, force beyond all measure! Gentlemen, I...",Win (1 of 3)
139.,2014-03-17 23:20:56,110.14,93%,The Inca believed that if one did not give thanks and obedie...,Win (1 of 4)
138.,2014-03-17 23:20:15,121.30,96%,Imagine for a moment if we once again knew these few unremar...,Win (1 of 2)
137.,2014-03-17 23:19:14,95.50,89%,Parisian French is different from Provincial French and Germ...,No win (2 of 5)
136.,2014-03-17 23:18:37,111.31,91%,The truth of the matter is that there are a lot of available...,Win (1 of 4)
135.,2014-03-17 23:17:52,125.12,97%,All the blue light reflections that color my mind when I sle...,Win (1 of 4)
134.,2014-03-17 23:16:57,117.44,94%,"When I was your age, television was called books. And this i...",Win (1 of 2)
133.,2014-03-17 23:16:18,108.89,91%,"Yet one fine day, in a fit of euphoria, after he had picked ...",No win (2 of 3)
132.,2014-03-17 23:15:18,73.65,76%,"I know a bloke who knows a bloke who knows a bloke. Now, I k...",No win (4 of 4)
131.,2014-03-17 23:14:45,125.62,96%,"And you know it's time to go, through the sleet and driving ...",No win (2 of 5)
130.,2014-03-17 23:13:55,123.40,96%,There is something about yourself that you don't know. Somet...,Win (1 of 4)
129.,2014-03-17 15:58:27,110.59,94%,"He started running, up and up, until he hurled himself into ...",No win (2 of 5)
128.,2014-03-17 15:57:30,124.79,96%,"Ultimately, this is not about solving your problems. It's ab...",Win (1 of 3)
127.,2014-03-17 15:56:51,113.56,95%,"Hello, hello, hello, is there anybody in there? Just nod if ...",Win (1 of 3)
126.,2014-03-17 15:56:05,119.58,95%,We live in a charmed world. If we have money we can buy lite...,No win (1 of 1)
125.,2014-03-17 15:55:09,90.28,87%,"One respondent said ""For women - a lot of games are crap - t...",No win (2 of 2)
124.,2014-03-17 15:54:33,116.16,94%,"I'm so glad you came, I'm so glad you remembered, the walkin...",Win (1 of 5)
123.,2014-03-17 15:53:54,124.63,95%,What should have been swift revenge turned into an all out w...,Win (1 of 4)
122.,2014-03-17 15:53:07,134.32,98%,"And you know it's time to go, through the sleet and driving ...",Win (1 of 5)
121.,2014-03-17 15:52:32,100.39,89%,"If you want to drive a race car well, whether to win an Indy...",Win (1 of 2)
120.,2014-03-17 15:51:30,96.04,90%,"Hey Mr. Tambourine Man, play a song for me, I'm not sleepy a...",No win (1 of 1)
119.,2014-03-17 15:50:49,121.15,97%,I'd just like to point out that you were given every opportu...,Win (1 of 3)
118.,2014-03-17 15:49:24,115.17,95%,Gardeners know how to grow top-notch crops. They determine w...,Win (1 of 3)
117.,2014-03-17 15:48:28,113.57,93%,"And in the world a heart of darkness, a firezone, where poet...",Win (1 of 2)
116.,2014-03-16 18:21:41,116.22,95%,Sholes consulted with an educator who helped him analyze the...,No win (1 of 1)
115.,2014-03-16 18:20:33,124.02,97%,"Well, it just so happens, this hacienda comes with its very ...",Win (1 of 3)
114.,2014-03-16 17:08:36,101.69,89%,"My darling, you have to be standing up in order to be able t...",Win (1 of 3)
113.,2014-03-15 21:04:29,102.19,95%,"The boy has not a real choice, has he? Self-interest, the fe...",Win (1 of 2)
112.,2014-03-15 21:03:01,101.48,92%,Sometimes you concentrate more on racing the cars around you...,Win (1 of 3)
111.,2014-03-15 21:01:52,104.46,88%,"For centuries, the battle of morality was fought between tho...",Win (1 of 3)
110.,2014-03-15 21:00:48,116.42,97%,"The term ""barbarian"" was created by the Greeks; it was origi...",No win (2 of 3)
109.,2014-03-15 20:59:11,137.22,98%,"Life is not suffering; it's just that you will suffer it, ra...",Win (1 of 5)
108.,2014-03-15 20:58:14,142.96,99%,Groups of illegal miners smuggle themselves down in freight ...,Win (1 of 3)
107.,2014-03-15 17:25:27,113.89,92%,It was one of those days when it's a minute away from snowin...,Win (1 of 2)
106.,2014-03-15 17:24:31,111.74,95%,I've always wondered about this coat business. When I'm in a...,No win (3 of 3)
105.,2014-03-15 17:23:43,107.35,93%,Having endured the racial turmoil of the Civil Rights Moveme...,Win (1 of 2)
104.,2014-03-15 17:22:46,102.69,93%,In 1969 four computers located around the country were in co...,No win (2 of 3)
103.,2014-03-15 17:21:50,103.97,93%,"Run to the bedroom, in the suitcase on the left, you'll find...",No win (3 of 5)
102.,2014-03-15 17:20:42,111.08,92%,"The sooner your kids appreciate the value of work, the more ...",No win (2 of 4)
101.,2014-03-15 17:19:29,121.31,95%,Stab a sorry heart with your favorite finger. Paint the whol...,Win (1 of 4)
100.,2014-03-15 17:11:35,103.77,89%,The chemistry of an element is determined by the manner in w...,Win (1 of 2)
99.,2014-03-15 17:09:41,119.19,95%,"When Betty and Billy fell asleep, he walked down to the kitc...",Win (1 of 2)
98.,2014-03-15 17:02:46,148.12,99%,"Ever since I was a child, folks have thought they had me peg...",Win (1 of 3)
97.,2014-03-14 23:09:42,111.20,94%,Had dreams. Two of 'em. Both had my father. It's peculiar. I...,No win (3 of 4)
96.,2014-03-14 23:07:53,122.26,95%,"The terminator wouldn't stop, it would never leave him. It w...",Win (1 of 4)
95.,2014-03-14 23:06:35,120.32,94%,Supermarket aisles are the perfect place to practice your gl...,Win (1 of 3)
94.,2014-03-14 16:25:49,122.55,96%,"Your face has fallen sad now, for you know the time is nigh....",No win (2 of 5)
93.,2014-03-14 16:25:11,113.47,94%,Few smart kids can spare the attention that popularity requi...,Win (1 of 5)
92.,2014-03-13 22:05:13,105.97,93%,"Today, you people are no longer maggots. Today, you are Mari...",Win (1 of 4)
91.,2014-03-13 22:04:00,116.30,94%,"Some pilots like the excitement of our missions, knowing tha...",No win (3 of 5)
90.,2014-03-13 09:14:45,114.05,96%,"That day, for no particular reason, I decided to go for a li...",Win (1 of 5)
89.,2014-03-13 09:13:53,124.48,97%,"I often see racers, particularly at the back of the pack in ...",No win (1 of 1)
88.,2014-03-13 09:12:52,113.23,94%,Well I woke in mid-afternoon cause that's when it all hurts ...,Win (1 of 4)
87.,2014-03-13 09:12:09,110.64,92%,"My friend, I shall be pedagogic, and say you ought to start ...",Win (1 of 3)
86.,2014-03-12 23:25:12,124.36,95%,"If you really want to hear about it, the first thing you'll ...",Win (1 of 3)
85.,2014-03-12 23:24:24,102.78,91%,You have to wonder: how do the machines know what Tasty Whea...,Win (1 of 4)
84.,2014-03-12 23:19:44,100.02,94%,"The boy has not a real choice, has he? Self-interest, the fe...",Win (1 of 3)
83.,2014-03-12 23:18:58,109.49,95%,Well I woke in mid-afternoon cause that's when it all hurts ...,Win (1 of 3)
82.,2014-03-12 23:18:16,117.42,94%,We've known each other for many years but this is the first ...,No win (2 of 4)
81.,2014-03-12 23:16:48,121.36,95%,There is something about yourself that you don't know. Somet...,No win (2 of 5)
80.,2014-03-12 23:16:02,106.04,92%,"They knew they were privileged to have these choices, but th...",No win (2 of 4)
79.,2014-03-12 23:14:39,104.53,94%,The evidence in the standard history of Qwerty versus Dvorak...,Win (1 of 3)
78.,2014-03-12 23:13:21,119.10,98%,In order to face down the danger that is stalking us and mov...,No win (2 of 3)
77.,2014-03-12 23:12:13,126.41,97%,The alternative to binge travel - the mini retirement - enta...,Win (1 of 3)
76.,2014-03-12 12:54:02,112.42,97%,"In May 1980, Fidel Castro opened the harbor at Mariel, Cuba ...",Win (1 of 4)
75.,2014-03-12 12:52:20,119.70,94%,Lucid but wholly false recollections can easily be induced b...,No win (2 of 5)
74.,2014-03-12 12:51:40,115.66,95%,There is a theory which states that if anybody ever discover...,Win (1 of 4)
73.,2014-03-12 12:50:57,114.36,93%,"I hope that whoever you are, you escape this place. I hope t...",No win (2 of 5)
72.,2014-03-12 12:50:10,119.68,95%,"Combat for a naval aviator is fought in short, violent burst...",No win (2 of 5)
71.,2014-03-12 12:49:10,115.10,94%,I said that I would see you because I had heard that you wer...,Win (1 of 4)
70.,2014-03-12 12:47:31,120.63,95%,"Some pilots like the excitement of our missions, knowing tha...",Win (1 of 5)
69.,2014-03-12 12:46:34,113.82,92%,"Yet one fine day, in a fit of euphoria, after he had picked ...",Win (1 of 4)
68.,2014-03-12 12:45:20,117.75,99%,"It turned out that the sweet-talking, tattoo-sporting pikey ...",Win (1 of 5)
67.,2014-03-12 12:44:38,114.75,96%,A giant inverted steel pyramid is perfectly balanced on its ...,Win (1 of 5)
66.,2014-03-12 12:43:49,88.29,89%,You could choke a dozen donkeys on that! And you're haggling...,Win (1 of 5)
65.,2014-03-12 12:42:58,112.52,94%,Everything we hold dear likewise resolves into its original ...,No win (2 of 4)
64.,2014-03-12 11:09:38,110.75,93%,I will need my spectacles and a clear head. Today I broke my...,Win (1 of 3)
63.,2014-03-12 11:08:24,37.64,78%,"Listen, strange women lyin' in ponds distributin' swords is ...",No win (2 of 3)
62.,2014-03-12 11:04:52,101.32,89%,"Dropping through sky, through the glass of the roof, through...",Win (1 of 2)
61.,2014-03-12 11:02:54,116.77,94%,Popularity is only partially about individual attractiveness...,Win (1 of 5)
60.,2014-03-12 11:02:14,83.23,88%,"Whether you're a student, secretary, office administrator, m...",No win (1 of 1)
59.,2014-03-12 11:01:26,95.20,89%,Aztec rule was based upon a system of tribute and fear over ...,Win (1 of 2)
58.,2014-03-12 11:00:06,115.94,95%,"Burning my bridges and smashing my mirrors, turning to see i...",Win (1 of 3)
57.,2014-03-12 10:59:15,120.53,95%,A few light taps upon the pane made him turn to the window. ...,Win (1 of 3)
56.,2014-03-12 10:58:39,109.14,91%,Groups of illegal miners smuggle themselves down in freight ...,No win (2 of 4)
55.,2014-03-12 10:51:06,129.43,94%,Remember that humor is written backwards. That means you fir...,Win (1 of 4)
54.,2014-03-12 10:50:08,102.55,90%,"Good games stay within, but at the outer edge, of the player...",Win (1 of 3)
53.,2014-03-12 10:49:17,110.44,93%,From compositional considerations the tomato layer would be ...,Win (1 of 3)
52.,2014-03-12 10:46:09,116.16,94%,"The sooner your kids appreciate the value of work, the more ...",No win (2 of 4)
51.,2014-03-12 10:45:31,112.52,93%,There's a piece of Maria in every song that I sing. And the ...,No win (3 of 4)
50.,2014-03-12 10:44:34,126.03,97%,"And in the world a heart of darkness, a firezone, where poet...",Win (1 of 3)
49.,2014-03-12 10:43:52,124.69,97%,"In the casino, the cardinal rule is to keep them playing and...",Win (1 of 3)
48.,2014-03-12 10:42:59,104.51,91%,"The time I waited seemed endless, and I felt doubts and fear...",No win (2 of 4)
47.,2014-03-12 10:42:26,105.44,93%,You've got a way to keep me on your side. You give me cause ...,No win (4 of 5)
46.,2014-03-12 10:41:55,111.06,91%,A few light taps upon the pane made him turn to the window. ...,No win (4 of 4)
45.,2014-03-12 10:41:15,111.66,93%,"Right, I am going to tell you how this works. You're going i...",No win (2 of 3)
44.,2014-03-12 10:39:36,116.46,95%,"Well, it just so happens, this hacienda comes with its very ...",No win (2 of 4)
43.,2014-03-12 10:38:57,114.93,97%,Quality humor doesn't just deliver one gag and then tax the ...,No win (2 of 5)
42.,2014-03-12 10:37:12,110.80,89%,"For centuries, the battle of morality was fought between tho...",No win (4 of 4)
41.,2014-03-12 10:36:25,106.51,95%,And then he calls me a jerk and says the last guy who though...,No win (2 of 4)
40.,2014-03-12 10:33:46,107.16,92%,Is it sweeter to exist only in the mind or to exist both in ...,No win (2 of 3)
39.,2014-03-12 10:32:38,121.63,95%,"If you really want to hear about it, the first thing you'll ...",Win (1 of 3)
38.,2014-03-11 20:05:51,66.96,87%,"The National Rifle Association says that, ""Guns don't kill p...",No win (3 of 3)
37.,2014-03-11 20:03:04,137.88,98%,The ultimate way to compose is to be able to keyboard as fas...,Win (1 of 3)
36.,2014-03-11 20:02:06,116.28,93%,What should have been swift revenge turned into an all out w...,Win (1 of 2)
35.,2014-03-11 20:00:34,120.99,96%,"Historically, most wines contained less than 14 percent alco...",Win (1 of 3)
34.,2014-03-11 17:42:11,98.32,93%,"Hi, and welcome to the future. San Dimas, California, 2688. ...",Win (1 of 3)
33.,2014-03-11 17:41:04,120.23,99%,The pickpockets' profession demands extraordinary nimbleness...,No win (1 of 1)
32.,2014-03-11 17:40:21,108.50,95%,At first they had tried to keep the finding quiet. After all...,Win (1 of 2)
31.,2014-03-11 17:35:40,123.94,97%,"Throughout my academic career, I'd given some pretty good ta...",No win (2 of 4)
30.,2014-03-11 17:30:05,115.53,94%,"Your face has fallen sad now, for you know the time is nigh....",Win (1 of 2)
29.,2014-03-11 17:23:33,107.70,96%,Having endured the racial turmoil of the Civil Rights Moveme...,Win (1 of 4)
28.,2014-03-11 17:22:24,89.29,87%,"Trudging slowly over wet sand, back to the bench where your ...",Win (1 of 3)
27.,2014-03-11 17:21:26,120.25,92%,The brain can be a tool. But when you can't stop thinking of...,No win (2 of 3)
26.,2014-03-11 17:17:51,120.80,96%,"When you are typing on a typewriter, your input appears dire...",Win (1 of 4)
25.,2014-03-11 17:16:28,122.55,94%,The ultimate way to compose is to be able to keyboard as fas...,No win (2 of 4)
24.,2014-03-11 17:14:00,115.25,97%,"Hey Mr. Tambourine Man, play a song for me, I'm not sleepy a...",Win (1 of 3)
23.,2014-03-11 16:25:39,127.64,97%,But the two men were not lonely at all. At home they were co...,Win (1 of 4)
22.,2014-03-11 16:24:04,112.37,96%,"In the late 1960s, a growing number of people became concern...",Win (1 of 4)
21.,2014-03-11 16:21:55,108.83,94%,The basis of the Aztecs' success in creating a great state a...,Win (1 of 2)
20.,2014-03-11 16:18:24,98.44,91%,Some have a positive vocation for breaking open safes: from ...,Win (1 of 2)
19.,2014-03-11 13:07:55,105.30,90%,Step out the front door like a ghost into the fog where no o...,No win (2 of 5)
18.,2014-03-11 13:07:06,101.47,93%,"In short order, Carter then proceeded to kill any chance he ...",No win (3 of 5)
17.,2014-03-11 13:05:26,111.55,93%,"When I was your age, television was called books. And this i...",No win (2 of 5)
16.,2014-03-11 13:04:47,100.20,89%,Is it sweeter to exist only in the mind or to exist both in ...,No win (3 of 3)
15.,2014-03-11 13:03:43,105.22,91%,This business is filled to the brim with unrealistic people ...,Win (1 of 3)
14.,2014-03-11 13:01:02,79.89,94%,"But, pray how could that which I spoke so many years ago, an...",Win (1 of 2)
13.,2014-03-11 12:58:57,68.44,95%,Supermarket aisles are the perfect place to practice your gl...,Win (1 of 2)
12.,2014-03-11 12:57:10,55.58,97%,"When I was your age, television was called books. And this i...",Win (1 of 2)
11.,2014-03-11 12:45:12,97.09,90%,It doesn't mean much to be able to filter out most present-d...,Win (1 of 5)
10.,2014-03-11 12:43:51,117.26,96%,"For centuries, the battle of morality was fought between tho...",Win (1 of 4)
9.,2014-03-11 12:43:06,98.73,92%,"Burning my bridges and smashing my mirrors, turning to see i...",Win (1 of 2)
8.,2014-03-11 12:41:21,124.42,97%,One thing I've learned in the last seven years: in every gam...,Win (1 of 2)
7.,2014-03-11 10:57:35,88.70,93%,I had a friend who was a heavy drinker. If somebody asked hi...,No win (2 of 3)
6.,2014-03-11 10:51:10,126.23,98%,There's a hole in the world like a great black pit. And the ...,Win (1 of 5)
5.,2014-03-11 10:50:38,94.82,91%,"If I leave here tomorrow, would you still remember me? For I...",No win (4 of 5)
4.,2014-03-11 10:49:32,109.43,95%,"The day dawned bleak and chill, a moving wall of gray light ...",Win (1 of 3)
3.,2014-03-11 10:48:15,106.49,94%,He rode past me and kept on goin'. Never said nothin' goin' ...,Win (1 of 3)
2.,2014-03-11 10:47:00,88.52,92%,I sincerely believe that if women study male lessons on conc...,No win (1 of 1)
1.,2014-03-11 10:45:09,102.97,95%,Do I really look like a guy with a plan? You know what I am?...,Win (1 of 4)
