207.,2017-06-18 01:36:47,25.88,97%,"First of all, you must be comfortable, otherwise it will be ...",No win (3 of 4)
206.,2017-06-18 01:34:34,22.81,96%,You've got a way to keep me on your side. You give me cause ...,No win (2 of 4)
205.,2017-06-18 01:32:48,23.63,97%,"Not so happy, yet much happier. Thou shalt get kings, though...",No win (3 of 3)
204.,2017-06-18 01:31:41,25.04,97%,In order to become an elf I filled out ten pages' worth of f...,Win (1 of 4)
203.,2017-06-18 01:29:55,26.03,99%,"Ah, merciless love, is there any length to which you cannot ...",No win (2 of 3)
202.,2017-06-18 01:25:19,26.37,99%,"I did not bow down to you, I bowed down to all the suffering...",No win (5 of 5)
201.,2017-06-18 01:24:04,20.51,96%,"At the very end of these food chains (which is to say, at th...",No win (5 of 5)
200.,2017-06-18 01:21:51,27.21,99%,The ultimate way to compose is to be able to keyboard as fas...,No win (2 of 3)
199.,2017-06-18 01:20:37,25.31,98%,"If the experts are baffled, how can the rest of us understan...",No win (2 of 3)
198.,2017-06-18 01:17:24,26.33,99%,"When she returns to the forum page, her post is there. It is...",No win (4 of 5)
197.,2017-06-18 01:14:37,22.54,97%,"In the past, all a King had to do was look respectable in un...",No win (2 of 3)
196.,2017-06-18 01:11:29,23.41,96%,When we got to the Mint I parked on the street in front of t...,No win (3 of 4)
195.,2017-06-18 01:09:15,23.79,98%,While there are few problems in today's world that the Unite...,No win (4 of 4)
194.,2017-06-18 01:07:25,24.25,98%,"I could easily forgive his pride, if he had not mortified mi...",No win (3 of 3)
193.,2017-06-18 01:06:11,27.25,99%,For it is not enough to have a good mind; the main thing is ...,No win (3 of 3)
192.,2017-06-18 01:03:16,26.25,99%,You have to be a fairly determined ecological detective to f...,No win (2 of 3)
191.,2017-06-18 01:01:07,25.23,99%,I want your answer and the money by noon tomorrow. And one m...,Win (1 of 3)
190.,2017-06-18 00:59:20,25.92,99%,"This above all: to thine own self be true, and it must follo...",Win (1 of 3)
189.,2017-06-18 00:57:51,26.00,99%,"It takes a great deal of bravery to stand up to our enemies,...",No win (5 of 5)
188.,2017-06-18 00:56:18,23.20,97%,"If the driver would only slow down, the car would actually g...",Win (1 of 2)
187.,2017-06-18 00:54:32,25.77,98%,"Well, a scavenger hunt is exactly like a treasure hunt, exce...",No win (4 of 4)
186.,2017-06-18 00:52:40,25.00,98%,"You're right, I did lose a million dollars last year. I expe...",Win (1 of 3)
185.,2017-06-18 00:51:03,22.56,97%,The men in the room suddenly realized that they didn't want ...,No win (3 of 3)
184.,2017-06-18 00:48:28,22.02,97%,Parisian French is different from Provincial French and Germ...,No win (2 of 3)
183.,2017-06-18 00:45:39,20.97,97%,Mankind is resilient: the atrocities that horrified us a wee...,No win (2 of 4)
182.,2017-06-18 00:44:15,25.74,100%,"Life is to be lived, not controlled; and humanity is won by ...",No win (2 of 5)
181.,2017-06-18 00:43:10,24.60,97%,Whoever talks about what does not concern him often hears wh...,No win (2 of 3)
180.,2017-06-18 00:42:04,25.21,98%,There are still some places where you can get all you can ea...,Win (1 of 3)
179.,2017-06-18 00:40:16,25.44,98%,"People only understand things in terms of their experience, ...",Win (1 of 3)
178.,2017-06-18 00:38:54,26.06,100%,"I know not all that may be coming, but be it what it will, I...",No win (2 of 3)
177.,2017-06-18 00:37:56,23.83,99%,"As for me, I am tormented with an everlasting itch for thing...",No win (3 of 5)
176.,2017-06-18 00:36:25,21.70,97%,"Listen up, maggots. You are not special. You are not a beaut...",No win (2 of 3)
175.,2017-06-18 00:34:49,21.37,98%,Who is Keyser Soze? He is supposed to be Turkish. Some say h...,No win (2 of 2)
174.,2017-06-18 00:32:35,23.69,98%,The gates of Hell are open night and day; smooth the descent...,Win (1 of 3)
173.,2017-06-18 00:31:09,25.56,100%,"Far from being accidental details, the properties of nature'...",No win (3 of 3)
172.,2017-06-18 00:29:36,24.45,99%,I made a very important discovery at Camp Currie. Happiness ...,Win (1 of 4)
171.,2017-06-18 00:27:46,18.63,98%,He implies there is a correlation between his daily work and...,No win (2 of 2)
170.,2017-06-13 13:55:55,28.07,98%,When a majority of the people are hungry and cold they will ...,No win (3 of 4)
169.,2017-06-13 13:52:33,24.43,98%,I've seen things you people wouldn't believe. Attack ships o...,No win (2 of 2)
168.,2017-06-13 13:49:20,25.94,97%,A man as smart as you has probably considered this. A man as...,No win (2 of 3)
167.,2017-06-13 13:48:18,24.09,98%,"We are going to die, and that makes us the lucky ones. Most ...",No win (2 of 2)
166.,2017-06-13 13:06:08,24.72,96%,I hope it is true that a man can die and yet not only live i...,No win (3 of 5)
165.,2017-06-13 13:04:43,25.40,99%,Say not a word in death's favor; I would rather be a paid se...,No win (5 of 5)
164.,2017-06-13 13:03:17,22.19,97%,"The problem is, Willie, is that Charles and yourself are not...",No win (3 of 3)
163.,2017-06-13 12:54:38,27.22,99%,"I can remember everything. That's my curse, young man. It's ...",No win (2 of 5)
162.,2017-06-13 12:52:24,26.08,98%,Good games offer players a set of challenging problems and t...,No win (5 of 5)
161.,2017-06-13 12:49:51,23.02,96%,"As if that blind rage had washed me clean, rid me of hope; f...",Win (1 of 2)
160.,2017-06-13 12:46:30,25.03,97%,It's really hard to do nothing totally. Even just sitting he...,No win (3 of 3)
159.,2017-06-13 12:44:31,25.12,99%,"Comfortable, Mullet? It seems sadly ironic that it's that ti...",No win (1 of 1)
158.,2017-06-13 12:42:04,25.76,97%,"She seemed to know, to accept, to welcome her position, the ...",No win (2 of 2)
157.,2017-06-13 12:40:27,19.58,94%,Maybe you should come with me for a few weeks. See what happ...,No win (3 of 3)
156.,2017-06-13 12:38:30,22.76,90%,You can't blame me. They've been making statues for some two...,Win (1 of 3)
155.,2017-06-13 12:36:47,24.06,98%,"Through intensive training and psychological manipulation, a...",Win (1 of 3)
154.,2017-06-13 12:34:57,25.48,98%,Let's take a drive into the middle of nowhere with a packet ...,No win (3 of 5)
153.,2017-06-13 12:33:52,26.67,98%,"Take a drink, my friend, and say what you have in your heart...",No win (3 of 4)
152.,2017-06-13 12:32:23,24.69,98%,"The presence of a noble nature, generous in its wishes, arde...",No win (5 of 5)
151.,2017-06-13 12:30:05,20.70,96%,"Pulp: a soft, moist, shapeless mass or matter.",No win (2 of 2)
150.,2017-06-13 12:28:49,25.11,99%,While it may hold true that the final few seconds of a bike ...,No win (3 of 3)
149.,2017-06-13 12:27:00,28.06,100%,"It is not necessary to accept everything as true, one must o...",No win (4 of 5)
148.,2017-06-13 12:25:55,24.50,99%,"Now you come to me and you say, ""Don Corleone, give me justi...",No win (2 of 4)
147.,2017-06-13 12:24:09,29.40,99%,I think if it is true that there are as many minds as there ...,No win (2 of 3)
146.,2017-06-13 12:23:06,20.35,96%,"It's a funny thing, but people mostly have it backward. They...",No win (2 of 3)
145.,2017-06-13 11:52:44,22.57,98%,There's a piece of Maria in every song that I sing. And the ...,No win (2 of 5)
144.,2017-06-13 11:51:31,22.85,99%,He smiled understandingly - much more than understandingly. ...,No win (2 of 4)
143.,2017-06-13 11:48:54,22.58,99%,"Radiation could be precisely determined, in principle, if we...",Win (1 of 2)
142.,2017-06-13 11:47:08,25.48,99%,That's how you have to think of this. We're rewriting the hi...,No win (2 of 3)
141.,2017-06-13 11:45:35,22.18,100%,The quick brown fox jumps over the lazy dog.,No win (2 of 3)
140.,2017-06-13 11:44:52,23.99,100%,"You see, I'm moving on fast. Finally got the pass, gonna lea...",Win (1 of 3)
139.,2017-06-13 11:43:19,24.55,97%,Anyone could become obsessed with the past with a background...,Win (1 of 3)
138.,2017-06-13 11:42:27,24.37,98%,"Of so little weight are the greatest services to princes, wh...",No win (5 of 5)
137.,2017-06-13 02:13:39,15.84,95%,"There was me, that is Alex, and my three droogs, that is Pet...",No win (5 of 5)
136.,2017-06-13 02:10:55,26.58,99%,"You're waiting for a train, a train that will take you far a...",No win (4 of 5)
135.,2017-06-13 02:09:35,26.12,99%,Break my heart. Break it a thousand times if you like. It wa...,Win (1 of 3)
134.,2017-06-13 02:08:41,22.63,99%,At first they had tried to keep the finding quiet. After all...,No win (3 of 4)
133.,2017-06-13 02:06:34,23.92,97%,"Ah, merciless love, is there any length to which you cannot ...",No win (3 of 3)
132.,2017-06-13 02:05:32,27.08,99%,Is that what your little note says? It must be hard living y...,Win (1 of 4)
131.,2017-06-13 02:04:12,22.43,98%,To an outsider's ear it sounds absurdly wild and ridiculous ...,No win (2 of 4)
130.,2017-06-13 02:02:33,23.47,98%,"In the capital of the Sunbelt South, the quiet revolution of...",Win (1 of 2)
129.,2017-06-13 02:00:50,22.93,98%,Most popular song lyrics have two sections - a verse and a b...,No win (2 of 5)
128.,2017-06-13 01:58:48,24.35,98%,"Furthermore, those not understanding this intensity will say...",No win (4 of 5)
127.,2017-06-13 01:57:05,24.77,98%,Nothing in life is easy. But that's no reason to give up. Yo...,Win (1 of 3)
126.,2017-06-13 01:55:48,25.76,99%,"You can have my answer now, if you like. My final offer is t...",Win (1 of 2)
125.,2017-06-13 01:54:12,22.74,97%,I hope you're pleased with yourselves. We could all have bee...,Win (1 of 3)
124.,2017-06-13 01:52:31,19.86,96%,"Hey Mr. Tambourine Man, play a song for me, I'm not sleepy a...",No win (3 of 3)
123.,2017-06-13 01:49:26,22.38,98%,"My friend, I shall be pedagogic, and say you ought to start ...",No win (5 of 5)
122.,2017-06-13 01:47:14,24.58,98%,It's funny how one single thing you choose to see could chan...,Win (1 of 3)
121.,2017-06-13 01:46:03,24.98,99%,A few light taps upon the pane made him turn to the window. ...,No win (2 of 5)
120.,2017-06-13 01:44:56,22.97,96%,"Until they became conscious they will never rebel, and until...",No win (2 of 3)
119.,2017-06-13 01:43:40,24.60,96%,"A library of books is the fairest garden in the world, and t...",No win (3 of 3)
118.,2017-06-13 01:42:30,21.93,96%,"I was within and without, simultaneously enchanted and repel...",No win (4 of 5)
117.,2017-06-13 01:41:13,21.93,98%,"A beast can never be as cruel as a human being, so artistica...",Win (1 of 3)
116.,2017-06-13 01:39:50,26.60,100%,The forum has become one of the most consistent places in he...,Win (1 of 3)
115.,2017-06-13 01:38:11,23.59,98%,The brain can be a tool. But when you can't stop thinking of...,Win (1 of 3)
114.,2017-06-13 01:35:55,22.54,98%,"And if you lose me, then you'll know I, I loved you. And I w...",Win (1 of 3)
113.,2017-06-13 01:34:44,20.99,96%,Time is dead as long as it is being clicked off by little wh...,No win (3 of 3)
112.,2017-06-13 01:33:18,24.29,98%,"Scottie, do you believe that someone out of the past - someo...",Win (1 of 4)
111.,2017-06-13 01:32:07,22.41,94%,Well I woke in mid-afternoon cause that's when it all hurts ...,No win (3 of 3)
110.,2017-06-13 01:30:29,22.38,99%,"After you got six pieces, you gotta get rid of 'em. Of cours...",No win (2 of 2)
109.,2017-06-13 01:28:57,22.68,98%,The forum has become one of the most consistent places in he...,No win (5 of 5)
108.,2017-06-13 01:27:20,21.30,97%,"We've had vicious kings and we've had idiot kings, but I don...",Win (1 of 2)
107.,2017-06-13 01:25:52,22.48,97%,I can already hear your tune calling me across the room. Whe...,No win (4 of 5)
106.,2017-06-13 01:23:17,21.15,97%,"If you're committed enough, you can make any story work. I o...",Win (1 of 4)
105.,2017-06-13 01:21:34,24.15,98%,Sometimes I wondered if I was seeing the same things through...,No win (5 of 5)
104.,2017-06-13 01:19:58,21.03,98%,Had dreams. Two of 'em. Both had my father. It's peculiar. I...,No win (2 of 2)
103.,2017-06-13 01:18:18,25.89,98%,"Dusk crept over the sky from the eastern horizon, and darkne...",No win (4 of 5)
102.,2017-06-13 01:17:17,22.49,97%,Remember: I'll do the talking. You sit there quietly with yo...,Win (1 of 4)
101.,2017-06-13 01:16:00,22.50,98%,Consider this: Is the pious being loved by the gods because ...,No win (2 of 5)
100.,2017-06-13 01:12:27,24.96,99%,"Don't tell me what's in, don't tell me how to write, don't t...",No win (3 of 3)
99.,2017-06-13 01:10:31,22.66,99%,"It's a funny thing, but people mostly have it backward. They...",No win (2 of 4)
98.,2017-06-13 01:08:47,21.57,99%,"Whenever you watch the mind, you withdraw consciousness from...",Win (1 of 3)
97.,2017-06-13 01:07:23,18.80,96%,"Shoot all the blue jays you want, if you can hit 'em, but re...",No win (3 of 3)
96.,2017-06-13 01:05:52,24.68,98%,You have to be a fairly determined ecological detective to f...,No win (3 of 3)
95.,2017-06-13 01:00:24,25.75,99%,It's much better to do good in a way that no one knows anyth...,No win (3 of 4)
94.,2017-06-13 00:57:19,24.46,98%,"Inside his house a kid gets one name, but on the other side ...",No win (3 of 4)
93.,2017-06-13 00:55:56,21.72,98%,"I'm going to roll my window up, then I'm going to drive away...",No win (2 of 2)
92.,2017-06-13 00:52:19,21.15,98%,We may climb into the thin and cold realm of pure geometry a...,No win (2 of 2)
91.,2017-06-13 00:49:55,20.01,99%,"The boy has not a real choice, has he? Self-interest, the fe...",No win (2 of 3)
90.,2017-06-13 00:47:03,22.14,100%,"When I was your age, television was called books. And this i...",No win (2 of 2)
89.,2017-06-09 22:10:51,21.59,98%,"Comfortable, Mullet? It seems sadly ironic that it's that ti...",No win (3 of 3)
88.,2017-06-09 22:08:49,21.61,98%,Without some flexibility in our definitions we'll remain for...,No win (3 of 3)
87.,2017-06-09 22:06:58,26.21,99%,I must not fear. Fear is the mind killer. Fear is the little...,Win (1 of 3)
86.,2017-06-09 22:05:37,25.21,100%,"So, I guess we are who we are for a lot of reasons. And mayb...",Win (1 of 2)
85.,2017-06-09 22:04:36,25.16,98%,Imagination is the only weapon in the war against reality.,No win (2 of 3)
84.,2017-06-09 21:37:14,22.13,97%,I do not wish any reward but to know I have done the right t...,No win (3 of 4)
83.,2017-06-09 21:35:45,23.78,99%,Question marks and exclamation points go inside quotation ma...,No win (2 of 2)
82.,2017-06-09 21:34:05,23.73,99%,I only lose my fear when I run. I won't lose a tear when I r...,Win (1 of 3)
81.,2017-06-09 21:32:28,25.75,99%,Do you ever wait for the longest day of the year and then mi...,Win (1 of 2)
80.,2017-06-09 21:31:05,25.11,100%,"If somebody else has it much worse, that doesn't really chan...",Win (1 of 2)
79.,2017-06-09 21:29:53,22.60,98%,The math is compelling. Most of the people in the world are ...,No win (2 of 3)
78.,2017-06-09 21:28:12,22.68,99%,"An idea is like a virus, resilient, highly contagious. The s...",Win (1 of 3)
77.,2017-06-09 21:26:34,23.33,98%,"Give me that man that is not passion's slave, and I will wea...",Win (1 of 2)
76.,2017-06-09 21:24:27,21.30,97%,"I am always saying ""Glad to've met you"" to somebody I'm not ...",No win (2 of 3)
75.,2017-06-09 21:22:39,23.14,99%,"You put the killing thing right between your teeth, but you ...",Win (1 of 2)
74.,2017-06-09 21:21:29,23.04,100%,This is why dreams can be such dangerous things; they smolde...,Win (1 of 3)
73.,2017-06-09 21:19:57,24.58,99%,You have two choices: you can keep running and hiding and bl...,No win (2 of 3)
72.,2017-06-09 21:18:11,16.51,99%,"With forty-six Chinese, fourteen Japanese, eighteen Mexican,...",No win (3 of 3)
71.,2017-06-09 21:15:53,22.05,100%,"There is no good and evil, there is only power and those too...",Win (1 of 3)
70.,2017-06-09 21:14:44,23.51,99%,"I gotta see a man who looks like he might know something, bu...",Win (1 of 2)
69.,2017-06-09 21:13:23,17.77,97%,"Baby, ever wondered why I could make you laugh and cry? Ecli...",No win (2 of 3)
68.,2017-06-09 21:11:54,22.24,99%,"Say, go through the darkest of days. Heaven's a heartbreak a...",No win (2 of 2)
67.,2017-06-09 21:10:09,20.75,100%,A man on a thousand mile walk has to forget his goal and say...,No win (3 of 4)
66.,2017-06-09 21:08:22,19.66,94%,"You there, my friend. Come, let me hold you. Now, with a sig...",No win (2 of 3)
65.,2017-06-09 21:06:53,22.02,98%,"I tensed, waiting for the fury - both his and mine - but it ...",No win (2 of 2)
64.,2017-06-09 21:04:58,20.38,98%,I thought maybe I'd run to the end of town. And when I got t...,Win (1 of 2)
63.,2017-06-09 21:02:36,19.76,98%,"There is no pain, you are receding. A distant ship smoke on ...",Win (1 of 3)
62.,2017-06-09 21:00:47,21.45,98%,Many rivers to cross but I can't seem to find my way over. W...,No win (3 of 3)
61.,2017-06-09 20:59:19,20.98,99%,Is this the real life? Is this just fantasy? Caught in a lan...,No win (2 of 4)
60.,2017-06-09 20:57:32,18.27,96%,"The typewriter had a problem, though. Try to type quickly on...",No win (2 of 4)
59.,2017-06-09 20:55:06,18.82,96%,Is that what your little note says? It must be hard living y...,No win (2 of 3)
58.,2017-06-09 20:53:40,20.88,100%,I must learn to be content with being happier than I deserve.,No win (2 of 4)
57.,2017-06-09 20:52:48,21.67,99%,Respect was invented to cover the empty place where love sho...,No win (3 of 3)
56.,2017-06-09 20:51:41,23.61,100%,I want your answer and the money by noon tomorrow. And one m...,Win (1 of 2)
55.,2017-06-09 20:50:00,23.75,99%,"I need you, the reader, to imagine us, for we don't really e...",Win (1 of 2)
54.,2017-06-09 20:48:58,21.37,97%,This is what happens when an unstoppable force meets an immo...,Win (1 of 2)
53.,2017-06-09 20:47:55,19.58,98%,"When I was a kid, you never saw radicchio in the produce sec...",No win (2 of 3)
52.,2017-06-09 20:45:47,25.78,100%,"There is no good and evil, there is only power and those too...",Win (1 of 3)
51.,2017-06-09 20:44:44,24.22,100%,I must not fear. Fear is the mind killer. Fear is the little...,Win (1 of 3)
50.,2017-06-09 20:43:17,22.97,99%,Lucid but wholly false recollections can easily be induced b...,Win (1 of 3)
49.,2017-06-09 20:41:45,21.08,99%,Make sure to secure the door when I am gone. There are many ...,Win (1 of 3)
48.,2017-06-09 20:39:49,23.93,100%,All happy families are alike; each unhappy family is unhappy...,Win (1 of 3)
47.,2017-06-09 20:38:10,19.66,100%,"I'm afraid I can't explain myself, sir. Because I am not mys...",No win (2 of 3)
46.,2017-06-09 20:36:58,22.46,99%,Difference in opinions has cost many millions of lives: for ...,No win (2 of 3)
45.,2017-06-09 20:35:10,21.48,99%,Is that what your little note says? It must be hard living y...,No win (2 of 3)
44.,2017-06-09 20:33:57,16.82,97%,"Twilight, again. Another ending. No matter how perfect the d...",No win (3 of 3)
43.,2017-06-09 20:32:41,20.89,98%,"I know I've made some very poor decisions recently, but I ca...",No win (2 of 2)
42.,2017-06-09 20:31:11,24.22,99%,You are the most important thing to me now. The most importa...,No win (2 of 2)
41.,2017-06-09 20:30:07,17.79,98%,"With forty-six Chinese, fourteen Japanese, eighteen Mexican,...",No win (2 of 3)
40.,2017-06-09 20:27:07,17.38,98%,"Because most of the 150,000 tons of gold ever mined is still...",No win (2 of 3)
39.,2017-06-09 20:24:33,17.77,99%,"It was behind you, Tyrone, whenever you reverse things come ...",Win (1 of 3)
38.,2017-06-09 11:59:34,17.74,97%,"You can't get away with saying ""I don't like green food!"" mu...",No win (2 of 3)
37.,2017-06-09 11:56:57,19.84,99%,"The problem is, Willie, is that Charles and yourself are not...",No win (3 of 3)
36.,2017-06-09 11:54:59,21.24,99%,The brain can be a tool. But when you can't stop thinking of...,Win (1 of 2)
35.,2017-06-09 11:52:20,24.05,100%,Some people don't understand the promises they're making whe...,Win (1 of 3)
34.,2017-06-09 11:51:05,19.54,99%,Confession is not betrayal. What you say or do doesn't matte...,No win (2 of 3)
33.,2017-06-09 11:49:08,22.46,99%,I'd have wasted a lot of time and trouble before I learned t...,Win (1 of 3)
32.,2017-06-09 11:47:00,19.32,100%,Doublethink means the power of holding two contradictory bel...,No win (3 of 3)
31.,2017-06-09 11:45:17,19.20,98%,"All in all, it was just a brick in the wall. All in all, it ...",No win (4 of 4)
30.,2017-06-09 11:43:51,14.95,98%,"King, eh? Very nice. And how'd you get that, eh? By exploiti...",No win (2 of 3)
29.,2017-06-09 00:18:36,18.18,95%,Remember that all the people in this world haven't had the a...,No win (3 of 3)
28.,2017-06-09 00:16:35,18.42,97%,"It was too big to be called a sword. Massive, thick, heavy, ...",No win (2 of 3)
27.,2017-06-09 00:14:47,14.65,95%,Because of their scouting skills and peripheral kinesthetic ...,No win (3 of 4)
26.,2017-06-08 17:03:46,16.98,95%,Rhymes trap you into saying things you don't want to say. A ...,No win (2 of 2)
25.,2017-06-08 17:01:08,18.99,96%,"It would have been so pointless to kill himself that, even i...",No win (3 of 3)
24.,2017-06-08 16:59:21,18.14,94%,"I have stones to sell, fat to chew, and many different men t...",No win (3 of 4)
23.,2017-06-08 16:57:42,16.60,96%,"Can I be like everyone, pretending that there's nothing wron...",No win (2 of 2)
22.,2017-06-08 16:55:41,15.15,93%,"It's our land. We were born on it, and we got killed on it, ...",No win (3 of 3)
21.,2017-06-08 16:52:57,18.72,97%,The brain can be a tool. But when you can't stop thinking of...,No win (2 of 2)
20.,2017-06-08 16:49:46,15.43,94%,I know why you did it. I know you were afraid. Who wouldn't ...,No win (2 of 2)
19.,2017-06-08 16:48:41,18.85,95%,"It is not necessary to accept everything as true, one must o...",No win (2 of 3)
18.,2017-06-08 16:47:15,17.29,95%,Since the ninja is that being than which nothing sweeter can...,Win (1 of 3)
17.,2017-06-08 16:44:54,24.78,99%,In that cell you found something that mattered more to you t...,No win (2 of 2)
16.,2017-06-08 16:43:57,18.35,97%,Imagination is the only weapon in the war against reality.,Win (1 of 3)
15.,2017-06-08 16:42:21,16.91,95%,My father taught me many things here - he taught me in this ...,No win (3 of 4)
14.,2017-06-08 16:40:13,18.20,97%,"The Earth is a world, the world is a ball, a ball in a game ...",No win (2 of 2)
13.,2017-06-08 16:38:00,17.09,97%,You are the most important thing to me now. The most importa...,No win (2 of 3)
12.,2017-06-08 16:36:37,15.74,95%,"Because some men aren't looking for anything logical, like m...",No win (2 of 3)
11.,2017-06-08 16:34:07,15.34,95%,Even the best-designed chair won't make up for bad posture. ...,Win (1 of 2)
10.,2017-06-08 16:31:00,16.04,97%,"Take my love, take my land, take me where I cannot stand. I ...",Win (1 of 2)
9.,2017-06-08 16:28:24,14.58,95%,Confession is not betrayal. What you say or do doesn't matte...,No win (4 of 4)
8.,2017-06-08 16:25:54,17.90,96%,"Right is right, and wrong is wrong, and a body ain't got no ...",No win (3 of 4)
7.,2017-06-08 16:24:03,19.01,98%,All we can know is that we know nothing. And that's the heig...,No win (2 of 2)
6.,2017-06-08 00:58:03,15.91,97%,You have to be a fairly determined ecological detective to f...,Win (1 of 4)
5.,2017-06-08 00:55:11,13.29,92%,"And it says to you love when you can, cry when you have to, ...",No win (2 of 2)
4.,2017-06-08 00:52:04,13.09,95%,This is what happens when an unstoppable force meets an immo...,No win (3 of 3)
3.,2017-06-08 00:50:26,17.49,98%,Come sail your ships around me and burn your bridges down. W...,No win (2 of 2)
2.,2017-06-08 00:48:45,15.17,94%,"If everybody minded their own business, the world would go a...",No win (3 of 3)
1.,2017-06-08 00:46:52,14.30,96%,Is that what your little note says? It must be hard living y...,No win (3 of 3)
