432.,2017-07-01 23:22:05,23.08,95%,"You see, if you shoot pool with some employee here, you can ...",No win (3 of 4)
431.,2017-07-01 23:19:17,22.63,92%,"Since we're all going to die, it's obvious that when and how...",No win (2 of 3)
430.,2017-07-01 23:18:20,26.34,95%,"At that time, I often thought that if I had had to live in t...",No win (5 of 5)
429.,2017-07-01 23:16:26,31.06,99%,"I did not bow down to you, I bowed down to all the suffering...",Win (1 of 3)
428.,2017-07-01 23:15:14,24.81,96%,Welcome to the room of people who have rooms of people that ...,No win (3 of 3)
427.,2017-07-01 23:12:24,23.35,94%,Because the peoples of Micronesia and Palau did not have a w...,No win (4 of 5)
426.,2017-07-01 23:09:25,28.49,98%,And the little screaming fact that sounds through all histor...,Win (1 of 3)
425.,2017-07-01 23:08:14,26.33,96%,"I know not all that may be coming, but be it what it will, I...",No win (3 of 4)
424.,2017-07-01 23:07:03,27.25,96%,We have a criminal jury system which is superior to any in t...,Win (1 of 3)
423.,2017-07-01 23:05:02,26.56,96%,"If you want to know what a man's like, take a good look at h...",No win (3 of 3)
422.,2017-07-01 23:03:52,27.00,96%,"Of so little weight are the greatest services to princes, wh...",No win (2 of 3)
421.,2017-07-01 23:02:18,23.06,95%,Our people are good people; our people are kind people. Pray...,Win (1 of 3)
420.,2017-07-01 23:00:52,23.55,96%,"Specialized uniforms, such as nun and priest garb, can be mo...",No win (2 of 2)
419.,2017-07-01 22:58:49,23.46,95%,The increase of disorder or entropy is what distinguishes th...,No win (3 of 3)
418.,2017-07-01 22:57:38,26.28,94%,"It's no use going back to yesterday, because I was a differe...",Win (1 of 3)
417.,2017-07-01 22:56:29,24.38,95%,We don't need no education. We don't need no thought control...,Win (1 of 3)
416.,2017-07-01 22:54:31,23.53,97%,Difference in opinions has cost many millions of lives: for ...,No win (2 of 3)
415.,2017-07-01 22:19:17,21.17,95%,"Can you ""choose"" something when you are forcefully and enthu...",No win (2 of 2)
414.,2017-07-01 22:17:16,20.14,93%,And if by chance an honest man like yourself should make ene...,No win (2 of 5)
413.,2017-06-29 01:43:23,23.88,95%,"The milk and cheese and yogurt, which once came from dairy c...",Win (1 of 3)
412.,2017-06-29 01:41:18,19.70,95%,"Whoa, pal, you aren't trying to cheat, are you? Now, I know ...",Win (1 of 3)
411.,2017-06-29 01:39:38,24.89,95%,"Whether they use the title or not, many lyrics have evocativ...",Win (1 of 3)
410.,2017-06-29 01:37:30,22.19,95%,So I'm two inches away from her. Her luscious lips part. Jus...,No win (2 of 2)
409.,2017-06-29 01:35:11,24.79,96%,"On a dark desert highway, cool wind in my hair, warm smell o...",No win (2 of 3)
408.,2017-06-29 01:32:46,22.34,94%,This won't take long. There. That should give us enough time...,No win (4 of 4)
407.,2017-06-29 01:31:26,25.90,95%,"You know, that might be the answer - to act boastfully about...",No win (2 of 3)
406.,2017-06-29 01:29:42,25.97,96%,Fools rush in where angels fear to tread. And so I come to y...,Win (1 of 2)
405.,2017-06-29 01:27:55,29.00,97%,Your sins are terrible. It is just that you suffer. Your lif...,Win (1 of 4)
404.,2017-06-29 01:26:31,25.92,96%,I can't remember if I cried when I read about his widowed br...,Win (1 of 4)
403.,2017-06-29 01:25:09,29.79,98%,"Sometimes in our lives we all have pain, we all have sorrow,...",No win (3 of 5)
402.,2017-06-29 01:23:49,28.61,96%,And so we meet at last. You are to be commended for avoiding...,Win (1 of 2)
401.,2017-06-29 01:18:53,22.65,95%,Speak roughly to your little boy and beat him when he sneeze...,No win (4 of 5)
400.,2017-06-25 01:24:15,22.84,95%,Freedom is the freedom to say that two plus two make four. I...,Win (1 of 2)
399.,2017-06-25 01:22:44,21.47,96%,"I didn't know the girl, but I knew her family. All their liv...",No win (3 of 3)
398.,2017-06-24 15:21:17,26.36,97%,"I went to the police, like a good American. These two boys w...",No win (3 of 5)
397.,2017-06-24 15:19:14,27.44,97%,I called Betsy again at her office and she said maybe we'd g...,No win (4 of 5)
396.,2017-06-24 15:17:18,25.88,97%,You're not like the others. I've seen a few; I know. When I ...,No win (2 of 2)
395.,2017-06-24 15:15:40,24.63,95%,"It's our land. We were born on it, and we got killed on it, ...",Win (1 of 2)
394.,2017-06-24 15:13:51,29.61,98%,Overhead the albatross hangs motionless upon the air and dee...,No win (3 of 5)
393.,2017-06-24 15:11:44,25.66,97%,"I'm Rick Harrison, and this is my pawn shop. I work here wit...",No win (3 of 3)
392.,2017-06-24 15:09:04,28.49,97%,Convection also plays a minor role because of the relative t...,No win (2 of 3)
391.,2017-06-24 15:06:30,31.89,98%,"Take my advice and live for a long, long time. Because the m...",No win (3 of 3)
390.,2017-06-24 15:05:19,25.44,97%,Make sure to secure the door when I am gone. There are many ...,Win (1 of 2)
389.,2017-06-24 15:03:42,30.04,98%,"So, I must be taken as I have been made. The success is not ...",Win (1 of 3)
388.,2017-06-24 15:01:43,25.83,96%,The unknown future rolls toward us. I face it for the first ...,No win (2 of 5)
387.,2017-06-24 14:59:58,24.25,96%,"After others have talked about themselves, a point will be r...",No win (2 of 3)
386.,2017-06-24 14:52:58,18.71,93%,"Now you come to me and you say, ""Don Corleone, give me justi...",No win (3 of 4)
385.,2017-06-24 14:50:28,27.78,98%,The spot where we intend to fight must not be made known; fo...,No win (2 of 2)
384.,2017-06-24 14:49:02,26.25,95%,"All at sea again, and now my hurricanes, have brought down t...",Win (1 of 2)
383.,2017-06-24 14:47:56,20.69,94%,I've seen things you people wouldn't believe. Attack ships o...,No win (2 of 3)
382.,2017-06-24 14:45:00,21.80,95%,"Imagine words like ""if"" as a two-finger movement instead of ...",No win (4 of 5)
381.,2017-06-24 14:43:07,21.09,95%,The garbage chute was a wonderful idea! What an incredible s...,No win (3 of 3)
380.,2017-06-24 14:41:47,23.82,96%,Many rivers to cross but I can't seem to find my way over. W...,No win (3 of 3)
379.,2017-06-24 14:39:57,27.45,98%,"When the mind is brought to rest and not allowed to wander, ...",Win (1 of 3)
378.,2017-06-24 14:38:16,24.07,95%,It's usually best to run as quick as you can for the first f...,No win (2 of 4)
377.,2017-06-24 14:36:03,20.39,94%,Make sure to secure the door when I am gone. There are many ...,No win (5 of 5)
376.,2017-06-24 14:34:06,22.48,97%,Isn't everybody tired of the fighting? Isn't everybody tired...,No win (2 of 2)
375.,2017-06-24 14:32:29,19.45,94%,There are very few things I wish I could change about those ...,No win (3 of 4)
374.,2017-06-24 14:31:01,29.67,98%,"I may not have been sure about what really did interest me, ...",No win (3 of 4)
373.,2017-06-24 14:29:54,23.41,97%,"In a word, I was too cowardly to do what I knew to be right,...",No win (3 of 5)
372.,2017-06-24 14:28:31,25.30,96%,I'll swear. All the clocks in the world have gone centuries ...,Win (1 of 3)
371.,2017-06-24 14:27:20,22.09,96%,"In the early history of topology, results were primarily mot...",No win (2 of 4)
370.,2017-06-24 14:25:53,24.37,98%,"You think you will die, but you just keep living, day after ...",Win (1 of 3)
369.,2017-06-23 18:45:51,25.88,94%,And the little screaming fact that sounds through all histor...,Win (1 of 3)
368.,2017-06-23 18:44:07,30.79,99%,You are the most important thing to me now. The most importa...,Win (1 of 3)
367.,2017-06-23 18:43:06,25.65,98%,"A computer needs a manager to administer its operations, jus...",No win (3 of 4)
366.,2017-06-23 18:41:34,22.34,96%,"And who are you, the proud lord said, that I must bow so low...",No win (4 of 4)
365.,2017-06-23 18:40:03,25.07,97%,I walked away and left him standing there in the moonlight w...,No win (2 of 2)
364.,2017-06-23 18:38:49,20.31,95%,"In a word, I was too cowardly to do what I knew to be right,...",No win (2 of 2)
363.,2017-06-23 18:37:11,24.50,96%,I remember that I'm invisible and walk softly so as to not a...,No win (2 of 3)
362.,2017-06-23 18:34:57,23.54,97%,We all know people who are very bright but who do not always...,Win (1 of 3)
361.,2017-06-23 14:17:03,19.72,95%,"Under such circumstances I naturally gravitated to London, t...",No win (4 of 4)
360.,2017-06-23 14:14:17,23.40,96%,"The Orient was almost a European invention, and had been sin...",No win (4 of 4)
359.,2017-06-23 14:11:38,25.96,98%,There's a piece of Maria in every song that I sing. And the ...,No win (2 of 3)
358.,2017-06-23 14:10:15,26.33,98%,"And who are you, the proud lord said, that I must bow so low...",No win (3 of 4)
357.,2017-06-23 14:08:58,25.21,96%,"Take a drink, my friend, and say what you have in your heart...",No win (3 of 3)
356.,2017-06-23 14:07:12,24.24,94%,"Doubting someone is not necessarily a bad thing, because it ...",No win (3 of 5)
355.,2017-06-23 14:05:25,21.61,96%,"Hello, babies. Welcome to Earth. It's hot in the summer and ...",No win (4 of 4)
354.,2017-06-23 14:03:06,24.45,97%,"Can I be like everyone, pretending that there's nothing wron...",Win (1 of 3)
353.,2017-06-23 14:01:10,28.77,97%,"If you think that you are going to love something, give it a...",Win (1 of 3)
352.,2017-06-23 13:59:08,28.27,97%,His dream must have seemed so close that he could hardly fai...,No win (3 of 3)
351.,2017-06-23 13:57:21,29.36,99%,It was one of those March days when the sun shines hot and t...,No win (3 of 5)
350.,2017-06-23 13:56:03,28.65,96%,In that cell you found something that mattered more to you t...,No win (2 of 3)
349.,2017-06-23 13:55:09,22.72,95%,"People get ready, there's a train coming. You don't need no ...",No win (2 of 3)
348.,2017-06-23 13:53:11,22.97,96%,"You cannot, sir, take from me any thing that I will more wil...",No win (3 of 3)
347.,2017-06-23 13:51:37,23.45,97%,"Many, many men have been just as troubled morally and spirit...",Win (1 of 3)
346.,2017-06-23 13:50:21,25.21,97%,"If the experts are baffled, how can the rest of us understan...",Win (1 of 3)
345.,2017-06-23 13:49:16,22.74,95%,"Look and think as far ahead as possible. Often, a driver's n...",No win (3 of 3)
344.,2017-06-23 13:47:18,22.14,96%,"Many years ago, a famous Arabian alchemist had visited Europ...",No win (2 of 2)
343.,2017-06-23 13:45:23,25.82,97%,That person tried to send poison to you and if you take it p...,Win (1 of 3)
342.,2017-06-23 13:43:29,24.28,96%,"In general, many of these targets are easier marks if you ar...",Win (1 of 3)
341.,2017-06-23 13:40:47,22.48,94%,Then he made one last effort to search in his heart for the ...,No win (3 of 3)
340.,2017-06-23 12:46:34,19.19,94%,"It's a funny thing, but people mostly have it backward. They...",No win (2 of 4)
339.,2017-06-23 12:43:54,23.09,95%,The intelligent person is able to identify a problem and fin...,No win (2 of 5)
338.,2017-06-23 12:42:29,16.36,95%,"Here I was born, and there I died. It was only a moment for ...",No win (2 of 4)
337.,2017-06-23 12:41:05,20.07,95%,"Tonight I'm making deals with the devil, and I know it's gon...",No win (4 of 4)
336.,2017-06-23 00:52:49,18.06,96%,The intelligent person is able to identify a problem and fin...,No win (3 of 4)
335.,2017-06-23 00:49:27,21.21,97%,I do not wish any reward but to know I have done the right t...,Win (1 of 3)
334.,2017-06-23 00:48:08,19.93,96%,Without some flexibility in our definitions we'll remain for...,No win (3 of 4)
333.,2017-06-23 00:46:23,16.59,95%,We live in a charmed world. If we have money we can buy lite...,No win (3 of 3)
332.,2017-06-23 00:43:59,20.46,97%,While it may hold true that the final few seconds of a bike ...,Win (1 of 3)
331.,2017-06-23 00:42:03,14.98,95%,I want your answer and the money by noon tomorrow. And one m...,Win (1 of 2)
330.,2017-06-22 02:15:32,13.74,94%,So it's all come back round to breaking apart again. Breakin...,No win (3 of 4)
329.,2017-06-22 02:11:09,21.05,98%,"It's too easy to criticize a man when he's out of favour, an...",No win (2 of 2)
328.,2017-06-22 02:09:20,19.43,96%,I can teach you how to bewitch the mind and ensnare the sens...,No win (5 of 5)
327.,2017-06-22 02:06:49,21.80,98%,"Every man desires to live long, but no man wishes to be old.",No win (5 of 5)
326.,2017-06-22 02:06:02,13.16,92%,The label doesn't mention that that rib-eye steak came from ...,No win (4 of 5)
325.,2017-06-20 20:12:42,22.18,93%,Contrary to my advice you took the job. I offered you someth...,No win (2 of 2)
324.,2017-06-20 20:11:26,22.21,94%,Sparkling wines are wines that contain carbon dioxide bubble...,Win (1 of 3)
323.,2017-06-20 20:09:22,22.07,96%,"Scottie, do you believe that someone out of the past - someo...",No win (3 of 3)
322.,2017-06-20 20:07:51,28.76,98%,In his blue gardens men and girls came and went like moths a...,Win (1 of 2)
321.,2017-06-20 20:06:48,22.22,96%,"For what do we live, but to make sport for our neighbors, an...",No win (2 of 3)
320.,2017-06-20 20:05:32,22.22,98%,"It's a four ton truck, Tyrone, it's not as though it's a pac...",Win (1 of 2)
319.,2017-06-20 20:04:28,20.23,96%,"Baby, ever wondered why I could make you laugh and cry? Ecli...",No win (2 of 2)
318.,2017-06-20 20:03:04,26.87,96%,A man who doesn't spend time with his family can never be a ...,No win (2 of 3)
317.,2017-06-20 20:01:36,25.89,98%,The awful thing is that beauty is mysterious as well as terr...,Win (1 of 3)
316.,2017-06-20 20:00:01,20.93,95%,"I need you, the reader, to imagine us, for we don't really e...",No win (3 of 3)
315.,2017-06-20 19:58:47,21.50,94%,"It was not the thorn bending to the honeysuckles, but the ho...",No win (3 of 3)
314.,2017-06-20 19:57:28,24.39,97%,You are what you are and you are where you are because of wh...,No win (2 of 3)
313.,2017-06-20 19:55:30,27.20,98%,"I have stones to sell, fat to chew, and many different men t...",No win (2 of 3)
312.,2017-06-20 19:51:06,20.65,95%,"Where I come from, there's a terrible drought. We saw pictur...",No win (3 of 3)
311.,2017-06-20 19:49:01,27.71,98%,And he told us of his life in the land of submarines.,No win (5 of 5)
310.,2017-06-20 19:48:20,24.63,98%,You can't blame me. They've been making statues for some two...,No win (2 of 2)
309.,2017-06-20 19:47:05,20.31,96%,Maybe you should come with me for a few weeks. See what happ...,No win (5 of 5)
308.,2017-06-20 19:45:30,21.47,98%,"And, anyway, it's not about making money, it's about taking ...",No win (4 of 5)
307.,2017-06-20 19:41:42,20.22,94%,The major difference between a thing that might go wrong and...,No win (5 of 5)
306.,2017-06-20 19:22:09,21.00,96%,"Half the time she did things not simply, not for themselves;...",No win (5 of 5)
305.,2017-06-20 19:17:54,29.71,99%,"It makes no difference, it don't make any difference to me w...",No win (3 of 3)
304.,2017-06-20 19:16:13,25.70,97%,Advertising has these people chasing cars and clothes they d...,No win (5 of 5)
303.,2017-06-20 14:12:26,25.37,97%,So what's in this for you? Should you rush out in search of ...,No win (4 of 4)
302.,2017-06-20 14:10:10,28.42,99%,"Every craft and every investigation, and likewise every acti...",No win (4 of 5)
301.,2017-06-20 14:08:06,26.78,98%,"Soon I'll be sixty years old, my daddy got sixty-one. Rememb...",No win (5 of 5)
300.,2017-06-20 14:05:53,28.28,98%,A truth once seen by a single mind ends up by imposing itsel...,Win (1 of 2)
299.,2017-06-20 14:04:26,30.21,100%,"You came close, but you never made it, and if you were gonna...",Win (1 of 4)
298.,2017-06-20 14:03:16,28.84,99%,"These things gotta happen every five years or so, ten years....",No win (2 of 3)
297.,2017-06-20 14:01:44,29.93,99%,I do not deny that what happened to us is a thing worth laug...,No win (3 of 5)
296.,2017-06-20 13:59:43,25.58,98%,By studying the cooling of pizza in the gravity free environ...,No win (4 of 5)
295.,2017-06-20 13:58:00,30.23,100%,Sometimes I wondered if I was seeing the same things through...,No win (2 of 4)
294.,2017-06-20 13:56:19,20.92,97%,"I'll have two number 9s, a number 9 large, a number 6 with e...",No win (4 of 4)
293.,2017-06-20 13:54:23,29.73,99%,Through error you come to the truth! I am a man because I er...,No win (3 of 5)
292.,2017-06-20 13:52:30,27.12,99%,"This is what we call love. When you are loved, you can do an...",No win (4 of 4)
291.,2017-06-20 13:49:46,31.91,99%,I think if it is true that there are as many minds as there ...,No win (4 of 5)
290.,2017-06-20 13:48:01,25.49,98%,He also swore himself by a binding oath that whatever wife h...,No win (3 of 4)
289.,2017-06-20 13:45:56,26.59,98%,"Some day, and that day may never come, I will call upon you ...",No win (3 of 5)
288.,2017-06-20 13:43:57,21.79,95%,"And as we let our own light shine, we unconsciously give oth...",Win (1 of 4)
287.,2017-06-19 11:37:50,27.11,99%,Isn't everybody tired of the fighting? Isn't everybody tired...,No win (2 of 4)
286.,2017-06-19 11:36:10,27.92,100%,"Hey, Uncle Mike, I'm just here for the party. I didn't come ...",No win (2 of 5)
285.,2017-06-19 11:35:14,25.89,96%,"You have been on my mind, I've been trying to let it go. I'v...",Win (1 of 5)
284.,2017-06-19 11:33:46,28.22,99%,What good are prayers and shrines to a person mad with love?...,No win (2 of 5)
283.,2017-06-19 11:32:11,30.29,100%,"Since we're all going to die, it's obvious that when and how...",Win (1 of 4)
282.,2017-06-19 11:31:07,28.50,99%,Your sins are terrible. It is just that you suffer. Your lif...,Win (1 of 3)
281.,2017-06-19 11:29:35,27.95,99%,"It is a truth universally acknowledged, that a single man in...",No win (4 of 5)
280.,2017-06-19 11:28:11,25.60,99%,I'm the most terrific liar you ever saw in your life. It's a...,No win (3 of 5)
279.,2017-06-19 11:26:22,22.81,98%,"Hey Mr. Tambourine Man, play a song for me, I'm not sleepy a...",No win (2 of 4)
278.,2017-06-18 20:21:08,23.91,97%,"I pulled up to the house about 7 or 8, and I yelled to the c...",No win (4 of 4)
277.,2017-06-18 20:19:03,25.31,97%,"They say, ""Find a purpose in your life and live it."" But, so...",No win (3 of 5)
276.,2017-06-18 20:16:59,26.84,98%,You are what you are and you are where you are because of wh...,No win (4 of 5)
275.,2017-06-18 20:14:57,26.07,98%,Try to keep in mind that a young person playing Willie Loman...,No win (5 of 5)
274.,2017-06-18 20:12:23,24.42,98%,I had a friend who was a heavy drinker. If somebody asked hi...,No win (4 of 5)
273.,2017-06-18 20:09:31,24.77,97%,Directories contain elements that describe objects in the wo...,No win (2 of 5)
272.,2017-06-18 20:04:45,26.10,99%,"Though my story's seldom told, I have squandered my resistan...",No win (3 of 5)
271.,2017-06-18 20:01:59,29.73,99%,"I am doing good to the poor, but I differ in opinion about t...",Win (1 of 2)
270.,2017-06-18 19:59:59,26.55,98%,You have brains in your head. You have feet in your shoes. Y...,No win (3 of 4)
269.,2017-06-18 19:57:42,27.08,97%,"And certainly, the mistakes that we male and female mortals ...",No win (3 of 5)
268.,2017-06-18 19:56:03,25.85,97%,"Look and think as far ahead as possible. Often, a driver's n...",No win (3 of 5)
267.,2017-06-18 19:54:14,23.62,97%,"I got that sunshine in my pocket, got that good soul in my f...",No win (2 of 2)
266.,2017-06-18 19:51:36,27.32,99%,"I don't want tickets, I need you to find me a painting, a cl...",No win (5 of 5)
265.,2017-06-18 19:49:00,23.49,98%,"Power doesn't have to show off. Power is confident, self-ass...",No win (3 of 4)
264.,2017-06-18 19:47:03,28.87,97%,"If anything in this life is certain, if history has taught u...",No win (2 of 4)
263.,2017-06-18 19:45:33,27.08,98%,"Mother used to say that however miserable one is, there's al...",No win (2 of 4)
262.,2017-06-18 19:42:58,23.47,97%,"To some, the rules of etiquette may seem outdated, stuffy an...",No win (3 of 5)
261.,2017-06-18 19:40:35,26.42,98%,"All hands on deck at dawn, sailing to sadder shores. Your po...",No win (2 of 5)
260.,2017-06-18 19:39:00,23.07,96%,"Now listen up! Back in my day, we didn't have fancy tanks! W...",No win (4 of 5)
259.,2017-06-18 19:36:36,29.08,98%,"You know, that might be the answer - to act boastfully about...",No win (3 of 5)
258.,2017-06-18 19:34:59,23.83,95%,The movements which work revolutions in the world are born o...,No win (5 of 5)
257.,2017-06-18 19:33:41,31.41,99%,"You have been on my mind, I've been trying to let it go. I'v...",No win (3 of 5)
256.,2017-06-18 19:32:08,24.84,98%,"People get ready, there's a train coming. You don't need no ...",Win (1 of 2)
255.,2017-06-18 19:27:58,27.96,99%,Every time I think of you I feel shot right through with a b...,Win (1 of 3)
254.,2017-06-18 19:25:52,24.04,97%,"To some, the rules of etiquette may seem outdated, stuffy an...",No win (2 of 4)
253.,2017-06-18 19:23:47,25.25,94%,To be fond of dancing was a certain step towards falling in ...,No win (2 of 2)
252.,2017-06-18 19:22:23,26.07,98%,Relativity is relatively easy to understand. But there's one...,No win (4 of 5)
251.,2017-06-18 19:19:32,30.02,100%,Wrongfully imprisoned action heroes rarely have the time to ...,Win (1 of 4)
250.,2017-06-18 19:18:27,26.52,97%,"When I really worry about something, I don't just fool aroun...",No win (5 of 5)
249.,2017-06-18 19:16:08,30.82,99%,"Dusk crept over the sky from the eastern horizon, and darkne...",No win (3 of 5)
248.,2017-06-18 19:14:43,29.54,99%,"If you know the enemy and know yourself, you need not fear t...",No win (2 of 4)
247.,2017-06-18 19:12:23,27.80,98%,"When I close my eyes, I am at the center of the sun. And I c...",No win (3 of 3)
246.,2017-06-18 19:11:09,31.12,98%,"For all the things you've done, for the things you might hav...",No win (2 of 4)
245.,2017-06-18 19:09:57,29.89,99%,Perhaps it was an old flame he was in mourning for from the ...,No win (3 of 4)
244.,2017-06-18 19:08:22,28.72,99%,You've got a way to keep me on your side. You give me cause ...,Win (1 of 3)
243.,2017-06-18 19:06:15,25.58,99%,Even the best-designed chair won't make up for bad posture. ...,No win (4 of 4)
242.,2017-06-18 17:53:08,27.67,100%,"Say, go through the darkest of days. Heaven's a heartbreak a...",No win (2 of 4)
241.,2017-06-18 17:50:41,26.23,99%,Welcome to the room of people who have rooms of people that ...,No win (5 of 5)
240.,2017-06-18 17:48:17,31.28,99%,That person tried to send poison to you and if you take it p...,No win (4 of 4)
239.,2017-06-18 17:46:50,27.91,97%,"We sailed up to the sun, till we found the sea of green and ...",No win (2 of 4)
238.,2017-06-18 17:45:18,28.61,98%,"To produce a mighty book, you must choose a mighty theme. No...",No win (4 of 5)
237.,2017-06-18 17:43:30,26.27,97%,You have brains in your head. You have feet in your shoes. Y...,No win (4 of 4)
236.,2017-06-18 17:41:06,26.44,99%,"Noontime, and I'm still pushing myself along the road, the d...",No win (3 of 5)
235.,2017-06-18 17:38:21,26.39,98%,I thought maybe I'd run to the end of town. And when I got t...,No win (4 of 5)
234.,2017-06-18 17:36:16,28.51,100%,"I know I've made some very poor decisions recently, but I ca...",No win (2 of 3)
233.,2017-06-18 17:34:30,27.70,100%,"My mother had to abandon her quest, but managed to extract f...",No win (4 of 5)
232.,2017-06-18 17:32:36,27.08,98%,I enjoy talking to you. Your mind appeals to me. It resemble...,No win (3 of 4)
231.,2017-06-18 17:25:34,21.73,96%,"""This man right here,"" McGuinness said, pointing at Kenna, ""...",No win (3 of 3)
230.,2017-06-18 17:22:31,24.31,98%,All music is what awakes from you when you are reminded by t...,No win (3 of 4)
229.,2017-06-18 17:19:22,27.52,99%,"I'd pull your eyes out of your head, and put them in my own ...",No win (3 of 5)
228.,2017-06-18 17:17:39,24.83,98%,I enjoy talking to you. Your mind appeals to me. It resemble...,No win (2 of 2)
227.,2017-06-18 17:15:48,24.02,97%,Supermarket aisles are the perfect place to practice your gl...,No win (3 of 5)
226.,2017-06-18 17:11:51,25.91,98%,Language is one of the keys to being human. It allows us to ...,Win (1 of 2)
225.,2017-06-18 17:09:04,30.07,100%,"You came close, but you never made it, and if you were gonna...",Win (1 of 3)
224.,2017-06-18 17:08:05,30.49,100%,It is at this point in our story that along comes a spider.,Win (1 of 4)
223.,2017-06-18 17:07:10,25.05,100%,"I said to myself, this is the business we've chosen; I didn'...",Win (1 of 3)
222.,2017-06-18 17:05:19,22.88,97%,So what's in this for you? Should you rush out in search of ...,No win (5 of 5)
221.,2017-06-18 02:07:30,27.37,100%,"I was within and without, simultaneously enchanted and repel...",Win (1 of 3)
220.,2017-06-18 02:06:23,24.52,98%,"I'll miss the sea, but a person needs new experiences. Witho...",Win (1 of 2)
219.,2017-06-18 02:05:06,22.98,96%,"What a tale he's told, what a bitter bowl of war he's drunk ...",No win (2 of 3)
218.,2017-06-18 02:03:52,23.03,96%,"If somebody else has it much worse, that doesn't really chan...",No win (2 of 2)
217.,2017-06-18 02:02:28,23.67,96%,"In fact, the mere act of opening the box will determine the ...",Win (1 of 2)
216.,2017-06-18 02:00:14,23.80,96%,I don't believe in painted roses or bleeding hearts while bu...,No win (2 of 3)
215.,2017-06-18 01:57:19,23.57,95%,I drew the blankets over my head and tried to think of Chris...,No win (3 of 3)
214.,2017-06-18 01:55:11,23.56,95%,Let us learn to appreciate there will be times when the tree...,No win (5 of 5)
213.,2017-06-18 01:46:48,27.41,99%,"And if you lose me, then you'll know I, I loved you. And I w...",Win (1 of 3)
212.,2017-06-18 01:45:35,26.76,98%,"Let me say that I swear, on the souls of my grandchildren, t...",No win (4 of 5)
211.,2017-06-18 01:43:56,23.52,97%,Men are so quick to blame the gods: they say that we devise ...,Win (1 of 2)
210.,2017-06-18 01:42:02,29.16,99%,I feel that way all the time. Like I'm from some other plane...,Win (1 of 3)
209.,2017-06-18 01:40:22,26.85,98%,You have two choices: you can keep running and hiding and bl...,No win (2 of 2)
208.,2017-06-18 01:38:27,28.06,98%,"However we choose to feed ourselves, we eat by the grace of ...",Win (1 of 3)
