656.,2017-07-15 14:31:20,25.77,94%,"You see, if you shoot pool with some employee here, you can ...",No win (2 of 4)
655.,2017-07-15 14:27:29,32.38,98%,Haven't you ever happened to come across in a book some vagu...,No win (4 of 5)
654.,2017-07-15 14:25:55,30.11,97%,"Dragged ya down below, down to the devil's show to be his gu...",Win (1 of 4)
653.,2017-07-15 14:23:57,28.15,97%,Having endured the racial turmoil of the Civil Rights Moveme...,No win (4 of 4)
652.,2017-07-15 14:19:20,30.83,98%,I can teach you how to bewitch the mind and ensnare the sens...,No win (4 of 4)
651.,2017-07-15 02:56:06,29.18,96%,"Sometimes I wake up by the door, that heart you caught must ...",No win (4 of 5)
650.,2017-07-15 02:54:33,26.83,95%,"During the battle, Rebel spies managed to steal secret plans...",No win (3 of 4)
649.,2017-07-15 02:52:15,24.27,93%,"Radiation could be precisely determined, in principle, if we...",No win (5 of 5)
648.,2017-07-15 02:50:39,32.69,97%,What's the use you learning to do right when it's troublesom...,No win (4 of 5)
647.,2017-07-15 02:49:33,32.19,98%,The increase of disorder or entropy is what distinguishes th...,No win (3 of 5)
646.,2017-07-15 02:48:31,28.16,96%,"I used to bite my tongue and hold my breath, scared to rock ...",No win (4 of 4)
645.,2017-07-15 02:46:27,32.20,98%,"When I was a kid, you never saw radicchio in the produce sec...",No win (3 of 4)
644.,2017-07-15 02:45:10,33.86,99%,"May your hands always be busy, may your feet always be swift...",No win (4 of 5)
643.,2017-07-15 02:43:35,31.60,98%,For one who contradicts emptiness there would be nothing tha...,No win (4 of 5)
642.,2017-07-15 02:42:20,29.13,97%,"At last, we finally meet. I have something for you, Chancell...",No win (3 of 3)
641.,2017-07-15 02:40:37,34.75,100%,What a lamentable thing it is that men should blame the gods...,No win (3 of 4)
640.,2017-07-15 02:39:05,29.58,97%,"I loved her against reason, against promise, against peace, ...",Win (1 of 3)
639.,2017-07-15 02:37:51,26.78,97%,"""Exactly,"" said Dumbledore, beaming once more. ""Which makes ...",No win (4 of 5)
638.,2017-07-15 02:35:50,32.02,98%,It's the possibility of having a dream come true that makes ...,No win (4 of 5)
637.,2017-07-14 00:52:31,27.99,95%,"I believe in love, and I know that you do too. And I believe...",Win (1 of 5)
636.,2017-07-14 00:51:03,31.66,99%,Everybody knows that your average bedroom monster is reptili...,Win (1 of 3)
635.,2017-07-14 00:50:03,30.15,99%,"Oh, but anyway, Toto, we're home. Home! And this is my room,...",No win (3 of 5)
634.,2017-07-14 00:48:30,27.11,95%,"To some, the rules of etiquette may seem outdated, stuffy an...",No win (3 of 4)
633.,2017-07-14 00:46:34,29.51,97%,"If I leave here tomorrow, would you still remember me? For I...",No win (4 of 5)
632.,2017-07-14 00:45:23,28.50,98%,As I experience certain sensory input patterns my mental pat...,No win (2 of 5)
631.,2017-07-14 00:43:58,28.69,97%,"When I was a kid, you never saw radicchio in the produce sec...",No win (5 of 5)
630.,2017-07-14 00:42:32,20.49,96%,"Waving colored flags, we won't surrender, there's no standin...",No win (4 of 5)
629.,2017-07-14 00:40:56,28.42,97%,He canceled all his commitments and pulled together the most...,No win (3 of 5)
628.,2017-07-14 00:38:48,24.18,96%,The beginner writes just twenty pieces. The professional wri...,No win (4 of 5)
627.,2017-07-14 00:36:49,28.72,98%,"If Realism called it like it saw it, Metafiction simply call...",No win (3 of 4)
626.,2017-07-14 00:35:54,32.15,99%,There's something way down deep that's eternal about every h...,No win (3 of 3)
625.,2017-07-14 00:35:03,25.64,97%,"The consequences of our actions are always so complicated, s...",No win (3 of 4)
624.,2017-07-14 00:33:43,28.72,98%,For it is the nature of a log or stone to remain motionless ...,No win (3 of 5)
623.,2017-07-14 00:32:55,25.44,97%,"The consequences of our actions are always so complicated, s...",No win (5 of 5)
622.,2017-07-13 01:45:38,34.46,99%,Sparkling wines are wines that contain carbon dioxide bubble...,Win (1 of 5)
621.,2017-07-13 01:44:17,32.98,98%,I was assailed by memories of a life that wasn't mine anymor...,No win (4 of 5)
620.,2017-07-13 01:42:33,27.93,97%,Some have a positive vocation for breaking open safes: from ...,No win (4 of 5)
619.,2017-07-13 01:40:00,25.70,95%,"Gentlemen: You have undertaken to cheat me. I won't sue you,...",Win (1 of 2)
618.,2017-07-13 01:38:51,29.65,97%,Oh... and how is education supposed to make me feel smarter?...,No win (5 of 5)
617.,2017-07-13 01:37:10,26.77,98%,Friday morning Qwilleran sat at his typewriter and stared at...,No win (4 of 4)
616.,2017-07-13 01:34:56,30.71,98%,I just want to tell you how I'm feeling. Gotta make you unde...,No win (4 of 4)
615.,2017-07-13 01:33:08,27.55,97%,"Hey, Uncle Mike, I'm just here for the party. I didn't come ...",No win (2 of 5)
614.,2017-07-13 01:32:11,30.85,97%,I'd sacrifice anything come what might for the sake of havin...,No win (2 of 4)
613.,2017-07-13 01:30:52,32.91,98%,"Some day, and that day may never come, I will call upon you ...",No win (3 of 5)
612.,2017-07-13 01:29:32,29.42,99%,"Ghana is passing through a demographic transition, and the r...",No win (5 of 5)
611.,2017-07-12 15:55:27,22.69,95%,We have a straight shot into the fusion reactor. We need a c...,No win (3 of 3)
610.,2017-07-12 15:51:52,18.99,94%,"You think you will die, but you just keep living, day after ...",No win (5 of 5)
609.,2017-07-12 15:50:47,31.04,97%,It's the possibility of having a dream come true that makes ...,No win (4 of 5)
608.,2017-07-12 15:49:33,24.51,90%,This country is hard on people. Hard and crazy. Got the devi...,No win (3 of 5)
607.,2017-07-12 15:48:22,28.07,96%,"It also occurred to him that throughout history, humankind h...",No win (2 of 3)
606.,2017-07-12 15:46:21,24.87,96%,I know now that it's over. I knew it then. There would be no...,No win (2 of 3)
605.,2017-07-12 15:43:50,25.48,95%,"Look, you should admit to yourself that Microsoft will miss ...",No win (3 of 5)
604.,2017-07-12 15:41:23,34.81,98%,"New thoughts and hopes were whirling through my mind, and al...",No win (3 of 4)
603.,2017-07-12 15:40:24,24.06,94%,Even the best-designed chair won't make up for bad posture. ...,No win (4 of 5)
602.,2017-07-12 15:38:05,25.55,96%,When I look into your eyes I can see a love restrained. But ...,No win (2 of 4)
601.,2017-07-12 15:35:49,29.02,96%,Haven't I taught you anything? What have I always told you? ...,No win (2 of 4)
600.,2017-07-12 15:34:29,32.58,98%,I was assailed by memories of a life that wasn't mine anymor...,No win (3 of 3)
599.,2017-07-12 15:32:46,29.20,97%,"This mystery of use without consumption, of warmth without c...",No win (4 of 5)
598.,2017-07-12 15:30:41,29.84,98%,Forgive me for being so inquisitive but during the past few ...,Win (1 of 3)
597.,2017-07-12 15:29:18,29.09,99%,There are two places on Earth that serve as canaries in the ...,Win (1 of 2)
596.,2017-07-12 15:27:40,25.81,95%,"Man, don't tell me how good I was. I just got away with it b...",No win (2 of 4)
595.,2017-07-12 15:26:00,26.83,96%,Surely there can't be so many countries worth dying for. Any...,No win (3 of 4)
594.,2017-07-12 15:24:46,22.68,96%,"You don't frighten us, English pig dogs. Go and boil your bo...",No win (2 of 3)
593.,2017-07-12 15:23:01,27.01,97%,You're right Will. I can't do this proof. But you can and wh...,No win (5 of 5)
592.,2017-07-12 15:21:12,21.76,93%,"Why, sometimes I've believed as many as six impossible thing...",No win (2 of 3)
591.,2017-07-12 14:47:25,23.73,93%,The beginner writes just twenty pieces. The professional wri...,No win (5 of 5)
590.,2017-07-12 14:45:21,28.54,98%,"Ever since I was a child, folks have thought they had me peg...",No win (2 of 4)
589.,2017-07-12 14:43:41,24.81,94%,I will need my spectacles and a clear head. Today I broke my...,Win (1 of 2)
588.,2017-07-12 14:41:04,18.90,94%,Why are you trying so hard to fit in when you were born to s...,No win (4 of 4)
587.,2017-07-12 14:39:54,23.20,93%,"King, eh? Very nice. And how'd you get that, eh? By exploiti...",Win (1 of 3)
586.,2017-07-12 14:37:45,28.68,97%,This country is hard on people. Hard and crazy. Got the devi...,Win (1 of 3)
585.,2017-07-12 14:36:31,22.95,94%,"In America, circus folk ride through town, while bands play ...",No win (3 of 5)
584.,2017-07-12 14:34:21,28.00,95%,It's really hard to do nothing totally. Even just sitting he...,No win (3 of 5)
583.,2017-07-12 14:32:42,25.89,95%,"My lamp burns low, and I have written far into the night; bu...",No win (2 of 3)
582.,2017-07-12 14:31:09,20.79,92%,"My words fly up, my thoughts remain below: words without tho...",No win (3 of 3)
581.,2017-07-12 14:29:53,25.30,93%,Since the ninja is that being than which nothing sweeter can...,No win (2 of 2)
580.,2017-07-12 14:28:05,27.37,96%,I have something here for you. Your father wanted you to hav...,No win (3 of 5)
579.,2017-07-12 14:26:02,24.15,96%,With the coming of Dean Moriarty began the part of my life y...,No win (4 of 4)
578.,2017-07-12 14:23:43,18.28,95%,"Some tourists think Amsterdam is a city of sin, but in truth...",No win (4 of 5)
577.,2017-07-12 02:05:59,22.09,93%,"Sir, a couple of brief points: firstly, you're not a qualifi...",No win (2 of 2)
576.,2017-07-12 02:03:13,21.68,94%,"Hope you're feeling better now, hope you got my letter, how ...",No win (3 of 4)
575.,2017-07-12 02:01:59,25.33,94%,"Keep off the path, beware of the gate, watch out for signs t...",No win (5 of 5)
574.,2017-07-12 01:59:55,32.14,96%,Love in action is a harsh and dreadful thing compared to lov...,No win (2 of 4)
573.,2017-07-12 01:59:08,31.69,98%,Teenage angst has paid off well. Now I'm bored and old. Self...,No win (4 of 5)
572.,2017-07-12 01:57:24,29.79,96%,"Some men are born mediocre, some men achieve mediocrity, and...",No win (2 of 4)
571.,2017-07-12 01:56:07,33.17,98%,The ultimate way to compose is to be able to keyboard as fas...,Win (1 of 2)
570.,2017-07-12 01:55:03,26.34,92%,"The Earth is a world, the world is a ball, a ball in a game ...",No win (2 of 3)
569.,2017-07-12 01:53:34,30.18,98%,Lucid but wholly false recollections can easily be induced b...,No win (2 of 2)
568.,2017-07-12 01:52:30,21.65,93%,"Words are, in my not-so-humble opinion, our most inexhaustib...",No win (2 of 5)
567.,2017-07-12 01:51:08,23.96,97%,"There can be no covenants between men and lions, wolves and ...",No win (3 of 4)
566.,2017-07-12 01:49:50,31.81,97%,"You think you will die, but you just keep living, day after ...",No win (2 of 5)
565.,2017-07-12 01:49:09,26.25,95%,They discussed its ramifications. Possession of grain alcoho...,No win (3 of 4)
564.,2017-07-12 01:46:52,30.37,98%,All I asked was for you to behave like a princess. Even roya...,Win (1 of 3)
563.,2017-07-12 01:45:29,25.94,95%,I enjoy talking to you. Your mind appeals to me. It resemble...,No win (5 of 5)
562.,2017-07-12 01:44:20,24.73,94%,"Lesser than Macbeth, and greater. Not so happy, yet much hap...",No win (4 of 4)
561.,2017-07-12 01:42:44,27.06,96%,"Everybody's talking about revolution, evolution, mastication...",No win (3 of 5)
560.,2017-07-12 01:40:42,26.20,95%,"Sometimes I wake up by the door, that heart you caught must ...",No win (5 of 5)
559.,2017-07-12 01:39:13,24.29,95%,My wife deserves vengeance. Doesn't make a difference whethe...,No win (3 of 4)
558.,2017-07-12 01:37:03,29.49,97%,How do I live without the ones I love? Time still turns the ...,No win (2 of 5)
557.,2017-07-12 01:35:36,27.14,95%,Involuntarily I glanced seaward - and distinguished nothing ...,No win (5 of 5)
556.,2017-07-12 01:05:32,32.13,98%,It is no worse because I write of it. It would be no better ...,Win (1 of 5)
555.,2017-07-12 01:04:12,31.18,96%,I don't believe in painted roses or bleeding hearts while bu...,Win (1 of 4)
554.,2017-07-12 01:02:36,29.96,97%,When we got to the Mint I parked on the street in front of t...,Win (1 of 3)
553.,2017-07-12 01:00:40,30.32,98%,"Your primary objective should be to touch-type; that is, to ...",No win (2 of 4)
552.,2017-07-12 00:58:29,28.17,98%,"One respondent said ""For women - a lot of games are crap - t...",No win (4 of 5)
551.,2017-07-12 00:56:41,27.62,96%,Supermarket aisles are the perfect place to practice your gl...,No win (2 of 5)
550.,2017-07-12 00:54:03,25.19,96%,I have never done a day's work in my life - honest or dishon...,No win (4 of 4)
549.,2017-07-10 23:28:28,26.37,97%,"Two years ago this property cost one million pounds. Today, ...",No win (3 of 5)
548.,2017-07-10 22:49:40,30.22,96%,And why the winter suns so rush to bathe themselves in the s...,No win (2 of 3)
547.,2017-07-10 22:47:12,24.26,93%,"You could substitute raspberries or any other fruit, but 99....",No win (5 of 5)
546.,2017-07-10 18:14:12,25.47,97%,"I'm afraid I can't explain myself, sir. Because I am not mys...",No win (3 of 5)
545.,2017-07-10 18:13:14,28.42,95%,Perhaps I'm just projecting my own concern about it. I know ...,No win (2 of 3)
544.,2017-07-10 18:11:18,28.35,96%,"With no map to navigate one's life, some of us have stood st...",No win (4 of 5)
543.,2017-07-10 18:09:34,29.78,96%,The alternative to binge travel entails relocating to one pl...,No win (4 of 5)
542.,2017-07-10 18:07:50,30.59,95%,And he told us of his life in the land of submarines.,No win (2 of 5)
541.,2017-07-10 18:07:10,34.39,97%,"And you can fly high as a kite if you want to, faster than l...",Win (1 of 4)
540.,2017-07-10 18:06:07,26.47,95%,Have you no hope at all? And do you really live with the tho...,No win (3 of 4)
539.,2017-07-10 18:04:59,28.78,95%,"These things gotta happen every five years or so, ten years....",No win (3 of 3)
538.,2017-07-10 18:03:45,34.71,98%,"Lonely people tend, rather, to be lonely because they declin...",No win (3 of 5)
537.,2017-07-10 18:02:18,30.34,98%,"The green eyes, you're the one that I wanted to find and any...",No win (5 of 5)
536.,2017-07-10 18:01:21,29.20,99%,"Sometimes I wake up by the door, that heart you caught must ...",No win (4 of 5)
535.,2017-07-10 18:00:02,29.59,99%,"There was me, that is Alex, and my three droogs, that is Pet...",No win (4 of 5)
534.,2017-07-10 17:58:22,29.63,99%,Hello. My name is Inigo Montoya. You killed my father. Prepa...,No win (2 of 5)
533.,2017-07-09 19:37:56,25.62,96%,"Does she know what she's getting, Spock? A carcass full of m...",No win (4 of 5)
532.,2017-07-09 19:35:22,25.81,95%,"Why is it that when one man builds a wall, the next man imme...",No win (2 of 3)
531.,2017-07-09 19:34:22,26.17,96%,"For most people, the ringing of a phone was a welcome sign. ...",No win (3 of 5)
530.,2017-07-09 19:32:30,30.27,98%,Without warning the Halon system goes off. Pillars of high-p...,Win (1 of 2)
529.,2017-07-09 19:30:56,32.00,97%,"They say that right after God created man, he took a rib fro...",No win (3 of 3)
528.,2017-07-09 19:29:09,27.52,95%,"The point is that if you are a little different, or a little...",Win (1 of 3)
527.,2017-07-09 19:27:43,27.76,95%,I have no idea how I untangled the complicated process of wo...,Win (1 of 3)
526.,2017-07-09 19:26:02,24.26,95%,She couldn't understand a vocation. Some people can't; at be...,No win (4 of 5)
525.,2017-07-09 19:24:07,23.27,96%,"Give me that man that is not passion's slave, and I will wea...",No win (2 of 3)
524.,2017-07-09 19:18:08,24.30,95%,"But when a man suspects any wrong, it sometimes happens that...",No win (2 of 3)
523.,2017-07-09 19:16:35,26.94,96%,"Thing is Butch, right now you got ability. But painful as it...",No win (3 of 5)
522.,2017-07-09 19:14:57,32.31,99%,We look not at the things which are what you would call seen...,No win (2 of 2)
521.,2017-07-09 19:13:21,25.54,94%,"I've heard there was a secret chord that David played, and i...",No win (4 of 4)
520.,2017-07-09 19:11:09,30.73,97%,"Sing us a song, you're the piano man. Sing us a song tonight...",No win (5 of 5)
519.,2017-07-09 19:10:04,25.41,94%,"Say, go through the darkest of days. Heaven's a heartbreak a...",No win (2 of 3)
518.,2017-07-09 19:08:32,28.62,97%,"If there's a bustle in your hedgerow, don't be alarmed now, ...",No win (2 of 2)
517.,2017-07-09 19:06:45,31.23,97%,A man of genius makes no mistakes. His errors are volitional...,No win (3 of 5)
516.,2017-07-09 19:05:50,30.73,96%,"I could easily forgive his pride, if he had not mortified mi...",No win (4 of 5)
515.,2017-07-09 19:05:05,31.78,99%,What good are prayers and shrines to a person mad with love?...,No win (2 of 4)
514.,2017-07-09 19:03:36,26.57,95%,I've been looking so long at these pictures of you that I al...,No win (3 of 3)
513.,2017-07-09 19:01:51,26.42,95%,They had their faces twisted toward their haunches and found...,No win (4 of 5)
512.,2017-07-09 18:59:56,32.91,99%,His soul swooned slowly as he heard the snow falling faintly...,No win (4 of 4)
511.,2017-07-09 18:58:32,26.63,98%,"May your hands always be busy, may your feet always be swift...",No win (3 of 3)
510.,2017-07-07 12:28:19,29.48,96%,Achieving top performance in a programming contest or any ot...,No win (3 of 5)
509.,2017-07-07 12:26:08,28.80,97%,This little droid. I think he's searching for his former mas...,No win (2 of 3)
508.,2017-07-07 12:24:04,29.77,96%,"The hectic speed, and the brevity of the lines in the thread...",No win (2 of 3)
507.,2017-07-07 12:22:47,29.74,95%,If we were left solely to the wordy wit of legislators in Co...,No win (3 of 4)
506.,2017-07-07 12:20:55,28.66,95%,My story is of such marvel that if it were written with a ne...,No win (4 of 5)
505.,2017-07-07 12:19:28,31.46,97%,You will become way less concerned with what other people th...,No win (3 of 5)
504.,2017-07-07 12:18:36,31.10,96%,"How can I just let you walk away, just let you leave without...",No win (5 of 5)
503.,2017-07-07 12:17:10,32.55,97%,A man who doesn't spend time with his family can never be a ...,No win (3 of 5)
502.,2017-07-07 12:16:25,27.05,94%,"The problem is, Willie, is that Charles and yourself are not...",No win (5 of 5)
501.,2017-07-07 12:14:49,34.91,97%,It is the easiest thing in the world for a man to look as if...,Win (1 of 3)
500.,2017-07-07 12:13:29,30.03,96%,"Did it matter then, she asked herself, walking towards bond ...",No win (3 of 5)
499.,2017-07-07 12:10:31,26.57,96%,We live in an age when people do more writing than they have...,No win (4 of 5)
498.,2017-07-07 12:08:08,29.25,98%,"If you don't get what you want, you suffer; if you get what ...",Win (1 of 2)
497.,2017-07-07 12:06:24,22.81,96%,Now I want you to think and stop being a smart aleck. A man'...,No win (4 of 5)
496.,2017-07-07 12:04:07,21.86,96%,"Balderdash! Why, I once watched ""Gentleman"" Jim Corbett figh...",Win (1 of 3)
495.,2017-07-07 12:01:46,26.85,97%,"Grits and fried chicken won't disappear, but perhaps future ...",Win (1 of 3)
494.,2017-07-06 23:32:24,24.24,97%,"I'm so in love with you. And I hope you know, darling, your ...",No win (3 of 4)
493.,2017-07-06 23:27:07,27.29,96%,And when he rode past I seen he was carryin' fire in a horn ...,Win (1 of 3)
492.,2017-07-06 23:25:28,25.94,98%,The streets were cleared by a Critical Mass bike ride and we...,No win (4 of 4)
491.,2017-07-06 23:06:58,26.20,97%,"The National Rifle Association says that, ""Guns don't kill p...",No win (2 of 3)
490.,2017-07-06 23:04:23,27.13,99%,No! Fool that I am! I should have remembered! Those slippers...,No win (4 of 5)
489.,2017-07-05 23:51:54,29.16,97%,"Many people limit themselves to leading boring, dull lives b...",Win (1 of 3)
488.,2017-07-05 23:50:38,25.64,96%,Peter Bailey was not a businessman. That's what killed him. ...,No win (2 of 3)
487.,2017-07-05 23:48:33,25.95,95%,I'm the most terrific liar you ever saw in your life. It's a...,Win (1 of 3)
486.,2017-07-05 23:42:32,21.78,94%,"Of course. Some circus owners are colossally rich, with hous...",No win (3 of 5)
485.,2017-07-05 23:40:55,24.44,95%,Although his voice was also broken by uncertainty and his ha...,No win (5 of 5)
484.,2017-07-05 23:39:01,23.37,96%,You have needs - satisfy them. You have as much right as the...,No win (4 of 5)
483.,2017-07-05 23:37:21,24.56,96%,You say: I am not free. But I have raised and lowered my arm...,No win (4 of 5)
482.,2017-07-05 23:35:49,32.35,99%,"It was love at first sight, at last sight, at ever and ever ...",No win (2 of 3)
481.,2017-07-05 23:34:33,24.81,96%,"His palms are sweaty, knees weak, arms are heavy. There's vo...",No win (3 of 4)
480.,2017-07-05 23:31:47,25.29,96%,Sparkling wines are wines that contain carbon dioxide bubble...,No win (5 of 5)
479.,2017-07-05 23:30:09,24.55,96%,I can't believe the things I see. The path that I have chose...,No win (4 of 5)
478.,2017-07-05 23:28:33,26.81,97%,What incensed him the most was the blatant jokes of the ones...,No win (3 of 5)
477.,2017-07-05 21:16:19,25.96,96%,"To protect you both from the Emperor, you were hidden from y...",No win (3 of 4)
476.,2017-07-05 20:48:38,23.79,93%,What? A swallow carrying a coconut? It's not a question of w...,No win (2 of 4)
475.,2017-07-05 20:45:37,25.23,94%,"Kid, I've flown from one side of this galaxy to the other, a...",No win (2 of 3)
474.,2017-07-05 20:43:11,26.30,96%,"Trudging slowly over wet sand, back to the bench where your ...",No win (3 of 3)
473.,2017-07-05 20:41:27,30.22,96%,"The streets looked small, of course. The streets that we hav...",No win (4 of 5)
472.,2017-07-05 20:39:49,27.17,96%,It is tragic and sad and chaotic and lovely. All life is the...,No win (3 of 3)
471.,2017-07-05 20:38:11,29.03,97%,"But I believe in true love, you know? I don't believe that e...",No win (4 of 5)
470.,2017-07-05 20:36:15,25.73,96%,"Keep off the path, beware of the gate, watch out for signs t...",No win (5 of 5)
469.,2017-07-05 20:34:14,31.00,98%,Focus your attention on the Now and tell me what problem you...,No win (3 of 3)
468.,2017-07-05 20:32:33,26.94,96%,"I am endeavoring, Madam, to construct a mnemonic memory circ...",Win (1 of 2)
467.,2017-07-05 20:31:22,29.81,97%,All the girls in the world were divided into two classes: on...,No win (4 of 5)
466.,2017-07-05 20:30:02,23.14,94%,"Hello, hello, hello. With the lights out, it's less dangerou...",No win (4 of 5)
465.,2017-07-05 20:27:58,25.59,96%,"Other keyboard layouts have been created since, but the orig...",No win (4 of 5)
464.,2017-07-05 19:50:35,23.94,95%,Space is big. Really big. You just won't believe how vastly ...,Win (1 of 3)
463.,2017-07-05 19:48:36,24.21,97%,Sholes split up the most common pairings of letters in the E...,No win (2 of 5)
462.,2017-07-05 18:48:05,30.00,98%,"Yes, it was her he was looking at, and there was meaning in ...",No win (3 of 4)
461.,2017-07-05 18:46:31,22.43,95%,"I am but mad north-north-west. When the wind is southerly, I...",No win (3 of 3)
460.,2017-07-05 18:44:53,22.46,94%,"With no map to navigate one's life, some of us have stood st...",No win (3 of 4)
459.,2017-07-05 18:42:53,30.64,99%,"Right now there are three people in chat, but there's no way...",No win (4 of 4)
458.,2017-07-05 01:04:00,25.11,94%,"Under such circumstances I naturally gravitated to London, t...",No win (4 of 5)
457.,2017-07-05 01:02:19,28.57,95%,"Now, sir, we'll talk if you like. I'll tell you right out, I...",Win (1 of 3)
456.,2017-07-05 01:01:02,26.68,93%,"I bet you never thought about it, but the Internet and dream...",No win (4 of 5)
455.,2017-07-05 00:59:38,31.76,98%,"You know when I was your age, I went out to fishing with all...",Win (1 of 3)
454.,2017-07-05 00:58:13,28.27,97%,"After removal from the oven, the pizza is sliced and plated ...",Win (1 of 4)
453.,2017-07-05 00:56:55,23.81,96%,"I must be cruel only to be kind; thus bad begins, and worse ...",No win (3 of 3)
452.,2017-07-05 00:55:49,29.73,97%,"But the life of man is ever racing to its end, swifter than ...",No win (2 of 3)
451.,2017-07-05 00:54:31,27.27,96%,"And in the world a heart of darkness, a firezone, where poet...",No win (5 of 5)
450.,2017-07-05 00:52:12,23.41,95%,"At 211 degrees, water is hot. At 212 degrees, it boils. And ...",No win (4 of 5)
449.,2017-07-05 00:50:18,27.67,96%,What have I got to do to make you love me? What have I got t...,No win (4 of 5)
448.,2017-07-05 00:48:49,27.79,96%,"Once there were two moons in the sky, but one wandered too c...",No win (4 of 5)
447.,2017-07-05 00:45:02,24.94,97%,"Allow me first to apologize for this interruption. I do, lik...",No win (4 of 5)
446.,2017-07-05 00:42:48,31.19,99%,"Comfortable, Mullet? It seems sadly ironic that it's that ti...",No win (2 of 3)
445.,2017-07-05 00:41:06,29.46,99%,"But the life of man is ever racing to its end, swifter than ...",No win (3 of 3)
444.,2017-07-02 20:59:04,22.90,95%,"Well, it just so happens, this hacienda comes with its very ...",No win (3 of 4)
443.,2017-07-02 20:26:38,24.79,95%,"During the battle, Rebel spies managed to steal secret plans...",No win (4 of 5)
442.,2017-07-02 20:24:09,27.06,95%,I can't remember if I cried when I read about his widowed br...,No win (2 of 4)
441.,2017-07-02 20:19:54,30.33,97%,"I know not all that may be coming, but be it what it will, I...",Win (1 of 2)
440.,2017-07-02 20:17:54,26.48,95%,"Warmer water increases the moisture content of storms, and w...",Win (1 of 3)
439.,2017-07-02 20:08:55,25.34,96%,Well this seems to be a waste of my time. That is nine hundr...,No win (2 of 3)
438.,2017-07-02 20:06:12,26.72,97%,"Near, far, wherever you are, I believe that the heart does g...",No win (3 of 3)
437.,2017-07-01 23:37:02,27.54,96%,"There is no physical separation after the slicing, so that e...",Win (1 of 3)
436.,2017-07-01 23:35:16,25.05,97%,"""Happy Days"" is my favorite theme song. I can sure kick your...",No win (3 of 4)
435.,2017-07-01 23:28:49,25.49,96%,The most precious treasures we have in life are the images w...,Win (1 of 3)
434.,2017-07-01 23:26:11,25.65,97%,Don't worry. That suit represents the latest advances in pol...,Win (1 of 2)
433.,2017-07-01 23:24:06,21.74,95%,Her hair reminds me of a warm safe place where as a child I'...,Win (1 of 3)
