64.,2013-08-26 17:02:32,102.92,90%,The development of a living body of literature became indica...,Win (1 of 3)
63.,2013-08-26 17:01:32,134.94,93%,"If you really want to hear about it, the first thing you'll ...",No win (2 of 5)
62.,2013-08-26 17:00:49,107.62,89%,Ideology: the process of making ideas. The work was generall...,Win (1 of 2)
61.,2013-08-26 16:59:45,113.51,87%,Lucid but wholly false recollections can easily be induced b...,No win (2 of 4)
60.,2013-08-26 16:59:03,148.98,96%,"But no matter how effective the lesson was, I never really u...",Win (1 of 3)
59.,2013-08-26 16:58:32,122.71,93%,"Combat for a naval aviator is fought in short, violent burst...",Win (1 of 5)
58.,2013-08-26 16:57:51,123.07,90%,"With no map to navigate one's life, some of us have stood st...",Win (1 of 2)
57.,2013-08-26 16:57:02,100.09,89%,The wine list looks so imposing that you finally give up lab...,Win (1 of 4)
56.,2013-08-26 16:56:05,116.21,88%,"I was hugely impressed. Kirk, I mean Shatner, was the ultima...",No win (2 of 2)
55.,2013-08-26 16:55:25,113.26,81%,If I'm curt with you it's because time is a factor. I think ...,No win (2 of 3)
54.,2013-08-26 16:54:53,120.67,91%,"You ask Raymond what he does for a living and he says, ""I br...",No win (2 of 5)
53.,2013-08-26 16:54:00,107.00,85%,The chemistry of an element is determined by the manner in w...,No win (2 of 2)
52.,2013-08-26 16:53:15,119.28,91%,Imagine for a moment if we once again knew these few unremar...,No win (2 of 5)
51.,2013-08-26 16:52:08,134.81,95%,"I had a dream. There was our world, and the world was dark b...",Win (1 of 3)
50.,2013-08-26 16:51:00,124.14,96%,I'm telling it like it is. Get used to it or put this book d...,Win (1 of 4)
49.,2013-08-26 16:32:19,117.72,94%,Jay made up for the lack of glamour in his assignment by hav...,Win (1 of 5)
48.,2013-08-26 16:31:17,112.72,90%,"I know that the idea of raising well-rounded, smarter kids c...",No win (2 of 5)
47.,2013-08-26 16:30:16,103.21,85%,"You just couldn't let me go, could you? This is what happens...",Win (1 of 3)
46.,2013-08-26 16:29:16,125.29,98%,"To some, the rules of etiquette may seem outdated, stuffy an...",Win (1 of 2)
45.,2013-08-26 16:28:28,121.20,92%,One essential rule: make sure the joke is the last possible ...,Win (1 of 3)
44.,2013-08-26 16:27:47,117.39,90%,To drive out of the Central Valley of California on a hot da...,Win (1 of 5)
43.,2013-08-26 16:25:49,120.34,92%,"They knew they were privileged to have these choices, but th...",Win (1 of 3)
42.,2013-08-26 16:24:50,124.99,92%,"Today, computers have taken this ancient art out of the craf...",Win (1 of 3)
41.,2013-08-26 16:24:02,117.95,92%,In order to become an elf I filled out ten pages' worth of f...,No win (2 of 3)
40.,2013-08-26 16:23:14,142.84,96%,"The time I waited seemed endless, and I felt doubts and fear...",Win (1 of 3)
39.,2013-08-26 16:22:38,118.57,91%,"I was shaking like a leaf, so without thinking I lit up a ci...",Win (1 of 2)
38.,2013-08-26 16:21:42,121.38,87%,"Ultimately, this is not about solving your problems. It's ab...",No win (3 of 5)
37.,2013-08-26 16:21:03,117.71,89%,All the blue light reflections that color my mind when I sle...,Win (1 of 3)
36.,2013-08-26 16:20:23,119.78,93%,"I'm so glad you came, I'm so glad you remembered, to see how...",No win (2 of 4)
35.,2013-08-26 16:19:50,110.94,94%,"It was an effect of light: quick sunlight dappling, yellow l...",No win (2 of 3)
34.,2013-08-26 16:18:52,134.05,98%,"I often see racers, particularly at the back of the pack in ...",No win (1 of 1)
33.,2013-08-26 16:17:48,103.90,91%,"You ask Raymond what he does for a living and he says, ""I br...",No win (3 of 3)
32.,2013-08-26 16:16:50,113.61,97%,"Tis but thy name that is my enemy. Thou art thyself, though ...",Win (1 of 3)
31.,2013-08-26 16:16:06,118.64,98%,"Anyway, like I was saying, shrimp is the fruit of the sea. Y...",Win (1 of 2)
30.,2013-08-26 16:15:22,106.99,91%,Most popular song lyrics have two sections - a verse and a b...,Win (1 of 5)
29.,2013-08-21 17:04:29,123.92,95%,I can already hear your tune calling me across the room. Whe...,Win (1 of 5)
28.,2013-08-21 17:03:36,111.65,92%,"The goal of the true seeker is to become a sage, or superior...",Win (1 of 3)
27.,2013-08-21 17:02:34,128.01,98%,"In general, many of these targets are easier marks if you ar...",Win (1 of 4)
26.,2013-08-21 17:01:46,97.56,94%,"Anyway, like I was saying, shrimp is the fruit of the sea. Y...",Win (1 of 3)
25.,2013-08-21 17:01:10,99.99,91%,"Whenever you watch the mind, you withdraw consciousness from...",Win (1 of 5)
24.,2013-08-21 16:59:30,101.23,93%,The invention of the wheel represented a major turning point...,Win (1 of 3)
23.,2013-08-21 16:58:38,111.86,92%,He canceled all his commitments and pulled together the most...,Win (1 of 3)
22.,2013-08-21 16:49:50,115.86,90%,"Ultimately, this is not about solving your problems. It's ab...",No win (2 of 2)
21.,2013-08-21 16:49:10,86.67,81%,The streets were cleared by a Critical Mass bike ride and we...,Win (1 of 3)
20.,2013-08-21 16:48:15,95.14,87%,"Yes, the newspapers were right: snow was general all over Ir...",No win (2 of 4)
19.,2013-08-21 16:47:29,108.54,94%,Three changes occur while the stacked disk structure equilib...,Win (1 of 3)
18.,2013-08-21 16:46:26,119.09,94%,Your faith was strong but you needed proof. You saw her bath...,Win (1 of 5)
17.,2013-08-21 16:45:40,129.57,97%,"Comfortable, Mullet? It seems sadly ironic that it's that ti...",Win (1 of 4)
16.,2013-08-21 16:45:11,102.54,87%,"In 1966, Andy Dufresne escaped from Shawshank prison. All th...",Win (1 of 3)
15.,2013-08-21 16:44:22,121.96,94%,I don't believe in painted roses or bleeding hearts while bu...,No win (2 of 5)
14.,2013-08-21 16:43:47,110.52,93%,"It was an effect of light: quick sunlight dappling, yellow l...",No win (2 of 4)
13.,2013-08-21 16:42:43,107.78,92%,Overhead the albatross hangs motionless upon the air and dee...,No win (2 of 5)
12.,2013-08-21 16:42:07,112.07,93%,The pickpockets' profession demands extraordinary nimbleness...,Win (1 of 5)
11.,2013-08-21 16:41:32,110.07,90%,And I don't believe in the existence of angels but looking a...,No win (2 of 5)
10.,2013-08-21 16:40:42,103.15,83%,The place to improve the world is first in one's own heart a...,No win (3 of 4)
9.,2013-08-21 05:09:55,109.95,88%,If you're working out in front of a mirror and watching your...,No win (2 of 2)
8.,2013-08-21 05:08:30,99.49,91%,"A zealot might be, for instance, an individual with a person...",No win (2 of 3)
7.,2013-08-21 05:07:19,116.63,95%,"When the light of life has gone, no change for the meter. Th...",Win (1 of 5)
6.,2013-08-21 05:06:28,122.25,96%,We've known each other for many years but this is the first ...,Win (1 of 3)
5.,2013-08-21 04:49:12,117.59,96%,Be impeccable with your word - speak with integrity. Say onl...,No win (2 of 3)
4.,2013-08-21 04:48:06,103.63,90%,Danger is a topic you're often asked about as a sprinter. Th...,No win (2 of 3)
3.,2013-08-21 04:46:37,123.13,94%,Now I want you to think and stop being a smart aleck. A man'...,No win (2 of 3)
2.,2013-08-21 04:45:43,104.31,88%,"Today, computers have taken this ancient art out of the craf...",No win (2 of 3)
1.,2013-08-21 04:44:07,114.53,92%,"A little boy went out to play. When he opened his door, he s...",No win (2 of 3)
