19.,2009-12-01 14:57:24,115.90,100%,"The melted mozzarella layer, which we shall designate MML, i...",No win (2 of 4)
18.,2009-12-01 13:21:56,93.20,100%,"Get it straight buster - I'm not here to say please, I'm her...",Win (1 of 5)
17.,2009-12-01 13:21:08,96.68,100%,I don't know why he saved my life. Maybe in those last momen...,No win (2 of 5)
16.,2009-12-01 13:20:10,82.45,100%,"My dog barks some. Mentally you picture my dog, but I have n...",No win (2 of 5)
15.,2009-12-01 13:19:26,90.21,100%,"Ezekiel twenty-five, seventeen: The path of the righteous ma...",No win (2 of 4)
14.,2009-12-01 13:18:21,105.14,100%,"The National Rifle Association says that, ""Guns don't kill p...",Win (1 of 4)
13.,2009-12-01 13:17:23,103.46,100%,Is this the real life? Is this just fantasy? Caught in a lan...,Win (1 of 5)
12.,2009-12-01 13:16:40,91.07,100%,"Under the headline ""Wonderful Typing,"" the New York Times re...",Win (1 of 3)
11.,2009-12-01 13:15:43,99.19,100%,"Now you might ask yourself, if by yourself you mean me, ""Ste...",Win (1 of 3)
10.,2009-11-24 23:54:44,114.93,100%,Since every piece of matter in the Universe is in some way a...,Win (1 of 2)
9.,2009-11-24 23:53:42,103.38,100%,"It is a period of civil war. Rebel spaceships, striking from...",No win (2 of 3)
8.,2009-11-24 23:52:39,94.67,100%,"Radiation could be precisely determined, in principle, if we...",No win (1 of 1)
7.,2009-11-24 23:51:28,93.81,100%,"Ticking away the moments that make up a dull day, you fritte...",Win (1 of 3)
6.,2009-11-24 11:28:21,107.58,100%,In order to face down the danger that is stalking us and mov...,Win (1 of 3)
5.,2009-11-24 11:27:20,112.84,100%,I'm telling it like it is. Get used to it or put this book d...,Win (1 of 3)
4.,2009-11-24 11:26:09,104.73,100%,"I went to the woods because I wished to live deliberately, t...",Win (1 of 3)
3.,2009-11-24 11:25:30,90.31,100%,"The Orient was almost a European invention, and had been sin...",No win (3 of 3)
2.,2009-11-24 11:24:26,102.74,100%,"I'd been walking for hours and, as usual, I'd lost track of ...",No win (2 of 2)
1.,2009-11-24 11:23:22,108.82,100%,"The Earth is a world, the world is a ball, a ball in a game ...",Win (1 of 4)
