245.,2011-05-16 01:59:47,116.19,94%,The chemistry of an element is determined by the manner in w...,Win (1 of 3)
244.,2011-05-16 01:59:12,129.20,96%,A giant inverted steel pyramid is perfectly balanced on its ...,Win (1 of 3)
243.,2011-05-15 22:02:13,132.20,96%,Data is by definition easy to copy. And the Internet makes c...,Win (1 of 3)
242.,2011-05-15 22:01:12,135.12,96%,Since every piece of matter in the Universe is in some way a...,Win (1 of 3)
241.,2011-05-15 22:00:34,119.45,96%,"Yes, the newspapers were right: snow was general all over Ir...",Win (1 of 3)
240.,2011-05-15 18:14:20,132.75,95%,A giant inverted steel pyramid is perfectly balanced on its ...,Win (1 of 2)
239.,2011-05-15 18:09:43,135.48,95%,I thought climbing the Devil's Thumb would fix all that was ...,Win (1 of 4)
238.,2011-05-15 18:09:10,116.11,92%,There are still some places where you can get all you can ea...,Win (1 of 5)
237.,2011-05-15 18:06:02,137.93,94%,"No matter how bad things are, you can always make things wor...",Win (1 of 2)
236.,2011-05-15 18:03:03,144.52,96%,"But, pray how could that which I spoke so many years ago, an...",Win (1 of 2)
235.,2011-05-15 18:02:24,131.82,96%,You've got a way to keep me on your side. You give me cause ...,No win (2 of 3)
234.,2011-05-15 18:01:16,120.66,96%,"O clear intelligence, force beyond all measure! Gentlemen, I...",Win (1 of 3)
233.,2011-05-15 18:00:03,125.60,94%,Space is big. Really big. You just won't believe how vastly ...,Win (1 of 3)
232.,2011-05-15 15:50:05,121.24,93%,I am learning about twenty new Italian words a day. Where am...,Win (1 of 2)
231.,2011-05-15 15:33:40,126.33,95%,We've known each other for many years but this is the first ...,Win (1 of 2)
230.,2011-05-15 04:10:21,125.83,98%,"When I really worry about something, I don't just fool aroun...",No win (2 of 4)
229.,2011-05-15 04:09:06,115.50,92%,The beginner writes just twenty pieces. The professional wri...,No win (1 of 1)
228.,2011-05-15 04:06:37,121.37,97%,Everything we hold dear likewise resolves into its original ...,No win (2 of 3)
227.,2011-05-15 03:19:39,142.50,98%,San Francisco in the middle sixties was a very special time ...,Win (1 of 3)
226.,2011-05-15 03:17:03,131.76,95%,"No matter how bad things are, you can always make things wor...",Win (1 of 3)
225.,2011-05-15 01:50:28,132.55,97%,To an outsider's ear it sounds absurdly wild and ridiculous ...,Win (1 of 3)
224.,2011-05-15 01:42:20,116.58,92%,If I'm curt with you it's because time is a factor. I think ...,No win (2 of 3)
223.,2011-05-15 01:41:05,122.37,94%,It's the possibility of having a dream come true that makes ...,No win (2 of 3)
222.,2011-05-15 01:37:14,131.10,97%,"She's got a smile that, it seems to me, reminds me of childh...",Win (1 of 4)
221.,2011-05-15 01:32:45,141.30,98%,Being able to quit things that don't work is integral to bei...,Win (1 of 3)
220.,2011-05-15 01:23:42,121.96,94%,What should have been swift revenge turned into an all out w...,Win (1 of 3)
219.,2011-05-15 01:22:58,122.93,95%,He canceled all his commitments and pulled together the most...,Win (1 of 3)
218.,2011-05-14 23:03:26,155.15,100%,It is possible that I already had some presentiment of my fu...,Win (1 of 3)
217.,2011-05-14 22:59:44,116.50,93%,"If you are given too many choices, if you are forced to cons...",Win (1 of 3)
216.,2011-05-14 22:53:26,125.96,95%,"The only people for me are the mad ones, the ones who are ma...",Win (1 of 3)
215.,2011-05-14 22:47:07,134.86,95%,If there is one thing the history of evolution has taught us...,Win (1 of 3)
214.,2011-05-14 16:13:07,134.34,95%,Groups of illegal miners smuggle themselves down in freight ...,No win (2 of 3)
213.,2011-05-14 16:11:52,130.96,95%,All time is all time. It does not change. It does not lend i...,Win (1 of 4)
212.,2011-05-14 16:10:48,126.86,93%,There is something about yourself that you don't know. Somet...,Win (1 of 4)
211.,2011-05-14 16:09:16,133.37,98%,The pathology of setting a deadline to the earliest articula...,Win (1 of 3)
210.,2011-05-14 16:07:32,132.82,96%,We all know people who are very bright but who do not always...,Win (1 of 3)
209.,2011-05-14 16:03:17,125.37,94%,So what's in this for you? Should you rush out in search of ...,Win (1 of 3)
208.,2011-05-13 20:26:22,125.40,97%,Involuntarily I glanced seaward - and distinguished nothing ...,No win (2 of 3)
207.,2011-05-13 20:23:02,131.76,96%,I said that I would see you because I had heard that you wer...,Win (1 of 3)
206.,2011-05-13 20:21:11,139.79,96%,She's got eyes of the bluest skies as if they thought of rai...,Win (1 of 5)
205.,2011-05-13 20:19:02,142.22,99%,The example of painting can teach us not only how to manage ...,Win (1 of 3)
204.,2011-05-13 20:16:39,122.99,97%,Being able to quit things that don't work is integral to bei...,Win (1 of 3)
203.,2011-05-13 20:11:34,141.70,98%,Being able to quit things that don't work is integral to bei...,Win (1 of 4)
202.,2011-05-13 20:10:55,131.90,96%,All time is all time. It does not change. It does not lend i...,Win (1 of 3)
201.,2011-05-12 23:31:23,126.79,95%,The only preventive thing I do is wash clothes after buying ...,Win (1 of 2)
200.,2011-05-12 23:18:26,130.31,95%,All the blue light reflections that color my mind when I sle...,Win (1 of 3)
199.,2011-05-12 23:14:59,141.79,98%,"People get ready, there's a train coming. You don't need no ...",Win (1 of 4)
198.,2011-05-12 23:14:30,124.56,93%,Although the United Nations does not have the power to enfor...,Win (1 of 4)
197.,2011-05-12 23:13:49,121.08,93%,But the two men were not lonely at all. At home they were co...,Win (1 of 3)
196.,2011-05-12 23:12:32,123.17,92%,So what's in this for you? Should you rush out in search of ...,Win (1 of 3)
195.,2011-05-12 21:55:02,127.98,96%,"Ergonomics is a term that combines the Greek word ergon, mea...",Win (1 of 3)
194.,2011-05-12 21:52:25,120.18,95%,Do you know what they call a Quarter-pounder with cheese in ...,Win (1 of 4)
193.,2011-05-12 21:51:58,142.85,97%,I have quit three jobs and been fired from all the rest. Get...,Win (1 of 3)
192.,2011-05-12 21:51:08,128.25,94%,There's a piece of Maria in every song that I sing. And the ...,No win (2 of 4)
191.,2011-05-12 21:48:14,125.49,96%,Who has a safety deposit box full of money and six passports...,Win (1 of 2)
190.,2011-05-12 21:47:38,116.58,90%,Let me tell you why you're here. You're here because you kno...,Win (1 of 3)
189.,2011-05-12 21:46:39,139.59,96%,"Well, the way they make shows is, they make one show. That s...",Win (1 of 2)
188.,2011-05-12 21:45:23,119.42,95%,"And today, Lady Liberty is under attack from the cable chann...",Win (1 of 3)
187.,2011-05-12 21:39:46,126.59,94%,"Combat for a naval aviator is fought in short, violent burst...",Win (1 of 5)
186.,2011-05-12 21:35:58,125.80,94%,"If you don't get what you want, you suffer; if you get what ...",Win (1 of 3)
185.,2011-05-12 21:34:54,138.30,96%,"When the light of life has gone, no change for the meter. Th...",Win (1 of 3)
184.,2011-05-11 21:55:28,129.38,95%,I remember when we used to sit in the government yard in Tre...,Win (1 of 3)
183.,2011-05-10 12:08:58,123.56,93%,"Combat for a naval aviator is fought in short, violent burst...",Win (1 of 2)
182.,2011-05-10 12:07:19,125.34,94%,It is possible that I already had some presentiment of my fu...,Win (1 of 2)
181.,2011-05-10 12:04:20,130.75,96%,I have quit three jobs and been fired from all the rest. Get...,No win (2 of 3)
180.,2011-05-10 12:01:10,140.74,95%,Humans need to practice what they are learning a good deal b...,Win (1 of 3)
179.,2011-05-10 11:59:19,137.99,96%,"Time is tricky. You have whole months, even years, when noth...",Win (1 of 2)
178.,2011-05-10 11:52:54,116.32,96%,Even the best-designed chair won't make up for bad posture. ...,No win (2 of 2)
177.,2011-05-10 03:56:06,121.05,95%,"Get it straight buster - I'm not here to say please, I'm her...",Win (1 of 3)
176.,2011-05-10 03:52:19,123.22,97%,Supermarket aisles are the perfect place to practice your gl...,No win (2 of 3)
175.,2011-05-10 03:51:23,120.48,95%,There is a theory which states that if anybody ever discover...,Win (1 of 4)
174.,2011-05-10 03:38:57,121.81,93%,Humans need to practice what they are learning a good deal b...,No win (2 of 2)
173.,2011-05-10 03:38:21,124.52,96%,"Well, it just so happens, this hacienda comes with its very ...",No win (2 of 2)
172.,2011-05-10 03:35:46,125.77,99%,"A little boy went out to play. When he opened his door, he s...",Win (1 of 4)
171.,2011-05-10 03:34:13,127.74,94%,The most precious treasures we have in life are the images w...,Win (1 of 2)
170.,2011-05-10 03:31:29,127.63,96%,There's a hole in the world like a great black pit. And the ...,Win (1 of 2)
169.,2011-05-10 03:27:46,129.91,96%,She's got eyes of the bluest skies as if they thought of rai...,No win (2 of 5)
168.,2011-05-10 03:25:15,117.18,97%,"I did my best, it wasn't much. I couldn't feel, so I tried t...",Win (1 of 2)
167.,2011-05-10 03:19:50,122.52,98%,"My dog barks some. Mentally you picture my dog, but I have n...",No win (2 of 2)
166.,2011-05-10 03:17:35,120.97,94%,I said that I would see you because I had heard that you wer...,Win (1 of 3)
165.,2011-05-10 03:14:38,120.26,96%,Is it sweeter to exist only in the mind or to exist both in ...,Win (1 of 3)
164.,2011-05-10 03:13:49,133.23,97%,We all know people who are very bright but who do not always...,Win (1 of 3)
163.,2011-05-09 16:13:05,116.15,93%,"I was hugely impressed. Kirk, I mean Shatner, was the ultima...",Win (1 of 3)
162.,2011-05-09 03:13:11,117.25,93%,"I've heard there was a secret chord that David played, and i...",Win (1 of 2)
161.,2011-05-09 03:10:16,138.82,99%,I remember when we used to sit in the government yard in Tre...,Win (1 of 4)
160.,2011-05-09 03:03:37,127.08,96%,To an outsider's ear it sounds absurdly wild and ridiculous ...,Win (1 of 3)
159.,2011-05-08 19:44:49,119.22,96%,"After the grapes are crushed, yeasts (tiny one-celled organi...",No win (2 of 3)
158.,2011-05-08 19:44:12,122.42,94%,"I hope that whoever you are, you escape this place. I hope t...",No win (2 of 3)
157.,2011-05-08 19:40:25,126.27,96%,Space is big. Really big. You just won't believe how vastly ...,No win (2 of 3)
156.,2011-05-08 06:41:00,123.85,94%,She's got eyes of the bluest skies as if they thought of rai...,Win (1 of 3)
155.,2011-05-08 06:40:17,128.24,96%,I've seen things you people wouldn't believe. Attack ships o...,Win (1 of 2)
154.,2011-05-08 06:31:48,126.01,96%,The most precious treasures we have in life are the images w...,Win (1 of 3)
153.,2011-05-08 06:31:09,125.57,96%,"Well, it just so happens, this hacienda comes with its very ...",Win (1 of 3)
152.,2011-05-08 06:28:21,142.51,97%,San Francisco in the middle sixties was a very special time ...,Win (1 of 4)
151.,2011-05-08 06:27:46,124.63,95%,The place to improve the world is first in one's own heart a...,No win (3 of 3)
150.,2011-05-07 03:59:06,125.28,95%,"Throughout my academic career, I'd given some pretty good ta...",Win (1 of 3)
149.,2011-05-07 03:58:16,127.58,95%,"When I was your age, television was called books. And this i...",Win (1 of 3)
148.,2011-05-07 03:57:20,137.97,98%,And I don't believe in the existence of angels but looking a...,Win (1 of 3)
147.,2011-05-07 03:53:08,122.84,95%,"Often, we assume that a familiar situation will be but a rep...",Win (1 of 3)
146.,2011-05-07 03:50:55,123.10,95%,There's a hole in the world like a great black pit. And the ...,Win (1 of 2)
145.,2011-05-07 03:48:42,125.56,95%,"On a manual typewriter, strike the key with a nice sharp str...",Win (1 of 3)
144.,2011-05-07 03:45:42,124.52,93%,"One day you're in a funk about things, telling a friend that...",Win (1 of 3)
143.,2011-05-07 03:44:32,130.74,97%,"Often, we assume that a familiar situation will be but a rep...",Win (1 of 3)
142.,2011-05-07 03:43:46,136.58,96%,There is something about yourself that you don't know. Somet...,Win (1 of 5)
141.,2011-05-07 03:40:58,122.01,96%,"A computer needs a manager to administer its operations, jus...",No win (2 of 4)
140.,2011-05-07 03:37:40,125.03,93%,All time is all time. It does not change. It does not lend i...,Win (1 of 2)
139.,2011-05-07 01:59:20,116.40,94%,"Double, double, toil and trouble; fire burn, and cauldron bu...",Win (1 of 2)
138.,2011-05-07 01:57:32,123.85,96%,Stab a sorry heart with your favorite finger. Paint the whol...,Win (1 of 3)
137.,2011-05-07 01:49:25,119.82,95%,Data is by definition easy to copy. And the Internet makes c...,Win (1 of 2)
136.,2011-05-07 01:47:42,127.52,95%,What should have been swift revenge turned into an all out w...,Win (1 of 3)
135.,2011-05-07 01:43:32,132.99,97%,Let's face it: there are tons of things in your home and lif...,Win (1 of 3)
134.,2011-05-07 01:39:34,122.94,96%,"Double, double, toil and trouble; fire burn, and cauldron bu...",Win (1 of 4)
133.,2011-05-07 01:37:50,122.89,97%,"A little boy went out to play. When he opened his door, he s...",No win (2 of 3)
132.,2011-05-07 01:37:05,137.91,100%,"Ever since I was a child, folks have thought they had me peg...",Win (1 of 3)
131.,2011-05-07 01:35:39,121.05,95%,Every time I think of you I feel shot right through with a b...,No win (2 of 3)
130.,2011-05-07 01:34:52,118.10,93%,"Well, the way they make shows is, they make one show. That s...",Win (1 of 3)
129.,2011-05-07 01:32:07,114.79,92%,Lucid but wholly false recollections can easily be induced b...,Win (1 of 4)
128.,2011-05-07 01:28:12,132.39,98%,"A little boy went out to play. When he opened his door, he s...",Win (1 of 3)
127.,2011-05-07 01:27:40,121.00,92%,There is a theory which states that if anybody ever discover...,Win (1 of 3)
126.,2011-05-06 23:29:18,131.35,97%,"It was a marvelous night, the sort of night one only experie...",Win (1 of 5)
125.,2011-05-06 23:28:46,129.28,96%,"But no matter how effective the lesson was, I never really u...",Win (1 of 4)
124.,2011-05-06 23:20:32,117.25,94%,"Common knowledge has bicyclists always riding into the wind,...",Win (1 of 2)
123.,2011-05-06 23:17:43,121.46,95%,Rhymes trap you into saying things you don't want to say. A ...,No win (2 of 3)
122.,2011-05-06 23:16:48,125.68,96%,It is possible that I already had some presentiment of my fu...,Win (1 of 4)
121.,2011-05-06 23:04:25,147.17,96%,Humans need to practice what they are learning a good deal b...,Win (1 of 3)
120.,2011-05-06 22:58:03,123.95,91%,"One day you're in a funk about things, telling a friend that...",Win (1 of 3)
119.,2011-05-06 22:57:06,126.42,96%,Who has a safety deposit box full of money and six passports...,Win (1 of 3)
118.,2011-05-06 22:56:02,125.48,96%,Yet the web of thought has no such creases and is more like ...,Win (1 of 2)
117.,2011-05-06 22:48:40,129.37,97%,Mac knew the score even if Aunt Ella didn't. Shot through th...,Win (1 of 2)
116.,2011-05-06 22:40:47,121.52,95%,Every time I think of you I feel shot right through with a b...,Win (1 of 3)
115.,2011-05-06 22:33:48,123.10,93%,"After removal from the oven, the pizza is sliced and plated ...",No win (1 of 1)
114.,2011-05-06 22:31:39,143.26,97%,I said that I would see you because I had heard that you wer...,Win (1 of 3)
113.,2011-05-06 22:29:37,126.34,95%,"And in the world a heart of darkness, a firezone, where poet...",Win (1 of 4)
112.,2011-05-06 22:27:54,119.12,93%,"It is a period of civil war. Rebel spaceships, striking from...",Win (1 of 3)
111.,2011-05-06 22:26:06,138.39,95%,Now I want you to think and stop being a smart aleck. A man'...,Win (1 of 2)
110.,2011-05-06 22:23:41,142.08,99%,"As if that blind rage had washed me clean, rid me of hope; f...",Win (1 of 3)
109.,2011-05-06 22:23:01,118.12,92%,"I had a job, I had a girl. I had something going, mister, in...",No win (2 of 3)
108.,2011-05-06 22:21:44,113.97,92%,"It is a period of civil war. Rebel spaceships, striking from...",Win (1 of 2)
107.,2011-05-06 22:17:20,109.27,93%,"That's Tommy. He tells people he was named after a gun, but ...",No win (2 of 3)
106.,2011-05-05 10:13:31,116.72,92%,The example of painting can teach us not only how to manage ...,Win (1 of 3)
105.,2011-05-05 03:22:09,137.48,97%,All time is all time. It does not change. It does not lend i...,Win (1 of 3)
104.,2011-05-05 03:17:02,122.68,95%,The unknown future rolls toward us. I face it for the first ...,No win (1 of 1)
103.,2011-05-05 03:14:40,113.92,94%,A giant inverted steel pyramid is perfectly balanced on its ...,No win (1 of 1)
102.,2011-05-05 03:07:14,130.10,98%,Always do your best - your best is going to change from mome...,Win (1 of 3)
101.,2011-05-05 03:06:23,125.28,93%,Although the United Nations does not have the power to enfor...,No win (2 of 2)
100.,2011-05-05 03:01:47,120.79,95%,Your faith was strong but you needed proof. You saw her bath...,Win (1 of 3)
99.,2011-05-05 02:58:12,110.53,92%,"No matter how bad things are, you can always make things wor...",Win (1 of 3)
98.,2011-05-05 02:57:05,115.47,92%,If there is one thing the history of evolution has taught us...,Win (1 of 5)
97.,2011-05-05 02:53:11,126.17,97%,We all know people who are very bright but who do not always...,Win (1 of 4)
96.,2011-05-05 02:52:30,126.46,95%,But the two men were not lonely at all. At home they were co...,Win (1 of 3)
95.,2011-05-05 02:51:43,122.20,95%,Although his voice was also broken by uncertainty and his ha...,Win (1 of 3)
94.,2011-05-05 02:50:33,114.75,94%,"Ever since I was a child, folks have thought they had me peg...",Win (1 of 2)
93.,2011-05-05 02:46:50,123.94,96%,Some have a positive vocation for breaking open safes: from ...,No win (1 of 1)
92.,2011-05-05 00:47:34,135.83,97%,Humans need to practice what they are learning a good deal b...,Win (1 of 3)
91.,2011-05-05 00:46:40,120.27,93%,I suddenly had the impression that I had been left all alone...,Win (1 of 4)
90.,2011-05-05 00:45:38,116.78,95%,"What good's a reward if you ain't around to use it? Besides,...",Win (1 of 3)
89.,2011-05-05 00:42:44,116.27,94%,"Do you smell that? Napalm, son. Nothing else in the world sm...",No win (2 of 3)
88.,2011-05-04 20:59:37,145.64,98%,San Francisco in the middle sixties was a very special time ...,Win (1 of 3)
87.,2011-05-04 14:16:45,122.27,96%,He canceled all his commitments and pulled together the most...,Win (1 of 4)
86.,2011-05-04 11:22:56,123.99,96%,Remembering you running soft through the night. You were big...,Win (1 of 3)
85.,2011-05-04 11:21:22,108.80,93%,"King, eh? Very nice. And how'd you get that, eh? By exploiti...",No win (2 of 5)
84.,2011-05-04 11:19:44,110.96,92%,"Yes, the newspapers were right: snow was general all over Ir...",Win (1 of 2)
83.,2011-05-04 11:12:54,138.27,97%,But the two men were not lonely at all. At home they were co...,Win (1 of 3)
82.,2011-05-04 11:12:12,142.14,99%,I don't believe in painted roses or bleeding hearts while bu...,Win (1 of 5)
81.,2011-05-04 11:08:28,112.40,95%,I remember when we used to sit in the government yard in Tre...,Win (1 of 4)
80.,2011-05-04 04:09:24,112.80,94%,"Thirdly, however, these wars could now be waged with the new...",Win (1 of 3)
79.,2011-05-04 04:06:43,112.86,91%,If I'm curt with you it's because time is a factor. I think ...,Win (1 of 4)
78.,2011-05-04 03:58:54,123.74,97%,What should have been swift revenge turned into an all out w...,Win (1 of 3)
77.,2011-05-04 03:57:32,119.36,92%,"And in the world a heart of darkness, a firezone, where poet...",Win (1 of 2)
76.,2011-05-04 03:56:12,135.38,98%,The great edifice of variety and choice that is an American ...,Win (1 of 2)
75.,2011-05-04 03:54:54,127.69,96%,"People get ready, there's a train coming. You don't need no ...",Win (1 of 3)
74.,2011-05-04 03:54:22,116.32,94%,"But, pray how could that which I spoke so many years ago, an...",Win (1 of 3)
73.,2011-05-04 03:50:35,110.15,94%,With the coming of Dean Moriarty began the part of my life y...,Win (1 of 4)
72.,2011-05-04 03:46:24,130.59,98%,"I was hugely impressed. Kirk, I mean Shatner, was the ultima...",No win (2 of 4)
71.,2011-05-04 03:44:59,120.36,96%,Few smart kids can spare the attention that popularity requi...,Win (1 of 3)
70.,2011-05-04 03:40:28,114.44,93%,Stab a sorry heart with your favorite finger. Paint the whol...,No win (2 of 3)
69.,2011-05-04 02:32:59,114.97,90%,Humans need to practice what they are learning a good deal b...,Win (1 of 3)
68.,2011-05-03 00:15:14,141.63,100%,"Ever since I was a child, folks have thought they had me peg...",Win (1 of 4)
67.,2011-05-03 00:11:46,115.57,96%,Lucid but wholly false recollections can easily be induced b...,Win (1 of 3)
66.,2011-05-03 00:11:05,117.65,94%,"Time is tricky. You have whole months, even years, when noth...",No win (2 of 4)
65.,2011-05-03 00:08:34,119.07,93%,Space is big. Really big. You just won't believe how vastly ...,Win (1 of 2)
64.,2011-05-03 00:07:56,108.05,92%,Chance and chance alone has a message for us. Everything tha...,No win (2 of 4)
63.,2011-05-03 00:00:26,106.35,92%,"Today, computers have taken this ancient art out of the craf...",Win (1 of 5)
62.,2011-05-02 23:57:46,119.88,94%,"Has it been five years? Six? It seems like a lifetime, the k...",Win (1 of 2)
61.,2011-05-02 23:56:53,111.11,96%,"It's a sunny, woodsy day in Lumberton, so get those chainsaw...",Win (1 of 3)
60.,2011-05-02 23:54:49,113.82,94%,Is this the real life? Is this just fantasy? Caught in a lan...,Win (1 of 4)
59.,2011-05-02 23:53:18,114.63,94%,I don't believe in painted roses or bleeding hearts while bu...,No win (2 of 4)
58.,2011-05-02 23:50:38,122.88,98%,"Get it straight buster - I'm not here to say please, I'm her...",Win (1 of 3)
57.,2011-05-02 23:48:10,111.00,93%,The beginner writes just twenty pieces. The professional wri...,Win (1 of 2)
56.,2011-05-02 23:45:48,120.17,98%,Is this the real life? Is this just fantasy? Caught in a lan...,Win (1 of 3)
55.,2011-05-02 23:44:58,117.56,94%,"If you don't get what you want, you suffer; if you get what ...",Win (1 of 3)
54.,2011-05-02 23:44:08,101.94,88%,Since every piece of matter in the Universe is in some way a...,No win (2 of 3)
53.,2011-05-02 23:42:10,111.21,98%,"He's got a two day head start on you, which is more than he ...",Win (1 of 4)
52.,2011-05-02 23:41:25,101.61,92%,"Hey Mr. Tambourine Man, play a song for me, I'm not sleepy a...",Win (1 of 4)
51.,2011-05-02 23:39:50,111.42,91%,"If we all go for the blonde and block each other, not a sing...",Win (1 of 3)
50.,2011-05-02 23:38:55,112.46,92%,Although the United Nations does not have the power to enfor...,No win (2 of 3)
49.,2011-05-02 23:37:59,114.59,94%,"Today, you people are no longer maggots. Today, you are Mari...",Win (1 of 3)
48.,2011-05-02 23:35:35,129.66,96%,"I went to the woods because I wished to live deliberately, t...",Win (1 of 3)
47.,2011-05-02 23:33:47,113.47,93%,Even the best-designed chair won't make up for bad posture. ...,Win (1 of 2)
46.,2011-05-02 23:32:39,111.51,90%,All time is all time. It does not change. It does not lend i...,Win (1 of 2)
45.,2011-05-02 23:31:35,109.37,90%,Remembering you running soft through the night. You were big...,Win (1 of 2)
44.,2011-05-02 23:30:57,109.71,93%,"Whether you're a student, secretary, office administrator, m...",No win (2 of 3)
43.,2011-05-02 13:28:05,110.26,100%,Facts can be thought of as objective or subjective. Things a...,Win (1 of 4)
42.,2011-05-02 13:19:07,131.85,100%,It is possible that I already had some presentiment of my fu...,Win (1 of 4)
41.,2011-05-02 13:16:40,123.99,100%,"Life is not suffering; it's just that you will suffer it, ra...",Win (1 of 3)
40.,2011-05-02 13:15:48,112.93,100%,I've seen things you people wouldn't believe. Attack ships o...,Win (1 of 5)
39.,2011-05-02 13:14:34,117.36,100%,"Thirdly, however, these wars could now be waged with the new...",Win (1 of 3)
38.,2011-05-02 13:13:21,127.97,100%,Step out the front door like a ghost into the fog where no o...,Win (1 of 2)
37.,2011-05-02 13:12:37,104.52,100%,Overhead the albatross hangs motionless upon the air and dee...,No win (2 of 5)
36.,2011-05-02 13:08:46,114.50,100%,Now I want you to think and stop being a smart aleck. A man'...,No win (2 of 5)
35.,2011-05-02 13:05:50,115.08,100%,"But, pray how could that which I spoke so many years ago, an...",No win (2 of 2)
34.,2011-05-02 13:03:15,138.50,100%,She's got eyes of the bluest skies as if they thought of rai...,Win (1 of 4)
33.,2011-05-02 13:00:22,111.86,100%,"Because they're at the bottom of the scale, nerds are a safe...",Win (1 of 5)
32.,2011-05-02 12:59:26,108.34,100%,"Excellent. He's enterprising, aggressive, outgoing, young, b...",Win (1 of 3)
31.,2011-05-02 12:58:38,133.66,100%,Good games offer players a set of challenging problems and t...,Win (1 of 2)
30.,2011-05-02 12:54:53,124.73,100%,I remember when we used to sit in the government yard in Tre...,Win (1 of 4)
29.,2011-05-02 12:53:32,106.01,100%,From compositional considerations the tomato layer would be ...,Win (1 of 3)
28.,2011-05-02 12:52:00,112.89,100%,"It's a blue savanna song: somewhere cross the desert, someti...",No win (2 of 3)
27.,2011-05-01 21:08:01,121.41,100%,"The terminator wouldn't stop, it would never leave him. It w...",Win (1 of 2)
26.,2011-05-01 21:07:11,110.49,100%,One essential rule: make sure the joke is the last possible ...,No win (2 of 2)
25.,2011-05-01 21:06:32,117.54,100%,"After the grapes are crushed, yeasts (tiny one-celled organi...",Win (1 of 2)
24.,2011-05-01 21:05:54,112.59,100%,The truth of the matter is that there are a lot of available...,No win (2 of 3)
23.,2011-05-01 21:04:08,142.92,100%,The alternative to binge travel - the mini retirement - enta...,Win (1 of 4)
22.,2011-05-01 21:03:32,112.60,100%,You've got a way to keep me on your side. You give me cause ...,Win (1 of 2)
21.,2011-05-01 21:02:49,128.21,100%,Unlike the other four senses located in the logical regions ...,Win (1 of 3)
20.,2011-05-01 03:49:27,96.35,100%,"It's a sunny, woodsy day in Lumberton, so get those chainsaw...",No win (2 of 3)
19.,2011-05-01 03:46:33,107.07,100%,We may climb into the thin and cold realm of pure geometry a...,Win (1 of 2)
