18.,2011-05-01 03:45:32,118.23,100%,The example of painting can teach us not only how to manage ...,Win (1 of 3)
17.,2011-05-01 03:40:15,113.28,100%,All the blue light reflections that color my mind when I sle...,No win (2 of 5)
16.,2011-05-01 03:38:43,109.15,100%,It takes more than a calorie of fossil fuel energy to produc...,No win (2 of 2)
15.,2011-05-01 03:37:44,135.36,100%,There's a hole in the world like a great black pit. And the ...,Win (1 of 5)
14.,2011-05-01 03:37:16,132.70,100%,"If you really want to hear about it, the first thing you'll ...",No win (2 of 3)
13.,2011-05-01 03:35:18,101.76,100%,"Often, we assume that a familiar situation will be but a rep...",No win (2 of 3)
12.,2011-05-01 03:34:36,106.84,100%,"The brain can be a tool. It can recall phone numbers, solve ...",No win (2 of 5)
11.,2011-05-01 03:29:56,101.59,100%,"The terminator wouldn't stop, it would never leave him. It w...",Win (1 of 3)
10.,2011-05-01 03:29:00,105.66,100%,But speculations on the structure of the universe also move ...,No win (3 of 3)
9.,2011-05-01 03:27:45,110.76,100%,I never said I would stay to the end - I knew I would leave ...,No win (3 of 5)
8.,2011-05-01 03:26:55,121.00,100%,Now I want you to think and stop being a smart aleck. A man'...,Win (1 of 4)
7.,2011-05-01 03:26:18,121.15,100%,Always do your best - your best is going to change from mome...,Win (1 of 5)
6.,2011-05-01 03:25:47,100.39,100%,It is possible that I already had some presentiment of my fu...,No win (2 of 2)
5.,2011-05-01 03:24:34,110.69,100%,"Around midafternoon, the snow thinned into sleet, and some u...",Win (1 of 2)
4.,2011-05-01 03:23:40,107.62,100%,San Francisco in the middle sixties was a very special time ...,No win (2 of 3)
3.,2011-05-01 03:22:56,112.15,100%,"Because they're at the bottom of the scale, nerds are a safe...",No win (3 of 4)
2.,2011-05-01 03:20:53,108.92,100%,One essential rule: make sure the joke is the last possible ...,No win (3 of 3)
1.,2011-05-01 03:19:58,131.27,100%,"After the grapes are crushed, yeasts (tiny one-celled organi...",Win (1 of 3)
