426.,2012-07-07 15:41:44,120.13,99%,Ideology: the process of making ideas. The work was generall...,Win (1 of 5)
425.,2012-07-07 15:40:52,116.85,96%,The example of painting can teach us not only how to manage ...,No win (2 of 3)
424.,2012-07-07 15:40:14,116.80,97%,He rode past me and kept on goin'. Never said nothin' goin' ...,Win (1 of 2)
423.,2012-07-07 15:39:07,115.41,97%,Step out the front door like a ghost into the fog where no o...,No win (2 of 3)
422.,2012-07-07 15:38:24,109.27,97%,"My dog barks some. Mentally you picture my dog, but I have n...",No win (2 of 3)
421.,2012-07-07 15:34:32,112.46,98%,"Finally, gentlemen, there are people with an hereditary anim...",Win (1 of 3)
420.,2012-07-07 15:33:28,105.11,93%,I remember when we used to sit in the government yard in Tre...,No win (2 of 3)
419.,2012-07-07 15:32:01,104.11,95%,"Finally, gentlemen, there are people with an hereditary anim...",No win (2 of 2)
418.,2012-07-07 15:30:43,128.63,98%,How many roads must a man walk down before you call him a ma...,No win (2 of 2)
417.,2012-05-26 21:31:52,114.98,98%,"Let's sort the buyers from the spiers, the needy from the gr...",No win (3 of 3)
416.,2012-05-26 21:31:05,121.62,99%,"One respondent said ""For women - a lot of games are crap - t...",Win (1 of 4)
415.,2012-05-26 21:30:20,122.93,97%,"I'm so glad you came, I'm so glad you remembered, to see how...",Win (1 of 3)
414.,2012-05-21 23:09:05,123.43,99%,Too often writers believe that they can emphasize words by p...,Win (1 of 5)
413.,2012-04-26 13:34:39,133.93,99%,"A computer needs a manager to administer its operations, jus...",No win (2 of 3)
412.,2012-04-26 13:33:53,120.41,95%,It was hard to toss things I had once thought were valuable ...,Win (1 of 4)
411.,2012-04-26 13:32:01,129.76,97%,"When I really worry about something, I don't just fool aroun...",Win (1 of 4)
410.,2012-04-26 13:31:06,127.81,98%,But speculations on the structure of the universe also move ...,Win (1 of 2)
409.,2012-04-26 13:30:02,128.28,97%,"After removal from the oven, the pizza is sliced and plated ...",No win (1 of 1)
408.,2012-04-26 13:28:10,124.53,96%,She's got eyes of the bluest skies as if they thought of rai...,Win (1 of 3)
407.,2012-04-26 13:27:20,133.68,98%,"She's got a smile that, it seems to me, reminds me of childh...",Win (1 of 3)
406.,2012-04-26 13:26:29,137.51,100%,Your inner child will be happy to know that when it comes to...,Win (1 of 3)
405.,2012-04-26 13:25:35,119.73,96%,"I know a bloke who knows a bloke who knows a bloke. Now, I k...",Win (1 of 4)
404.,2012-04-25 14:00:08,143.78,100%,She's got eyes of the bluest skies as if they thought of rai...,Win (1 of 3)
403.,2012-04-25 13:59:15,136.40,99%,A glooming peace this morning with it brings. The sun for so...,Win (1 of 4)
402.,2012-04-25 13:58:46,129.42,97%,Focus your attention on the Now and tell me what problem you...,No win (1 of 1)
401.,2012-04-25 13:58:06,123.45,98%,"When I really worry about something, I don't just fool aroun...",Win (1 of 3)
400.,2012-04-25 13:57:04,139.30,98%,Remember that humor is written backwards. That means you fir...,Win (1 of 2)
399.,2012-04-25 13:56:39,118.89,95%,Good games offer players a set of challenging problems and t...,Win (1 of 2)
398.,2012-04-25 13:56:06,140.26,100%,"I know a bloke who knows a bloke who knows a bloke. Now, I k...",Win (1 of 4)
397.,2012-04-25 13:55:07,130.07,99%,"Historically, most wines contained less than 14 percent alco...",Win (1 of 2)
396.,2012-04-25 13:54:30,123.99,97%,"As if that blind rage had washed me clean, rid me of hope; f...",Win (1 of 5)
395.,2012-04-08 11:34:48,123.97,99%,You've got a way to keep me on your side. You give me cause ...,Win (1 of 2)
394.,2012-04-06 12:18:03,119.82,97%,"But no matter how effective the lesson was, I never really u...",No win (2 of 3)
393.,2012-04-06 12:16:52,120.93,99%,It was hard to toss things I had once thought were valuable ...,No win (2 of 3)
392.,2012-04-06 12:15:59,116.24,97%,"It was a marvelous night, the sort of night one only experie...",No win (2 of 3)
391.,2012-04-06 12:15:22,130.77,100%,"People get ready, there's a train coming. You don't need no ...",No win (2 of 5)
390.,2012-04-06 12:14:45,111.75,97%,This business is filled to the brim with unrealistic people ...,Win (1 of 4)
389.,2012-04-06 12:13:39,126.29,100%,"My darling, you have to be standing up in order to be able t...",No win (2 of 3)
388.,2012-04-04 13:11:05,121.47,99%,"On a manual typewriter, strike the key with a nice sharp str...",Win (1 of 4)
387.,2012-04-04 13:10:23,120.59,97%,"The Earth is a world, the world is a ball, a ball in a game ...",No win (2 of 5)
386.,2012-04-04 13:09:55,117.83,99%,It was hard to toss things I had once thought were valuable ...,Win (1 of 3)
385.,2012-04-04 13:08:13,122.99,99%,"Ticking away the moments that make up a dull day, you fritte...",No win (2 of 3)
384.,2012-04-04 13:07:15,113.13,97%,Paper as we know it today was invented in China in around 10...,No win (2 of 2)
383.,2012-03-31 20:24:09,140.34,100%,Well I woke in mid-afternoon cause that's when it all hurts ...,Win (1 of 3)
382.,2012-03-31 20:20:31,128.69,98%,"Well, the way they make shows is, they make one show. That s...",Win (1 of 2)
381.,2012-03-31 20:19:23,135.79,99%,"No matter how bad things are, you can always make things wor...",Win (1 of 4)
380.,2012-03-31 13:54:57,129.52,99%,"When we conceive of the sweetest being ever, we are conceivi...",Win (1 of 3)
379.,2012-03-31 13:38:50,123.17,97%,"Well, it just so happens, this hacienda comes with its very ...",Win (1 of 2)
378.,2012-03-31 13:27:06,111.68,94%,I have quit three jobs and been fired from all the rest. Get...,Win (1 of 2)
377.,2012-03-31 13:21:11,117.29,96%,"I don't want tickets, I need you to find me a painting, a cl...",No win (2 of 3)
376.,2012-03-31 13:09:05,120.86,98%,How many roads must a man walk down before you call him a ma...,No win (2 of 3)
375.,2012-03-31 13:07:46,130.26,99%,"The sooner your kids appreciate the value of work, the more ...",Win (1 of 3)
374.,2012-03-31 12:55:51,143.48,100%,The most precious treasures we have in life are the images w...,No win (2 of 2)
373.,2012-03-30 21:56:54,112.91,96%,Since every piece of matter in the Universe is in some way a...,No win (3 of 4)
372.,2012-03-30 21:56:07,118.79,97%,At first they had tried to keep the finding quiet. After all...,Win (1 of 3)
371.,2012-03-30 21:45:21,121.80,99%,Your inner child will be happy to know that when it comes to...,Win (1 of 2)
370.,2012-03-30 21:44:33,127.02,100%,Although his voice was also broken by uncertainty and his ha...,Win (1 of 2)
369.,2012-03-30 21:44:02,123.78,96%,"I don't believe in an interventionist God, but I know, darli...",Win (1 of 4)
368.,2012-03-30 21:32:37,118.01,97%,Yet the web of thought has no such creases and is more like ...,No win (2 of 3)
367.,2012-03-30 21:31:47,114.18,98%,Your faith was strong but you needed proof. You saw her bath...,No win (2 of 3)
366.,2012-03-30 21:31:03,125.98,98%,"Because they're at the bottom of the scale, nerds are a safe...",Win (1 of 3)
365.,2012-02-06 16:09:19,134.70,100%,But the two men were not lonely at all. At home they were co...,Win (1 of 4)
364.,2012-01-29 21:45:50,132.13,99%,So what's in this for you? Should you rush out in search of ...,Win (1 of 4)
363.,2012-01-05 15:37:27,136.41,100%,But the two men were not lonely at all. At home they were co...,Win (1 of 5)
362.,2012-01-05 15:36:56,106.78,95%,I will need my spectacles and a clear head. Today I broke my...,No win (2 of 5)
361.,2012-01-05 14:03:09,133.09,99%,Let me tell you why you're here. You're here because you kno...,Win (1 of 2)
360.,2012-01-03 16:06:39,133.55,98%,"Let me get this straight. You think that your client, one of...",Win (1 of 5)
359.,2012-01-03 16:05:55,118.17,96%,"The only people for me are the mad ones, the ones who are ma...",Win (1 of 2)
358.,2012-01-03 16:05:04,116.46,98%,"The sooner your kids appreciate the value of work, the more ...",No win (4 of 5)
357.,2012-01-03 16:04:25,106.17,95%,"The goal of the true seeker is to become a sage, or superior...",No win (2 of 5)
356.,2012-01-02 21:22:20,107.13,96%,"My friend, I shall be pedagogic, and say you ought to start ...",Win (1 of 5)
355.,2012-01-02 21:21:34,130.48,100%,"Ticking away the moments that make up a dull day, you fritte...",Win (1 of 2)
354.,2012-01-02 21:20:40,98.11,96%,We might begin by asking why the pregnant man image has been...,Win (1 of 4)
353.,2012-01-01 20:49:32,137.36,99%,"In the casino, the cardinal rule is to keep them playing and...",Win (1 of 3)
352.,2012-01-01 20:48:55,140.67,100%,"Whether they use the title or not, many lyrics have evocativ...",Win (1 of 3)
351.,2012-01-01 20:48:25,106.44,94%,Gardeners know how to grow top-notch crops. They determine w...,Win (1 of 2)
350.,2012-01-01 20:46:02,122.60,99%,Facts can be thought of as objective or subjective. Things a...,Win (1 of 2)
349.,2012-01-01 20:45:21,109.52,95%,"A little boy went out to play. When he opened his door, he s...",No win (2 of 2)
348.,2012-01-01 20:44:02,110.92,97%,I'm telling it like it is. Get used to it or put this book d...,Win (1 of 2)
347.,2012-01-01 20:43:05,109.49,97%,The basic concept is simple: a satellite in geosynchronous o...,Win (1 of 3)
346.,2012-01-01 20:42:11,103.15,96%,Aztec rule was based upon a system of tribute and fear over ...,Win (1 of 3)
345.,2012-01-01 20:41:11,121.84,99%,"There are perhaps twenty regular posters on the forum, and s...",Win (1 of 2)
344.,2011-12-28 15:20:27,123.70,99%,"If you are given too many choices, if you are forced to cons...",Win (1 of 4)
343.,2011-12-27 15:57:25,129.44,99%,Every time I think of you I feel shot right through with a b...,Win (1 of 3)
342.,2011-12-18 14:59:35,98.12,92%,"The melted mozzarella layer, which we shall designate MML, i...",No win (2 of 4)
341.,2011-12-18 14:58:48,104.12,95%,We often believe the more we practice a skill or technique -...,No win (3 of 4)
340.,2011-12-18 14:57:35,114.18,97%,I've been thinking lots about my life and how quick I'd wash...,No win (2 of 3)
339.,2011-12-18 14:56:59,103.11,94%,"Let's sort the buyers from the spiers, the needy from the gr...",No win (3 of 3)
338.,2011-12-18 14:56:04,109.45,97%,The Inca believed that if one did not give thanks and obedie...,Win (1 of 2)
337.,2011-12-18 14:55:23,105.03,95%,"He's got a two day head start on you, which is more than he ...",Win (1 of 2)
336.,2011-12-17 14:58:16,102.98,96%,"Yeah, you just take Soupy-Sales to prom 'cause I can think o...",Win (1 of 2)
335.,2011-12-17 14:57:25,115.28,97%,"Ticking away the moments that make up a dull day, you fritte...",Win (1 of 2)
334.,2011-12-17 14:56:45,110.11,96%,Who is Keyser Soze? He is supposed to be Turkish. Some say h...,Win (1 of 2)
333.,2011-12-17 14:55:07,115.87,95%,I said that I would see you because I had heard that you wer...,Win (1 of 2)
332.,2011-12-17 14:53:07,101.69,93%,"A computer needs a manager to administer its operations, jus...",No win (2 of 3)
331.,2011-12-17 14:52:35,122.21,98%,Sometimes you concentrate more on racing the cars around you...,No win (1 of 1)
330.,2011-12-17 14:51:15,109.08,95%,"The idea of ""Mr. Right"" has been passed down over the genera...",Win (1 of 3)
329.,2011-12-17 14:50:20,126.28,96%,I can already hear your tune calling me across the room. Whe...,Win (1 of 2)
328.,2011-12-17 14:49:27,113.06,96%,"There was me, that is Alex, and my three droogs, that is Pet...",Win (1 of 2)
327.,2011-12-17 14:48:52,123.24,97%,Space is big. Really big. You just won't believe how vastly ...,No win (2 of 4)
326.,2011-12-17 14:48:21,110.79,96%,Danger is a topic you're often asked about as a sprinter. Th...,Win (1 of 4)
325.,2011-12-17 14:47:24,123.36,99%,I remember when we used to sit in the government yard in Tre...,Win (1 of 3)
324.,2011-12-17 14:46:44,100.66,94%,The streets were cleared by a Critical Mass bike ride and we...,Win (1 of 3)
323.,2011-12-17 14:45:45,122.45,94%,"I'm so glad you came, I'm so glad you remembered, to see how...",Win (1 of 2)
322.,2011-12-17 14:44:45,115.53,96%,To an outsider's ear it sounds absurdly wild and ridiculous ...,No win (2 of 4)
321.,2011-12-17 14:44:18,120.89,98%,But speculations on the structure of the universe also move ...,No win (2 of 4)
320.,2011-12-16 18:37:32,111.79,95%,Popularity is only partially about individual attractiveness...,No win (3 of 3)
319.,2011-12-16 18:36:46,101.07,95%,Ideology: the process of making ideas. The work was generall...,No win (3 of 3)
318.,2011-12-16 18:35:46,126.21,98%,The place to improve the world is first in one's own heart a...,No win (2 of 3)
317.,2011-12-16 12:25:05,123.32,98%,"Life is not suffering; it's just that you will suffer it, ra...",Win (1 of 3)
316.,2011-12-16 12:23:44,110.15,96%,Indonesia is a nation of islands - more than seventeen thous...,Win (1 of 3)
315.,2011-12-16 12:22:56,94.58,97%,"Ergonomics is a term that combines the Greek word ergon, mea...",Win (1 of 3)
314.,2011-12-16 12:22:12,121.25,98%,I will need my spectacles and a clear head. Today I broke my...,Win (1 of 3)
313.,2011-12-16 12:21:43,131.09,98%,But if in efficient causes it is possible to go on to infini...,Win (1 of 5)
312.,2011-12-16 12:20:59,108.71,95%,Even the best-designed chair won't make up for bad posture. ...,Win (1 of 4)
311.,2011-12-16 12:20:26,104.07,93%,"Warmer water increases the moisture content of storms, and w...",No win (2 of 3)
310.,2011-12-16 12:18:10,102.59,95%,Typing competitions provided another test of the Qwerty keyb...,No win (3 of 3)
309.,2011-12-16 11:04:31,92.95,92%,"The boy has not a real choice, has he? Self-interest, the fe...",No win (2 of 3)
308.,2011-12-16 11:01:17,118.62,96%,"I don't believe in an interventionist God, but I know, darli...",Win (1 of 3)
307.,2011-12-16 11:00:32,117.03,95%,Imagine for a moment if we once again knew these few unremar...,Win (1 of 4)
306.,2011-12-16 10:59:09,123.09,96%,She's got eyes of the bluest skies as if they thought of rai...,Win (1 of 3)
305.,2011-12-16 10:58:28,115.62,97%,I said that I would see you because I had heard that you wer...,Win (1 of 3)
304.,2011-12-16 10:57:21,124.75,99%,Every time I think of you I feel shot right through with a b...,Win (1 of 4)
303.,2011-12-16 10:56:29,137.90,99%,The odds are that you will generally meet the worst of them....,Win (1 of 2)
302.,2011-12-16 10:55:00,105.15,94%,"It's a blue savanna song: somewhere cross the desert, someti...",Win (1 of 4)
301.,2011-12-16 10:54:20,126.14,98%,"My darling, you have to be standing up in order to be able t...",Win (1 of 4)
300.,2011-12-16 10:51:49,108.21,97%,"To evaluate an option from the other side's point of view, c...",Win (1 of 4)
299.,2011-12-16 10:51:10,111.36,96%,"I can feel the heat closing in, feel them out there making t...",No win (2 of 3)
298.,2011-12-16 10:50:31,126.17,100%,Music finds a comfortable parallel with that of human langua...,Win (1 of 4)
297.,2011-12-16 10:50:09,123.63,98%,The great edifice of variety and choice that is an American ...,Win (1 of 5)
296.,2011-12-16 10:49:29,115.20,98%,The problem we now face is that this thin layer of atmospher...,No win (2 of 5)
295.,2011-12-16 10:46:35,101.43,97%,The development of a living body of literature became indica...,Win (1 of 3)
294.,2011-12-16 10:45:35,98.91,92%,"You needn't take it any further, sir. You've proved to me th...",Win (1 of 3)
293.,2011-12-16 10:44:50,107.09,93%,"Never give up, no matter how far behind you are, no matter h...",Win (1 of 2)
292.,2011-12-16 10:43:50,121.91,97%,Don't take anything personally - nothing others do is becaus...,Win (1 of 3)
291.,2011-12-16 10:43:11,118.04,99%,I had the impression of being abandoned by everyone when the...,Win (1 of 2)
290.,2011-12-15 23:31:50,103.17,94%,"My dog barks some. Mentally you picture my dog, but I have n...",Win (1 of 2)
289.,2011-12-15 23:30:33,130.95,99%,What should have been swift revenge turned into an all out w...,Win (1 of 4)
288.,2011-12-15 23:29:51,114.24,96%,Even the best-designed chair won't make up for bad posture. ...,No win (2 of 4)
287.,2011-12-15 23:29:15,115.85,96%,I will need my spectacles and a clear head. Today I broke my...,No win (2 of 4)
286.,2011-12-15 23:28:49,99.23,92%,Music finds a comfortable parallel with that of human langua...,No win (3 of 4)
285.,2011-12-15 23:28:19,115.90,96%,A giant inverted steel pyramid is perfectly balanced on its ...,Win (1 of 3)
284.,2011-12-15 23:27:31,125.06,99%,"There is no pain, you are receding. A distant ship smoke on ...",Win (1 of 5)
283.,2011-12-15 23:26:44,116.13,95%,"He's got a two day head start on you, which is more than he ...",Win (1 of 3)
282.,2011-12-15 23:25:56,135.86,100%,"That fear had been inside him for many years, it had lived w...",Win (1 of 5)
281.,2011-12-15 23:25:11,123.97,98%,"Common knowledge has bicyclists always riding into the wind,...",Win (1 of 3)
280.,2011-12-15 23:23:35,110.72,97%,"Samatha is a state in which the mind is brought to rest, foc...",No win (2 of 4)
279.,2011-12-15 23:22:57,101.14,96%,"Wilkinson County was a recipient of one of the new ""separate...",Win (1 of 3)
278.,2011-12-15 23:22:11,114.78,96%,Three changes occur while the stacked disk structure equilib...,Win (1 of 3)
277.,2011-12-15 23:21:09,116.29,97%,"That's Tommy. He tells people he was named after a gun, but ...",Win (1 of 4)
276.,2011-12-15 23:20:41,120.84,95%,I am learning about twenty new Italian words a day. Where am...,Win (1 of 3)
275.,2011-12-15 23:20:08,111.03,95%,I'd just like to point out that you were given every opportu...,Win (1 of 5)
274.,2011-12-15 23:19:17,99.96,96%,The evidence in the standard history of Qwerty versus Dvorak...,Win (1 of 2)
273.,2011-12-15 15:32:11,113.29,97%,We began to recognize in them a strange obsession. After all...,No win (1 of 1)
272.,2011-12-15 15:31:31,111.70,93%,You've got a way to keep me on your side. You give me cause ...,No win (1 of 1)
271.,2011-12-14 14:05:36,117.91,99%,We often believe the more we practice a skill or technique -...,Win (1 of 3)
270.,2011-12-14 14:04:40,118.21,97%,I've flown seven million miles. And I've been waiting on peo...,Win (1 of 4)
269.,2011-12-14 14:03:42,126.75,99%,Being able to quit things that don't work is integral to bei...,Win (1 of 3)
268.,2011-12-14 14:03:05,115.64,96%,Groups of illegal miners smuggle themselves down in freight ...,Win (1 of 2)
267.,2011-12-14 14:02:19,102.10,93%,"I did my best, it wasn't much. I couldn't feel, so I tried t...",No win (2 of 2)
266.,2011-12-14 14:01:39,111.13,93%,"Warmer water increases the moisture content of storms, and w...",No win (2 of 2)
265.,2011-12-14 14:00:46,127.63,98%,"Races are not won in the first corner; however, they are oft...",Win (1 of 3)
264.,2011-12-13 15:07:54,131.84,99%,Space is big. Really big. You just won't believe how vastly ...,No win (1 of 1)
263.,2011-12-13 15:07:24,117.75,97%,We go waiting for the stars to come showering down. From Mos...,No win (1 of 1)
262.,2011-12-13 15:06:41,107.17,96%,"I can feel the heat closing in, feel them out there making t...",Win (1 of 3)
261.,2011-12-09 23:52:08,115.53,99%,I still see things that are not here. I just choose not to a...,Win (1 of 4)
260.,2011-12-09 23:51:10,115.36,97%,I don't believe in painted roses or bleeding hearts while bu...,No win (1 of 1)
259.,2011-12-08 11:55:04,110.04,97%,"O clear intelligence, force beyond all measure! Gentlemen, I...",No win (1 of 1)
258.,2011-12-07 22:58:05,118.65,97%,"But older than me now, more constant, more real, and the fur...",No win (1 of 1)
257.,2011-12-07 22:57:33,112.25,97%,Every time I think of you I feel shot right through with a b...,No win (1 of 1)
256.,2011-12-07 22:56:49,109.87,99%,Do you know what they call a Quarter-pounder with cheese in ...,No win (1 of 1)
255.,2011-12-05 19:04:08,117.54,98%,In order to become an elf I filled out ten pages' worth of f...,Win (1 of 2)
254.,2011-12-05 19:03:18,113.06,98%,"It's a sunny, woodsy day in Lumberton, so get those chainsaw...",Win (1 of 2)
253.,2011-12-05 16:04:02,133.24,99%,"No matter how bad things are, you can always make things wor...",No win (2 of 5)
252.,2011-12-05 16:03:32,108.23,93%,"Throughout my academic career, I'd given some pretty good ta...",No win (2 of 3)
251.,2011-12-05 16:02:55,110.96,97%,"Listen, strange women lyin' in ponds distributin' swords is ...",Win (1 of 4)
250.,2011-12-05 16:02:13,115.97,96%,The unknown future rolls toward us. I face it for the first ...,Win (1 of 4)
249.,2011-12-05 16:01:15,122.29,96%,I've been thinking lots about my life and how quick I'd wash...,Win (1 of 5)
248.,2011-12-05 16:00:35,105.94,96%,The recipe for turning fruit into wine goes something like t...,No win (3 of 5)
247.,2011-12-05 15:59:27,120.17,97%,"Now that I know that I'm breaking to pieces, I'll pull out m...",Win (1 of 3)
246.,2011-12-05 15:58:31,106.15,92%,Even the best-designed chair won't make up for bad posture. ...,No win (3 of 5)
245.,2011-12-05 15:57:58,128.32,99%,"Never give up, no matter how far behind you are, no matter h...",No win (2 of 5)
244.,2011-12-05 15:57:06,115.53,95%,"I rejected those answers; instead, I chose something differe...",No win (2 of 4)
243.,2011-12-05 15:19:22,118.21,97%,"I'd been walking for hours and, as usual, I'd lost track of ...",Win (1 of 2)
242.,2011-12-05 15:18:20,134.92,100%,"I don't believe in an interventionist God, but I know, darli...",Win (1 of 2)
241.,2011-12-04 22:00:54,122.86,97%,How many roads must a man walk down before you call him a ma...,Win (1 of 5)
240.,2011-12-04 22:00:10,109.02,96%,Stab a sorry heart with your favorite finger. Paint the whol...,No win (2 of 2)
239.,2011-12-04 21:59:22,126.07,98%,"Well, the way they make shows is, they make one show. That s...",Win (1 of 3)
238.,2011-12-04 21:58:39,117.42,96%,"I don't want tickets, I need you to find me a painting, a cl...",Win (1 of 4)
237.,2011-12-04 21:58:00,106.99,95%,"Today, computers have taken this ancient art out of the craf...",Win (1 of 4)
236.,2011-12-04 21:57:08,115.53,95%,"But older than me now, more constant, more real, and the fur...",No win (2 of 3)
235.,2011-12-04 21:56:33,119.54,100%,"After the grapes are crushed, yeasts (tiny one-celled organi...",Win (1 of 2)
234.,2011-12-04 21:55:54,120.37,98%,I will need my spectacles and a clear head. Today I broke my...,Win (1 of 3)
233.,2011-12-04 21:55:18,114.15,98%,We've arranged a global civilization in which most crucial e...,Win (1 of 2)
232.,2011-12-04 21:54:37,111.47,96%,The streets were cleared by a Critical Mass bike ride and we...,Win (1 of 2)
231.,2011-12-04 21:53:53,102.93,97%,You could choke a dozen donkeys on that! And you're haggling...,Win (1 of 2)
230.,2011-12-04 21:53:09,129.50,100%,Chance and chance alone has a message for us. Everything tha...,Win (1 of 2)
229.,2011-12-04 21:52:27,123.27,99%,Everything we hold dear likewise resolves into its original ...,Win (1 of 2)
228.,2011-12-04 21:51:27,123.28,97%,If you're working out in front of a mirror and watching your...,Win (1 of 4)
227.,2011-12-04 21:50:51,120.54,97%,There is something about yourself that you don't know. Somet...,Win (1 of 3)
226.,2011-12-04 21:50:08,105.39,94%,I thought climbing the Devil's Thumb would fix all that was ...,Win (1 of 2)
225.,2011-12-04 21:49:25,106.25,94%,"He started running, up and up, until he hurled himself into ...",Win (1 of 2)
224.,2011-12-01 21:39:52,110.35,94%,Parisian French is different from Provincial French and Germ...,Win (1 of 4)
223.,2011-12-01 21:39:07,123.44,97%,"Never give up, no matter how far behind you are, no matter h...",Win (1 of 5)
222.,2011-12-01 21:38:09,123.38,99%,"But, pray how could that which I spoke so many years ago, an...",Win (1 of 2)
221.,2011-12-01 21:37:25,139.11,99%,There's a piece of Maria in every song that I sing. And the ...,Win (1 of 4)
220.,2011-12-01 21:36:50,107.98,94%,"Let's sort the buyers from the spiers, the needy from the gr...",No win (2 of 5)
219.,2011-12-01 21:36:00,106.29,96%,"Disillusion is the greatest gift I can give you. But, becaus...",Win (1 of 2)
218.,2011-12-01 21:35:05,121.48,97%,"If I leave here tomorrow, would you still remember me? For I...",No win (2 of 2)
217.,2011-12-01 21:34:25,130.30,98%,I don't know why he saved my life. Maybe in those last momen...,Win (1 of 5)
216.,2011-12-01 21:33:30,130.19,99%,"After removal from the oven, the pizza is sliced and plated ...",Win (1 of 2)
215.,2011-12-01 21:32:47,127.74,98%,"Your face has fallen sad now, for you know the time is nigh....",No win (3 of 4)
214.,2011-12-01 21:32:00,117.85,96%,If there is one thing the history of evolution has taught us...,Win (1 of 5)
213.,2011-11-29 15:11:47,133.20,97%,The alternative to binge travel - the mini retirement - enta...,Win (1 of 2)
212.,2011-11-29 15:10:58,128.98,98%,Always do your best - your best is going to change from mome...,No win (1 of 1)
211.,2011-11-29 15:10:19,110.89,96%,"Milt, with the excellent timing of a master comedy writer, w...",Win (1 of 2)
210.,2011-11-29 15:09:36,116.54,96%,"Now that I know that I'm breaking to pieces, I'll pull out m...",No win (2 of 3)
209.,2011-11-29 15:08:40,130.67,97%,Every time I think of you I feel shot right through with a b...,No win (2 of 4)
208.,2011-11-29 15:07:59,108.44,95%,The basis of the Aztecs' success in creating a great state a...,No win (2 of 2)
207.,2011-11-29 15:07:08,118.51,96%,"The creation ends in South Georgia, at the very edge of the ...",No win (2 of 2)
206.,2011-11-29 15:06:15,118.37,97%,"Let's sort the buyers from the spiers, the needy from the gr...",No win (2 of 2)
205.,2011-11-29 15:05:18,126.12,98%,The ultimate way to compose is to be able to keyboard as fas...,No win (2 of 4)
204.,2011-11-29 15:04:35,129.35,99%,"And in the world a heart of darkness, a firezone, where poet...",No win (2 of 3)
203.,2011-11-29 15:03:56,119.67,98%,"But no matter how effective the lesson was, I never really u...",No win (2 of 4)
202.,2011-11-29 15:03:24,100.53,97%,"Air-conditioned, odorless, illuminated by buzzing fluorescen...",No win (2 of 2)
