201.,2011-11-29 15:02:39,102.13,93%,"Races are not won in the first corner; however, they are oft...",Win (1 of 2)
200.,2011-11-24 16:52:16,124.44,96%,Every time I think of you I feel shot right through with a b...,Win (1 of 4)
199.,2011-11-24 16:51:27,124.69,99%,Many rivers to cross but I can't seem to find my way over. W...,Win (1 of 3)
198.,2011-11-24 16:50:34,123.25,98%,"That day, for no particular reason, I decided to go for a li...",Win (1 of 2)
197.,2011-11-24 16:49:46,126.07,98%,"Ultimately, this is not about solving your problems. It's ab...",No win (2 of 3)
196.,2011-11-24 16:49:07,114.60,96%,"Run to the bedroom, in the suitcase on the left, you'll find...",Win (1 of 4)
195.,2011-11-24 16:48:00,141.86,100%,Always do your best - your best is going to change from mome...,Win (1 of 2)
194.,2011-11-24 16:47:02,113.46,95%,"The brain can be a tool. It can recall phone numbers, solve ...",Win (1 of 4)
193.,2011-11-24 16:46:03,121.97,95%,"If we all go for the blonde and block each other, not a sing...",Win (1 of 5)
192.,2011-11-24 16:45:14,126.26,99%,For it is not enough to have a good mind; the main thing is ...,Win (1 of 5)
191.,2011-11-24 16:44:28,128.36,96%,"Contrary to the feminist cant, there are many things we can ...",No win (2 of 2)
190.,2011-11-24 16:43:49,119.68,97%,Remembering you running soft through the night. You were big...,No win (2 of 4)
189.,2011-11-24 16:43:18,118.24,97%,"Good evening, London. Allow me first to apologize for this i...",Win (1 of 2)
188.,2011-11-24 16:42:13,113.93,95%,"I did my best, it wasn't much. I couldn't feel, so I tried t...",Win (1 of 2)
187.,2011-11-24 16:41:26,128.40,99%,I don't know why he saved my life. Maybe in those last momen...,Win (1 of 4)
186.,2011-11-24 16:40:47,106.39,93%,"And in the world a heart of darkness, a firezone, where poet...",Win (1 of 4)
185.,2011-11-24 16:40:03,99.61,93%,"Ezekiel twenty-five, seventeen: The path of the righteous ma...",Win (1 of 3)
184.,2011-11-24 16:39:05,127.33,97%,She's got eyes of the bluest skies as if they thought of rai...,Win (1 of 4)
183.,2011-11-24 16:38:27,132.09,98%,"Races are not won in the first corner; however, they are oft...",Win (1 of 3)
182.,2011-11-24 16:37:42,107.70,93%,"A little boy went out to play. When he opened his door, he s...",Win (1 of 2)
181.,2011-11-24 16:37:09,114.99,96%,"What good's a reward if you ain't around to use it? Besides,...",No win (2 of 3)
180.,2011-11-24 16:36:30,99.75,92%,"Trudging slowly over wet sand, back to the bench where your ...",Win (1 of 3)
179.,2011-11-24 16:35:46,110.75,96%,"Hey Mr. Tambourine Man, play a song for me, I'm not sleepy a...",Win (1 of 4)
178.,2011-11-24 16:35:13,129.44,97%,If you're working out in front of a mirror and watching your...,No win (2 of 2)
177.,2011-11-24 16:34:32,108.81,91%,Space is big. Really big. You just won't believe how vastly ...,No win (2 of 4)
176.,2011-11-24 16:33:49,138.83,99%,Don't make assumptions - find the courage to ask questions a...,Win (1 of 4)
175.,2011-11-24 16:33:13,113.69,96%,We live in a charmed world. If we have money we can buy lite...,Win (1 of 3)
174.,2011-11-24 16:32:05,119.17,98%,I said that I would see you because I had heard that you wer...,No win (2 of 4)
173.,2011-11-23 19:12:58,111.34,94%,"When I really worry about something, I don't just fool aroun...",Win (1 of 3)
172.,2011-11-23 19:12:05,114.05,96%,"In the witch trials, it was nearly impossible to provide com...",No win (2 of 3)
171.,2011-11-23 19:11:12,128.70,96%,Imagine for a moment if we once again knew these few unremar...,No win (2 of 2)
170.,2011-11-23 19:05:51,93.68,94%,"Prior to the 1970's, because the United States had long been...",No win (2 of 3)
169.,2011-11-23 19:04:42,128.18,99%,"Look and think as far ahead as possible. Often, a driver's n...",No win (2 of 3)
168.,2011-11-23 19:03:57,129.33,97%,"Ticking away the moments that make up a dull day, you fritte...",Win (1 of 4)
167.,2011-11-23 19:03:24,102.24,94%,So my heart goes out to them. Figuratively. I would never ac...,Win (1 of 3)
166.,2011-11-23 19:02:35,122.53,97%,Although the United Nations does not have the power to enfor...,Win (1 of 2)
165.,2011-11-23 19:01:24,127.18,98%,"Keying text quickly is important, but it is more important t...",Win (1 of 3)
164.,2011-11-23 19:00:41,103.74,93%,Since the 1980s virtually all the sodas and most of the frui...,Win (1 of 3)
163.,2011-11-23 18:59:38,126.52,97%,We've known each other for many years but this is the first ...,Win (1 of 2)
162.,2011-11-23 18:58:52,127.76,99%,"Picking up the pieces, half alive in a nine 'til five, vacan...",Win (1 of 3)
161.,2011-11-23 18:58:14,112.74,95%,"Now that I know that I'm breaking to pieces, I'll pull out m...",No win (2 of 4)
160.,2011-11-23 18:57:07,114.98,97%,He rode past me and kept on goin'. Never said nothin' goin' ...,No win (2 of 4)
159.,2011-11-23 18:55:57,126.98,99%,We began to recognize in them a strange obsession. After all...,Win (1 of 4)
158.,2011-11-21 22:21:11,106.33,95%,The Inca believed that if one did not give thanks and obedie...,Win (1 of 4)
157.,2011-11-21 22:20:32,128.73,97%,"Look, you should admit to yourself that Microsoft will miss ...",No win (2 of 2)
156.,2011-11-21 22:19:48,100.00,93%,"Excellent. He's enterprising, aggressive, outgoing, young, b...",No win (3 of 3)
155.,2011-11-21 22:18:24,119.82,95%,"Combat for a naval aviator is fought in short, violent burst...",No win (2 of 4)
154.,2011-11-21 22:17:40,121.18,99%,"What good's a reward if you ain't around to use it? Besides,...",Win (1 of 3)
153.,2011-11-21 22:17:14,125.10,97%,"When we pulled out into the winter night and the real snow, ...",No win (2 of 2)
152.,2011-11-21 22:16:19,135.89,98%,There is something about yourself that you don't know. Somet...,No win (2 of 4)
151.,2011-11-21 22:15:44,129.09,99%,"It's a blue savanna song: somewhere cross the desert, someti...",Win (1 of 4)
150.,2011-11-21 22:14:42,106.96,94%,"They say that right after God created man, he took a rib fro...",No win (4 of 4)
149.,2011-11-21 22:13:26,110.76,97%,"Imagine considering ""if"" as a two-finger movement instead of...",No win (2 of 3)
148.,2011-11-19 12:12:02,120.93,96%,The alternative to binge travel - the mini retirement - enta...,No win (2 of 4)
147.,2011-11-19 12:11:29,119.76,95%,I still see things that are not here. I just choose not to a...,Win (1 of 4)
146.,2011-11-19 12:10:57,130.02,99%,The great edifice of variety and choice that is an American ...,Win (1 of 5)
145.,2011-11-19 12:10:18,120.89,97%,I drew the blankets over my head and tried to think of Chris...,Win (1 of 4)
144.,2011-11-19 12:09:36,132.33,99%,"Ticking away the moments that make up a dull day, you fritte...",No win (2 of 5)
143.,2011-11-19 12:09:01,120.65,95%,If there is one thing the history of evolution has taught us...,Win (1 of 4)
142.,2011-11-19 12:08:27,106.56,92%,"Combat for a naval aviator is fought in short, violent burst...",No win (2 of 4)
141.,2011-11-19 12:07:38,117.09,96%,Your faith was strong but you needed proof. You saw her bath...,Win (1 of 4)
140.,2011-11-19 12:07:02,110.82,94%,It is greatly to America's advantage that it is a congenial ...,No win (2 of 3)
139.,2011-11-19 12:06:19,103.77,96%,The inner surface of the cell wall touches the cytoplasmic m...,No win (2 of 2)
138.,2011-11-19 12:05:32,133.24,99%,"I'm so glad you came, I'm so glad you remembered, to see how...",Win (1 of 4)
137.,2011-11-19 11:52:09,135.20,100%,"No matter how bad things are, you can always make things wor...",Win (1 of 4)
136.,2011-11-19 11:51:38,138.31,99%,"You have a class of young strong men and women, and they wan...",Win (1 of 4)
135.,2011-11-19 11:50:57,119.74,96%,Since every piece of matter in the Universe is in some way a...,Win (1 of 3)
134.,2011-11-19 11:50:09,105.73,96%,You could choke a dozen donkeys on that! And you're haggling...,Win (1 of 3)
133.,2011-11-19 11:49:20,139.17,100%,"You have a class of young strong men and women, and they wan...",Win (1 of 5)
132.,2011-11-19 11:48:36,102.56,95%,Paper as we know it today was invented in China in around 10...,Win (1 of 5)
131.,2011-11-18 22:38:54,113.33,95%,It was hard to toss things I had once thought were valuable ...,No win (2 of 5)
130.,2011-11-18 22:37:55,124.43,98%,Don't make assumptions - find the courage to ask questions a...,Win (1 of 5)
129.,2011-11-18 15:35:18,104.25,96%,"When I really worry about something, I don't just fool aroun...",Win (1 of 3)
128.,2011-11-18 15:34:33,104.96,94%,The most precious treasures we have in life are the images w...,Win (1 of 4)
127.,2011-11-18 15:03:04,95.26,94%,"One respondent said ""For women - a lot of games are crap - t...",No win (1 of 1)
126.,2011-11-18 12:24:31,125.55,100%,"Ticking away the moments that make up a dull day, you fritte...",No win (1 of 1)
125.,2011-11-18 11:35:43,104.89,98%,"I was hugely impressed. Kirk, I mean Shatner, was the ultima...",No win (1 of 1)
124.,2011-11-17 20:30:02,106.23,94%,"The less you do with the controls, the less chance of error....",No win (3 of 4)
123.,2011-11-17 20:29:17,118.83,98%,We've known each other for many years but this is the first ...,No win (2 of 3)
122.,2011-11-17 13:47:47,111.11,95%,The beginner writes just twenty pieces. The professional wri...,Win (1 of 4)
121.,2011-11-17 13:47:02,108.60,97%,Paper as we know it today was invented in China in around 10...,Win (1 of 3)
120.,2011-11-17 13:46:07,124.93,98%,I can already hear your tune calling me across the room. Whe...,Win (1 of 4)
119.,2011-11-17 13:45:20,117.37,98%,The time has come for man to set himself a goal. The time ha...,No win (2 of 3)
118.,2011-11-17 13:44:25,98.02,94%,He had spent enormous amounts of time at the great libraries...,Win (1 of 2)
117.,2011-11-16 16:20:10,112.44,97%,Being able to quit things that don't work is integral to bei...,No win (2 of 4)
116.,2011-11-16 16:19:35,114.89,97%,We often believe the more we practice a skill or technique -...,No win (2 of 2)
115.,2011-11-16 16:18:44,114.25,96%,"The creation ends in South Georgia, at the very edge of the ...",No win (2 of 3)
114.,2011-11-16 16:17:53,116.84,96%,Images of broken light which dance before me like a million ...,No win (2 of 4)
113.,2011-11-16 16:17:15,128.07,100%,"The less you do with the controls, the less chance of error....",No win (2 of 2)
112.,2011-11-16 16:16:41,117.15,98%,"After the grapes are crushed, yeasts (tiny one-celled organi...",Win (1 of 3)
111.,2011-11-16 16:16:04,112.38,98%,"The National Rifle Association says that, ""Guns don't kill p...",No win (2 of 5)
110.,2011-11-16 16:13:24,129.95,98%,"And you know it's time to go, through the sleet and driving ...",No win (1 of 1)
109.,2011-11-16 16:12:57,101.51,96%,"Pulp: 1. A soft, moist, shapeless mass or matter. 2. A magaz...",No win (1 of 1)
108.,2011-11-16 16:10:09,101.39,94%,"In 1966, Andy Dufresne escaped from Shawshank prison. All th...",No win (2 of 2)
107.,2011-11-15 19:22:03,112.73,97%,"Do you smell that? Napalm, son. Nothing else in the world sm...",No win (1 of 1)
106.,2011-11-13 16:36:23,113.65,98%,There is a theory which states that if anybody ever discover...,No win (3 of 3)
105.,2011-11-12 18:13:50,107.18,96%,But speculations on the structure of the universe also move ...,Win (1 of 4)
104.,2011-11-12 18:13:04,118.93,97%,"There are men who possess a peculiarly strong visual memory,...",Win (1 of 2)
103.,2011-11-12 18:12:14,139.30,100%,Is it really necessary to send that email? The more emails y...,Win (1 of 3)
102.,2011-11-12 18:11:24,122.33,97%,There are very few things I wish I could change about those ...,Win (1 of 5)
101.,2011-11-12 18:10:42,121.53,99%,"After the grapes are crushed, yeasts (tiny one-celled organi...",Win (1 of 5)
100.,2011-11-12 16:22:48,134.95,97%,There's a piece of Maria in every song that I sing. And the ...,No win (1 of 1)
99.,2011-11-12 16:21:53,120.87,97%,I thought climbing the Devil's Thumb would fix all that was ...,No win (1 of 1)
98.,2011-11-12 16:21:24,124.65,98%,The truth of the matter is that there are a lot of available...,No win (1 of 1)
97.,2011-11-12 16:20:50,125.36,97%,"I'm so glad you came, I'm so glad you remembered, to see how...",No win (1 of 1)
96.,2011-11-12 16:19:41,137.73,99%,There's a hole in the world like a great black pit. And the ...,No win (1 of 1)
95.,2011-11-12 16:19:11,122.34,96%,But the two men were not lonely at all. At home they were co...,No win (1 of 1)
94.,2011-11-12 16:17:54,138.05,99%,"She's got a smile that, it seems to me, reminds me of childh...",No win (1 of 1)
93.,2011-11-12 16:17:25,123.06,98%,Chance and chance alone has a message for us. Everything tha...,No win (1 of 1)
92.,2011-11-12 16:16:53,106.83,96%,"Keying text quickly is important, but it is more important t...",No win (1 of 1)
91.,2011-11-12 16:16:28,117.06,94%,"If you don't get what you want, you suffer; if you get what ...",No win (1 of 1)
90.,2011-11-12 16:14:30,125.09,97%,"A computer needs a manager to administer its operations, jus...",Win (1 of 2)
89.,2011-11-12 16:14:00,114.50,97%,Ideology: the process of making ideas. The work was generall...,Win (1 of 3)
88.,2011-11-12 16:12:52,126.08,98%,"In the witch trials, it was nearly impossible to provide com...",Win (1 of 2)
87.,2011-11-12 16:11:55,129.76,99%,"The Earth is a world, the world is a ball, a ball in a game ...",No win (2 of 3)
86.,2011-11-12 16:11:26,117.17,97%,"You found paradise in America. You had a good trade, made a ...",Win (1 of 5)
85.,2011-11-12 16:09:58,123.51,99%,"The time I waited seemed endless, and I felt doubts and fear...",Win (1 of 3)
84.,2011-11-12 16:09:17,116.87,97%,"What about Tony? You know, Bullet Tooth Tony. He'll find you...",Win (1 of 4)
83.,2011-11-12 16:08:41,118.85,97%,There's sometimes a buggy. How many drivers does a buggy hav...,Win (1 of 3)
82.,2011-11-12 16:08:04,111.99,95%,"That day, for no particular reason, I decided to go for a li...",No win (2 of 4)
81.,2011-11-12 16:07:13,116.64,96%,You've got a way to keep me on your side. You give me cause ...,Win (1 of 3)
80.,2011-11-12 13:06:51,123.42,97%,"I don't believe in an interventionist God, but I know, darli...",Win (1 of 3)
79.,2011-11-12 13:06:11,120.11,98%,What should have been swift revenge turned into an all out w...,Win (1 of 4)
78.,2011-11-12 13:05:27,116.74,97%,Stab a sorry heart with your favorite finger. Paint the whol...,Win (1 of 2)
77.,2011-11-12 13:03:53,111.04,97%,"Imagine a vast sheet of paper on which straight Lines, Trian...",Win (1 of 3)
76.,2011-11-12 13:02:54,121.62,98%,Always do your best - your best is going to change from mome...,Win (1 of 5)
75.,2011-11-12 13:02:17,122.33,97%,"Contrary to the feminist cant, there are many things we can ...",No win (1 of 1)
74.,2011-11-11 17:38:28,110.24,96%,There was a stage and a PA up in western Massachusetts and t...,Win (1 of 4)
73.,2011-11-11 17:36:50,123.29,96%,The ultimate way to compose is to be able to keyboard as fas...,Win (1 of 4)
72.,2011-11-11 17:36:08,127.58,99%,"I've heard there was a secret chord that David played, and i...",No win (2 of 4)
71.,2011-11-11 17:35:32,134.65,100%,"When I really worry about something, I don't just fool aroun...",Win (1 of 3)
70.,2011-11-11 17:34:57,126.18,97%,"Hello, hello, hello, is there anybody in there? Just nod if ...",Win (1 of 5)
69.,2011-11-11 17:34:10,133.11,99%,One thing I've learned in the last seven years: in every gam...,Win (1 of 4)
68.,2011-11-11 17:33:38,103.30,95%,"My dog barks some. Mentally you picture my dog, but I have n...",No win (2 of 5)
67.,2011-11-11 17:33:07,110.91,96%,"Now that I know that I'm breaking to pieces, I'll pull out m...",No win (3 of 3)
66.,2011-11-11 17:32:09,113.45,95%,"People get ready, there's a train coming. You don't need no ...",No win (2 of 4)
65.,2011-11-11 17:30:37,112.82,97%,"Around midafternoon, the snow thinned into sleet, and some u...",No win (2 of 2)
64.,2011-11-11 17:30:02,133.87,100%,"Your face has fallen sad now, for you know the time is nigh....",Win (1 of 3)
63.,2011-11-11 17:29:25,135.18,100%,"As if that blind rage had washed me clean, rid me of hope; f...",Win (1 of 4)
62.,2011-11-11 17:28:54,110.74,96%,It doesn't mean much to be able to filter out most present-d...,No win (3 of 3)
61.,2011-11-11 17:28:16,120.75,99%,"Time is tricky. You have whole months, even years, when noth...",Win (1 of 3)
60.,2011-11-11 17:27:32,116.86,97%,There are very few things I wish I could change about those ...,Win (1 of 4)
59.,2011-11-08 19:51:22,99.40,93%,Parisian French is different from Provincial French and Germ...,No win (2 of 4)
58.,2011-11-08 19:50:45,125.44,99%,"When I was your age, television was called books. And this i...",Win (1 of 2)
57.,2011-11-08 19:50:11,115.99,99%,"O clear intelligence, force beyond all measure! Gentlemen, I...",Win (1 of 2)
56.,2011-11-08 19:49:35,117.09,97%,He rode past me and kept on goin'. Never said nothin' goin' ...,Win (1 of 2)
55.,2011-11-08 19:45:05,115.46,96%,"We turn away to face the cold, enduring chill, as the day be...",Win (1 of 4)
54.,2011-11-08 19:44:24,122.26,98%,I said that I would see you because I had heard that you wer...,Win (1 of 4)
53.,2011-11-08 19:43:38,128.40,98%,There's a piece of Maria in every song that I sing. And the ...,Win (1 of 3)
52.,2011-11-08 19:43:00,115.17,97%,"My name is Turkish. Funny name for an Englishman, I know. My...",Win (1 of 4)
51.,2011-11-08 19:42:08,119.19,99%,Unlike the other four senses located in the logical regions ...,Win (1 of 3)
50.,2011-11-08 19:41:30,120.12,97%,I thought climbing the Devil's Thumb would fix all that was ...,No win (2 of 3)
49.,2011-11-08 19:40:42,114.57,98%,"The term ""barbarian"" was created by the Greeks; it was origi...",Win (1 of 4)
48.,2011-11-08 19:40:05,100.21,92%,The beginner writes just twenty pieces. The professional wri...,No win (2 of 5)
47.,2011-11-08 19:39:12,119.12,99%,"This was the most delicious meal he'd had in recent years, a...",Win (1 of 3)
46.,2011-11-08 19:38:28,119.48,97%,"Often, we assume that a familiar situation will be but a rep...",Win (1 of 3)
45.,2011-11-08 19:36:45,124.53,99%,"If I leave here tomorrow, would you still remember me? For I...",Win (1 of 2)
44.,2011-11-08 19:35:03,106.71,99%,Glancing through the 1977 Atlanta Yellow Pages reveals a cit...,Win (1 of 3)
43.,2011-11-08 19:34:24,115.73,98%,"When I was a kid, you never saw radicchio in the produce sec...",Win (1 of 2)
42.,2011-11-08 19:33:36,118.79,98%,And I will strike down upon thee with great vengeance and fu...,Win (1 of 3)
41.,2011-11-08 19:32:57,124.43,99%,"She's got a smile that, it seems to me, reminds me of childh...",Win (1 of 4)
40.,2011-11-08 19:32:16,116.16,96%,Your inner child will be happy to know that when it comes to...,Win (1 of 4)
39.,2011-11-08 19:31:31,108.77,95%,Always do your best - your best is going to change from mome...,Win (1 of 2)
38.,2011-11-08 19:30:51,112.11,97%,The pathology of setting a deadline to the earliest articula...,Win (1 of 4)
37.,2011-11-08 19:30:01,123.31,98%,"But older than me now, more constant, more real, and the fur...",Win (1 of 3)
36.,2011-11-08 19:29:15,95.63,96%,"Prior to the 1970's, because the United States had long been...",Win (1 of 2)
35.,2011-11-08 19:28:07,97.10,92%,Overhead the albatross hangs motionless upon the air and dee...,No win (2 of 3)
34.,2011-11-08 19:26:44,115.40,99%,"And I said, I don't care if they lay me off either, because ...",No win (1 of 1)
33.,2011-11-08 16:18:23,101.90,95%,"""This man right here,"" McGuinness said, pointing at Kenna, ""...",Win (1 of 3)
32.,2011-11-08 16:17:22,104.76,94%,"Get it straight buster - I'm not here to say please, I'm her...",Win (1 of 3)
31.,2011-11-08 16:16:33,137.11,99%,"I'm so glad you came, I'm so glad you remembered, to see how...",Win (1 of 3)
30.,2011-11-08 16:15:51,104.76,94%,Quality humor doesn't just deliver one gag and then tax the ...,No win (2 of 4)
29.,2011-11-08 16:15:12,118.43,95%,"Well, the way they make shows is, they make one show. That s...",No win (2 of 2)
28.,2011-11-08 16:14:19,126.38,98%,The truth of the matter is that there are a lot of available...,Win (1 of 4)
27.,2011-11-08 16:13:13,117.51,96%,"Ever since I was a child, folks have thought they had me peg...",Win (1 of 4)
26.,2011-11-08 16:12:47,110.52,95%,The theory of music emphasizes the elements from which music...,No win (2 of 3)
25.,2011-11-08 16:12:00,118.37,96%,"I don't want tickets, I need you to find me a painting, a cl...",No win (2 of 3)
24.,2011-11-08 16:11:15,113.93,97%,We may climb into the thin and cold realm of pure geometry a...,Win (1 of 4)
23.,2011-11-08 16:10:39,113.34,98%,Many wines have more than 14 percent alcohol because the win...,No win (2 of 3)
22.,2011-11-08 16:09:40,118.49,98%,"Picking up the pieces, half alive in a nine 'til five, vacan...",Win (1 of 2)
21.,2011-11-08 16:08:57,114.41,97%,Well I woke in mid-afternoon cause that's when it all hurts ...,No win (2 of 3)
20.,2011-11-08 16:08:16,112.79,96%,At the time when Britain faced a plunge into chaos and darkn...,Win (1 of 2)
19.,2011-11-08 16:07:22,108.90,94%,It's the possibility of having a dream come true that makes ...,No win (4 of 5)
18.,2011-11-07 16:39:09,121.95,96%,"When the light of life has gone, no change for the meter. Th...",No win (3 of 5)
17.,2011-11-07 16:38:34,121.28,97%,"I'm so glad you came, I'm so glad you remembered, to see how...",No win (3 of 5)
16.,2011-11-07 16:38:07,100.73,93%,There's a hole in the world like a great black pit. And the ...,No win (3 of 3)
15.,2011-11-07 16:37:34,118.40,94%,If you're working out in front of a mirror and watching your...,No win (3 of 5)
14.,2011-11-07 16:36:49,133.99,100%,"A little boy went out to play. When he opened his door, he s...",Win (1 of 5)
13.,2011-11-07 16:36:09,114.44,97%,And I will strike down upon thee with great vengeance and fu...,No win (3 of 5)
12.,2011-11-07 16:35:35,118.17,99%,Mac knew the score even if Aunt Ella didn't. Shot through th...,No win (3 of 4)
11.,2011-11-07 16:34:46,114.29,97%,"He started running, up and up, until he hurled himself into ...",No win (2 of 3)
10.,2011-11-07 16:33:55,108.18,96%,It doesn't mean much to be able to filter out most present-d...,Win (1 of 3)
9.,2011-11-07 16:33:17,100.87,94%,"A lot of people, especially this one psychoanalyst guy they ...",Win (1 of 4)
8.,2011-11-07 16:32:25,100.58,95%,"No man is an island, entire of itself; every man is a piece ...",Win (1 of 5)
7.,2011-11-07 16:31:26,116.60,96%,I still see things that are not here. I just choose not to a...,Win (1 of 3)
6.,2011-11-07 16:30:47,100.24,95%,"My dog barks some. Mentally you picture my dog, but I have n...",No win (2 of 3)
5.,2011-11-07 16:30:11,116.21,98%,"A computer needs a manager to administer its operations, jus...",Win (1 of 2)
4.,2011-11-07 16:29:35,97.86,93%,The wine list looks so imposing that you finally give up lab...,Win (1 of 4)
3.,2011-11-07 16:28:32,108.77,97%,"You just couldn't let me go, could you? This is what happens...",Win (1 of 3)
2.,2011-11-07 16:27:42,92.57,92%,"Let's sort the buyers from the spiers, the needy from the gr...",Win (1 of 5)
1.,2011-11-07 16:26:18,100.83,94%,"My friend, I shall be pedagogic, and say you ought to start ...",Win (1 of 5)
