13.,2016-08-12 20:18:26,33.12,89%,"Under the headline ""Wonderful Typing,"" the New York Times re...",No win (2 of 5)
12.,2016-08-12 20:14:31,44.13,90%,For it is not enough to have a good mind; the main thing is ...,No win (3 of 3)
11.,2016-08-12 20:12:44,46.75,93%,"Many people limit themselves to leading boring, dull lives b...",No win (2 of 4)
10.,2016-08-12 20:10:53,39.97,88%,In order to face down the danger that is stalking us and mov...,No win (4 of 5)
9.,2016-08-12 20:08:35,55.58,98%,"I know what ""exacerbate"" means. There is not a word or a sen...",Win (1 of 3)
8.,2016-08-12 20:07:37,45.37,91%,"Other keyboard layouts have been created since, and some are...",No win (2 of 4)
7.,2016-08-12 20:06:18,39.00,87%,The beginner writes just twenty pieces. The professional wri...,No win (4 of 5)
6.,2016-08-12 16:31:35,45.91,91%,Step out the front door like a ghost into the fog where no o...,No win (5 of 5)
5.,2016-08-12 16:25:12,41.46,93%,The beginner writes just twenty pieces. The professional wri...,No win (4 of 5)
4.,2016-08-12 15:59:36,44.03,90%,"It is a period of civil war. Rebel spaceships, striking from...",No win (2 of 5)
3.,2016-08-12 15:57:22,43.87,90%,"In the late 1960s, a growing number of people became concern...",No win (3 of 3)
2.,2016-08-12 15:55:16,41.90,90%,"Like painting, most software is intended for a human audienc...",No win (4 of 4)
1.,2016-08-12 13:23:19,47.41,95%,"Because most of the 150,000 tons of gold ever mined is still...",Win (1 of 4)
