125.,2013-03-14 21:56:46,133.95,95%,"She's got a smile that, it seems to me, reminds me of childh...",No win (2 of 5)
124.,2013-03-14 21:56:08,132.59,94%,I must not fear. Fear is the mind killer. Fear is the little...,Win (1 of 5)
123.,2013-03-14 21:55:34,134.83,97%,"Has it been five years? Six? It seems like a lifetime, the k...",Win (1 of 5)
122.,2013-03-14 21:54:51,137.42,98%,"Yet one fine day, in a fit of euphoria, after he had picked ...",Win (1 of 5)
121.,2013-03-14 21:54:09,120.84,95%,"One respondent said ""For women - a lot of games are crap - t...",Win (1 of 4)
120.,2013-03-14 21:53:19,135.98,97%,"Ticking away the moments that make up a dull day, you fritte...",No win (2 of 5)
119.,2013-03-14 21:52:13,138.09,97%,"That fear had been inside him for many years, it had lived w...",Win (1 of 5)
118.,2013-03-14 21:50:44,116.16,95%,In order to become an elf I filled out ten pages' worth of f...,Win (1 of 4)
117.,2013-03-14 21:49:56,118.24,94%,Facts can be thought of as objective or subjective. Things a...,No win (3 of 5)
116.,2013-03-13 23:31:03,127.28,92%,"If you really want to hear about it, the first thing you'll ...",No win (2 of 3)
115.,2013-03-13 23:29:55,125.50,96%,I know that you weren't bored that day because there was a l...,Win (1 of 2)
114.,2013-03-13 23:29:03,119.70,98%,What? A swallow carrying a coconut? It's not a question of w...,Win (1 of 5)
113.,2013-03-13 23:28:20,135.59,96%,We sit silently and watch the world around us. This has take...,Win (1 of 5)
112.,2013-03-13 23:27:22,149.15,99%,The example of painting can teach us not only how to manage ...,Win (1 of 4)
111.,2013-03-13 23:25:44,146.48,96%,We've known each other for many years but this is the first ...,Win (1 of 3)
110.,2013-03-13 23:24:51,122.98,87%,"For centuries, the battle of morality was fought between tho...",No win (2 of 3)
109.,2013-03-13 23:23:54,126.11,91%,"Your face has fallen sad now, for you know the time is nigh....",Win (1 of 3)
108.,2013-03-13 23:22:55,121.91,97%,The truth of the matter is that there are a lot of available...,Win (1 of 2)
107.,2013-03-13 23:22:12,143.43,98%,Don't take anything personally - nothing others do is becaus...,Win (1 of 2)
106.,2013-03-13 23:21:03,135.18,85%,"I know a bloke who knows a bloke who knows a bloke. Now, I k...",Win (1 of 2)
105.,2013-03-13 23:20:31,137.25,93%,"Your face has fallen sad now, for you know the time is nigh....",Win (1 of 2)
104.,2013-03-13 23:19:37,133.29,94%,I've always wondered about this coat business. When I'm in a...,Win (1 of 3)
103.,2013-03-13 23:18:48,118.60,97%,"Now you might ask yourself, if by yourself you mean me, ""Ste...",No win (1 of 1)
102.,2013-03-13 23:18:02,140.97,96%,"If you really want to hear about it, the first thing you'll ...",Win (1 of 3)
101.,2013-03-13 23:16:23,153.93,95%,"For centuries, the battle of morality was fought between tho...",Win (1 of 3)
100.,2013-03-13 23:15:26,146.71,100%,I must not fear. Fear is the mind killer. Fear is the little...,Win (1 of 4)
99.,2013-03-13 23:14:46,138.81,96%,"Time is tricky. You have whole months, even years, when noth...",Win (1 of 2)
98.,2013-03-12 22:23:52,150.69,100%,"In the casino, the cardinal rule is to keep them playing and...",Win (1 of 3)
97.,2013-03-12 22:23:17,114.98,93%,The problem we now face is that this thin layer of atmospher...,No win (2 of 3)
96.,2013-03-12 22:22:18,119.13,95%,"That day, for no particular reason, I decided to go for a li...",No win (2 of 4)
95.,2013-03-12 22:21:32,123.29,96%,Groups of illegal miners smuggle themselves down in freight ...,Win (1 of 5)
94.,2013-03-12 22:20:07,122.64,95%,The truth of the matter is that there are a lot of available...,Win (1 of 2)
93.,2013-03-12 22:19:22,119.54,96%,"The world of typing has changed. In the 1970s, every busines...",Win (1 of 3)
92.,2013-03-12 22:18:30,138.33,97%,So it's all come back round to breaking apart again. Breakin...,Win (1 of 5)
91.,2013-03-12 22:17:41,138.45,98%,Let's face it: there are tons of things in your home and lif...,Win (1 of 4)
90.,2013-03-12 22:17:06,118.54,94%,If there is one thing the history of evolution has taught us...,Win (1 of 4)
89.,2013-03-12 22:16:16,126.96,92%,Being able to quit things that don't work is integral to bei...,Win (1 of 3)
88.,2013-03-12 22:13:37,136.34,93%,We've known each other for many years but this is the first ...,Win (1 of 2)
87.,2013-03-12 22:12:14,130.87,94%,He rode past me and kept on goin'. Never said nothin' goin' ...,No win (1 of 1)
86.,2013-03-12 22:11:08,120.32,93%,"When she returns to the forum page, her post is there. It is...",Win (1 of 4)
85.,2013-03-12 22:10:27,122.22,91%,But the two men were not lonely at all. At home they were co...,No win (2 of 2)
84.,2013-03-12 22:09:42,148.67,97%,The place to improve the world is first in one's own heart a...,Win (1 of 4)
83.,2013-03-12 22:09:01,130.74,97%,There is a theory which states that if anybody ever discover...,Win (1 of 5)
82.,2013-03-12 22:08:21,116.67,88%,You've got a way to keep me on your side. You give me cause ...,No win (2 of 3)
81.,2013-03-09 19:10:32,143.09,97%,We sit silently and watch the world around us. This has take...,Win (1 of 5)
80.,2013-03-09 19:09:26,141.39,95%,Let's face it: there are tons of things in your home and lif...,Win (1 of 3)
79.,2013-03-09 19:08:34,126.34,98%,"You just couldn't let me go, could you? This is what happens...",Win (1 of 3)
78.,2013-03-09 19:05:52,104.46,92%,In 1969 four computers located around the country were in co...,Win (1 of 4)
77.,2013-03-09 19:04:43,121.00,94%,I can already hear your tune calling me across the room. Whe...,No win (2 of 3)
76.,2013-03-09 19:03:45,103.21,96%,"So, I'm tending bar there at Ecklund & Swedlin's last Tu...",No win (2 of 4)
75.,2013-03-09 19:02:48,127.62,93%,Space is big. Really big. You just won't believe how vastly ...,No win (2 of 2)
74.,2013-03-09 19:01:51,130.03,95%,"That fear had been inside him for many years, it had lived w...",Win (1 of 2)
73.,2013-03-09 19:00:29,113.77,93%,"Kid, I've flown from one side of this galaxy to the other, a...",No win (2 of 4)
72.,2013-03-09 18:59:45,123.51,97%,"And though my journeys did take me to a great many states, a...",Win (1 of 4)
71.,2013-03-09 18:59:01,115.84,95%,The basis of the Aztecs' success in creating a great state a...,Win (1 of 2)
70.,2013-03-09 18:57:58,139.38,96%,"Has it been five years? Six? It seems like a lifetime, the k...",Win (1 of 3)
69.,2013-03-09 18:56:57,131.09,95%,"Let's sort the buyers from the spiers, the needy from the gr...",Win (1 of 4)
68.,2013-03-09 18:56:03,133.35,96%,"The Earth is a world, the world is a ball, a ball in a game ...",Win (1 of 3)
67.,2013-03-09 18:55:04,130.13,99%,A glooming peace this morning with it brings. The sun for so...,Win (1 of 3)
66.,2013-03-09 18:54:13,123.11,94%,"We turn away to face the cold, enduring chill, as the day be...",Win (1 of 5)
65.,2013-03-09 18:53:33,125.57,97%,"Because they're at the bottom of the scale, nerds are a safe...",Win (1 of 2)
64.,2013-03-09 18:52:44,109.17,95%,"Disillusion is the greatest gift I can give you. But, becaus...",Win (1 of 3)
63.,2013-03-09 18:51:47,129.47,93%,"I did my best, it wasn't much. I couldn't feel, so I tried t...",Win (1 of 2)
62.,2013-03-09 18:50:55,116.23,95%,"Common knowledge has bicyclists always riding into the wind,...",Win (1 of 2)
61.,2013-03-09 18:49:08,120.80,95%,"Thirdly, however, these wars could now be waged with the new...",Win (1 of 2)
60.,2013-03-09 18:48:15,98.31,89%,I sincerely believe that if women study male lessons on conc...,No win (2 of 2)
59.,2013-03-09 18:47:21,111.91,93%,I still see things that are not here. I just choose not to a...,Win (1 of 3)
58.,2013-03-09 18:46:33,144.89,97%,I must not fear. Fear is the mind killer. Fear is the little...,Win (1 of 4)
57.,2013-03-09 18:45:58,125.01,94%,"The Earth is a world, the world is a ball, a ball in a game ...",Win (1 of 4)
56.,2013-03-09 18:45:13,124.54,93%,"Many people limit themselves to leading boring, dull lives b...",Win (1 of 3)
55.,2013-03-09 18:44:23,132.84,97%,But speculations on the structure of the universe also move ...,Win (1 of 2)
54.,2013-03-08 18:52:39,95.78,91%,Quality humor doesn't just deliver one gag and then tax the ...,No win (2 of 3)
53.,2013-03-08 18:51:48,130.75,96%,Humans need to practice what they are learning a good deal b...,Win (1 of 5)
52.,2013-03-08 18:51:13,121.47,96%,I've flown seven million miles. And I've been waiting on peo...,Win (1 of 2)
51.,2013-03-08 18:50:11,125.78,92%,"But older than me now, more constant, more real, and the fur...",No win (3 of 3)
50.,2013-03-08 18:49:20,106.12,95%,"The term ""barbarian"" was created by the Greeks; it was origi...",Win (1 of 3)
49.,2013-03-08 18:48:41,118.72,86%,Good games offer players a set of challenging problems and t...,No win (2 of 2)
48.,2013-03-08 18:48:14,119.60,94%,Remembering you running soft through the night. You were big...,No win (2 of 3)
47.,2013-03-08 18:47:33,114.08,92%,"Padre, these are subtleties! We are not concerned with motiv...",No win (2 of 2)
46.,2013-03-08 18:46:33,120.79,93%,"Burning my bridges and smashing my mirrors, turning to see i...",Win (1 of 3)
45.,2013-03-08 18:45:38,125.77,99%,"Yes, the newspapers were right: snow was general all over Ir...",Win (1 of 5)
44.,2013-03-08 18:44:38,137.70,98%,"I rejected those answers; instead, I chose something differe...",Win (1 of 3)
43.,2013-03-08 18:43:41,112.71,93%,Instead of hiring workers during the peak hog kill in the wi...,Win (1 of 3)
42.,2013-03-08 18:42:48,135.76,98%,"Often, we assume that a familiar situation will be but a rep...",Win (1 of 3)
41.,2013-03-08 18:41:47,118.43,97%,I drew the blankets over my head and tried to think of Chris...,Win (1 of 4)
40.,2013-03-08 18:41:03,128.79,95%,It's the possibility of having a dream come true that makes ...,Win (1 of 2)
39.,2013-03-08 18:40:04,138.22,98%,"What good's a reward if you ain't around to use it? Besides,...",Win (1 of 3)
38.,2013-03-08 18:39:35,134.80,97%,"And in the world a heart of darkness, a firezone, where poet...",Win (1 of 5)
37.,2013-03-08 18:38:50,126.63,96%,The only preventive thing I do is wash clothes after buying ...,Win (1 of 5)
36.,2013-03-08 18:38:07,118.63,92%,I never said I would stay to the end - I knew I would leave ...,Win (1 of 5)
35.,2013-03-08 18:37:15,110.07,89%,From compositional considerations the tomato layer would be ...,No win (2 of 5)
34.,2013-03-08 18:36:36,118.74,94%,"Well, it just so happens, this hacienda comes with its very ...",No win (2 of 5)
33.,2013-03-08 18:35:56,138.02,98%,It's the possibility of having a dream come true that makes ...,Win (1 of 3)
32.,2013-03-08 18:35:15,131.47,97%,"Races are not won in the first corner; however, they are oft...",Win (1 of 5)
31.,2013-03-08 18:34:19,121.03,95%,These contests provided ample opportunity to demonstrate the...,No win (3 of 4)
30.,2013-03-08 18:33:25,118.12,98%,"Geometry sets out from certain conceptions such as ""plane,"" ...",Win (1 of 2)
29.,2013-03-08 18:32:15,124.60,93%,"We turn away to face the cold, enduring chill, as the day be...",Win (1 of 3)
28.,2013-03-08 18:03:11,138.20,97%,I said that I would see you because I had heard that you wer...,Win (1 of 4)
27.,2013-03-08 18:01:29,151.85,100%,"O clear intelligence, force beyond all measure! Gentlemen, I...",Win (1 of 5)
26.,2013-03-08 18:00:31,113.45,92%,"In general, many of these targets are easier marks if you ar...",Win (1 of 2)
25.,2013-03-08 17:59:18,108.82,96%,"She was a genius of sadness, immersing herself in it, separa...",No win (2 of 3)
24.,2013-03-08 17:57:59,135.46,95%,"Many people limit themselves to leading boring, dull lives b...",Win (1 of 4)
23.,2013-03-08 17:57:05,123.92,95%,Remembering you running soft through the night. You were big...,No win (2 of 3)
22.,2013-03-08 17:56:20,122.81,96%,Stab a sorry heart with your favorite finger. Paint the whol...,Win (1 of 2)
21.,2013-03-08 17:55:04,131.50,98%,"And in the world a heart of darkness, a firezone, where poet...",Win (1 of 4)
20.,2013-03-08 17:54:12,116.42,95%,"There are men who possess a peculiarly strong visual memory,...",No win (2 of 4)
19.,2013-03-08 17:53:29,130.04,95%,I will need my spectacles and a clear head. Today I broke my...,No win (2 of 5)
18.,2013-03-08 17:52:51,141.83,98%,"There is no pain, you are receding. A distant ship smoke on ...",Win (1 of 4)
17.,2013-03-08 17:52:04,124.43,96%,"I went to the woods because I wished to live deliberately, t...",No win (2 of 2)
16.,2013-03-08 17:51:25,131.75,96%,She's got eyes of the bluest skies as if they thought of rai...,No win (3 of 3)
15.,2013-03-08 17:50:43,105.15,90%,"I know that the idea of raising well-rounded, smarter kids c...",No win (3 of 3)
14.,2013-03-08 17:49:42,120.36,97%,"We turn away to face the cold, enduring chill, as the day be...",No win (3 of 3)
13.,2013-03-08 17:48:58,108.55,95%,"After the grapes are crushed, yeasts (tiny one-celled organi...",No win (2 of 4)
12.,2013-03-08 17:48:05,120.43,91%,"I hope that whoever you are, you escape this place. I hope t...",Win (1 of 4)
11.,2013-03-08 17:47:14,96.43,83%,"Let me get this straight. You think that your client, one of...",No win (3 of 3)
10.,2013-03-08 17:46:26,123.22,96%,If there is one thing the history of evolution has taught us...,No win (2 of 4)
9.,2013-03-08 17:45:42,125.39,95%,I can already hear your tune calling me across the room. Whe...,Win (1 of 3)
8.,2013-03-08 17:44:40,130.27,98%,I'm telling it like it is. Get used to it or put this book d...,Win (1 of 2)
7.,2013-03-08 17:43:45,110.18,93%,"King, eh? Very nice. And how'd you get that, eh? By exploiti...",Win (1 of 5)
6.,2013-03-08 17:42:43,123.01,98%,"Imagine this: Here we are, a plane full of grown human being...",Win (1 of 3)
5.,2013-03-08 17:41:44,139.92,99%,"The brain can be a tool. It can recall phone numbers, solve ...",Win (1 of 3)
4.,2013-03-08 17:40:44,127.01,97%,I've been thinking lots about my life and how quick I'd wash...,Win (1 of 5)
3.,2013-03-08 17:39:46,101.24,93%,"Whether you're a student, secretary, office administrator, m...",Win (1 of 3)
2.,2013-03-08 17:38:40,110.68,95%,To drive out of the Central Valley of California on a hot da...,Win (1 of 3)
1.,2013-03-08 17:37:07,110.09,95%,If there is one thing the history of evolution has taught us...,Win (1 of 5)
