351.,2013-10-01 22:06:53,124.89,93%,"The Earth is a world, the world is a ball, a ball in a game ...",No win (2 of 5)
350.,2013-10-01 22:06:23,133.53,96%,It is by will alone I set my mind in motion. It is by the ju...,No win (2 of 2)
349.,2013-10-01 22:05:02,143.27,96%,"If you don't get what you want, you suffer; if you get what ...",No win (2 of 3)
348.,2013-10-01 22:03:17,136.87,93%,Good games offer players a set of challenging problems and t...,No win (2 of 4)
347.,2013-10-01 22:01:40,149.94,99%,Don't make assumptions - find the courage to ask questions a...,Win (1 of 4)
346.,2013-10-01 22:01:10,132.65,96%,"Ultimately, this is not about solving your problems. It's ab...",No win (3 of 5)
345.,2013-10-01 21:58:56,144.08,94%,We've known each other for many years but this is the first ...,No win (2 of 3)
344.,2013-10-01 21:55:45,126.24,94%,"The brain can be a tool. It can recall phone numbers, solve ...",No win (3 of 3)
343.,2013-10-01 21:54:58,124.18,96%,"The idea of ""Mr. Right"" has been passed down over the genera...",No win (2 of 4)
342.,2013-10-01 21:54:07,139.66,99%,"The time I waited seemed endless, and I felt doubts and fear...",No win (2 of 4)
341.,2013-10-01 21:52:44,123.02,96%,Indonesia is a nation of islands - more than seventeen thous...,No win (3 of 4)
340.,2013-10-01 21:51:54,131.97,97%,Who has a safety deposit box full of money and six passports...,No win (3 of 3)
339.,2013-10-01 21:48:24,131.04,93%,"With no map to navigate one's life, some of us have stood st...",No win (2 of 2)
338.,2013-10-01 21:47:37,126.08,93%,Don't take anything personally - nothing others do is becaus...,Win (1 of 3)
337.,2013-10-01 21:46:14,149.73,98%,There's a hole in the world like a great black pit. And the ...,Win (1 of 3)
336.,2013-10-01 21:45:33,145.82,97%,Step out the front door like a ghost into the fog where no o...,Win (1 of 2)
335.,2013-09-30 22:35:24,127.54,97%,"Imagine considering ""if"" as a two-finger movement instead of...",Win (1 of 4)
334.,2013-09-30 22:31:27,126.54,96%,Although his voice was also broken by uncertainty and his ha...,No win (3 of 5)
333.,2013-09-30 22:29:18,124.57,92%,Focus your attention on the Now and tell me what problem you...,Win (1 of 2)
332.,2013-09-30 22:27:36,135.31,98%,Too often writers believe that they can emphasize words by p...,Win (1 of 5)
331.,2013-09-30 22:25:42,144.28,95%,"I hope that whoever you are, you escape this place. I hope t...",Win (1 of 4)
330.,2013-09-30 22:21:03,160.08,99%,"I'm so glad you came, I'm so glad you remembered, to see how...",No win (2 of 4)
329.,2013-09-30 22:20:35,143.90,97%,"When the light of life has gone, no change for the meter. Th...",No win (3 of 3)
328.,2013-09-30 22:18:20,144.63,98%,"And in the world a heart of darkness, a firezone, where poet...",Win (1 of 4)
327.,2013-09-30 22:16:50,131.83,92%,Humans need to practice what they are learning a good deal b...,No win (3 of 3)
326.,2013-09-30 22:15:05,131.53,96%,Let's face it: there are tons of things in your home and lif...,No win (3 of 5)
325.,2013-09-30 22:14:30,126.20,93%,There is something about yourself that you don't know. Somet...,No win (3 of 3)
324.,2013-09-30 22:13:48,141.99,97%,Many rivers to cross but I can't seem to find my way over. W...,Win (1 of 4)
323.,2013-09-30 22:12:49,123.81,94%,It's the possibility of having a dream come true that makes ...,No win (3 of 3)
322.,2013-09-30 22:11:33,127.84,95%,"Do you smell that? Napalm, son. Nothing else in the world sm...",No win (2 of 2)
321.,2013-09-30 22:10:53,136.35,96%,There's a piece of Maria in every song that I sing. And the ...,No win (3 of 4)
320.,2013-09-30 22:09:53,128.58,96%,The invention of the wheel represented a major turning point...,No win (2 of 4)
319.,2013-06-03 22:48:10,130.83,93%,"I went to the woods because I wished to live deliberately, t...",Win (1 of 3)
318.,2013-06-03 22:47:11,156.66,97%,I think you're gonna find - when all this stuff is over and ...,Win (1 of 3)
317.,2013-06-03 22:46:12,139.94,98%,"If you want to drive a race car well, whether to win an Indy...",Win (1 of 3)
316.,2013-06-03 22:45:17,140.28,95%,This business is filled to the brim with unrealistic people ...,Win (1 of 3)
315.,2013-06-03 22:43:14,123.18,95%,"Good games stay within, but at the outer edge, of the player...",Win (1 of 3)
314.,2013-06-03 22:42:36,125.43,94%,To drive out of the Central Valley of California on a hot da...,Win (1 of 2)
313.,2013-06-03 22:40:42,133.01,89%,So what's in this for you? Should you rush out in search of ...,Win (1 of 3)
312.,2013-06-03 22:39:48,130.25,95%,"There is no physical separation after the slicing, so that e...",Win (1 of 3)
311.,2013-06-03 22:39:01,154.05,98%,The place to improve the world is first in one's own heart a...,Win (1 of 2)
310.,2013-06-03 22:35:28,142.09,93%,I've been looking so long at these pictures of you that I al...,Win (1 of 2)
309.,2013-06-03 22:34:01,176.58,99%,I think you're gonna find - when all this stuff is over and ...,Win (1 of 3)
308.,2013-06-03 22:28:43,147.69,95%,"But older than me now, more constant, more real, and the fur...",Win (1 of 3)
307.,2013-06-03 22:27:54,168.06,100%,"The problem is, Willie, is that Charles and yourself are not...",Win (1 of 3)
306.,2013-04-26 19:53:15,137.80,91%,The example of painting can teach us not only how to manage ...,Win (1 of 5)
305.,2013-04-26 19:52:48,131.54,97%,"Well, it just so happens, this hacienda comes with its very ...",Win (1 of 4)
304.,2013-04-26 19:51:21,127.70,94%,And I don't believe in the existence of angels but looking a...,Win (1 of 2)
303.,2013-04-26 19:49:37,123.23,96%,Since the 1980s virtually all the sodas and most of the frui...,Win (1 of 5)
302.,2013-04-26 19:48:42,131.56,97%,The beginner writes just twenty pieces. The professional wri...,Win (1 of 4)
301.,2013-04-26 19:47:34,134.95,93%,"As if that blind rage had washed me clean, rid me of hope; f...",Win (1 of 3)
300.,2013-04-26 19:46:19,144.91,92%,Rhymes trap you into saying things you don't want to say. A ...,Win (1 of 2)
299.,2013-04-25 18:09:14,138.52,94%,"Your face has fallen sad now, for you know the time is nigh....",Win (1 of 3)
298.,2013-04-25 18:08:18,134.59,90%,The odds are that you will generally meet the worst of them....,Win (1 of 3)
297.,2013-04-25 18:06:27,145.37,97%,I've been thinking lots about my life and how quick I'd wash...,Win (1 of 3)
296.,2013-04-25 18:05:27,143.83,92%,Come sail your ships around me and burn your bridges down. W...,Win (1 of 3)
295.,2013-04-25 18:04:44,139.24,90%,"If you really want to hear about it, the first thing you'll ...",Win (1 of 3)
294.,2013-04-25 18:03:47,136.55,98%,The chemistry of an element is determined by the manner in w...,Win (1 of 2)
293.,2013-04-25 18:03:07,144.62,98%,"Contrary to the feminist cant, there are many things we can ...",Win (1 of 3)
292.,2013-04-25 18:00:05,141.73,93%,We've known each other for many years but this is the first ...,Win (1 of 4)
291.,2013-04-25 17:59:15,136.82,97%,Always do your best - your best is going to change from mome...,Win (1 of 2)
290.,2013-04-25 17:58:35,162.10,94%,I think you're gonna find - when all this stuff is over and ...,Win (1 of 2)
289.,2013-04-25 17:57:56,136.57,93%,One essential rule: make sure the joke is the last possible ...,Win (1 of 2)
288.,2013-04-25 17:18:22,141.77,94%,The unknown future rolls toward us. I face it for the first ...,Win (1 of 3)
287.,2013-04-25 17:16:37,162.82,99%,Being able to quit things that don't work is integral to bei...,Win (1 of 3)
286.,2013-04-25 17:15:46,140.70,93%,San Francisco in the middle sixties was a very special time ...,Win (1 of 3)
285.,2013-04-25 17:14:38,133.16,91%,"Ticking away the moments that make up a dull day, you fritte...",Win (1 of 3)
284.,2013-04-24 18:11:35,160.95,100%,Let's face it: there are tons of things in your home and lif...,Win (1 of 4)
283.,2013-04-24 18:09:55,141.69,96%,"Do you smell that? Napalm, son. Nothing else in the world sm...",Win (1 of 4)
282.,2013-04-24 18:09:25,137.44,92%,"The terminator wouldn't stop, it would never leave him. It w...",No win (2 of 4)
281.,2013-04-24 18:07:13,156.88,99%,Space is big. Really big. You just won't believe how vastly ...,Win (1 of 4)
280.,2013-04-24 18:05:45,155.50,99%,Now I want you to think and stop being a smart aleck. A man'...,Win (1 of 3)
279.,2013-04-24 18:03:56,149.12,91%,Rhymes trap you into saying things you don't want to say. A ...,No win (2 of 2)
278.,2013-04-24 18:00:37,155.38,98%,"Has it been five years? Six? It seems like a lifetime, the k...",Win (1 of 2)
277.,2013-04-24 17:59:32,145.14,95%,There is something about yourself that you don't know. Somet...,Win (1 of 4)
276.,2013-04-24 17:55:18,141.49,95%,If I'm curt with you it's because time is a factor. I think ...,No win (2 of 2)
275.,2013-04-24 17:54:48,130.88,90%,"The problem is, Willie, is that Charles and yourself are not...",No win (2 of 2)
274.,2013-04-24 17:52:28,166.51,99%,One essential rule: make sure the joke is the last possible ...,Win (1 of 2)
273.,2013-04-11 19:11:40,143.70,92%,"For centuries, the battle of morality was fought between tho...",Win (1 of 3)
272.,2013-04-11 19:10:00,149.75,95%,"I don't believe in an interventionist God, but I know, darli...",Win (1 of 3)
271.,2013-04-11 19:08:47,145.65,95%,"Your face has fallen sad now, for you know the time is nigh....",Win (1 of 3)
270.,2013-04-11 19:07:12,136.41,95%,"Today, you people are no longer maggots. Today, you are Mari...",Win (1 of 2)
269.,2013-04-07 00:38:23,127.27,97%,"He started running, up and up, until he hurled himself into ...",Win (1 of 5)
268.,2013-04-07 00:37:24,143.84,96%,"Many people limit themselves to leading boring, dull lives b...",Win (1 of 4)
267.,2013-04-07 00:36:43,123.92,92%,"Often, we assume that a familiar situation will be but a rep...",Win (1 of 2)
266.,2013-04-07 00:35:54,130.82,94%,So it's all come back round to breaking apart again. Breakin...,Win (1 of 5)
265.,2013-04-07 00:35:09,141.34,97%,"I went to the woods because I wished to live deliberately, t...",Win (1 of 3)
264.,2013-04-07 00:33:27,122.55,94%,"Life is not suffering; it's just that you will suffer it, ra...",Win (1 of 3)
263.,2013-04-07 00:32:43,154.45,98%,I must not fear. Fear is the mind killer. Fear is the little...,Win (1 of 5)
262.,2013-04-07 00:31:55,141.05,99%,I've seen things you people wouldn't believe. Attack ships o...,Win (1 of 4)
261.,2013-04-07 00:30:38,134.28,96%,"I don't believe in an interventionist God, but I know, darli...",No win (2 of 4)
260.,2013-04-07 00:29:54,143.88,98%,I said that I would see you because I had heard that you wer...,Win (1 of 4)
259.,2013-04-07 00:29:02,140.88,97%,"The less you do with the controls, the less chance of error....",Win (1 of 3)
258.,2013-04-07 00:27:04,147.14,98%,The most precious treasures we have in life are the images w...,Win (1 of 2)
257.,2013-04-07 00:25:19,133.46,99%,"Throughout my academic career, I'd given some pretty good ta...",Win (1 of 4)
256.,2013-04-07 00:24:48,119.59,92%,I know that you weren't bored that day because there was a l...,Win (1 of 4)
255.,2013-04-07 00:23:58,147.18,97%,Now I want you to think and stop being a smart aleck. A man'...,Win (1 of 2)
254.,2013-04-07 00:23:13,132.25,89%,Let me tell you why you're here. You're here because you kno...,Win (1 of 3)
253.,2013-04-07 00:22:30,125.45,94%,I am learning about twenty new Italian words a day. Where am...,Win (1 of 3)
252.,2013-04-07 00:21:48,146.69,92%,Remember that humor is written backwards. That means you fir...,Win (1 of 3)
251.,2013-04-07 00:20:53,136.33,97%,"When I really worry about something, I don't just fool aroun...",Win (1 of 2)
250.,2013-04-07 00:18:46,124.75,91%,I can already hear your tune calling me across the room. Whe...,Win (1 of 2)
249.,2013-04-07 00:17:47,138.13,88%,"For centuries, the battle of morality was fought between tho...",Win (1 of 2)
248.,2013-04-07 00:17:09,126.66,99%,Overhead the albatross hangs motionless upon the air and dee...,Win (1 of 2)
247.,2013-04-07 00:12:12,151.60,98%,Humans need to practice what they are learning a good deal b...,Win (1 of 3)
246.,2013-04-07 00:11:31,124.72,96%,"And though my journeys did take me to a great many states, a...",Win (1 of 3)
245.,2013-04-07 00:10:44,144.36,95%,I suddenly had the impression that I had been left all alone...,Win (1 of 3)
244.,2013-04-07 00:09:28,136.29,94%,"The Earth is a world, the world is a ball, a ball in a game ...",No win (2 of 4)
243.,2013-04-07 00:07:40,127.65,97%,"Whether they use the title or not, many lyrics have evocativ...",No win (2 of 4)
242.,2013-04-07 00:07:09,128.21,91%,If you're working out in front of a mirror and watching your...,Win (1 of 3)
241.,2013-04-07 00:06:19,152.04,98%,There's a piece of Maria in every song that I sing. And the ...,Win (1 of 2)
240.,2013-04-07 00:05:42,131.43,98%,If there is one thing the history of evolution has taught us...,Win (1 of 3)
239.,2013-04-07 00:04:11,122.51,87%,I've been looking so long at these pictures of you that I al...,Win (1 of 3)
238.,2013-04-07 00:03:35,141.82,96%,It was hard to toss things I had once thought were valuable ...,Win (1 of 4)
237.,2013-04-07 00:02:34,129.88,95%,"Whether they use the title or not, many lyrics have evocativ...",Win (1 of 2)
236.,2013-04-07 00:01:54,135.88,95%,"This planet has, or rather had, a problem, which was this: m...",Win (1 of 2)
235.,2013-04-07 00:01:04,125.82,96%,The Inca believed that if one did not give thanks and obedie...,Win (1 of 3)
234.,2013-04-07 00:00:27,127.26,96%,"When you are typing on a typewriter, your input appears dire...",Win (1 of 3)
233.,2013-04-06 23:57:54,129.50,97%,"I'd been walking for hours and, as usual, I'd lost track of ...",Win (1 of 3)
232.,2013-04-06 23:57:03,145.49,97%,"As if that blind rage had washed me clean, rid me of hope; f...",Win (1 of 3)
231.,2013-04-06 23:56:16,131.27,93%,"As if that blind rage had washed me clean, rid me of hope; f...",No win (2 of 3)
230.,2013-04-06 23:55:14,141.28,98%,I still see things that are not here. I just choose not to a...,Win (1 of 3)
229.,2013-04-02 21:40:04,165.29,100%,The example of painting can teach us not only how to manage ...,Win (1 of 3)
228.,2013-04-02 21:39:13,137.23,97%,I know that you weren't bored that day because there was a l...,No win (1 of 1)
227.,2013-04-02 21:37:31,139.28,98%,We all know people who are very bright but who do not always...,Win (1 of 5)
226.,2013-04-02 21:36:59,133.26,95%,"The Earth is a world, the world is a ball, a ball in a game ...",Win (1 of 3)
225.,2013-04-02 21:35:35,138.10,97%,I don't believe in painted roses or bleeding hearts while bu...,Win (1 of 2)
224.,2013-04-02 21:34:54,119.95,98%,"Ergonomics is a term that combines the Greek word ergon, mea...",Win (1 of 3)
223.,2013-04-02 21:34:17,120.79,89%,"Let's sort the buyers from the spiers, the needy from the gr...",No win (2 of 3)
222.,2013-04-02 21:33:21,141.63,95%,"Races are not won in the first corner; however, they are oft...",Win (1 of 4)
221.,2013-04-02 21:32:00,148.78,95%,"Your face has fallen sad now, for you know the time is nigh....",Win (1 of 5)
220.,2013-04-02 21:31:21,118.64,97%,So I'm two inches away from her. Her luscious lips part. Jus...,No win (2 of 3)
219.,2013-04-02 21:30:32,137.54,97%,Popularity is only partially about individual attractiveness...,Win (1 of 3)
218.,2013-04-02 21:29:53,116.73,95%,The chemistry of an element is determined by the manner in w...,No win (2 of 4)
217.,2013-04-02 21:29:18,130.83,93%,"You have a class of young strong men and women, and they wan...",Win (1 of 3)
216.,2013-04-02 21:27:47,141.88,99%,"Do you smell that? Napalm, son. Nothing else in the world sm...",Win (1 of 5)
215.,2013-03-27 17:01:56,126.04,89%,"On a manual typewriter, strike the key with a nice sharp str...",Win (1 of 4)
214.,2013-03-27 17:01:19,134.05,95%,"To evaluate an option from the other side's point of view, c...",Win (1 of 2)
213.,2013-03-27 17:00:43,126.10,94%,"She's got a smile that, it seems to me, reminds me of childh...",No win (3 of 4)
212.,2013-03-27 16:59:11,122.69,92%,Is it sweeter to exist only in the mind or to exist both in ...,Win (1 of 5)
211.,2013-03-27 16:57:52,117.25,93%,"The problem is, Willie, is that Charles and yourself are not...",No win (3 of 3)
210.,2013-03-27 16:57:15,133.95,98%,"Warmer water increases the moisture content of storms, and w...",Win (1 of 5)
209.,2013-03-27 16:56:00,151.24,99%,"The less you do with the controls, the less chance of error....",No win (2 of 2)
208.,2013-03-27 16:55:25,140.17,98%,"But older than me now, more constant, more real, and the fur...",No win (2 of 4)
207.,2013-03-27 16:54:54,117.06,94%,Commas and periods always go inside quotation marks. Colons ...,Win (1 of 5)
206.,2013-03-27 16:54:02,125.72,92%,"For centuries, the battle of morality was fought between tho...",No win (3 of 3)
205.,2013-03-27 16:53:20,132.29,97%,"And you know it's time to go, through the sleet and driving ...",No win (2 of 2)
204.,2013-03-27 16:52:38,124.19,96%,"Imagine a vast sheet of paper on which straight Lines, Trian...",No win (2 of 2)
203.,2013-03-27 16:50:53,149.10,99%,Humans need to practice what they are learning a good deal b...,No win (3 of 4)
202.,2013-03-27 16:50:23,115.83,93%,"No man is an island, entire of itself; every man is a piece ...",No win (3 of 4)
201.,2013-03-27 16:49:26,141.08,98%,It was one of those days when it's a minute away from snowin...,Win (1 of 3)
200.,2013-03-23 22:48:47,126.48,98%,All the blue light reflections that color my mind when I sle...,Win (1 of 2)
199.,2013-03-23 22:47:30,145.19,95%,Good games offer players a set of challenging problems and t...,Win (1 of 4)
198.,2013-03-23 22:46:09,143.26,98%,"For centuries, the battle of morality was fought between tho...",Win (1 of 2)
197.,2013-03-23 22:45:11,136.76,95%,So it's all come back round to breaking apart again. Breakin...,Win (1 of 3)
196.,2013-03-23 22:44:23,144.71,97%,"Right, I am going to tell you how this works. You're going i...",Win (1 of 2)
195.,2013-03-23 22:43:33,134.35,95%,Being able to quit things that don't work is integral to bei...,Win (1 of 3)
194.,2013-03-23 22:42:36,140.46,92%,Let me tell you why you're here. You're here because you kno...,Win (1 of 2)
193.,2013-03-23 22:41:20,133.25,95%,I don't know why he saved my life. Maybe in those last momen...,Win (1 of 4)
192.,2013-03-23 22:40:38,122.59,91%,We sit silently and watch the world around us. This has take...,No win (1 of 1)
191.,2013-03-23 22:39:29,141.07,96%,And then he calls me a jerk and says the last guy who though...,No win (2 of 3)
190.,2013-03-15 20:36:12,133.27,94%,He rode past me and kept on goin'. Never said nothin' goin' ...,Win (1 of 2)
189.,2013-03-15 20:34:16,151.10,98%,"No matter how bad things are, you can always make things wor...",Win (1 of 3)
188.,2013-03-15 20:33:29,122.78,96%,"Some pilots like the excitement of our missions, knowing tha...",No win (2 of 5)
187.,2013-03-15 20:32:48,122.29,93%,Humans need to practice what they are learning a good deal b...,Win (1 of 2)
186.,2013-03-15 20:31:10,127.24,95%,"People get ready, there's a train coming. You don't need no ...",Win (1 of 2)
185.,2013-03-15 20:29:59,149.96,93%,I've been looking so long at these pictures of you that I al...,Win (1 of 3)
184.,2013-03-15 20:29:08,145.71,95%,There's a piece of Maria in every song that I sing. And the ...,Win (1 of 3)
183.,2013-03-15 20:28:18,132.87,94%,We've known each other for many years but this is the first ...,Win (1 of 2)
182.,2013-03-15 20:24:10,142.63,99%,The most precious treasures we have in life are the images w...,No win (2 of 5)
181.,2013-03-15 20:22:29,153.06,96%,"For centuries, the battle of morality was fought between tho...",Win (1 of 2)
180.,2013-03-15 20:19:33,149.26,95%,All time is all time. It does not change. It does not lend i...,Win (1 of 2)
179.,2013-03-14 22:57:43,135.49,98%,All the blue light reflections that color my mind when I sle...,Win (1 of 3)
178.,2013-03-14 22:57:00,150.34,98%,Don't make assumptions - find the courage to ask questions a...,Win (1 of 3)
177.,2013-03-14 22:56:14,135.02,92%,"One day you're in a funk about things, telling a friend that...",No win (2 of 3)
176.,2013-03-14 22:55:05,151.90,99%,"But no matter how effective the lesson was, I never really u...",Win (1 of 2)
175.,2013-03-14 22:54:24,137.66,96%,"Today, you people are no longer maggots. Today, you are Mari...",Win (1 of 2)
174.,2013-03-14 22:53:33,142.45,95%,I've been thinking lots about my life and how quick I'd wash...,Win (1 of 3)
173.,2013-03-14 22:52:07,126.31,97%,"Trudging slowly over wet sand, back to the bench where your ...",Win (1 of 3)
172.,2013-03-14 22:51:32,135.26,96%,"And in the world a heart of darkness, a firezone, where poet...",Win (1 of 3)
171.,2013-03-14 22:50:57,137.21,96%,I know that you weren't bored that day because there was a l...,Win (1 of 2)
170.,2013-03-14 22:50:16,124.71,96%,"The problem is, Willie, is that Charles and yourself are not...",Win (1 of 2)
169.,2013-03-14 22:49:43,134.95,94%,"If you really want to hear about it, the first thing you'll ...",Win (1 of 3)
168.,2013-03-14 22:48:21,131.14,99%,I don't believe in painted roses or bleeding hearts while bu...,Win (1 of 3)
167.,2013-03-14 22:46:43,122.07,94%,"There is no physical separation after the slicing, so that e...",Win (1 of 3)
166.,2013-03-14 22:45:59,129.69,95%,The truth of the matter is that there are a lot of available...,Win (1 of 2)
165.,2013-03-14 22:44:24,138.21,96%,He rode past me and kept on goin'. Never said nothin' goin' ...,Win (1 of 2)
164.,2013-03-14 22:43:20,127.96,95%,I remember when we used to sit in the government yard in Tre...,Win (1 of 2)
163.,2013-03-14 22:42:36,134.48,95%,"When I was your age, television was called books. And this i...",Win (1 of 3)
162.,2013-03-14 22:41:46,132.73,94%,I must not fear. Fear is the mind killer. Fear is the little...,Win (1 of 4)
161.,2013-03-14 22:38:42,135.99,94%,There is something about yourself that you don't know. Somet...,Win (1 of 5)
160.,2013-03-14 22:36:47,160.86,100%,"When I was your age, television was called books. And this i...",No win (2 of 2)
159.,2013-03-14 22:36:16,117.42,90%,You've got a way to keep me on your side. You give me cause ...,No win (2 of 2)
158.,2013-03-14 22:35:42,142.72,98%,"Many people limit themselves to leading boring, dull lives b...",No win (2 of 2)
157.,2013-03-14 22:34:59,131.55,90%,Let me tell you why you're here. You're here because you kno...,No win (3 of 4)
156.,2013-03-14 22:34:10,135.19,98%,"They say that right after God created man, he took a rib fro...",No win (2 of 2)
155.,2013-03-14 22:33:34,128.71,96%,"I don't want tickets, I need you to find me a painting, a cl...",Win (1 of 2)
154.,2013-03-14 22:32:42,135.95,95%,"Time is tricky. You have whole months, even years, when noth...",No win (2 of 4)
153.,2013-03-14 22:31:56,141.33,95%,If you're working out in front of a mirror and watching your...,Win (1 of 4)
152.,2013-03-14 22:31:05,132.21,97%,The unknown future rolls toward us. I face it for the first ...,Win (1 of 3)
151.,2013-03-14 22:30:26,144.77,97%,"No matter how bad things are, you can always make things wor...",Win (1 of 2)
150.,2013-03-14 22:29:36,124.22,81%,"I know a bloke who knows a bloke who knows a bloke. Now, I k...",Win (1 of 4)
149.,2013-03-14 22:28:10,155.15,99%,The example of painting can teach us not only how to manage ...,No win (2 of 4)
148.,2013-03-14 22:27:37,130.19,94%,"Well, the way they make shows is, they make one show. That s...",Win (1 of 5)
147.,2013-03-14 22:25:24,123.42,93%,"And I said, I don't care if they lay me off either, because ...",Win (1 of 5)
146.,2013-03-14 22:24:23,128.83,96%,"Warmer water increases the moisture content of storms, and w...",Win (1 of 5)
145.,2013-03-14 22:23:17,131.77,92%,All time is all time. It does not change. It does not lend i...,Win (1 of 3)
144.,2013-03-14 22:22:03,130.48,94%,There's sometimes a buggy. How many drivers does a buggy hav...,Win (1 of 3)
143.,2013-03-14 22:20:51,130.46,97%,"Ultimately, this is not about solving your problems. It's ab...",Win (1 of 3)
142.,2013-03-14 22:20:17,128.60,93%,I've been thinking lots about my life and how quick I'd wash...,Win (1 of 2)
141.,2013-03-14 22:19:29,123.32,91%,"I had a job, I had a girl. I had something going, mister, in...",Win (1 of 3)
140.,2013-03-14 22:18:32,138.48,94%,"But no matter how effective the lesson was, I never really u...",Win (1 of 2)
139.,2013-03-14 22:17:51,117.01,90%,Don't make assumptions - find the courage to ask questions a...,Win (1 of 3)
138.,2013-03-14 22:13:55,120.04,93%,For it is not enough to have a good mind; the main thing is ...,No win (1 of 1)
137.,2013-03-14 22:11:39,131.19,97%,"The problem is, Willie, is that Charles and yourself are not...",Win (1 of 2)
136.,2013-03-14 22:10:08,142.33,96%,We've known each other for many years but this is the first ...,Win (1 of 3)
135.,2013-03-14 22:08:45,141.04,98%,I will need my spectacles and a clear head. Today I broke my...,Win (1 of 3)
134.,2013-03-14 22:05:35,127.92,96%,"This planet has, or rather had, a problem, which was this: m...",No win (2 of 5)
133.,2013-03-14 22:04:43,138.85,98%,"The sooner your kids appreciate the value of work, the more ...",No win (2 of 5)
132.,2013-03-14 22:03:58,135.88,97%,How many roads must a man walk down before you call him a ma...,No win (2 of 5)
131.,2013-03-14 22:03:18,121.56,96%,I know that you weren't bored that day because there was a l...,Win (1 of 2)
130.,2013-03-14 22:02:31,134.05,91%,"You have a class of young strong men and women, and they wan...",Win (1 of 3)
129.,2013-03-14 22:01:51,140.10,98%,"Look and think as far ahead as possible. Often, a driver's n...",Win (1 of 3)
128.,2013-03-14 22:01:07,130.87,97%,"I often see racers, particularly at the back of the pack in ...",No win (2 of 3)
127.,2013-03-14 21:58:12,132.48,98%,"In May 1980, Fidel Castro opened the harbor at Mariel, Cuba ...",Win (1 of 5)
126.,2013-03-14 21:57:25,129.89,96%,"The time I waited seemed endless, and I felt doubts and fear...",Win (1 of 5)
