578.,2013-10-14 22:39:09,145.97,98%,The odds are that you will generally meet the worst of them....,Win (1 of 3)
577.,2013-10-14 22:36:30,159.27,97%,Let me tell you why you're here. You're here because you kno...,Win (1 of 4)
576.,2013-10-14 22:35:24,136.31,87%,"I know a bloke who knows a bloke who knows a bloke. Now, I k...",No win (2 of 4)
575.,2013-10-14 22:34:45,126.72,96%,"If I leave here tomorrow, would you still remember me? For I...",Win (1 of 3)
574.,2013-10-14 22:32:59,139.64,99%,"Ticking away the moments that make up a dull day, you fritte...",No win (3 of 4)
573.,2013-10-14 22:31:07,129.43,92%,"When the light of life has gone, no change for the meter. Th...",Win (1 of 3)
572.,2013-10-14 22:29:42,126.42,93%,Since every piece of matter in the Universe is in some way a...,Win (1 of 3)
571.,2013-10-14 22:28:53,155.73,96%,I've been looking so long at these pictures of you that I al...,Win (1 of 2)
570.,2013-10-14 22:28:18,136.88,95%,"But no matter how effective the lesson was, I never really u...",Win (1 of 2)
569.,2013-10-14 22:27:41,143.04,96%,Although the United Nations does not have the power to enfor...,No win (2 of 2)
568.,2013-10-14 22:26:21,158.72,99%,There is something about yourself that you don't know. Somet...,Win (1 of 3)
567.,2013-10-14 22:25:19,132.08,98%,It is greatly to America's advantage that it is a congenial ...,Win (1 of 2)
566.,2013-10-14 22:24:39,137.92,97%,With the coming of Dean Moriarty began the part of my life y...,Win (1 of 2)
565.,2013-10-14 22:23:26,143.06,96%,But the two men were not lonely at all. At home they were co...,Win (1 of 2)
564.,2013-10-14 22:20:02,145.41,96%,I've been thinking lots about my life and how quick I'd wash...,Win (1 of 2)
563.,2013-10-14 22:19:14,138.06,94%,"I had a job, I had a girl. I had something going, mister, in...",Win (1 of 3)
562.,2013-10-14 18:13:04,139.42,98%,Come sail your ships around me and burn your bridges down. W...,Win (1 of 5)
561.,2013-10-14 18:10:34,155.06,97%,I have quit three jobs and been fired from all the rest. Get...,Win (1 of 5)
560.,2013-10-14 18:09:02,151.67,96%,"One day you're in a funk about things, telling a friend that...",Win (1 of 3)
559.,2013-10-14 18:08:07,143.95,99%,I don't know why he saved my life. Maybe in those last momen...,Win (1 of 3)
558.,2013-10-14 18:06:03,147.12,99%,"And you know it's time to go, through the sleet and driving ...",Win (1 of 2)
557.,2013-10-14 18:05:28,141.01,96%,If I'm curt with you it's because time is a factor. I think ...,Win (1 of 2)
556.,2013-10-13 22:44:24,138.39,98%,Mac knew the score even if Aunt Ella didn't. Shot through th...,Win (1 of 3)
555.,2013-10-13 22:36:27,133.42,99%,"Tis but thy name that is my enemy. Thou art thyself, though ...",No win (2 of 2)
554.,2013-10-13 17:28:36,177.74,100%,I've been looking so long at these pictures of you that I al...,Win (1 of 5)
553.,2013-10-13 17:27:20,155.52,100%,I can already hear your tune calling me across the room. Whe...,Win (1 of 3)
552.,2013-10-13 17:24:36,144.05,95%,You've got a way to keep me on your side. You give me cause ...,Win (1 of 2)
551.,2013-10-13 17:23:38,164.06,100%,I must not fear. Fear is the mind killer. Fear is the little...,Win (1 of 4)
550.,2013-10-13 17:22:38,143.45,98%,This business is filled to the brim with unrealistic people ...,Win (1 of 3)
549.,2013-10-13 17:20:37,153.97,99%,The truth of the matter is that there are a lot of available...,Win (1 of 3)
548.,2013-10-13 17:18:33,150.15,93%,"For centuries, the battle of morality was fought between tho...",Win (1 of 2)
547.,2013-10-13 17:16:14,161.20,98%,Let me tell you why you're here. You're here because you kno...,Win (1 of 4)
546.,2013-10-13 16:56:32,132.18,98%,Your faith was strong but you needed proof. You saw her bath...,No win (2 of 3)
545.,2013-10-13 16:49:30,149.89,99%,"Right, I am going to tell you how this works. You're going i...",Win (1 of 3)
544.,2013-10-13 16:48:11,140.80,96%,Let's face it: there are tons of things in your home and lif...,Win (1 of 2)
543.,2013-10-13 16:47:04,144.26,97%,I've seen things you people wouldn't believe. Attack ships o...,Win (1 of 3)
542.,2013-10-13 16:42:12,211.65,99%,Good games offer players a set of challenging problems and t...,Win (1 of 2)
541.,2013-10-13 16:41:03,167.07,99%,"I had a job, I had a girl. I had something going, mister, in...",Win (1 of 2)
540.,2013-10-13 16:40:02,140.68,99%,"My name is Turkish. Funny name for an Englishman, I know. My...",No win (1 of 1)
539.,2013-10-13 16:39:29,148.16,97%,"In the casino, the cardinal rule is to keep them playing and...",No win (2 of 2)
538.,2013-10-13 16:38:36,140.23,99%,"He's got a two day head start on you, which is more than he ...",Win (1 of 3)
537.,2013-10-13 16:34:51,142.28,98%,"Let's sort the buyers from the spiers, the needy from the gr...",No win (1 of 1)
536.,2013-10-13 16:33:40,135.52,97%,It is by will alone I set my mind in motion. It is by the ju...,Win (1 of 4)
535.,2013-10-13 16:33:10,146.40,95%,"The terminator wouldn't stop, it would never leave him. It w...",Win (1 of 3)
534.,2013-10-13 16:31:59,161.47,99%,We've known each other for many years but this is the first ...,Win (1 of 2)
533.,2013-10-13 16:31:06,170.84,99%,"For centuries, the battle of morality was fought between tho...",Win (1 of 3)
532.,2013-10-13 16:30:03,136.79,93%,There are very few things I wish I could change about those ...,Win (1 of 3)
531.,2013-10-13 16:28:47,160.00,97%,"For centuries, the battle of morality was fought between tho...",Win (1 of 3)
530.,2013-10-13 16:27:50,145.61,97%,Focus your attention on the Now and tell me what problem you...,Win (1 of 3)
529.,2013-10-13 16:26:45,174.26,92%,"I know a bloke who knows a bloke who knows a bloke. Now, I k...",No win (1 of 1)
528.,2013-10-13 16:22:53,155.56,99%,Being able to quit things that don't work is integral to bei...,Win (1 of 3)
527.,2013-10-13 16:22:08,146.87,99%,"Life is not suffering; it's just that you will suffer it, ra...",No win (1 of 1)
526.,2013-10-13 16:21:40,140.68,99%,"When Betty and Billy fell asleep, he walked down to the kitc...",Win (1 of 4)
525.,2013-10-13 16:20:56,132.63,97%,"O clear intelligence, force beyond all measure! Gentlemen, I...",Win (1 of 4)
524.,2013-10-13 16:20:25,146.55,90%,Remember that humor is written backwards. That means you fir...,Win (1 of 3)
523.,2013-10-13 16:19:39,143.65,97%,It is possible that I already had some presentiment of my fu...,Win (1 of 4)
522.,2013-10-13 16:13:38,156.48,98%,There are very few things I wish I could change about those ...,Win (1 of 3)
521.,2013-10-13 16:12:45,152.93,99%,I think you're gonna find - when all this stuff is over and ...,Win (1 of 5)
520.,2013-10-13 16:11:06,135.92,92%,Don't take anything personally - nothing others do is becaus...,Win (1 of 3)
519.,2013-10-13 16:10:24,128.55,94%,"And in the world a heart of darkness, a firezone, where poet...",Win (1 of 3)
518.,2013-10-13 16:08:59,151.37,98%,Come sail your ships around me and burn your bridges down. W...,Win (1 of 2)
517.,2013-10-13 16:06:44,130.23,91%,"That fear had been inside him for many years, it had lived w...",Win (1 of 2)
516.,2013-10-13 16:05:59,137.80,96%,Is it sweeter to exist only in the mind or to exist both in ...,Win (1 of 2)
515.,2013-10-13 16:05:15,122.61,97%,The basis of the Aztecs' success in creating a great state a...,Win (1 of 3)
514.,2013-10-13 16:04:27,139.37,99%,"You found paradise in America. You had a good trade, made a ...",Win (1 of 2)
513.,2013-10-13 16:03:35,131.59,97%,Instead of hiring workers during the peak hog kill in the wi...,Win (1 of 5)
512.,2013-10-13 16:02:43,140.52,95%,I said that I would see you because I had heard that you wer...,Win (1 of 4)
511.,2013-10-13 16:01:14,166.90,100%,"Your face has fallen sad now, for you know the time is nigh....",Win (1 of 3)
510.,2013-10-13 15:59:57,122.55,97%,Few smart kids can spare the attention that popularity requi...,Win (1 of 2)
509.,2013-10-13 15:59:03,137.17,96%,There are very few things I wish I could change about those ...,Win (1 of 2)
508.,2013-10-13 15:57:23,134.53,98%,"A little boy went out to play. When he opened his door, he s...",Win (1 of 3)
507.,2013-10-11 22:43:34,141.71,95%,I have quit three jobs and been fired from all the rest. Get...,Win (1 of 3)
506.,2013-10-11 22:42:43,145.87,97%,We've known each other for many years but this is the first ...,Win (1 of 2)
505.,2013-10-11 22:39:00,156.66,98%,Let's face it: there are tons of things in your home and lif...,Win (1 of 4)
504.,2013-10-11 22:38:18,143.95,97%,Don't make assumptions - find the courage to ask questions a...,Win (1 of 3)
503.,2013-10-11 22:35:27,134.04,97%,"Look, you should admit to yourself that Microsoft will miss ...",Win (1 of 3)
502.,2013-10-11 22:34:52,146.69,95%,Being able to quit things that don't work is integral to bei...,No win (2 of 4)
501.,2013-10-11 22:33:48,147.65,89%,"I know a bloke who knows a bloke who knows a bloke. Now, I k...",Win (1 of 4)
500.,2013-10-11 22:31:36,141.47,99%,"The idea of ""Mr. Right"" has been passed down over the genera...",Win (1 of 4)
499.,2013-10-11 22:30:48,147.46,95%,"If you really want to hear about it, the first thing you'll ...",No win (3 of 5)
498.,2013-10-11 22:28:37,139.89,95%,The odds are that you will generally meet the worst of them....,No win (2 of 4)
497.,2013-10-11 22:27:35,147.42,98%,He rode past me and kept on goin'. Never said nothin' goin' ...,No win (2 of 4)
496.,2013-10-11 22:26:34,141.06,96%,A glooming peace this morning with it brings. The sun for so...,No win (2 of 4)
495.,2013-10-11 22:25:47,162.46,99%,"I don't believe in an interventionist God, but I know, darli...",No win (2 of 2)
494.,2013-10-11 22:24:36,137.36,96%,"It was a marvelous night, the sort of night one only experie...",Win (1 of 2)
493.,2013-10-11 22:23:45,136.67,96%,We've known each other for many years but this is the first ...,Win (1 of 2)
492.,2013-10-11 21:38:43,143.38,96%,"On a manual typewriter, strike the key with a nice sharp str...",Win (1 of 2)
491.,2013-10-11 21:38:08,157.29,99%,I've been thinking lots about my life and how quick I'd wash...,Win (1 of 3)
490.,2013-10-11 21:37:23,159.18,98%,We've known each other for many years but this is the first ...,Win (1 of 3)
489.,2013-10-11 21:36:40,137.92,95%,"Life is not suffering; it's just that you will suffer it, ra...",No win (2 of 3)
488.,2013-10-11 21:35:04,138.81,96%,"If you really want to hear about it, the first thing you'll ...",No win (2 of 2)
487.,2013-10-11 21:34:17,148.91,99%,I've always wondered about this coat business. When I'm in a...,Win (1 of 2)
486.,2013-10-11 21:33:22,157.52,99%,There is something about yourself that you don't know. Somet...,Win (1 of 4)
485.,2013-10-11 21:32:16,123.46,93%,"Kid, I've flown from one side of this galaxy to the other, a...",No win (2 of 3)
484.,2013-10-11 21:31:20,133.42,97%,"After removal from the oven, the pizza is sliced and plated ...",Win (1 of 4)
483.,2013-10-11 21:30:38,144.92,96%,"If you really want to hear about it, the first thing you'll ...",Win (1 of 3)
482.,2013-10-11 21:29:44,143.34,96%,Come sail your ships around me and burn your bridges down. W...,Win (1 of 4)
481.,2013-10-11 21:27:30,151.11,97%,"I'm so glad you came, I'm so glad you remembered, to see how...",Win (1 of 2)
480.,2013-10-11 21:26:18,151.45,93%,Rhymes trap you into saying things you don't want to say. A ...,Win (1 of 4)
479.,2013-10-11 21:23:49,148.99,96%,And I don't believe in the existence of angels but looking a...,Win (1 of 3)
478.,2013-10-11 21:22:05,170.51,100%,But the two men were not lonely at all. At home they were co...,Win (1 of 4)
477.,2013-10-11 21:21:02,140.49,94%,San Francisco in the middle sixties was a very special time ...,Win (1 of 2)
476.,2013-10-11 21:04:45,165.73,99%,I've been looking so long at these pictures of you that I al...,Win (1 of 3)
475.,2013-10-11 21:03:50,173.39,95%,"I know a bloke who knows a bloke who knows a bloke. Now, I k...",Win (1 of 3)
474.,2013-10-11 21:00:45,151.45,94%,I think you're gonna find - when all this stuff is over and ...,Win (1 of 3)
473.,2013-10-11 20:58:45,147.47,98%,Even the best-designed chair won't make up for bad posture. ...,Win (1 of 2)
472.,2013-10-11 20:57:18,169.24,99%,I think you're gonna find - when all this stuff is over and ...,Win (1 of 4)
471.,2013-10-11 20:54:11,190.53,100%,"I know a bloke who knows a bloke who knows a bloke. Now, I k...",Win (1 of 3)
470.,2013-10-11 20:53:03,150.21,94%,I think you're gonna find - when all this stuff is over and ...,Win (1 of 3)
469.,2013-10-11 20:51:14,133.16,97%,I had the impression of being abandoned by everyone when the...,Win (1 of 2)
468.,2013-10-11 19:40:18,152.99,98%,"One day you're in a funk about things, telling a friend that...",Win (1 of 3)
467.,2013-10-11 19:30:52,146.87,98%,It was one of those days when it's a minute away from snowin...,Win (1 of 2)
466.,2013-10-10 21:22:31,135.99,98%,"My dog barks some. Mentally you picture my dog, but I have n...",Win (1 of 2)
465.,2013-10-10 21:21:55,146.62,95%,All time is all time. It does not change. It does not lend i...,Win (1 of 2)
464.,2013-10-10 21:21:19,149.28,97%,"Look and think as far ahead as possible. Often, a driver's n...",Win (1 of 3)
463.,2013-10-10 21:17:39,143.58,98%,The truth of the matter is that there are a lot of available...,Win (1 of 4)
462.,2013-10-10 21:16:12,143.45,99%,I know that you weren't bored that day because there was a l...,Win (1 of 2)
461.,2013-10-10 21:14:22,162.38,99%,The place to improve the world is first in one's own heart a...,Win (1 of 4)
460.,2013-10-10 21:13:12,139.01,97%,Be impeccable with your word - speak with integrity. Say onl...,Win (1 of 2)
459.,2013-10-10 21:12:34,153.48,97%,"I had a job, I had a girl. I had something going, mister, in...",Win (1 of 3)
458.,2013-10-10 21:11:32,146.79,94%,Rhymes trap you into saying things you don't want to say. A ...,Win (1 of 2)
457.,2013-10-10 21:10:36,151.85,95%,"One day you're in a funk about things, telling a friend that...",Win (1 of 3)
456.,2013-10-10 21:08:57,150.97,99%,It was one of those days when it's a minute away from snowin...,Win (1 of 2)
455.,2013-10-10 21:07:33,152.30,96%,Don't take anything personally - nothing others do is becaus...,Win (1 of 3)
454.,2013-10-10 21:06:48,168.07,100%,A glooming peace this morning with it brings. The sun for so...,Win (1 of 3)
453.,2013-10-10 21:05:52,155.00,96%,"I'm so glad you came, I'm so glad you remembered, to see how...",Win (1 of 2)
452.,2013-10-10 21:04:47,171.31,99%,You've got a way to keep me on your side. You give me cause ...,Win (1 of 3)
451.,2013-10-10 21:03:32,140.51,95%,The ultimate way to compose is to be able to keyboard as fas...,Win (1 of 4)
450.,2013-10-10 21:01:53,161.60,99%,There's a piece of Maria in every song that I sing. And the ...,Win (1 of 3)
449.,2013-10-10 21:00:46,140.24,97%,Being able to quit things that don't work is integral to bei...,No win (2 of 5)
448.,2013-10-10 20:59:48,126.09,95%,"Whether you're a student, secretary, office administrator, m...",No win (2 of 3)
447.,2013-10-10 20:59:10,143.24,97%,Is it sweeter to exist only in the mind or to exist both in ...,Win (1 of 3)
446.,2013-10-10 20:57:35,124.50,97%,"The Orient was almost a European invention, and had been sin...",Win (1 of 3)
445.,2013-10-10 20:56:59,135.09,97%,"Ultimately, this is not about solving your problems. It's ab...",No win (2 of 4)
444.,2013-10-10 20:55:37,148.46,98%,San Francisco in the middle sixties was a very special time ...,No win (2 of 2)
443.,2013-10-10 20:46:08,136.95,97%,Focus your attention on the Now and tell me what problem you...,No win (2 of 2)
442.,2013-10-10 20:45:19,148.91,95%,Let me tell you why you're here. You're here because you kno...,Win (1 of 3)
441.,2013-10-10 20:44:22,144.43,99%,I've always wondered about this coat business. When I'm in a...,Win (1 of 2)
440.,2013-10-10 20:43:27,149.16,98%,"When I really worry about something, I don't just fool aroun...",Win (1 of 3)
439.,2013-10-10 20:42:56,130.53,95%,"Burning my bridges and smashing my mirrors, turning to see i...",No win (2 of 2)
438.,2013-10-10 20:42:12,162.81,100%,"I'm so glad you came, I'm so glad you remembered, to see how...",Win (1 of 2)
437.,2013-10-10 20:41:00,127.58,95%,I've flown seven million miles. And I've been waiting on peo...,No win (2 of 3)
436.,2013-10-10 20:40:06,148.29,100%,One essential rule: make sure the joke is the last possible ...,Win (1 of 3)
435.,2013-10-10 20:38:19,140.36,98%,I don't know why he saved my life. Maybe in those last momen...,Win (1 of 5)
434.,2013-10-10 20:36:52,126.12,96%,"Thirdly, however, these wars could now be waged with the new...",No win (2 of 3)
433.,2013-10-10 20:36:10,123.79,97%,Overhead the albatross hangs motionless upon the air and dee...,Win (1 of 5)
432.,2013-10-10 20:35:29,144.10,100%,"It's a sunny, woodsy day in Lumberton, so get those chainsaw...",Win (1 of 3)
431.,2013-10-10 20:34:52,136.81,97%,And then he calls me a jerk and says the last guy who though...,Win (1 of 3)
430.,2013-10-10 20:34:11,135.99,97%,"When I was your age, television was called books. And this i...",Win (1 of 3)
429.,2013-10-10 20:33:16,141.49,97%,A glooming peace this morning with it brings. The sun for so...,Win (1 of 3)
428.,2013-10-10 20:31:44,152.85,99%,Don't make assumptions - find the courage to ask questions a...,Win (1 of 2)
427.,2013-10-10 20:30:45,157.41,99%,The place to improve the world is first in one's own heart a...,Win (1 of 3)
426.,2013-10-10 20:29:56,143.58,98%,"She's got a smile that, it seems to me, reminds me of childh...",Win (1 of 2)
425.,2013-10-10 20:29:15,141.27,97%,For it is not enough to have a good mind; the main thing is ...,Win (1 of 3)
424.,2013-10-10 20:28:34,141.56,98%,I am learning about twenty new Italian words a day. Where am...,Win (1 of 2)
423.,2013-10-10 20:27:51,137.71,99%,What should have been swift revenge turned into an all out w...,Win (1 of 2)
422.,2013-10-10 20:27:10,132.99,97%,Popularity is only partially about individual attractiveness...,Win (1 of 4)
421.,2013-10-10 20:26:28,134.86,95%,The only preventive thing I do is wash clothes after buying ...,Win (1 of 2)
420.,2013-10-10 20:25:38,145.57,97%,Is it sweeter to exist only in the mind or to exist both in ...,Win (1 of 2)
419.,2013-10-08 19:56:49,133.04,95%,"And you know it's time to go, through the sleet and driving ...",No win (2 of 4)
418.,2013-10-08 19:56:04,130.62,90%,"And you know it's time to go, through the sleet and driving ...",No win (2 of 3)
417.,2013-10-08 19:55:15,140.97,94%,"If we all go for the blonde and block each other, not a sing...",Win (1 of 2)
416.,2013-10-08 19:54:19,152.65,99%,"There are perhaps twenty regular posters on the forum, and s...",Win (1 of 4)
415.,2013-10-08 19:53:32,142.44,96%,It's the possibility of having a dream come true that makes ...,Win (1 of 2)
414.,2013-10-08 19:52:45,154.48,94%,I think you're gonna find - when all this stuff is over and ...,Win (1 of 2)
413.,2013-10-08 19:36:43,145.07,91%,Good games offer players a set of challenging problems and t...,Win (1 of 3)
412.,2013-10-08 19:12:09,128.64,92%,We don't need no education. We don't need no thought control...,Win (1 of 5)
411.,2013-10-08 19:11:31,129.21,93%,Your faith was strong but you needed proof. You saw her bath...,No win (3 of 3)
410.,2013-10-08 19:10:44,140.29,96%,"I'm so glad you came, I'm so glad you remembered, the walkin...",Win (1 of 5)
409.,2013-10-08 19:09:28,147.50,97%,There's a hole in the world like a great black pit. And the ...,Win (1 of 3)
408.,2013-10-08 19:04:37,153.79,99%,"When I really worry about something, I don't just fool aroun...",Win (1 of 3)
407.,2013-10-08 19:02:24,138.82,94%,There are very few things I wish I could change about those ...,No win (2 of 2)
406.,2013-10-08 19:01:36,158.77,100%,"She's got a smile that, it seems to me, reminds me of childh...",Win (1 of 4)
405.,2013-10-08 18:59:44,135.25,98%,Ideology: the process of making ideas. The work was generall...,Win (1 of 5)
404.,2013-10-08 18:57:29,137.19,95%,And I don't believe in the existence of angels but looking a...,Win (1 of 4)
403.,2013-10-08 18:56:25,163.97,99%,She's got eyes of the bluest skies as if they thought of rai...,Win (1 of 3)
402.,2013-10-08 18:54:45,151.92,97%,"I hope that whoever you are, you escape this place. I hope t...",Win (1 of 3)
401.,2013-10-08 18:53:30,141.62,96%,"If we all go for the blonde and block each other, not a sing...",Win (1 of 5)
400.,2013-10-08 18:52:06,131.10,92%,"Comfortable, Mullet? It seems sadly ironic that it's that ti...",Win (1 of 4)
399.,2013-10-08 18:50:13,144.84,98%,The time has come for man to set himself a goal. The time ha...,Win (1 of 2)
398.,2013-10-08 18:48:21,164.95,98%,"Ever since I was a child, folks have thought they had me peg...",Win (1 of 4)
397.,2013-10-07 02:16:08,150.01,93%,"You have a class of young strong men and women, and they wan...",Win (1 of 3)
396.,2013-10-07 02:14:25,132.22,89%,"I had a job, I had a girl. I had something going, mister, in...",Win (1 of 2)
395.,2013-10-07 02:13:40,139.21,93%,I said that I would see you because I had heard that you wer...,Win (1 of 2)
394.,2013-10-07 02:12:32,142.26,97%,"The only people for me are the mad ones, the ones who are ma...",Win (1 of 2)
393.,2013-10-07 02:11:46,137.91,94%,I'd just like to point out that you were given every opportu...,Win (1 of 2)
392.,2013-10-07 02:10:53,140.78,99%,"If you are given too many choices, if you are forced to cons...",Win (1 of 2)
391.,2013-10-07 02:09:51,146.27,100%,Since every piece of matter in the Universe is in some way a...,Win (1 of 2)
390.,2013-10-07 02:08:38,140.30,95%,"When I really worry about something, I don't just fool aroun...",Win (1 of 3)
389.,2013-10-07 02:05:33,154.01,98%,"One day you're in a funk about things, telling a friend that...",Win (1 of 2)
388.,2013-10-07 01:58:22,171.80,100%,You've got a way to keep me on your side. You give me cause ...,Win (1 of 5)
387.,2013-10-07 01:57:06,160.69,100%,"I hope that whoever you are, you escape this place. I hope t...",Win (1 of 3)
386.,2013-10-07 01:56:10,149.04,98%,The truth of the matter is that there are a lot of available...,Win (1 of 3)
385.,2013-10-07 01:55:03,154.64,98%,"I had a job, I had a girl. I had something going, mister, in...",Win (1 of 4)
384.,2013-10-07 01:54:18,150.50,98%,I don't believe in painted roses or bleeding hearts while bu...,Win (1 of 2)
383.,2013-10-07 01:53:46,134.26,93%,If I'm curt with you it's because time is a factor. I think ...,Win (1 of 5)
382.,2013-10-07 01:53:00,148.73,99%,"The less you do with the controls, the less chance of error....",Win (1 of 3)
381.,2013-10-07 01:51:51,149.74,96%,Every time I think of you I feel shot right through with a b...,Win (1 of 4)
380.,2013-10-07 01:51:04,145.30,99%,It's the possibility of having a dream come true that makes ...,Win (1 of 2)
379.,2013-10-07 01:50:19,145.63,94%,"For centuries, the battle of morality was fought between tho...",Win (1 of 4)
378.,2013-10-07 01:49:36,137.48,94%,"Your face has fallen sad now, for you know the time is nigh....",Win (1 of 3)
377.,2013-10-07 01:47:18,141.14,96%,"For centuries, the battle of morality was fought between tho...",No win (2 of 3)
376.,2013-10-07 01:46:18,162.49,96%,I've been thinking lots about my life and how quick I'd wash...,Win (1 of 3)
375.,2013-10-07 01:44:50,130.97,97%,Many rivers to cross but I can't seem to find my way over. W...,Win (1 of 3)
374.,2013-10-07 01:44:06,139.37,97%,"And I said, I don't care if they lay me off either, because ...",Win (1 of 2)
373.,2013-10-07 01:43:14,135.03,96%,There is a theory which states that if anybody ever discover...,Win (1 of 2)
372.,2013-10-07 01:42:35,129.51,94%,What should have been swift revenge turned into an all out w...,Win (1 of 3)
371.,2013-10-07 01:40:55,150.53,96%,"Right, I am going to tell you how this works. You're going i...",Win (1 of 2)
370.,2013-10-07 01:39:57,124.27,98%,"All Ninja are men of peace, and must always remain so or los...",Win (1 of 4)
369.,2013-10-07 01:36:53,156.02,99%,"Ticking away the moments that make up a dull day, you fritte...",Win (1 of 3)
368.,2013-10-07 01:36:16,161.94,99%,"If you don't get what you want, you suffer; if you get what ...",Win (1 of 4)
367.,2013-10-07 01:35:24,139.18,97%,"Picking up the pieces, half alive in a nine 'til five, vacan...",Win (1 of 2)
366.,2013-10-07 01:34:27,145.59,95%,I can already hear your tune calling me across the room. Whe...,Win (1 of 2)
365.,2013-10-07 01:33:02,143.95,97%,Remembering you running soft through the night. You were big...,Win (1 of 4)
364.,2013-10-07 01:32:30,141.67,97%,I know that you weren't bored that day because there was a l...,Win (1 of 3)
363.,2013-10-07 01:30:57,147.87,98%,"I don't want tickets, I need you to find me a painting, a cl...",Win (1 of 3)
362.,2013-10-01 22:19:41,137.17,95%,"I don't believe in an interventionist God, but I know, darli...",No win (3 of 3)
361.,2013-10-01 22:19:03,147.72,96%,You've got a way to keep me on your side. You give me cause ...,No win (3 of 3)
360.,2013-10-01 22:18:13,156.08,99%,"But no matter how effective the lesson was, I never really u...",Win (1 of 3)
359.,2013-10-01 22:17:10,162.96,97%,Remember that humor is written backwards. That means you fir...,Win (1 of 4)
358.,2013-10-01 22:16:01,154.57,99%,"I'm so glad you came, I'm so glad you remembered, the walkin...",Win (1 of 2)
357.,2013-10-01 22:14:47,150.44,100%,"Burning my bridges and smashing my mirrors, turning to see i...",No win (2 of 3)
356.,2013-10-01 22:14:16,151.59,98%,The most precious treasures we have in life are the images w...,No win (2 of 3)
355.,2013-10-01 22:12:11,125.63,97%,"Whenever you watch the mind, you withdraw consciousness from...",No win (2 of 3)
354.,2013-10-01 22:11:32,129.82,96%,"When Betty and Billy fell asleep, he walked down to the kitc...",No win (2 of 3)
353.,2013-10-01 22:09:52,146.02,97%,Don't take anything personally - nothing others do is becaus...,Win (1 of 3)
352.,2013-10-01 22:08:10,157.51,99%,"When we conceive of the sweetest being ever, we are conceivi...",No win (3 of 4)
