151.,2015-09-22 11:38:00,125.10,96%,We often believe the more we practice a skill or technique -...,Win (1 of 4)
150.,2015-09-22 11:36:23,147.88,99%,We all know people who are very bright but who do not always...,Win (1 of 3)
149.,2015-09-22 11:35:50,154.70,98%,The place to improve the world is first in one's own heart a...,Win (1 of 3)
148.,2015-09-22 11:35:14,125.87,92%,There's sometimes a buggy. How many drivers does a buggy hav...,No win (2 of 2)
147.,2015-09-22 11:34:35,127.53,95%,Many rivers to cross but I can't seem to find my way over. W...,Win (1 of 2)
146.,2015-09-20 23:10:34,133.52,97%,"Some pilots like the excitement of our missions, knowing tha...",Win (1 of 3)
145.,2015-09-17 11:40:52,107.74,93%,"It is a period of civil war. Rebel spaceships, striking from...",No win (3 of 3)
144.,2015-09-17 10:57:07,157.71,100%,The quick brown fox jumps over the lazy dog.,Win (1 of 3)
143.,2015-09-17 10:56:34,135.52,95%,"It was a marvelous night, the sort of night one only experie...",Win (1 of 3)
142.,2015-09-17 02:05:51,106.41,89%,"Gentlemen: You have undertaken to cheat me. I won't sue you,...",No win (2 of 4)
141.,2015-09-17 01:52:57,155.09,98%,"It's a funny thing, but people mostly have it backward. They...",Win (1 of 4)
140.,2015-09-15 01:08:07,137.52,99%,It is greatly to America's advantage that it is a congenial ...,Win (1 of 3)
139.,2015-09-15 01:07:12,143.17,98%,Commas and periods always go inside quotation marks. Colons ...,Win (1 of 3)
138.,2015-09-15 01:06:20,126.81,95%,All that year the animals worked like slaves. But they were ...,Win (1 of 2)
137.,2015-09-15 01:05:25,116.36,95%,"Hey Mr. Tambourine Man, play a song for me, I'm not sleepy a...",Win (1 of 3)
136.,2015-09-15 01:04:51,124.16,92%,When we got to the Mint I parked on the street in front of t...,Win (1 of 3)
135.,2015-09-15 01:04:27,120.09,89%,Don't take anything personally - nothing others do is becaus...,Win (1 of 3)
134.,2015-09-15 01:03:37,104.55,91%,And that's what this whole thing is about. Calling home. Ins...,Win (1 of 5)
133.,2015-09-15 01:02:34,128.07,95%,"After removal from the oven, the pizza is sliced and plated ...",Win (1 of 4)
132.,2015-09-15 01:01:34,119.74,90%,"No matter how bad things are, you can always make things wor...",Win (1 of 2)
131.,2015-09-14 21:01:44,115.20,91%,Who has a safety deposit box full of money and six passports...,Win (1 of 2)
130.,2015-09-14 21:00:39,131.28,90%,I've been looking so long at these pictures of you that I al...,No win (2 of 3)
129.,2015-09-14 20:59:42,137.30,94%,Don't take anything personally - nothing others do is becaus...,Win (1 of 2)
128.,2015-09-14 20:59:04,97.50,85%,"In the moment when I truly understand my enemy, understand h...",Win (1 of 2)
127.,2015-09-14 20:58:09,126.10,95%,Ideology: the process of making ideas. The work was generall...,Win (1 of 4)
126.,2015-09-14 00:34:20,102.78,89%,"When I close my eyes, I am at the center of the sun. And I c...",No win (2 of 3)
125.,2015-09-14 00:33:50,124.43,95%,Be impeccable with your word - speak with integrity. Say onl...,Win (1 of 4)
124.,2015-09-14 00:33:20,134.41,94%,"If you really want to hear about it, the first thing you'll ...",Win (1 of 5)
123.,2015-09-14 00:32:37,139.14,97%,The basis of the Aztecs' success in creating a great state a...,Win (1 of 2)
122.,2015-09-14 00:31:47,127.88,98%,Remember that humor is written backwards. That means you fir...,Win (1 of 5)
121.,2015-09-14 00:31:14,119.16,96%,"In the late 1960s, a growing number of people became concern...",Win (1 of 3)
120.,2015-09-13 01:54:52,127.28,95%,He had spent enormous amounts of time at the great libraries...,Win (1 of 3)
119.,2015-09-13 01:53:39,100.46,88%,It's really hard to do nothing totally. Even just sitting he...,No win (3 of 4)
118.,2015-09-13 01:53:05,120.40,98%,"Ever since I was a child, folks have thought they had me peg...",No win (3 of 3)
117.,2015-09-13 01:52:27,111.71,94%,Music finds a comfortable parallel with that of human langua...,No win (2 of 2)
116.,2015-09-13 01:51:28,102.16,85%,Remembering you running soft through the night. You were big...,No win (2 of 3)
115.,2015-09-13 01:50:43,149.85,100%,Suppose you suggest to your husband that subsidized llama fa...,No win (1 of 1)
114.,2015-09-13 01:49:56,123.98,92%,Step out the front door like a ghost into the fog where no o...,Win (1 of 5)
113.,2015-09-13 01:48:01,131.66,97%,"Everyone said I was daft to build a castle on a swamp, but I...",No win (1 of 1)
112.,2015-09-13 01:46:25,122.25,93%,"Ever since I was a child, folks have thought they had me peg...",No win (2 of 5)
111.,2015-09-13 01:12:08,125.72,93%,Your inner child will be happy to know that when it comes to...,No win (1 of 1)
110.,2015-09-13 00:32:44,131.21,96%,"Keying text quickly is important, but it is more important t...",Win (1 of 2)
109.,2015-09-13 00:32:09,119.31,90%,She's got eyes of the bluest skies as if they thought of rai...,Win (1 of 2)
108.,2015-09-13 00:30:31,145.23,96%,I see in your eyes the same fear that would take the heart o...,Win (1 of 4)
107.,2015-09-13 00:29:49,133.89,91%,"If you think that you are going to love something, give it a...",Win (1 of 5)
106.,2015-09-13 00:29:21,125.60,94%,We have a criminal jury system which is superior to any in t...,No win (2 of 5)
105.,2015-09-13 00:28:55,114.47,87%,When we got to the Mint I parked on the street in front of t...,No win (2 of 5)
104.,2015-09-13 00:28:23,145.67,97%,Step out the front door like a ghost into the fog where no o...,Win (1 of 3)
103.,2015-09-13 00:27:43,117.49,91%,You've got a way to keep me on your side. You give me cause ...,No win (2 of 4)
102.,2015-09-13 00:27:09,148.70,100%,The day is made up of 24 hours and an infinite number of mom...,Win (1 of 5)
101.,2015-09-13 00:26:30,119.72,93%,The invention of the wheel represented a major turning point...,Win (1 of 4)
100.,2015-09-13 00:25:56,121.81,96%,"There is no physical separation after the slicing, so that e...",No win (1 of 1)
99.,2015-09-13 00:25:15,131.24,95%,Since the 1980s virtually all the sodas and most of the frui...,Win (1 of 3)
98.,2015-09-13 00:24:14,138.51,98%,"When we pulled out into the winter night and the real snow, ...",Win (1 of 4)
97.,2015-09-13 00:23:19,113.51,91%,To an outsider's ear it sounds absurdly wild and ridiculous ...,No win (2 of 4)
96.,2015-09-12 22:25:08,155.84,98%,"When we conceive of the sweetest being ever, we are conceivi...",Win (1 of 2)
95.,2015-09-12 22:23:56,135.76,98%,"In the English language, swearing is essential to effective ...",Win (1 of 4)
94.,2015-09-12 22:23:14,120.28,95%,When beetles fight these battles in a bottle with their padd...,Win (1 of 2)
93.,2015-09-12 22:21:27,142.61,98%,And I will strike down upon thee with great vengeance and fu...,Win (1 of 3)
92.,2015-09-12 20:43:51,117.50,97%,"In the English language, swearing is essential to effective ...",Win (1 of 4)
91.,2015-09-12 20:43:18,128.95,94%,We sit silently and watch the world around us. This has take...,No win (2 of 2)
90.,2015-09-12 20:42:20,151.24,99%,"There is no pain, you are receding. A distant ship smoke on ...",Win (1 of 4)
89.,2015-09-12 20:41:06,156.03,99%,Writing is hard work. A clear sentence is no accident. Very ...,Win (1 of 3)
88.,2015-09-12 20:40:26,159.82,100%,"On a manual typewriter, strike the key with a nice sharp str...",Win (1 of 3)
87.,2015-09-12 20:39:16,139.39,99%,The basis of the Aztecs' success in creating a great state a...,No win (1 of 1)
86.,2015-09-12 20:38:30,97.06,87%,"There was me, that is Alex, and my three droogs, that is Pet...",No win (1 of 1)
85.,2015-09-12 20:37:36,125.22,94%,Most popular song lyrics have two sections - a verse and a b...,Win (1 of 2)
84.,2015-09-12 20:36:54,119.16,96%,"Oh bliss! Bliss and heaven! Oh, it was gorgeousness and gorg...",Win (1 of 2)
83.,2015-09-12 20:31:33,130.21,97%,It is greatly to America's advantage that it is a congenial ...,Win (1 of 4)
82.,2015-09-12 20:31:00,118.71,94%,Most popular song lyrics have two sections - a verse and a b...,No win (2 of 3)
81.,2015-09-11 01:28:33,117.39,91%,There was a time not that long ago when many drivers thought...,Win (1 of 4)
80.,2015-09-11 01:27:40,115.27,90%,I don't know why he saved my life. Maybe in those last momen...,Win (1 of 3)
79.,2015-09-11 01:26:57,102.30,90%,Three changes occur while the stacked disk structure equilib...,No win (3 of 3)
78.,2015-09-11 01:25:43,139.83,98%,"Run to the bedroom, in the suitcase on the left, you'll find...",Win (1 of 3)
77.,2015-09-11 01:24:51,115.44,97%,I was having this awful nightmare that I was 32. And then I ...,No win (3 of 4)
76.,2015-09-11 01:24:20,124.92,99%,"Pulp: 1. A soft, moist, shapeless mass or matter. 2. A magaz...",Win (1 of 4)
75.,2015-09-11 01:23:50,114.13,91%,"To some, the rules of etiquette may seem outdated, stuffy an...",No win (2 of 4)
74.,2015-09-11 01:23:01,106.06,91%,Always do your best - your best is going to change from mome...,No win (3 of 3)
73.,2015-09-11 01:22:09,144.26,97%,Paranoia is a survival trait when you run in my circles. It ...,Win (1 of 2)
72.,2015-09-11 01:21:28,100.21,93%,The inner surface of the cell wall touches the cytoplasmic m...,No win (2 of 3)
71.,2015-09-10 10:54:15,94.77,80%,We might begin by asking why the pregnant man image has been...,Win (1 of 4)
70.,2015-09-10 03:40:36,104.05,93%,"To be fair, English is full of booby traps for the unwary fo...",No win (2 of 2)
69.,2015-09-10 03:39:52,120.03,94%,"This was the most delicious meal he'd had in recent years, a...",Win (1 of 2)
68.,2015-09-10 03:39:10,119.20,91%,"This planet has, or rather had, a problem, which was this: m...",No win (2 of 3)
67.,2015-09-10 03:38:19,121.14,95%,I sincerely believe that if women study male lessons on conc...,No win (2 of 4)
66.,2015-09-10 03:37:42,131.48,99%,"Finally, there are those languages, such as Turkish, Finnish...",Win (1 of 4)
65.,2015-09-10 03:36:53,122.68,96%,The beginner writes just twenty pieces. The professional wri...,Win (1 of 3)
64.,2015-09-10 03:36:11,120.29,94%,"The result has been the emergence of what some call the ""win...",No win (2 of 4)
63.,2015-09-10 03:35:26,125.73,94%,Popularity is only partially about individual attractiveness...,No win (2 of 2)
62.,2015-09-10 03:34:41,126.82,93%,The one place where a man ought to get a square deal is in a...,Win (1 of 2)
61.,2015-09-10 03:33:37,100.92,89%,"Whether you're a student, secretary, office administrator, m...",No win (4 of 4)
60.,2015-09-10 02:27:11,114.56,90%,"Throughout my academic career, I'd given some pretty good ta...",Win (1 of 2)
59.,2015-09-10 02:26:27,112.43,92%,"He was rough around the edges. He'd been to school, but neve...",Win (1 of 4)
58.,2015-09-10 02:25:20,126.37,94%,I said that I would see you because I had heard that you wer...,Win (1 of 3)
57.,2015-09-10 02:20:49,102.52,90%,"When you are typing on a typewriter, your input appears dire...",Win (1 of 2)
56.,2015-09-08 13:05:11,97.53,89%,"Imagine this: Here we are, a plane full of grown human being...",Win (1 of 2)
55.,2015-09-08 13:04:12,120.39,95%,And I don't believe in the existence of angels but looking a...,Win (1 of 2)
54.,2015-09-08 13:03:23,139.83,98%,I was having this awful nightmare that I was 32. And then I ...,Win (1 of 3)
53.,2015-09-07 16:23:58,117.92,93%,We go waiting for the stars to come showering down. From Mos...,Win (1 of 3)
52.,2015-09-07 16:23:10,109.25,91%,Space is big. Really big. You just won't believe how vastly ...,No win (2 of 4)
51.,2015-09-07 16:22:20,143.09,97%,"Don't tell me what's in, don't tell me how to write, don't t...",Win (1 of 5)
50.,2015-09-07 16:21:44,130.01,95%,We go waiting for the stars to come showering down. From Mos...,Win (1 of 5)
49.,2015-09-07 16:09:21,87.74,90%,"There is more to color than a swatch in a book, or a pull do...",No win (2 of 3)
48.,2015-09-07 14:56:10,95.75,94%,"The term ""barbarian"" was created by the Greeks; it was origi...",Win (1 of 3)
47.,2015-09-07 14:55:19,139.67,97%,A freedom fighter learns the hard way that it is the oppress...,Win (1 of 3)
46.,2015-09-07 03:38:59,110.65,91%,The only message I got was from the company that holds my st...,No win (2 of 3)
45.,2015-09-07 03:37:43,161.31,99%,"For centuries, the battle of morality was fought between tho...",Win (1 of 2)
44.,2015-09-07 03:37:00,108.35,89%,Popularity is only partially about individual attractiveness...,Win (1 of 4)
43.,2015-09-07 03:35:39,113.90,92%,The place to improve the world is first in one's own heart a...,Win (1 of 2)
42.,2015-09-07 03:34:46,55.10,93%,"A lot of people, especially this one psychoanalyst guy they ...",No win (4 of 5)
41.,2015-09-07 03:28:22,131.74,96%,"Let me get this straight. You think that your client, one of...",Win (1 of 3)
40.,2015-09-07 01:56:59,116.68,94%,It is greatly to America's advantage that it is a congenial ...,Win (1 of 4)
39.,2015-09-07 01:56:16,131.83,97%,I have quit three jobs and been fired from all the rest. Get...,No win (2 of 4)
38.,2015-09-07 01:55:34,116.87,92%,We began to recognize in them a strange obsession. After all...,Win (1 of 3)
37.,2015-09-07 01:54:45,142.68,96%,So it's all come back round to breaking apart again. Breakin...,Win (1 of 4)
36.,2015-09-07 01:54:03,130.45,97%,Suppose you suggest to your husband that subsidized llama fa...,Win (1 of 4)
35.,2015-09-07 01:53:23,134.73,96%,In order to face down the danger that is stalking us and mov...,Win (1 of 2)
34.,2015-09-06 23:08:57,98.88,90%,"The boy has not a real choice, has he? Self-interest, the fe...",Win (1 of 2)
33.,2015-09-06 23:08:12,123.36,91%,The ultimate way to compose is to be able to keyboard as fas...,Win (1 of 5)
32.,2015-09-06 23:07:27,90.36,90%,When is a legend a legend? Why is a myth a myth? How old and...,No win (2 of 4)
31.,2015-09-06 23:06:47,148.07,99%,It was one of those days when it's a minute away from snowin...,No win (1 of 1)
30.,2015-09-06 23:06:03,137.93,96%,"You ask Raymond what he does for a living and he says, ""I br...",Win (1 of 4)
29.,2015-09-05 03:28:51,99.65,94%,"It is a period of civil war. Rebel spaceships, striking from...",Win (1 of 4)
28.,2015-09-05 03:21:05,122.04,93%,The child is brought up in a culture where he or she simply ...,Win (1 of 3)
27.,2015-09-05 03:20:20,129.23,94%,The example of painting can teach us not only how to manage ...,Win (1 of 3)
26.,2015-09-05 03:19:27,132.66,94%,It's really hard to do nothing totally. Even just sitting he...,Win (1 of 4)
25.,2015-09-05 03:18:50,124.56,94%,There's a hole in the world like a great black pit. And the ...,Win (1 of 2)
24.,2015-09-05 03:18:17,139.41,99%,Do I really look like a guy with a plan? You know what I am?...,Win (1 of 4)
23.,2015-09-05 03:17:22,109.07,90%,"I did my best, it wasn't much. I couldn't feel, so I tried t...",Win (1 of 2)
22.,2015-09-05 03:16:43,100.68,89%,"That's Tommy. He tells people he was named after a gun, but ...",Win (1 of 4)
21.,2015-09-05 03:16:14,117.77,96%,"But suddenly, I viddied that thinking was for the gloopy one...",Win (1 of 4)
20.,2015-09-05 03:15:40,114.82,97%,The recipe for turning fruit into wine goes something like t...,Win (1 of 4)
19.,2015-09-05 03:14:32,136.94,97%,"Historically, most wines contained less than 14 percent alco...",Win (1 of 3)
18.,2015-09-04 04:08:17,102.91,92%,But if in efficient causes it is possible to go on to infini...,Win (1 of 3)
17.,2015-09-04 03:59:30,107.56,91%,"And today, Lady Liberty is under attack from the cable chann...",Win (1 of 2)
16.,2015-09-04 03:58:42,82.14,84%,"I know a bloke who knows a bloke who knows a bloke. Now, I k...",No win (3 of 3)
15.,2015-09-04 03:58:01,116.86,92%,Well I woke in mid-afternoon cause that's when it all hurts ...,No win (3 of 3)
14.,2015-09-04 03:56:54,116.23,93%,"Take my love, take my land, take me where I cannot stand. I ...",Win (1 of 2)
13.,2015-09-04 03:44:17,105.36,94%,"I was shaking like a leaf, so without thinking I lit up a ci...",Win (1 of 4)
12.,2015-09-04 03:43:23,90.65,90%,"The less you do with the controls, the less chance of error....",Win (1 of 2)
11.,2015-09-04 03:42:41,112.20,93%,"We turn away to face the cold, enduring chill, as the day be...",No win (2 of 3)
10.,2015-09-04 03:41:48,138.29,98%,There was a time not that long ago when many drivers thought...,Win (1 of 2)
9.,2015-09-04 03:41:00,148.17,98%,There is a theory which states that if anybody ever discover...,Win (1 of 4)
8.,2015-09-04 03:40:11,132.10,97%,Commas and periods always go inside quotation marks. Colons ...,Win (1 of 3)
7.,2015-09-04 03:39:29,129.17,92%,"You have a class of young strong men and women, and they wan...",Win (1 of 3)
6.,2015-09-04 03:38:45,129.44,99%,The unknown future rolls toward us. I face it for the first ...,Win (1 of 5)
5.,2015-09-04 03:38:08,150.89,100%,It's really hard to do nothing totally. Even just sitting he...,Win (1 of 3)
4.,2015-08-04 05:30:54,129.12,96%,"No matter how bad things are, you can always make things wor...",Win (1 of 4)
3.,2015-08-04 05:30:06,124.16,96%,"I'm so glad you came, I'm so glad you remembered to see how ...",No win (3 of 4)
2.,2015-08-04 05:29:15,116.52,92%,Always do your best - your best is going to change from mome...,No win (2 of 4)
1.,2015-08-04 05:28:15,126.38,96%,God help the man who ever really loves you. You'd break his ...,No win (2 of 3)
