175.,2012-10-28 01:48:22,76.48,89%,"Ultimately, this is not about solving your problems. It's ab...",No win (2 of 4)
174.,2012-10-28 01:24:55,107.69,96%,The only preventive thing I do is wash clothes after buying ...,No win (2 of 3)
173.,2012-10-28 01:22:36,104.04,97%,One essential rule: make sure the joke is the last possible ...,No win (2 of 4)
172.,2012-10-27 22:00:17,78.37,91%,"Often, we assume that a familiar situation will be but a rep...",No win (4 of 5)
171.,2012-10-27 20:23:28,86.28,92%,We've known each other for many years but this is the first ...,Win (1 of 2)
170.,2012-10-27 20:21:08,93.15,94%,"The time I waited seemed endless, and I felt doubts and fear...",Win (1 of 2)
169.,2012-10-25 00:50:10,72.69,86%,Space is big. Really big. You just won't believe how vastly ...,No win (3 of 5)
168.,2012-10-25 00:49:15,92.35,94%,"Combat for a naval aviator is fought in short, violent burst...",Win (1 of 5)
167.,2012-10-25 00:45:56,89.30,96%,"Trudging slowly over wet sand, back to the bench where your ...",Win (1 of 5)
166.,2012-10-25 00:45:22,83.01,93%,"There is no pain, you are receding. A distant ship smoke on ...",No win (2 of 2)
165.,2012-10-25 00:44:06,88.49,94%,"Historically, most wines contained less than 14 percent alco...",Win (1 of 4)
164.,2012-10-24 21:30:13,77.63,90%,"The world of typing has changed. In the 1970s, every busines...",Win (1 of 3)
163.,2012-10-23 23:44:07,81.04,89%,I must not fear. Fear is the mind killer. Fear is the little...,No win (2 of 5)
162.,2012-10-23 23:43:07,74.55,90%,"All Ninja are men of peace, and must always remain so or los...",Win (1 of 5)
161.,2012-10-23 01:23:29,83.44,91%,We all know people who are very bright but who do not always...,No win (2 of 5)
160.,2012-10-22 20:11:16,99.53,90%,"I hope that whoever you are, you escape this place. I hope t...",Win (1 of 5)
159.,2012-10-22 18:47:03,100.24,95%,I will need my spectacles and a clear head. Today I broke my...,Win (1 of 4)
158.,2012-10-22 18:29:33,73.84,89%,"People get ready, there's a train coming. You don't need no ...",Win (1 of 4)
157.,2012-10-22 18:28:41,71.22,93%,"Listen, strange women lyin' in ponds distributin' swords is ...",No win (2 of 3)
156.,2012-10-22 18:27:46,72.54,89%,"Imagine a vast sheet of paper on which straight Lines, Trian...",No win (3 of 5)
155.,2012-10-22 17:55:06,72.67,91%,"As the netted bag says, this potato was grown in Idaho, that...",Win (1 of 5)
154.,2012-10-22 02:17:53,69.74,89%,Having endured the racial turmoil of the Civil Rights Moveme...,Win (1 of 5)
153.,2012-10-22 02:16:52,59.13,85%,"Imagine considering ""if"" as a two-finger movement instead of...",No win (4 of 5)
152.,2012-10-22 02:15:29,79.27,91%,Unlike the other four senses located in the logical regions ...,Win (1 of 4)
151.,2012-10-22 02:14:39,67.39,85%,A giant inverted steel pyramid is perfectly balanced on its ...,No win (2 of 5)
150.,2012-10-22 02:13:28,66.54,83%,There are still some places where you can get all you can ea...,No win (2 of 4)
149.,2012-10-22 02:12:05,88.23,89%,"Time is tricky. You have whole months, even years, when noth...",Win (1 of 4)
148.,2012-10-22 02:11:04,88.59,89%,"Because most of the 150,000 tons of gold ever mined is still...",Win (1 of 5)
147.,2012-10-22 02:10:26,71.33,87%,The most precious treasures we have in life are the images w...,No win (4 of 5)
146.,2012-10-22 02:09:33,59.42,85%,"King, eh? Very nice. And how'd you get that, eh? By exploiti...",Win (1 of 5)
145.,2012-10-22 02:08:45,73.79,87%,Since every piece of matter in the Universe is in some way a...,No win (3 of 4)
144.,2012-10-22 02:07:47,71.37,91%,"King, eh? Very nice. And how'd you get that, eh? By exploiti...",No win (2 of 2)
143.,2012-10-22 02:07:01,78.88,95%,"One respondent said ""For women - a lot of games are crap - t...",Win (1 of 5)
142.,2012-10-22 02:06:15,75.69,92%,"In short order, Carter then proceeded to kill any chance he ...",No win (2 of 4)
141.,2012-10-22 02:05:08,77.84,91%,But speculations on the structure of the universe also move ...,No win (2 of 2)
140.,2012-10-22 02:04:08,72.15,87%,We've arranged a global civilization in which most crucial e...,No win (3 of 3)
139.,2012-10-22 02:03:12,112.42,95%,There is something about yourself that you don't know. Somet...,No win (2 of 5)
138.,2012-10-22 02:02:27,83.27,91%,"The brain can be a tool. It can recall phone numbers, solve ...",No win (4 of 5)
137.,2012-10-22 02:00:57,68.65,86%,"The boy has not a real choice, has he? Self-interest, the fe...",No win (3 of 5)
136.,2012-10-21 23:47:21,85.53,91%,Imagine for a moment if we once again knew these few unremar...,No win (2 of 5)
135.,2012-10-21 23:43:59,66.83,92%,"No matter how bad things are, you can always make things wor...",No win (3 of 4)
134.,2012-10-21 19:17:18,81.74,90%,"Time is tricky. You have whole months, even years, when noth...",Win (1 of 4)
133.,2012-10-20 15:57:25,78.93,94%,"Disillusion is the greatest gift I can give you. But, becaus...",No win (2 of 4)
132.,2012-10-20 15:56:02,73.33,90%,"Has it been five years? Six? It seems like a lifetime, the k...",No win (4 of 5)
131.,2012-10-20 15:54:40,81.74,89%,The theory of music emphasizes the elements from which music...,Win (1 of 4)
130.,2012-10-19 22:41:56,113.41,97%,The alternative to binge travel - the mini retirement - enta...,Win (1 of 5)
129.,2012-10-19 22:40:33,79.98,91%,Few smart kids can spare the attention that popularity requi...,No win (2 of 3)
128.,2012-10-19 18:43:20,86.81,93%,But if in efficient causes it is possible to go on to infini...,Win (1 of 3)
127.,2012-10-19 05:52:28,56.91,86%,We don't need no education. We don't need no thought control...,No win (4 of 5)
126.,2012-10-18 00:05:35,76.39,87%,The ultimate way to compose is to be able to keyboard as fas...,No win (4 of 5)
125.,2012-10-18 00:04:35,85.17,93%,It takes more than a calorie of fossil fuel energy to produc...,No win (2 of 5)
124.,2012-10-18 00:03:25,88.42,92%,"And in the world a heart of darkness, a firezone, where poet...",No win (2 of 5)
123.,2012-10-18 00:02:39,93.61,90%,"We speak of something carried and something carrying, of som...",No win (2 of 5)
122.,2012-10-18 00:01:46,75.58,90%,"Good games stay within, but at the outer edge, of the player...",No win (2 of 3)
121.,2012-10-18 00:01:01,65.28,85%,"O clear intelligence, force beyond all measure! Gentlemen, I...",No win (4 of 4)
120.,2012-10-18 00:00:18,66.59,84%,We go waiting for the stars to come showering down. From Mos...,No win (4 of 5)
119.,2012-10-17 23:59:26,79.72,92%,I don't believe in painted roses or bleeding hearts while bu...,No win (5 of 5)
118.,2012-10-17 23:58:47,88.97,94%,But if in efficient causes it is possible to go on to infini...,Win (1 of 4)
117.,2012-10-17 23:57:54,87.21,91%,"My darling, you have to be standing up in order to be able t...",No win (3 of 4)
116.,2012-10-17 23:57:09,70.97,91%,In 1873 the Sholes & Glidden Type Writer became the firs...,No win (5 of 5)
115.,2012-10-17 23:55:48,102.01,97%,"The time I waited seemed endless, and I felt doubts and fear...",No win (2 of 2)
114.,2012-10-17 23:54:59,60.85,81%,"I've heard there was a secret chord that David played, and i...",No win (4 of 5)
113.,2012-10-17 23:31:44,87.82,91%,Language is one of the keys to being human. It allows us to ...,No win (2 of 5)
112.,2012-10-17 23:30:50,76.67,93%,"He's got a two day head start on you, which is more than he ...",No win (2 of 5)
111.,2012-10-17 23:29:54,78.39,92%,"Let me get this straight. You think that your client, one of...",No win (2 of 3)
110.,2012-10-17 23:29:00,71.94,90%,Stab a sorry heart with your favorite finger. Paint the whol...,No win (4 of 5)
109.,2012-10-17 23:27:53,73.60,90%,"Historian James C. Cobb has described southern identity as ""...",Win (1 of 5)
108.,2012-10-17 23:26:57,65.89,82%,"Around midafternoon, the snow thinned into sleet, and some u...",No win (2 of 2)
107.,2012-10-17 23:00:56,108.17,94%,Remembering you running soft through the night. You were big...,Win (1 of 3)
106.,2012-10-17 22:51:23,89.10,93%,Let me tell you why you're here. You're here because you kno...,Win (1 of 5)
105.,2012-10-17 22:50:22,92.23,95%,Many rivers to cross but I can't seem to find my way over. W...,No win (2 of 4)
104.,2012-10-17 22:49:33,83.48,93%,Unlike the other four senses located in the logical regions ...,No win (2 of 5)
103.,2012-10-17 22:48:40,104.11,95%,Now I want you to think and stop being a smart aleck. A man'...,Win (1 of 5)
102.,2012-10-17 01:57:07,87.71,96%,To drive out of the Central Valley of California on a hot da...,No win (2 of 4)
101.,2012-10-17 01:55:48,77.15,89%,Stab a sorry heart with your favorite finger. Paint the whol...,No win (3 of 3)
100.,2012-10-16 22:12:34,90.17,91%,"Well, it just so happens, this hacienda comes with its very ...",Win (1 of 2)
99.,2012-10-16 20:16:06,80.29,91%,Do you know what they call a Quarter-pounder with cheese in ...,Win (1 of 4)
98.,2012-10-16 03:30:19,74.94,93%,Involuntarily I glanced seaward - and distinguished nothing ...,Win (1 of 4)
97.,2012-10-16 03:29:27,74.26,90%,"That's Tommy. He tells people he was named after a gun, but ...",No win (3 of 4)
96.,2012-10-16 03:28:50,88.35,96%,"They say that right after God created man, he took a rib fro...",No win (2 of 3)
95.,2012-10-16 03:28:00,75.39,92%,But if in efficient causes it is possible to go on to infini...,No win (2 of 4)
94.,2012-10-16 02:36:33,83.22,91%,"If you don't get what you want, you suffer; if you get what ...",No win (3 of 4)
93.,2012-10-16 01:31:44,69.15,94%,The beginner writes just twenty pieces. The professional wri...,No win (3 of 5)
92.,2012-10-16 00:27:26,83.68,97%,"To some, the rules of etiquette may seem outdated, stuffy an...",Win (1 of 5)
91.,2012-10-15 21:46:25,93.20,93%,How do I live without the ones I love? Time still turns the ...,No win (2 of 4)
90.,2012-10-15 21:42:23,56.29,85%,If I'm curt with you it's because time is a factor. I think ...,No win (4 of 5)
89.,2012-10-15 21:41:27,78.08,93%,"The less you do with the controls, the less chance of error....",No win (3 of 5)
88.,2012-10-15 21:27:37,82.07,93%,I thought climbing the Devil's Thumb would fix all that was ...,No win (3 of 5)
87.,2012-10-15 20:31:36,55.26,90%,"Wilkinson County was a recipient of one of the new ""separate...",No win (2 of 4)
86.,2012-10-15 20:30:29,74.03,88%,Overhead the albatross hangs motionless upon the air and dee...,No win (3 of 5)
85.,2012-10-15 20:29:40,80.52,92%,He canceled all his commitments and pulled together the most...,Win (1 of 4)
84.,2012-10-15 20:28:38,67.73,92%,I don't know why he saved my life. Maybe in those last momen...,No win (3 of 5)
83.,2012-10-15 20:27:41,70.98,85%,"It was a marvelous night, the sort of night one only experie...",No win (4 of 5)
82.,2012-10-15 20:26:51,77.62,87%,He canceled all his commitments and pulled together the most...,No win (2 of 3)
81.,2012-10-15 20:25:57,73.22,91%,"But, pray how could that which I spoke so many years ago, an...",No win (4 of 5)
80.,2012-10-15 20:24:53,89.78,95%,And I will strike down upon thee with great vengeance and fu...,No win (2 of 4)
79.,2012-10-15 20:24:12,90.21,97%,"A computer needs a manager to administer its operations, jus...",No win (2 of 4)
78.,2012-10-15 20:23:39,71.76,87%,The streets were cleared by a Critical Mass bike ride and we...,No win (2 of 3)
77.,2012-10-15 20:22:44,78.52,86%,"People get ready, there's a train coming. You don't need no ...",No win (4 of 5)
76.,2012-10-15 20:22:03,92.00,92%,I am learning about twenty new Italian words a day. Where am...,No win (3 of 5)
75.,2012-10-15 20:20:54,81.56,90%,Once you get into the processed foods you have to be a fairl...,No win (3 of 5)
74.,2012-10-15 20:20:01,85.36,91%,"Many people limit themselves to leading boring, dull lives b...",No win (3 of 4)
73.,2012-10-15 20:13:34,77.99,90%,"Historically, most wines contained less than 14 percent alco...",No win (2 of 2)
72.,2012-10-15 20:12:46,102.08,97%,I can practically see your face and another revolutionary fa...,Win (1 of 5)
71.,2012-10-15 16:00:40,71.12,91%,Mac knew the score even if Aunt Ella didn't. Shot through th...,No win (2 of 2)
70.,2012-10-15 15:57:30,50.55,87%,"You cannot entice a true thief, and thief by vocation, into ...",No win (2 of 4)
69.,2012-10-15 15:41:44,72.05,87%,"Around midafternoon, the snow thinned into sleet, and some u...",No win (3 of 5)
68.,2012-10-15 15:40:56,74.79,92%,The Inca believed that if one did not give thanks and obedie...,No win (3 of 5)
67.,2012-10-15 15:40:05,78.96,85%,He canceled all his commitments and pulled together the most...,Win (1 of 5)
66.,2012-10-14 21:30:22,80.59,96%,These contests provided ample opportunity to demonstrate the...,Win (1 of 5)
65.,2012-10-14 07:11:40,63.67,90%,"My dog barks some. Mentally you picture my dog, but I have n...",Win (1 of 3)
64.,2012-10-14 07:10:39,88.42,93%,The odds are that you will generally meet the worst of them....,No win (2 of 3)
63.,2012-10-14 06:41:47,79.66,91%,"Whether they use the title or not, many lyrics have evocativ...",No win (3 of 5)
62.,2012-10-14 06:40:53,85.34,92%,Space is big. Really big. You just won't believe how vastly ...,No win (3 of 4)
61.,2012-10-14 06:40:09,83.63,95%,Stab a sorry heart with your favorite finger. Paint the whol...,No win (4 of 5)
60.,2012-10-14 06:38:52,83.37,93%,The unknown future rolls toward us. I face it for the first ...,No win (2 of 5)
59.,2012-10-14 06:38:13,70.41,97%,"With forty-six Chinese, fourteen Japanese, eighteen Mexican,...",Win (1 of 5)
58.,2012-10-14 06:37:35,109.02,99%,There's a hole in the world like a great black pit. And the ...,No win (2 of 4)
57.,2012-10-14 06:36:56,73.28,92%,"In 1966, Andy Dufresne escaped from Shawshank prison. All th...",No win (4 of 4)
56.,2012-10-14 06:35:53,106.06,95%,Don't take anything personally - nothing others do is becaus...,Win (1 of 5)
55.,2012-10-14 04:56:33,85.97,93%,"Common knowledge has bicyclists always riding into the wind,...",Win (1 of 4)
54.,2012-10-14 04:55:13,73.09,91%,"Two years ago this property cost one million pounds. Today, ...",No win (2 of 3)
53.,2012-10-14 04:54:04,72.59,90%,The beginner writes just twenty pieces. The professional wri...,No win (3 of 3)
52.,2012-10-14 04:53:01,78.95,95%,It takes more than a calorie of fossil fuel energy to produc...,No win (2 of 3)
51.,2012-10-14 04:51:51,94.04,96%,Sometimes you concentrate more on racing the cars around you...,No win (4 of 5)
50.,2012-10-14 04:50:52,89.54,94%,I've been looking so long at these pictures of you that I al...,No win (3 of 3)
49.,2012-10-14 04:50:11,76.55,91%,"My name is Turkish. Funny name for an Englishman, I know. My...",No win (2 of 2)
48.,2012-10-14 04:49:04,74.73,92%,"Hey Mr. Tambourine Man, play a song for me, I'm not sleepy a...",No win (2 of 4)
47.,2012-10-14 04:48:18,84.38,91%,A glooming peace this morning with it brings. The sun for so...,Win (1 of 4)
46.,2012-10-14 04:47:27,80.75,95%,This business is filled to the brim with unrealistic people ...,Win (1 of 4)
45.,2012-10-14 04:46:15,79.36,94%,"Hey Mr. Tambourine Man, play a song for me, I'm not sleepy a...",No win (1 of 1)
44.,2012-10-14 04:44:52,98.27,98%,"Now you might ask yourself, if by yourself you mean me, ""Ste...",Win (1 of 3)
43.,2012-10-13 18:33:18,87.97,90%,"Comfortable, Mullet? It seems sadly ironic that it's that ti...",Win (1 of 4)
42.,2012-10-13 18:32:41,93.88,92%,"No matter how bad things are, you can always make things wor...",Win (1 of 4)
41.,2012-10-13 17:15:33,77.94,91%,"But older than me now, more constant, more real, and the fur...",No win (2 of 5)
40.,2012-10-13 01:39:04,70.07,88%,I sincerely believe that if women study male lessons on conc...,No win (2 of 2)
39.,2012-10-13 01:37:01,73.62,92%,Aztec rule was based upon a system of tribute and fear over ...,No win (3 of 5)
38.,2012-10-13 01:35:50,72.45,89%,If I'm curt with you it's because time is a factor. I think ...,No win (5 of 5)
37.,2012-10-13 01:35:06,85.92,93%,"Contrary to the feminist cant, there are many things we can ...",No win (3 of 5)
36.,2012-10-13 01:34:18,80.07,91%,"The brain can be a tool. It can recall phone numbers, solve ...",No win (3 of 3)
35.,2012-10-13 01:33:01,87.24,96%,"A long time ago, I was in Burma, my friends and I were worki...",Win (1 of 4)
34.,2012-10-13 01:31:42,92.74,94%,I am learning about twenty new Italian words a day. Where am...,No win (2 of 5)
33.,2012-10-13 01:30:56,71.43,93%,"Whenever you watch the mind, you withdraw consciousness from...",No win (3 of 5)
32.,2012-10-13 01:29:48,80.43,95%,The problem we now face is that this thin layer of atmospher...,No win (2 of 5)
31.,2012-10-13 01:28:42,85.58,94%,Everything we hold dear likewise resolves into its original ...,No win (1 of 1)
30.,2012-10-13 01:26:55,89.02,98%,"In the witch trials, it was nearly impossible to provide com...",Win (1 of 5)
29.,2012-10-13 01:24:36,82.29,96%,"Disillusion is the greatest gift I can give you. But, becaus...",No win (2 of 4)
28.,2012-10-13 00:18:51,75.75,89%,To an outsider's ear it sounds absurdly wild and ridiculous ...,No win (2 of 5)
27.,2012-10-13 00:17:16,85.67,96%,Even the best-designed chair won't make up for bad posture. ...,No win (2 of 4)
26.,2012-10-13 00:16:32,76.28,91%,I'd just like to point out that you were given every opportu...,No win (2 of 5)
25.,2012-10-12 21:40:07,84.00,94%,There's sometimes a buggy. How many drivers does a buggy hav...,Win (1 of 4)
24.,2012-10-12 20:00:53,67.44,85%,"You needn't take it any further, sir. You've proved to me th...",No win (4 of 5)
23.,2012-10-12 17:13:25,83.29,92%,Consider this: Is the pious being loved by the gods because ...,No win (3 of 5)
22.,2012-10-12 17:11:52,79.14,92%,There was a stage and a PA up in western Massachusetts and t...,No win (4 of 5)
21.,2012-10-12 17:09:56,79.59,93%,Corn is what feeds the steer that becomes the steak. Corn fe...,No win (3 of 4)
20.,2012-10-12 17:08:31,79.19,93%,"Alfred Hitchcock once said, ""Drama is life with the dull bit...",No win (3 of 4)
19.,2012-10-12 17:07:30,75.76,86%,Let me tell you why you're here. You're here because you kno...,No win (4 of 5)
18.,2012-10-12 17:06:24,97.09,98%,"What good's a reward if you ain't around to use it? Besides,...",Win (1 of 5)
17.,2012-10-12 17:05:49,97.71,96%,"If you don't get what you want, you suffer; if you get what ...",Win (1 of 4)
16.,2012-10-12 17:04:51,80.22,93%,"I can feel the heat closing in, feel them out there making t...",No win (3 of 3)
15.,2012-10-12 17:03:23,104.02,91%,Humans need to practice what they are learning a good deal b...,Win (1 of 3)
14.,2012-10-12 17:02:37,97.96,96%,"Look and think as far ahead as possible. Often, a driver's n...",No win (2 of 4)
13.,2012-10-12 17:01:31,73.50,93%,"Ezekiel twenty-five, seventeen: The path of the righteous ma...",Win (1 of 2)
12.,2012-10-12 17:00:28,80.92,93%,The wine list looks so imposing that you finally give up lab...,No win (2 of 3)
11.,2012-10-12 04:04:38,68.72,95%,The evidence in the standard history of Qwerty versus Dvorak...,No win (2 of 4)
10.,2012-10-12 03:18:41,83.99,92%,"When we conceive of the sweetest being ever, we are conceivi...",No win (2 of 4)
9.,2012-10-12 03:03:24,92.20,92%,The time has come for man to set himself a goal. The time ha...,No win (2 of 4)
8.,2012-10-12 02:58:56,80.07,95%,Chance and chance alone has a message for us. Everything tha...,No win (3 of 4)
7.,2012-10-12 02:57:54,99.00,96%,Step out the front door like a ghost into the fog where no o...,No win (2 of 2)
6.,2012-10-12 02:56:36,81.05,95%,"Hi, and welcome to the future. San Dimas, California, 2688. ...",No win (2 of 3)
5.,2012-10-12 02:47:46,90.05,94%,"The less you do with the controls, the less chance of error....",No win (2 of 4)
4.,2012-10-12 01:01:05,67.98,95%,A total of twenty-five friends were headed from San Francisc...,No win (3 of 4)
3.,2012-10-11 21:31:53,80.01,95%,The basis of the Aztecs' success in creating a great state a...,No win (2 of 4)
2.,2012-10-11 21:30:47,86.31,94%,All the blue light reflections that color my mind when I sle...,No win (2 of 3)
1.,2012-10-11 21:29:53,95.02,96%,The girls I like best are ones I never feel much like kiddin...,Win (1 of 4)
